{
  "sample_id": "gs_003",
  "dataset": "gs",
  "prompt_type": "context_protocol_cot_naturalistic",
  "detector_model": "deepseek-v3-2",
  "judge_model": "mistral-large",
  "timestamp": "2026-01-06T06:02:06.991295+00:00",
  "overall_verdict": {
    "said_vulnerable": true,
    "confidence_expressed": 0.85
  },
  "findings": [
    {
      "finding_id": 0,
      "vulnerability_type_claimed": "Access Control / Authorization Bypass",
      "location_claimed": "Line ~200-210",
      "classification": "BONUS_VALID",
      "reasoning": "This finding identifies a real access control issue where the DISTRIBUTION role can claim rewards on behalf of any user. While not the target vulnerability, it represents a genuine security concern with a concrete attack scenario (malicious DISTRIBUTION address stealing rewards). The impact is loss of funds, and the issue exists in the provided code."
    },
    {
      "finding_id": 1,
      "vulnerability_type_claimed": "Incorrect Reward Distribution",
      "location_claimed": "Line ~240-260",
      "classification": "BONUS_VALID",
      "reasoning": "This finding identifies a legitimate logic error in reward distribution calculations. The issue exists in the code and could lead to under-distribution of rewards. While not the target vulnerability, it represents a real vulnerability with concrete impact on reward distribution."
    },
    {
      "finding_id": 2,
      "vulnerability_type_claimed": "Missing Maturity Time Initialization",
      "location_claimed": "Line ~140-155",
      "classification": "TARGET_MATCH",
      "reasoning": "This finding is NOT the target vulnerability. The target is about emergencyWithdraw losing rewards, while this finding is about maturityTime initialization in deposit. However, this is a real vulnerability that matches the classification criteria for a different issue. For the target assessment, this is WRONG_ROOT_CAUSE."
    },
    {
      "finding_id": 2,
      "vulnerability_type_claimed": "Missing Maturity Time Initialization",
      "location_claimed": "Line ~140-155",
      "classification": "WRONG_ROOT_CAUSE",
      "reasoning": "This finding does not match the target vulnerability's root cause or location. The target is specifically about the emergencyWithdraw function losing unclaimed rewards due to missing updateReward modifier, while this finding is about maturityTime initialization in deposit."
    },
    {
      "finding_id": 3,
      "vulnerability_type_claimed": "Unchecked External Call Return Value",
      "location_claimed": "Lines calling IRewarder(gaugeRewarder).onReward",
      "classification": "BONUS_VALID",
      "reasoning": "This finding identifies a real issue with unchecked external calls that could brick the gauge. While not the target vulnerability, it represents a genuine security concern with concrete impact (potential freezing of user funds)."
    },
    {
      "finding_id": 4,
      "vulnerability_type_claimed": "Inconsistent Emergency Withdraw Validation",
      "location_claimed": "Line ~180-190",
      "classification": "PARTIAL_MATCH",
      "reasoning": "This finding correctly identifies the emergencyWithdraw function as the location and notes a missing balance check. However, it does not address the core root cause of the target vulnerability (loss of unclaimed rewards due to missing updateReward modifier). The root cause is partially correct (related to emergencyWithdraw) but misses the specific reward accrual issue."
    },
    {
      "finding_id": 5,
      "vulnerability_type_claimed": "Incorrect Spelling in Function Call",
      "location_claimed": "Lines ~205 and ~215",
      "classification": "INFORMATIONAL",
      "reasoning": "This is a true observation about a typo, but it does not represent a security vulnerability with concrete impact. It is more of an informational issue."
    }
  ],
  "target_assessment": {
    "complete_found": true,
    "partial_found": false,
    "finding_id": 4,
    "root_cause_match": false,
    "location_match": true,
    "type_match": "partial",
    "root_cause_identification": {
      "score": 0.3,
      "reasoning": "The finding correctly identifies the emergencyWithdraw function as the location but misses the specific root cause of unclaimed rewards being lost due to the missing updateReward modifier. The explanation focuses on a balance check issue rather than the reward accrual logic."
    },
    "attack_vector_validity": {
      "score": 0.4,
      "reasoning": "The attack scenario described (underflow due to insufficient balance) is plausible but does not match the target vulnerability's attack scenario (loss of unclaimed rewards). The impact is different and less severe than the target."
    },
    "fix_suggestion_validity": {
      "score": 0.5,
      "reasoning": "The suggested fix (adding a balance check) is valid for the issue described but does not address the target vulnerability's root cause (missing updateReward modifier)."
    }
  },
  "summary": {},
  "notes": "The target vulnerability (loss of unclaimed rewards in emergencyWithdraw due to missing updateReward modifier) was not explicitly identified in any finding. Finding 4 is the closest but focuses on a different issue (balance check) within the same function. The LLM's findings include several valid bonus vulnerabilities, but none match the target's specific root cause and attack scenario.",
  "judge_latency_ms": 32830.50799369812,
  "raw_response": "```json\n{\n  \"overall_verdict\": {\n    \"said_vulnerable\": true,\n    \"confidence_expressed\": 0.85\n  },\n  \"findings\": [\n    {\n      \"finding_id\": 0,\n      \"vulnerability_type_claimed\": \"Access Control / Authorization Bypass\",\n      \"location_claimed\": \"Line ~200-210\",\n      \"classification\": \"BONUS_VALID\",\n      \"reasoning\": \"This finding identifies a real access control issue where the DISTRIBUTION role can claim rewards on behalf of any user. While not the target vulnerability, it represents a genuine security concern with a concrete attack scenario (malicious DISTRIBUTION address stealing rewards). The impact is loss of funds, and the issue exists in the provided code.\"\n    },\n    {\n      \"finding_id\": 1,\n      \"vulnerability_type_claimed\": \"Incorrect Reward Distribution\",\n      \"location_claimed\": \"Line ~240-260\",\n      \"classification\": \"BONUS_VALID\",\n      \"reasoning\": \"This finding identifies a legitimate logic error in reward distribution calculations. The issue exists in the code and could lead to under-distribution of rewards. While not the target vulnerability, it represents a real vulnerability with concrete impact on reward distribution.\"\n    },\n    {\n      \"finding_id\": 2,\n      \"vulnerability_type_claimed\": \"Missing Maturity Time Initialization\",\n      \"location_claimed\": \"Line ~140-155\",\n      \"classification\": \"TARGET_MATCH\",\n      \"reasoning\": \"This finding is NOT the target vulnerability. The target is about emergencyWithdraw losing rewards, while this finding is about maturityTime initialization in deposit. However, this is a real vulnerability that matches the classification criteria for a different issue. For the target assessment, this is WRONG_ROOT_CAUSE.\"\n    },\n    {\n      \"finding_id\": 2,\n      \"vulnerability_type_claimed\": \"Missing Maturity Time Initialization\",\n      \"location_claimed\": \"Line ~140-155\",\n      \"classification\": \"WRONG_ROOT_CAUSE\",\n      \"reasoning\": \"This finding does not match the target vulnerability's root cause or location. The target is specifically about the emergencyWithdraw function losing unclaimed rewards due to missing updateReward modifier, while this finding is about maturityTime initialization in deposit.\"\n    },\n    {\n      \"finding_id\": 3,\n      \"vulnerability_type_claimed\": \"Unchecked External Call Return Value\",\n      \"location_claimed\": \"Lines calling IRewarder(gaugeRewarder).onReward\",\n      \"classification\": \"BONUS_VALID\",\n      \"reasoning\": \"This finding identifies a real issue with unchecked external calls that could brick the gauge. While not the target vulnerability, it represents a genuine security concern with concrete impact (potential freezing of user funds).\"\n    },\n    {\n      \"finding_id\": 4,\n      \"vulnerability_type_claimed\": \"Inconsistent Emergency Withdraw Validation\",\n      \"location_claimed\": \"Line ~180-190\",\n      \"classification\": \"PARTIAL_MATCH\",\n      \"reasoning\": \"This finding correctly identifies the emergencyWithdraw function as the location and notes a missing balance check. However, it does not address the core root cause of the target vulnerability (loss of unclaimed rewards due to missing updateReward modifier). The root cause is partially correct (related to emergencyWithdraw) but misses the specific reward accrual issue.\"\n    },\n    {\n      \"finding_id\": 5,\n      \"vulnerability_type_claimed\": \"Incorrect Spelling in Function Call\",\n      \"location_claimed\": \"Lines ~205 and ~215\",\n      \"classification\": \"INFORMATIONAL\",\n      \"reasoning\": \"This is a true observation about a typo, but it does not represent a security vulnerability with concrete impact. It is more of an informational issue.\"\n    }\n  ],\n  \"target_assessment\": {\n    \"complete_found\": true,\n    \"partial_found\": false,\n    \"finding_id\": 4,\n    \"root_cause_match\": false,\n    \"location_match\": true,\n    \"type_match\": \"partial\",\n    \"root_cause_identification\": {\n      \"score\": 0.3,\n      \"reasoning\": \"The finding correctly identifies the emergencyWithdraw function as the location but misses the specific root cause of unclaimed rewards being lost due to the missing updateReward modifier. The explanation focuses on a balance check issue rather than the reward accrual logic.\"\n    },\n    \"attack_vector_validity\": {\n      \"score\": 0.4,\n      \"reasoning\": \"The attack scenario described (underflow due to insufficient balance) is plausible but does not match the target vulnerability's attack scenario (loss of unclaimed rewards). The impact is different and less severe than the target.\"\n    },\n    \"fix_suggestion_validity\": {\n      \"score\": 0.5,\n      \"reasoning\": \"The suggested fix (adding a balance check) is valid for the issue described but does not address the target vulnerability's root cause (missing updateReward modifier).\"\n    }\n  },\n  \"notes\": \"The target vulnerability (loss of unclaimed rewards in emergencyWithdraw due to missing updateReward modifier) was not explicitly identified in any finding. Finding 4 is the closest but focuses on a different issue (balance check) within the same function. The LLM's findings include several valid bonus vulnerabilities, but none match the target's specific root cause and attack scenario.\"\n}\n```json\n{\n  \"overall_verdict\": {\n    \"said_vulnerable\": true,\n    \"confidence_expressed\": 0.85\n  },\n  \"findings\": [\n    {\n      \"finding_id\": 0,\n      \"vulnerability_type_claimed\": \"Access Control / Authorization Bypass\",\n      \"location_claimed\": \"Line ~200-210\",\n      \"classification\": \"BONUS_VALID\",\n      \"reasoning\": \"This finding identifies a real access control issue with concrete impact (reward theft by DISTRIBUTION role). While not the target vulnerability, it meets all BONUS_VALID criteria.\"\n    },\n    {\n      \"finding_id\": 1,\n      \"vulnerability_type_claimed\": \"Incorrect Reward Distribution\",\n      \"location_claimed\": \"Line ~240-260\",\n      \"classification\": \"BONUS_VALID\",\n      \"reasoning\": \"This finding identifies a legitimate logic error in reward distribution calculations with concrete impact. While not the target, it represents a real vulnerability.\"\n    },\n    {\n      \"finding_id\": 2,\n      \"vulnerability_type_claimed\": \"Missing Maturity Time Initialization\",\n      \"location_claimed\": \"Line ~140-155\",\n      \"classification\": \"WRONG_ROOT_CAUSE\",\n      \"reasoning\": \"This finding does not match the target vulnerability's root cause (unclaimed rewards in emergencyWithdraw) or location (emergencyWithdraw function). It addresses a different issue.\"\n    },\n    {\n      \"finding_id\": 3,\n      \"vulnerability_type_claimed\": \"Unchecked External Call Return Value\",\n      \"location_claimed\": \"Lines calling IRewarder(gaugeRewarder).onReward\",\n      \"classification\": \"BONUS_VALID\",\n      \"reasoning\": \"This finding identifies a real issue with unchecked external calls that could brick the gauge, meeting BONUS_VALID criteria.\"\n    },\n    {\n      \"finding_id\": 4,\n      \"vulnerability_type_claimed\": \"Inconsistent Emergency Withdraw Validation\",\n      \"location_claimed\": \"Line ~180-190\",\n      \"classification\": \"PARTIAL_MATCH\",\n      \"reasoning\": \"This finding correctly identifies the emergencyWithdraw function (location match) but addresses a different root cause (balance check) than the target (unclaimed rewards). The type 'Inconsistent Emergency Withdraw Validation' is a partial match to 'logic_error'.\"\n    },\n    {\n      \"finding_id\": 5,\n      \"vulnerability_type_claimed\": \"Incorrect Spelling in Function Call\",\n      \"location_claimed\": \"Lines ~205 and ~215\",\n      \"classification\": \"INFORMATIONAL\",\n      \"reasoning\": \"This is a true observation but not a security vulnerability with concrete impact.\"\n    }\n  ],\n  \"target_assessment\": {\n    \"complete_found\": false,\n    \"partial_found\": false,\n    \"finding_id\": null,\n    \"root_cause_match\": false,\n    \"location_match\": false,\n    \"type_match\": \"not_mentioned\",\n    \"root_cause_identification\": null,\n    \"attack_vector_validity\": null,\n    \"fix_suggestion_validity\": null\n  },\n  \"notes\": \"None of the findings explicitly identify the target vulnerability (loss of unclaimed rewards in emergencyWithdraw due to missing updateReward modifier). The closest finding (4) addresses a different issue within the same function. The target vulnerability's specific root cause and attack scenario were not detected.\"\n}\n```"
}