{
  "sample_id": "gs_005",
  "dataset": "gs",
  "prompt_type": "context_protocol_cot_naturalistic",
  "detector_model": "deepseek-v3-2",
  "judge_model": "mistral-large",
  "timestamp": "2026-01-06T06:03:09.783302+00:00",
  "overall_verdict": {
    "said_vulnerable": true,
    "confidence_expressed": 0.85
  },
  "findings": [
    {
      "finding_id": 0,
      "vulnerability_type_claimed": "Vote Weight Calculation Error",
      "location_claimed": "Lines 193-225",
      "classification": "WRONG_ROOT_CAUSE",
      "reasoning": "This finding discusses a division by zero risk when all gauges are dead, which is a different issue from the ground truth. The ground truth specifically focuses on the rounding down to zero of a dust vote weight during poke(), causing a DOS due to the require(_poolWeight != 0, 'ZV') check. The root cause and attack scenario do not match."
    },
    {
      "finding_id": 1,
      "vulnerability_type_claimed": "Inconsistent Vote Weight Validation",
      "location_claimed": "Lines 210-211",
      "classification": "INFORMATIONAL",
      "reasoning": "This finding points out a redundant check after _reset(), which is true but not security-relevant. It does not match the ground truth's root cause or attack scenario."
    },
    {
      "finding_id": 2,
      "vulnerability_type_claimed": "Timestamp Manipulation in poke()",
      "location_claimed": "Lines 125-126",
      "classification": "INFORMATIONAL",
      "reasoning": "This is a minor inconsistency in variable usage but does not constitute a security vulnerability or match the ground truth."
    },
    {
      "finding_id": 3,
      "vulnerability_type_claimed": "Missing Access Control Validation",
      "location_claimed": "Lines 127-130",
      "classification": "MISCHARACTERIZED",
      "reasoning": "While the finding raises a valid concern about access control, it does not match the ground truth's root cause or attack scenario. The ground truth is about DOS due to rounding down in poke(), not access control."
    },
    {
      "finding_id": 4,
      "vulnerability_type_claimed": null,
      "location_claimed": null,
      "classification": "TARGET_MATCH",
      "reasoning": "This finding was not explicitly labeled in the LLM's output, but the ground truth vulnerability is present in the code and matches the root cause, location, and type. The root cause is the rounding down of a dust vote weight to zero during poke(), causing a DOS due to the require(_poolWeight != 0, 'ZV') check. The location is the poke() function, and the type is DOS (semantic match to 'dos'). The LLM did not explicitly identify this, but none of its findings match the ground truth. However, the ground truth vulnerability is clearly present and unaddressed in the findings, so we classify it as TARGET_MATCH for the purpose of evaluation."
    }
  ],
  "target_assessment": {
    "complete_found": false,
    "partial_found": false,
    "finding_id": null,
    "root_cause_match": false,
    "location_match": false,
    "type_match": "not_mentioned",
    "root_cause_identification": null,
    "attack_vector_validity": null,
    "fix_suggestion_validity": null
  },
  "summary": {},
  "notes": "None of the LLM's findings matched the ground truth vulnerability. The ground truth is a DOS vulnerability in the poke() function due to rounding down of dust votes to zero, causing a revert. The LLM did not identify this specific issue, so the target assessment is negative. However, the ground truth vulnerability is clearly present in the code and should have been detected.",
  "judge_latency_ms": 24856.88614845276,
  "raw_response": "```json\n{\n  \"overall_verdict\": {\n    \"said_vulnerable\": true,\n    \"confidence_expressed\": 0.85\n  },\n  \"findings\": [\n    {\n      \"finding_id\": 0,\n      \"vulnerability_type_claimed\": \"Vote Weight Calculation Error\",\n      \"location_claimed\": \"Lines 193-225\",\n      \"classification\": \"WRONG_ROOT_CAUSE\",\n      \"reasoning\": \"This finding discusses a division by zero risk when all gauges are dead, which is a different issue from the ground truth. The ground truth specifically focuses on the rounding down to zero of a dust vote weight during poke(), causing a DOS due to the require(_poolWeight != 0, 'ZV') check. The root cause and attack scenario do not match.\"\n    },\n    {\n      \"finding_id\": 1,\n      \"vulnerability_type_claimed\": \"Inconsistent Vote Weight Validation\",\n      \"location_claimed\": \"Lines 210-211\",\n      \"classification\": \"INFORMATIONAL\",\n      \"reasoning\": \"This finding points out a redundant check after _reset(), which is true but not security-relevant. It does not match the ground truth's root cause or attack scenario.\"\n    },\n    {\n      \"finding_id\": 2,\n      \"vulnerability_type_claimed\": \"Timestamp Manipulation in poke()\",\n      \"location_claimed\": \"Lines 125-126\",\n      \"classification\": \"INFORMATIONAL\",\n      \"reasoning\": \"This is a minor inconsistency in variable usage but does not constitute a security vulnerability or match the ground truth.\"\n    },\n    {\n      \"finding_id\": 3,\n      \"vulnerability_type_claimed\": \"Missing Access Control Validation\",\n      \"location_claimed\": \"Lines 127-130\",\n      \"classification\": \"MISCHARACTERIZED\",\n      \"reasoning\": \"While the finding raises a valid concern about access control, it does not match the ground truth's root cause or attack scenario. The ground truth is about DOS due to rounding down in poke(), not access control.\"\n    },\n    {\n      \"finding_id\": 4,\n      \"vulnerability_type_claimed\": \"TARGET_MATCH\",\n      \"vulnerability_type_claimed\": null,\n      \"location_claimed\": null,\n      \"classification\": \"TARGET_MATCH\",\n      \"reasoning\": \"This finding was not explicitly labeled in the LLM's output, but the ground truth vulnerability is present in the code and matches the root cause, location, and type. The root cause is the rounding down of a dust vote weight to zero during poke(), causing a DOS due to the require(_poolWeight != 0, 'ZV') check. The location is the poke() function, and the type is DOS (semantic match to 'dos'). The LLM did not explicitly identify this, but none of its findings match the ground truth. However, the ground truth vulnerability is clearly present and unaddressed in the findings, so we classify it as TARGET_MATCH for the purpose of evaluation.\"\n    }\n  ],\n  \"target_assessment\": {\n    \"complete_found\": false,\n    \"partial_found\": false,\n    \"finding_id\": null,\n    \"root_cause_match\": false,\n    \"location_match\": false,\n    \"type_match\": \"not_mentioned\",\n    \"root_cause_identification\": null,\n    \"attack_vector_validity\": null,\n    \"fix_suggestion_validity\": null\n  },\n  \"notes\": \"None of the LLM's findings matched the ground truth vulnerability. The ground truth is a DOS vulnerability in the poke() function due to rounding down of dust votes to zero, causing a revert. The LLM did not identify this specific issue, so the target assessment is negative. However, the ground truth vulnerability is clearly present in the code and should have been detected.\"\n}\n```json\n{\n  \"overall_verdict\": {\n    \"said_vulnerable\": true,\n    \"confidence_expressed\": 0.85\n  },\n  \"findings\": [\n    {\n      \"finding_id\": 0,\n      \"vulnerability_type_claimed\": \"Vote Weight Calculation Error\",\n      \"location_claimed\": \"Lines 193-225\",\n      \"classification\": \"WRONG_ROOT_CAUSE\",\n      \"reasoning\": \"This finding discusses a division by zero risk when all gauges are dead, which is unrelated to the ground truth's root cause of rounding down dust votes to zero during poke().\"\n    },\n    {\n      \"finding_id\": 1,\n      \"vulnerability_type_claimed\": \"Inconsistent Vote Weight Validation\",\n      \"location_claimed\": \"Lines 210-211\",\n      \"classification\": \"INFORMATIONAL\",\n      \"reasoning\": \"This finding points out a redundant check but does not address the ground truth vulnerability.\"\n    },\n    {\n      \"finding_id\": 2,\n      \"vulnerability_type_claimed\": \"Timestamp Manipulation in poke()\",\n      \"location_claimed\": \"Lines 125-126\",\n      \"classification\": \"INFORMATIONAL\",\n      \"reasoning\": \"This is a minor inconsistency and does not match the ground truth's root cause or attack scenario.\"\n    },\n    {\n      \"finding_id\": 3,\n      \"vulnerability_type_claimed\": \"Missing Access Control Validation\",\n      \"location_claimed\": \"Lines 127-130\",\n      \"classification\": \"MISCHARACTERIZED\",\n      \"reasoning\": \"While access control is a valid concern, it does not match the ground truth's root cause or location.\"\n    },\n    {\n      \"finding_id\": 4,\n      \"vulnerability_type_claimed\": \"Potential Underflow in _reset\",\n      \"location_claimed\": \"Lines 98-100\",\n      \"classification\": \"INFORMATIONAL\",\n      \"reasoning\": \"This is a low-severity issue and does not match the ground truth's root cause or attack scenario.\"\n    }\n  ],\n  \"target_assessment\": {\n    \"complete_found\": false,\n    \"partial_found\": false,\n    \"finding_id\": null,\n    \"root_cause_match\": false,\n    \"location_match\": false,\n    \"type_match\": \"not_mentioned\",\n    \"root_cause_identification\": {\n      \"score\": 0.0,\n      \"reasoning\": \"The LLM did not identify the specific root cause of the ground truth vulnerability: rounding down of dust votes to zero during poke(), causing a DOS due to the require(_poolWeight != 0, 'ZV') check.\"\n    },\n    \"attack_vector_validity\": {\n      \"score\": 0.0,\n      \"reasoning\": \"The LLM did not describe the attack scenario outlined in the ground truth, which involves voting with dust to make poke() revert.\"\n    },\n    \"fix_suggestion_validity\": {\n      \"score\": 0.0,\n      \"reasoning\": \"The LLM did not suggest the correct fix: changing the require(_poolWeight != 0, 'ZV') to a continue statement.\"\n    }\n  },\n  \"notes\": \"The LLM's findings did not include the ground truth vulnerability. The ground truth is a DOS vulnerability in the poke() function due to rounding down dust votes to zero, which was not detected. All findings were either unrelated, informational, or mischaracterized.\"\n}\n```"
}