{
  "sample_id": "ss_tc_017",
  "variant": "shapeshifter_l3",
  "detector_model": "gpt-5.2",
  "prompt_type": "direct",
  "judge_model": "mistral-large",
  "timestamp": "2026-01-06T00:27:31.753017+00:00",
  "overall_verdict": {
    "said_vulnerable": true,
    "confidence_expressed": 0.9
  },
  "findings": [
    {
      "finding_id": 0,
      "vulnerability_type_claimed": "Oracle manipulation / spot-price based collateral valuation (LP reserves)",
      "location_claimed": "_0xac561e() borrow uses _0x8cd0a4()",
      "classification": "TARGET_MATCH",
      "reasoning": "\n        **Root Cause Match**: The finding correctly identifies that the LP token value is calculated directly from current Uniswap pool reserves without using TWAP or external oracles, making it vulnerable to flash loan manipulation. This matches the ground truth root cause exactly.\n        **Location Match**: The finding correctly identifies the vulnerable function `_0xac561e` and its dependency on `_0x8cd0a4()`, which aligns with the ground truth.\n        **Type Match**: The type 'Oracle manipulation / spot-price based collateral valuation (LP reserves)' is a semantic match to 'price_oracle_manipulation' in the ground truth.\n      "
    },
    {
      "finding_id": 1,
      "vulnerability_type_claimed": "Incorrect accounting due to unchecked ERC20 transfer results / fee-on-transfer tokens",
      "location_claimed": "_0x4f9b02() deposit, _0x2f7c62() repay",
      "classification": "BONUS_VALID",
      "reasoning": "\n        **Bonus Validity**: This finding identifies a real vulnerability not covered in the ground truth. The issue of unchecked ERC20 transfer results and fee-on-transfer tokens is a genuine concern, with a concrete attack scenario and impact (over-crediting collateral or debt forgiveness). The exploit does not require trusted roles and results in loss of funds.\n      "
    }
  ],
  "target_assessment": {
    "complete_found": true,
    "partial_found": false,
    "finding_id": 0,
    "root_cause_match": true,
    "location_match": true,
    "type_match": "semantic",
    "root_cause_identification": {
      "score": 1.0,
      "reasoning": "The root cause is identified with high precision, matching the ground truth exactly. The explanation demonstrates a clear understanding of the vulnerability's specific mechanics (spot-price based collateral valuation using manipulable reserves)."
    },
    "attack_vector_validity": {
      "score": 1.0,
      "reasoning": "The attack scenario is concrete and step-by-step, matching the ground truth's description of flash loan manipulation to inflate LP token value and overborrow. The scenario is technically accurate and feasible."
    },
    "fix_suggestion_validity": {
      "score": 0.9,
      "reasoning": "The suggested fix (using TWAP or external oracles, borrow caps, etc.) is valid and aligns with the ground truth. The only minor deduction is for not explicitly mentioning multi-block delays, but the core remediation is correct."
    }
  },
  "summary": {},
  "notes": "Finding 0 is a clear TARGET_MATCH, while Finding 1 is a valid bonus issue not covered in the ground truth. The evaluation strictly follows the criteria for root cause, location, and type matching.",
  "judge_latency_ms": 13453.492164611816,
  "raw_response": "```json\n{\n  \"overall_verdict\": {\n    \"said_vulnerable\": true,\n    \"confidence_expressed\": 0.9\n  },\n  \"findings\": [\n    {\n      \"finding_id\": 0,\n      \"vulnerability_type_claimed\": \"Oracle manipulation / spot-price based collateral valuation (LP reserves)\",\n      \"location_claimed\": \"_0xac561e() borrow uses _0x8cd0a4()\",\n      \"classification\": \"TARGET_MATCH\",\n      \"reasoning\": \"\n        **Root Cause Match**: The finding correctly identifies that the LP token value is calculated directly from current Uniswap pool reserves without using TWAP or external oracles, making it vulnerable to flash loan manipulation. This matches the ground truth root cause exactly.\n        **Location Match**: The finding correctly identifies the vulnerable function `_0xac561e` and its dependency on `_0x8cd0a4()`, which aligns with the ground truth.\n        **Type Match**: The type 'Oracle manipulation / spot-price based collateral valuation (LP reserves)' is a semantic match to 'price_oracle_manipulation' in the ground truth.\n      \"\n    },\n    {\n      \"finding_id\": 1,\n      \"vulnerability_type_claimed\": \"Incorrect accounting due to unchecked ERC20 transfer results / fee-on-transfer tokens\",\n      \"location_claimed\": \"_0x4f9b02() deposit, _0x2f7c62() repay\",\n      \"classification\": \"BONUS_VALID\",\n      \"reasoning\": \"\n        **Bonus Validity**: This finding identifies a real vulnerability not covered in the ground truth. The issue of unchecked ERC20 transfer results and fee-on-transfer tokens is a genuine concern, with a concrete attack scenario and impact (over-crediting collateral or debt forgiveness). The exploit does not require trusted roles and results in loss of funds.\n      \"\n    }\n  ],\n  \"target_assessment\": {\n    \"complete_found\": true,\n    \"partial_found\": false,\n    \"finding_id\": 0,\n    \"root_cause_match\": true,\n    \"location_match\": true,\n    \"type_match\": \"semantic\",\n    \"root_cause_identification\": {\n      \"score\": 1.0,\n      \"reasoning\": \"The root cause is identified with high precision, matching the ground truth exactly. The explanation demonstrates a clear understanding of the vulnerability's specific mechanics (spot-price based collateral valuation using manipulable reserves).\"\n    },\n    \"attack_vector_validity\": {\n      \"score\": 1.0,\n      \"reasoning\": \"The attack scenario is concrete and step-by-step, matching the ground truth's description of flash loan manipulation to inflate LP token value and overborrow. The scenario is technically accurate and feasible.\"\n    },\n    \"fix_suggestion_validity\": {\n      \"score\": 0.9,\n      \"reasoning\": \"The suggested fix (using TWAP or external oracles, borrow caps, etc.) is valid and aligns with the ground truth. The only minor deduction is for not explicitly mentioning multi-block delays, but the core remediation is correct.\"\n    }\n  },\n  \"notes\": \"Finding 0 is a clear TARGET_MATCH, while Finding 1 is a valid bonus issue not covered in the ground truth. The evaluation strictly follows the criteria for root cause, location, and type matching.\"\n}\n```"
}