{
  "sample_id": "ds_t1_013",
  "detector_model": "claude-opus-4-5",
  "prompt_type": "direct",
  "judge_model": "mistral-large",
  "timestamp": "2026-01-06T01:26:13.816113+00:00",
  "overall_verdict": {
    "said_vulnerable": true,
    "confidence_expressed": 0.95
  },
  "findings": [
    {
      "finding_id": 0,
      "vulnerability_type_claimed": "Missing Balance Update (Theft of Funds)",
      "location_claimed": "refund()",
      "classification": "TARGET_MATCH",
      "reasoning": "\n        **Root Cause Match**: The ground truth describes the `refund()` function as lacking access control, but the actual root cause is the missing balance update after transfer. The model correctly identifies this specific issue: the balance is never set to zero after transfer, allowing repeated calls to drain the contract. While the ground truth's root cause is not explicitly specified, the model's explanation aligns with the actual vulnerability (missing balance update) and its impact (theft of funds).\n\n\n        **Location Match**: The model correctly identifies the `refund()` function as the vulnerable location, matching the ground truth.\n\n\n        **Type Match**: The model labels the vulnerability as 'Missing Balance Update (Theft of Funds)', which is a semantic match to the ground truth's 'access_control'. The core issue is the lack of proper state updates (a form of access control over funds), and the model's label accurately describes the exploit mechanism (theft of funds due to missing balance update).\n\n\n        The model's explanation, attack scenario, and fix are technically accurate and align with the ground truth's implications."
    },
    {
      "finding_id": 1,
      "vulnerability_type_claimed": "Reentrancy",
      "location_claimed": "withdraw()",
      "classification": "BONUS_VALID",
      "reasoning": "\n        **Bonus Valid**: The model identifies a reentrancy vulnerability in the `withdraw()` function, which is a real issue in the code. While the `transfer()` function limits the gas forwarded (2300 gas), the pattern is still unsafe and violates the checks-effects-interactions best practice. The model provides a concrete attack scenario (malicious contract re-entering `withdraw()`) and a valid fix (reordering balance update before transfer). This is a genuine vulnerability not covered by the ground truth, and the exploit is feasible (though limited by gas constraints)."
    }
  ],
  "target_assessment": {
    "complete_found": true,
    "partial_found": false,
    "finding_id": 0,
    "root_cause_match": true,
    "location_match": true,
    "type_match": "semantic",
    "root_cause_identification": {
      "score": 1.0,
      "reasoning": "The model precisely identifies the root cause: the missing balance update in `refund()` allows repeated withdrawals. This matches the actual issue (theft of funds due to improper state management) and is more specific than the ground truth's implied root cause (access control)."
    },
    "attack_vector_validity": {
      "score": 1.0,
      "reasoning": "The model provides a concrete, step-by-step attack scenario that is technically accurate and demonstrates how the contract can be drained. The scenario aligns with the root cause and is executable."
    },
    "fix_suggestion_validity": {
      "score": 1.0,
      "reasoning": "The suggested fix (setting balance to zero before transfer) is correct and remediates the issue. It is semantically equivalent to the ground truth's implied fix (proper access control via state updates)."
    }
  },
  "summary": {},
  "notes": "\n    The ground truth's description of the vulnerability as 'access_control' is somewhat misleading, as the actual issue is a missing balance update. The model's finding is more precise and technically accurate. The ground truth's fix suggestion (access control modifiers) is less relevant than the model's fix (state update), though both address the same underlying problem. The model's classification of the vulnerability as 'Missing Balance Update' is a better fit than 'access_control'.",
  "judge_latency_ms": 16502.504110336304,
  "raw_response": "```json\n{\n  \"overall_verdict\": {\n    \"said_vulnerable\": true,\n    \"confidence_expressed\": 0.95\n  },\n  \"findings\": [\n    {\n      \"finding_id\": 0,\n      \"vulnerability_type_claimed\": \"Missing Balance Update (Theft of Funds)\",\n      \"location_claimed\": \"refund()\",\n      \"classification\": \"TARGET_MATCH\",\n      \"reasoning\": \"\n        **Root Cause Match**: The ground truth describes the `refund()` function as lacking access control, but the actual root cause is the missing balance update after transfer. The model correctly identifies this specific issue: the balance is never set to zero after transfer, allowing repeated calls to drain the contract. While the ground truth's root cause is not explicitly specified, the model's explanation aligns with the actual vulnerability (missing balance update) and its impact (theft of funds).\\n\\n\n        **Location Match**: The model correctly identifies the `refund()` function as the vulnerable location, matching the ground truth.\\n\\n\n        **Type Match**: The model labels the vulnerability as 'Missing Balance Update (Theft of Funds)', which is a semantic match to the ground truth's 'access_control'. The core issue is the lack of proper state updates (a form of access control over funds), and the model's label accurately describes the exploit mechanism (theft of funds due to missing balance update).\\n\\n\n        The model's explanation, attack scenario, and fix are technically accurate and align with the ground truth's implications.\"\n    },\n    {\n      \"finding_id\": 1,\n      \"vulnerability_type_claimed\": \"Reentrancy\",\n      \"location_claimed\": \"withdraw()\",\n      \"classification\": \"BONUS_VALID\",\n      \"reasoning\": \"\n        **Bonus Valid**: The model identifies a reentrancy vulnerability in the `withdraw()` function, which is a real issue in the code. While the `transfer()` function limits the gas forwarded (2300 gas), the pattern is still unsafe and violates the checks-effects-interactions best practice. The model provides a concrete attack scenario (malicious contract re-entering `withdraw()`) and a valid fix (reordering balance update before transfer). This is a genuine vulnerability not covered by the ground truth, and the exploit is feasible (though limited by gas constraints).\"\n    }\n  ],\n  \"target_assessment\": {\n    \"complete_found\": true,\n    \"partial_found\": false,\n    \"finding_id\": 0,\n    \"root_cause_match\": true,\n    \"location_match\": true,\n    \"type_match\": \"semantic\",\n    \"root_cause_identification\": {\n      \"score\": 1.0,\n      \"reasoning\": \"The model precisely identifies the root cause: the missing balance update in `refund()` allows repeated withdrawals. This matches the actual issue (theft of funds due to improper state management) and is more specific than the ground truth's implied root cause (access control).\"\n    },\n    \"attack_vector_validity\": {\n      \"score\": 1.0,\n      \"reasoning\": \"The model provides a concrete, step-by-step attack scenario that is technically accurate and demonstrates how the contract can be drained. The scenario aligns with the root cause and is executable.\"\n    },\n    \"fix_suggestion_validity\": {\n      \"score\": 1.0,\n      \"reasoning\": \"The suggested fix (setting balance to zero before transfer) is correct and remediates the issue. It is semantically equivalent to the ground truth's implied fix (proper access control via state updates).\"\n    }\n  },\n  \"notes\": \"\n    The ground truth's description of the vulnerability as 'access_control' is somewhat misleading, as the actual issue is a missing balance update. The model's finding is more precise and technically accurate. The ground truth's fix suggestion (access control modifiers) is less relevant than the model's fix (state update), though both address the same underlying problem. The model's classification of the vulnerability as 'Missing Balance Update' is a better fit than 'access_control'.\"\n}\n```"
}