{
  "sample_id": "df_tc_021",
  "variant": "differential",
  "detector_model": "grok-4-fast",
  "prompt_type": "direct",
  "judge_model": "gemini-3-flash",
  "timestamp": "2026-01-05T08:06:58.979994+00:00",
  "overall_verdict": {
    "said_vulnerable": true,
    "confidence_expressed": 0.95
  },
  "findings": [
    {
      "finding_id": 0,
      "description": "The contract allows users to deposit collateral via transferFrom but provides no withdraw or repayment function to retrieve it.",
      "vulnerability_type_claimed": "Locked Funds",
      "severity_claimed": "critical",
      "location_claimed": "deposit function in LendingProtocol",
      "matches_target": false,
      "is_valid_concern": true,
      "classification": "BONUS_VALID",
      "reasoning": "The contract is indeed a 'honey pot' by design or omission; it lacks any mechanism to withdraw collateral or repay debt, meaning any funds sent to it are permanently trapped. This is a high-impact architectural flaw."
    },
    {
      "finding_id": 1,
      "description": "The TWAP calculation formula incorrectly multiplies prices by timestamps, effectively weighting an initial zero price over the entire block.timestamp, causing perpetual severe underestimation of the price.",
      "vulnerability_type_claimed": "Incorrect Logic",
      "severity_claimed": "high",
      "location_claimed": "updatePrice function in PriceOracle",
      "matches_target": true,
      "is_valid_concern": true,
      "classification": "TARGET_MATCH",
      "reasoning": "This finding correctly identifies the broken price oracle logic. While the ground truth specifically mentions 'price_oracle_manipulation', the root cause in this code is the flawed math in the TWAP calculation (using block.timestamp as a divisor and weight), which makes the price feed unreliable and susceptible to manipulation or complete failure."
    },
    {
      "finding_id": 2,
      "description": "transferFrom and transfer calls do not check return values (bool). If the token returns false without reverting, the transaction proceeds, updating state without actual token movement.",
      "vulnerability_type_claimed": "Unchecked Return Value",
      "severity_claimed": "medium",
      "location_claimed": "deposit and borrow functions in LendingProtocol",
      "matches_target": false,
      "is_valid_concern": true,
      "classification": "BONUS_VALID",
      "reasoning": "The contract uses standard IERC20 interface calls without checking the boolean return value. For tokens like USDT (on some chains) or other non-reverting tokens, this allows users to inflate their collateral balance without actually transferring tokens."
    }
  ],
  "target_assessment": {
    "found": true,
    "finding_id": 1,
    "type_match": "semantic",
    "type_match_reasoning": "The ground truth identifies 'price_oracle_manipulation'. The finding identifies 'Incorrect Logic' in the oracle calculation which leads to the price being manipulated/broken.",
    "root_cause_identification": {
      "score": 1.0,
      "reasoning": "The auditor correctly identifies that the formula `(twapPrice * lastUpdateTime + spotPrice * timeElapsed) / block.timestamp` is mathematically unsound for a TWAP and results in a price near zero."
    },
    "attack_vector_validity": {
      "score": 0.9,
      "reasoning": "The attack scenario correctly describes how the protocol becomes unusable (DoS) due to the undervalued collateral, though 'manipulation' usually implies profit for the attacker, here it results in protocol failure."
    },
    "fix_suggestion_validity": {
      "score": 1.0,
      "reasoning": "The suggestion to use a proper EMA or a standard TWAP accumulator is the correct industry fix."
    }
  },
  "summary": {
    "total_findings": 3,
    "target_matches": 1,
    "partial_matches": 0,
    "bonus_valid": 2,
    "hallucinated": 0,
    "mischaracterized": 0,
    "design_choice": 0,
    "out_of_scope": 0,
    "security_theater": 0,
    "informational": 0
  },
  "notes": "The auditor found the target vulnerability and also identified two significant additional issues: the lack of withdrawal logic (Locked Funds) and the failure to check ERC20 return values.",
  "judge_latency_ms": 6526.748180389404,
  "raw_response": "```json\n{\n  \"overall_verdict\": {\n    \"said_vulnerable\": true,\n    \"confidence_expressed\": 0.95\n  },\n  \"findings\": [\n    {\n      \"finding_id\": 0,\n      \"description\": \"The contract allows users to deposit collateral via transferFrom but provides no withdraw or repayment function to retrieve it.\",\n      \"vulnerability_type_claimed\": \"Locked Funds\",\n      \"severity_claimed\": \"critical\",\n      \"location_claimed\": \"deposit function in LendingProtocol\",\n      \"matches_target\": false,\n      \"is_valid_concern\": true,\n      \"classification\": \"BONUS_VALID\",\n      \"reasoning\": \"The contract is indeed a 'honey pot' by design or omission; it lacks any mechanism to withdraw collateral or repay debt, meaning any funds sent to it are permanently trapped. This is a high-impact architectural flaw.\"\n    },\n    {\n      \"finding_id\": 1,\n      \"description\": \"The TWAP calculation formula incorrectly multiplies prices by timestamps, effectively weighting an initial zero price over the entire block.timestamp, causing perpetual severe underestimation of the price.\",\n      \"vulnerability_type_claimed\": \"Incorrect Logic\",\n      \"severity_claimed\": \"high\",\n      \"location_claimed\": \"updatePrice function in PriceOracle\",\n      \"matches_target\": true,\n      \"is_valid_concern\": true,\n      \"classification\": \"TARGET_MATCH\",\n      \"reasoning\": \"This finding correctly identifies the broken price oracle logic. While the ground truth specifically mentions 'price_oracle_manipulation', the root cause in this code is the flawed math in the TWAP calculation (using block.timestamp as a divisor and weight), which makes the price feed unreliable and susceptible to manipulation or complete failure.\",\n    },\n    {\n      \"finding_id\": 2,\n      \"description\": \"transferFrom and transfer calls do not check return values (bool). If the token returns false without reverting, the transaction proceeds, updating state without actual token movement.\",\n      \"vulnerability_type_claimed\": \"Unchecked Return Value\",\n      \"severity_claimed\": \"medium\",\n      \"location_claimed\": \"deposit and borrow functions in LendingProtocol\",\n      \"matches_target\": false,\n      \"is_valid_concern\": true,\n      \"classification\": \"BONUS_VALID\",\n      \"reasoning\": \"The contract uses standard IERC20 interface calls without checking the boolean return value. For tokens like USDT (on some chains) or other non-reverting tokens, this allows users to inflate their collateral balance without actually transferring tokens.\"\n    }\n  ],\n  \"target_assessment\": {\n    \"found\": true,\n    \"finding_id\": 1,\n    \"type_match\": \"semantic\",\n    \"type_match_reasoning\": \"The ground truth identifies 'price_oracle_manipulation'. The finding identifies 'Incorrect Logic' in the oracle calculation which leads to the price being manipulated/broken.\",\n    \"root_cause_identification\": {\n      \"score\": 1.0,\n      \"reasoning\": \"The auditor correctly identifies that the formula `(twapPrice * lastUpdateTime + spotPrice * timeElapsed) / block.timestamp` is mathematically unsound for a TWAP and results in a price near zero.\"\n    },\n    \"attack_vector_validity\": {\n      \"score\": 0.9,\n      \"reasoning\": \"The attack scenario correctly describes how the protocol becomes unusable (DoS) due to the undervalued collateral, though 'manipulation' usually implies profit for the attacker, here it results in protocol failure.\"\n    },\n    \"fix_suggestion_validity\": {\n      \"score\": 1.0,\n      \"reasoning\": \"The suggestion to use a proper EMA or a standard TWAP accumulator is the correct industry fix.\"\n    }\n  },\n  \"summary\": {\n    \"total_findings\": 3,\n    \"target_matches\": 1,\n    \"partial_matches\": 0,\n    \"bonus_valid\": 2,\n    \"hallucinated\": 0,\n    \"mischaracterized\": 0,\n    \"design_choice\": 0,\n    \"out_of_scope\": 0,\n    \"security_theater\": 0,\n    \"informational\": 0\n  },\n  \"notes\": \"The auditor found the target vulnerability and also identified two significant additional issues: the lack of withdrawal logic (Locked Funds) and the failure to check ERC20 return values.\"\n}\n```"
}