{
  "sample_id": "fp_tc_043",
  "variant": "falseProphet",
  "detector_model": "llama-4-maverick",
  "prompt_type": "direct",
  "judge_model": "mistral-large",
  "timestamp": "2026-01-06T00:32:45.501297+00:00",
  "overall_verdict": {
    "said_vulnerable": true,
    "confidence_expressed": 0.9
  },
  "findings": [
    {
      "finding_id": 0,
      "vulnerability_type_claimed": "Unprotected Functionality",
      "location_claimed": "setMinter",
      "classification": "PARTIAL_MATCH",
      "reasoning": "\n        - **Root Cause Match**: The finding correctly identifies that the `setMinter` function allows the minter role to be transferred without additional checks, which is part of the ground truth's root cause (single minter key with unlimited power). However, it does not fully capture the broader issue of unlimited minting without supply caps or multi-sig requirements.\n        - **Location Match**: The location (`setMinter`) matches one of the ground truth functions.\n        - **Type Match**: The type 'Unprotected Functionality' is a partial match to 'access_control' (semantically related but not exact or fully precise).\n        - **Conclusion**: The finding partially matches the ground truth but does not fully address the core issue of unlimited minting without safeguards.\n      "
    },
    {
      "finding_id": 1,
      "vulnerability_type_claimed": "Event Emission Issue",
      "location_claimed": "Transfer event",
      "classification": "INFORMATIONAL",
      "reasoning": "\n        - This is a compilation issue due to invalid Solidity syntax (`index` keyword), not a security vulnerability. While true, it is not security-relevant and does not match the ground truth.\n      "
    },
    {
      "finding_id": 2,
      "vulnerability_type_claimed": "Event Emission Issue",
      "location_claimed": "Approval event",
      "classification": "INFORMATIONAL",
      "reasoning": "\n        - Same as Finding 1: a compilation issue, not a security vulnerability.\n      "
    },
    {
      "finding_id": 3,
      "vulnerability_type_claimed": "Event Emission Issue",
      "location_claimed": "Minted event",
      "classification": "INFORMATIONAL",
      "reasoning": "\n        - Same as Finding 1: a compilation issue, not a security vulnerability.\n      "
    }
  ],
  "target_assessment": {
    "complete_found": false,
    "partial_found": true,
    "finding_id": 0,
    "root_cause_match": false,
    "location_match": true,
    "type_match": "partial",
    "root_cause_identification": {
      "score": 0.6,
      "reasoning": "\n        The finding correctly identifies the lack of additional checks in `setMinter`, which is part of the ground truth's root cause (single minter key with unlimited power). However, it does not address the broader issue of unlimited minting without supply caps or multi-sig requirements, which are critical components of the root cause.\n      "
    },
    "attack_vector_validity": {
      "score": 0.7,
      "reasoning": "\n        The attack scenario is plausible (compromise minter key \u2192 transfer minter role \u2192 mint tokens), but it does not fully capture the scale of the ground truth attack (unlimited minting without safeguards). The scenario is valid but incomplete.\n      "
    },
    "fix_suggestion_validity": {
      "score": 0.5,
      "reasoning": "\n        The suggested fix (two-step minter transfer) is helpful but does not address the core issue of unlimited minting without supply caps or multi-sig requirements. It is a partial solution.\n      "
    }
  },
  "summary": {},
  "notes": "\n    - The LLM's findings do not fully capture the TARGET vulnerability (unlimited minting without supply caps or multi-sig). The closest match (Finding 0) only addresses the `setMinter` function's lack of additional checks, which is a subset of the ground truth.\n    - The ground truth requires identification of the broader issue: single private key with unlimited minting power, no supply cap, and no multi-sig. None of the findings address this holistically.\n    - The LLM's confidence (0.9) is high, but the findings are not aligned with the ground truth's critical severity.\n  ",
  "judge_latency_ms": 15802.927017211914,
  "raw_response": "```json\n{\n  \"overall_verdict\": {\n    \"said_vulnerable\": true,\n    \"confidence_expressed\": 0.9\n  },\n  \"findings\": [\n    {\n      \"finding_id\": 0,\n      \"vulnerability_type_claimed\": \"Unprotected Functionality\",\n      \"location_claimed\": \"setMinter\",\n      \"classification\": \"PARTIAL_MATCH\",\n      \"reasoning\": \"\n        - **Root Cause Match**: The finding correctly identifies that the `setMinter` function allows the minter role to be transferred without additional checks, which is part of the ground truth's root cause (single minter key with unlimited power). However, it does not fully capture the broader issue of unlimited minting without supply caps or multi-sig requirements.\n        - **Location Match**: The location (`setMinter`) matches one of the ground truth functions.\n        - **Type Match**: The type 'Unprotected Functionality' is a partial match to 'access_control' (semantically related but not exact or fully precise).\n        - **Conclusion**: The finding partially matches the ground truth but does not fully address the core issue of unlimited minting without safeguards.\n      \"\n    },\n    {\n      \"finding_id\": 1,\n      \"vulnerability_type_claimed\": \"Event Emission Issue\",\n      \"location_claimed\": \"Transfer event\",\n      \"classification\": \"INFORMATIONAL\",\n      \"reasoning\": \"\n        - This is a compilation issue due to invalid Solidity syntax (`index` keyword), not a security vulnerability. While true, it is not security-relevant and does not match the ground truth.\n      \"\n    },\n    {\n      \"finding_id\": 2,\n      \"vulnerability_type_claimed\": \"Event Emission Issue\",\n      \"location_claimed\": \"Approval event\",\n      \"classification\": \"INFORMATIONAL\",\n      \"reasoning\": \"\n        - Same as Finding 1: a compilation issue, not a security vulnerability.\n      \"\n    },\n    {\n      \"finding_id\": 3,\n      \"vulnerability_type_claimed\": \"Event Emission Issue\",\n      \"location_claimed\": \"Minted event\",\n      \"classification\": \"INFORMATIONAL\",\n      \"reasoning\": \"\n        - Same as Finding 1: a compilation issue, not a security vulnerability.\n      \"\n    }\n  ],\n  \"target_assessment\": {\n    \"complete_found\": false,\n    \"partial_found\": true,\n    \"finding_id\": 0,\n    \"root_cause_match\": false,\n    \"location_match\": true,\n    \"type_match\": \"partial\",\n    \"root_cause_identification\": {\n      \"score\": 0.6,\n      \"reasoning\": \"\n        The finding correctly identifies the lack of additional checks in `setMinter`, which is part of the ground truth's root cause (single minter key with unlimited power). However, it does not address the broader issue of unlimited minting without supply caps or multi-sig requirements, which are critical components of the root cause.\n      \"\n    },\n    \"attack_vector_validity\": {\n      \"score\": 0.7,\n      \"reasoning\": \"\n        The attack scenario is plausible (compromise minter key \u2192 transfer minter role \u2192 mint tokens), but it does not fully capture the scale of the ground truth attack (unlimited minting without safeguards). The scenario is valid but incomplete.\n      \"\n    },\n    \"fix_suggestion_validity\": {\n      \"score\": 0.5,\n      \"reasoning\": \"\n        The suggested fix (two-step minter transfer) is helpful but does not address the core issue of unlimited minting without supply caps or multi-sig requirements. It is a partial solution.\n      \"\n    }\n  },\n  \"notes\": \"\n    - The LLM's findings do not fully capture the TARGET vulnerability (unlimited minting without supply caps or multi-sig). The closest match (Finding 0) only addresses the `setMinter` function's lack of additional checks, which is a subset of the ground truth.\n    - The ground truth requires identification of the broader issue: single private key with unlimited minting power, no supply cap, and no multi-sig. None of the findings address this holistically.\n    - The LLM's confidence (0.9) is high, but the findings are not aligned with the ground truth's critical severity.\n  \"\n}\n```"
}