{
  "sample_id": "ds_t3_017",
  "detector_model": "claude-opus-4-5",
  "prompt_type": "direct",
  "judge_model": "mistral-large",
  "timestamp": "2026-01-06T01:28:23.987746+00:00",
  "overall_verdict": {
    "said_vulnerable": true,
    "confidence_expressed": 0.95
  },
  "findings": [
    {
      "finding_id": 0,
      "vulnerability_type_claimed": "Logic Error / Impossible Condition",
      "location_claimed": "multiplicate function",
      "classification": "TARGET_MATCH",
      "reasoning": "\n        **Root Cause Match**: The finding correctly identifies the core issue - the condition `msg.value >= this.balance` is impossible to satisfy profitably because `this.balance` already includes `msg.value` when the condition is checked. This matches the ground truth's description of the honeypot mechanism, even though the ground truth did not explicitly state the root cause.\n\n        **Location Match**: While the ground truth specifies the `withdraw` function as the vulnerable location, the actual vulnerability (the honeypot logic) resides in the `multiplicate` function. However, the ground truth's description clearly points to the `multiplicate` function's logic as the root of the honeypot scam, and the `withdraw` function is merely the mechanism for the attacker to steal funds. The finding correctly identifies the `multiplicate` function as the source of the vulnerability, which is semantically aligned with the ground truth's intent.\n\n        **Type Match**: The finding labels the issue as 'Logic Error / Impossible Condition', which is a semantic match for 'honeypot' - both describe the same underlying scam mechanism. The ground truth's type is 'honeypot', and the finding's type accurately captures the essence of the vulnerability.\n\n        **Quality**:\n        - **RCIR**: HIGH (0.9). The root cause is precisely identified and explained.\n        - **AVA**: HIGH (1.0). The attack scenario is concrete, step-by-step, and accurately describes the honeypot scam.\n        - **FSV**: HIGH (0.9). The suggested fix (caching the balance) is technically correct and addresses the root cause, though the finding also notes the contract is fundamentally a scam.\n      "
    },
    {
      "finding_id": 1,
      "vulnerability_type_claimed": "Outdated Solidity Version",
      "location_claimed": "pragma solidity ^0.4.18",
      "classification": "INFORMATIONAL",
      "reasoning": "\n        This finding is a true observation about the use of an outdated Solidity version, but it is not security-relevant to the TARGET vulnerability (honeypot). While it is a valid informational note, it does not constitute a security vulnerability in this context.\n      "
    }
  ],
  "target_assessment": {
    "complete_found": true,
    "partial_found": false,
    "finding_id": 0,
    "root_cause_match": true,
    "location_match": true,
    "type_match": "semantic",
    "root_cause_identification": {
      "score": 0.9,
      "reasoning": "The finding precisely identifies the root cause of the honeypot vulnerability - the impossible condition in the `multiplicate` function due to `this.balance` including `msg.value`."
    },
    "attack_vector_validity": {
      "score": 1.0,
      "reasoning": "The attack scenario is concrete, step-by-step, and accurately describes how the honeypot scam works, including the attacker's ability to withdraw trapped funds."
    },
    "fix_suggestion_validity": {
      "score": 0.9,
      "reasoning": "The suggested fix (caching the balance before receiving funds) is technically correct and would remediate the issue, though the finding also correctly notes the contract is fundamentally a scam."
    }
  },
  "summary": {},
  "notes": "\n    The ground truth's location specification (`withdraw` function) is somewhat misleading, as the actual vulnerability resides in the `multiplicate` function. However, the finding correctly identifies the `multiplicate` function as the source of the honeypot logic, which aligns with the ground truth's description of the vulnerability. The `withdraw` function is merely the mechanism for the attacker to steal funds, not the root cause of the honeypot.\n  ",
  "judge_latency_ms": 17876.332998275757,
  "raw_response": "```json\n{\n  \"overall_verdict\": {\n    \"said_vulnerable\": true,\n    \"confidence_expressed\": 0.95\n  },\n  \"findings\": [\n    {\n      \"finding_id\": 0,\n      \"vulnerability_type_claimed\": \"Logic Error / Impossible Condition\",\n      \"location_claimed\": \"multiplicate function\",\n      \"classification\": \"TARGET_MATCH\",\n      \"reasoning\": \"\n        **Root Cause Match**: The finding correctly identifies the core issue - the condition `msg.value >= this.balance` is impossible to satisfy profitably because `this.balance` already includes `msg.value` when the condition is checked. This matches the ground truth's description of the honeypot mechanism, even though the ground truth did not explicitly state the root cause.\n\n        **Location Match**: While the ground truth specifies the `withdraw` function as the vulnerable location, the actual vulnerability (the honeypot logic) resides in the `multiplicate` function. However, the ground truth's description clearly points to the `multiplicate` function's logic as the root of the honeypot scam, and the `withdraw` function is merely the mechanism for the attacker to steal funds. The finding correctly identifies the `multiplicate` function as the source of the vulnerability, which is semantically aligned with the ground truth's intent.\n\n        **Type Match**: The finding labels the issue as 'Logic Error / Impossible Condition', which is a semantic match for 'honeypot' - both describe the same underlying scam mechanism. The ground truth's type is 'honeypot', and the finding's type accurately captures the essence of the vulnerability.\n\n        **Quality**:\n        - **RCIR**: HIGH (0.9). The root cause is precisely identified and explained.\n        - **AVA**: HIGH (1.0). The attack scenario is concrete, step-by-step, and accurately describes the honeypot scam.\n        - **FSV**: HIGH (0.9). The suggested fix (caching the balance) is technically correct and addresses the root cause, though the finding also notes the contract is fundamentally a scam.\n      \"\n    },\n    {\n      \"finding_id\": 1,\n      \"vulnerability_type_claimed\": \"Outdated Solidity Version\",\n      \"location_claimed\": \"pragma solidity ^0.4.18\",\n      \"classification\": \"INFORMATIONAL\",\n      \"reasoning\": \"\n        This finding is a true observation about the use of an outdated Solidity version, but it is not security-relevant to the TARGET vulnerability (honeypot). While it is a valid informational note, it does not constitute a security vulnerability in this context.\n      \"\n    }\n  ],\n  \"target_assessment\": {\n    \"complete_found\": true,\n    \"partial_found\": false,\n    \"finding_id\": 0,\n    \"root_cause_match\": true,\n    \"location_match\": true,\n    \"type_match\": \"semantic\",\n    \"root_cause_identification\": {\n      \"score\": 0.9,\n      \"reasoning\": \"The finding precisely identifies the root cause of the honeypot vulnerability - the impossible condition in the `multiplicate` function due to `this.balance` including `msg.value`.\"\n    },\n    \"attack_vector_validity\": {\n      \"score\": 1.0,\n      \"reasoning\": \"The attack scenario is concrete, step-by-step, and accurately describes how the honeypot scam works, including the attacker's ability to withdraw trapped funds.\"\n    },\n    \"fix_suggestion_validity\": {\n      \"score\": 0.9,\n      \"reasoning\": \"The suggested fix (caching the balance before receiving funds) is technically correct and would remediate the issue, though the finding also correctly notes the contract is fundamentally a scam.\"\n    }\n  },\n  \"notes\": \"\n    The ground truth's location specification (`withdraw` function) is somewhat misleading, as the actual vulnerability resides in the `multiplicate` function. However, the finding correctly identifies the `multiplicate` function as the source of the honeypot logic, which aligns with the ground truth's description of the vulnerability. The `withdraw` function is merely the mechanism for the attacker to steal funds, not the root cause of the honeypot.\n  \"\n}\n```"
}