{
  "sample_id": "ds_t3_006",
  "detector_model": "claude-opus-4-5",
  "prompt_type": "direct",
  "judge_model": "mistral-large",
  "timestamp": "2026-01-06T01:26:11.418341+00:00",
  "overall_verdict": {
    "said_vulnerable": true,
    "confidence_expressed": 0.95
  },
  "findings": [
    {
      "finding_id": 0,
      "vulnerability_type_claimed": "Integer Truncation / Data Loss",
      "location_claimed": "SimpleBank.deposit() - line 11",
      "classification": "TARGET_MATCH",
      "reasoning": "\n        **Root Cause Match**: The finding correctly identifies the root cause as unsafe downcasting from uint256 to uint8 without checks, which leads to truncation and data loss. This matches the ground truth's implied root cause (unchecked downcasting).\n\n        **Location Match**: The finding correctly identifies the `deposit` function in `SimpleBank` as the vulnerable location, matching the ground truth.\n\n        **Type Match**: The type 'Integer Truncation / Data Loss' is a semantic match to 'unchecked_call' (the ground truth type), as both describe the same underlying issue of unchecked downcasting leading to data loss.\n\n        The explanation, attack scenario, and fix are all technically accurate and align with the ground truth's requirements."
    },
    {
      "finding_id": 1,
      "vulnerability_type_claimed": "Integer Truncation / DoS via Revert",
      "location_claimed": "SimpleBankB.deposit() - line 27",
      "classification": "BONUS_VALID",
      "reasoning": "\n        This finding identifies a real vulnerability in `SimpleBankB` that is not covered by the ground truth. The issue (DoS via revert due to SafeCast.toUint8() reverting on overflow) is a concrete, exploitable problem that does not require trusted roles and has a genuine impact (contract unusability for amounts > 255).\n\n        The attack scenario is well-described, and the fix is valid. This qualifies as a BONUS_VALID finding."
    }
  ],
  "target_assessment": {
    "complete_found": true,
    "partial_found": false,
    "finding_id": 0,
    "root_cause_match": true,
    "location_match": true,
    "type_match": "semantic",
    "root_cause_identification": {
      "score": 1.0,
      "reasoning": "The finding precisely identifies the root cause (unsafe downcasting without checks) and explains its impact (data loss due to truncation). This is a high-quality, technically accurate explanation."
    },
    "attack_vector_validity": {
      "score": 1.0,
      "reasoning": "The attack scenario is concrete, step-by-step, and demonstrates a real-world exploit (e.g., depositing 1000 results in 232). The impact is clear and actionable."
    },
    "fix_suggestion_validity": {
      "score": 1.0,
      "reasoning": "The suggested fix (removing the unsafe downcast or adding a require check) is correct and aligns with the ground truth's recommended fix (use consistent uint256 or SafeCast)."
    }
  },
  "summary": {},
  "notes": "\n    - The ground truth's type 'unchecked_call' is somewhat misleading, as the actual issue is integer truncation/data loss. However, the finding's type ('Integer Truncation / Data Loss') is a semantic match because it describes the same vulnerability.\n\n    - Finding 1 is a valid bonus finding but does not match the ground truth, so it does not affect the target assessment.",
  "judge_latency_ms": 14066.49112701416,
  "raw_response": "```json\n{\n  \"overall_verdict\": {\n    \"said_vulnerable\": true,\n    \"confidence_expressed\": 0.95\n  },\n  \"findings\": [\n    {\n      \"finding_id\": 0,\n      \"vulnerability_type_claimed\": \"Integer Truncation / Data Loss\",\n      \"location_claimed\": \"SimpleBank.deposit() - line 11\",\n      \"classification\": \"TARGET_MATCH\",\n      \"reasoning\": \"\n        **Root Cause Match**: The finding correctly identifies the root cause as unsafe downcasting from uint256 to uint8 without checks, which leads to truncation and data loss. This matches the ground truth's implied root cause (unchecked downcasting).\\n\n        **Location Match**: The finding correctly identifies the `deposit` function in `SimpleBank` as the vulnerable location, matching the ground truth.\\n\n        **Type Match**: The type 'Integer Truncation / Data Loss' is a semantic match to 'unchecked_call' (the ground truth type), as both describe the same underlying issue of unchecked downcasting leading to data loss.\\n\n        The explanation, attack scenario, and fix are all technically accurate and align with the ground truth's requirements.\"\n    },\n    {\n      \"finding_id\": 1,\n      \"vulnerability_type_claimed\": \"Integer Truncation / DoS via Revert\",\n      \"location_claimed\": \"SimpleBankB.deposit() - line 27\",\n      \"classification\": \"BONUS_VALID\",\n      \"reasoning\": \"\n        This finding identifies a real vulnerability in `SimpleBankB` that is not covered by the ground truth. The issue (DoS via revert due to SafeCast.toUint8() reverting on overflow) is a concrete, exploitable problem that does not require trusted roles and has a genuine impact (contract unusability for amounts > 255).\\n\n        The attack scenario is well-described, and the fix is valid. This qualifies as a BONUS_VALID finding.\"\n    }\n  ],\n  \"target_assessment\": {\n    \"complete_found\": true,\n    \"partial_found\": false,\n    \"finding_id\": 0,\n    \"root_cause_match\": true,\n    \"location_match\": true,\n    \"type_match\": \"semantic\",\n    \"root_cause_identification\": {\n      \"score\": 1.0,\n      \"reasoning\": \"The finding precisely identifies the root cause (unsafe downcasting without checks) and explains its impact (data loss due to truncation). This is a high-quality, technically accurate explanation.\"\n    },\n    \"attack_vector_validity\": {\n      \"score\": 1.0,\n      \"reasoning\": \"The attack scenario is concrete, step-by-step, and demonstrates a real-world exploit (e.g., depositing 1000 results in 232). The impact is clear and actionable.\"\n    },\n    \"fix_suggestion_validity\": {\n      \"score\": 1.0,\n      \"reasoning\": \"The suggested fix (removing the unsafe downcast or adding a require check) is correct and aligns with the ground truth's recommended fix (use consistent uint256 or SafeCast).\"\n    }\n  },\n  \"notes\": \"\n    - The ground truth's type 'unchecked_call' is somewhat misleading, as the actual issue is integer truncation/data loss. However, the finding's type ('Integer Truncation / Data Loss') is a semantic match because it describes the same vulnerability.\\n\n    - Finding 1 is a valid bonus finding but does not match the ground truth, so it does not affect the target assessment.\"\n}\n```"
}