{
  "sample_id": "ds_t3_005",
  "detector_model": "claude-opus-4-5",
  "prompt_type": "direct",
  "judge_model": "mistral-large",
  "timestamp": "2026-01-06T01:26:00.146667+00:00",
  "overall_verdict": {
    "said_vulnerable": true,
    "confidence_expressed": 0.95
  },
  "findings": [
    {
      "finding_id": 0,
      "vulnerability_type_claimed": "Uninitialized Implementation Contract",
      "location_claimed": "Engine contract - initialize() function",
      "classification": "TARGET_MATCH",
      "reasoning": "\n        The finding correctly identifies the root cause of the vulnerability: the Engine implementation contract remains uninitialized because the `initialize()` call from the proxy constructor affects the proxy's storage, not the Engine's own storage. This allows an attacker to directly call `initialize()` on the Engine contract and become the `upgrader`.\n\n        The location matches the ground truth, as the vulnerability is centered around the `initialize()` function (and by extension, `upgradeToAndCall()` since the attacker uses it after becoming the `upgrader`).\n\n        The vulnerability type 'Uninitialized Implementation Contract' is a semantic match to the ground truth's 'logic_error', as it describes a logical flaw in the initialization process that leads to unintended behavior.\n\n        The attack scenario is concrete and step-by-step, demonstrating a real exploit that bricks the proxy by destroying the implementation contract. The suggested fix is valid and aligns with best practices for securing upgradeable contracts.\n      "
    }
  ],
  "target_assessment": {
    "complete_found": true,
    "partial_found": false,
    "finding_id": 0,
    "root_cause_match": true,
    "location_match": true,
    "type_match": "semantic",
    "root_cause_identification": {
      "score": 1.0,
      "reasoning": "The finding precisely identifies the root cause: the Engine implementation contract's storage remains uninitialized, allowing direct calls to `initialize()`. This is a technically accurate and complete explanation of the issue."
    },
    "attack_vector_validity": {
      "score": 1.0,
      "reasoning": "The attack scenario is concrete, step-by-step, and demonstrably works. It outlines how an attacker can become the `upgrader` and then destroy the implementation contract, bricking the proxy."
    },
    "fix_suggestion_validity": {
      "score": 1.0,
      "reasoning": "The suggested fix (`_disableInitializers()` in the constructor) is correct and effectively remediates the issue by preventing direct calls to `initialize()` on the implementation contract."
    }
  },
  "summary": {},
  "notes": "\n    The ground truth's description of the vulnerability as a 'logic_error' is quite generic, but the finding's explanation and attack scenario provide the necessary specificity to confirm a match. The finding goes beyond the ground truth by detailing the exact mechanism and exploit, which is a positive.\n  ",
  "judge_latency_ms": 11264.317989349365,
  "raw_response": "```json\n{\n  \"overall_verdict\": {\n    \"said_vulnerable\": true,\n    \"confidence_expressed\": 0.95\n  },\n  \"findings\": [\n    {\n      \"finding_id\": 0,\n      \"vulnerability_type_claimed\": \"Uninitialized Implementation Contract\",\n      \"location_claimed\": \"Engine contract - initialize() function\",\n      \"classification\": \"TARGET_MATCH\",\n      \"reasoning\": \"\n        The finding correctly identifies the root cause of the vulnerability: the Engine implementation contract remains uninitialized because the `initialize()` call from the proxy constructor affects the proxy's storage, not the Engine's own storage. This allows an attacker to directly call `initialize()` on the Engine contract and become the `upgrader`.\n\n        The location matches the ground truth, as the vulnerability is centered around the `initialize()` function (and by extension, `upgradeToAndCall()` since the attacker uses it after becoming the `upgrader`).\n\n        The vulnerability type 'Uninitialized Implementation Contract' is a semantic match to the ground truth's 'logic_error', as it describes a logical flaw in the initialization process that leads to unintended behavior.\n\n        The attack scenario is concrete and step-by-step, demonstrating a real exploit that bricks the proxy by destroying the implementation contract. The suggested fix is valid and aligns with best practices for securing upgradeable contracts.\n      \"\n    }\n  ],\n  \"target_assessment\": {\n    \"complete_found\": true,\n    \"partial_found\": false,\n    \"finding_id\": 0,\n    \"root_cause_match\": true,\n    \"location_match\": true,\n    \"type_match\": \"semantic\",\n    \"root_cause_identification\": {\n      \"score\": 1.0,\n      \"reasoning\": \"The finding precisely identifies the root cause: the Engine implementation contract's storage remains uninitialized, allowing direct calls to `initialize()`. This is a technically accurate and complete explanation of the issue.\"\n    },\n    \"attack_vector_validity\": {\n      \"score\": 1.0,\n      \"reasoning\": \"The attack scenario is concrete, step-by-step, and demonstrably works. It outlines how an attacker can become the `upgrader` and then destroy the implementation contract, bricking the proxy.\"\n    },\n    \"fix_suggestion_validity\": {\n      \"score\": 1.0,\n      \"reasoning\": \"The suggested fix (`_disableInitializers()` in the constructor) is correct and effectively remediates the issue by preventing direct calls to `initialize()` on the implementation contract.\"\n    }\n  },\n  \"notes\": \"\n    The ground truth's description of the vulnerability as a 'logic_error' is quite generic, but the finding's explanation and attack scenario provide the necessary specificity to confirm a match. The finding goes beyond the ground truth by detailing the exact mechanism and exploit, which is a positive.\n  \"\n}\n```"
}