{
  "sample_id": "ms_tc_024",
  "variant": "minimalsanitized",
  "model": "gemini-3-pro-extended",
  "prompt_type": "direct",
  "timestamp": "2026-01-05T01:04:26.461440+00:00",
  "ground_truth": {
    "is_vulnerable": true,
    "vulnerability_type": "input_validation",
    "vulnerable_function": "swapExactTokensForTokens",
    "vulnerable_lines": [
      27,
      37
    ],
    "severity": null
  },
  "prediction": {
    "verdict": "vulnerable",
    "confidence": 0.95,
    "vulnerabilities": [
      {
        "type": "Missing Transfer Logic",
        "severity": "critical",
        "vulnerable_lines": [
          12,
          32
        ],
        "location": "swapExactTokensForTokens",
        "explanation": "The `swapExactTokensForTokens` function calculates swap amounts but never actually transfers any tokens. It iterates through the path, calculates output amounts based on reserves, and returns the calculated amounts array. However, it completely lacks calls to `IERC20(token).transferFrom` (to pull user funds) or calls to the pair contracts to execute the swap (e.g., `IPair(pair).swap(...)`). Users calling this function will pay gas but no tokens will be moved or swapped.",
        "attack_scenario": "1. A user calls `swapExactTokensForTokens` expecting to swap Token A for Token B.\n2. The function executes successfully, calculating the theoretical output amounts.\n3. The transaction completes, consuming gas.\n4. No tokens are transferred from the user, and no tokens are received by the user. The function is effectively a 'view' function disguised as a state-changing transaction, leading to loss of gas fees and failure of intended logic.",
        "suggested_fix": "Implement the actual swap logic. This involves:\n1. Transferring `amountIn` from `msg.sender` to the first pair.\n2. Calling the `swap` function on each pair in the path to move tokens to the next pair (or the recipient)."
      },
      {
        "type": "Incorrect Price Calculation (Missing Constant Product Formula)",
        "severity": "high",
        "vulnerable_lines": [
          41
        ],
        "location": "_getAmountOut",
        "explanation": "The `_getAmountOut` function uses a simple linear proportion `(amountIn * reserveOut) / reserveIn` to calculate the output amount. This is incorrect for Automated Market Makers (AMMs) like Uniswap, which use the Constant Product Formula `x * y = k`. The correct formula (ignoring fees) is `(amountIn * reserveOut) / (reserveIn + amountIn)`. The current implementation assumes infinite liquidity or a linear curve, which would drain the pool's reserves incorrectly if actual swaps were implemented.",
        "attack_scenario": "If the transfer logic were implemented:\n1. An attacker identifies a pool with reserves (1000 A, 1000 B).\n2. They attempt to swap 1000 A.\n3. The current formula calculates output as `(1000 * 1000) / 1000 = 1000 B`.\n4. A correct AMM would yield significantly less (approx 500 B) to maintain the constant product.\n5. The attacker would drain the pool of 100% of its B reserves for only 50% of the pool's total value.",
        "suggested_fix": "Use the standard Uniswap V2 library formula: `amountInWithFee = amountIn * 997; numerator = amountInWithFee * reserveOut; denominator = (reserveIn * 1000) + amountInWithFee; return numerator / denominator;`."
      },
      {
        "type": "Missing Deadline Check",
        "severity": "low",
        "vulnerable_lines": [
          17
        ],
        "location": "swapExactTokensForTokens",
        "explanation": "The function accepts a `deadline` parameter but never checks it against `block.timestamp`. This allows miners to hold the transaction and execute it at a later time when market conditions might be unfavorable to the user.",
        "attack_scenario": "1. User submits a swap with a deadline.\n2. Miner sees the transaction but decides not to include it immediately.\n3. Market moves significantly.\n4. Miner includes the transaction long after the intended deadline, executing the swap at a bad rate.",
        "suggested_fix": "Add `require(deadline >= block.timestamp, 'EXPIRED');` at the beginning of the function."
      },
      {
        "type": "Missing Slippage Check",
        "severity": "medium",
        "vulnerable_lines": [
          14
        ],
        "location": "swapExactTokensForTokens",
        "explanation": "The function accepts `amountOutMin` but never verifies that the final calculated output amount is greater than or equal to this minimum. This exposes users to unlimited slippage (or sandwich attacks if the swap logic existed).",
        "attack_scenario": "1. User submits a swap expecting at least 100 tokens out.\n2. The pool reserves change (front-running).\n3. The function calculates the output to be 50 tokens.\n4. The function returns successfully without reverting, giving the user far less than they accepted.",
        "suggested_fix": "Add `require(amounts[amounts.length - 1] >= amountOutMin, 'INSUFFICIENT_OUTPUT_AMOUNT');` before returning."
      }
    ],
    "overall_explanation": "The contract is non-functional and highly insecure. It appears to be a skeleton or a mock implementation rather than a working router. The most critical issue is that it performs no token transfers or swaps whatsoever\u2014it merely performs math and returns. Furthermore, the math it performs is incorrect for standard AMMs (linear vs constant product), and it ignores standard safety checks like deadlines and slippage protection."
  },
  "parsing": {
    "success": true,
    "errors": [],
    "raw_response": "Here is the security analysis of the `BurgerSwapRouter` contract.\n\n```json\n{\n  \"verdict\": \"vulnerable\",\n  \"confidence\": 0.95,\n  \"vulnerabilities\": [\n    {\n      \"type\": \"Missing Transfer Logic\",\n      \"severity\": \"critical\",\n      \"vulnerable_lines\": [12, 32],\n      \"location\": \"swapExactTokensForTokens\",\n      \"explanation\": \"The `swapExactTokensForTokens` function calculates swap amounts but never actually transfers any tokens. It iterates through the path, calculates output amounts based on reserves, and returns the calculated amounts array. However, it completely lacks calls to `IERC20(token).transferFrom` (to pull user funds) or calls to the pair contracts to execute the swap (e.g., `IPair(pair).swap(...)`). Users calling this function will pay gas but no tokens will be moved or swapped.\",\n      \"attack_scenario\": \"1. A user calls `swapExactTokensForTokens` expecting to swap Token A for Token B.\\n2. The function executes successfully, calculating the theoretical output amounts.\\n3. The transaction completes, consuming gas.\\n4. No tokens are transferred from the user, and no tokens are received by the user. The function is effectively a 'view' function disguised as a state-changing transaction, leading to loss of gas fees and failure of intended logic.\",\n      \"suggested_fix\": \"Implement the actual swap logic. This involves:\\n1. Transferring `amountIn` from `msg.sender` to the first pair.\\n2. Calling the `swap` function on each pair in the path to move tokens to the next pair (or the recipient).\"\n    },\n    {\n      \"type\": \"Incorrect Price Calculation (Missing Constant Product Formula)\",\n      \"severity\": \"high\",\n      \"vulnerable_lines\": [41],\n      \"location\": \"_getAmountOut\",\n      \"explanation\": \"The `_getAmountOut` function uses a simple linear proportion `(amountIn * reserveOut) / reserveIn` to calculate the output amount. This is incorrect for Automated Market Makers (AMMs) like Uniswap, which use the Constant Product Formula `x * y = k`. The correct formula (ignoring fees) is `(amountIn * reserveOut) / (reserveIn + amountIn)`. The current implementation assumes infinite liquidity or a linear curve, which would drain the pool's reserves incorrectly if actual swaps were implemented.\",\n      \"attack_scenario\": \"If the transfer logic were implemented:\\n1. An attacker identifies a pool with reserves (1000 A, 1000 B).\\n2. They attempt to swap 1000 A.\\n3. The current formula calculates output as `(1000 * 1000) / 1000 = 1000 B`.\\n4. A correct AMM would yield significantly less (approx 500 B) to maintain the constant product.\\n5. The attacker would drain the pool of 100% of its B reserves for only 50% of the pool's total value.\",\n      \"suggested_fix\": \"Use the standard Uniswap V2 library formula: `amountInWithFee = amountIn * 997; numerator = amountInWithFee * reserveOut; denominator = (reserveIn * 1000) + amountInWithFee; return numerator / denominator;`.\"\n    },\n    {\n      \"type\": \"Missing Deadline Check\",\n      \"severity\": \"low\",\n      \"vulnerable_lines\": [17],\n      \"location\": \"swapExactTokensForTokens\",\n      \"explanation\": \"The function accepts a `deadline` parameter but never checks it against `block.timestamp`. This allows miners to hold the transaction and execute it at a later time when market conditions might be unfavorable to the user.\",\n      \"attack_scenario\": \"1. User submits a swap with a deadline.\\n2. Miner sees the transaction but decides not to include it immediately.\\n3. Market moves significantly.\\n4. Miner includes the transaction long after the intended deadline, executing the swap at a bad rate.\",\n      \"suggested_fix\": \"Add `require(deadline >= block.timestamp, 'EXPIRED');` at the beginning of the function.\"\n    },\n    {\n      \"type\": \"Missing Slippage Check\",\n      \"severity\": \"medium\",\n      \"vulnerable_lines\": [14],\n      \"location\": \"swapExactTokensForTokens\",\n      \"explanation\": \"The function accepts `amountOutMin` but never verifies that the final calculated output amount is greater than or equal to this minimum. This exposes users to unlimited slippage (or sandwich attacks if the swap logic existed).\",\n      \"attack_scenario\": \"1. User submits a swap expecting at least 100 tokens out.\\n2. The pool reserves change (front-running).\\n3. The function calculates the output to be 50 tokens.\\n4. The function returns successfully without reverting, giving the user far less than they accepted.\",\n      \"suggested_fix\": \"Add `require(amounts[amounts.length - 1] >= amountOutMin, 'INSUFFICIENT_OUTPUT_AMOUNT');` before returning.\"\n    }\n  ],\n  \"overall_explanation\": \"The contract is non-functional and highly insecure. It appears to be a skeleton or a mock implementation rather than a working router. The most critical issue is that it performs no token transfers or swaps whatsoever\u2014it merely performs math and returns. Furthermore, the math it performs is incorrect for standard AMMs (linear vs constant product), and it ignores standard safety checks like deadlines and slippage protection.\"\n}\n```"
  },
  "api_metrics": {
    "input_tokens": 1555,
    "output_tokens": 1369,
    "latency_ms": 14207.972764968872
  }
}