{
  "sample_id": "ds_t4_001",
  "detector_model": "gpt-5.2",
  "prompt_type": "direct",
  "judge_model": "mistral-large",
  "timestamp": "2026-01-06T02:31:00.002270+00:00",
  "overall_verdict": {
    "said_vulnerable": true,
    "confidence_expressed": 0.93
  },
  "findings": [
    {
      "finding_id": 0,
      "vulnerability_type_claimed": "Reentrancy via ERC777 tokensReceived hook (state update after external call)",
      "location_claimed": "SimpleBank.claim()",
      "classification": "TARGET_MATCH",
      "reasoning": "\n        **Root Cause Match**: The finding correctly identifies the reentrancy vulnerability due to the ERC777 tokensReceived hook being triggered during token.transfer, which allows reentrancy before the state (_mints[account]) is updated. This matches the ground truth's implied root cause (lack of reentrancy protection in the claim function).\n        **Location Match**: The finding correctly identifies the vulnerable function as `claim`, which matches the ground truth.\n        **Type Match**: The type 'Reentrancy via ERC777 tokensReceived hook' is a semantic match to the ground truth's 'reentrancy'. The additional context about the hook is a valid elaboration, not a deviation.\n        The attack scenario and fix are concrete and align with the ground truth's suggested remediation (checks-effects-interactions and reentrancy guard).\n      "
    },
    {
      "finding_id": 1,
      "vulnerability_type_claimed": "Unrestricted token minting",
      "location_claimed": "MyERC777.mint()",
      "classification": "BONUS_VALID",
      "reasoning": "\n        This finding identifies a real vulnerability not covered in the ground truth. The `mint` function in `MyERC777` is publicly callable with no access control, allowing arbitrary minting. The attack scenario is concrete (minting unlimited tokens to manipulate dependent systems), and the fix (access control) is valid. This meets all criteria for BONUS_VALID.\n      "
    }
  ],
  "target_assessment": {
    "complete_found": true,
    "partial_found": false,
    "finding_id": 0,
    "root_cause_match": true,
    "location_match": true,
    "type_match": "semantic",
    "root_cause_identification": {
      "score": 1.0,
      "reasoning": "\n        The finding precisely identifies the root cause: the ERC777 tokensReceived hook allows reentrancy during token.transfer, and the state update (_mints[account]) occurs after the external call. This is a technically accurate and complete explanation of the issue.\n      "
    },
    "attack_vector_validity": {
      "score": 1.0,
      "reasoning": "\n        The attack scenario is concrete and step-by-step, demonstrating how a malicious recipient contract can reenter `claim` to drain the SimpleBank's token balance. This is a valid and realistic exploit.\n      "
    },
    "fix_suggestion_validity": {
      "score": 1.0,
      "reasoning": "\n        The suggested fix (moving state updates before external calls and/or using a reentrancy guard) is technically correct and aligns with the ground truth's recommendation. The additional suggestion to consider ERC20 is also valid, though not required for the fix.\n      "
    }
  },
  "summary": {},
  "notes": "\n    Finding 0 is a strong TARGET_MATCH, with high-quality root cause identification, attack vector, and fix suggestions. Finding 1 is a valid bonus finding, demonstrating the model's ability to identify additional vulnerabilities beyond the ground truth.\n  ",
  "judge_latency_ms": 14522.8590965271,
  "raw_response": "```json\n{\n  \"overall_verdict\": {\n    \"said_vulnerable\": true,\n    \"confidence_expressed\": 0.93\n  },\n  \"findings\": [\n    {\n      \"finding_id\": 0,\n      \"vulnerability_type_claimed\": \"Reentrancy via ERC777 tokensReceived hook (state update after external call)\",\n      \"location_claimed\": \"SimpleBank.claim()\",\n      \"classification\": \"TARGET_MATCH\",\n      \"reasoning\": \"\n        **Root Cause Match**: The finding correctly identifies the reentrancy vulnerability due to the ERC777 tokensReceived hook being triggered during token.transfer, which allows reentrancy before the state (_mints[account]) is updated. This matches the ground truth's implied root cause (lack of reentrancy protection in the claim function).\n        **Location Match**: The finding correctly identifies the vulnerable function as `claim`, which matches the ground truth.\n        **Type Match**: The type 'Reentrancy via ERC777 tokensReceived hook' is a semantic match to the ground truth's 'reentrancy'. The additional context about the hook is a valid elaboration, not a deviation.\n        The attack scenario and fix are concrete and align with the ground truth's suggested remediation (checks-effects-interactions and reentrancy guard).\n      \"\n    },\n    {\n      \"finding_id\": 1,\n      \"vulnerability_type_claimed\": \"Unrestricted token minting\",\n      \"location_claimed\": \"MyERC777.mint()\",\n      \"classification\": \"BONUS_VALID\",\n      \"reasoning\": \"\n        This finding identifies a real vulnerability not covered in the ground truth. The `mint` function in `MyERC777` is publicly callable with no access control, allowing arbitrary minting. The attack scenario is concrete (minting unlimited tokens to manipulate dependent systems), and the fix (access control) is valid. This meets all criteria for BONUS_VALID.\n      \"\n    }\n  ],\n  \"target_assessment\": {\n    \"complete_found\": true,\n    \"partial_found\": false,\n    \"finding_id\": 0,\n    \"root_cause_match\": true,\n    \"location_match\": true,\n    \"type_match\": \"semantic\",\n    \"root_cause_identification\": {\n      \"score\": 1.0,\n      \"reasoning\": \"\n        The finding precisely identifies the root cause: the ERC777 tokensReceived hook allows reentrancy during token.transfer, and the state update (_mints[account]) occurs after the external call. This is a technically accurate and complete explanation of the issue.\n      \"\n    },\n    \"attack_vector_validity\": {\n      \"score\": 1.0,\n      \"reasoning\": \"\n        The attack scenario is concrete and step-by-step, demonstrating how a malicious recipient contract can reenter `claim` to drain the SimpleBank's token balance. This is a valid and realistic exploit.\n      \"\n    },\n    \"fix_suggestion_validity\": {\n      \"score\": 1.0,\n      \"reasoning\": \"\n        The suggested fix (moving state updates before external calls and/or using a reentrancy guard) is technically correct and aligns with the ground truth's recommendation. The additional suggestion to consider ERC20 is also valid, though not required for the fix.\n      \"\n    }\n  },\n  \"notes\": \"\n    Finding 0 is a strong TARGET_MATCH, with high-quality root cause identification, attack vector, and fix suggestions. Finding 1 is a valid bonus finding, demonstrating the model's ability to identify additional vulnerabilities beyond the ground truth.\n  \"\n}\n```"
}