{
  "sample_id": "gs_031",
  "dataset": "gs",
  "prompt_type": "context_protocol_cot_naturalistic",
  "model": "gemini-3-pro-hyper-extended",
  "timestamp": "2026-01-05T15:52:52.646544+00:00",
  "ground_truth": {
    "is_vulnerable": true,
    "vulnerability_type": "dos",
    "vulnerable_functions": [
      "validateUserOp"
    ],
    "severity": "medium",
    "description": "In ERC-4337, validateUserOp uses external self-call to isValidSignature, changing msg.sender to wallet instead of entrypoint. BaseAuth.signatureValidation enforces caller binding, causing revert for static signatures bound to entrypoint.",
    "root_cause": "In ERC-4337, validateUserOp uses external self-call to isValidSignature, changing msg.sender to wallet instead of entrypoint. BaseAuth.signatureValidation enforces caller binding, causing revert for static signatures bound to entrypoint.",
    "attack_scenario": "Deploy wallet with static signature bound to entrypoint. Attempt validateUserOp \u2192 reverts with InvalidStaticSignatureWrongCaller. PoC: Add test to test/modules/ERC4337v07.t.sol: test_validateUserOp_staticSig_callerMismatch_reverts. Uses server and forge test.",
    "fix_description": "Avoid external self-call; propagate intended caller into validation.",
    "language": "solidity"
  },
  "prediction": {
    "verdict": "vulnerable",
    "confidence": 0.95,
    "vulnerabilities": [
      {
        "type": "Compliance / DoS",
        "severity": "high",
        "vulnerable_function": "validateUserOp",
        "location": "ERC4337v07.sol:49",
        "explanation": "The contract calls `this.isValidSignature(...)` which delegates to `BaseAuth`. `BaseAuth` reverts (e.g., `InvalidStaticSignatureExpired`, `InvalidSignatureWeight`) when a signature is invalid. According to ERC-4337, `validateUserOp` MUST NOT revert for signature failures; it must return `SIG_VALIDATION_FAILED` (1). Reverting causes Bundlers to drop the UserOperation and potentially ban the entity.",
        "attack_scenario": "A user submits a UserOperation with an expired or invalid signature. The Bundler simulates validation. The contract reverts. The Bundler marks this wallet/paymaster as 'throttled' or 'banned' because it behaved unexpectedly during validation, leading to Denial of Service for the user.",
        "suggested_fix": "Wrap the call to signature validation in a try/catch block. If it reverts, return `SIG_VALIDATION_FAILED`. Alternatively, refactor the auth logic to return boolean success/failure instead of reverting."
      },
      {
        "type": "Logic Error",
        "severity": "high",
        "vulnerable_function": "validateUserOp",
        "location": "ERC4337v07.sol:49",
        "explanation": "The function uses `this.isValidSignature(...)` to validate the signature. Using `this.` triggers an external call, which sets `msg.sender` to the wallet address (`address(this)`). However, `BaseAuth.signatureValidation` checks `if (addr != address(0) && addr != msg.sender)` for static signatures. Since `msg.sender` is now the wallet itself, this check will likely fail or behave incorrectly compared to standard ERC-1271 calls.",
        "attack_scenario": "A user sets up a static signature authorized for a specific caller. They submit a UserOp. `validateUserOp` calls `this.isValidSignature`. Inside `BaseAuth`, `msg.sender` is the wallet address. The check `addr != msg.sender` fails (assuming the signer isn't the wallet itself), causing valid signatures to be rejected.",
        "suggested_fix": "Do not use `this.` to call `isValidSignature`. Call the internal logic directly (e.g., `_isValidSignature` or `signatureValidation`). Ensure the logic handles the fact that `msg.sender` is the EntryPoint during validation, or pass the intended signer explicitly."
      },
      {
        "type": "Gas / Logic",
        "severity": "medium",
        "vulnerable_function": "validateUserOp",
        "location": "ERC4337v07.sol:53",
        "explanation": "The function returns `0` (success) for `validationData`, which implies `validAfter=0` and `validUntil=0` (valid forever). However, `BaseAuth` enforces expiration timestamps for static signatures. This mismatch means the Bundler thinks the Op is valid forever, but on-chain execution will revert if the timestamp passes.",
        "attack_scenario": "A user submits a UserOp with a static signature expiring in 2 minutes. `validateUserOp` returns 'valid forever'. The Bundler queues it. 5 minutes later, the Bundler submits it. The transaction reverts on-chain because `BaseAuth` checks the timestamp, causing the Bundler to lose gas.",
        "suggested_fix": "Extract the expiration timestamp from the static signature (if present) and return it in the packed `validationData` (bytes 20-25 for validAfter, bytes 26-31 for validUntil) instead of returning 0."
      }
    ],
    "overall_explanation": "The contract fails to strictly adhere to ERC-4337 validation rules. The primary issues are reverting during validation (instead of returning failure codes) and corrupting the `msg.sender` context by making an external call to `this`. These issues will likely cause Bundlers to reject or ban the wallet."
  },
  "parsing": {
    "success": true,
    "errors": [],
    "raw_response": "Here is the step-by-step analysis of the provided smart contract code.\n\n### Step 1: Understand What They're Building\nThe user is building an ERC-4337 validation module for a smart contract wallet (Sequence).\n*   **Core Component:** `ERC4337v07.sol` is the main interface for the EntryPoint.\n*   **Functionality:** It handles `validateUserOp` to approve transactions submitted by bundlers.\n*   **Auth Logic:** It relies on `isValidSignature` (ERC-1271) which delegates to `BaseAuth` and `SessionManager` logic to verify if the operation is authorized.\n*   **Key Constraint:** ERC-4337 validation phase has strict storage access rules (no accessing other contracts' storage, limited gas, etc.) to prevent DoS attacks on bundlers.\n\n### Step 2: Trace the Code Flow\n1.  **EntryPoint calls `validateUserOp`**:\n    *   Checks `msg.sender` is EntryPoint.\n    *   Pays prefund (`missingAccountFunds`).\n    *   Calls `this.isValidSignature(userOpHash, userOp.signature)`.\n2.  **`isValidSignature` Execution**:\n    *   This is an external call to `this`.\n    *   It goes to `BaseAuth.isValidSignature`.\n    *   It decodes the payload and calls `signatureValidation`.\n    *   It checks static signatures or recovers weights/thresholds via `BaseSig`.\n\n### Step 3: Look for Potential Issues\n\n**Issue 1: The `validateUserOp` Implementation Strategy**\n*   *Observation:* In `ERC4337v07.sol`, the function `validateUserOp` calls `this.isValidSignature(...)`.\n*   *Context:* `validateUserOp` is called by the EntryPoint. The EntryPoint restricts what the wallet can do during validation. Specifically, **ERC-4337 forbids `CALL` opcodes to external contracts** (except the EntryPoint itself) during validation to prevent storage access violations and DoS vectors.\n*   *The Problem:* `this.isValidSignature(...)` is an external call (`CALL` opcode) to the contract itself. While calling *self* is technically an external call, standard ERC-4337 rules (specifically OpenZeppelin's implementation and the standard definition) usually flag *any* `CALL` opcode that isn't to a precompile or the EntryPoint as a violation of the storage access rules, or at least a high risk for gas estimation/bundler simulation.\n*   *Refinement:* Actually, the specific rule in ERC-4337 (UserOp Validation Rules) says: \"The wallet MUST NOT call any other contract...\". Calling `address(this)` is generally allowed *if* it doesn't trigger forbidden opcodes. However, there is a much bigger issue here.\n*   *The Real Issue:* **Signature Validation Logic Complexity.** The `isValidSignature` implementation in `BaseAuth` and `SessionManager` is extremely complex. It involves decoding payloads, checking session limits, iterating over arrays, and potentially reading significant storage.\n    *   If `isValidSignature` reads storage slots associated with *other* entities (like a session signer that is another contract), it breaks ERC-4337 storage rules.\n    *   Looking at `SessionManager.sol`: `recoverSapientSignature` -> `_validateImplicitCall` -> checks `sig.implicitBlacklist`.\n    *   Looking at `BaseAuth.sol`: `_getStaticSignature` reads storage. This is fine (wallet's own storage).\n    *   **Critical:** The `validateUserOp` function returns `SIG_VALIDATION_FAILED` (1) if the signature is invalid. It does *not* revert. This is correct per spec.\n\n**Issue 2: Replay Protection (Nonce Handling)**\n*   *Observation:* The comment says `// userOp.nonce is validated by the entrypoint`.\n*   *Context:* This is true for the 2D nonce (key/seq).\n*   *Problem:* `BaseAuth` uses `Payload.fromDigest(_hash)`. If the `userOpHash` is signed, it includes the nonce. This seems safe.\n\n**Issue 3: The `validateUserOp` Return Value**\n*   *Observation:* `validateUserOp` returns `0` on success.\n*   *Context:* The return value `validationData` is packed: `authorizer (20 bytes) | validUntil (6 bytes) | validAfter (6 bytes)`.\n*   *Problem:* Returning `0` means `validAfter = 0` and `validUntil = 0` (max uint48? No, 0 means \"forever\" usually, but in 4337 `validUntil=0` usually means \"valid forever\" depending on implementation, but strictly `validUntil` is a timestamp).\n*   *Correction:* In ERC-4337, `validUntil=0` implies the operation is valid *forever*. This is generally discouraged because it allows replay attacks if the signature scheme is weak or if the key is compromised later. However, since the nonce protects against replay, this is technically \"safe\" but bad practice. Usually, you want a time window.\n*   *Deeper Look:* `BaseAuth` checks `timestamp` for static signatures: `if (timestamp <= block.timestamp) revert...`. But this check happens inside `isValidSignature`. If it reverts, `validateUserOp` bubbles up the revert?\n    *   `ERC4337v07.sol`: `if (this.isValidSignature(...) != MAGIC) return SIG_VALIDATION_FAILED`.\n    *   If `isValidSignature` *reverts* (e.g., `InvalidStaticSignatureExpired`), the entire `validateUserOp` reverts.\n    *   **Violation:** `validateUserOp` **SHOULD NOT REVERT** for signature failures. It should return `SIG_VALIDATION_FAILED`. If `BaseAuth` reverts (which it does for expired static signatures), the Bundler will drop the UserOp, but it makes simulation harder and is technically against the \"return 1 for sig failure\" recommendation, though not a hard security vulnerability, just a compatibility/DoS risk.\n\n**Issue 4: `msg.sender` spoofing in `recoverSapientSignature`**\n*   *Observation:* In `BaseAuth.sol`, `recoverSapientSignature` does: `parentWallets[_payload.parentWallets.length] = msg.sender;`.\n*   *Context:* This function is `external`.\n*   *Scenario:* An attacker calls `recoverSapientSignature` directly on the wallet. `msg.sender` is the attacker. The attacker is added to `parentWallets`.\n*   *Impact:* This function returns `bytes32(uint256(1))` (success?) or reverts. It doesn't seem to change state. It's a view function (mostly). Wait, `BaseAuth` inherits `ISapient`.\n*   *Check:* Is this used for authorization? `SessionManager` also implements `recoverSapientSignature`.\n*   *Analysis:* This seems to be part of a nested signature verification scheme (EIP-1271 for nested wallets). If `msg.sender` is the parent wallet validating a child's signature, this logic holds. This looks okay, assuming it's `view` only.\n\n**Issue 5: The `validateUserOp` External Call to `this`**\n*   *Observation:* `this.isValidSignature(...)`\n*   *Severity:* **High**.\n*   *Reason:* In Solidity, `this.function()` triggers a standard `CALL`.\n*   *ERC-4337 Rule:* \"The wallet MUST NOT call any other contract...\". While `address(this)` is the same contract, the `CALL` opcode changes the context.\n*   *Gas Overhead:* This adds significant gas overhead (cold account access cost, though it's the same address).\n*   *Reentrancy:* `ERC4337v07` inherits `ReentrancyGuard`. `validateUserOp` is not marked `nonReentrant`, but `executeUserOp` is.\n*   *The real vulnerability:* If `isValidSignature` is `external` (which it is in `BaseAuth`), calling it via `this.` works. However, if the implementation of `isValidSignature` or its dependencies (like `SessionManager`) accesses `msg.sender`, **`msg.sender` will be the wallet itself (`address(this)`), not the EntryPoint**.\n*   *Check `BaseAuth` / `SessionManager`:*\n    *   `SessionManager.sol`: `address wallet = msg.sender;`\n    *   If `validateUserOp` calls `this.isValidSignature`, inside `isValidSignature`, `msg.sender` is `address(this)`.\n    *   `SessionManager` expects `msg.sender` to be the wallet?\n        *   If `SessionManager` is a *module* (delegatecall) or inherited?\n        *   The inheritance tree: `ERC4337v07 is ... Calls`. `Calls` is not shown but likely handles execution.\n        *   `SessionManager` is a separate file. The provided code shows `SessionManager` as a `contract`, not `abstract`.\n        *   Wait, `ERC4337v07` does *not* inherit `SessionManager` or `BaseAuth` in the provided snippet. It inherits `IAccount`, `Calls`.\n        *   **CRITICAL MISSING CONTEXT/LINK:** The provided `ERC4337v07` is `abstract`. It doesn't inherit `BaseAuth`.\n        *   *Assumption:* The final wallet implementation inherits `ERC4337v07`, `BaseAuth`, and `SessionManager` (or uses them).\n        *   *If Inherited:* `this.isValidSignature` changes `msg.sender` to `address(this)`.\n        *   *In `BaseAuth.signatureValidation`:* `if (addr != address(0) && addr != msg.sender)`.\n            *   Here `msg.sender` is checked against the static signature signer.\n            *   If called via `validateUserOp` -> `this.isValidSignature`, `msg.sender` is `address(this)`.\n            *   If the static signature was authorized for the *EntryPoint* (which is unlikely, usually it's a session key), this check fails.\n            *   If the static signature expects the *User* to be `msg.sender`, this fails.\n            *   **Actually**, `validateUserOp` is called by `EntryPoint`. `msg.sender` is `EntryPoint`.\n            *   If we use `this.isValidSignature`, `msg.sender` becomes `Wallet`.\n            *   `BaseAuth` checks: `addr != msg.sender`.\n            *   This implies static signatures are only valid if the *Wallet itself* calls the function? That makes no sense for a user op.\n            *   **Conclusion:** The use of `this.isValidSignature` inside `validateUserOp` corrupts `msg.sender`. `isValidSignature` logic in `BaseAuth` relies on `msg.sender` for static signature validation (`addr != msg.sender`). This will almost certainly break static signature validation during `validateUserOp` because `msg.sender` will be the wallet address, not the signer or EntryPoint.\n\n**Issue 6: Missing `payPrefund` logic / Gas Calculation**\n*   *Observation:* `IEntryPoint(entrypoint).depositTo{ value: missingAccountFunds }(address(this));`\n*   *Context:* This pays the EntryPoint.\n*   *Issue:* If `missingAccountFunds > 0`, the wallet must have ETH.\n*   *Check:* Does the wallet have a `receive()` function? Not shown. If not, and it relies on this contract, it might fail to receive ETH later, but `depositTo` pulls *from* the wallet *to* the EntryPoint. This line is correct.\n\n**Issue 7: `validateUserOp` Revert on Signature Failure**\n*   *Observation:* `BaseAuth` reverts with `InvalidStaticSignatureExpired` or `InvalidSignatureWeight`.\n*   *Impact:* `validateUserOp` catches the return value of `isValidSignature` *only if it returns successfully*. If `isValidSignature` reverts (which `BaseAuth` does frequently for invalid sigs), `validateUserOp` reverts.\n*   *Protocol Violation:* ERC-4337 dictates that `validateUserOp` **MUST NOT REVERT** solely because the signature is invalid. It must return `SIG_VALIDATION_FAILED` (1).\n*   *Consequence:* The Bundler cannot distinguish between a \"bad signature\" (user error, do not ban) and \"contract failure\" (code error, ban opcode). The Bundler will likely ban this wallet implementation or drop the UserOp without payment, causing DoS.\n\n### Step 4: Validate Concerns\n\n1.  **`this.isValidSignature` usage:**\n    *   It changes `msg.sender` to `address(this)`.\n    *   `BaseAuth` uses `msg.sender` for static signature checks.\n    *   This breaks the logic. The wallet is verifying a signature *as if* the wallet itself signed it or is submitting it.\n    *   **Fix:** Call `isValidSignature` internally (without `this.`) or extract the logic into an internal function `_isValidSignature` that takes the sender context if needed, or relies on `_msgSender()` if using context mixins (though 4337 is tricky with context). Since `ERC4337v07` is abstract and likely mixed into the same contract as `BaseAuth`, `isValidSignature` is available internally. Calling it internally preserves `msg.sender` (which is EntryPoint).\n    *   *Wait*, if called internally, `msg.sender` is `EntryPoint`. `BaseAuth` checks `addr != msg.sender`. If `addr` (signer) is a user EOA, and `msg.sender` is EntryPoint, this check fails.\n    *   *Realization:* `isValidSignature` (ERC-1271) is designed for *external* calls where `msg.sender` is the validator (e.g., OpenSea). In 4337, the validator is the EntryPoint.\n    *   The logic in `BaseAuth` seems designed for 1271, not 4337.\n    *   **Verdict:** The reuse of `isValidSignature` for `validateUserOp` is flawed because the `msg.sender` expectations differ between a direct 1271 call and a 4337 validation.\n\n2.  **Reverting instead of returning 1:**\n    *   `BaseAuth` reverts on invalid signatures.\n    *   `validateUserOp` does not wrap this in a try/catch.\n    *   **Verdict:** Vulnerable to Bundler banning/DoS.\n\n3.  **Time-range validation:**\n    *   `validateUserOp` returns `0` (valid forever) for the time-range portion of the validation data.\n    *   However, `BaseAuth` checks timestamps for static signatures.\n    *   If the static signature expires in 10 minutes, but `validateUserOp` returns \"valid forever\", the Bundler might keep the UserOp in the mempool. When it finally mines it, `validateUserOp` will revert (due to the check in `BaseAuth`), causing the Bundler to lose gas (if on-chain) or drop it (if simulated).\n    *   **Fix:** `validateUserOp` should return the expiration timestamp in the `validationData` return value, not check it and revert.\n\n### Final Analysis Structure\n\n1.  **Critical:** `validateUserOp` reverts on invalid signatures instead of returning failure code.\n2.  **High:** `this.isValidSignature` usage corrupts `msg.sender` and breaks static signature logic.\n3.  **Medium:** Incorrect Time-Range handling (returning 0 instead of actual expiry).\n\nLet's refine the \"Critical\" one. If `validateUserOp` reverts, the EntryPoint catches it? No, the EntryPoint calls it. If it reverts, the transaction fails. The Bundler simulates this off-chain. If simulation reverts, the Bundler drops the op. This isn't a \"security\" vulnerability in the sense of funds lost, but it's a \"functional\" vulnerability that makes the wallet incompatible with standard Bundlers.\n\nThe `this.isValidSignature` is a logic bug.\n\nThe most distinct \"Vulnerability\" is the **Revert on Signature Failure**.\n\nAlso, the **`msg.sender` corruption** via `this.` call is a functional bug that prevents static signatures from working.\n\nOne more check: `SessionManager`.\n`recoverSapientSignature` -> `_validateExplicitCall`.\nThis iterates over `payload.calls`.\nIn `validateUserOp`, we are validating the *UserOp*, not executing it.\nThe `userOp.callData` contains the execution calldata.\n`isValidSignature` in `SessionManager` decodes the payload.\nIf the payload is `KIND_TRANSACTIONS`, it validates the calls against permissions.\nThis is fine, BUT `validateUserOp` has a gas limit.\nIf `payload.calls` is large, `isValidSignature` might run out of gas.\nBundlers cap validation gas (usually 100k).\nLooping over calls in validation is risky.\n\n**Verdict:** Vulnerable.\n\n```json\n{\n  \"verdict\": \"vulnerable\",\n  \"confidence\": 0.95,\n  \"vulnerabilities\": [\n    {\n      \"type\": \"Compliance / DoS\",\n      \"severity\": \"high\",\n      \"vulnerable_function\": \"validateUserOp\",\n      \"location\": \"ERC4337v07.sol:49\",\n      \"explanation\": \"The contract calls `this.isValidSignature(...)` which delegates to `BaseAuth`. `BaseAuth` reverts (e.g., `InvalidStaticSignatureExpired`, `InvalidSignatureWeight`) when a signature is invalid. According to ERC-4337, `validateUserOp` MUST NOT revert for signature failures; it must return `SIG_VALIDATION_FAILED` (1). Reverting causes Bundlers to drop the UserOperation and potentially ban the entity.\",\n      \"attack_scenario\": \"A user submits a UserOperation with an expired or invalid signature. The Bundler simulates validation. The contract reverts. The Bundler marks this wallet/paymaster as 'throttled' or 'banned' because it behaved unexpectedly during validation, leading to Denial of Service for the user.\",\n      \"suggested_fix\": \"Wrap the call to signature validation in a try/catch block. If it reverts, return `SIG_VALIDATION_FAILED`. Alternatively, refactor the auth logic to return boolean success/failure instead of reverting.\"\n    },\n    {\n      \"type\": \"Logic Error\",\n      \"severity\": \"high\",\n      \"vulnerable_function\": \"validateUserOp\",\n      \"location\": \"ERC4337v07.sol:49\",\n      \"explanation\": \"The function uses `this.isValidSignature(...)` to validate the signature. Using `this.` triggers an external call, which sets `msg.sender` to the wallet address (`address(this)`). However, `BaseAuth.signatureValidation` checks `if (addr != address(0) && addr != msg.sender)` for static signatures. Since `msg.sender` is now the wallet itself, this check will likely fail or behave incorrectly compared to standard ERC-1271 calls.\",\n      \"attack_scenario\": \"A user sets up a static signature authorized for a specific caller. They submit a UserOp. `validateUserOp` calls `this.isValidSignature`. Inside `BaseAuth`, `msg.sender` is the wallet address. The check `addr != msg.sender` fails (assuming the signer isn't the wallet itself), causing valid signatures to be rejected.\",\n      \"suggested_fix\": \"Do not use `this.` to call `isValidSignature`. Call the internal logic directly (e.g., `_isValidSignature` or `signatureValidation`). Ensure the logic handles the fact that `msg.sender` is the EntryPoint during validation, or pass the intended signer explicitly.\"\n    },\n    {\n      \"type\": \"Gas / Logic\",\n      \"severity\": \"medium\",\n      \"vulnerable_function\": \"validateUserOp\",\n      \"location\": \"ERC4337v07.sol:53\",\n      \"explanation\": \"The function returns `0` (success) for `validationData`, which implies `validAfter=0` and `validUntil=0` (valid forever). However, `BaseAuth` enforces expiration timestamps for static signatures. This mismatch means the Bundler thinks the Op is valid forever, but on-chain execution will revert if the timestamp passes.\",\n      \"attack_scenario\": \"A user submits a UserOp with a static signature expiring in 2 minutes. `validateUserOp` returns 'valid forever'. The Bundler queues it. 5 minutes later, the Bundler submits it. The transaction reverts on-chain because `BaseAuth` checks the timestamp, causing the Bundler to lose gas.\",\n      \"suggested_fix\": \"Extract the expiration timestamp from the static signature (if present) and return it in the packed `validationData` (bytes 20-25 for validAfter, bytes 26-31 for validUntil) instead of returning 0.\"\n    }\n  ],\n  \"overall_explanation\": \"The contract fails to strictly adhere to ERC-4337 validation rules. The primary issues are reverting during validation (instead of returning failure codes) and corrupting the `msg.sender` context by making an external call to `this`. These issues will likely cause Bundlers to reject or ban the wallet.\"\n}\n```"
  },
  "context_info": {
    "has_context_files": true,
    "context_file_count": 3,
    "has_protocol_doc": true
  },
  "api_metrics": {
    "input_tokens": 4745,
    "output_tokens": 4968,
    "latency_ms": 53729.07614707947
  }
}