{
  "sample_id": "nc_tc_015",
  "variant": "nocomments",
  "detector_model": "deepseek-v3-2",
  "prompt_type": "direct",
  "judge_model": "mistral-large",
  "timestamp": "2026-01-06T00:27:06.743686+00:00",
  "overall_verdict": {
    "said_vulnerable": true,
    "confidence_expressed": 0.95
  },
  "findings": [
    {
      "finding_id": 0,
      "vulnerability_type_claimed": "Incorrect Weight Update Logic Leading to Price Manipulation",
      "location_claimed": "_updateWeights() function",
      "classification": "TARGET_MATCH",
      "reasoning": "\n        **Root Cause Match**: The finding correctly identifies that the weight calculation in `_updateWeights()` is based on instantaneous token balances, which can be manipulated via flash loans. The ground truth specifies that weights are recalculated based on instantaneous balances after swaps, allowing attackers to drain liquidity and manipulate prices. The finding's explanation aligns with this, though it focuses on the incorrect assumption of equal token value (due to different decimals) rather than flash loan manipulation. However, the core issue (instantaneous balance-based weight calculation) is the same, and the attack scenario describes a similar manipulation vector.\n\n        **Location Match**: The finding correctly identifies the `_updateWeights()` function as the vulnerable location.\n\n        **Type Match**: The type 'Incorrect Weight Update Logic Leading to Price Manipulation' is a semantic match for 'pool_manipulation'. Both describe the same class of vulnerability where pool pricing logic is exploited.\n      "
    },
    {
      "finding_id": 1,
      "vulnerability_type_claimed": "Insufficient Input Validation in addToken",
      "location_claimed": "addToken function",
      "classification": "BONUS_VALID",
      "reasoning": "\n        This finding identifies a real vulnerability not covered in the ground truth. The `addToken` function lacks access control and input validation, allowing attackers to add malicious or duplicate tokens. The attack scenario is concrete and plausible, and the suggested fix is valid. This is a genuine security issue with clear impact (pool manipulation or denial of service).\n      "
    },
    {
      "finding_id": 2,
      "vulnerability_type_claimed": "Reentrancy in swap function",
      "location_claimed": "swap function",
      "classification": "MISCHARACTERIZED",
      "reasoning": "\n        The finding claims reentrancy in the `swap` function due to state changes after external calls. However, the contract uses Solidity 0.8.0, which includes built-in overflow/underflow checks and is not inherently vulnerable to reentrancy unless the ERC20 token itself is malicious. The `swap` function updates state (`tokens[tokenOut].balance`) before the external call (`IERC20(tokenOut).transfer`), which follows the checks-effects-interactions pattern. Thus, reentrancy is not possible here. The finding mischaracterizes the code.\n      "
    }
  ],
  "target_assessment": {
    "complete_found": true,
    "partial_found": false,
    "finding_id": 0,
    "root_cause_match": true,
    "location_match": true,
    "type_match": "semantic",
    "root_cause_identification": {
      "score": 0.9,
      "reasoning": "\n        The finding correctly identifies the root cause: weight calculations based on instantaneous token balances. While the explanation focuses on token decimals (a valid but narrower issue), it still captures the core problem of balance-based weight updates being manipulable. The ground truth emphasizes flash loans, but the finding's alternative explanation (decimals) is technically accurate and valid.\n      "
    },
    "attack_vector_validity": {
      "score": 0.85,
      "reasoning": "\n        The attack scenario describes a concrete exploit (adding tokens with different decimals to manipulate weights), which is a valid alternative to the flash loan attack in the ground truth. The scenario is step-by-step and demonstrates a genuine vulnerability, though it differs slightly from the ground truth's focus on flash loans.\n      "
    },
    "fix_suggestion_validity": {
      "score": 0.9,
      "reasoning": "\n        The suggested fix (using external oracles or common denominators for weight calculations) is a valid alternative to the ground truth's TWAP/oracle solution. It directly addresses the root cause by replacing instantaneous balance-based weights with a more robust pricing mechanism.\n      "
    }
  },
  "summary": {},
  "notes": "\n    Finding 0 is classified as TARGET_MATCH because it correctly identifies the root cause (instantaneous balance-based weight updates) and location (`_updateWeights`), and the type is a semantic match for 'pool_manipulation'. The explanation and attack scenario are slightly different from the ground truth but are technically valid alternatives. Finding 1 is a valid bonus issue, while Finding 2 is a mischaracterization.\n  ",
  "judge_latency_ms": 19833.3797454834,
  "raw_response": "```json\n{\n  \"overall_verdict\": {\n    \"said_vulnerable\": true,\n    \"confidence_expressed\": 0.95\n  },\n  \"findings\": [\n    {\n      \"finding_id\": 0,\n      \"vulnerability_type_claimed\": \"Incorrect Weight Update Logic Leading to Price Manipulation\",\n      \"location_claimed\": \"_updateWeights() function\",\n      \"classification\": \"TARGET_MATCH\",\n      \"reasoning\": \"\n        **Root Cause Match**: The finding correctly identifies that the weight calculation in `_updateWeights()` is based on instantaneous token balances, which can be manipulated via flash loans. The ground truth specifies that weights are recalculated based on instantaneous balances after swaps, allowing attackers to drain liquidity and manipulate prices. The finding's explanation aligns with this, though it focuses on the incorrect assumption of equal token value (due to different decimals) rather than flash loan manipulation. However, the core issue (instantaneous balance-based weight calculation) is the same, and the attack scenario describes a similar manipulation vector.\n\n        **Location Match**: The finding correctly identifies the `_updateWeights()` function as the vulnerable location.\n\n        **Type Match**: The type 'Incorrect Weight Update Logic Leading to Price Manipulation' is a semantic match for 'pool_manipulation'. Both describe the same class of vulnerability where pool pricing logic is exploited.\n      \"\n    },\n    {\n      \"finding_id\": 1,\n      \"vulnerability_type_claimed\": \"Insufficient Input Validation in addToken\",\n      \"location_claimed\": \"addToken function\",\n      \"classification\": \"BONUS_VALID\",\n      \"reasoning\": \"\n        This finding identifies a real vulnerability not covered in the ground truth. The `addToken` function lacks access control and input validation, allowing attackers to add malicious or duplicate tokens. The attack scenario is concrete and plausible, and the suggested fix is valid. This is a genuine security issue with clear impact (pool manipulation or denial of service).\n      \"\n    },\n    {\n      \"finding_id\": 2,\n      \"vulnerability_type_claimed\": \"Reentrancy in swap function\",\n      \"location_claimed\": \"swap function\",\n      \"classification\": \"MISCHARACTERIZED\",\n      \"reasoning\": \"\n        The finding claims reentrancy in the `swap` function due to state changes after external calls. However, the contract uses Solidity 0.8.0, which includes built-in overflow/underflow checks and is not inherently vulnerable to reentrancy unless the ERC20 token itself is malicious. The `swap` function updates state (`tokens[tokenOut].balance`) before the external call (`IERC20(tokenOut).transfer`), which follows the checks-effects-interactions pattern. Thus, reentrancy is not possible here. The finding mischaracterizes the code.\n      \"\n    }\n  ],\n  \"target_assessment\": {\n    \"complete_found\": true,\n    \"partial_found\": false,\n    \"finding_id\": 0,\n    \"root_cause_match\": true,\n    \"location_match\": true,\n    \"type_match\": \"semantic\",\n    \"root_cause_identification\": {\n      \"score\": 0.9,\n      \"reasoning\": \"\n        The finding correctly identifies the root cause: weight calculations based on instantaneous token balances. While the explanation focuses on token decimals (a valid but narrower issue), it still captures the core problem of balance-based weight updates being manipulable. The ground truth emphasizes flash loans, but the finding's alternative explanation (decimals) is technically accurate and valid.\n      \"\n    },\n    \"attack_vector_validity\": {\n      \"score\": 0.85,\n      \"reasoning\": \"\n        The attack scenario describes a concrete exploit (adding tokens with different decimals to manipulate weights), which is a valid alternative to the flash loan attack in the ground truth. The scenario is step-by-step and demonstrates a genuine vulnerability, though it differs slightly from the ground truth's focus on flash loans.\n      \"\n    },\n    \"fix_suggestion_validity\": {\n      \"score\": 0.9,\n      \"reasoning\": \"\n        The suggested fix (using external oracles or common denominators for weight calculations) is a valid alternative to the ground truth's TWAP/oracle solution. It directly addresses the root cause by replacing instantaneous balance-based weights with a more robust pricing mechanism.\n      \"\n    }\n  },\n  \"notes\": \"\n    Finding 0 is classified as TARGET_MATCH because it correctly identifies the root cause (instantaneous balance-based weight updates) and location (`_updateWeights`), and the type is a semantic match for 'pool_manipulation'. The explanation and attack scenario are slightly different from the ground truth but are technically valid alternatives. Finding 1 is a valid bonus issue, while Finding 2 is a mischaracterization.\n  \"\n}\n```"
}