{
  "sample_id": "nc_tc_036",
  "variant": "nocomments",
  "detector_model": "deepseek-v3-2",
  "prompt_type": "direct",
  "judge_model": "mistral-large",
  "timestamp": "2026-01-06T00:31:35.857198+00:00",
  "overall_verdict": {
    "said_vulnerable": true,
    "confidence_expressed": 0.95
  },
  "findings": [
    {
      "finding_id": 0,
      "vulnerability_type_claimed": "Unprotected Callback with Arbitrary Token Transfer",
      "location_claimed": "uniswapV3SwapCallback",
      "classification": "TARGET_MATCH",
      "reasoning": "\n        **Root Cause Match**: The finding correctly identifies the missing msg.sender validation in the uniswapV3SwapCallback function, allowing direct external calls. It also highlights the trust in user-provided addresses (tokenIn and recipient) and the lack of validation that the caller is a legitimate Uniswap pool. This matches the ground truth root cause exactly.\n\n\n        **Location Match**: The finding correctly identifies the vulnerable function as uniswapV3SwapCallback, matching the ground truth.\n\n\n        **Type Match**: The type 'Unprotected Callback with Arbitrary Token Transfer' is a semantic match to 'access_control' as it describes the same underlying issue (lack of access control on a critical function).\n\n\n        The attack scenario and suggested fix are also aligned with the ground truth, demonstrating a clear understanding of the vulnerability."
    },
    {
      "finding_id": 1,
      "vulnerability_type_claimed": "Unchecked ETH Transfer",
      "location_claimed": "uniswapV3SwapCallback",
      "classification": "BONUS_VALID",
      "reasoning": "\n        **Bonus Valid**: This finding identifies a real, distinct vulnerability not covered in the ground truth. The issue of using `transfer()` with a fixed gas stipend (2300) can cause reverts if the recipient is a contract with a fallback function that consumes more gas. This is a concrete issue with a clear attack scenario (disrupting swap execution) and a valid fix (using `call()` instead of `transfer()`). The impact is genuine (disruption of legitimate swaps), and the exploit does not require a trusted role to be compromised."
    }
  ],
  "target_assessment": {
    "complete_found": true,
    "partial_found": false,
    "finding_id": 0,
    "root_cause_match": true,
    "location_match": true,
    "type_match": "semantic",
    "root_cause_identification": {
      "score": 1.0,
      "reasoning": "The finding's explanation of the root cause is technically accurate and semantically matches the ground truth. It correctly identifies the lack of msg.sender validation, trust in user-provided data, and the external visibility of the callback function."
    },
    "attack_vector_validity": {
      "score": 1.0,
      "reasoning": "The attack scenario is concrete and step-by-step, demonstrating how an attacker can drain funds by directly calling the callback with crafted parameters. This matches the ground truth attack scenario."
    },
    "fix_suggestion_validity": {
      "score": 0.9,
      "reasoning": "The suggested fix (adding access control to validate msg.sender as a legitimate Uniswap pool) is correct and aligns with the ground truth. However, it could be slightly more detailed (e.g., mentioning whitelisting or using Uniswap factory.getPool())."
    }
  },
  "summary": {},
  "notes": "Finding 0 is a clear TARGET_MATCH, while Finding 1 is a valid bonus issue. The model demonstrated a strong understanding of the target vulnerability and provided high-quality explanations and fixes.",
  "judge_latency_ms": 14172.730922698975,
  "raw_response": "```json\n{\n  \"overall_verdict\": {\n    \"said_vulnerable\": true,\n    \"confidence_expressed\": 0.95\n  },\n  \"findings\": [\n    {\n      \"finding_id\": 0,\n      \"vulnerability_type_claimed\": \"Unprotected Callback with Arbitrary Token Transfer\",\n      \"location_claimed\": \"uniswapV3SwapCallback\",\n      \"classification\": \"TARGET_MATCH\",\n      \"reasoning\": \"\n        **Root Cause Match**: The finding correctly identifies the missing msg.sender validation in the uniswapV3SwapCallback function, allowing direct external calls. It also highlights the trust in user-provided addresses (tokenIn and recipient) and the lack of validation that the caller is a legitimate Uniswap pool. This matches the ground truth root cause exactly.\\n\\n\n        **Location Match**: The finding correctly identifies the vulnerable function as uniswapV3SwapCallback, matching the ground truth.\\n\\n\n        **Type Match**: The type 'Unprotected Callback with Arbitrary Token Transfer' is a semantic match to 'access_control' as it describes the same underlying issue (lack of access control on a critical function).\\n\\n\n        The attack scenario and suggested fix are also aligned with the ground truth, demonstrating a clear understanding of the vulnerability.\"\n    },\n    {\n      \"finding_id\": 1,\n      \"vulnerability_type_claimed\": \"Unchecked ETH Transfer\",\n      \"location_claimed\": \"uniswapV3SwapCallback\",\n      \"classification\": \"BONUS_VALID\",\n      \"reasoning\": \"\n        **Bonus Valid**: This finding identifies a real, distinct vulnerability not covered in the ground truth. The issue of using `transfer()` with a fixed gas stipend (2300) can cause reverts if the recipient is a contract with a fallback function that consumes more gas. This is a concrete issue with a clear attack scenario (disrupting swap execution) and a valid fix (using `call()` instead of `transfer()`). The impact is genuine (disruption of legitimate swaps), and the exploit does not require a trusted role to be compromised.\"\n    }\n  ],\n  \"target_assessment\": {\n    \"complete_found\": true,\n    \"partial_found\": false,\n    \"finding_id\": 0,\n    \"root_cause_match\": true,\n    \"location_match\": true,\n    \"type_match\": \"semantic\",\n    \"root_cause_identification\": {\n      \"score\": 1.0,\n      \"reasoning\": \"The finding's explanation of the root cause is technically accurate and semantically matches the ground truth. It correctly identifies the lack of msg.sender validation, trust in user-provided data, and the external visibility of the callback function.\"\n    },\n    \"attack_vector_validity\": {\n      \"score\": 1.0,\n      \"reasoning\": \"The attack scenario is concrete and step-by-step, demonstrating how an attacker can drain funds by directly calling the callback with crafted parameters. This matches the ground truth attack scenario.\"\n    },\n    \"fix_suggestion_validity\": {\n      \"score\": 0.9,\n      \"reasoning\": \"The suggested fix (adding access control to validate msg.sender as a legitimate Uniswap pool) is correct and aligns with the ground truth. However, it could be slightly more detailed (e.g., mentioning whitelisting or using Uniswap factory.getPool()).\"\n    }\n  },\n  \"notes\": \"Finding 0 is a clear TARGET_MATCH, while Finding 1 is a valid bonus issue. The model demonstrated a strong understanding of the target vulnerability and provided high-quality explanations and fixes.\"\n}\n```"
}