{
  "sample_id": "ds_t1_002",
  "detector_model": "llama-4-maverick",
  "prompt_type": "direct",
  "judge_model": "mistral-large",
  "timestamp": "2026-01-06T02:34:41.682464+00:00",
  "overall_verdict": {
    "said_vulnerable": true,
    "confidence_expressed": 0.95
  },
  "findings": [
    {
      "finding_id": 0,
      "vulnerability_type_claimed": "Reentrancy",
      "location_claimed": "withdrawBalance",
      "classification": "TARGET_MATCH",
      "reasoning": "\n        - **Root Cause Match**: The finding correctly identifies the reentrancy vulnerability due to the external call (`msg.sender.call.value()`) being made before updating the user's balance. This matches the ground truth's implied root cause (checks-effects-interactions violation).\n        - **Location Match**: The vulnerable function `withdrawBalance` is correctly identified.\n        - **Type Match**: The type 'Reentrancy' is an exact match to the ground truth.\n        - The attack scenario and suggested fix are concrete and align with the ground truth.\n      "
    },
    {
      "finding_id": 1,
      "vulnerability_type_claimed": "Outdated Solidity Version",
      "location_claimed": "pragma solidity ^0.4.15;",
      "classification": "INFORMATIONAL",
      "reasoning": "\n        - The finding is true (the Solidity version is outdated) but does not represent a direct security vulnerability in the provided code. It is more of an informational or best-practice issue rather than a concrete, exploitable flaw in the given context.\n        - The attack scenario is vague and does not specify a concrete, profitable exploit.\n        - No BONUS_VALID classification because it lacks a concrete attack vector or critical impact.\n      "
    }
  ],
  "target_assessment": {
    "complete_found": true,
    "partial_found": false,
    "finding_id": 0,
    "root_cause_match": true,
    "location_match": true,
    "type_match": "exact",
    "root_cause_identification": {
      "score": 1.0,
      "reasoning": "\n        The root cause is accurately identified as the external call (`msg.sender.call.value()`) being made before updating the user's balance, which is the core issue enabling reentrancy. This matches the ground truth's implied root cause.\n      "
    },
    "attack_vector_validity": {
      "score": 1.0,
      "reasoning": "\n        The attack scenario is concrete and step-by-step, describing how an attacker could recursively call `withdrawBalance` to drain the contract. This aligns perfectly with the ground truth's description of the exploit.\n      "
    },
    "fix_suggestion_validity": {
      "score": 1.0,
      "reasoning": "\n        The suggested fix (applying the checks-effects-interactions pattern by updating the balance before the external call) is exactly what the ground truth recommends. It is a correct and complete remediation.\n      "
    }
  },
  "summary": {},
  "notes": "\n    - Finding 0 is a clear TARGET_MATCH with high-quality root cause identification, attack vector, and fix suggestion.\n    - Finding 1 is valid but classified as INFORMATIONAL because it does not represent a direct, exploitable vulnerability in the provided code.\n  ",
  "judge_latency_ms": 12790.128946304321,
  "raw_response": "```json\n{\n  \"overall_verdict\": {\n    \"said_vulnerable\": true,\n    \"confidence_expressed\": 0.95\n  },\n  \"findings\": [\n    {\n      \"finding_id\": 0,\n      \"vulnerability_type_claimed\": \"Reentrancy\",\n      \"location_claimed\": \"withdrawBalance\",\n      \"classification\": \"TARGET_MATCH\",\n      \"reasoning\": \"\n        - **Root Cause Match**: The finding correctly identifies the reentrancy vulnerability due to the external call (`msg.sender.call.value()`) being made before updating the user's balance. This matches the ground truth's implied root cause (checks-effects-interactions violation).\n        - **Location Match**: The vulnerable function `withdrawBalance` is correctly identified.\n        - **Type Match**: The type 'Reentrancy' is an exact match to the ground truth.\n        - The attack scenario and suggested fix are concrete and align with the ground truth.\n      \"\n    },\n    {\n      \"finding_id\": 1,\n      \"vulnerability_type_claimed\": \"Outdated Solidity Version\",\n      \"location_claimed\": \"pragma solidity ^0.4.15;\",\n      \"classification\": \"INFORMATIONAL\",\n      \"reasoning\": \"\n        - The finding is true (the Solidity version is outdated) but does not represent a direct security vulnerability in the provided code. It is more of an informational or best-practice issue rather than a concrete, exploitable flaw in the given context.\n        - The attack scenario is vague and does not specify a concrete, profitable exploit.\n        - No BONUS_VALID classification because it lacks a concrete attack vector or critical impact.\n      \"\n    }\n  ],\n  \"target_assessment\": {\n    \"complete_found\": true,\n    \"partial_found\": false,\n    \"finding_id\": 0,\n    \"root_cause_match\": true,\n    \"location_match\": true,\n    \"type_match\": \"exact\",\n    \"root_cause_identification\": {\n      \"score\": 1.0,\n      \"reasoning\": \"\n        The root cause is accurately identified as the external call (`msg.sender.call.value()`) being made before updating the user's balance, which is the core issue enabling reentrancy. This matches the ground truth's implied root cause.\n      \"\n    },\n    \"attack_vector_validity\": {\n      \"score\": 1.0,\n      \"reasoning\": \"\n        The attack scenario is concrete and step-by-step, describing how an attacker could recursively call `withdrawBalance` to drain the contract. This aligns perfectly with the ground truth's description of the exploit.\n      \"\n    },\n    \"fix_suggestion_validity\": {\n      \"score\": 1.0,\n      \"reasoning\": \"\n        The suggested fix (applying the checks-effects-interactions pattern by updating the balance before the external call) is exactly what the ground truth recommends. It is a correct and complete remediation.\n      \"\n    }\n  },\n  \"notes\": \"\n    - Finding 0 is a clear TARGET_MATCH with high-quality root cause identification, attack vector, and fix suggestion.\n    - Finding 1 is valid but classified as INFORMATIONAL because it does not represent a direct, exploitable vulnerability in the provided code.\n  \"\n}\n```"
}