{
  "sample_id": "gs_030",
  "dataset": "gs",
  "prompt_type": "context_protocol_cot",
  "detector_model": "deepseek-v3-2",
  "judge_model": "mimo-v2-flash",
  "timestamp": "2026-01-05T20:03:26.865667+00:00",
  "overall_verdict": {
    "said_vulnerable": true,
    "confidence_expressed": 0.95
  },
  "findings": [
    {
      "finding_id": 0,
      "vulnerability_type_claimed": "Signature Replay",
      "location_claimed": "SessionSig.hashCallWithReplayProtection",
      "classification": "PARTIAL_MATCH",
      "reasoning": "Finding 0 identifies the correct function (hashCallWithReplayProtection) and correctly recognizes it as a signature replay vulnerability. However, it identifies the WRONG root cause - it focuses on the noChainId flag allowing cross-chain replay, while the ground truth specifies the root cause as omitting wallet address (address(this)) in the hash, allowing signatures for one wallet to be replayed on another wallet with the same config and nonce. The location is correct and the vulnerability type is semantically correct (signature replay), but the root cause is different from the target."
    },
    {
      "finding_id": 1,
      "vulnerability_type_claimed": "Insufficient Validation",
      "location_claimed": "SessionSig.recoverConfiguration",
      "classification": "INVALID",
      "reasoning": "This finding is about a different function (recoverConfiguration) and a different issue (memory corruption via assembly). It does not match the target vulnerability location (hashCallWithReplayProtection) or root cause. This is a BONUS_VALID finding if the vulnerability actually exists, but it's not the target."
    },
    {
      "finding_id": 2,
      "vulnerability_type_claimed": "Logic Error",
      "location_claimed": "SessionSig.recoverSignature",
      "classification": "INVALID",
      "reasoning": "This finding is about a different function (recoverSignature) and a different issue (validation order). It does not match the target vulnerability location or root cause. This is not the target vulnerability."
    }
  ],
  "target_assessment": {
    "found": true,
    "finding_id": 0,
    "location_match": true,
    "root_cause_match": false,
    "type_match": "semantic",
    "root_cause_identification": {
      "score": 0.3,
      "reasoning": "Finding 0 identifies a different root cause (noChainId flag allowing cross-chain replay) than the target (omitting wallet address in hash, allowing cross-wallet replay). While both are signature replay issues, they are distinct vulnerabilities with different attack vectors and fixes."
    },
    "attack_vector_validity": {
      "score": 0.7,
      "reasoning": "The attack scenario described (cross-chain replay via noChainId) is plausible and technically valid if the vulnerability exists. However, it's not the attack scenario from ground truth (cross-wallet replay). The scenario is concrete but addresses a different issue."
    },
    "fix_suggestion_validity": {
      "score": 0.4,
      "reasoning": "The suggested fix (remove noChainId flag or ensure chain-specific protection) addresses the finding's identified issue but does not address the ground truth root cause (adding address(this) to the hash). The fix is valid for the finding's issue but not for the target vulnerability."
    }
  },
  "summary": {},
  "notes": "The model correctly identified that hashCallWithReplayProtection has a signature replay vulnerability, but identified a different root cause than the target. Finding 0 is a PARTIAL_MATCH because it has correct location and vulnerability type, but wrong root cause. The other findings are unrelated to the target. The target vulnerability (omitting wallet address in hash) is NOT explicitly identified in the findings.",
  "judge_latency_ms": 9789.262771606445,
  "raw_response": "```json\n{\n  \"overall_verdict\": {\n    \"said_vulnerable\": true,\n    \"confidence_expressed\": 0.95\n  },\n  \"findings\": [\n    {\n      \"finding_id\": 0,\n      \"vulnerability_type_claimed\": \"Signature Replay\",\n      \"location_claimed\": \"SessionSig.hashCallWithReplayProtection\",\n      \"classification\": \"PARTIAL_MATCH\",\n      \"reasoning\": \"Finding 0 identifies the correct function (hashCallWithReplayProtection) and correctly recognizes it as a signature replay vulnerability. However, it identifies the WRONG root cause - it focuses on the noChainId flag allowing cross-chain replay, while the ground truth specifies the root cause as omitting wallet address (address(this)) in the hash, allowing signatures for one wallet to be replayed on another wallet with the same config and nonce. The location is correct and the vulnerability type is semantically correct (signature replay), but the root cause is different from the target.\"\n    },\n    {\n      \"finding_id\": 1,\n      \"vulnerability_type_claimed\": \"Insufficient Validation\",\n      \"location_claimed\": \"SessionSig.recoverConfiguration\",\n      \"classification\": \"INVALID\",\n      \"reasoning\": \"This finding is about a different function (recoverConfiguration) and a different issue (memory corruption via assembly). It does not match the target vulnerability location (hashCallWithReplayProtection) or root cause. This is a BONUS_VALID finding if the vulnerability actually exists, but it's not the target.\",\n    },\n    {\n      \"finding_id\": 2,\n      \"vulnerability_type_claimed\": \"Logic Error\",\n      \"location_claimed\": \"SessionSig.recoverSignature\",\n      \"classification\": \"INVALID\",\n      \"reasoning\": \"This finding is about a different function (recoverSignature) and a different issue (validation order). It does not match the target vulnerability location or root cause. This is not the target vulnerability.\"\n    }\n  ],\n  \"target_assessment\": {\n    \"found\": true,\n    \"finding_id\": 0,\n    \"location_match\": true,\n    \"root_cause_match\": false,\n    \"type_match\": \"semantic\",\n    \"root_cause_identification\": {\n      \"score\": 0.3,\n      \"reasoning\": \"Finding 0 identifies a different root cause (noChainId flag allowing cross-chain replay) than the target (omitting wallet address in hash, allowing cross-wallet replay). While both are signature replay issues, they are distinct vulnerabilities with different attack vectors and fixes.\"\n    },\n    \"attack_vector_validity\": {\n      \"score\": 0.7,\n      \"reasoning\": \"The attack scenario described (cross-chain replay via noChainId) is plausible and technically valid if the vulnerability exists. However, it's not the attack scenario from ground truth (cross-wallet replay). The scenario is concrete but addresses a different issue.\"\n    },\n    \"fix_suggestion_validity\": {\n      \"score\": 0.4,\n      \"reasoning\": \"The suggested fix (remove noChainId flag or ensure chain-specific protection) addresses the finding's identified issue but does not address the ground truth root cause (adding address(this) to the hash). The fix is valid for the finding's issue but not for the target vulnerability.\"\n    }\n  },\n  \"notes\": \"The model correctly identified that hashCallWithReplayProtection has a signature replay vulnerability, but identified a different root cause than the target. Finding 0 is a PARTIAL_MATCH because it has correct location and vulnerability type, but wrong root cause. The other findings are unrelated to the target. The target vulnerability (omitting wallet address in hash) is NOT explicitly identified in the findings.\"\n}\n```"
}