{
  "sample_id": "ds_t3_006",
  "detector_model": "deepseek-v3-2",
  "prompt_type": "direct",
  "judge_model": "mistral-large",
  "timestamp": "2026-01-06T01:26:08.288105+00:00",
  "overall_verdict": {
    "said_vulnerable": true,
    "confidence_expressed": 0.95
  },
  "findings": [
    {
      "finding_id": 0,
      "vulnerability_type_claimed": "Integer Overflow/Underflow",
      "location_claimed": "SimpleBank.deposit()",
      "classification": "TARGET_MATCH",
      "reasoning": "\n        **Root Cause Match**: The finding correctly identifies the unsafe downcast from uint256 to uint8 without validation, which is the core issue described in the ground truth (though the ground truth labels it as 'unchecked_call', the root cause is semantically equivalent to 'integer overflow/underflow' in this context). The explanation explicitly mentions truncation via modulo 256, which matches the ground truth's description of unexpected behavior due to downcasting.\n        **Location Match**: The finding correctly identifies the `deposit` function in `SimpleBank`, which matches the ground truth's vulnerable function.\n        **Type Match**: The type 'Integer Overflow/Underflow' is a semantic match to 'unchecked_call' in this context, as the vulnerability arises from unchecked downcasting leading to overflow/underflow behavior.\n      "
    },
    {
      "finding_id": 1,
      "vulnerability_type_claimed": "Integer Overflow/Underflow",
      "location_claimed": "SimpleBankB.deposit()",
      "classification": "DESIGN_CHOICE",
      "reasoning": "\n        The finding describes a functional limitation (capping deposits at 255 wei) rather than a security vulnerability. While this is a valid observation, it is not a security issue but a design choice that restricts usability. No funds are lost, and the contract behaves as intended (albeit with limited functionality).\n      "
    }
  ],
  "target_assessment": {
    "complete_found": true,
    "partial_found": false,
    "finding_id": 0,
    "root_cause_match": true,
    "location_match": true,
    "type_match": "semantic",
    "root_cause_identification": {
      "score": 1.0,
      "reasoning": "\n        The finding precisely identifies the root cause: unsafe downcasting from uint256 to uint8 without validation, leading to silent data loss. This is a technically accurate and complete explanation of the issue.\n      "
    },
    "attack_vector_validity": {
      "score": 1.0,
      "reasoning": "\n        The attack scenario is concrete and step-by-step, demonstrating how an attacker can deposit 256 wei but end up with a 0 balance due to truncation. This is a valid and realistic exploit.\n      "
    },
    "fix_suggestion_validity": {
      "score": 1.0,
      "reasoning": "\n        The suggested fix (explicit validation or using SafeCast's toUint8()) directly addresses the root cause and matches the ground truth's recommendation to use OpenZeppelin's SafeCast or ensure consistent uint256 usage.\n      "
    }
  },
  "summary": {},
  "notes": "\n    The ground truth's 'unchecked_call' label is somewhat misleading in this context, as the actual issue is integer truncation due to unchecked downcasting. The LLM's use of 'Integer Overflow/Underflow' is more precise and semantically equivalent for this specific vulnerability. Finding 1 is correctly classified as a design choice, not a security issue.\n  ",
  "judge_latency_ms": 14003.119945526123,
  "raw_response": "```json\n{\n  \"overall_verdict\": {\n    \"said_vulnerable\": true,\n    \"confidence_expressed\": 0.95\n  },\n  \"findings\": [\n    {\n      \"finding_id\": 0,\n      \"vulnerability_type_claimed\": \"Integer Overflow/Underflow\",\n      \"location_claimed\": \"SimpleBank.deposit()\",\n      \"classification\": \"TARGET_MATCH\",\n      \"reasoning\": \"\n        **Root Cause Match**: The finding correctly identifies the unsafe downcast from uint256 to uint8 without validation, which is the core issue described in the ground truth (though the ground truth labels it as 'unchecked_call', the root cause is semantically equivalent to 'integer overflow/underflow' in this context). The explanation explicitly mentions truncation via modulo 256, which matches the ground truth's description of unexpected behavior due to downcasting.\n        **Location Match**: The finding correctly identifies the `deposit` function in `SimpleBank`, which matches the ground truth's vulnerable function.\n        **Type Match**: The type 'Integer Overflow/Underflow' is a semantic match to 'unchecked_call' in this context, as the vulnerability arises from unchecked downcasting leading to overflow/underflow behavior.\n      \"\n    },\n    {\n      \"finding_id\": 1,\n      \"vulnerability_type_claimed\": \"Integer Overflow/Underflow\",\n      \"location_claimed\": \"SimpleBankB.deposit()\",\n      \"classification\": \"DESIGN_CHOICE\",\n      \"reasoning\": \"\n        The finding describes a functional limitation (capping deposits at 255 wei) rather than a security vulnerability. While this is a valid observation, it is not a security issue but a design choice that restricts usability. No funds are lost, and the contract behaves as intended (albeit with limited functionality).\n      \"\n    }\n  ],\n  \"target_assessment\": {\n    \"complete_found\": true,\n    \"partial_found\": false,\n    \"finding_id\": 0,\n    \"root_cause_match\": true,\n    \"location_match\": true,\n    \"type_match\": \"semantic\",\n    \"root_cause_identification\": {\n      \"score\": 1.0,\n      \"reasoning\": \"\n        The finding precisely identifies the root cause: unsafe downcasting from uint256 to uint8 without validation, leading to silent data loss. This is a technically accurate and complete explanation of the issue.\n      \"\n    },\n    \"attack_vector_validity\": {\n      \"score\": 1.0,\n      \"reasoning\": \"\n        The attack scenario is concrete and step-by-step, demonstrating how an attacker can deposit 256 wei but end up with a 0 balance due to truncation. This is a valid and realistic exploit.\n      \"\n    },\n    \"fix_suggestion_validity\": {\n      \"score\": 1.0,\n      \"reasoning\": \"\n        The suggested fix (explicit validation or using SafeCast's toUint8()) directly addresses the root cause and matches the ground truth's recommendation to use OpenZeppelin's SafeCast or ensure consistent uint256 usage.\n      \"\n    }\n  },\n  \"notes\": \"\n    The ground truth's 'unchecked_call' label is somewhat misleading in this context, as the actual issue is integer truncation due to unchecked downcasting. The LLM's use of 'Integer Overflow/Underflow' is more precise and semantically equivalent for this specific vulnerability. Finding 1 is correctly classified as a design choice, not a security issue.\n  \"\n}\n```"
}