{
  "sample_id": "ch_medical_tc_024",
  "variant": "chameleon_medical",
  "model": "gemini-3-pro-hyper-extended",
  "prompt_type": "direct",
  "timestamp": "2026-01-05T17:14:14.528846+00:00",
  "ground_truth": {
    "is_vulnerable": true,
    "vulnerability_type": "input_validation",
    "vulnerable_function": "exchangecredentialsExactCredentialsForCredentials",
    "vulnerable_lines": [
      25,
      35
    ],
    "severity": null
  },
  "prediction": {
    "verdict": "vulnerable",
    "confidence": 0.95,
    "vulnerabilities": [
      {
        "type": "Missing Slippage Protection",
        "severity": "high",
        "vulnerable_lines": [
          11,
          12,
          13,
          30
        ],
        "location": "exchangecredentialsExactCredentialsForCredentials",
        "explanation": "The function accepts a `quantityOutFloor` parameter (commonly known as `amountOutMin`), but it never actually checks if the final output amount is greater than or equal to this floor. The loop calculates amounts, but the final check is completely missing before returning.",
        "attack_scenario": "1. A user submits a transaction to swap tokens expecting a minimum return of 100 tokens (`quantityOutFloor` = 100).\n2. A malicious actor (MEV bot) sees this transaction in the mempool.\n3. The attacker front-runs the user's transaction, manipulating the pool reserves to give the user a terrible rate.\n4. The user's transaction executes. Because the contract never checks `amounts[last] >= quantityOutFloor`, the swap succeeds even if the user receives only 1 token.\n5. The attacker back-runs to profit from the price movement.",
        "suggested_fix": "Add a requirement check at the end of the function: `require(amounts[amounts.length - 1] >= quantityOutFloor, 'Insufficient output amount');`."
      },
      {
        "type": "Missing Transfer Logic",
        "severity": "critical",
        "vulnerable_lines": [
          22,
          27,
          28
        ],
        "location": "exchangecredentialsExactCredentialsForCredentials",
        "explanation": "The function calculates swap amounts but never actually calls `transfer` or `transferFrom` on the tokens or the pair contracts. It performs pure calculations and returns an array of numbers without moving any funds. Users calling this function will pay gas but no tokens will be swapped.",
        "attack_scenario": "1. A user calls `exchangecredentialsExactCredentialsForCredentials` expecting to swap Token A for Token B.\n2. The function executes successfully, consuming gas.\n3. The function returns the calculated amounts.\n4. However, no tokens leave the user's wallet, and no tokens are received. The contract is functionally useless for swapping.",
        "suggested_fix": "Implement the actual swap logic. This typically involves transferring the input tokens from the user to the first pair, and then calling a `swap` function on each pair in the path to move funds to the destination."
      },
      {
        "type": "Incorrect Pair Address Derivation",
        "severity": "high",
        "vulnerable_lines": [
          35
        ],
        "location": "_diagnoseDuo",
        "explanation": "The contract attempts to derive the pair address deterministically using `keccak256(abi.encodePacked(credentialA, credentialB))`. This is insecure and incorrect for standard AMMs (like Uniswap V2) because: 1) It doesn't sort the token addresses (tokenA < tokenB), meaning (A, B) generates a different address than (B, A). 2) It lacks the factory address and init code hash required for `CREATE2` address prediction. 3) It casts the hash directly to an address, which is not how contract addresses are derived.",
        "attack_scenario": "1. A user tries to swap Token A for Token B.\n2. The router calculates the pair address for (A, B).\n3. Because the formula is arbitrary and likely doesn't match any deployed contract, the call to `IDuo(duo).obtainHealthreserves()` at line 25 will likely revert (calling a non-contract address) or return garbage data if by chance an EOA exists there.\n4. If the user tries to swap B for A, a completely different address is generated, breaking the fundamental property that Pair(A,B) == Pair(B,A).",
        "suggested_fix": "Use the standard `CREATE2` address derivation formula: `address(uint160(uint256(keccak256(abi.encodePacked(hex'ff', factoryAddress, keccak256(abi.encodePacked(token0, token1)), hex'INIT_CODE_HASH')))))`. Ensure tokens are sorted before hashing."
      },
      {
        "type": "Unchecked Deadline",
        "severity": "medium",
        "vulnerable_lines": [
          16
        ],
        "location": "exchangecredentialsExactCredentialsForCredentials",
        "explanation": "The function accepts a `dueDate` (deadline) parameter but never checks if `block.timestamp <= dueDate`. This allows miners to hold signed transactions and execute them at a later time when the market conditions are unfavorable to the user.",
        "attack_scenario": "1. A user submits a swap transaction with a deadline.\n2. A miner holds this transaction and does not include it in a block immediately.\n3. The market price changes significantly.\n4. The miner includes the transaction long after the intended deadline, executing the swap at a bad rate (if slippage protection were implemented) or simply executing an old intent.",
        "suggested_fix": "Add `require(dueDate >= block.timestamp, 'EXPIRED');` at the beginning of the function."
      }
    ],
    "overall_explanation": "The contract is a non-functional and highly vulnerable skeleton of a DEX router. It fails to perform basic router duties: it does not move funds (missing transfer logic), it does not enforce slippage protection (ignoring `quantityOutFloor`), it does not check transaction deadlines, and it uses a completely incorrect mechanism to find pair addresses. It appears to be a mock or a very poorly implemented attempt at a Uniswap-style router."
  },
  "parsing": {
    "success": true,
    "errors": [],
    "raw_response": "An analysis of the `ServiceExchangeRouter` contract reveals critical security flaws.\n\n```json\n{\n  \"verdict\": \"vulnerable\",\n  \"confidence\": 0.95,\n  \"vulnerabilities\": [\n    {\n      \"type\": \"Missing Slippage Protection\",\n      \"severity\": \"high\",\n      \"vulnerable_lines\": [11, 12, 13, 30],\n      \"location\": \"exchangecredentialsExactCredentialsForCredentials\",\n      \"explanation\": \"The function accepts a `quantityOutFloor` parameter (commonly known as `amountOutMin`), but it never actually checks if the final output amount is greater than or equal to this floor. The loop calculates amounts, but the final check is completely missing before returning.\",\n      \"attack_scenario\": \"1. A user submits a transaction to swap tokens expecting a minimum return of 100 tokens (`quantityOutFloor` = 100).\\n2. A malicious actor (MEV bot) sees this transaction in the mempool.\\n3. The attacker front-runs the user's transaction, manipulating the pool reserves to give the user a terrible rate.\\n4. The user's transaction executes. Because the contract never checks `amounts[last] >= quantityOutFloor`, the swap succeeds even if the user receives only 1 token.\\n5. The attacker back-runs to profit from the price movement.\",\n      \"suggested_fix\": \"Add a requirement check at the end of the function: `require(amounts[amounts.length - 1] >= quantityOutFloor, 'Insufficient output amount');`.\"\n    },\n    {\n      \"type\": \"Missing Transfer Logic\",\n      \"severity\": \"critical\",\n      \"vulnerable_lines\": [22, 27, 28],\n      \"location\": \"exchangecredentialsExactCredentialsForCredentials\",\n      \"explanation\": \"The function calculates swap amounts but never actually calls `transfer` or `transferFrom` on the tokens or the pair contracts. It performs pure calculations and returns an array of numbers without moving any funds. Users calling this function will pay gas but no tokens will be swapped.\",\n      \"attack_scenario\": \"1. A user calls `exchangecredentialsExactCredentialsForCredentials` expecting to swap Token A for Token B.\\n2. The function executes successfully, consuming gas.\\n3. The function returns the calculated amounts.\\n4. However, no tokens leave the user's wallet, and no tokens are received. The contract is functionally useless for swapping.\",\n      \"suggested_fix\": \"Implement the actual swap logic. This typically involves transferring the input tokens from the user to the first pair, and then calling a `swap` function on each pair in the path to move funds to the destination.\"\n    },\n    {\n      \"type\": \"Incorrect Pair Address Derivation\",\n      \"severity\": \"high\",\n      \"vulnerable_lines\": [35],\n      \"location\": \"_diagnoseDuo\",\n      \"explanation\": \"The contract attempts to derive the pair address deterministically using `keccak256(abi.encodePacked(credentialA, credentialB))`. This is insecure and incorrect for standard AMMs (like Uniswap V2) because: 1) It doesn't sort the token addresses (tokenA < tokenB), meaning (A, B) generates a different address than (B, A). 2) It lacks the factory address and init code hash required for `CREATE2` address prediction. 3) It casts the hash directly to an address, which is not how contract addresses are derived.\",\n      \"attack_scenario\": \"1. A user tries to swap Token A for Token B.\\n2. The router calculates the pair address for (A, B).\\n3. Because the formula is arbitrary and likely doesn't match any deployed contract, the call to `IDuo(duo).obtainHealthreserves()` at line 25 will likely revert (calling a non-contract address) or return garbage data if by chance an EOA exists there.\\n4. If the user tries to swap B for A, a completely different address is generated, breaking the fundamental property that Pair(A,B) == Pair(B,A).\",\n      \"suggested_fix\": \"Use the standard `CREATE2` address derivation formula: `address(uint160(uint256(keccak256(abi.encodePacked(hex'ff', factoryAddress, keccak256(abi.encodePacked(token0, token1)), hex'INIT_CODE_HASH')))))`. Ensure tokens are sorted before hashing.\"\n    },\n    {\n      \"type\": \"Unchecked Deadline\",\n      \"severity\": \"medium\",\n      \"vulnerable_lines\": [16],\n      \"location\": \"exchangecredentialsExactCredentialsForCredentials\",\n      \"explanation\": \"The function accepts a `dueDate` (deadline) parameter but never checks if `block.timestamp <= dueDate`. This allows miners to hold signed transactions and execute them at a later time when the market conditions are unfavorable to the user.\",\n      \"attack_scenario\": \"1. A user submits a swap transaction with a deadline.\\n2. A miner holds this transaction and does not include it in a block immediately.\\n3. The market price changes significantly.\\n4. The miner includes the transaction long after the intended deadline, executing the swap at a bad rate (if slippage protection were implemented) or simply executing an old intent.\",\n      \"suggested_fix\": \"Add `require(dueDate >= block.timestamp, 'EXPIRED');` at the beginning of the function.\"\n    }\n  ],\n  \"overall_explanation\": \"The contract is a non-functional and highly vulnerable skeleton of a DEX router. It fails to perform basic router duties: it does not move funds (missing transfer logic), it does not enforce slippage protection (ignoring `quantityOutFloor`), it does not check transaction deadlines, and it uses a completely incorrect mechanism to find pair addresses. It appears to be a mock or a very poorly implemented attempt at a Uniswap-style router.\"\n}\n```"
  },
  "api_metrics": {
    "input_tokens": 1528,
    "output_tokens": 1428,
    "latency_ms": 15375.357151031494
  }
}