{
  "sample_id": "sn_tc_021",
  "variant": "sanitized",
  "detector_model": "llama-4-maverick",
  "prompt_type": "direct",
  "judge_model": "mistral-large",
  "timestamp": "2026-01-06T00:28:30.716174+00:00",
  "overall_verdict": {
    "said_vulnerable": true,
    "confidence_expressed": 0.9
  },
  "findings": [
    {
      "finding_id": 0,
      "vulnerability_type_claimed": "Unprotected Price Manipulation",
      "location_claimed": "getCollateralValue",
      "classification": "TARGET_MATCH",
      "reasoning": "\n        **Root Cause Match**: The finding correctly identifies that the oracle relies on `get_virtual_price()` which can be manipulated via flash loans or liquidity additions, and that there is no protection like TWAP or manipulation resistance. This matches the ground truth root cause exactly.\n        **Location Match**: While the ground truth specifies the `borrow` function as the vulnerable entry point, the root cause is in `getCollateralValue` (called by `borrow`). The finding correctly identifies the root cause location (`getCollateralValue`), and the ground truth's `borrow` function is directly dependent on this. Thus, the location is considered a match because the vulnerability originates from `getCollateralValue`.\n        **Type Match**: 'Unprotected Price Manipulation' is a semantic match for 'price_oracle_manipulation'.\n      "
    },
    {
      "finding_id": 1,
      "vulnerability_type_claimed": "Lack of Reentrancy Protection",
      "location_claimed": "borrow",
      "classification": "BONUS_VALID",
      "reasoning": "\n        The finding identifies a real vulnerability not in the ground truth. The `borrow` function updates state after the external call (`IERC20(borrowToken).transfer`), which could allow reentrancy if `borrowToken` is a malicious contract. The attack scenario is concrete and plausible, and the fix suggestion (Checks-Effects-Interactions) is valid.\n      "
    }
  ],
  "target_assessment": {
    "complete_found": true,
    "partial_found": false,
    "finding_id": 0,
    "root_cause_match": true,
    "location_match": true,
    "type_match": "semantic",
    "root_cause_identification": {
      "score": 1.0,
      "reasoning": "The finding precisely matches the ground truth root cause, explaining the reliance on `get_virtual_price()` and the lack of manipulation resistance."
    },
    "attack_vector_validity": {
      "score": 0.9,
      "reasoning": "The attack scenario closely mirrors the ground truth, though it simplifies the flash loan steps. It is concrete and would work as described."
    },
    "fix_suggestion_validity": {
      "score": 0.9,
      "reasoning": "The suggested fix (TWAP or Chainlink) aligns with the ground truth fix (TWAP, EMA, or manipulation-resistant oracles)."
    }
  },
  "summary": {},
  "notes": "\n    The location mismatch between `getCollateralValue` (finding) and `borrow` (ground truth) is nuanced. Since `borrow` relies on `getCollateralValue`, and the root cause is in the latter, this is considered a location match. The ground truth's focus on `borrow` is because it is the entry point for the exploit, but the vulnerability originates from the oracle logic in `getCollateralValue`.\n  ",
  "judge_latency_ms": 13696.413040161133,
  "raw_response": "```json\n{\n  \"overall_verdict\": {\n    \"said_vulnerable\": true,\n    \"confidence_expressed\": 0.9\n  },\n  \"findings\": [\n    {\n      \"finding_id\": 0,\n      \"vulnerability_type_claimed\": \"Unprotected Price Manipulation\",\n      \"location_claimed\": \"getCollateralValue\",\n      \"classification\": \"TARGET_MATCH\",\n      \"reasoning\": \"\n        **Root Cause Match**: The finding correctly identifies that the oracle relies on `get_virtual_price()` which can be manipulated via flash loans or liquidity additions, and that there is no protection like TWAP or manipulation resistance. This matches the ground truth root cause exactly.\n        **Location Match**: While the ground truth specifies the `borrow` function as the vulnerable entry point, the root cause is in `getCollateralValue` (called by `borrow`). The finding correctly identifies the root cause location (`getCollateralValue`), and the ground truth's `borrow` function is directly dependent on this. Thus, the location is considered a match because the vulnerability originates from `getCollateralValue`.\n        **Type Match**: 'Unprotected Price Manipulation' is a semantic match for 'price_oracle_manipulation'.\n      \"\n    },\n    {\n      \"finding_id\": 1,\n      \"vulnerability_type_claimed\": \"Lack of Reentrancy Protection\",\n      \"location_claimed\": \"borrow\",\n      \"classification\": \"BONUS_VALID\",\n      \"reasoning\": \"\n        The finding identifies a real vulnerability not in the ground truth. The `borrow` function updates state after the external call (`IERC20(borrowToken).transfer`), which could allow reentrancy if `borrowToken` is a malicious contract. The attack scenario is concrete and plausible, and the fix suggestion (Checks-Effects-Interactions) is valid.\n      \"\n    }\n  ],\n  \"target_assessment\": {\n    \"complete_found\": true,\n    \"partial_found\": false,\n    \"finding_id\": 0,\n    \"root_cause_match\": true,\n    \"location_match\": true,\n    \"type_match\": \"semantic\",\n    \"root_cause_identification\": {\n      \"score\": 1.0,\n      \"reasoning\": \"The finding precisely matches the ground truth root cause, explaining the reliance on `get_virtual_price()` and the lack of manipulation resistance.\"\n    },\n    \"attack_vector_validity\": {\n      \"score\": 0.9,\n      \"reasoning\": \"The attack scenario closely mirrors the ground truth, though it simplifies the flash loan steps. It is concrete and would work as described.\"\n    },\n    \"fix_suggestion_validity\": {\n      \"score\": 0.9,\n      \"reasoning\": \"The suggested fix (TWAP or Chainlink) aligns with the ground truth fix (TWAP, EMA, or manipulation-resistant oracles).\"\n    }\n  },\n  \"notes\": \"\n    The location mismatch between `getCollateralValue` (finding) and `borrow` (ground truth) is nuanced. Since `borrow` relies on `getCollateralValue`, and the root cause is in the latter, this is considered a location match. The ground truth's focus on `borrow` is because it is the entry point for the exploit, but the vulnerability originates from the oracle logic in `getCollateralValue`.\n  \"\n}\n```"
}