{
  "sample_id": "sn_tc_005",
  "variant": "sanitized",
  "detector_model": "llama-4-maverick",
  "prompt_type": "direct",
  "judge_model": "mistral-large",
  "timestamp": "2026-01-06T00:25:19.846787+00:00",
  "overall_verdict": {
    "said_vulnerable": true,
    "confidence_expressed": 0.9
  },
  "findings": [
    {
      "finding_id": 0,
      "vulnerability_type_claimed": "Unprotected Function Call",
      "location_claimed": "CrossChainManager.verifyHeaderAndExecuteTx",
      "classification": "TARGET_MATCH",
      "reasoning": "\n        **Root Cause Match**: The finding correctly identifies that `verifyHeaderAndExecuteTx` allows calling any contract function without restricting the target contract or method. This matches the ground truth's root cause: EthCrossChainManager didn't restrict which contracts could be targeted for execution, allowing calls to privileged contracts like EthCrossChainData.\n        **Location Match**: The finding correctly identifies the vulnerable function `verifyHeaderAndExecuteTx`.\n        **Type Match**: 'Unprotected Function Call' is a semantic match for 'access_control' as it describes the same underlying issue (lack of access control on function calls).\n        The attack scenario and suggested fix also align with the ground truth, demonstrating understanding of the specific vulnerability.\n      "
    },
    {
      "finding_id": 1,
      "vulnerability_type_claimed": "Simplified Verification",
      "location_claimed": "CrossChainManager._verifyHeader and _verifyProof",
      "classification": "BONUS_VALID",
      "reasoning": "\n        This is a real vulnerability not mentioned in the ground truth. The simplified verification functions (`_verifyHeader` and `_verifyProof`) always return true, which could allow attackers to bypass critical validation steps. The attack scenario is concrete and plausible, and the impact (arbitrary transaction execution) is genuine. This does not require a trusted role to be compromised.\n      "
    },
    {
      "finding_id": 2,
      "vulnerability_type_claimed": "Static Return Values",
      "location_claimed": "CrossChainManager._decodeTx",
      "classification": "INFORMATIONAL",
      "reasoning": "\n        While the observation about static return values is true, it does not constitute a security vulnerability in this context. The `_decodeTx` function's behavior is a simplification for demonstration purposes, and the ground truth does not mention this as a vulnerability. There is no concrete attack scenario or impact described that would result in loss of funds or unauthorized access.\n      "
    }
  ],
  "target_assessment": {
    "complete_found": true,
    "partial_found": false,
    "finding_id": 0,
    "root_cause_match": true,
    "location_match": true,
    "type_match": "semantic",
    "root_cause_identification": {
      "score": 1.0,
      "reasoning": "The finding's root cause explanation is technically accurate and semantically matches the ground truth. It correctly identifies the lack of target contract/method validation as the core issue."
    },
    "attack_vector_validity": {
      "score": 1.0,
      "reasoning": "The attack scenario is concrete and matches the ground truth's description of how an attacker could exploit the vulnerability to call privileged functions."
    },
    "fix_suggestion_validity": {
      "score": 0.9,
      "reasoning": "The suggested fix (validating `toContract` and restricting `method`) is correct and aligns with the ground truth's recommendation to implement a whitelist of allowed target contracts. The fix is slightly less comprehensive than the ground truth's multi-faceted approach but is still valid."
    }
  },
  "summary": {},
  "notes": "\n    Finding 0 is a strong TARGET_MATCH, demonstrating a clear understanding of the Poly Network vulnerability. Finding 1 is a valid bonus finding, while Finding 2 is informational and not security-relevant.\n  ",
  "judge_latency_ms": 14265.962839126587,
  "raw_response": "```json\n{\n  \"overall_verdict\": {\n    \"said_vulnerable\": true,\n    \"confidence_expressed\": 0.9\n  },\n  \"findings\": [\n    {\n      \"finding_id\": 0,\n      \"vulnerability_type_claimed\": \"Unprotected Function Call\",\n      \"location_claimed\": \"CrossChainManager.verifyHeaderAndExecuteTx\",\n      \"classification\": \"TARGET_MATCH\",\n      \"reasoning\": \"\n        **Root Cause Match**: The finding correctly identifies that `verifyHeaderAndExecuteTx` allows calling any contract function without restricting the target contract or method. This matches the ground truth's root cause: EthCrossChainManager didn't restrict which contracts could be targeted for execution, allowing calls to privileged contracts like EthCrossChainData.\n        **Location Match**: The finding correctly identifies the vulnerable function `verifyHeaderAndExecuteTx`.\n        **Type Match**: 'Unprotected Function Call' is a semantic match for 'access_control' as it describes the same underlying issue (lack of access control on function calls).\n        The attack scenario and suggested fix also align with the ground truth, demonstrating understanding of the specific vulnerability.\n      \"\n    },\n    {\n      \"finding_id\": 1,\n      \"vulnerability_type_claimed\": \"Simplified Verification\",\n      \"location_claimed\": \"CrossChainManager._verifyHeader and _verifyProof\",\n      \"classification\": \"BONUS_VALID\",\n      \"reasoning\": \"\n        This is a real vulnerability not mentioned in the ground truth. The simplified verification functions (`_verifyHeader` and `_verifyProof`) always return true, which could allow attackers to bypass critical validation steps. The attack scenario is concrete and plausible, and the impact (arbitrary transaction execution) is genuine. This does not require a trusted role to be compromised.\n      \"\n    },\n    {\n      \"finding_id\": 2,\n      \"vulnerability_type_claimed\": \"Static Return Values\",\n      \"location_claimed\": \"CrossChainManager._decodeTx\",\n      \"classification\": \"INFORMATIONAL\",\n      \"reasoning\": \"\n        While the observation about static return values is true, it does not constitute a security vulnerability in this context. The `_decodeTx` function's behavior is a simplification for demonstration purposes, and the ground truth does not mention this as a vulnerability. There is no concrete attack scenario or impact described that would result in loss of funds or unauthorized access.\n      \"\n    }\n  ],\n  \"target_assessment\": {\n    \"complete_found\": true,\n    \"partial_found\": false,\n    \"finding_id\": 0,\n    \"root_cause_match\": true,\n    \"location_match\": true,\n    \"type_match\": \"semantic\",\n    \"root_cause_identification\": {\n      \"score\": 1.0,\n      \"reasoning\": \"The finding's root cause explanation is technically accurate and semantically matches the ground truth. It correctly identifies the lack of target contract/method validation as the core issue.\"\n    },\n    \"attack_vector_validity\": {\n      \"score\": 1.0,\n      \"reasoning\": \"The attack scenario is concrete and matches the ground truth's description of how an attacker could exploit the vulnerability to call privileged functions.\"\n    },\n    \"fix_suggestion_validity\": {\n      \"score\": 0.9,\n      \"reasoning\": \"The suggested fix (validating `toContract` and restricting `method`) is correct and aligns with the ground truth's recommendation to implement a whitelist of allowed target contracts. The fix is slightly less comprehensive than the ground truth's multi-faceted approach but is still valid.\"\n    }\n  },\n  \"notes\": \"\n    Finding 0 is a strong TARGET_MATCH, demonstrating a clear understanding of the Poly Network vulnerability. Finding 1 is a valid bonus finding, while Finding 2 is informational and not security-relevant.\n  \"\n}\n```"
}