{
  "sample_id": "ds_t2_068",
  "detector_model": "llama-4-maverick",
  "prompt_type": "direct",
  "judge_model": "mistral-large",
  "timestamp": "2026-01-06T02:10:37.867740+00:00",
  "overall_verdict": {
    "said_vulnerable": true,
    "confidence_expressed": 0.9
  },
  "findings": [
    {
      "finding_id": 0,
      "vulnerability_type_claimed": "Reentrancy/State Manipulation",
      "location_claimed": "register function",
      "classification": "TARGET_MATCH",
      "reasoning": "\n        **Root Cause Match**: The ground truth specifies a logic error in the `register` function, but does not specify the exact root cause. The model correctly identifies that the `unlocked` variable is initialized to `false` and there is no function to change it, making the `register` function unusable. This is a specific logic error that matches the ground truth's description of unintended behavior due to incorrect validation/processing.\n\n        **Location Match**: The model correctly identifies the `register` function as the vulnerable location, matching the ground truth.\n\n        **Type Match**: The model labels this as 'Reentrancy/State Manipulation', which is not an exact match to 'logic_error'. However, the explanation clearly describes a logic error (unintended state leading to unusable function), so this is a semantic match for the underlying issue. The type name is imprecise but the core vulnerability is correctly identified.\n      "
    },
    {
      "finding_id": 1,
      "vulnerability_type_claimed": "Outdated Solidity Version",
      "location_claimed": "pragma solidity ^0.4.15;",
      "classification": "INFORMATIONAL",
      "reasoning": "\n        This finding is about the use of an outdated Solidity version, which is a true observation but not directly related to the TARGET vulnerability (logic error in the `register` function). While it is a security-relevant issue, it does not match the ground truth's root cause, location, or type. It is classified as INFORMATIONAL because it does not describe a concrete, exploitable vulnerability in the contract's logic.\n      "
    }
  ],
  "target_assessment": {
    "complete_found": true,
    "partial_found": false,
    "finding_id": 0,
    "root_cause_match": true,
    "location_match": true,
    "type_match": "semantic",
    "root_cause_identification": {
      "score": 1.0,
      "reasoning": "\n        The model's explanation of the root cause is technically accurate and specific: the `unlocked` variable is initialized to `false` and there is no mechanism to change it, making the `register` function unusable. This matches the ground truth's description of a logic error leading to unintended behavior.\n      "
    },
    "attack_vector_validity": {
      "score": 1.0,
      "reasoning": "\n        The attack scenario is concrete and step-by-step: deploying the contract and attempting to register a name will always revert due to the `require(unlocked)` check failing. This is a valid and accurate description of the unintended behavior.\n      "
    },
    "fix_suggestion_validity": {
      "score": 1.0,
      "reasoning": "\n        The suggested fix (adding a function to toggle the `unlocked` state with access control) is a correct and complete remediation for the issue. It directly addresses the root cause and restores the intended functionality of the contract.\n      "
    }
  },
  "summary": {},
  "notes": "\n    The ground truth's description of the TARGET vulnerability is vague ('logic error' with no specific root cause or attack scenario). However, the model's finding for the `register` function is a clear and specific instance of a logic error, making it a strong match. The type mismatch ('Reentrancy/State Manipulation' vs 'logic_error') is minor given the semantic alignment of the underlying issue.\n  ",
  "judge_latency_ms": 15078.36389541626,
  "raw_response": "```json\n{\n  \"overall_verdict\": {\n    \"said_vulnerable\": true,\n    \"confidence_expressed\": 0.9\n  },\n  \"findings\": [\n    {\n      \"finding_id\": 0,\n      \"vulnerability_type_claimed\": \"Reentrancy/State Manipulation\",\n      \"location_claimed\": \"register function\",\n      \"classification\": \"TARGET_MATCH\",\n      \"reasoning\": \"\n        **Root Cause Match**: The ground truth specifies a logic error in the `register` function, but does not specify the exact root cause. The model correctly identifies that the `unlocked` variable is initialized to `false` and there is no function to change it, making the `register` function unusable. This is a specific logic error that matches the ground truth's description of unintended behavior due to incorrect validation/processing.\n\n        **Location Match**: The model correctly identifies the `register` function as the vulnerable location, matching the ground truth.\n\n        **Type Match**: The model labels this as 'Reentrancy/State Manipulation', which is not an exact match to 'logic_error'. However, the explanation clearly describes a logic error (unintended state leading to unusable function), so this is a semantic match for the underlying issue. The type name is imprecise but the core vulnerability is correctly identified.\n      \"\n    },\n    {\n      \"finding_id\": 1,\n      \"vulnerability_type_claimed\": \"Outdated Solidity Version\",\n      \"location_claimed\": \"pragma solidity ^0.4.15;\",\n      \"classification\": \"INFORMATIONAL\",\n      \"reasoning\": \"\n        This finding is about the use of an outdated Solidity version, which is a true observation but not directly related to the TARGET vulnerability (logic error in the `register` function). While it is a security-relevant issue, it does not match the ground truth's root cause, location, or type. It is classified as INFORMATIONAL because it does not describe a concrete, exploitable vulnerability in the contract's logic.\n      \"\n    }\n  ],\n  \"target_assessment\": {\n    \"complete_found\": true,\n    \"partial_found\": false,\n    \"finding_id\": 0,\n    \"root_cause_match\": true,\n    \"location_match\": true,\n    \"type_match\": \"semantic\",\n    \"root_cause_identification\": {\n      \"score\": 1.0,\n      \"reasoning\": \"\n        The model's explanation of the root cause is technically accurate and specific: the `unlocked` variable is initialized to `false` and there is no mechanism to change it, making the `register` function unusable. This matches the ground truth's description of a logic error leading to unintended behavior.\n      \"\n    },\n    \"attack_vector_validity\": {\n      \"score\": 1.0,\n      \"reasoning\": \"\n        The attack scenario is concrete and step-by-step: deploying the contract and attempting to register a name will always revert due to the `require(unlocked)` check failing. This is a valid and accurate description of the unintended behavior.\n      \"\n    },\n    \"fix_suggestion_validity\": {\n      \"score\": 1.0,\n      \"reasoning\": \"\n        The suggested fix (adding a function to toggle the `unlocked` state with access control) is a correct and complete remediation for the issue. It directly addresses the root cause and restores the intended functionality of the contract.\n      \"\n    }\n  },\n  \"notes\": \"\n    The ground truth's description of the TARGET vulnerability is vague ('logic error' with no specific root cause or attack scenario). However, the model's finding for the `register` function is a clear and specific instance of a logic error, making it a strong match. The type mismatch ('Reentrancy/State Manipulation' vs 'logic_error') is minor given the semantic alignment of the underlying issue.\n  \"\n}\n```"
}