{
  "sample_id": "ds_t2_037",
  "detector_model": "llama-4-maverick",
  "prompt_type": "direct",
  "judge_model": "mistral-large",
  "timestamp": "2026-01-06T02:08:38.316761+00:00",
  "overall_verdict": {
    "said_vulnerable": true,
    "confidence_expressed": 0.95
  },
  "findings": [
    {
      "finding_id": 0,
      "vulnerability_type_claimed": "Unprotected Functionality",
      "location_claimed": "changeOwner(address)",
      "classification": "TARGET_MATCH",
      "reasoning": "\n        **Root Cause Match**: The finding correctly identifies the lack of access control in the `changeOwner` function, which aligns with the ground truth's access control vulnerability. The explanation explicitly states the function lacks the `onlyowner` modifier, making it callable by anyone. This matches the ground truth's root cause (missing authorization checks).\n\n        **Location Match**: The finding correctly identifies the `changeOwner` function as the vulnerable location, which matches the ground truth.\n\n        **Type Match**: The type 'Unprotected Functionality' is a semantic match to 'access_control' as both describe the same vulnerability class (missing authorization checks).\n      "
    },
    {
      "finding_id": 1,
      "vulnerability_type_claimed": "Outdated Solidity Version",
      "location_claimed": "pragma solidity ^0.4.15;",
      "classification": "INFORMATIONAL",
      "reasoning": "\n        This finding is about the use of an outdated Solidity version, which is a true observation but not security-relevant to the TARGET vulnerability (access control). It does not describe a concrete, exploitable vulnerability in the provided code and lacks a step-by-step attack scenario with impact. Thus, it is classified as INFORMATIONAL.\n      "
    }
  ],
  "target_assessment": {
    "complete_found": true,
    "partial_found": false,
    "finding_id": 0,
    "root_cause_match": true,
    "location_match": true,
    "type_match": "semantic",
    "root_cause_identification": {
      "score": 1.0,
      "reasoning": "\n        The finding's root cause explanation is technically accurate and semantically matches the ground truth. It correctly identifies the lack of the `onlyowner` modifier as the specific issue, which is the core of the access control vulnerability.\n      "
    },
    "attack_vector_validity": {
      "score": 1.0,
      "reasoning": "\n        The attack scenario is concrete and step-by-step: an attacker calls `changeOwner` with their address, taking control of the contract. This is a valid and realistic exploit for the identified vulnerability.\n      "
    },
    "fix_suggestion_validity": {
      "score": 1.0,
      "reasoning": "\n        The suggested fix (adding the `onlyowner` modifier) is correct and semantically matches the ground truth's recommendation to add proper access control. It directly remediates the issue.\n      "
    }
  },
  "summary": {},
  "notes": "\n    Finding 0 is a clear TARGET_MATCH as it meets all criteria: correct root cause, location, and type (semantic match). Finding 1 is valid but not security-relevant to the TARGET vulnerability, so it is classified as INFORMATIONAL.\n  ",
  "judge_latency_ms": 12207.767009735107,
  "raw_response": "```json\n{\n  \"overall_verdict\": {\n    \"said_vulnerable\": true,\n    \"confidence_expressed\": 0.95\n  },\n  \"findings\": [\n    {\n      \"finding_id\": 0,\n      \"vulnerability_type_claimed\": \"Unprotected Functionality\",\n      \"location_claimed\": \"changeOwner(address)\",\n      \"classification\": \"TARGET_MATCH\",\n      \"reasoning\": \"\n        **Root Cause Match**: The finding correctly identifies the lack of access control in the `changeOwner` function, which aligns with the ground truth's access control vulnerability. The explanation explicitly states the function lacks the `onlyowner` modifier, making it callable by anyone. This matches the ground truth's root cause (missing authorization checks).\n\n        **Location Match**: The finding correctly identifies the `changeOwner` function as the vulnerable location, which matches the ground truth.\n\n        **Type Match**: The type 'Unprotected Functionality' is a semantic match to 'access_control' as both describe the same vulnerability class (missing authorization checks).\n      \"\n    },\n    {\n      \"finding_id\": 1,\n      \"vulnerability_type_claimed\": \"Outdated Solidity Version\",\n      \"location_claimed\": \"pragma solidity ^0.4.15;\",\n      \"classification\": \"INFORMATIONAL\",\n      \"reasoning\": \"\n        This finding is about the use of an outdated Solidity version, which is a true observation but not security-relevant to the TARGET vulnerability (access control). It does not describe a concrete, exploitable vulnerability in the provided code and lacks a step-by-step attack scenario with impact. Thus, it is classified as INFORMATIONAL.\n      \"\n    }\n  ],\n  \"target_assessment\": {\n    \"complete_found\": true,\n    \"partial_found\": false,\n    \"finding_id\": 0,\n    \"root_cause_match\": true,\n    \"location_match\": true,\n    \"type_match\": \"semantic\",\n    \"root_cause_identification\": {\n      \"score\": 1.0,\n      \"reasoning\": \"\n        The finding's root cause explanation is technically accurate and semantically matches the ground truth. It correctly identifies the lack of the `onlyowner` modifier as the specific issue, which is the core of the access control vulnerability.\n      \"\n    },\n    \"attack_vector_validity\": {\n      \"score\": 1.0,\n      \"reasoning\": \"\n        The attack scenario is concrete and step-by-step: an attacker calls `changeOwner` with their address, taking control of the contract. This is a valid and realistic exploit for the identified vulnerability.\n      \"\n    },\n    \"fix_suggestion_validity\": {\n      \"score\": 1.0,\n      \"reasoning\": \"\n        The suggested fix (adding the `onlyowner` modifier) is correct and semantically matches the ground truth's recommendation to add proper access control. It directly remediates the issue.\n      \"\n    }\n  },\n  \"notes\": \"\n    Finding 0 is a clear TARGET_MATCH as it meets all criteria: correct root cause, location, and type (semantic match). Finding 1 is valid but not security-relevant to the TARGET vulnerability, so it is classified as INFORMATIONAL.\n  \"\n}\n```"
}