{
  "sample_id": "df_tc_015",
  "variant": "differential",
  "detector_model": "gpt-5.2",
  "prompt_type": "direct",
  "judge_model": "gemini-3-flash",
  "timestamp": "2026-01-05T08:06:41.295129+00:00",
  "overall_verdict": {
    "said_vulnerable": true,
    "confidence_expressed": 0.93
  },
  "findings": [
    {
      "finding_id": 0,
      "description": "The contract uses transfer() instead of transferFrom() for inbound transfers, and fails to check return values, leading to phantom deposits.",
      "vulnerability_type_claimed": "Incorrect ERC20 transfer usage",
      "severity_claimed": "critical",
      "location_claimed": "swap() and addLiquidity()",
      "matches_target": false,
      "is_valid_concern": true,
      "classification": "BONUS_VALID",
      "reasoning": "This is a severe, exploitable vulnerability. In LN-44 and LN-101, the contract calls `IERC20(token).transfer(address(this), amount)`. In ERC20, `transfer` sends tokens from `msg.sender` (the contract) to the recipient. To pull tokens from a user, `transferFrom` must be used. As written, the contract attempts to pay itself with its own tokens, fails to actually move user funds, but still increments the internal `balance` variable, allowing users to drain the pool for free."
    },
    {
      "finding_id": 1,
      "description": "Unrestricted addToken allows overwriting existing tokens and DoS via list bloating.",
      "vulnerability_type_claimed": "Unrestricted token listing",
      "severity_claimed": "high",
      "location_claimed": "addToken()",
      "matches_target": false,
      "is_valid_concern": true,
      "classification": "BONUS_VALID",
      "reasoning": "The `addToken` function lacks access control and does not check if a token is already added. An attacker can overwrite the `Token` struct for an existing token (resetting its balance to 0 in the mapping) or bloat the `tokenList` array to make the loops in `updateWeights` exceed the block gas limit."
    },
    {
      "finding_id": 2,
      "description": "Broken rate-limiting in updateWeights() due to checking lastUpdate[msg.sender] but updating lastUpdate[token].",
      "vulnerability_type_claimed": "Broken rate-limiting",
      "severity_claimed": "medium",
      "location_claimed": "updateWeights()",
      "matches_target": true,
      "is_valid_concern": true,
      "classification": "TARGET_MATCH",
      "reasoning": "This correctly identifies the logic error in the ground truth target. The check `block.timestamp - lastUpdate[msg.sender]` is ineffective because `lastUpdate[msg.sender]` is never updated (only `lastUpdate[token]` is), allowing the weight update logic to be triggered more frequently than intended, which facilitates pool manipulation."
    }
  ],
  "target_assessment": {
    "found": true,
    "finding_id": 2,
    "type_match": "semantic",
    "type_match_reasoning": "The ground truth labels this 'pool_manipulation'. The finding labels it 'Broken rate-limiting... enables arbitrary repeated weight manipulation', which describes the mechanism for the manipulation.",
    "root_cause_identification": {
      "score": 1.0,
      "reasoning": "Correctly identifies that the mapping key used for the check (msg.sender) is not the one updated in the loop (token)."
    },
    "attack_vector_validity": {
      "score": 1.0,
      "reasoning": "Correctly identifies that this allows rapid weight updates to skew pricing, especially when combined with balance manipulation."
    },
    "fix_suggestion_validity": {
      "score": 1.0,
      "reasoning": "Suggests using a global update timestamp or correctly updating the per-token/per-user timestamp."
    }
  },
  "summary": {
    "total_findings": 3,
    "target_matches": 1,
    "partial_matches": 0,
    "bonus_valid": 2,
    "hallucinated": 0,
    "mischaracterized": 0,
    "design_choice": 0,
    "out_of_scope": 0,
    "security_theater": 0,
    "informational": 0
  },
  "notes": "The auditor found the target vulnerability and two additional critical/high vulnerabilities that are significantly more dangerous than the target itself (specifically the transfer vs transferFrom error).",
  "judge_latency_ms": 6820.988893508911,
  "raw_response": "```json\n{\n  \"overall_verdict\": {\n    \"said_vulnerable\": true,\n    \"confidence_expressed\": 0.93\n  },\n  \"findings\": [\n    {\n      \"finding_id\": 0,\n      \"description\": \"The contract uses transfer() instead of transferFrom() for inbound transfers, and fails to check return values, leading to phantom deposits.\",\n      \"vulnerability_type_claimed\": \"Incorrect ERC20 transfer usage\",\n      \"severity_claimed\": \"critical\",\n      \"location_claimed\": \"swap() and addLiquidity()\",\n      \"matches_target\": false,\n      \"is_valid_concern\": true,\n      \"classification\": \"BONUS_VALID\",\n      \"reasoning\": \"This is a severe, exploitable vulnerability. In LN-44 and LN-101, the contract calls `IERC20(token).transfer(address(this), amount)`. In ERC20, `transfer` sends tokens from `msg.sender` (the contract) to the recipient. To pull tokens from a user, `transferFrom` must be used. As written, the contract attempts to pay itself with its own tokens, fails to actually move user funds, but still increments the internal `balance` variable, allowing users to drain the pool for free.\"\n    },\n    {\n      \"finding_id\": 1,\n      \"description\": \"Unrestricted addToken allows overwriting existing tokens and DoS via list bloating.\",\n      \"vulnerability_type_claimed\": \"Unrestricted token listing\",\n      \"severity_claimed\": \"high\",\n      \"location_claimed\": \"addToken()\",\n      \"matches_target\": false,\n      \"is_valid_concern\": true,\n      \"classification\": \"BONUS_VALID\",\n      \"reasoning\": \"The `addToken` function lacks access control and does not check if a token is already added. An attacker can overwrite the `Token` struct for an existing token (resetting its balance to 0 in the mapping) or bloat the `tokenList` array to make the loops in `updateWeights` exceed the block gas limit.\"\n    },\n    {\n      \"finding_id\": 2,\n      \"description\": \"Broken rate-limiting in updateWeights() due to checking lastUpdate[msg.sender] but updating lastUpdate[token].\",\n      \"vulnerability_type_claimed\": \"Broken rate-limiting\",\n      \"severity_claimed\": \"medium\",\n      \"location_claimed\": \"updateWeights()\",\n      \"matches_target\": true,\n      \"is_valid_concern\": true,\n      \"classification\": \"TARGET_MATCH\",\n      \"reasoning\": \"This correctly identifies the logic error in the ground truth target. The check `block.timestamp - lastUpdate[msg.sender]` is ineffective because `lastUpdate[msg.sender]` is never updated (only `lastUpdate[token]` is), allowing the weight update logic to be triggered more frequently than intended, which facilitates pool manipulation.\",\n    }\n  ],\n  \"target_assessment\": {\n    \"found\": true,\n    \"finding_id\": 2,\n    \"type_match\": \"semantic\",\n    \"type_match_reasoning\": \"The ground truth labels this 'pool_manipulation'. The finding labels it 'Broken rate-limiting... enables arbitrary repeated weight manipulation', which describes the mechanism for the manipulation.\",\n    \"root_cause_identification\": {\n      \"score\": 1.0,\n      \"reasoning\": \"Correctly identifies that the mapping key used for the check (msg.sender) is not the one updated in the loop (token).\"\n    },\n    \"attack_vector_validity\": {\n      \"score\": 1.0,\n      \"reasoning\": \"Correctly identifies that this allows rapid weight updates to skew pricing, especially when combined with balance manipulation.\"\n    },\n    \"fix_suggestion_validity\": {\n      \"score\": 1.0,\n      \"reasoning\": \"Suggests using a global update timestamp or correctly updating the per-token/per-user timestamp.\"\n    }\n  },\n  \"summary\": {\n    \"total_findings\": 3,\n    \"target_matches\": 1,\n    \"partial_matches\": 0,\n    \"bonus_valid\": 2,\n    \"hallucinated\": 0,\n    \"mischaracterized\": 0,\n    \"design_choice\": 0,\n    \"out_of_scope\": 0,\n    \"security_theater\": 0,\n    \"informational\": 0\n  },\n  \"notes\": \"The auditor found the target vulnerability and two additional critical/high vulnerabilities that are significantly more dangerous than the target itself (specifically the transfer vs transferFrom error).\"\n}\n```"
}