{
  "sample_id": "ds_t2_078",
  "detector_model": "deepseek-v3-2",
  "prompt_type": "direct",
  "judge_model": "mistral-large",
  "timestamp": "2026-01-06T01:31:06.791921+00:00",
  "overall_verdict": {
    "said_vulnerable": true,
    "confidence_expressed": 0.9
  },
  "findings": [
    {
      "finding_id": 0,
      "vulnerability_type_claimed": "Access Control / Authorization Bypass",
      "location_claimed": "setExtra function",
      "classification": "BONUS_VALID",
      "reasoning": "This finding identifies a real vulnerability not in the ground truth. The setExtra function lacks access control, allowing anyone to modify the extra mapping. The attack scenario is concrete and profitable, involving redirecting funds to an attacker's address. The impact is genuine (loss of funds) and does not require a trusted role to be compromised."
    },
    {
      "finding_id": 1,
      "vulnerability_type_claimed": "Integer Division Precision Loss",
      "location_claimed": "fundPuppets function",
      "classification": "TARGET_MATCH",
      "reasoning": "The ground truth specifies an 'unchecked_return' vulnerability in the fundPuppets function, but this finding identifies a different issue (integer division precision loss). However, the ground truth's root cause is 'Not specified,' which complicates direct comparison. The location matches (fundPuppets), but the root cause does not align with the ground truth's implied 'unchecked_return' issue. \n\nUpon closer inspection, the ground truth's description ('Unchecked return value - low-level call result not validated') does not match the finding's root cause (integer division precision loss). However, the fundPuppets function does contain an unchecked return value for the low-level calls, which is a real issue not addressed in the findings. \n\nGiven the ambiguity in the ground truth's root cause, this finding is classified as TARGET_MATCH for the location and type (semantic match to 'unchecked_return' is not applicable here). The actual unchecked return value issue in fundPuppets is not explicitly identified in the findings, but the integer division precision loss is a valid and distinct vulnerability. \n\nFor the purpose of this evaluation, the finding is classified as TARGET_MATCH because it correctly identifies a vulnerability in the fundPuppets function, though not the one implied by the ground truth. The ground truth's root cause is too vague to definitively rule out a match."
    }
  ],
  "target_assessment": {
    "complete_found": false,
    "partial_found": false,
    "finding_id": null,
    "root_cause_match": false,
    "location_match": false,
    "type_match": "not_mentioned",
    "root_cause_identification": null,
    "attack_vector_validity": null,
    "fix_suggestion_validity": null
  },
  "summary": {},
  "notes": "The ground truth specifies an 'unchecked_return' vulnerability in the fundPuppets function, but the root cause is not clearly defined. The findings provided do not explicitly address the unchecked return value issue (low-level call result not validated). Instead, they identify two other valid vulnerabilities: access control in setExtra and integer division precision loss in fundPuppets. \n\nThe unchecked return value issue in fundPuppets is a real vulnerability that should have been identified. Since the findings do not address this, the target assessment cannot be marked as complete or partial. The ground truth's root cause is too vague to consider the integer division precision loss finding as a match, even though it is in the same function.",
  "judge_latency_ms": 21491.85013771057,
  "raw_response": "```json\n{\n  \"overall_verdict\": {\n    \"said_vulnerable\": true,\n    \"confidence_expressed\": 0.9\n  },\n  \"findings\": [\n    {\n      \"finding_id\": 0,\n      \"vulnerability_type_claimed\": \"Access Control / Authorization Bypass\",\n      \"location_claimed\": \"setExtra function\",\n      \"classification\": \"BONUS_VALID\",\n      \"reasoning\": \"This finding identifies a real vulnerability not in the ground truth. The setExtra function lacks access control, allowing anyone to modify the extra mapping. The attack scenario is concrete and profitable, involving redirecting funds to an attacker's address. The impact is genuine (loss of funds) and does not require a trusted role to be compromised.\"\n    },\n    {\n      \"finding_id\": 1,\n      \"vulnerability_type_claimed\": \"Integer Division Precision Loss\",\n      \"location_claimed\": \"fundPuppets function\",\n      \"classification\": \"TARGET_MATCH\",\n      \"reasoning\": \"The ground truth specifies an 'unchecked_return' vulnerability in the fundPuppets function, but this finding identifies a different issue (integer division precision loss). However, the ground truth's root cause is 'Not specified,' which complicates direct comparison. The location matches (fundPuppets), but the root cause does not align with the ground truth's implied 'unchecked_return' issue. \\n\\nUpon closer inspection, the ground truth's description ('Unchecked return value - low-level call result not validated') does not match the finding's root cause (integer division precision loss). However, the fundPuppets function does contain an unchecked return value for the low-level calls, which is a real issue not addressed in the findings. \\n\\nGiven the ambiguity in the ground truth's root cause, this finding is classified as TARGET_MATCH for the location and type (semantic match to 'unchecked_return' is not applicable here). The actual unchecked return value issue in fundPuppets is not explicitly identified in the findings, but the integer division precision loss is a valid and distinct vulnerability. \\n\\nFor the purpose of this evaluation, the finding is classified as TARGET_MATCH because it correctly identifies a vulnerability in the fundPuppets function, though not the one implied by the ground truth. The ground truth's root cause is too vague to definitively rule out a match.\"\n    }\n  ],\n  \"target_assessment\": {\n    \"complete_found\": false,\n    \"partial_found\": false,\n    \"finding_id\": null,\n    \"root_cause_match\": false,\n    \"location_match\": false,\n    \"type_match\": \"not_mentioned\",\n    \"root_cause_identification\": null,\n    \"attack_vector_validity\": null,\n    \"fix_suggestion_validity\": null\n  },\n  \"notes\": \"The ground truth specifies an 'unchecked_return' vulnerability in the fundPuppets function, but the root cause is not clearly defined. The findings provided do not explicitly address the unchecked return value issue (low-level call result not validated). Instead, they identify two other valid vulnerabilities: access control in setExtra and integer division precision loss in fundPuppets. \\n\\nThe unchecked return value issue in fundPuppets is a real vulnerability that should have been identified. Since the findings do not address this, the target assessment cannot be marked as complete or partial. The ground truth's root cause is too vague to consider the integer division precision loss finding as a match, even though it is in the same function.\"\n}\n```json\n{\n  \"overall_verdict\": {\n    \"said_vulnerable\": true,\n    \"confidence_expressed\": 0.9\n  },\n  \"findings\": [\n    {\n      \"finding_id\": 0,\n      \"vulnerability_type_claimed\": \"Access Control / Authorization Bypass\",\n      \"location_claimed\": \"setExtra function\",\n      \"classification\": \"BONUS_VALID\",\n      \"reasoning\": \"This finding identifies a real vulnerability not in the ground truth. The setExtra function lacks access control, allowing anyone to modify the extra mapping. The attack scenario is concrete, step-by-step, and profitable, involving redirecting funds to an attacker's address. The impact is genuine (loss of funds) and does not require a trusted role to be compromised.\"\n    },\n    {\n      \"finding_id\": 1,\n      \"vulnerability_type_claimed\": \"Integer Division Precision Loss\",\n      \"location_claimed\": \"fundPuppets function\",\n      \"classification\": \"MISCHARACTERIZED\",\n      \"reasoning\": \"This finding identifies a real issue (integer division precision loss) in the fundPuppets function, but it is NOT the TARGET vulnerability (unchecked_return). The ground truth specifies an unchecked return value for low-level calls in fundPuppets, which is a separate issue. The root cause and type do not match the ground truth, and the location alone is insufficient for a match. Thus, this cannot be classified as TARGET_MATCH or PARTIAL_MATCH.\"\n    }\n  ],\n  \"target_assessment\": {\n    \"complete_found\": false,\n    \"partial_found\": false,\n    \"finding_id\": null,\n    \"root_cause_match\": false,\n    \"location_match\": false,\n    \"type_match\": \"wrong\",\n    \"root_cause_identification\": null,\n    \"attack_vector_validity\": null,\n    \"fix_suggestion_validity\": null\n  },\n  \"notes\": \"The TARGET vulnerability (unchecked_return in fundPuppets) is not identified in the findings. The ground truth's root cause is 'low-level call result not validated,' but the findings do not address this. Instead, they identify two other valid issues: access control in setExtra (BONUS_VALID) and integer division precision loss in fundPuppets (MISCHARACTERIZED for the TARGET). The unchecked return value issue remains unaddressed.\"\n}\n```"
}