{
  "sample_id": "ds_t2_018",
  "detector_model": "deepseek-v3-2",
  "prompt_type": "direct",
  "judge_model": "mistral-large",
  "timestamp": "2026-01-06T01:26:17.669757+00:00",
  "overall_verdict": {
    "said_vulnerable": true,
    "confidence_expressed": 0.95
  },
  "findings": [
    {
      "finding_id": 0,
      "vulnerability_type_claimed": "Incorrect Array Deletion",
      "location_claimed": "deleteElement function",
      "classification": "TARGET_MATCH",
      "reasoning": "\n        1. **Root Cause Match**: The finding correctly identifies that the `delete` keyword only sets the element to its default value (0) but does not remove it from the array, leading to data inconsistency. This matches the ground truth's implied root cause (improper array deletion handling).\n        2. **Location Match**: The finding correctly identifies the `deleteElement` function as the vulnerable location.\n        3. **Type Match**: The claimed type 'Incorrect Array Deletion' is a semantic match to the ground truth's 'logic_error' (both describe a logical flaw in array handling).\n        4. The attack scenario and suggested fix are concrete and valid, aligning with the ground truth's description of the issue and its remediation.\n      "
    }
  ],
  "target_assessment": {
    "complete_found": true,
    "partial_found": false,
    "finding_id": 0,
    "root_cause_match": true,
    "location_match": true,
    "type_match": "semantic",
    "root_cause_identification": {
      "score": 1.0,
      "reasoning": "The finding precisely identifies the root cause: the `delete` keyword does not remove the element from the array, only resets it to default, leading to data inconsistency. This is a technically accurate and complete explanation."
    },
    "attack_vector_validity": {
      "score": 1.0,
      "reasoning": "The attack scenario is concrete and step-by-step, demonstrating how the array's length and state become misleading after deletion. This is a valid and realistic exploit of the vulnerability."
    },
    "fix_suggestion_validity": {
      "score": 1.0,
      "reasoning": "The suggested fix provides two valid alternatives (shifting elements or swapping with the last element) that properly remove the element from the array, directly addressing the root cause."
    }
  },
  "summary": {},
  "notes": "The ground truth did not specify a root cause or attack scenario, but the finding's explanation and scenario are consistent with the implied logic error in array deletion. The type 'Incorrect Array Deletion' is a more precise label than 'logic_error', but it is semantically equivalent for this context.",
  "judge_latency_ms": 10276.470184326172,
  "raw_response": "```json\n{\n  \"overall_verdict\": {\n    \"said_vulnerable\": true,\n    \"confidence_expressed\": 0.95\n  },\n  \"findings\": [\n    {\n      \"finding_id\": 0,\n      \"vulnerability_type_claimed\": \"Incorrect Array Deletion\",\n      \"location_claimed\": \"deleteElement function\",\n      \"classification\": \"TARGET_MATCH\",\n      \"reasoning\": \"\n        1. **Root Cause Match**: The finding correctly identifies that the `delete` keyword only sets the element to its default value (0) but does not remove it from the array, leading to data inconsistency. This matches the ground truth's implied root cause (improper array deletion handling).\n        2. **Location Match**: The finding correctly identifies the `deleteElement` function as the vulnerable location.\n        3. **Type Match**: The claimed type 'Incorrect Array Deletion' is a semantic match to the ground truth's 'logic_error' (both describe a logical flaw in array handling).\n        4. The attack scenario and suggested fix are concrete and valid, aligning with the ground truth's description of the issue and its remediation.\n      \"\n    }\n  ],\n  \"target_assessment\": {\n    \"complete_found\": true,\n    \"partial_found\": false,\n    \"finding_id\": 0,\n    \"root_cause_match\": true,\n    \"location_match\": true,\n    \"type_match\": \"semantic\",\n    \"root_cause_identification\": {\n      \"score\": 1.0,\n      \"reasoning\": \"The finding precisely identifies the root cause: the `delete` keyword does not remove the element from the array, only resets it to default, leading to data inconsistency. This is a technically accurate and complete explanation.\"\n    },\n    \"attack_vector_validity\": {\n      \"score\": 1.0,\n      \"reasoning\": \"The attack scenario is concrete and step-by-step, demonstrating how the array's length and state become misleading after deletion. This is a valid and realistic exploit of the vulnerability.\"\n    },\n    \"fix_suggestion_validity\": {\n      \"score\": 1.0,\n      \"reasoning\": \"The suggested fix provides two valid alternatives (shifting elements or swapping with the last element) that properly remove the element from the array, directly addressing the root cause.\"\n    }\n  },\n  \"notes\": \"The ground truth did not specify a root cause or attack scenario, but the finding's explanation and scenario are consistent with the implied logic error in array deletion. The type 'Incorrect Array Deletion' is a more precise label than 'logic_error', but it is semantically equivalent for this context.\"\n}\n```"
}