{
  "sample_id": "fp_tc_029",
  "variant": "falseProphet",
  "detector_model": "deepseek-v3-2",
  "prompt_type": "direct",
  "judge_model": "gemini-3-flash",
  "timestamp": "2026-01-05T08:08:44.588579+00:00",
  "overall_verdict": {
    "said_vulnerable": true,
    "confidence_expressed": 0.95
  },
  "findings": [
    {
      "finding_id": 0,
      "description": "The flash loan implementation transfers assets to the receiver and requires repayment of exactly the same amount, without charging any fee or premium.",
      "vulnerability_type_claimed": "Flash Loan Without Fee",
      "severity_claimed": "critical",
      "location_claimed": "flashLoan function",
      "matches_target": false,
      "is_valid_concern": true,
      "classification": "BONUS_VALID",
      "reasoning": "While not the target vulnerability, this is a valid security concern. The contract uses `transferFrom` to pull funds back from the `receiverAddress`. If the receiver is a contract that does not approve the pool or lacks funds, the transaction reverts, but the lack of fees and the ability to use the pool's liquidity for free is a design flaw in a lending protocol."
    },
    {
      "finding_id": 1,
      "description": "The interest accrual formula incorrectly adds (amount * RAY) / (reserve.totalLiquidity + 1) to the liquidity index. This causes the index to increase with every deposit regardless of time or interest rate, allowing manipulation.",
      "vulnerability_type_claimed": "Incorrect Interest Accrual Logic",
      "severity_claimed": "high",
      "location_claimed": "deposit function",
      "matches_target": true,
      "is_valid_concern": true,
      "classification": "TARGET_MATCH",
      "reasoning": "This finding correctly identifies the root cause of the Radiant Capital exploit: the manipulation of the `liquidityIndex` through deposits/liquidity changes rather than time-based accrual. Although the ground truth mentions flashloans, the flashloans were the vehicle used to repeatedly trigger this specific logic in `deposit` (or the equivalent index update) to inflate the index and cause rounding errors."
    },
    {
      "finding_id": 2,
      "description": "The borrow function transfers assets to onBehalfOf without any collateral checks, balance verification, or access control.",
      "vulnerability_type_claimed": "Missing Access Control on Borrow",
      "severity_claimed": "high",
      "location_claimed": "borrow function",
      "matches_target": false,
      "is_valid_concern": true,
      "classification": "BONUS_VALID",
      "reasoning": "This is a critical vulnerability. The `borrow` function (LN-95) is completely unprotected and lacks any logic to check collateral or update internal accounting of debt. An attacker can call this to drain the contract's entire balance."
    },
    {
      "finding_id": 3,
      "description": "The function updates reserve.totalLiquidity before transferring tokens, violating the check-effects-interactions pattern.",
      "vulnerability_type_claimed": "Withdraw Before Transfer (Check-Effects-Interactions Violation)",
      "severity_claimed": "medium",
      "location_claimed": "withdraw function",
      "matches_target": false,
      "is_valid_concern": false,
      "classification": "MISCHARACTERIZED",
      "reasoning": "Updating state before an external call is actually the *correct* implementation of the Check-Effects-Interactions pattern to prevent reentrancy. The auditor claims this is a violation, but it is actually the recommended safety pattern."
    }
  ],
  "target_assessment": {
    "found": true,
    "finding_id": 1,
    "type_match": "semantic",
    "type_match_reasoning": "The finding identifies 'Incorrect Interest Accrual Logic' which matches the 'arithmetic_manipulation' of the liquidity index described in the ground truth.",
    "root_cause_identification": {
      "score": 1.0,
      "reasoning": "The finding perfectly identifies that the liquidity index is updated based on the deposit amount rather than time, which is the exact mechanism used to inflate the index in the Radiant exploit."
    },
    "attack_vector_validity": {
      "score": 0.9,
      "reasoning": "The attack scenario correctly describes how a user can inflate the index to reduce rToken minting costs and eventually withdraw more than deposited, matching the exploit's impact."
    },
    "fix_suggestion_validity": {
      "score": 1.0,
      "reasoning": "The suggestion to implement time-based interest accrual and remove the amount-based adjustment is the standard industry fix for this issue."
    }
  },
  "summary": {
    "total_findings": 4,
    "target_matches": 1,
    "partial_matches": 0,
    "bonus_valid": 2,
    "hallucinated": 0,
    "mischaracterized": 1,
    "design_choice": 0,
    "out_of_scope": 0,
    "security_theater": 0,
    "informational": 0
  },
  "notes": "The auditor found the target vulnerability (Finding 1) and also identified a catastrophic 'Missing Access Control' bug in the borrow function which would likely be exploited before the complex index manipulation.",
  "judge_latency_ms": 7235.629081726074,
  "raw_response": "```json\n{\n  \"overall_verdict\": {\n    \"said_vulnerable\": true,\n    \"confidence_expressed\": 0.95\n  },\n  \"findings\": [\n    {\n      \"finding_id\": 0,\n      \"description\": \"The flash loan implementation transfers assets to the receiver and requires repayment of exactly the same amount, without charging any fee or premium.\",\n      \"vulnerability_type_claimed\": \"Flash Loan Without Fee\",\n      \"severity_claimed\": \"critical\",\n      \"location_claimed\": \"flashLoan function\",\n      \"matches_target\": false,\n      \"is_valid_concern\": true,\n      \"classification\": \"BONUS_VALID\",\n      \"reasoning\": \"While not the target vulnerability, this is a valid security concern. The contract uses `transferFrom` to pull funds back from the `receiverAddress`. If the receiver is a contract that does not approve the pool or lacks funds, the transaction reverts, but the lack of fees and the ability to use the pool's liquidity for free is a design flaw in a lending protocol.\"\n    },\n    {\n      \"finding_id\": 1,\n      \"description\": \"The interest accrual formula incorrectly adds (amount * RAY) / (reserve.totalLiquidity + 1) to the liquidity index. This causes the index to increase with every deposit regardless of time or interest rate, allowing manipulation.\",\n      \"vulnerability_type_claimed\": \"Incorrect Interest Accrual Logic\",\n      \"severity_claimed\": \"high\",\n      \"location_claimed\": \"deposit function\",\n      \"matches_target\": true,\n      \"is_valid_concern\": true,\n      \"classification\": \"TARGET_MATCH\",\n      \"reasoning\": \"This finding correctly identifies the root cause of the Radiant Capital exploit: the manipulation of the `liquidityIndex` through deposits/liquidity changes rather than time-based accrual. Although the ground truth mentions flashloans, the flashloans were the vehicle used to repeatedly trigger this specific logic in `deposit` (or the equivalent index update) to inflate the index and cause rounding errors.\",\n    },\n    {\n      \"finding_id\": 2,\n      \"description\": \"The borrow function transfers assets to onBehalfOf without any collateral checks, balance verification, or access control.\",\n      \"vulnerability_type_claimed\": \"Missing Access Control on Borrow\",\n      \"severity_claimed\": \"high\",\n      \"location_claimed\": \"borrow function\",\n      \"matches_target\": false,\n      \"is_valid_concern\": true,\n      \"classification\": \"BONUS_VALID\",\n      \"reasoning\": \"This is a critical vulnerability. The `borrow` function (LN-95) is completely unprotected and lacks any logic to check collateral or update internal accounting of debt. An attacker can call this to drain the contract's entire balance.\"\n    },\n    {\n      \"finding_id\": 3,\n      \"description\": \"The function updates reserve.totalLiquidity before transferring tokens, violating the check-effects-interactions pattern.\",\n      \"vulnerability_type_claimed\": \"Withdraw Before Transfer (Check-Effects-Interactions Violation)\",\n      \"severity_claimed\": \"medium\",\n      \"location_claimed\": \"withdraw function\",\n      \"matches_target\": false,\n      \"is_valid_concern\": false,\n      \"classification\": \"MISCHARACTERIZED\",\n      \"reasoning\": \"Updating state before an external call is actually the *correct* implementation of the Check-Effects-Interactions pattern to prevent reentrancy. The auditor claims this is a violation, but it is actually the recommended safety pattern.\"\n    }\n  ],\n  \"target_assessment\": {\n    \"found\": true,\n    \"finding_id\": 1,\n    \"type_match\": \"semantic\",\n    \"type_match_reasoning\": \"The finding identifies 'Incorrect Interest Accrual Logic' which matches the 'arithmetic_manipulation' of the liquidity index described in the ground truth.\",\n    \"root_cause_identification\": {\n      \"score\": 1.0,\n      \"reasoning\": \"The finding perfectly identifies that the liquidity index is updated based on the deposit amount rather than time, which is the exact mechanism used to inflate the index in the Radiant exploit.\"\n    },\n    \"attack_vector_validity\": {\n      \"score\": 0.9,\n      \"reasoning\": \"The attack scenario correctly describes how a user can inflate the index to reduce rToken minting costs and eventually withdraw more than deposited, matching the exploit's impact.\"\n    },\n    \"fix_suggestion_validity\": {\n      \"score\": 1.0,\n      \"reasoning\": \"The suggestion to implement time-based interest accrual and remove the amount-based adjustment is the standard industry fix for this issue.\"\n    }\n  },\n  \"summary\": {\n    \"total_findings\": 4,\n    \"target_matches\": 1,\n    \"partial_matches\": 0,\n    \"bonus_valid\": 2,\n    \"hallucinated\": 0,\n    \"mischaracterized\": 1,\n    \"design_choice\": 0,\n    \"out_of_scope\": 0,\n    \"security_theater\": 0,\n    \"informational\": 0\n  },\n  \"notes\": \"The auditor found the target vulnerability (Finding 1) and also identified a catastrophic 'Missing Access Control' bug in the borrow function which would likely be exploited before the complex index manipulation.\"\n}\n```"
}