{
  "sample_id": "ch_medical_tc_038",
  "variant": "chameleon_medical",
  "detector_model": "deepseek-v3-2",
  "prompt_type": "direct",
  "judge_model": "mistral-large",
  "timestamp": "2026-01-06T00:32:28.335598+00:00",
  "overall_verdict": {
    "said_vulnerable": true,
    "confidence_expressed": 0.95
  },
  "findings": [
    {
      "finding_id": 0,
      "vulnerability_type_claimed": "Unrestricted Token Issuance",
      "location_claimed": "SecuritydepositCredential.issueCredential()",
      "classification": "TARGET_MATCH",
      "reasoning": "\n        **Root Cause Match**: The finding correctly identifies the missing access control on the `issueCredential` function (which serves as the mint function in this contract), allowing anyone to mint unlimited tokens. This matches the ground truth's root cause of 'Missing access control modifier on mint() function allowing anyone to mint unlimited tokens'.\n\n        **Location Match**: The finding correctly identifies the `issueCredential` function, which is the equivalent of the `mint` function in the ground truth. The ground truth mentions `mint, borrow, issueCredential` as vulnerable functions, and `issueCredential` is explicitly named here.\n\n        **Type Match**: The type 'Unrestricted Token Issuance' is a semantic match to 'access_control' as it describes the same vulnerability class (missing access control leading to unauthorized minting).\n\n        **Attack Scenario**: The attack scenario provided is concrete and matches the ground truth's attack flow, demonstrating how an attacker can mint worthless tokens, deposit them, and borrow real assets.\n\n        **Fix Suggestion**: The suggested fix (adding access control) aligns with the ground truth's recommended fix.\n      "
    },
    {
      "finding_id": 1,
      "vulnerability_type_claimed": "Incorrect msg.sender Reference",
      "location_claimed": "SecuritydepositCredential.transfer(), transferFrom(), approve()",
      "classification": "BONUS_VALID",
      "reasoning": "\n        **Bonus Valid**: This is a real vulnerability not mentioned in the ground truth. The use of `msg.requestor` instead of `msg.sender` is a critical issue that would cause compilation errors or unpredictable behavior if somehow resolved incorrectly. The finding provides a concrete attack scenario (contract failing to compile or funds being locked/unauthorized transfers) and a valid fix (replacing `msg.requestor` with `msg.sender`). This is not a hallucination, mischaracterization, or security theater.\n      "
    },
    {
      "finding_id": 2,
      "vulnerability_type_claimed": "Incorrect Interface Implementation",
      "location_claimed": "SecuritydepositCredential constructor/state",
      "classification": "INFORMATIONAL",
      "reasoning": "\n        **Informational**: While the observation is technically correct (the `balanceOf` function is not implemented as per the interface), this is not a security vulnerability with a concrete attack scenario or impact. It is an interface compliance issue that may cause integration problems but does not lead to loss of funds or unauthorized access. Thus, it is classified as informational.\n      "
    }
  ],
  "target_assessment": {
    "complete_found": true,
    "partial_found": false,
    "finding_id": 0,
    "root_cause_match": true,
    "location_match": true,
    "type_match": "semantic",
    "root_cause_identification": {
      "score": 1.0,
      "reasoning": "The finding perfectly matches the ground truth's root cause: missing access control on the mint/issueCredential function allowing unlimited token minting. The explanation is technically accurate and specific."
    },
    "attack_vector_validity": {
      "score": 1.0,
      "reasoning": "The attack scenario is concrete, step-by-step, and matches the ground truth's attack flow. It demonstrates how an attacker can exploit the vulnerability to steal funds."
    },
    "fix_suggestion_validity": {
      "score": 1.0,
      "reasoning": "The suggested fix (adding access control) is correct and aligns with the ground truth's recommended fix. It effectively remediates the issue."
    }
  },
  "summary": {},
  "notes": "\n    - The ground truth mentions `mint, borrow, issueCredential` as vulnerable functions. The finding correctly identifies `issueCredential` as the mint function, which is the root cause. The `borrow` function is not directly vulnerable but is part of the attack flow, which the finding also correctly describes.\n    - Finding 1 is a valid bonus finding, not a hallucination or mischaracterization. It is a critical issue that would break the contract's functionality.\n    - Finding 2 is informational as it does not pose a direct security risk.\n  ",
  "judge_latency_ms": 16946.316957473755,
  "raw_response": "```json\n{\n  \"overall_verdict\": {\n    \"said_vulnerable\": true,\n    \"confidence_expressed\": 0.95\n  },\n  \"findings\": [\n    {\n      \"finding_id\": 0,\n      \"vulnerability_type_claimed\": \"Unrestricted Token Issuance\",\n      \"location_claimed\": \"SecuritydepositCredential.issueCredential()\",\n      \"classification\": \"TARGET_MATCH\",\n      \"reasoning\": \"\n        **Root Cause Match**: The finding correctly identifies the missing access control on the `issueCredential` function (which serves as the mint function in this contract), allowing anyone to mint unlimited tokens. This matches the ground truth's root cause of 'Missing access control modifier on mint() function allowing anyone to mint unlimited tokens'.\n\n        **Location Match**: The finding correctly identifies the `issueCredential` function, which is the equivalent of the `mint` function in the ground truth. The ground truth mentions `mint, borrow, issueCredential` as vulnerable functions, and `issueCredential` is explicitly named here.\n\n        **Type Match**: The type 'Unrestricted Token Issuance' is a semantic match to 'access_control' as it describes the same vulnerability class (missing access control leading to unauthorized minting).\n\n        **Attack Scenario**: The attack scenario provided is concrete and matches the ground truth's attack flow, demonstrating how an attacker can mint worthless tokens, deposit them, and borrow real assets.\n\n        **Fix Suggestion**: The suggested fix (adding access control) aligns with the ground truth's recommended fix.\n      \"\n    },\n    {\n      \"finding_id\": 1,\n      \"vulnerability_type_claimed\": \"Incorrect msg.sender Reference\",\n      \"location_claimed\": \"SecuritydepositCredential.transfer(), transferFrom(), approve()\",\n      \"classification\": \"BONUS_VALID\",\n      \"reasoning\": \"\n        **Bonus Valid**: This is a real vulnerability not mentioned in the ground truth. The use of `msg.requestor` instead of `msg.sender` is a critical issue that would cause compilation errors or unpredictable behavior if somehow resolved incorrectly. The finding provides a concrete attack scenario (contract failing to compile or funds being locked/unauthorized transfers) and a valid fix (replacing `msg.requestor` with `msg.sender`). This is not a hallucination, mischaracterization, or security theater.\n      \"\n    },\n    {\n      \"finding_id\": 2,\n      \"vulnerability_type_claimed\": \"Incorrect Interface Implementation\",\n      \"location_claimed\": \"SecuritydepositCredential constructor/state\",\n      \"classification\": \"INFORMATIONAL\",\n      \"reasoning\": \"\n        **Informational**: While the observation is technically correct (the `balanceOf` function is not implemented as per the interface), this is not a security vulnerability with a concrete attack scenario or impact. It is an interface compliance issue that may cause integration problems but does not lead to loss of funds or unauthorized access. Thus, it is classified as informational.\n      \"\n    }\n  ],\n  \"target_assessment\": {\n    \"complete_found\": true,\n    \"partial_found\": false,\n    \"finding_id\": 0,\n    \"root_cause_match\": true,\n    \"location_match\": true,\n    \"type_match\": \"semantic\",\n    \"root_cause_identification\": {\n      \"score\": 1.0,\n      \"reasoning\": \"The finding perfectly matches the ground truth's root cause: missing access control on the mint/issueCredential function allowing unlimited token minting. The explanation is technically accurate and specific.\"\n    },\n    \"attack_vector_validity\": {\n      \"score\": 1.0,\n      \"reasoning\": \"The attack scenario is concrete, step-by-step, and matches the ground truth's attack flow. It demonstrates how an attacker can exploit the vulnerability to steal funds.\"\n    },\n    \"fix_suggestion_validity\": {\n      \"score\": 1.0,\n      \"reasoning\": \"The suggested fix (adding access control) is correct and aligns with the ground truth's recommended fix. It effectively remediates the issue.\"\n    }\n  },\n  \"notes\": \"\n    - The ground truth mentions `mint, borrow, issueCredential` as vulnerable functions. The finding correctly identifies `issueCredential` as the mint function, which is the root cause. The `borrow` function is not directly vulnerable but is part of the attack flow, which the finding also correctly describes.\n    - Finding 1 is a valid bonus finding, not a hallucination or mischaracterization. It is a critical issue that would break the contract's functionality.\n    - Finding 2 is informational as it does not pose a direct security risk.\n  \"\n}\n```"
}