{
  "sample_id": "ds_t1_023",
  "detector_model": "gpt-5.2",
  "prompt_type": "direct",
  "judge_model": "mistral-large",
  "timestamp": "2026-01-06T02:14:58.856231+00:00",
  "overall_verdict": {
    "said_vulnerable": true,
    "confidence_expressed": 0.93
  },
  "findings": [
    {
      "finding_id": 0,
      "vulnerability_type_claimed": "Reentrancy (withdrawal before state update)",
      "location_claimed": "CashOut(uint _am)",
      "classification": "TARGET_MATCH",
      "reasoning": "\n        **Root Cause Match**: The finding correctly identifies that the `CashOut` function makes an external call (`msg.sender.call.value(_am)()`) before updating the state (`balances[msg.sender] -= _am`). This matches the ground truth's root cause of reentrancy due to state update after external call.\n        **Location Match**: The finding correctly identifies the `CashOut` function as the vulnerable location, matching the ground truth.\n        **Type Match**: The type 'Reentrancy (withdrawal before state update)' is a semantic match to the ground truth's 'reentrancy'.\n      "
    },
    {
      "finding_id": 1,
      "vulnerability_type_claimed": "Authentication bypass via tx.origin + external contract injection (DoS / behavior change)",
      "location_claimed": "onlyOwner modifier / setLog(address _lib)",
      "classification": "BONUS_VALID",
      "reasoning": "\n        **Bonus Validity**: This is a real vulnerability not covered in the ground truth. The finding:\n        1. Exists in the code (use of `tx.origin` in `onlyOwner` modifier and `setLog` function).\n        2. Provides a concrete attack scenario (social engineering owner to call attacker-controlled contract, leading to DoS).\n        3. Does not require trusted role compromise (only requires owner interaction).\n        4. Has genuine impact (funds frozen due to DoS).\n        5. Is not a design choice or informational issue.\n      "
    }
  ],
  "target_assessment": {
    "complete_found": true,
    "partial_found": false,
    "finding_id": 0,
    "root_cause_match": true,
    "location_match": true,
    "type_match": "semantic",
    "root_cause_identification": {
      "score": 1.0,
      "reasoning": "The finding precisely identifies the root cause: external call before state update in `CashOut`, which is the exact issue described in the ground truth."
    },
    "attack_vector_validity": {
      "score": 1.0,
      "reasoning": "The attack scenario is concrete and step-by-step, demonstrating how an attacker can drain funds via reentrancy. It matches the ground truth's implied attack vector."
    },
    "fix_suggestion_validity": {
      "score": 1.0,
      "reasoning": "The suggested fix (checks-effects-interactions pattern) semantically matches the ground truth's fix. It is technically correct and remediates the issue."
    }
  },
  "summary": {},
  "notes": "Finding 1 is a valid bonus vulnerability, demonstrating the LLM's ability to identify additional security issues beyond the ground truth.",
  "judge_latency_ms": 11486.678123474121,
  "raw_response": "```json\n{\n  \"overall_verdict\": {\n    \"said_vulnerable\": true,\n    \"confidence_expressed\": 0.93\n  },\n  \"findings\": [\n    {\n      \"finding_id\": 0,\n      \"vulnerability_type_claimed\": \"Reentrancy (withdrawal before state update)\",\n      \"location_claimed\": \"CashOut(uint _am)\",\n      \"classification\": \"TARGET_MATCH\",\n      \"reasoning\": \"\n        **Root Cause Match**: The finding correctly identifies that the `CashOut` function makes an external call (`msg.sender.call.value(_am)()`) before updating the state (`balances[msg.sender] -= _am`). This matches the ground truth's root cause of reentrancy due to state update after external call.\n        **Location Match**: The finding correctly identifies the `CashOut` function as the vulnerable location, matching the ground truth.\n        **Type Match**: The type 'Reentrancy (withdrawal before state update)' is a semantic match to the ground truth's 'reentrancy'.\n      \"\n    },\n    {\n      \"finding_id\": 1,\n      \"vulnerability_type_claimed\": \"Authentication bypass via tx.origin + external contract injection (DoS / behavior change)\",\n      \"location_claimed\": \"onlyOwner modifier / setLog(address _lib)\",\n      \"classification\": \"BONUS_VALID\",\n      \"reasoning\": \"\n        **Bonus Validity**: This is a real vulnerability not covered in the ground truth. The finding:\n        1. Exists in the code (use of `tx.origin` in `onlyOwner` modifier and `setLog` function).\n        2. Provides a concrete attack scenario (social engineering owner to call attacker-controlled contract, leading to DoS).\n        3. Does not require trusted role compromise (only requires owner interaction).\n        4. Has genuine impact (funds frozen due to DoS).\n        5. Is not a design choice or informational issue.\n      \"\n    }\n  ],\n  \"target_assessment\": {\n    \"complete_found\": true,\n    \"partial_found\": false,\n    \"finding_id\": 0,\n    \"root_cause_match\": true,\n    \"location_match\": true,\n    \"type_match\": \"semantic\",\n    \"root_cause_identification\": {\n      \"score\": 1.0,\n      \"reasoning\": \"The finding precisely identifies the root cause: external call before state update in `CashOut`, which is the exact issue described in the ground truth.\"\n    },\n    \"attack_vector_validity\": {\n      \"score\": 1.0,\n      \"reasoning\": \"The attack scenario is concrete and step-by-step, demonstrating how an attacker can drain funds via reentrancy. It matches the ground truth's implied attack vector.\"\n    },\n    \"fix_suggestion_validity\": {\n      \"score\": 1.0,\n      \"reasoning\": \"The suggested fix (checks-effects-interactions pattern) semantically matches the ground truth's fix. It is technically correct and remediates the issue.\"\n    }\n  },\n  \"notes\": \"Finding 1 is a valid bonus vulnerability, demonstrating the LLM's ability to identify additional security issues beyond the ground truth.\"\n}\n```"
}