{
  "sample_id": "ds_t1_019",
  "detector_model": "gpt-5.2",
  "prompt_type": "direct",
  "judge_model": "mistral-large",
  "timestamp": "2026-01-06T02:14:22.038289+00:00",
  "overall_verdict": {
    "said_vulnerable": true,
    "confidence_expressed": 0.93
  },
  "findings": [
    {
      "finding_id": 0,
      "vulnerability_type_claimed": "Reentrancy + balance underflow leading to unlimited withdrawals",
      "location_claimed": "Collect(uint _am)",
      "classification": "TARGET_MATCH",
      "reasoning": "\n        **Root Cause Match**: The finding correctly identifies the reentrancy vulnerability in the `Collect` function, where the external call (`msg.sender.call.value()`) is made before updating the state (`balances[msg.sender]`). This matches the ground truth's root cause (reentrancy due to checks-effects-interactions violation). The additional detail about underflow is a valid extension of the reentrancy issue, as it exacerbates the impact.\n        **Location Match**: The finding correctly identifies the `Collect` function, which matches the ground truth.\n        **Type Match**: The type 'Reentrancy' is explicitly mentioned and is an exact match to the ground truth. The additional 'balance underflow' is a valid secondary issue but does not detract from the primary reentrancy match.\n      "
    },
    {
      "finding_id": 1,
      "vulnerability_type_claimed": "Unprotected initialization allows permanent funds lock (DoS)",
      "location_claimed": "SetMinSum, SetLogFile, Initialized",
      "classification": "BONUS_VALID",
      "reasoning": "\n        **Bonus Validity**: This is a real vulnerability not covered in the ground truth. The finding:\n        1. Exists in the code (unprotected initialization functions).\n        2. Provides a concrete attack scenario (setting `MinSum` to an impossibly large value and locking the contract).\n        3. Does not require a trusted role to be compromised (anyone can call the functions).\n        4. Has genuine impact (permanent fund lock).\n        5. Is not a design choice or informational issue.\n      "
    }
  ],
  "target_assessment": {
    "complete_found": true,
    "partial_found": false,
    "finding_id": 0,
    "root_cause_match": true,
    "location_match": true,
    "type_match": "exact",
    "root_cause_identification": {
      "score": 1.0,
      "reasoning": "\n        The finding precisely identifies the root cause of the reentrancy vulnerability (external call before state update) and even extends it with a valid secondary issue (underflow). This matches the ground truth's root cause and provides additional technically accurate details.\n      "
    },
    "attack_vector_validity": {
      "score": 1.0,
      "reasoning": "\n        The attack scenario is concrete and step-by-step, demonstrating how an attacker can exploit the reentrancy and underflow to drain funds. It aligns with the ground truth's implied attack vector (reentrancy) and adds valid details about underflow exploitation.\n      "
    },
    "fix_suggestion_validity": {
      "score": 1.0,
      "reasoning": "\n        The suggested fix (checks-effects-interactions, reentrancy guard, and SafeMath) directly addresses the root cause and matches the ground truth's recommended fix. The example provided is correct and remediates the issue.\n      "
    }
  },
  "summary": {},
  "notes": "\n    The LLM's output is highly accurate for the TARGET vulnerability (reentrancy in `Collect`). The additional finding about unprotected initialization is a valid bonus, demonstrating thorough analysis beyond the ground truth.\n  ",
  "judge_latency_ms": 15295.923948287964,
  "raw_response": "```json\n{\n  \"overall_verdict\": {\n    \"said_vulnerable\": true,\n    \"confidence_expressed\": 0.93\n  },\n  \"findings\": [\n    {\n      \"finding_id\": 0,\n      \"vulnerability_type_claimed\": \"Reentrancy + balance underflow leading to unlimited withdrawals\",\n      \"location_claimed\": \"Collect(uint _am)\",\n      \"classification\": \"TARGET_MATCH\",\n      \"reasoning\": \"\n        **Root Cause Match**: The finding correctly identifies the reentrancy vulnerability in the `Collect` function, where the external call (`msg.sender.call.value()`) is made before updating the state (`balances[msg.sender]`). This matches the ground truth's root cause (reentrancy due to checks-effects-interactions violation). The additional detail about underflow is a valid extension of the reentrancy issue, as it exacerbates the impact.\n        **Location Match**: The finding correctly identifies the `Collect` function, which matches the ground truth.\n        **Type Match**: The type 'Reentrancy' is explicitly mentioned and is an exact match to the ground truth. The additional 'balance underflow' is a valid secondary issue but does not detract from the primary reentrancy match.\n      \"\n    },\n    {\n      \"finding_id\": 1,\n      \"vulnerability_type_claimed\": \"Unprotected initialization allows permanent funds lock (DoS)\",\n      \"location_claimed\": \"SetMinSum, SetLogFile, Initialized\",\n      \"classification\": \"BONUS_VALID\",\n      \"reasoning\": \"\n        **Bonus Validity**: This is a real vulnerability not covered in the ground truth. The finding:\n        1. Exists in the code (unprotected initialization functions).\n        2. Provides a concrete attack scenario (setting `MinSum` to an impossibly large value and locking the contract).\n        3. Does not require a trusted role to be compromised (anyone can call the functions).\n        4. Has genuine impact (permanent fund lock).\n        5. Is not a design choice or informational issue.\n      \"\n    }\n  ],\n  \"target_assessment\": {\n    \"complete_found\": true,\n    \"partial_found\": false,\n    \"finding_id\": 0,\n    \"root_cause_match\": true,\n    \"location_match\": true,\n    \"type_match\": \"exact\",\n    \"root_cause_identification\": {\n      \"score\": 1.0,\n      \"reasoning\": \"\n        The finding precisely identifies the root cause of the reentrancy vulnerability (external call before state update) and even extends it with a valid secondary issue (underflow). This matches the ground truth's root cause and provides additional technically accurate details.\n      \"\n    },\n    \"attack_vector_validity\": {\n      \"score\": 1.0,\n      \"reasoning\": \"\n        The attack scenario is concrete and step-by-step, demonstrating how an attacker can exploit the reentrancy and underflow to drain funds. It aligns with the ground truth's implied attack vector (reentrancy) and adds valid details about underflow exploitation.\n      \"\n    },\n    \"fix_suggestion_validity\": {\n      \"score\": 1.0,\n      \"reasoning\": \"\n        The suggested fix (checks-effects-interactions, reentrancy guard, and SafeMath) directly addresses the root cause and matches the ground truth's recommended fix. The example provided is correct and remediates the issue.\n      \"\n    }\n  },\n  \"notes\": \"\n    The LLM's output is highly accurate for the TARGET vulnerability (reentrancy in `Collect`). The additional finding about unprotected initialization is a valid bonus, demonstrating thorough analysis beyond the ground truth.\n  \"\n}\n```"
}