{
  "sample_id": "ds_t4_011",
  "detector_model": "gemini-3-pro",
  "prompt_type": "direct",
  "judge_model": "mistral-large",
  "timestamp": "2026-01-06T01:50:51.576875+00:00",
  "overall_verdict": {
    "said_vulnerable": true,
    "confidence_expressed": 1.0
  },
  "findings": [
    {
      "finding_id": 0,
      "vulnerability_type_claimed": "Integer Overflow",
      "location_claimed": "PausableToken.batchTransfer",
      "classification": "TARGET_MATCH",
      "reasoning": "\n        1. **Root Cause Match**: The finding correctly identifies the integer overflow vulnerability in the multiplication `uint256 amount = uint256(cnt) * _value;` within the `batchTransfer` function. This matches the ground truth's description of an integer overflow/underflow vulnerability due to unsafe arithmetic operations.\n        2. **Location Match**: The finding specifies the exact function `PausableToken.batchTransfer`, which matches the ground truth's vulnerable function.\n        3. **Type Match**: The finding labels the vulnerability as 'Integer Overflow', which is a semantic match to the ground truth's 'integer_issues'. Both refer to the same class of vulnerability.\n        4. The attack scenario is concrete and demonstrates a valid exploit path, and the suggested fix is correct and aligns with the ground truth's recommendation to use SafeMath or Solidity 0.8+.\n      "
    }
  ],
  "target_assessment": {
    "complete_found": true,
    "partial_found": false,
    "finding_id": 0,
    "root_cause_match": true,
    "location_match": true,
    "type_match": "semantic",
    "root_cause_identification": {
      "score": 1.0,
      "reasoning": "The finding precisely identifies the root cause as the unsafe multiplication operation in `batchTransfer` that can overflow, which is the exact issue described in the ground truth."
    },
    "attack_vector_validity": {
      "score": 1.0,
      "reasoning": "The attack scenario is technically accurate and provides a step-by-step exploit that would work in practice, demonstrating a concrete and profitable attack vector."
    },
    "fix_suggestion_validity": {
      "score": 1.0,
      "reasoning": "The suggested fix (using SafeMath's `mul` function) is correct and directly addresses the root cause of the vulnerability."
    }
  },
  "summary": {},
  "notes": "The finding is a strong TARGET_MATCH, with high-quality root cause identification, attack vector explanation, and fix suggestion. No partial or bonus findings are applicable here.",
  "judge_latency_ms": 9336.3938331604,
  "raw_response": "```json\n{\n  \"overall_verdict\": {\n    \"said_vulnerable\": true,\n    \"confidence_expressed\": 1.0\n  },\n  \"findings\": [\n    {\n      \"finding_id\": 0,\n      \"vulnerability_type_claimed\": \"Integer Overflow\",\n      \"location_claimed\": \"PausableToken.batchTransfer\",\n      \"classification\": \"TARGET_MATCH\",\n      \"reasoning\": \"\n        1. **Root Cause Match**: The finding correctly identifies the integer overflow vulnerability in the multiplication `uint256 amount = uint256(cnt) * _value;` within the `batchTransfer` function. This matches the ground truth's description of an integer overflow/underflow vulnerability due to unsafe arithmetic operations.\n        2. **Location Match**: The finding specifies the exact function `PausableToken.batchTransfer`, which matches the ground truth's vulnerable function.\n        3. **Type Match**: The finding labels the vulnerability as 'Integer Overflow', which is a semantic match to the ground truth's 'integer_issues'. Both refer to the same class of vulnerability.\n        4. The attack scenario is concrete and demonstrates a valid exploit path, and the suggested fix is correct and aligns with the ground truth's recommendation to use SafeMath or Solidity 0.8+.\n      \"\n    }\n  ],\n  \"target_assessment\": {\n    \"complete_found\": true,\n    \"partial_found\": false,\n    \"finding_id\": 0,\n    \"root_cause_match\": true,\n    \"location_match\": true,\n    \"type_match\": \"semantic\",\n    \"root_cause_identification\": {\n      \"score\": 1.0,\n      \"reasoning\": \"The finding precisely identifies the root cause as the unsafe multiplication operation in `batchTransfer` that can overflow, which is the exact issue described in the ground truth.\"\n    },\n    \"attack_vector_validity\": {\n      \"score\": 1.0,\n      \"reasoning\": \"The attack scenario is technically accurate and provides a step-by-step exploit that would work in practice, demonstrating a concrete and profitable attack vector.\"\n    },\n    \"fix_suggestion_validity\": {\n      \"score\": 1.0,\n      \"reasoning\": \"The suggested fix (using SafeMath's `mul` function) is correct and directly addresses the root cause of the vulnerability.\"\n    }\n  },\n  \"notes\": \"The finding is a strong TARGET_MATCH, with high-quality root cause identification, attack vector explanation, and fix suggestion. No partial or bonus findings are applicable here.\"\n}\n```"
}