{
  "sample_id": "gs_022",
  "dataset": "gs",
  "prompt_type": "context_protocol_cot_naturalistic",
  "model": "gemini-3-pro-hyper-extended",
  "timestamp": "2026-01-05T15:44:52.134803+00:00",
  "ground_truth": {
    "is_vulnerable": true,
    "vulnerability_type": "logic_error",
    "vulnerable_functions": [
      "updatePositionManager"
    ],
    "severity": "medium",
    "description": "Staking.allocateETH() forwards ETH to LiquidityBuffer.depositETH(), which auto-allocates to defaultManagerId when shouldExecuteAllocation is true. If the current default manager is deactivated via LiquidityBuffer.updatePositionManager()/togglePositionManagerStatus() without first switching defaultManagerId or disabling auto-allocation, _allocateETHToManager(defaultManagerId, \u2026) reverts with LiquidityBuffer__ManagerInactive(). This can unexpectedly block allocation flows.",
    "root_cause": "Staking.allocateETH() forwards ETH to LiquidityBuffer.depositETH(), which auto-allocates to defaultManagerId when shouldExecuteAllocation is true. If the current default manager is deactivated via LiquidityBuffer.updatePositionManager()/togglePositionManagerStatus() without first switching defaultManagerId or disabling auto-allocation, _allocateETHToManager(defaultManagerId, \u2026) reverts with LiquidityBuffer__ManagerInactive(). This can unexpectedly block allocation flows.",
    "attack_scenario": "1. Admin sets defaultManagerId to manager 0 with shouldExecuteAllocation = true\n2. Admin calls togglePositionManagerStatus(0) to deactivate the default manager\n3. User calls Staking.allocateETH() which forwards to LiquidityBuffer.depositETH()\n4. depositETH() calls _allocateETHToManager(defaultManagerId, msg.value)\n5. _allocateETHToManager reverts with LiquidityBuffer__ManagerInactive() because the default manager is inactive\n6. All allocation flows are blocked until admin either reactivates the manager or changes defaultManagerId",
    "fix_description": "Prevent deactivation of the current defaultManagerId while auto-allocation is enabled: require shouldExecuteAllocation == false or switch defaultManagerId to an active manager before deactivation.",
    "language": "solidity"
  },
  "prediction": {
    "verdict": "vulnerable",
    "confidence": 0.95,
    "vulnerabilities": [
      {
        "type": "Denial of Service",
        "severity": "high",
        "vulnerable_function": "onlyPositionManagerContract",
        "location": "Modifier 'onlyPositionManagerContract' used in 'receiveETHFromPositionManager'",
        "explanation": "The modifier iterates through all position managers (0 to positionManagerCount) to validate the sender. As this modifier is applied to the function that receives ETH, if the number of position managers grows large, the gas cost of this loop will exceed the block gas limit or the stipend provided by the sender. This will cause the transaction to revert.",
        "attack_scenario": "1. An admin adds 50+ position managers (active or inactive) over time. 2. A user or admin attempts to withdraw funds from a valid Position Manager via `withdrawAndReturn`. 3. The Position Manager attempts to send ETH back to the Buffer. 4. The Buffer's `receiveETHFromPositionManager` triggers the modifier. 5. The loop consumes all gas and reverts. 6. Funds cannot be withdrawn from the Position Manager.",
        "suggested_fix": "Replace the loop with a mapping check. You already have `mapping(address => bool) public isRegisteredManager`. Use `if (!isRegisteredManager[msg.sender]) revert...` instead of iterating."
      },
      {
        "type": "Accounting Inconsistency",
        "severity": "medium",
        "vulnerable_function": "receiveETHFromPositionManager",
        "location": "Function 'receiveETHFromPositionManager'",
        "explanation": "The function accepts ETH but does not update `pendingPrincipal` or `pendingInterest`. If a Position Manager sends ETH outside of a standard withdrawal flow (e.g. airdrop, forced exit, or rebasing distribution), the contract balance increases but the internal accounting does not.",
        "attack_scenario": "1. A Position Manager sends 1 ETH to the Buffer without a `withdraw` call triggering it. 2. `address(this).balance` increases by 1 ETH. 3. `pendingPrincipal` remains unchanged. 4. The admin tries to allocate this 1 ETH using `allocateETHToManager`. 5. The function checks `if (amount > pendingPrincipal)`. 6. If `pendingPrincipal` is 0 (all funds allocated), the allocation fails, and the 1 ETH is effectively stuck in the contract.",
        "suggested_fix": "Implement a 'skim' or 'sync' function that allows an admin to detect excess ETH in the contract balance (balance > pendingPrincipal + pendingInterest) and attribute it to either principal or interest (likely interest/fees)."
      },
      {
        "type": "Gas Inefficiency / Potential DoS",
        "severity": "medium",
        "vulnerable_function": "getControlledBalance",
        "location": "Function 'getControlledBalance'",
        "explanation": "This view function iterates through all position managers and makes an external call to each. While currently a view function, if this is ever used on-chain (e.g. by the Staking contract to calculate total value locked), it will revert when the number of managers grows.",
        "attack_scenario": "If the Staking contract relies on `getControlledBalance` to determine the exchange rate of mETH, adding too many position managers will break the exchange rate calculation, potentially freezing the entire staking protocol.",
        "suggested_fix": "Remove the loop. Track the total balance using a state variable (e.g., `totalAllocatedBalance` which you already have) and rely on that. If you need real-time underlying balances (for rebasing tokens), you must limit the number of active managers significantly."
      }
    ],
    "overall_explanation": "The contract has a critical design flaw in how it validates Position Managers during ETH receipt. The O(N) loop in the `onlyPositionManagerContract` modifier creates a dangerous Denial of Service vector that could permanently lock funds in Position Managers. Additionally, the accounting system is rigid and does not account for passive ETH receipt, which could lead to stuck funds. The use of loops in view functions also suggests scalability issues."
  },
  "parsing": {
    "success": true,
    "errors": [],
    "raw_response": "Here is the step-by-step analysis of the `LiquidityBuffer` contract.\n\n### Step 1: Understand the Protocol\nThe `LiquidityBuffer` acts as a middle layer between a Staking contract (mETH) and various yield sources (Position Managers, e.g., Aave).\n- **Inflow:** ETH comes from Staking -> Buffer.\n- **Allocation:** Buffer -> Position Managers (to earn yield).\n- **Outflow:** Position Managers -> Buffer -> Staking (for withdrawals or interest distribution).\n- **Accounting:** It strictly tracks `pendingPrincipal` (ETH belonging to stakers) vs `pendingInterest` (yield earned).\n\n### Step 2: Trace the Code Flow\n1.  **Deposit Flow:** `depositETH` is called by `LIQUIDITY_MANAGER_ROLE`. It updates `totalFundsReceived` and `pendingPrincipal`. If `shouldExecuteAllocation` is true, it immediately calls `_allocateETHToManager`.\n2.  **Allocation Flow:** `_allocateETHToManager` checks caps, updates `allocatedBalance`, decreases `pendingPrincipal`, and calls `manager.deposit{value: amount}`.\n3.  **Withdrawal Flow:** `withdrawAndReturn` calls `_withdrawETHFromManager` (pulls from manager to buffer) then `_returnETHToStaking` (sends buffer to staking).\n4.  **Interest Flow:** `claimInterestFromManager` calculates yield (`underlying - allocated`), withdraws it, and adds to `pendingInterest`. Then `topUpInterestToStaking` sends it to the staking contract minus fees.\n\n### Step 3: Identify Potential Issues\n\n*   **Gas Bomb in `getControlledBalance`:** The function iterates through *all* position managers and makes an external call (`getUnderlyingBalance`) to each. If the number of managers grows, this view function could revert due to gas limits. While it's a view function, if other contracts rely on it on-chain, it's a denial of service vector.\n*   **Reentrancy Risks:** The contract follows Checks-Effects-Interactions (CEI) generally well. However, `receiveETHFromPositionManager` is `payable` and open to `onlyPositionManagerContract`.\n*   **Access Control on `depositETH`:** The function `depositETH` is restricted to `LIQUIDITY_MANAGER_ROLE`. In the `initialize` function, the `stakingContract` is granted this role. However, `depositETH` is `payable`. If the staking contract sends ETH via `call` (which it likely does), this works. But if a normal EOA with the role calls it, `msg.sender` is the EOA, not the staking contract. The logic assumes `msg.value` is the amount to record.\n*   **The \"Double Accounting\" Bug in `depositETH`:**\n    *   `depositETH` calls `_receiveETHFromStaking(msg.value)`.\n    *   `_receiveETHFromStaking` increases `pendingPrincipal` by `msg.value`.\n    *   If `shouldExecuteAllocation` is true, it calls `_allocateETHToManager(defaultManagerId, msg.value)`.\n    *   `_allocateETHToManager` *decreases* `pendingPrincipal` by `amount`.\n    *   Net result: `pendingPrincipal` stays flat? No, wait.\n        *   Start: Principal = 0.\n        *   Deposit 10 ETH. `_receive` -> Principal = 10.\n        *   Allocate 10 ETH. `_allocate` -> Principal = 0.\n    *   This logic implies `pendingPrincipal` tracks *idle* ETH in the buffer, not total principal owned by stakers.\n    *   However, look at `_returnETHToStaking`. It checks `if (amount > pendingPrincipal) revert`.\n    *   **CRITICAL FLAW:** If I deposit 10 ETH and it auto-allocates, `pendingPrincipal` becomes 0. If I then try to withdraw that 10 ETH via `withdrawAndReturn`, the function calls `_withdrawETHFromManager` (which increases `pendingPrincipal` back to 10) and then `_returnETHToStaking` (which decreases it). This logic actually seems consistent for *idle* tracking, but let's look closer at `_withdrawETHFromManager`.\n    *   `_withdrawETHFromManager`: `pendingPrincipal += amount`.\n    *   Okay, the accounting seems to be: `pendingPrincipal` = ETH sitting in this contract's balance that belongs to principal (not interest).\n\n*   **The `receiveETHFromPositionManager` Vulnerability:**\n    *   This function is `payable` and protected by `onlyPositionManagerContract`.\n    *   It has an empty body: `// The ETH is already in the contract balance`.\n    *   **Scenario:** A Position Manager (e.g., a wrapper around Aave) sends ETH back to the Buffer during a `withdraw` call.\n    *   The `_withdrawETHFromManager` function calls `manager.withdraw(amount)`.\n    *   The manager sends ETH. `receiveETHFromPositionManager` triggers.\n    *   The `_withdrawETHFromManager` function *already* updated `pendingPrincipal += amount`.\n    *   This looks fine for standard withdrawals.\n    *   **BUT**, what if a Position Manager sends ETH *without* being asked (e.g., a forced exit, or a rebasing token distribution converted to ETH)?\n    *   The ETH lands in the contract. `pendingPrincipal` is **NOT** updated. `pendingInterest` is **NOT** updated.\n    *   The ETH is effectively \"stuck\" in the contract's balance but invisible to the accounting system.\n    *   Later, `_allocateETHToManager` checks `address(this).balance`. It sees the extra ETH. It allows allocating it.\n    *   `_allocateETHToManager` decreases `pendingPrincipal`.\n    *   If `pendingPrincipal` is low, allocation might fail or underflow (though Solidity 0.8 protects underflow).\n    *   If `pendingPrincipal` is high enough, we allocate the \"stuck\" ETH.\n    *   When we withdraw it later, `pendingPrincipal` increases.\n    *   **Result:** The accounting drifts from reality if funds enter passively.\n\n*   **The Loop in `onlyPositionManagerContract`:**\n    *   This modifier iterates over `positionManagerCount`.\n    *   If an attacker (with `POSITION_MANAGER_ROLE`) adds a large number of managers (even inactive ones), this modifier becomes extremely gas heavy.\n    *   This modifier is used in `receiveETHFromPositionManager`.\n    *   If the loop is too large, `receiveETHFromPositionManager` runs out of gas.\n    *   **Impact:** Position Managers cannot send ETH back. Withdrawals fail. Funds are locked.\n\n### Step 4: Validate Concerns\n\n1.  **DoS via Array Iteration (High Severity):**\n    The `onlyPositionManagerContract` modifier iterates `0` to `positionManagerCount`.\n    The `addPositionManager` function allows adding infinite managers.\n    If `positionManagerCount` gets large (e.g., 50-100+ depending on block limits), the `receiveETHFromPositionManager` function will revert due to Out of Gas.\n    Since `_withdrawETHFromManager` calls `manager.withdraw()`, which likely attempts to send ETH back to `receiveETHFromPositionManager`, **withdrawals will permanently fail**.\n    This is a classic Denial of Service.\n\n2.  **Accounting Drift / Stuck Funds (Medium Severity):**\n    If a Position Manager sends ETH voluntarily (not triggered by `withdraw` or `claimInterest`), the ETH hits `receiveETHFromPositionManager`.\n    The function does not update `pendingPrincipal` or `pendingInterest`.\n    The contract balance increases, but the internal accounting variables do not.\n    While `_allocateETHToManager` checks `address(this).balance`, it *also* requires `amount <= pendingPrincipal`.\n    If `pendingPrincipal` is 0 (all funds allocated), you cannot allocate this extra ETH.\n    You cannot withdraw it (requires `allocatedBalance`).\n    You cannot claim it as interest (requires `getInterestAmount` calculation which relies on `getUnderlyingBalance`).\n    The funds are essentially stuck unless a specific sequence of accounting shifts happens.\n\n3.  **Access Control / Initialization (Low/Config):**\n    `_grantRole(LIQUIDITY_MANAGER_ROLE, address(stakingContract));` is in `initialize`.\n    But `depositETH` is `onlyRole(LIQUIDITY_MANAGER_ROLE)`.\n    If the Staking contract is the *only* entity meant to deposit, this is fine.\n    But if the `init.liquidityManager` (an EOA or multisig) calls `depositETH`, the event `ETHReceivedFromStaking` is emitted, which is misleading off-chain data, though not a security vulnerability on-chain.\n\n### Analysis Conclusion\nThe most critical issue is the O(N) loop in the `onlyPositionManagerContract` modifier which is executed during the `receive` flow. This can lead to permanent fund locking if the array grows too large.\n\n```json\n{\n  \"verdict\": \"vulnerable\",\n  \"confidence\": 0.95,\n  \"vulnerabilities\": [\n    {\n      \"type\": \"Denial of Service\",\n      \"severity\": \"high\",\n      \"vulnerable_function\": \"onlyPositionManagerContract\",\n      \"location\": \"Modifier 'onlyPositionManagerContract' used in 'receiveETHFromPositionManager'\",\n      \"explanation\": \"The modifier iterates through all position managers (0 to positionManagerCount) to validate the sender. As this modifier is applied to the function that receives ETH, if the number of position managers grows large, the gas cost of this loop will exceed the block gas limit or the stipend provided by the sender. This will cause the transaction to revert.\",\n      \"attack_scenario\": \"1. An admin adds 50+ position managers (active or inactive) over time. 2. A user or admin attempts to withdraw funds from a valid Position Manager via `withdrawAndReturn`. 3. The Position Manager attempts to send ETH back to the Buffer. 4. The Buffer's `receiveETHFromPositionManager` triggers the modifier. 5. The loop consumes all gas and reverts. 6. Funds cannot be withdrawn from the Position Manager.\",\n      \"suggested_fix\": \"Replace the loop with a mapping check. You already have `mapping(address => bool) public isRegisteredManager`. Use `if (!isRegisteredManager[msg.sender]) revert...` instead of iterating.\"\n    },\n    {\n      \"type\": \"Accounting Inconsistency\",\n      \"severity\": \"medium\",\n      \"vulnerable_function\": \"receiveETHFromPositionManager\",\n      \"location\": \"Function 'receiveETHFromPositionManager'\",\n      \"explanation\": \"The function accepts ETH but does not update `pendingPrincipal` or `pendingInterest`. If a Position Manager sends ETH outside of a standard withdrawal flow (e.g. airdrop, forced exit, or rebasing distribution), the contract balance increases but the internal accounting does not.\",\n      \"attack_scenario\": \"1. A Position Manager sends 1 ETH to the Buffer without a `withdraw` call triggering it. 2. `address(this).balance` increases by 1 ETH. 3. `pendingPrincipal` remains unchanged. 4. The admin tries to allocate this 1 ETH using `allocateETHToManager`. 5. The function checks `if (amount > pendingPrincipal)`. 6. If `pendingPrincipal` is 0 (all funds allocated), the allocation fails, and the 1 ETH is effectively stuck in the contract.\",\n      \"suggested_fix\": \"Implement a 'skim' or 'sync' function that allows an admin to detect excess ETH in the contract balance (balance > pendingPrincipal + pendingInterest) and attribute it to either principal or interest (likely interest/fees).\"\n    },\n    {\n      \"type\": \"Gas Inefficiency / Potential DoS\",\n      \"severity\": \"medium\",\n      \"vulnerable_function\": \"getControlledBalance\",\n      \"location\": \"Function 'getControlledBalance'\",\n      \"explanation\": \"This view function iterates through all position managers and makes an external call to each. While currently a view function, if this is ever used on-chain (e.g. by the Staking contract to calculate total value locked), it will revert when the number of managers grows.\",\n      \"attack_scenario\": \"If the Staking contract relies on `getControlledBalance` to determine the exchange rate of mETH, adding too many position managers will break the exchange rate calculation, potentially freezing the entire staking protocol.\",\n      \"suggested_fix\": \"Remove the loop. Track the total balance using a state variable (e.g., `totalAllocatedBalance` which you already have) and rely on that. If you need real-time underlying balances (for rebasing tokens), you must limit the number of active managers significantly.\"\n    }\n  ],\n  \"overall_explanation\": \"The contract has a critical design flaw in how it validates Position Managers during ETH receipt. The O(N) loop in the `onlyPositionManagerContract` modifier creates a dangerous Denial of Service vector that could permanently lock funds in Position Managers. Additionally, the accounting system is rigid and does not account for passive ETH receipt, which could lead to stuck funds. The use of loops in view functions also suggests scalability issues.\"\n}\n```"
  },
  "context_info": {
    "has_context_files": true,
    "context_file_count": 1,
    "has_protocol_doc": true
  },
  "api_metrics": {
    "input_tokens": 6271,
    "output_tokens": 3089,
    "latency_ms": 33976.79591178894
  }
}