{
  "sample_id": "tr_tc_038",
  "variant": "trojan",
  "detector_model": "claude-opus-4-5",
  "prompt_type": "direct",
  "judge_model": "mistral-large",
  "timestamp": "2026-01-06T00:32:08.739370+00:00",
  "overall_verdict": {
    "said_vulnerable": true,
    "confidence_expressed": 0.95
  },
  "findings": [
    {
      "finding_id": 0,
      "vulnerability_type_claimed": "Unrestricted Mint Function",
      "location_claimed": "CollateralToken.mint()",
      "classification": "TARGET_MATCH",
      "reasoning": "\n        - **Root Cause Match**: The finding correctly identifies the missing access control modifier on the `mint()` function, allowing anyone to mint unlimited tokens. This matches the ground truth's specific root cause exactly.\n        - **Location Match**: The finding correctly identifies the `mint()` function, which is one of the two functions specified in the ground truth (`mint`, `borrow`).\n        - **Type Match**: The type 'Unrestricted Mint Function' is a semantic match to 'access_control' as it describes the same vulnerability class (missing access control).\n        - The attack scenario and suggested fix are also accurate and align with the ground truth.\n      "
    },
    {
      "finding_id": 1,
      "vulnerability_type_claimed": "Unchecked Return Value",
      "location_claimed": "CollateralVault - multiple functions",
      "classification": "BONUS_VALID",
      "reasoning": "\n        - The finding identifies a real vulnerability (unchecked return values of `transfer()` and `transferFrom()`) that is not part of the ground truth.\n        - The issue is concrete and actionable, with a clear attack scenario (silent failures leading to state inconsistency).\n        - The impact is genuine (potential loss of funds or manipulation of vault state).\n        - The vulnerability does not require a trusted role to be compromised and is not a design choice or informational issue.\n      "
    }
  ],
  "target_assessment": {
    "complete_found": true,
    "partial_found": false,
    "finding_id": 0,
    "root_cause_match": true,
    "location_match": true,
    "type_match": "semantic",
    "root_cause_identification": {
      "score": 1.0,
      "reasoning": "The finding's explanation of the root cause (missing access control on `mint()`) is technically accurate and semantically matches the ground truth exactly."
    },
    "attack_vector_validity": {
      "score": 1.0,
      "reasoning": "The attack scenario is concrete, step-by-step, and aligns perfectly with the ground truth's attack flow. It demonstrates a clear and profitable exploit."
    },
    "fix_suggestion_validity": {
      "score": 1.0,
      "reasoning": "The suggested fix (adding an `onlyOwner` modifier) is correct and matches the ground truth's recommended remediation (role-based access control)."
    }
  },
  "summary": {},
  "notes": "\n    - Finding 0 is a perfect TARGET_MATCH, meeting all criteria for root cause, location, and type.\n    - Finding 1 is a valid bonus finding, as it identifies a real and impactful vulnerability not covered by the ground truth.\n    - The LLM's confidence score (0.95) is justified given the accuracy of the findings.\n  ",
  "judge_latency_ms": 11985.096216201782,
  "raw_response": "```json\n{\n  \"overall_verdict\": {\n    \"said_vulnerable\": true,\n    \"confidence_expressed\": 0.95\n  },\n  \"findings\": [\n    {\n      \"finding_id\": 0,\n      \"vulnerability_type_claimed\": \"Unrestricted Mint Function\",\n      \"location_claimed\": \"CollateralToken.mint()\",\n      \"classification\": \"TARGET_MATCH\",\n      \"reasoning\": \"\n        - **Root Cause Match**: The finding correctly identifies the missing access control modifier on the `mint()` function, allowing anyone to mint unlimited tokens. This matches the ground truth's specific root cause exactly.\n        - **Location Match**: The finding correctly identifies the `mint()` function, which is one of the two functions specified in the ground truth (`mint`, `borrow`).\n        - **Type Match**: The type 'Unrestricted Mint Function' is a semantic match to 'access_control' as it describes the same vulnerability class (missing access control).\n        - The attack scenario and suggested fix are also accurate and align with the ground truth.\n      \"\n    },\n    {\n      \"finding_id\": 1,\n      \"vulnerability_type_claimed\": \"Unchecked Return Value\",\n      \"location_claimed\": \"CollateralVault - multiple functions\",\n      \"classification\": \"BONUS_VALID\",\n      \"reasoning\": \"\n        - The finding identifies a real vulnerability (unchecked return values of `transfer()` and `transferFrom()`) that is not part of the ground truth.\n        - The issue is concrete and actionable, with a clear attack scenario (silent failures leading to state inconsistency).\n        - The impact is genuine (potential loss of funds or manipulation of vault state).\n        - The vulnerability does not require a trusted role to be compromised and is not a design choice or informational issue.\n      \"\n    }\n  ],\n  \"target_assessment\": {\n    \"complete_found\": true,\n    \"partial_found\": false,\n    \"finding_id\": 0,\n    \"root_cause_match\": true,\n    \"location_match\": true,\n    \"type_match\": \"semantic\",\n    \"root_cause_identification\": {\n      \"score\": 1.0,\n      \"reasoning\": \"The finding's explanation of the root cause (missing access control on `mint()`) is technically accurate and semantically matches the ground truth exactly.\"\n    },\n    \"attack_vector_validity\": {\n      \"score\": 1.0,\n      \"reasoning\": \"The attack scenario is concrete, step-by-step, and aligns perfectly with the ground truth's attack flow. It demonstrates a clear and profitable exploit.\"\n    },\n    \"fix_suggestion_validity\": {\n      \"score\": 1.0,\n      \"reasoning\": \"The suggested fix (adding an `onlyOwner` modifier) is correct and matches the ground truth's recommended remediation (role-based access control).\"\n    }\n  },\n  \"notes\": \"\n    - Finding 0 is a perfect TARGET_MATCH, meeting all criteria for root cause, location, and type.\n    - Finding 1 is a valid bonus finding, as it identifies a real and impactful vulnerability not covered by the ground truth.\n    - The LLM's confidence score (0.95) is justified given the accuracy of the findings.\n  \"\n}\n```"
}