{
  "sample_id": "tr_tc_040",
  "variant": "trojan",
  "detector_model": "claude-opus-4-5",
  "prompt_type": "direct",
  "judge_model": "mistral-large",
  "timestamp": "2026-01-06T00:32:35.515563+00:00",
  "overall_verdict": {
    "said_vulnerable": true,
    "confidence_expressed": 0.95
  },
  "findings": [
    {
      "finding_id": 0,
      "vulnerability_type_claimed": "Arbitrary External Call",
      "location_claimed": "performOperations function",
      "classification": "TARGET_MATCH",
      "reasoning": "\n        **Root Cause Match**: The finding correctly identifies the root cause as user-controlled target address and calldata in `performOperations` allowing arbitrary external calls. The explanation explicitly mentions that both `target` and `callData` are fully controlled by the caller, matching the ground truth's key weaknesses (user-controlled target address, user-controlled calldata without validation, no whitelist of approved targets).\n\n        **Location Match**: The finding correctly identifies the `performOperations` function as the vulnerable location, which matches the ground truth.\n\n        **Type Match**: The type 'Arbitrary External Call' is a semantic match to the ground truth's 'access_control' type. While the terminology differs, both describe the same underlying issue: unauthorized execution of arbitrary calls due to missing access controls and validation.\n\n        **Quality Assessment**:\n        - **RCIR**: HIGH (0.9). The root cause is accurately and comprehensively described, matching the ground truth.\n        - **AVA**: HIGH (0.9). The attack scenario is concrete, step-by-step, and aligns with the ground truth's attack flow (e.g., draining tokens via `transferFrom`).\n        - **FSV**: HIGH (0.9). The suggested fix (access control + whitelist of allowed targets/function selectors) directly addresses the root cause and aligns with the ground truth's fix.\n      "
    },
    {
      "finding_id": 1,
      "vulnerability_type_claimed": "Missing Access Control",
      "location_claimed": "addVaultOwner function",
      "classification": "BONUS_VALID",
      "reasoning": "\n        This finding identifies a real vulnerability not covered in the ground truth. The `addVaultOwner` function lacks access control, allowing anyone to add themselves as a vault owner. While the `vaultOwners` mapping is currently unused for authorization, this is a genuine access control flaw that could be exploited if future code relies on this mapping. The attack scenario is concrete (attacker grants themselves owner status) and the impact is valid (potential future authorization bypass). This meets all criteria for BONUS_VALID.\n      "
    }
  ],
  "target_assessment": {
    "complete_found": true,
    "partial_found": false,
    "finding_id": 0,
    "root_cause_match": true,
    "location_match": true,
    "type_match": "semantic",
    "root_cause_identification": {
      "score": 0.9,
      "reasoning": "The root cause is accurately identified and semantically matches the ground truth, including all key weaknesses (user-controlled target/calldata, no whitelist)."
    },
    "attack_vector_validity": {
      "score": 0.9,
      "reasoning": "The attack scenario is concrete, step-by-step, and aligns with the ground truth's attack flow, including the exploitation of `transferFrom` approvals."
    },
    "fix_suggestion_validity": {
      "score": 0.9,
      "reasoning": "The suggested fix (access control + whitelist) directly addresses the root cause and matches the ground truth's recommended remediation."
    }
  },
  "summary": {},
  "notes": "\n    - Finding 0 is a clear TARGET_MATCH, as it meets all prerequisites (root cause, location) and the type is a semantic match.\n    - Finding 1 is a valid bonus finding, as it identifies a real, exploitable access control flaw not covered in the ground truth.\n    - The model's confidence (0.95) is justified given the accuracy of the findings.\n  ",
  "judge_latency_ms": 14419.722080230713,
  "raw_response": "```json\n{\n  \"overall_verdict\": {\n    \"said_vulnerable\": true,\n    \"confidence_expressed\": 0.95\n  },\n  \"findings\": [\n    {\n      \"finding_id\": 0,\n      \"vulnerability_type_claimed\": \"Arbitrary External Call\",\n      \"location_claimed\": \"performOperations function\",\n      \"classification\": \"TARGET_MATCH\",\n      \"reasoning\": \"\n        **Root Cause Match**: The finding correctly identifies the root cause as user-controlled target address and calldata in `performOperations` allowing arbitrary external calls. The explanation explicitly mentions that both `target` and `callData` are fully controlled by the caller, matching the ground truth's key weaknesses (user-controlled target address, user-controlled calldata without validation, no whitelist of approved targets).\n\n        **Location Match**: The finding correctly identifies the `performOperations` function as the vulnerable location, which matches the ground truth.\n\n        **Type Match**: The type 'Arbitrary External Call' is a semantic match to the ground truth's 'access_control' type. While the terminology differs, both describe the same underlying issue: unauthorized execution of arbitrary calls due to missing access controls and validation.\n\n        **Quality Assessment**:\n        - **RCIR**: HIGH (0.9). The root cause is accurately and comprehensively described, matching the ground truth.\n        - **AVA**: HIGH (0.9). The attack scenario is concrete, step-by-step, and aligns with the ground truth's attack flow (e.g., draining tokens via `transferFrom`).\n        - **FSV**: HIGH (0.9). The suggested fix (access control + whitelist of allowed targets/function selectors) directly addresses the root cause and aligns with the ground truth's fix.\n      \"\n    },\n    {\n      \"finding_id\": 1,\n      \"vulnerability_type_claimed\": \"Missing Access Control\",\n      \"location_claimed\": \"addVaultOwner function\",\n      \"classification\": \"BONUS_VALID\",\n      \"reasoning\": \"\n        This finding identifies a real vulnerability not covered in the ground truth. The `addVaultOwner` function lacks access control, allowing anyone to add themselves as a vault owner. While the `vaultOwners` mapping is currently unused for authorization, this is a genuine access control flaw that could be exploited if future code relies on this mapping. The attack scenario is concrete (attacker grants themselves owner status) and the impact is valid (potential future authorization bypass). This meets all criteria for BONUS_VALID.\n      \"\n    }\n  ],\n  \"target_assessment\": {\n    \"complete_found\": true,\n    \"partial_found\": false,\n    \"finding_id\": 0,\n    \"root_cause_match\": true,\n    \"location_match\": true,\n    \"type_match\": \"semantic\",\n    \"root_cause_identification\": {\n      \"score\": 0.9,\n      \"reasoning\": \"The root cause is accurately identified and semantically matches the ground truth, including all key weaknesses (user-controlled target/calldata, no whitelist).\"\n    },\n    \"attack_vector_validity\": {\n      \"score\": 0.9,\n      \"reasoning\": \"The attack scenario is concrete, step-by-step, and aligns with the ground truth's attack flow, including the exploitation of `transferFrom` approvals.\"\n    },\n    \"fix_suggestion_validity\": {\n      \"score\": 0.9,\n      \"reasoning\": \"The suggested fix (access control + whitelist) directly addresses the root cause and matches the ground truth's recommended remediation.\"\n    }\n  },\n  \"notes\": \"\n    - Finding 0 is a clear TARGET_MATCH, as it meets all prerequisites (root cause, location) and the type is a semantic match.\n    - Finding 1 is a valid bonus finding, as it identifies a real, exploitable access control flaw not covered in the ground truth.\n    - The model's confidence (0.95) is justified given the accuracy of the findings.\n  \"\n}\n```"
}