{
  "sample_id": "tr_tc_046",
  "variant": "trojan",
  "detector_model": "claude-opus-4-5",
  "prompt_type": "direct",
  "judge_model": "mistral-large",
  "timestamp": "2026-01-06T00:33:41.847289+00:00",
  "overall_verdict": {
    "said_vulnerable": true,
    "confidence_expressed": 0.92
  },
  "findings": [
    {
      "finding_id": 0,
      "vulnerability_type_claimed": "Access Control Bypass",
      "location_claimed": "onlyAdmin modifier and admin transfer functions",
      "classification": "TARGET_MATCH",
      "reasoning": "\n        **Root Cause Match**: The finding correctly identifies the root cause as the `onlyAdmin` modifier allowing both `admin` and `pendingAdmin` to execute admin functions, which enables immediate privilege escalation. This matches the ground truth's key weakness of 'Single developer with critical key access' and 'No multi-signature requirement', as the flawed modifier effectively allows a single rogue developer to gain admin privileges without oversight.\n\n        **Location Match**: The finding correctly identifies the vulnerable functions (`setLockRecipient`, `emergencyUnlock`, `transferAdmin`) through the `onlyAdmin` modifier, which is the same as the ground truth. The attack scenario also aligns with the ground truth's description of redirecting user funds via admin functions.\n\n        **Type Match**: The type 'Access Control Bypass' is a semantic match to the ground truth's 'access_control'.\n\n        **Quality**:\n        - Root Cause Identification: HIGH (0.9) - The explanation is technically accurate and matches the ground truth's root cause.\n        - Attack Vector Validity: HIGH (1.0) - The attack scenario is concrete and matches the ground truth's flow.\n        - Fix Suggestion Validity: HIGH (1.0) - The suggested fix (removing `pendingAdmin` from the modifier) is correct and aligns with the ground truth's recommendation for multi-signature requirements.\n      "
    },
    {
      "finding_id": 1,
      "vulnerability_type_claimed": "Unchecked Return Value",
      "location_claimed": "lock(), unlock(), emergencyUnlock()",
      "classification": "BONUS_VALID",
      "reasoning": "\n        This finding identifies a real vulnerability not mentioned in the ground truth. The issue of unchecked return values for ERC20 transfers is a valid concern, especially for tokens that return false instead of reverting. The attack scenario is concrete and plausible, and the suggested fix (using SafeERC20) is correct. This qualifies as a BONUS_VALID finding.\n      "
    }
  ],
  "target_assessment": {
    "complete_found": true,
    "partial_found": false,
    "finding_id": 0,
    "root_cause_match": true,
    "location_match": true,
    "type_match": "semantic",
    "root_cause_identification": {
      "score": 0.9,
      "reasoning": "The finding accurately identifies the root cause (flawed `onlyAdmin` modifier allowing immediate privilege escalation) and aligns with the ground truth's key weaknesses (single developer access, no multi-sig)."
    },
    "attack_vector_validity": {
      "score": 1.0,
      "reasoning": "The attack scenario is step-by-step and matches the ground truth's description of redirecting user funds via admin functions."
    },
    "fix_suggestion_validity": {
      "score": 1.0,
      "reasoning": "The suggested fix (removing `pendingAdmin` from the modifier) is correct and aligns with the ground truth's recommendation for multi-signature requirements."
    }
  },
  "summary": {},
  "notes": "Finding 0 is a TARGET_MATCH because it meets all criteria: correct root cause, location, and type. Finding 1 is a valid bonus finding but unrelated to the ground truth.",
  "judge_latency_ms": 14003.474950790405,
  "raw_response": "```json\n{\n  \"overall_verdict\": {\n    \"said_vulnerable\": true,\n    \"confidence_expressed\": 0.92\n  },\n  \"findings\": [\n    {\n      \"finding_id\": 0,\n      \"vulnerability_type_claimed\": \"Access Control Bypass\",\n      \"location_claimed\": \"onlyAdmin modifier and admin transfer functions\",\n      \"classification\": \"TARGET_MATCH\",\n      \"reasoning\": \"\n        **Root Cause Match**: The finding correctly identifies the root cause as the `onlyAdmin` modifier allowing both `admin` and `pendingAdmin` to execute admin functions, which enables immediate privilege escalation. This matches the ground truth's key weakness of 'Single developer with critical key access' and 'No multi-signature requirement', as the flawed modifier effectively allows a single rogue developer to gain admin privileges without oversight.\n\n        **Location Match**: The finding correctly identifies the vulnerable functions (`setLockRecipient`, `emergencyUnlock`, `transferAdmin`) through the `onlyAdmin` modifier, which is the same as the ground truth. The attack scenario also aligns with the ground truth's description of redirecting user funds via admin functions.\n\n        **Type Match**: The type 'Access Control Bypass' is a semantic match to the ground truth's 'access_control'.\n\n        **Quality**:\n        - Root Cause Identification: HIGH (0.9) - The explanation is technically accurate and matches the ground truth's root cause.\n        - Attack Vector Validity: HIGH (1.0) - The attack scenario is concrete and matches the ground truth's flow.\n        - Fix Suggestion Validity: HIGH (1.0) - The suggested fix (removing `pendingAdmin` from the modifier) is correct and aligns with the ground truth's recommendation for multi-signature requirements.\n      \"\n    },\n    {\n      \"finding_id\": 1,\n      \"vulnerability_type_claimed\": \"Unchecked Return Value\",\n      \"location_claimed\": \"lock(), unlock(), emergencyUnlock()\",\n      \"classification\": \"BONUS_VALID\",\n      \"reasoning\": \"\n        This finding identifies a real vulnerability not mentioned in the ground truth. The issue of unchecked return values for ERC20 transfers is a valid concern, especially for tokens that return false instead of reverting. The attack scenario is concrete and plausible, and the suggested fix (using SafeERC20) is correct. This qualifies as a BONUS_VALID finding.\n      \"\n    }\n  ],\n  \"target_assessment\": {\n    \"complete_found\": true,\n    \"partial_found\": false,\n    \"finding_id\": 0,\n    \"root_cause_match\": true,\n    \"location_match\": true,\n    \"type_match\": \"semantic\",\n    \"root_cause_identification\": {\n      \"score\": 0.9,\n      \"reasoning\": \"The finding accurately identifies the root cause (flawed `onlyAdmin` modifier allowing immediate privilege escalation) and aligns with the ground truth's key weaknesses (single developer access, no multi-sig).\"\n    },\n    \"attack_vector_validity\": {\n      \"score\": 1.0,\n      \"reasoning\": \"The attack scenario is step-by-step and matches the ground truth's description of redirecting user funds via admin functions.\"\n    },\n    \"fix_suggestion_validity\": {\n      \"score\": 1.0,\n      \"reasoning\": \"The suggested fix (removing `pendingAdmin` from the modifier) is correct and aligns with the ground truth's recommendation for multi-signature requirements.\"\n    }\n  },\n  \"notes\": \"Finding 0 is a TARGET_MATCH because it meets all criteria: correct root cause, location, and type. Finding 1 is a valid bonus finding but unrelated to the ground truth.\"\n}\n```"
}