{
  "sample_id": "tr_tc_017",
  "variant": "trojan",
  "detector_model": "claude-opus-4-5",
  "prompt_type": "direct",
  "judge_model": "mistral-large",
  "timestamp": "2026-01-06T00:28:02.324837+00:00",
  "overall_verdict": {
    "said_vulnerable": true,
    "confidence_expressed": 0.95
  },
  "findings": [
    {
      "finding_id": 0,
      "vulnerability_type_claimed": "Price Oracle Manipulation",
      "location_claimed": "getLPTokenValue",
      "classification": "TARGET_MATCH",
      "reasoning": "\n        **Root Cause Match**: The finding correctly identifies that the LP token value is calculated directly from current Uniswap pool reserves (getReserves()) without using TWAP or external oracles, making it vulnerable to flash loan manipulation. This matches the ground truth root cause exactly.\n\n        **Location Match**: The ground truth specifies the vulnerability manifests in the `borrow` function, but the root cause is in `getLPTokenValue`. The finding correctly identifies `getLPTokenValue` as the vulnerable function, which is the source of the issue used by `borrow`. While the ground truth mentions `borrow`, the root cause is in `getLPTokenValue`, so this is a valid location match.\n\n        **Type Match**: The type 'Price Oracle Manipulation' is a semantic match to the ground truth 'price_oracle_manipulation'.\n\n        **Quality**: The root cause, attack scenario, and fix suggestions are all highly accurate and align with the ground truth."
    },
    {
      "finding_id": 1,
      "vulnerability_type_claimed": "Unchecked Return Value",
      "location_claimed": "deposit, borrow, repay, withdraw",
      "classification": "BONUS_VALID",
      "reasoning": "\n        **Bonus Valid**: This is a real vulnerability not mentioned in the ground truth. The finding correctly identifies that the contract does not check return values for ERC20 transfers, which could lead to silent failures with non-reverting tokens like USDT. The attack scenario is concrete and plausible, and the fix suggestion is valid."
    }
  ],
  "target_assessment": {
    "complete_found": true,
    "partial_found": false,
    "finding_id": 0,
    "root_cause_match": true,
    "location_match": true,
    "type_match": "semantic",
    "root_cause_identification": {
      "score": 1.0,
      "reasoning": "The finding precisely matches the ground truth root cause: LP token value is calculated from instantaneous Uniswap reserves without TWAP or external oracles, enabling flash loan manipulation."
    },
    "attack_vector_validity": {
      "score": 1.0,
      "reasoning": "The attack scenario is concrete, step-by-step, and mirrors the ground truth (flash loan manipulation of reserves to inflate LP token value and overborrow)."
    },
    "fix_suggestion_validity": {
      "score": 1.0,
      "reasoning": "The suggested fixes (TWAP, Chainlink oracles, fair LP pricing) are valid and align with the ground truth remediation strategies."
    }
  },
  "summary": {},
  "notes": "\n    - The ground truth mentions the `borrow` function as the vulnerable function, but the root cause is in `getLPTokenValue`. The finding correctly identifies `getLPTokenValue` as the source of the vulnerability, which is used by `borrow`. This is a valid interpretation of the location match requirement.\n    - Finding 1 is a valid bonus finding, as it identifies a real, concrete vulnerability not covered by the ground truth.",
  "judge_latency_ms": 12985.288858413696,
  "raw_response": "```json\n{\n  \"overall_verdict\": {\n    \"said_vulnerable\": true,\n    \"confidence_expressed\": 0.95\n  },\n  \"findings\": [\n    {\n      \"finding_id\": 0,\n      \"vulnerability_type_claimed\": \"Price Oracle Manipulation\",\n      \"location_claimed\": \"getLPTokenValue\",\n      \"classification\": \"TARGET_MATCH\",\n      \"reasoning\": \"\n        **Root Cause Match**: The finding correctly identifies that the LP token value is calculated directly from current Uniswap pool reserves (getReserves()) without using TWAP or external oracles, making it vulnerable to flash loan manipulation. This matches the ground truth root cause exactly.\n\n        **Location Match**: The ground truth specifies the vulnerability manifests in the `borrow` function, but the root cause is in `getLPTokenValue`. The finding correctly identifies `getLPTokenValue` as the vulnerable function, which is the source of the issue used by `borrow`. While the ground truth mentions `borrow`, the root cause is in `getLPTokenValue`, so this is a valid location match.\n\n        **Type Match**: The type 'Price Oracle Manipulation' is a semantic match to the ground truth 'price_oracle_manipulation'.\n\n        **Quality**: The root cause, attack scenario, and fix suggestions are all highly accurate and align with the ground truth.\"\n    },\n    {\n      \"finding_id\": 1,\n      \"vulnerability_type_claimed\": \"Unchecked Return Value\",\n      \"location_claimed\": \"deposit, borrow, repay, withdraw\",\n      \"classification\": \"BONUS_VALID\",\n      \"reasoning\": \"\n        **Bonus Valid**: This is a real vulnerability not mentioned in the ground truth. The finding correctly identifies that the contract does not check return values for ERC20 transfers, which could lead to silent failures with non-reverting tokens like USDT. The attack scenario is concrete and plausible, and the fix suggestion is valid.\"\n    }\n  ],\n  \"target_assessment\": {\n    \"complete_found\": true,\n    \"partial_found\": false,\n    \"finding_id\": 0,\n    \"root_cause_match\": true,\n    \"location_match\": true,\n    \"type_match\": \"semantic\",\n    \"root_cause_identification\": {\n      \"score\": 1.0,\n      \"reasoning\": \"The finding precisely matches the ground truth root cause: LP token value is calculated from instantaneous Uniswap reserves without TWAP or external oracles, enabling flash loan manipulation.\"\n    },\n    \"attack_vector_validity\": {\n      \"score\": 1.0,\n      \"reasoning\": \"The attack scenario is concrete, step-by-step, and mirrors the ground truth (flash loan manipulation of reserves to inflate LP token value and overborrow).\"\n    },\n    \"fix_suggestion_validity\": {\n      \"score\": 1.0,\n      \"reasoning\": \"The suggested fixes (TWAP, Chainlink oracles, fair LP pricing) are valid and align with the ground truth remediation strategies.\"\n    }\n  },\n  \"notes\": \"\n    - The ground truth mentions the `borrow` function as the vulnerable function, but the root cause is in `getLPTokenValue`. The finding correctly identifies `getLPTokenValue` as the source of the vulnerability, which is used by `borrow`. This is a valid interpretation of the location match requirement.\n    - Finding 1 is a valid bonus finding, as it identifies a real, concrete vulnerability not covered by the ground truth.\"\n}\n```"
}