{
  "sample_id": "tr_tc_039",
  "variant": "trojan",
  "detector_model": "claude-opus-4-5",
  "prompt_type": "direct",
  "judge_model": "mistral-large",
  "timestamp": "2026-01-06T00:32:20.741079+00:00",
  "overall_verdict": {
    "said_vulnerable": true,
    "confidence_expressed": 0.92
  },
  "findings": [
    {
      "finding_id": 0,
      "vulnerability_type_claimed": "Arbitrary External Call",
      "location_claimed": "createLockedCampaign",
      "classification": "TARGET_MATCH",
      "reasoning": "\n        **Root Cause Match**: The finding correctly identifies the root cause as a user-controlled `tokenLocker` address used in an arbitrary external call without validation. The explanation matches the ground truth's key weaknesses: 'User-controlled address in external call; No whitelist of approved tokenLocker contracts; Arbitrary external call without validation.'\n\n        **Location Match**: The finding correctly identifies the vulnerable function as `createLockedCampaign`, which matches the ground truth.\n\n        **Type Match**: The type 'Arbitrary External Call' is a semantic match to the ground truth's 'access_control' because the vulnerability stems from improper access control (allowing arbitrary calls to user-controlled addresses). The core issue is the same: lack of validation over a critical external call.\n      "
    },
    {
      "finding_id": 1,
      "vulnerability_type_claimed": "Missing Access Control",
      "location_claimed": "toggleUnsafeCallMode",
      "classification": "BONUS_VALID",
      "reasoning": "\n        This finding identifies a real vulnerability not covered in the ground truth. The `toggleUnsafeCallMode` function lacks access control, allowing any user to manipulate the `unsafeCallBypass` state variable. While the current impact is limited (only affects caching behavior), this is a genuine security issue that could be exploited to manipulate contract state or behavior. The attack scenario is concrete and does not require a trusted role to be compromised.\n      "
    }
  ],
  "target_assessment": {
    "complete_found": true,
    "partial_found": false,
    "finding_id": 0,
    "root_cause_match": true,
    "location_match": true,
    "type_match": "semantic",
    "root_cause_identification": {
      "score": 1.0,
      "reasoning": "\n        The finding's root cause explanation is technically accurate and semantically matches the ground truth. It correctly identifies the specific issue (user-controlled `tokenLocker` address in an arbitrary external call) and the lack of validation (no whitelist). The explanation is detailed and aligns perfectly with the ground truth's description.\n      "
    },
    "attack_vector_validity": {
      "score": 0.9,
      "reasoning": "\n        The attack scenario provided is valid and concrete, though it differs slightly from the ground truth's real-world exploit (which involved `transferFrom` calls on victim tokens). The finding describes a plausible attack vector where an attacker could use the contract as a proxy for arbitrary calls, potentially bypassing access controls in other contracts. The scenario is step-by-step and technically sound, but it does not fully capture the specific `transferFrom` exploit described in the ground truth. Thus, it is a valid alternative but not an exact match.\n      "
    },
    "fix_suggestion_validity": {
      "score": 1.0,
      "reasoning": "\n        The suggested fix (implementing a whitelist of approved tokenLocker addresses) is technically correct and matches the ground truth's recommended remediation. It directly addresses the root cause by preventing arbitrary external calls to user-controlled addresses.\n      "
    }
  },
  "summary": {},
  "notes": "\n    Finding 0 is a clear TARGET_MATCH because it meets all criteria: correct root cause, correct location, and semantic type match. Finding 1 is a valid bonus finding as it identifies a real, exploitable vulnerability not covered in the ground truth. The LLM's output demonstrates a strong understanding of the target vulnerability and provides actionable insights.\n  ",
  "judge_latency_ms": 14768.563270568848,
  "raw_response": "```json\n{\n  \"overall_verdict\": {\n    \"said_vulnerable\": true,\n    \"confidence_expressed\": 0.92\n  },\n  \"findings\": [\n    {\n      \"finding_id\": 0,\n      \"vulnerability_type_claimed\": \"Arbitrary External Call\",\n      \"location_claimed\": \"createLockedCampaign\",\n      \"classification\": \"TARGET_MATCH\",\n      \"reasoning\": \"\n        **Root Cause Match**: The finding correctly identifies the root cause as a user-controlled `tokenLocker` address used in an arbitrary external call without validation. The explanation matches the ground truth's key weaknesses: 'User-controlled address in external call; No whitelist of approved tokenLocker contracts; Arbitrary external call without validation.'\n\n        **Location Match**: The finding correctly identifies the vulnerable function as `createLockedCampaign`, which matches the ground truth.\n\n        **Type Match**: The type 'Arbitrary External Call' is a semantic match to the ground truth's 'access_control' because the vulnerability stems from improper access control (allowing arbitrary calls to user-controlled addresses). The core issue is the same: lack of validation over a critical external call.\n      \"\n    },\n    {\n      \"finding_id\": 1,\n      \"vulnerability_type_claimed\": \"Missing Access Control\",\n      \"location_claimed\": \"toggleUnsafeCallMode\",\n      \"classification\": \"BONUS_VALID\",\n      \"reasoning\": \"\n        This finding identifies a real vulnerability not covered in the ground truth. The `toggleUnsafeCallMode` function lacks access control, allowing any user to manipulate the `unsafeCallBypass` state variable. While the current impact is limited (only affects caching behavior), this is a genuine security issue that could be exploited to manipulate contract state or behavior. The attack scenario is concrete and does not require a trusted role to be compromised.\n      \"\n    }\n  ],\n  \"target_assessment\": {\n    \"complete_found\": true,\n    \"partial_found\": false,\n    \"finding_id\": 0,\n    \"root_cause_match\": true,\n    \"location_match\": true,\n    \"type_match\": \"semantic\",\n    \"root_cause_identification\": {\n      \"score\": 1.0,\n      \"reasoning\": \"\n        The finding's root cause explanation is technically accurate and semantically matches the ground truth. It correctly identifies the specific issue (user-controlled `tokenLocker` address in an arbitrary external call) and the lack of validation (no whitelist). The explanation is detailed and aligns perfectly with the ground truth's description.\n      \"\n    },\n    \"attack_vector_validity\": {\n      \"score\": 0.9,\n      \"reasoning\": \"\n        The attack scenario provided is valid and concrete, though it differs slightly from the ground truth's real-world exploit (which involved `transferFrom` calls on victim tokens). The finding describes a plausible attack vector where an attacker could use the contract as a proxy for arbitrary calls, potentially bypassing access controls in other contracts. The scenario is step-by-step and technically sound, but it does not fully capture the specific `transferFrom` exploit described in the ground truth. Thus, it is a valid alternative but not an exact match.\n      \"\n    },\n    \"fix_suggestion_validity\": {\n      \"score\": 1.0,\n      \"reasoning\": \"\n        The suggested fix (implementing a whitelist of approved tokenLocker addresses) is technically correct and matches the ground truth's recommended remediation. It directly addresses the root cause by preventing arbitrary external calls to user-controlled addresses.\n      \"\n    }\n  },\n  \"notes\": \"\n    Finding 0 is a clear TARGET_MATCH because it meets all criteria: correct root cause, correct location, and semantic type match. Finding 1 is a valid bonus finding as it identifies a real, exploitable vulnerability not covered in the ground truth. The LLM's output demonstrates a strong understanding of the target vulnerability and provides actionable insights.\n  \"\n}\n```"
}