{
  "sample_id": "ss_tc_038",
  "variant": "shapeshifter_l3",
  "detector_model": "claude-opus-4-5",
  "prompt_type": "direct",
  "judge_model": "mistral-large",
  "timestamp": "2026-01-06T00:32:25.749189+00:00",
  "overall_verdict": {
    "said_vulnerable": true,
    "confidence_expressed": 0.95
  },
  "findings": [
    {
      "finding_id": 0,
      "vulnerability_type_claimed": "Unrestricted Minting",
      "location_claimed": "CollateralToken._0xae3550",
      "classification": "TARGET_MATCH",
      "reasoning": "\n        **Root Cause Match**: The finding correctly identifies the missing access control modifier on the mint function (_0xae3550), allowing anyone to mint unlimited tokens. This matches the ground truth root cause exactly, including the specific weaknesses (no owner/admin check, no role-based access control, no minting limits).\n\n        **Location Match**: The finding correctly identifies the vulnerable function _0xae3550, which is one of the two functions specified in the ground truth (the other being _0x51bedd). While it doesn't mention _0x51bedd, the ground truth allows for one or more functions to match, and the root cause is fully captured in _0xae3550.\n\n        **Type Match**: The type 'Unrestricted Minting' is a semantic match to 'access_control', as it describes the same vulnerability class (missing access control leading to unauthorized minting).\n\n        **Attack Scenario**: The attack scenario is concrete and matches the ground truth flow, including minting tokens, depositing as collateral, and borrowing real assets.\n\n        **Fix Suggestion**: The suggested fix (adding an onlyOwner modifier) is correct and aligns with the ground truth fix.\n      "
    },
    {
      "finding_id": 1,
      "vulnerability_type_claimed": "Missing Return Value Check",
      "location_claimed": "CollateralVault (multiple functions)",
      "classification": "BONUS_VALID",
      "reasoning": "\n        **Bonus Validity**: This finding identifies a real vulnerability not covered in the ground truth. The issue (missing return value checks on external token transfers) is a valid concern, especially when interacting with non-reverting ERC20 tokens. The attack scenario is concrete and plausible, and the fix suggestion (using SafeERC20 or explicit checks) is correct. The vulnerability does not require a trusted role to be compromised and has a genuine impact (incorrect state updates).\n      "
    }
  ],
  "target_assessment": {
    "complete_found": true,
    "partial_found": false,
    "finding_id": 0,
    "root_cause_match": true,
    "location_match": true,
    "type_match": "semantic",
    "root_cause_identification": {
      "score": 1.0,
      "reasoning": "The finding's root cause explanation is technically accurate and semantically matches the ground truth, including all key weaknesses (no access control, no role-based checks, no minting limits)."
    },
    "attack_vector_validity": {
      "score": 1.0,
      "reasoning": "The attack scenario is concrete, step-by-step, and matches the ground truth flow. It demonstrates a clear and profitable exploit."
    },
    "fix_suggestion_validity": {
      "score": 1.0,
      "reasoning": "The suggested fix (adding an onlyOwner modifier) is correct and remediates the issue as described in the ground truth."
    }
  },
  "summary": {},
  "notes": "\n    - The ground truth mentions two vulnerable functions (_0xae3550 and _0x51bedd), but the root cause is fully captured in _0xae3550. The second function (_0x51bedd) is a downstream victim of the minting vulnerability, not a root cause location. Thus, the finding's location is considered correct.\n    - The second finding (Missing Return Value Check) is classified as BONUS_VALID because it identifies a real, distinct vulnerability not covered in the ground truth.\n  ",
  "judge_latency_ms": 14991.962909698486,
  "raw_response": "```json\n{\n  \"overall_verdict\": {\n    \"said_vulnerable\": true,\n    \"confidence_expressed\": 0.95\n  },\n  \"findings\": [\n    {\n      \"finding_id\": 0,\n      \"vulnerability_type_claimed\": \"Unrestricted Minting\",\n      \"location_claimed\": \"CollateralToken._0xae3550\",\n      \"classification\": \"TARGET_MATCH\",\n      \"reasoning\": \"\n        **Root Cause Match**: The finding correctly identifies the missing access control modifier on the mint function (_0xae3550), allowing anyone to mint unlimited tokens. This matches the ground truth root cause exactly, including the specific weaknesses (no owner/admin check, no role-based access control, no minting limits).\n\n        **Location Match**: The finding correctly identifies the vulnerable function _0xae3550, which is one of the two functions specified in the ground truth (the other being _0x51bedd). While it doesn't mention _0x51bedd, the ground truth allows for one or more functions to match, and the root cause is fully captured in _0xae3550.\n\n        **Type Match**: The type 'Unrestricted Minting' is a semantic match to 'access_control', as it describes the same vulnerability class (missing access control leading to unauthorized minting).\n\n        **Attack Scenario**: The attack scenario is concrete and matches the ground truth flow, including minting tokens, depositing as collateral, and borrowing real assets.\n\n        **Fix Suggestion**: The suggested fix (adding an onlyOwner modifier) is correct and aligns with the ground truth fix.\n      \"\n    },\n    {\n      \"finding_id\": 1,\n      \"vulnerability_type_claimed\": \"Missing Return Value Check\",\n      \"location_claimed\": \"CollateralVault (multiple functions)\",\n      \"classification\": \"BONUS_VALID\",\n      \"reasoning\": \"\n        **Bonus Validity**: This finding identifies a real vulnerability not covered in the ground truth. The issue (missing return value checks on external token transfers) is a valid concern, especially when interacting with non-reverting ERC20 tokens. The attack scenario is concrete and plausible, and the fix suggestion (using SafeERC20 or explicit checks) is correct. The vulnerability does not require a trusted role to be compromised and has a genuine impact (incorrect state updates).\n      \"\n    }\n  ],\n  \"target_assessment\": {\n    \"complete_found\": true,\n    \"partial_found\": false,\n    \"finding_id\": 0,\n    \"root_cause_match\": true,\n    \"location_match\": true,\n    \"type_match\": \"semantic\",\n    \"root_cause_identification\": {\n      \"score\": 1.0,\n      \"reasoning\": \"The finding's root cause explanation is technically accurate and semantically matches the ground truth, including all key weaknesses (no access control, no role-based checks, no minting limits).\"\n    },\n    \"attack_vector_validity\": {\n      \"score\": 1.0,\n      \"reasoning\": \"The attack scenario is concrete, step-by-step, and matches the ground truth flow. It demonstrates a clear and profitable exploit.\"\n    },\n    \"fix_suggestion_validity\": {\n      \"score\": 1.0,\n      \"reasoning\": \"The suggested fix (adding an onlyOwner modifier) is correct and remediates the issue as described in the ground truth.\"\n    }\n  },\n  \"notes\": \"\n    - The ground truth mentions two vulnerable functions (_0xae3550 and _0x51bedd), but the root cause is fully captured in _0xae3550. The second function (_0x51bedd) is a downstream victim of the minting vulnerability, not a root cause location. Thus, the finding's location is considered correct.\n    - The second finding (Missing Return Value Check) is classified as BONUS_VALID because it identifies a real, distinct vulnerability not covered in the ground truth.\n  \"\n}\n```"
}