{
  "sample_id": "ss_tc_021",
  "variant": "shapeshifter_l3",
  "detector_model": "claude-opus-4-5",
  "prompt_type": "direct",
  "judge_model": "mistral-large",
  "timestamp": "2026-01-06T00:28:56.720134+00:00",
  "overall_verdict": {
    "said_vulnerable": true,
    "confidence_expressed": 0.92
  },
  "findings": [
    {
      "finding_id": 0,
      "vulnerability_type_claimed": "Oracle Manipulation",
      "location_claimed": "_0x390062 function and SimplifiedOracle._0x70dd97",
      "classification": "TARGET_MATCH",
      "reasoning": "\n        **Root Cause Match**: The finding correctly identifies that the oracle price is fetched directly from a pool's virtual price function (_0x0cce35, likely Curve's get_virtual_price), which can be manipulated within a single transaction through flash loans. This matches the ground truth root cause exactly: the oracle relies on a manipulable spot price without time-weighted averaging or manipulation resistance.\n\n        **Location Match**: The finding identifies the correct vulnerable functions. The ground truth specifies _0x8e4527 as the vulnerable function, but this function relies on _0x390062 (which fetches the oracle price) and SimplifiedOracle._0x70dd97 (which calls the pool's virtual price). Thus, the location is correctly identified as the root of the vulnerability.\n\n        **Type Match**: The type 'Oracle Manipulation' is a semantic match to the ground truth type 'price_oracle_manipulation'. Both describe the same vulnerability class.\n      "
    },
    {
      "finding_id": 1,
      "vulnerability_type_claimed": "Unchecked Return Value",
      "location_claimed": "_0x51bedd and _0x8e4527 functions",
      "classification": "BONUS_VALID",
      "reasoning": "\n        **Bonus Valid**: This is a real vulnerability not mentioned in the ground truth. The finding correctly identifies that the contract does not check return values for ERC20 transfers, which could lead to phantom deposits or failed borrows if non-reverting tokens (like USDT) are used. The attack scenario is concrete and plausible, and the fix suggestion (using SafeERC20) is valid.\n      "
    },
    {
      "finding_id": 2,
      "vulnerability_type_claimed": "Missing Withdrawal Function",
      "location_claimed": "_0x51bedd function",
      "classification": "MISCHARACTERIZED",
      "reasoning": "\n        **Mischaracterized**: While the observation is true (there is no withdrawal function), this is not a security vulnerability but rather a design choice or functional limitation. The lack of a withdrawal function does not lead to loss of funds, unauthorized access, or critical state manipulation. It is an informational issue or a design flaw, not a security vulnerability.\n      "
    }
  ],
  "target_assessment": {
    "complete_found": true,
    "partial_found": false,
    "finding_id": 0,
    "root_cause_match": true,
    "location_match": true,
    "type_match": "semantic",
    "root_cause_identification": {
      "score": 1.0,
      "reasoning": "\n        The finding's root cause explanation is technically accurate and semantically matches the ground truth. It correctly identifies the reliance on a manipulable spot price oracle and the lack of manipulation resistance.\n      "
    },
    "attack_vector_validity": {
      "score": 1.0,
      "reasoning": "\n        The attack scenario is concrete and step-by-step, matching the ground truth's description of flash loan manipulation. It correctly outlines how an attacker can inflate the oracle price, borrow against inflated collateral, and profit from the manipulation.\n      "
    },
    "fix_suggestion_validity": {
      "score": 0.9,
      "reasoning": "\n        The fix suggestions (TWAP, price deviation checks, Chainlink oracles) are valid and align with the ground truth's recommended fixes. The only minor omission is the lack of mention of exponential moving averages (EMA) or minimum time delays between price updates, but the core suggestions are correct.\n      "
    }
  },
  "summary": {},
  "notes": "\n    Finding 0 is a strong TARGET_MATCH, as it meets all criteria for root cause, location, and type. Finding 1 is a valid bonus finding, while Finding 2 is mischaracterized as it does not represent a security vulnerability.\n  ",
  "judge_latency_ms": 18710.705995559692,
  "raw_response": "```json\n{\n  \"overall_verdict\": {\n    \"said_vulnerable\": true,\n    \"confidence_expressed\": 0.92\n  },\n  \"findings\": [\n    {\n      \"finding_id\": 0,\n      \"vulnerability_type_claimed\": \"Oracle Manipulation\",\n      \"location_claimed\": \"_0x390062 function and SimplifiedOracle._0x70dd97\",\n      \"classification\": \"TARGET_MATCH\",\n      \"reasoning\": \"\n        **Root Cause Match**: The finding correctly identifies that the oracle price is fetched directly from a pool's virtual price function (_0x0cce35, likely Curve's get_virtual_price), which can be manipulated within a single transaction through flash loans. This matches the ground truth root cause exactly: the oracle relies on a manipulable spot price without time-weighted averaging or manipulation resistance.\n\n        **Location Match**: The finding identifies the correct vulnerable functions. The ground truth specifies _0x8e4527 as the vulnerable function, but this function relies on _0x390062 (which fetches the oracle price) and SimplifiedOracle._0x70dd97 (which calls the pool's virtual price). Thus, the location is correctly identified as the root of the vulnerability.\n\n        **Type Match**: The type 'Oracle Manipulation' is a semantic match to the ground truth type 'price_oracle_manipulation'. Both describe the same vulnerability class.\n      \"\n    },\n    {\n      \"finding_id\": 1,\n      \"vulnerability_type_claimed\": \"Unchecked Return Value\",\n      \"location_claimed\": \"_0x51bedd and _0x8e4527 functions\",\n      \"classification\": \"BONUS_VALID\",\n      \"reasoning\": \"\n        **Bonus Valid**: This is a real vulnerability not mentioned in the ground truth. The finding correctly identifies that the contract does not check return values for ERC20 transfers, which could lead to phantom deposits or failed borrows if non-reverting tokens (like USDT) are used. The attack scenario is concrete and plausible, and the fix suggestion (using SafeERC20) is valid.\n      \"\n    },\n    {\n      \"finding_id\": 2,\n      \"vulnerability_type_claimed\": \"Missing Withdrawal Function\",\n      \"location_claimed\": \"_0x51bedd function\",\n      \"classification\": \"MISCHARACTERIZED\",\n      \"reasoning\": \"\n        **Mischaracterized**: While the observation is true (there is no withdrawal function), this is not a security vulnerability but rather a design choice or functional limitation. The lack of a withdrawal function does not lead to loss of funds, unauthorized access, or critical state manipulation. It is an informational issue or a design flaw, not a security vulnerability.\n      \"\n    }\n  ],\n  \"target_assessment\": {\n    \"complete_found\": true,\n    \"partial_found\": false,\n    \"finding_id\": 0,\n    \"root_cause_match\": true,\n    \"location_match\": true,\n    \"type_match\": \"semantic\",\n    \"root_cause_identification\": {\n      \"score\": 1.0,\n      \"reasoning\": \"\n        The finding's root cause explanation is technically accurate and semantically matches the ground truth. It correctly identifies the reliance on a manipulable spot price oracle and the lack of manipulation resistance.\n      \"\n    },\n    \"attack_vector_validity\": {\n      \"score\": 1.0,\n      \"reasoning\": \"\n        The attack scenario is concrete and step-by-step, matching the ground truth's description of flash loan manipulation. It correctly outlines how an attacker can inflate the oracle price, borrow against inflated collateral, and profit from the manipulation.\n      \"\n    },\n    \"fix_suggestion_validity\": {\n      \"score\": 0.9,\n      \"reasoning\": \"\n        The fix suggestions (TWAP, price deviation checks, Chainlink oracles) are valid and align with the ground truth's recommended fixes. The only minor omission is the lack of mention of exponential moving averages (EMA) or minimum time delays between price updates, but the core suggestions are correct.\n      \"\n    }\n  },\n  \"notes\": \"\n    Finding 0 is a strong TARGET_MATCH, as it meets all criteria for root cause, location, and type. Finding 1 is a valid bonus finding, while Finding 2 is mischaracterized as it does not represent a security vulnerability.\n  \"\n}\n```"
}