{
  "sample_id": "ss_tc_014",
  "variant": "shapeshifter_l3",
  "detector_model": "claude-opus-4-5",
  "prompt_type": "direct",
  "judge_model": "mistral-large",
  "timestamp": "2026-01-06T00:27:24.639748+00:00",
  "overall_verdict": {
    "said_vulnerable": true,
    "confidence_expressed": 0.95
  },
  "findings": [
    {
      "finding_id": 0,
      "vulnerability_type_claimed": "Arbitrary External Call",
      "location_claimed": "_0x390062 function in YieldController",
      "classification": "TARGET_MATCH",
      "reasoning": "\n        **Root Cause Match**: The finding correctly identifies that the function _0x390062 allows arbitrary external calls with user-provided targets and data without validation. This matches the ground truth root cause, which emphasizes the lack of validation in the controller's swap function enabling arbitrary calls.\n        **Location Match**: The finding correctly identifies the vulnerable function as _0x390062, which matches the ground truth.\n        **Type Match**: The type 'Arbitrary External Call' is a semantic match to 'access_control' in the context of this vulnerability, as the root issue is the lack of access control over who can trigger these arbitrary calls.\n        **Quality**: The root cause identification is precise, the attack vector is concrete and valid, and the suggested fix aligns with the ground truth (adding access control)."
    },
    {
      "finding_id": 1,
      "vulnerability_type_claimed": "Missing Access Control",
      "location_claimed": "_0x7d6277 and _0x6ff151 functions in YieldStrategy",
      "classification": "BONUS_VALID",
      "reasoning": "\n        **Bonus Validity**: This finding identifies a real vulnerability not covered in the ground truth. The functions _0x7d6277 and _0x6ff151 lack access control, allowing anyone to trigger fund transfers. The attack scenario is concrete (griefing, front-running, or draining funds), and the impact is genuine (loss of funds or operational disruption). The suggested fix (adding access control) is valid and remediates the issue."
    }
  ],
  "target_assessment": {
    "complete_found": true,
    "partial_found": false,
    "finding_id": 0,
    "root_cause_match": true,
    "location_match": true,
    "type_match": "semantic",
    "root_cause_identification": {
      "score": 1.0,
      "reasoning": "The finding precisely matches the ground truth root cause: the controller allows arbitrary external calls with user-provided targets and data without validation, and strategy functions lack access control checks."
    },
    "attack_vector_validity": {
      "score": 1.0,
      "reasoning": "The attack scenario is concrete and matches the ground truth: an attacker can craft malicious calls to drain funds or manipulate state by leveraging the arbitrary call functionality."
    },
    "fix_suggestion_validity": {
      "score": 0.9,
      "reasoning": "The suggested fix (adding access control) aligns with the ground truth. The additional suggestion of whitelisting targets is a valid enhancement, though not explicitly mentioned in the ground truth."
    }
  },
  "summary": {},
  "notes": "Finding 0 is a clear TARGET_MATCH, while Finding 1 is a valid bonus issue not covered in the ground truth. The evaluation strictly adheres to the criteria for root cause, location, and type matching.",
  "judge_latency_ms": 13914.540767669678,
  "raw_response": "```json\n{\n  \"overall_verdict\": {\n    \"said_vulnerable\": true,\n    \"confidence_expressed\": 0.95\n  },\n  \"findings\": [\n    {\n      \"finding_id\": 0,\n      \"vulnerability_type_claimed\": \"Arbitrary External Call\",\n      \"location_claimed\": \"_0x390062 function in YieldController\",\n      \"classification\": \"TARGET_MATCH\",\n      \"reasoning\": \"\n        **Root Cause Match**: The finding correctly identifies that the function _0x390062 allows arbitrary external calls with user-provided targets and data without validation. This matches the ground truth root cause, which emphasizes the lack of validation in the controller's swap function enabling arbitrary calls.\n        **Location Match**: The finding correctly identifies the vulnerable function as _0x390062, which matches the ground truth.\n        **Type Match**: The type 'Arbitrary External Call' is a semantic match to 'access_control' in the context of this vulnerability, as the root issue is the lack of access control over who can trigger these arbitrary calls.\n        **Quality**: The root cause identification is precise, the attack vector is concrete and valid, and the suggested fix aligns with the ground truth (adding access control).\"\n    },\n    {\n      \"finding_id\": 1,\n      \"vulnerability_type_claimed\": \"Missing Access Control\",\n      \"location_claimed\": \"_0x7d6277 and _0x6ff151 functions in YieldStrategy\",\n      \"classification\": \"BONUS_VALID\",\n      \"reasoning\": \"\n        **Bonus Validity**: This finding identifies a real vulnerability not covered in the ground truth. The functions _0x7d6277 and _0x6ff151 lack access control, allowing anyone to trigger fund transfers. The attack scenario is concrete (griefing, front-running, or draining funds), and the impact is genuine (loss of funds or operational disruption). The suggested fix (adding access control) is valid and remediates the issue.\"\n    }\n  ],\n  \"target_assessment\": {\n    \"complete_found\": true,\n    \"partial_found\": false,\n    \"finding_id\": 0,\n    \"root_cause_match\": true,\n    \"location_match\": true,\n    \"type_match\": \"semantic\",\n    \"root_cause_identification\": {\n      \"score\": 1.0,\n      \"reasoning\": \"The finding precisely matches the ground truth root cause: the controller allows arbitrary external calls with user-provided targets and data without validation, and strategy functions lack access control checks.\"\n    },\n    \"attack_vector_validity\": {\n      \"score\": 1.0,\n      \"reasoning\": \"The attack scenario is concrete and matches the ground truth: an attacker can craft malicious calls to drain funds or manipulate state by leveraging the arbitrary call functionality.\"\n    },\n    \"fix_suggestion_validity\": {\n      \"score\": 0.9,\n      \"reasoning\": \"The suggested fix (adding access control) aligns with the ground truth. The additional suggestion of whitelisting targets is a valid enhancement, though not explicitly mentioned in the ground truth.\"\n    }\n  },\n  \"notes\": \"Finding 0 is a clear TARGET_MATCH, while Finding 1 is a valid bonus issue not covered in the ground truth. The evaluation strictly adheres to the criteria for root cause, location, and type matching.\"\n}\n```"
}