{
  "sample_id": "ss_tc_034",
  "variant": "shapeshifter_l3",
  "detector_model": "claude-opus-4-5",
  "prompt_type": "direct",
  "judge_model": "mistral-large",
  "timestamp": "2026-01-06T00:31:33.960442+00:00",
  "overall_verdict": {
    "said_vulnerable": true,
    "confidence_expressed": 0.92
  },
  "findings": [
    {
      "finding_id": 0,
      "vulnerability_type_claimed": "Price Oracle Manipulation",
      "location_claimed": "PoolOracle._0x7248ad",
      "classification": "TARGET_MATCH",
      "reasoning": "\n        **Root Cause Match**: The finding correctly identifies the root cause as oracle reliance on manipulable Curve pool spot prices without TWAP or external validation. The explanation explicitly mentions the vulnerability of deriving prices directly from pool balances (`_0x771f54`), which can be manipulated within a single transaction via large swaps. This matches the ground truth's key weaknesses: no TWAP, reliance on spot prices, and no external validation.\n\n        **Location Match**: The finding correctly identifies the vulnerable function `_0x7248ad` in `PoolOracle`, which is one of the ground truth functions. While the ground truth also includes `_0xd860ea` and `_0x3454e7` in `LendingPool`, the root cause originates from `_0x7248ad`, and the finding's location is a subset of the ground truth's broader scope. This is acceptable for a match.\n\n        **Type Match**: The type 'Price Oracle Manipulation' is a semantic match to the ground truth's 'price_oracle_manipulation'.\n\n        **Attack Scenario**: The attack scenario is concrete and aligns with the ground truth's description, detailing how an attacker can manipulate pool balances to inflate collateral value and borrow excess assets. The steps are technically accurate and reflect the real-world exploit.\n\n        **Fix Suggestion**: The suggested fix (TWAP oracles, Chainlink integration) matches the ground truth's remediation steps.\n      "
    },
    {
      "finding_id": 1,
      "vulnerability_type_claimed": "Missing Collateralization Check on Withdrawal",
      "location_claimed": "LendingPool._0x70dd97",
      "classification": "BONUS_VALID",
      "reasoning": "\n        **Bonus Finding**: This is a valid vulnerability not mentioned in the ground truth. The finding correctly identifies that the withdrawal function `_0x70dd97` lacks a check for outstanding debt, allowing users to withdraw collateral even when their position is undercollateralized. The attack scenario is concrete and technically accurate, demonstrating how an attacker could exploit this to extract value and leave the protocol with bad debt. The suggested fix (health factor check) is appropriate and remediates the issue.\n      "
    }
  ],
  "target_assessment": {
    "complete_found": true,
    "partial_found": false,
    "finding_id": 0,
    "root_cause_match": true,
    "location_match": true,
    "type_match": "semantic",
    "root_cause_identification": {
      "score": 1.0,
      "reasoning": "The finding's root cause explanation is technically accurate and semantically matches the ground truth. It correctly identifies the reliance on manipulable spot prices from Curve pools without TWAP or external validation as the core issue."
    },
    "attack_vector_validity": {
      "score": 1.0,
      "reasoning": "The attack scenario is concrete, step-by-step, and technically valid. It mirrors the real-world exploit described in the ground truth, demonstrating how an attacker can manipulate pool balances to inflate collateral value and borrow excess assets."
    },
    "fix_suggestion_validity": {
      "score": 1.0,
      "reasoning": "The suggested fix (TWAP oracles or Chainlink integration) is technically correct and aligns with the ground truth's remediation steps. It addresses the root cause by replacing manipulable spot prices with more secure price feeds."
    }
  },
  "summary": {},
  "notes": "\n    - The ground truth lists three vulnerable functions (`_0xd860ea`, `_0x3454e7`, `_0x7248ad`), while the finding only mentions `_0x7248ad`. However, the root cause originates from the oracle function (`_0x7248ad`), and the other functions are downstream consumers of the manipulated price. Thus, the location match is still valid.\n    - Finding 1 is classified as BONUS_VALID because it identifies a real, critical vulnerability not covered in the ground truth.\n  ",
  "judge_latency_ms": 17971.13275527954,
  "raw_response": "```json\n{\n  \"overall_verdict\": {\n    \"said_vulnerable\": true,\n    \"confidence_expressed\": 0.92\n  },\n  \"findings\": [\n    {\n      \"finding_id\": 0,\n      \"vulnerability_type_claimed\": \"Price Oracle Manipulation\",\n      \"location_claimed\": \"PoolOracle._0x7248ad\",\n      \"classification\": \"TARGET_MATCH\",\n      \"reasoning\": \"\n        **Root Cause Match**: The finding correctly identifies the root cause as oracle reliance on manipulable Curve pool spot prices without TWAP or external validation. The explanation explicitly mentions the vulnerability of deriving prices directly from pool balances (`_0x771f54`), which can be manipulated within a single transaction via large swaps. This matches the ground truth's key weaknesses: no TWAP, reliance on spot prices, and no external validation.\n\n        **Location Match**: The finding correctly identifies the vulnerable function `_0x7248ad` in `PoolOracle`, which is one of the ground truth functions. While the ground truth also includes `_0xd860ea` and `_0x3454e7` in `LendingPool`, the root cause originates from `_0x7248ad`, and the finding's location is a subset of the ground truth's broader scope. This is acceptable for a match.\n\n        **Type Match**: The type 'Price Oracle Manipulation' is a semantic match to the ground truth's 'price_oracle_manipulation'.\n\n        **Attack Scenario**: The attack scenario is concrete and aligns with the ground truth's description, detailing how an attacker can manipulate pool balances to inflate collateral value and borrow excess assets. The steps are technically accurate and reflect the real-world exploit.\n\n        **Fix Suggestion**: The suggested fix (TWAP oracles, Chainlink integration) matches the ground truth's remediation steps.\n      \"\n    },\n    {\n      \"finding_id\": 1,\n      \"vulnerability_type_claimed\": \"Missing Collateralization Check on Withdrawal\",\n      \"location_claimed\": \"LendingPool._0x70dd97\",\n      \"classification\": \"BONUS_VALID\",\n      \"reasoning\": \"\n        **Bonus Finding**: This is a valid vulnerability not mentioned in the ground truth. The finding correctly identifies that the withdrawal function `_0x70dd97` lacks a check for outstanding debt, allowing users to withdraw collateral even when their position is undercollateralized. The attack scenario is concrete and technically accurate, demonstrating how an attacker could exploit this to extract value and leave the protocol with bad debt. The suggested fix (health factor check) is appropriate and remediates the issue.\n      \"\n    }\n  ],\n  \"target_assessment\": {\n    \"complete_found\": true,\n    \"partial_found\": false,\n    \"finding_id\": 0,\n    \"root_cause_match\": true,\n    \"location_match\": true,\n    \"type_match\": \"semantic\",\n    \"root_cause_identification\": {\n      \"score\": 1.0,\n      \"reasoning\": \"The finding's root cause explanation is technically accurate and semantically matches the ground truth. It correctly identifies the reliance on manipulable spot prices from Curve pools without TWAP or external validation as the core issue.\"\n    },\n    \"attack_vector_validity\": {\n      \"score\": 1.0,\n      \"reasoning\": \"The attack scenario is concrete, step-by-step, and technically valid. It mirrors the real-world exploit described in the ground truth, demonstrating how an attacker can manipulate pool balances to inflate collateral value and borrow excess assets.\"\n    },\n    \"fix_suggestion_validity\": {\n      \"score\": 1.0,\n      \"reasoning\": \"The suggested fix (TWAP oracles or Chainlink integration) is technically correct and aligns with the ground truth's remediation steps. It addresses the root cause by replacing manipulable spot prices with more secure price feeds.\"\n    }\n  },\n  \"notes\": \"\n    - The ground truth lists three vulnerable functions (`_0xd860ea`, `_0x3454e7`, `_0x7248ad`), while the finding only mentions `_0x7248ad`. However, the root cause originates from the oracle function (`_0x7248ad`), and the other functions are downstream consumers of the manipulated price. Thus, the location match is still valid.\n    - Finding 1 is classified as BONUS_VALID because it identifies a real, critical vulnerability not covered in the ground truth.\n  \"\n}\n```"
}