{
  "sample_id": "gs_028",
  "dataset": "gs",
  "prompt_type": "context_protocol_cot_naturalistic",
  "model": "deepseek-v3-2",
  "timestamp": "2026-01-05T16:51:01.834945+00:00",
  "ground_truth": {
    "is_vulnerable": true,
    "vulnerability_type": "access_control",
    "vulnerable_functions": [
      "recover"
    ],
    "severity": "high",
    "description": "When a wallet is behind a checkpointer and a chained signature is used with bit 6 (checkpointer usage flag) set to zero, BaseSig.recover skips the checkpointer validation block (BaseSig.sol:88-106). This leaves _checkpointer and snapshot unset (zero-valued). In recoverChained, the checkpointer is ignored, and the signature validation passes even if the checkpointer should be enforced. The final validation succeeds because snapshot.imageHash == bytes32(0) as the checkpointer is ignored.",
    "root_cause": "When a wallet is behind a checkpointer and a chained signature is used with bit 6 (checkpointer usage flag) set to zero, BaseSig.recover skips the checkpointer validation block (BaseSig.sol:88-106). This leaves _checkpointer and snapshot unset (zero-valued). In recoverChained, the checkpointer is ignored, and the signature validation passes even if the checkpointer should be enforced. The final validation succeeds because snapshot.imageHash == bytes32(0) as the checkpointer is ignored.",
    "attack_scenario": "An evicted signer can sign a payload valid under stale wallet configuration and bypass checkpointer validation. PoC: Add test case to BaseSigTest and run forge test --match-test test_PoC_checkpointer_bypass. The test constructs a chained signature with checkpointer disabled, mocks the checkpointer response, and asserts successful recovery with correct image hash.",
    "fix_description": "Do not permit checkpointer to be disabled (bit 6 unset) if chained signature is used. Revert in this case with custom error. Example fix in BaseSig.sol:\nif (signatureFlag & 0x40 == 0) {\n    revert MissingCheckpointer();\n}",
    "language": "solidity"
  },
  "prediction": {
    "verdict": "vulnerable",
    "confidence": 0.85,
    "vulnerabilities": [
      {
        "type": "Missing Validation",
        "severity": "medium",
        "vulnerable_function": "recoverBranch",
        "location": "Line ~350: while loop flag handling",
        "explanation": "The flag validation switch doesn't handle all possible flag values. Flag 0x0B (11) would fall through to the default revert, but this flag isn't defined in the constants. This could cause valid signatures with undefined flags to be rejected.",
        "attack_scenario": "An attacker could craft a signature with flag 0x0B to cause a transaction to revert, potentially causing denial of service for certain wallet operations.",
        "suggested_fix": "Either define flag 0x0B or ensure the flag validation properly handles all 0-15 range. Consider using a switch statement or ensuring all flags are accounted for."
      },
      {
        "type": "Array Bounds Vulnerability",
        "severity": "high",
        "vulnerable_function": "recover",
        "location": "Line ~80: checkpointerData reading",
        "explanation": "The code reads checkpointerData without verifying the bounds: `bytes memory checkpointerData = _signature[rindex:rindex + checkpointerDataSize];`. If checkpointerDataSize is too large, this will cause an out-of-bounds read.",
        "attack_scenario": "An attacker could craft a signature with a maliciously large checkpointerDataSize that exceeds the signature length, causing the transaction to revert with out-of-bounds error or potentially reading invalid memory.",
        "suggested_fix": "Add bounds checking: `require(rindex + checkpointerDataSize <= _signature.length, \"Invalid checkpointer data size\");`"
      },
      {
        "type": "Uninitialized Memory Usage",
        "severity": "medium",
        "vulnerable_function": "recoverChained",
        "location": "Line ~130: linkedPayload usage",
        "explanation": "`linkedPayload` is declared with only `kind` initialized. Other fields remain uninitialized memory. When passed to `recover()`, these uninitialized values could cause unpredictable behavior.",
        "attack_scenario": "Uninitialized memory could contain leftover data from previous operations, potentially causing incorrect signature validation in chained signatures.",
        "suggested_fix": "Initialize all fields of `linkedPayload` or create a fresh payload struct with default values for chained signature validation."
      }
    ],
    "overall_explanation": "The BaseSig library has several concerning issues that need attention. The array bounds vulnerability is particularly serious as it could lead to crashes or unexpected behavior. The missing flag validation could cause compatibility issues. The code appears to be part of a complex signature system with many edge cases, and these vulnerabilities could affect the reliability of signature validation in Sequence wallets. The UnstakeRequestsManager contract appears unrelated and doesn't have obvious vulnerabilities in the provided snippet."
  },
  "parsing": {
    "success": true,
    "errors": [],
    "raw_response": "Looking at this code, I need to analyze it step by step.\n\n## Step 1: Understand What They're Building\nThis is a signature validation library for Sequence smart contract wallets. It handles:\n- Multiple signature types (ECDSA, ERC1271, Sapient, etc.)\n- Chained signatures for historical configurations\n- Checkpointer integration for additional validation rules\n- Merkle tree construction for multi-sig validation\n- Weight/threshold calculations for authorization\n\n## Step 2: Trace the Code Flow\nThe main entry point is `recover()` which:\n1. Reads signature flags to determine signature type\n2. Handles checkpointer integration if enabled\n3. Routes to either normal or chained signature recovery\n4. Validates signatures and builds merkle tree\n5. Returns threshold, weight, imageHash, checkpoint, and opHash\n\n## Step 3: Look for Potential Issues\nI notice several concerning patterns:\n\n1. **Signature Flag Validation**: The flag validation in `recoverBranch()` has a critical issue - it uses `if/else if` chain but doesn't handle all flags. Flag `0x0B` (11) is undefined but would fall through to the end and revert.\n\n2. **Unchecked Array Access**: In `recover()`, when reading checkpointer data: `bytes memory checkpointerData = _signature[rindex:rindex + checkpointerDataSize];` - there's no bounds checking on `checkpointerDataSize`.\n\n3. **Inconsistent Weight Handling**: For `FLAG_ADDRESS` (0x01), the weight is read but NOT added to the total weight. This seems intentional but could be confusing.\n\n4. **Type Confusion in Chained Signatures**: In `recoverChained()`, when `prevCheckpoint == type(uint256).max`, it calls `recover()` with the original payload, but otherwise uses `linkedPayload`. However, `linkedPayload` only has `kind` set - other fields are uninitialized.\n\n## Step 4: Validate Concerns\nLet me examine each issue more closely:\n\n1. **Missing Flag Handling**: Looking at the flag constants, there are flags 0-10 defined, but the code only handles 0-9 explicitly. Flag 10 (`FLAG_SIGNATURE_SAPIENT_COMPACT`) is handled, but flag 11 would cause a revert. This could be a denial of service if someone crafts a signature with flag 11.\n\n2. **Array Bounds Issue**: The checkpointer data reading doesn't verify that `rindex + checkpointerDataSize <= _signature.length`. This could lead to out-of-bounds reads.\n\n3. **Weight Logic**: For `FLAG_ADDRESS`, the comment says \"Compute the merkle root WITHOUT adding the weight\" - this seems intentional for address-only validation without signature.\n\n4. **Uninitialized Payload**: In `recoverChained()`, `linkedPayload` only has `kind` set. When passed to `recover()`, it will use uninitialized memory values which could cause undefined behavior.\n\n```json\n{\n  \"verdict\": \"vulnerable\",\n  \"confidence\": 0.85,\n  \"vulnerabilities\": [\n    {\n      \"type\": \"Missing Validation\",\n      \"severity\": \"medium\",\n      \"vulnerable_function\": \"recoverBranch\",\n      \"location\": \"Line ~350: while loop flag handling\",\n      \"explanation\": \"The flag validation switch doesn't handle all possible flag values. Flag 0x0B (11) would fall through to the default revert, but this flag isn't defined in the constants. This could cause valid signatures with undefined flags to be rejected.\",\n      \"attack_scenario\": \"An attacker could craft a signature with flag 0x0B to cause a transaction to revert, potentially causing denial of service for certain wallet operations.\",\n      \"suggested_fix\": \"Either define flag 0x0B or ensure the flag validation properly handles all 0-15 range. Consider using a switch statement or ensuring all flags are accounted for.\"\n    },\n    {\n      \"type\": \"Array Bounds Vulnerability\",\n      \"severity\": \"high\",\n      \"vulnerable_function\": \"recover\",\n      \"location\": \"Line ~80: checkpointerData reading\",\n      \"explanation\": \"The code reads checkpointerData without verifying the bounds: `bytes memory checkpointerData = _signature[rindex:rindex + checkpointerDataSize];`. If checkpointerDataSize is too large, this will cause an out-of-bounds read.\",\n      \"attack_scenario\": \"An attacker could craft a signature with a maliciously large checkpointerDataSize that exceeds the signature length, causing the transaction to revert with out-of-bounds error or potentially reading invalid memory.\",\n      \"suggested_fix\": \"Add bounds checking: `require(rindex + checkpointerDataSize <= _signature.length, \\\"Invalid checkpointer data size\\\");`\"\n    },\n    {\n      \"type\": \"Uninitialized Memory Usage\",\n      \"severity\": \"medium\",\n      \"vulnerable_function\": \"recoverChained\",\n      \"location\": \"Line ~130: linkedPayload usage\",\n      \"explanation\": \"`linkedPayload` is declared with only `kind` initialized. Other fields remain uninitialized memory. When passed to `recover()`, these uninitialized values could cause unpredictable behavior.\",\n      \"attack_scenario\": \"Uninitialized memory could contain leftover data from previous operations, potentially causing incorrect signature validation in chained signatures.\",\n      \"suggested_fix\": \"Initialize all fields of `linkedPayload` or create a fresh payload struct with default values for chained signature validation.\"\n    }\n  ],\n  \"overall_explanation\": \"The BaseSig library has several concerning issues that need attention. The array bounds vulnerability is particularly serious as it could lead to crashes or unexpected behavior. The missing flag validation could cause compatibility issues. The code appears to be part of a complex signature system with many edge cases, and these vulnerabilities could affect the reliability of signature validation in Sequence wallets. The UnstakeRequestsManager contract appears unrelated and doesn't have obvious vulnerabilities in the provided snippet.\"\n}\n```"
  },
  "context_info": {
    "has_context_files": true,
    "context_file_count": 1,
    "has_protocol_doc": true
  },
  "api_metrics": {
    "input_tokens": 7673,
    "output_tokens": 1485,
    "latency_ms": 72634.6869468689
  }
}