{
  "sample_id": "ch_medical_tc_046",
  "variant": "chameleon_medical",
  "detector_model": "claude-opus-4-5",
  "prompt_type": "direct",
  "judge_model": "mistral-large",
  "timestamp": "2026-01-06T00:33:34.662333+00:00",
  "overall_verdict": {
    "said_vulnerable": true,
    "confidence_expressed": 0.92
  },
  "findings": [
    {
      "finding_id": 0,
      "vulnerability_type_claimed": "Beneficiary Manipulation by Admin",
      "location_claimed": "collectionRestrictaccessBeneficiary",
      "classification": "TARGET_MATCH",
      "reasoning": "\n        **Root Cause Match**: The finding correctly identifies that the medicalDirector (admin) has unchecked control over beneficiary addresses, allowing them to redirect funds. This matches the ground truth's root cause of 'Single developer had access to admin private keys without multi-sig or oversight, allowing malicious upgrades' in the context of unauthorized control over critical functions. The specific weakness of 'No multi-signature requirement' is implicitly addressed by the finding's focus on admin abuse.\n\n        **Location Match**: The finding targets `collectionRestrictaccessBeneficiary`, which is explicitly listed in the ground truth's vulnerable functions.\n\n        **Type Match**: The type 'Beneficiary Manipulation by Admin' is a semantic match to 'access_control', as it describes an access control vulnerability where an admin abuses their privileges.\n\n        **Attack Scenario**: The scenario aligns with the ground truth's attack flow, where an admin (rogue developer) manipulates user funds by changing withdrawal addresses. The finding's scenario is concrete and demonstrates the same core issue: admin abuse leading to fund redirection.\n\n        **Fix Suggestion**: The suggested fix (removing the function or requiring user consent) directly addresses the root cause by mitigating admin overreach, aligning with the ground truth's recommendation for multi-sig and timelocks.\n      "
    },
    {
      "finding_id": 1,
      "vulnerability_type_claimed": "Unchecked Return Value",
      "location_claimed": "restrictAccess, grantAccess, urgentGrantaccess",
      "classification": "BONUS_VALID",
      "reasoning": "\n        This is a valid vulnerability not covered in the ground truth. The finding correctly identifies that the contract does not check return values for `transferFrom` and `transfer`, which could lead to state inconsistencies if the token returns `false` instead of reverting. The attack scenario is concrete and plausible, and the fix (using SafeERC20) is valid. This is a real issue with a clear impact (fund loss or state corruption).\n      "
    },
    {
      "finding_id": 2,
      "vulnerability_type_claimed": "State Inconsistency on Multiple Locks",
      "location_claimed": "restrictAccess",
      "classification": "BONUS_VALID",
      "reasoning": "\n        This is another valid vulnerability not covered in the ground truth. The finding correctly identifies the inconsistency between `playerAccountcreditsmap` and `playerPreferences` when multiple locks are created. The attack scenario is concrete (funds getting stuck), and the fix (preventing multiple locks or accumulating quantities) is valid. This is a real issue with a clear impact (fund loss).\n      "
    }
  ],
  "target_assessment": {
    "complete_found": true,
    "partial_found": false,
    "finding_id": 0,
    "root_cause_match": true,
    "location_match": true,
    "type_match": "semantic",
    "root_cause_identification": {
      "score": 0.9,
      "reasoning": "\n        The finding accurately identifies the root cause: admin overreach due to lack of multi-sig or oversight. While the ground truth focuses on 'malicious upgrades', the finding's focus on 'beneficiary manipulation' is a specific instance of the same core issue (admin abuse). The explanation is technically accurate and aligns with the ground truth's key weaknesses.\n      "
    },
    "attack_vector_validity": {
      "score": 0.95,
      "reasoning": "\n        The attack scenario is concrete, step-by-step, and demonstrates a real exploit (admin redirecting funds). It matches the ground truth's attack flow in spirit (admin abuse leading to fund redirection) and is technically valid.\n      "
    },
    "fix_suggestion_validity": {
      "score": 0.9,
      "reasoning": "\n        The suggested fix (removing the function or requiring user consent) directly addresses the root cause by mitigating admin overreach. It aligns with the ground truth's recommendation for multi-sig and timelocks, though it proposes a more specific solution for this function.\n      "
    }
  },
  "summary": {},
  "notes": "\n    The ground truth's root cause is broader (admin abuse via upgrades), but the finding's focus on `collectionRestrictaccessBeneficiary` is a specific instance of the same issue. The finding's classification as TARGET_MATCH is justified because it meets all criteria: correct root cause, correct location, and semantic type match. The other findings are valid bonuses.\n  ",
  "judge_latency_ms": 19457.15093612671,
  "raw_response": "```json\n{\n  \"overall_verdict\": {\n    \"said_vulnerable\": true,\n    \"confidence_expressed\": 0.92\n  },\n  \"findings\": [\n    {\n      \"finding_id\": 0,\n      \"vulnerability_type_claimed\": \"Beneficiary Manipulation by Admin\",\n      \"location_claimed\": \"collectionRestrictaccessBeneficiary\",\n      \"classification\": \"TARGET_MATCH\",\n      \"reasoning\": \"\n        **Root Cause Match**: The finding correctly identifies that the medicalDirector (admin) has unchecked control over beneficiary addresses, allowing them to redirect funds. This matches the ground truth's root cause of 'Single developer had access to admin private keys without multi-sig or oversight, allowing malicious upgrades' in the context of unauthorized control over critical functions. The specific weakness of 'No multi-signature requirement' is implicitly addressed by the finding's focus on admin abuse.\n\n        **Location Match**: The finding targets `collectionRestrictaccessBeneficiary`, which is explicitly listed in the ground truth's vulnerable functions.\n\n        **Type Match**: The type 'Beneficiary Manipulation by Admin' is a semantic match to 'access_control', as it describes an access control vulnerability where an admin abuses their privileges.\n\n        **Attack Scenario**: The scenario aligns with the ground truth's attack flow, where an admin (rogue developer) manipulates user funds by changing withdrawal addresses. The finding's scenario is concrete and demonstrates the same core issue: admin abuse leading to fund redirection.\n\n        **Fix Suggestion**: The suggested fix (removing the function or requiring user consent) directly addresses the root cause by mitigating admin overreach, aligning with the ground truth's recommendation for multi-sig and timelocks.\n      \"\n    },\n    {\n      \"finding_id\": 1,\n      \"vulnerability_type_claimed\": \"Unchecked Return Value\",\n      \"location_claimed\": \"restrictAccess, grantAccess, urgentGrantaccess\",\n      \"classification\": \"BONUS_VALID\",\n      \"reasoning\": \"\n        This is a valid vulnerability not covered in the ground truth. The finding correctly identifies that the contract does not check return values for `transferFrom` and `transfer`, which could lead to state inconsistencies if the token returns `false` instead of reverting. The attack scenario is concrete and plausible, and the fix (using SafeERC20) is valid. This is a real issue with a clear impact (fund loss or state corruption).\n      \"\n    },\n    {\n      \"finding_id\": 2,\n      \"vulnerability_type_claimed\": \"State Inconsistency on Multiple Locks\",\n      \"location_claimed\": \"restrictAccess\",\n      \"classification\": \"BONUS_VALID\",\n      \"reasoning\": \"\n        This is another valid vulnerability not covered in the ground truth. The finding correctly identifies the inconsistency between `playerAccountcreditsmap` and `playerPreferences` when multiple locks are created. The attack scenario is concrete (funds getting stuck), and the fix (preventing multiple locks or accumulating quantities) is valid. This is a real issue with a clear impact (fund loss).\n      \"\n    }\n  ],\n  \"target_assessment\": {\n    \"complete_found\": true,\n    \"partial_found\": false,\n    \"finding_id\": 0,\n    \"root_cause_match\": true,\n    \"location_match\": true,\n    \"type_match\": \"semantic\",\n    \"root_cause_identification\": {\n      \"score\": 0.9,\n      \"reasoning\": \"\n        The finding accurately identifies the root cause: admin overreach due to lack of multi-sig or oversight. While the ground truth focuses on 'malicious upgrades', the finding's focus on 'beneficiary manipulation' is a specific instance of the same core issue (admin abuse). The explanation is technically accurate and aligns with the ground truth's key weaknesses.\n      \"\n    },\n    \"attack_vector_validity\": {\n      \"score\": 0.95,\n      \"reasoning\": \"\n        The attack scenario is concrete, step-by-step, and demonstrates a real exploit (admin redirecting funds). It matches the ground truth's attack flow in spirit (admin abuse leading to fund redirection) and is technically valid.\n      \"\n    },\n    \"fix_suggestion_validity\": {\n      \"score\": 0.9,\n      \"reasoning\": \"\n        The suggested fix (removing the function or requiring user consent) directly addresses the root cause by mitigating admin overreach. It aligns with the ground truth's recommendation for multi-sig and timelocks, though it proposes a more specific solution for this function.\n      \"\n    }\n  },\n  \"notes\": \"\n    The ground truth's root cause is broader (admin abuse via upgrades), but the finding's focus on `collectionRestrictaccessBeneficiary` is a specific instance of the same issue. The finding's classification as TARGET_MATCH is justified because it meets all criteria: correct root cause, correct location, and semantic type match. The other findings are valid bonuses.\n  \"\n}\n```"
}