{
  "sample_id": "ch_medical_tc_014",
  "variant": "chameleon_medical",
  "detector_model": "claude-opus-4-5",
  "prompt_type": "direct",
  "judge_model": "mistral-large",
  "timestamp": "2026-01-06T00:27:04.662429+00:00",
  "overall_verdict": {
    "said_vulnerable": true,
    "confidence_expressed": 0.95
  },
  "findings": [
    {
      "finding_id": 0,
      "vulnerability_type_claimed": "Arbitrary External Call",
      "location_claimed": "YieldController.exchangecredentialsExactJarForJar",
      "classification": "TARGET_MATCH",
      "reasoning": "\n        **Root Cause Match**: The finding correctly identifies that the `exchangecredentialsExactJarForJar` function allows arbitrary external calls with user-provided targets and data without validation. This matches the ground truth root cause exactly.\n        **Location Match**: The finding correctly identifies the vulnerable function as `exchangecredentialsExactJarForJar`.\n        **Type Match**: The type 'Arbitrary External Call' is a semantic match to 'access_control' in the context of this vulnerability, as the root issue is the lack of access control over arbitrary calls.\n        **Quality**: The explanation is detailed, the attack scenario is concrete, and the fix suggestion is valid and aligns with the ground truth fix.\n      "
    },
    {
      "finding_id": 1,
      "vulnerability_type_claimed": "Missing Access Control",
      "location_claimed": "YieldStrategy.dischargeAllFunds and YieldStrategy.dischargeFunds",
      "classification": "BONUS_VALID",
      "reasoning": "\n        **Bonus Valid**: This finding identifies a real, separate vulnerability not covered in the ground truth. The functions `dischargeAllFunds` and `dischargeFunds` lack access control, allowing unauthorized draining of strategy funds. The attack scenario is concrete, and the impact is genuine (disruption of protocol operations). The fix suggestion is valid and remediates the issue.\n      "
    }
  ],
  "target_assessment": {
    "complete_found": true,
    "partial_found": false,
    "finding_id": 0,
    "root_cause_match": true,
    "location_match": true,
    "type_match": "semantic",
    "root_cause_identification": {
      "score": 1.0,
      "reasoning": "The finding's root cause explanation semantically matches the ground truth, identifying the lack of validation for arbitrary external calls and the resulting security implications."
    },
    "attack_vector_validity": {
      "score": 1.0,
      "reasoning": "The attack scenario is concrete, step-by-step, and technically accurate, matching the ground truth scenario."
    },
    "fix_suggestion_validity": {
      "score": 1.0,
      "reasoning": "The fix suggestion (access control + whitelisting or removal of arbitrary calls) aligns with the ground truth fix and is technically correct."
    }
  },
  "summary": {},
  "notes": "\n    Finding 0 is a clear TARGET_MATCH, as it meets all criteria for root cause, location, and type. Finding 1 is a valid bonus finding, as it identifies a separate access control issue in the strategy contract that was not part of the ground truth but is a real vulnerability.\n  ",
  "judge_latency_ms": 13358.72483253479,
  "raw_response": "```json\n{\n  \"overall_verdict\": {\n    \"said_vulnerable\": true,\n    \"confidence_expressed\": 0.95\n  },\n  \"findings\": [\n    {\n      \"finding_id\": 0,\n      \"vulnerability_type_claimed\": \"Arbitrary External Call\",\n      \"location_claimed\": \"YieldController.exchangecredentialsExactJarForJar\",\n      \"classification\": \"TARGET_MATCH\",\n      \"reasoning\": \"\n        **Root Cause Match**: The finding correctly identifies that the `exchangecredentialsExactJarForJar` function allows arbitrary external calls with user-provided targets and data without validation. This matches the ground truth root cause exactly.\n        **Location Match**: The finding correctly identifies the vulnerable function as `exchangecredentialsExactJarForJar`.\n        **Type Match**: The type 'Arbitrary External Call' is a semantic match to 'access_control' in the context of this vulnerability, as the root issue is the lack of access control over arbitrary calls.\n        **Quality**: The explanation is detailed, the attack scenario is concrete, and the fix suggestion is valid and aligns with the ground truth fix.\n      \"\n    },\n    {\n      \"finding_id\": 1,\n      \"vulnerability_type_claimed\": \"Missing Access Control\",\n      \"location_claimed\": \"YieldStrategy.dischargeAllFunds and YieldStrategy.dischargeFunds\",\n      \"classification\": \"BONUS_VALID\",\n      \"reasoning\": \"\n        **Bonus Valid**: This finding identifies a real, separate vulnerability not covered in the ground truth. The functions `dischargeAllFunds` and `dischargeFunds` lack access control, allowing unauthorized draining of strategy funds. The attack scenario is concrete, and the impact is genuine (disruption of protocol operations). The fix suggestion is valid and remediates the issue.\n      \"\n    }\n  ],\n  \"target_assessment\": {\n    \"complete_found\": true,\n    \"partial_found\": false,\n    \"finding_id\": 0,\n    \"root_cause_match\": true,\n    \"location_match\": true,\n    \"type_match\": \"semantic\",\n    \"root_cause_identification\": {\n      \"score\": 1.0,\n      \"reasoning\": \"The finding's root cause explanation semantically matches the ground truth, identifying the lack of validation for arbitrary external calls and the resulting security implications.\"\n    },\n    \"attack_vector_validity\": {\n      \"score\": 1.0,\n      \"reasoning\": \"The attack scenario is concrete, step-by-step, and technically accurate, matching the ground truth scenario.\"\n    },\n    \"fix_suggestion_validity\": {\n      \"score\": 1.0,\n      \"reasoning\": \"The fix suggestion (access control + whitelisting or removal of arbitrary calls) aligns with the ground truth fix and is technically correct.\"\n    }\n  },\n  \"notes\": \"\n    Finding 0 is a clear TARGET_MATCH, as it meets all criteria for root cause, location, and type. Finding 1 is a valid bonus finding, as it identifies a separate access control issue in the strategy contract that was not part of the ground truth but is a real vulnerability.\n  \"\n}\n```"
}