{
  "sample_id": "ch_medical_tc_009",
  "variant": "chameleon_medical",
  "detector_model": "claude-opus-4-5",
  "prompt_type": "direct",
  "judge_model": "mistral-large",
  "timestamp": "2026-01-06T00:26:11.248594+00:00",
  "overall_verdict": {
    "said_vulnerable": true,
    "confidence_expressed": 0.92
  },
  "findings": [
    {
      "finding_id": 0,
      "vulnerability_type_claimed": "Reentrancy",
      "location_claimed": "dischargeFunds",
      "classification": "TARGET_MATCH",
      "reasoning": "\n        **Root Cause Match**: The finding correctly identifies the root cause as the token transfer (ERC777) occurring before state updates, combined with the ERC777 tokensToSend hook allowing reentrancy. This matches the ground truth's specific root cause (checks-effects-interactions violation with token hooks).\n        **Location Match**: The finding correctly identifies the `dischargeFunds` function as the vulnerable location.\n        **Type Match**: The type 'Reentrancy' is an exact match to the ground truth.\n        **Attack Scenario**: The provided attack scenario is concrete and matches the ground truth's description of recursive withdrawals through ERC777 callbacks.\n        **Fix Suggestion**: The suggested fix (updating state before external calls) is correct and aligns with the ground truth's recommended fix.\n      "
    },
    {
      "finding_id": 1,
      "vulnerability_type_claimed": "Incorrect Token Transfer Logic",
      "location_claimed": "provideResources",
      "classification": "BONUS_VALID",
      "reasoning": "\n        **Bonus Validity**: This is a real vulnerability not mentioned in the ground truth. The issue exists in the `provideResources` function where `transfer()` is used incorrectly to receive tokens (should use `transferFrom`). The attack scenario is concrete and profitable (users can withdraw tokens they never deposited). The impact is genuine (loss of funds for other depositors). The fix suggestion (using `transferFrom`) is correct and remediates the issue.\n      "
    }
  ],
  "target_assessment": {
    "complete_found": true,
    "partial_found": false,
    "finding_id": 0,
    "root_cause_match": true,
    "location_match": true,
    "type_match": "exact",
    "root_cause_identification": {
      "score": 1.0,
      "reasoning": "The root cause is identified with high precision, matching the ground truth's specific explanation of ERC777 reentrancy due to token transfer before state updates."
    },
    "attack_vector_validity": {
      "score": 1.0,
      "reasoning": "The attack scenario is concrete, step-by-step, and technically accurate, matching the ground truth's description of recursive withdrawals through ERC777 hooks."
    },
    "fix_suggestion_validity": {
      "score": 1.0,
      "reasoning": "The fix suggestion (updating state before external calls) is correct and aligns with the ground truth's recommended fix."
    }
  },
  "summary": {},
  "notes": "Finding 0 is a perfect TARGET_MATCH. Finding 1 is a valid bonus finding that meets all BONUS_VALID criteria.",
  "judge_latency_ms": 15187.938928604126,
  "raw_response": "```json\n{\n  \"overall_verdict\": {\n    \"said_vulnerable\": true,\n    \"confidence_expressed\": 0.92\n  },\n  \"findings\": [\n    {\n      \"finding_id\": 0,\n      \"vulnerability_type_claimed\": \"Reentrancy\",\n      \"location_claimed\": \"dischargeFunds\",\n      \"classification\": \"TARGET_MATCH\",\n      \"reasoning\": \"\n        **Root Cause Match**: The finding correctly identifies the root cause as the token transfer (ERC777) occurring before state updates, combined with the ERC777 tokensToSend hook allowing reentrancy. This matches the ground truth's specific root cause (checks-effects-interactions violation with token hooks).\n        **Location Match**: The finding correctly identifies the `dischargeFunds` function as the vulnerable location.\n        **Type Match**: The type 'Reentrancy' is an exact match to the ground truth.\n        **Attack Scenario**: The provided attack scenario is concrete and matches the ground truth's description of recursive withdrawals through ERC777 callbacks.\n        **Fix Suggestion**: The suggested fix (updating state before external calls) is correct and aligns with the ground truth's recommended fix.\n      \"\n    },\n    {\n      \"finding_id\": 1,\n      \"vulnerability_type_claimed\": \"Incorrect Token Transfer Logic\",\n      \"location_claimed\": \"provideResources\",\n      \"classification\": \"BONUS_VALID\",\n      \"reasoning\": \"\n        **Bonus Validity**: This is a real vulnerability not mentioned in the ground truth. The issue exists in the `provideResources` function where `transfer()` is used incorrectly to receive tokens (should use `transferFrom`). The attack scenario is concrete and profitable (users can withdraw tokens they never deposited). The impact is genuine (loss of funds for other depositors). The fix suggestion (using `transferFrom`) is correct and remediates the issue.\n      \"\n    }\n  ],\n  \"target_assessment\": {\n    \"complete_found\": true,\n    \"partial_found\": false,\n    \"finding_id\": 0,\n    \"root_cause_match\": true,\n    \"location_match\": true,\n    \"type_match\": \"exact\",\n    \"root_cause_identification\": {\n      \"score\": 1.0,\n      \"reasoning\": \"The root cause is identified with high precision, matching the ground truth's specific explanation of ERC777 reentrancy due to token transfer before state updates.\"\n    },\n    \"attack_vector_validity\": {\n      \"score\": 1.0,\n      \"reasoning\": \"The attack scenario is concrete, step-by-step, and technically accurate, matching the ground truth's description of recursive withdrawals through ERC777 hooks.\"\n    },\n    \"fix_suggestion_validity\": {\n      \"score\": 1.0,\n      \"reasoning\": \"The fix suggestion (updating state before external calls) is correct and aligns with the ground truth's recommended fix.\"\n    }\n  },\n  \"notes\": \"Finding 0 is a perfect TARGET_MATCH. Finding 1 is a valid bonus finding that meets all BONUS_VALID criteria.\"\n}\n```"
}