{
  "sample_id": "ds_t2_036",
  "detector_model": "gpt-5.2",
  "prompt_type": "direct",
  "judge_model": "mistral-large",
  "timestamp": "2026-01-06T02:19:27.717760+00:00",
  "overall_verdict": {
    "said_vulnerable": true,
    "confidence_expressed": 0.95
  },
  "findings": [
    {
      "finding_id": 0,
      "vulnerability_type_claimed": "Unprotected initializer / constructor naming bug (owner takeover)",
      "location_claimed": "function DynamicPyramid()",
      "classification": "TARGET_MATCH",
      "reasoning": "\n        **Root Cause Match**: The ground truth specifies an access control vulnerability in the `DynamicPyramid` function due to missing or incorrect authorization checks. The model correctly identifies that `DynamicPyramid()` is not a constructor (due to naming mismatch with the contract) and is publicly callable, allowing any user to become the `creator` and gain unauthorized access to `onlyowner` functions. This matches the ground truth's root cause of improper access control.\n        **Location Match**: The model correctly identifies the vulnerable function as `DynamicPyramid()`, which matches the ground truth.\n        **Type Match**: The model's type 'Unprotected initializer / constructor naming bug (owner takeover)' is a semantic match to the ground truth's 'access_control'. Both describe the same underlying issue of improper access control due to a constructor naming bug.\n      "
    },
    {
      "finding_id": 1,
      "vulnerability_type_claimed": "Silent payout failure due to unchecked send return value (fund locking / accounting corruption)",
      "location_claimed": "addPayout(): participants[payoutOrder].etherAddress.send(payoutToSend);",
      "classification": "BONUS_VALID",
      "reasoning": "\n        This finding is a real vulnerability not covered in the ground truth. The model provides a concrete attack scenario (attacker deploys a contract with a reverting fallback to cause silent payout failure) and demonstrates how it leads to fund locking and accounting corruption. The impact is genuine (loss of funds) and does not require a trusted role to be compromised. Thus, it qualifies as BONUS_VALID.\n      "
    },
    {
      "finding_id": 2,
      "vulnerability_type_claimed": "Out-of-bounds array access leading to denial of service (DoS)",
      "location_claimed": "addPayout(): while (balance > participants[payoutOrder].payout) { ... }",
      "classification": "BONUS_VALID",
      "reasoning": "\n        This finding is another real vulnerability not covered in the ground truth. The model explains how an out-of-bounds array access can occur when `payoutOrder` equals `participants.length`, leading to a permanent DoS of the contract's core functionality. The attack scenario is concrete and the impact is genuine (contract bricking). Thus, it qualifies as BONUS_VALID.\n      "
    }
  ],
  "target_assessment": {
    "complete_found": true,
    "partial_found": false,
    "finding_id": 0,
    "root_cause_match": true,
    "location_match": true,
    "type_match": "semantic",
    "root_cause_identification": {
      "score": 1.0,
      "reasoning": "The model's explanation of the root cause (constructor naming bug leading to public callability and owner takeover) is technically accurate and semantically matches the ground truth's access control vulnerability. The explanation is detailed and specific."
    },
    "attack_vector_validity": {
      "score": 1.0,
      "reasoning": "The model provides a concrete, step-by-step attack scenario that is technically valid and demonstrates how an attacker can exploit the vulnerability to steal fees and manipulate contract settings. The scenario is highly plausible and aligns with the root cause."
    },
    "fix_suggestion_validity": {
      "score": 1.0,
      "reasoning": "The model's suggested fix (renaming the constructor to match the contract name or using a modern constructor syntax) is correct and directly addresses the root cause. The fix is actionable and remediates the issue."
    }
  },
  "summary": {},
  "notes": "The model correctly identified the TARGET vulnerability (Finding 0) and also uncovered two additional valid vulnerabilities (Findings 1 and 2) that were not part of the ground truth. The evaluation of the TARGET vulnerability is strict and aligns with the provided criteria.",
  "judge_latency_ms": 16594.99216079712,
  "raw_response": "```json\n{\n  \"overall_verdict\": {\n    \"said_vulnerable\": true,\n    \"confidence_expressed\": 0.95\n  },\n  \"findings\": [\n    {\n      \"finding_id\": 0,\n      \"vulnerability_type_claimed\": \"Unprotected initializer / constructor naming bug (owner takeover)\",\n      \"location_claimed\": \"function DynamicPyramid()\",\n      \"classification\": \"TARGET_MATCH\",\n      \"reasoning\": \"\n        **Root Cause Match**: The ground truth specifies an access control vulnerability in the `DynamicPyramid` function due to missing or incorrect authorization checks. The model correctly identifies that `DynamicPyramid()` is not a constructor (due to naming mismatch with the contract) and is publicly callable, allowing any user to become the `creator` and gain unauthorized access to `onlyowner` functions. This matches the ground truth's root cause of improper access control.\n        **Location Match**: The model correctly identifies the vulnerable function as `DynamicPyramid()`, which matches the ground truth.\n        **Type Match**: The model's type 'Unprotected initializer / constructor naming bug (owner takeover)' is a semantic match to the ground truth's 'access_control'. Both describe the same underlying issue of improper access control due to a constructor naming bug.\n      \"\n    },\n    {\n      \"finding_id\": 1,\n      \"vulnerability_type_claimed\": \"Silent payout failure due to unchecked send return value (fund locking / accounting corruption)\",\n      \"location_claimed\": \"addPayout(): participants[payoutOrder].etherAddress.send(payoutToSend);\",\n      \"classification\": \"BONUS_VALID\",\n      \"reasoning\": \"\n        This finding is a real vulnerability not covered in the ground truth. The model provides a concrete attack scenario (attacker deploys a contract with a reverting fallback to cause silent payout failure) and demonstrates how it leads to fund locking and accounting corruption. The impact is genuine (loss of funds) and does not require a trusted role to be compromised. Thus, it qualifies as BONUS_VALID.\n      \"\n    },\n    {\n      \"finding_id\": 2,\n      \"vulnerability_type_claimed\": \"Out-of-bounds array access leading to denial of service (DoS)\",\n      \"location_claimed\": \"addPayout(): while (balance > participants[payoutOrder].payout) { ... }\",\n      \"classification\": \"BONUS_VALID\",\n      \"reasoning\": \"\n        This finding is another real vulnerability not covered in the ground truth. The model explains how an out-of-bounds array access can occur when `payoutOrder` equals `participants.length`, leading to a permanent DoS of the contract's core functionality. The attack scenario is concrete and the impact is genuine (contract bricking). Thus, it qualifies as BONUS_VALID.\n      \"\n    }\n  ],\n  \"target_assessment\": {\n    \"complete_found\": true,\n    \"partial_found\": false,\n    \"finding_id\": 0,\n    \"root_cause_match\": true,\n    \"location_match\": true,\n    \"type_match\": \"semantic\",\n    \"root_cause_identification\": {\n      \"score\": 1.0,\n      \"reasoning\": \"The model's explanation of the root cause (constructor naming bug leading to public callability and owner takeover) is technically accurate and semantically matches the ground truth's access control vulnerability. The explanation is detailed and specific.\"\n    },\n    \"attack_vector_validity\": {\n      \"score\": 1.0,\n      \"reasoning\": \"The model provides a concrete, step-by-step attack scenario that is technically valid and demonstrates how an attacker can exploit the vulnerability to steal fees and manipulate contract settings. The scenario is highly plausible and aligns with the root cause.\"\n    },\n    \"fix_suggestion_validity\": {\n      \"score\": 1.0,\n      \"reasoning\": \"The model's suggested fix (renaming the constructor to match the contract name or using a modern constructor syntax) is correct and directly addresses the root cause. The fix is actionable and remediates the issue.\"\n    }\n  },\n  \"notes\": \"The model correctly identified the TARGET vulnerability (Finding 0) and also uncovered two additional valid vulnerabilities (Findings 1 and 2) that were not part of the ground truth. The evaluation of the TARGET vulnerability is strict and aligns with the provided criteria.\"\n}\n```"
}