{
  "sample_id": "ds_t2_068",
  "detector_model": "gpt-5.2",
  "prompt_type": "direct",
  "judge_model": "mistral-large",
  "timestamp": "2026-01-06T02:21:23.809493+00:00",
  "overall_verdict": {
    "said_vulnerable": true,
    "confidence_expressed": 0.95
  },
  "findings": [
    {
      "finding_id": 0,
      "vulnerability_type_claimed": "Uninitialized storage pointer / storage corruption (Solidity 0.4.x)",
      "location_claimed": "register(): `NameRecord newRecord;`",
      "classification": "TARGET_MATCH",
      "reasoning": "\n        **Root Cause Match**: The ground truth specifies a 'logic_error' in the `register` function without detailing the root cause. The model's finding identifies a SPECIFIC logic error (uninitialized storage pointer in Solidity 0.4.x) that directly explains the unintended behavior. This is a concrete instance of a logic error, matching the ground truth's description of a logic error causing unintended behavior.\n\n        **Location Match**: The model correctly identifies the `register` function as the vulnerable location, matching the ground truth.\n\n        **Type Match**: The model's type 'Uninitialized storage pointer / storage corruption (Solidity 0.4.x)' is a semantic match to 'logic_error' as it describes a specific logic error in the contract's implementation.\n\n        The finding provides a detailed explanation of the root cause, attack scenario, and fix, all of which are technically accurate and align with the ground truth's requirements.\n      "
    },
    {
      "finding_id": 1,
      "vulnerability_type_claimed": "Missing authorization/uniqueness check for name ownership (name hijacking)",
      "location_claimed": "register(): `resolve[_name] = _mappedAddress;`",
      "classification": "BONUS_VALID",
      "reasoning": "\n        This finding identifies a real vulnerability (name hijacking) that exists in the code and is not covered by the ground truth. The attack scenario is concrete and does not require a trusted role to be compromised. The impact (unauthorized overwriting of name mappings) is genuine and critical. Thus, it qualifies as a BONUS_VALID finding.\n      "
    }
  ],
  "target_assessment": {
    "complete_found": true,
    "partial_found": false,
    "finding_id": 0,
    "root_cause_match": true,
    "location_match": true,
    "type_match": "semantic",
    "root_cause_identification": {
      "score": 1.0,
      "reasoning": "\n        The model's root cause explanation is technically accurate and provides a valid alternative to the unspecified ground truth root cause. It clearly identifies the uninitialized storage pointer issue, which is the actual root cause of the logic error in the contract.\n      "
    },
    "attack_vector_validity": {
      "score": 1.0,
      "reasoning": "\n        The model's attack scenario is concrete, step-by-step, and technically valid. It demonstrates how the uninitialized storage pointer can be exploited to bypass the `require(unlocked)` check and corrupt storage, which aligns with the ground truth's description of unintended behavior.\n      "
    },
    "fix_suggestion_validity": {
      "score": 1.0,
      "reasoning": "\n        The model's suggested fix is technically correct and remediates the issue by preventing the uninitialized storage pointer problem. It also includes an additional best practice (moving `require(unlocked)` to the top of the function), which is a valid enhancement.\n      "
    }
  },
  "summary": {},
  "notes": "\n    The ground truth's description of the vulnerability is vague ('logic_error' with no root cause or attack scenario specified). The model's first finding provides a precise and actionable explanation of the actual vulnerability, which is a significant improvement over the ground truth. The second finding is a valid bonus issue not covered by the ground truth.\n  ",
  "judge_latency_ms": 14519.655227661133,
  "raw_response": "```json\n{\n  \"overall_verdict\": {\n    \"said_vulnerable\": true,\n    \"confidence_expressed\": 0.95\n  },\n  \"findings\": [\n    {\n      \"finding_id\": 0,\n      \"vulnerability_type_claimed\": \"Uninitialized storage pointer / storage corruption (Solidity 0.4.x)\",\n      \"location_claimed\": \"register(): `NameRecord newRecord;`\",\n      \"classification\": \"TARGET_MATCH\",\n      \"reasoning\": \"\n        **Root Cause Match**: The ground truth specifies a 'logic_error' in the `register` function without detailing the root cause. The model's finding identifies a SPECIFIC logic error (uninitialized storage pointer in Solidity 0.4.x) that directly explains the unintended behavior. This is a concrete instance of a logic error, matching the ground truth's description of a logic error causing unintended behavior.\n\n        **Location Match**: The model correctly identifies the `register` function as the vulnerable location, matching the ground truth.\n\n        **Type Match**: The model's type 'Uninitialized storage pointer / storage corruption (Solidity 0.4.x)' is a semantic match to 'logic_error' as it describes a specific logic error in the contract's implementation.\n\n        The finding provides a detailed explanation of the root cause, attack scenario, and fix, all of which are technically accurate and align with the ground truth's requirements.\n      \"\n    },\n    {\n      \"finding_id\": 1,\n      \"vulnerability_type_claimed\": \"Missing authorization/uniqueness check for name ownership (name hijacking)\",\n      \"location_claimed\": \"register(): `resolve[_name] = _mappedAddress;`\",\n      \"classification\": \"BONUS_VALID\",\n      \"reasoning\": \"\n        This finding identifies a real vulnerability (name hijacking) that exists in the code and is not covered by the ground truth. The attack scenario is concrete and does not require a trusted role to be compromised. The impact (unauthorized overwriting of name mappings) is genuine and critical. Thus, it qualifies as a BONUS_VALID finding.\n      \"\n    }\n  ],\n  \"target_assessment\": {\n    \"complete_found\": true,\n    \"partial_found\": false,\n    \"finding_id\": 0,\n    \"root_cause_match\": true,\n    \"location_match\": true,\n    \"type_match\": \"semantic\",\n    \"root_cause_identification\": {\n      \"score\": 1.0,\n      \"reasoning\": \"\n        The model's root cause explanation is technically accurate and provides a valid alternative to the unspecified ground truth root cause. It clearly identifies the uninitialized storage pointer issue, which is the actual root cause of the logic error in the contract.\n      \"\n    },\n    \"attack_vector_validity\": {\n      \"score\": 1.0,\n      \"reasoning\": \"\n        The model's attack scenario is concrete, step-by-step, and technically valid. It demonstrates how the uninitialized storage pointer can be exploited to bypass the `require(unlocked)` check and corrupt storage, which aligns with the ground truth's description of unintended behavior.\n      \"\n    },\n    \"fix_suggestion_validity\": {\n      \"score\": 1.0,\n      \"reasoning\": \"\n        The model's suggested fix is technically correct and remediates the issue by preventing the uninitialized storage pointer problem. It also includes an additional best practice (moving `require(unlocked)` to the top of the function), which is a valid enhancement.\n      \"\n    }\n  },\n  \"notes\": \"\n    The ground truth's description of the vulnerability is vague ('logic_error' with no root cause or attack scenario specified). The model's first finding provides a precise and actionable explanation of the actual vulnerability, which is a significant improvement over the ground truth. The second finding is a valid bonus issue not covered by the ground truth.\n  \"\n}\n```"
}