{
  "sample_id": "gs_010",
  "dataset": "gs",
  "prompt_type": "context_protocol_cot_naturalistic",
  "detector_model": "qwen3-coder-plus",
  "judge_model": "mistral-large",
  "timestamp": "2026-01-06T06:44:43.117359+00:00",
  "overall_verdict": {
    "said_vulnerable": true,
    "confidence_expressed": 0.8
  },
  "findings": [
    {
      "finding_id": 0,
      "vulnerability_type_claimed": "Incorrect Voting Power Calculation",
      "location_claimed": "Line 52: `_currentBalance = token.balanceOf(_who) + lockManager.getLockedBalance(_who)`",
      "classification": "TARGET_MATCH",
      "reasoning": "\n        **Root Cause Match**: The finding correctly identifies that the voting power calculation includes unlocked token balances (token.balanceOf(_who)), which can be exploited via flash loans. This matches the ground truth root cause, which specifies that the inclusion of token.balanceOf(_who) allows flash loan bypasses. The explanation aligns with the ground truth's description of the vulnerability.\n\n        **Location Match**: The finding correctly identifies the vulnerable function (`isGranted`) and the specific line (52) where the issue occurs. This matches the ground truth location.\n\n        **Type Match**: The claimed type ('Incorrect Voting Power Calculation') is a semantic match to the ground truth type ('flash_loan'). While the terminology differs, both describe the same underlying issue: the inclusion of unlocked balances in voting power calculations enables flash loan attacks.\n\n        **Quality**:\n        - **Root Cause Identification (RCIR)**: HIGH (0.9). The finding accurately describes the root cause and its implications.\n        - **Attack Vector Validity (AVA)**: HIGH (0.9). The attack scenario is slightly simplified but correctly identifies the core issue (bypassing lock requirements). The ground truth's flash loan scenario is more detailed, but the finding's scenario is valid.\n        - **Fix Suggestion Validity (FSV)**: HIGH (0.9). The suggested fix (using only locked balance) matches the ground truth fix.\n      "
    },
    {
      "finding_id": 1,
      "vulnerability_type_claimed": "Function Signature Mismatch",
      "location_claimed": "Constructor parameters vs actual usage",
      "classification": "INFORMATIONAL",
      "reasoning": "\n        This finding is about a potential interface mismatch, which is not a security vulnerability in the context of the ground truth. It does not address the flash loan issue or the root cause described in the ground truth. While it may be a valid observation, it is not security-relevant to the TARGET vulnerability.\n      "
    },
    {
      "finding_id": 2,
      "vulnerability_type_claimed": "Unused Parameters",
      "location_claimed": "Line 49: Unused parameters `_where`, `_permissionId`, `_data`",
      "classification": "INFORMATIONAL",
      "reasoning": "\n        This finding is about unused parameters, which is a code quality issue rather than a security vulnerability. It does not relate to the ground truth's flash loan vulnerability or its root cause.\n      "
    }
  ],
  "target_assessment": {
    "complete_found": true,
    "partial_found": false,
    "finding_id": 0,
    "root_cause_match": true,
    "location_match": true,
    "type_match": "semantic",
    "root_cause_identification": {
      "score": 0.9,
      "reasoning": "The finding accurately identifies the root cause: the inclusion of unlocked token balances in voting power calculations enables flash loan attacks. The explanation is technically precise and aligns with the ground truth."
    },
    "attack_vector_validity": {
      "score": 0.9,
      "reasoning": "The attack scenario is valid but slightly simplified compared to the ground truth. It correctly identifies the core issue (bypassing lock requirements) but does not explicitly mention flash loans. However, the scenario is still concrete and actionable."
    },
    "fix_suggestion_validity": {
      "score": 0.9,
      "reasoning": "The suggested fix (using only locked balance) is correct and matches the ground truth fix. It effectively remediates the issue."
    }
  },
  "summary": {},
  "notes": "Finding 0 is a TARGET_MATCH because it meets all criteria: correct root cause, correct location, and semantic type match. The other findings are informational and unrelated to the TARGET vulnerability.",
  "judge_latency_ms": 16169.450759887695,
  "raw_response": "```json\n{\n  \"overall_verdict\": {\n    \"said_vulnerable\": true,\n    \"confidence_expressed\": 0.8\n  },\n  \"findings\": [\n    {\n      \"finding_id\": 0,\n      \"vulnerability_type_claimed\": \"Incorrect Voting Power Calculation\",\n      \"location_claimed\": \"Line 52: `_currentBalance = token.balanceOf(_who) + lockManager.getLockedBalance(_who)`\",\n      \"classification\": \"TARGET_MATCH\",\n      \"reasoning\": \"\n        **Root Cause Match**: The finding correctly identifies that the voting power calculation includes unlocked token balances (token.balanceOf(_who)), which can be exploited via flash loans. This matches the ground truth root cause, which specifies that the inclusion of token.balanceOf(_who) allows flash loan bypasses. The explanation aligns with the ground truth's description of the vulnerability.\n\n        **Location Match**: The finding correctly identifies the vulnerable function (`isGranted`) and the specific line (52) where the issue occurs. This matches the ground truth location.\n\n        **Type Match**: The claimed type ('Incorrect Voting Power Calculation') is a semantic match to the ground truth type ('flash_loan'). While the terminology differs, both describe the same underlying issue: the inclusion of unlocked balances in voting power calculations enables flash loan attacks.\n\n        **Quality**:\n        - **Root Cause Identification (RCIR)**: HIGH (0.9). The finding accurately describes the root cause and its implications.\n        - **Attack Vector Validity (AVA)**: HIGH (0.9). The attack scenario is slightly simplified but correctly identifies the core issue (bypassing lock requirements). The ground truth's flash loan scenario is more detailed, but the finding's scenario is valid.\n        - **Fix Suggestion Validity (FSV)**: HIGH (0.9). The suggested fix (using only locked balance) matches the ground truth fix.\n      \"\n    },\n    {\n      \"finding_id\": 1,\n      \"vulnerability_type_claimed\": \"Function Signature Mismatch\",\n      \"location_claimed\": \"Constructor parameters vs actual usage\",\n      \"classification\": \"INFORMATIONAL\",\n      \"reasoning\": \"\n        This finding is about a potential interface mismatch, which is not a security vulnerability in the context of the ground truth. It does not address the flash loan issue or the root cause described in the ground truth. While it may be a valid observation, it is not security-relevant to the TARGET vulnerability.\n      \"\n    },\n    {\n      \"finding_id\": 2,\n      \"vulnerability_type_claimed\": \"Unused Parameters\",\n      \"location_claimed\": \"Line 49: Unused parameters `_where`, `_permissionId`, `_data`\",\n      \"classification\": \"INFORMATIONAL\",\n      \"reasoning\": \"\n        This finding is about unused parameters, which is a code quality issue rather than a security vulnerability. It does not relate to the ground truth's flash loan vulnerability or its root cause.\n      \"\n    }\n  ],\n  \"target_assessment\": {\n    \"complete_found\": true,\n    \"partial_found\": false,\n    \"finding_id\": 0,\n    \"root_cause_match\": true,\n    \"location_match\": true,\n    \"type_match\": \"semantic\",\n    \"root_cause_identification\": {\n      \"score\": 0.9,\n      \"reasoning\": \"The finding accurately identifies the root cause: the inclusion of unlocked token balances in voting power calculations enables flash loan attacks. The explanation is technically precise and aligns with the ground truth.\"\n    },\n    \"attack_vector_validity\": {\n      \"score\": 0.9,\n      \"reasoning\": \"The attack scenario is valid but slightly simplified compared to the ground truth. It correctly identifies the core issue (bypassing lock requirements) but does not explicitly mention flash loans. However, the scenario is still concrete and actionable.\"\n    },\n    \"fix_suggestion_validity\": {\n      \"score\": 0.9,\n      \"reasoning\": \"The suggested fix (using only locked balance) is correct and matches the ground truth fix. It effectively remediates the issue.\"\n    }\n  },\n  \"notes\": \"Finding 0 is a TARGET_MATCH because it meets all criteria: correct root cause, correct location, and semantic type match. The other findings are informational and unrelated to the TARGET vulnerability.\"\n}\n```"
}