{
  "sample_id": "gs_022",
  "dataset": "gs",
  "prompt_type": "context_protocol_cot_adversarial",
  "model": "llama-4-maverick",
  "timestamp": "2026-01-05T15:33:28.524769+00:00",
  "ground_truth": {
    "is_vulnerable": true,
    "vulnerability_type": "logic_error",
    "vulnerable_functions": [
      "updatePositionManager"
    ],
    "severity": "medium",
    "description": "Staking.allocateETH() forwards ETH to LiquidityBuffer.depositETH(), which auto-allocates to defaultManagerId when shouldExecuteAllocation is true. If the current default manager is deactivated via LiquidityBuffer.updatePositionManager()/togglePositionManagerStatus() without first switching defaultManagerId or disabling auto-allocation, _allocateETHToManager(defaultManagerId, \u2026) reverts with LiquidityBuffer__ManagerInactive(). This can unexpectedly block allocation flows.",
    "root_cause": "Staking.allocateETH() forwards ETH to LiquidityBuffer.depositETH(), which auto-allocates to defaultManagerId when shouldExecuteAllocation is true. If the current default manager is deactivated via LiquidityBuffer.updatePositionManager()/togglePositionManagerStatus() without first switching defaultManagerId or disabling auto-allocation, _allocateETHToManager(defaultManagerId, \u2026) reverts with LiquidityBuffer__ManagerInactive(). This can unexpectedly block allocation flows.",
    "attack_scenario": "1. Admin sets defaultManagerId to manager 0 with shouldExecuteAllocation = true\n2. Admin calls togglePositionManagerStatus(0) to deactivate the default manager\n3. User calls Staking.allocateETH() which forwards to LiquidityBuffer.depositETH()\n4. depositETH() calls _allocateETHToManager(defaultManagerId, msg.value)\n5. _allocateETHToManager reverts with LiquidityBuffer__ManagerInactive() because the default manager is inactive\n6. All allocation flows are blocked until admin either reactivates the manager or changes defaultManagerId",
    "fix_description": "Prevent deactivation of the current defaultManagerId while auto-allocation is enabled: require shouldExecuteAllocation == false or switch defaultManagerId to an active manager before deactivation.",
    "language": "solidity"
  },
  "prediction": {
    "verdict": "vulnerable",
    "confidence": 0.8,
    "vulnerabilities": [
      {
        "type": "Potential for Incorrect State Updates",
        "severity": "medium",
        "vulnerable_function": "_claimInterestFromManager",
        "location": "LiquidityBuffer.sol:_claimInterestFromManager",
        "explanation": "The function relies on the position manager's getUnderlyingBalance, which could be manipulated or return incorrect values, leading to incorrect state updates.",
        "attack_scenario": "A malicious position manager could manipulate its getUnderlyingBalance to claim more interest than available.",
        "suggested_fix": "Implement additional checks or validations for the position manager's balance."
      },
      {
        "type": "Potential for Denial of Service (DoS)",
        "severity": "medium",
        "vulnerable_function": "getControlledBalance",
        "location": "LiquidityBuffer.sol:getControlledBalance",
        "explanation": "The function iterates over all position managers, which could lead to high gas consumption and potentially a DoS if there are many position managers.",
        "attack_scenario": "An attacker could register many position managers to cause the function to run out of gas.",
        "suggested_fix": "Consider caching the total balance or redesigning the function to reduce gas consumption."
      },
      {
        "type": "Lack of Input Validation",
        "severity": "low",
        "vulnerable_function": "setCumulativeDrawdown",
        "location": "LiquidityBuffer.sol:setCumulativeDrawdown",
        "explanation": "The function lacks input validation for the drawdownAmount parameter.",
        "attack_scenario": "An attacker could set an invalid or extreme drawdown amount.",
        "suggested_fix": "Add input validation to ensure the drawdownAmount is within a valid range."
      }
    ],
    "overall_explanation": "The LiquidityBuffer contract has several potential vulnerabilities and areas for improvement, including reliance on external contracts' integrity, potential for DoS, and lack of input validation in certain functions. While the contract follows best practices like the Checks-Effects-Interactions pattern, these issues should be addressed to enhance security and robustness."
  },
  "parsing": {
    "success": true,
    "errors": [],
    "raw_response": "### Step 1: Understand the Protocol Intent\n\nThe LiquidityBuffer contract is part of the Mantle mETH liquid staking protocol's integration with Aave. It manages ETH liquidity between the staking protocol and yield-generating position managers. The contract handles auto-allocation of deposits, tracks controlled balances, and manages position manager lifecycle.\n\n### Step 2: Map the Code Flow\n\n1. **Initialization**: The contract is initialized with various roles (admin, liquidity manager, position manager, interest top-up, drawdown manager) and essential addresses (staking contract, pauser contract, fees receiver).\n2. **Deposit and Allocation**: ETH is received from the staking contract and can be allocated to position managers based on the default manager ID or specific manager ID.\n3. **Withdrawal and Return**: ETH can be withdrawn from position managers and returned to the staking contract.\n4. **Interest Management**: Interest can be claimed from position managers and topped up to the staking contract.\n5. **Role-Based Access Control**: Various functions are restricted to specific roles.\n\n### Step 3: Compare Intent vs Implementation\n\nUpon reviewing the code, several potential issues were identified:\n\n1. **Reentrancy Vulnerability**: The contract uses the Checks-Effects-Interactions pattern, which is good practice. However, the `receiveETHFromPositionManager` function is payable and can be called by position managers. Although it doesn't perform any significant actions, it's essential to ensure that the contract's balance is correctly updated when ETH is received from position managers.\n\n2. **Unprotected Function**: The `receiveETHFromPositionManager` function is restricted to position manager contracts, but it doesn't check if the received ETH amount is valid or if the sender is an active position manager.\n\n3. **Potential for Incorrect State Updates**: In the `_claimInterestFromManager` function, the interest amount is calculated based on the current balance of the position manager. If the position manager's `getUnderlyingBalance` function is manipulated or returns an incorrect value, it could lead to incorrect state updates.\n\n4. **Lack of Input Validation**: Some functions lack input validation. For example, the `setCumulativeDrawdown` function doesn't check if the `drawdownAmount` is within a valid range.\n\n5. **Potential for Denial of Service (DoS)**: The `getControlledBalance` function iterates over all position managers to calculate the total balance. If there are many position managers, this could lead to a DoS due to gas limits.\n\n### Step 4: Identify Attack Vectors\n\n1. **Reentrancy Attack**: Although the contract follows the Checks-Effects-Interactions pattern, there's still a risk if the position managers are malicious or vulnerable.\n\n2. **Manipulation of Position Manager Balance**: If a position manager's `getUnderlyingBalance` function can be manipulated, it could affect the interest calculation and lead to incorrect state updates.\n\n3. **DoS Attack**: The `getControlledBalance` function's gas consumption could be exploited if there are many position managers.\n\n### Step 5: Validate Findings\n\n1. **Reentrancy Vulnerability**: The contract is generally safe from reentrancy due to its use of the Checks-Effects-Interactions pattern. However, the `receiveETHFromPositionManager` function should be reviewed to ensure it doesn't introduce any reentrancy risks indirectly.\n\n2. **Unprotected Function**: The `receiveETHFromPositionManager` function is protected by the `onlyPositionManagerContract` modifier, which checks if the sender is a registered and active position manager.\n\n3. **Potential for Incorrect State Updates**: The `_claimInterestFromManager` function's reliance on the position manager's `getUnderlyingBalance` could be a risk if the position manager is compromised or manipulated.\n\n4. **Lack of Input Validation**: Functions like `setCumulativeDrawdown` should validate their inputs to prevent incorrect state updates.\n\n5. **Potential for DoS**: The `getControlledBalance` function's design could lead to a DoS if not managed properly.\n\n### Report\n\n```json\n{\n  \"verdict\": \"vulnerable\",\n  \"confidence\": 0.8,\n  \"vulnerabilities\": [\n    {\n      \"type\": \"Potential for Incorrect State Updates\",\n      \"severity\": \"medium\",\n      \"vulnerable_function\": \"_claimInterestFromManager\",\n      \"location\": \"LiquidityBuffer.sol:_claimInterestFromManager\",\n      \"explanation\": \"The function relies on the position manager's getUnderlyingBalance, which could be manipulated or return incorrect values, leading to incorrect state updates.\",\n      \"attack_scenario\": \"A malicious position manager could manipulate its getUnderlyingBalance to claim more interest than available.\",\n      \"suggested_fix\": \"Implement additional checks or validations for the position manager's balance.\"\n    },\n    {\n      \"type\": \"Potential for Denial of Service (DoS)\",\n      \"severity\": \"medium\",\n      \"vulnerable_function\": \"getControlledBalance\",\n      \"location\": \"LiquidityBuffer.sol:getControlledBalance\",\n      \"explanation\": \"The function iterates over all position managers, which could lead to high gas consumption and potentially a DoS if there are many position managers.\",\n      \"attack_scenario\": \"An attacker could register many position managers to cause the function to run out of gas.\",\n      \"suggested_fix\": \"Consider caching the total balance or redesigning the function to reduce gas consumption.\"\n    },\n    {\n      \"type\": \"Lack of Input Validation\",\n      \"severity\": \"low\",\n      \"vulnerable_function\": \"setCumulativeDrawdown\",\n      \"location\": \"LiquidityBuffer.sol:setCumulativeDrawdown\",\n      \"explanation\": \"The function lacks input validation for the drawdownAmount parameter.\",\n      \"attack_scenario\": \"An attacker could set an invalid or extreme drawdown amount.\",\n      \"suggested_fix\": \"Add input validation to ensure the drawdownAmount is within a valid range.\"\n    }\n  ],\n  \"overall_explanation\": \"The LiquidityBuffer contract has several potential vulnerabilities and areas for improvement, including reliance on external contracts' integrity, potential for DoS, and lack of input validation in certain functions. While the contract follows best practices like the Checks-Effects-Interactions pattern, these issues should be addressed to enhance security and robustness.\"\n}\n```"
  },
  "context_info": {
    "has_context_files": true,
    "context_file_count": 1,
    "has_protocol_doc": true
  },
  "api_metrics": {
    "input_tokens": 5460,
    "output_tokens": 1276,
    "latency_ms": 2705.9359550476074
  }
}