{
  "sample_id": "gs_014",
  "dataset": "gs",
  "prompt_type": "context_protocol_cot_adversarial",
  "model": "llama-4-maverick",
  "timestamp": "2026-01-05T15:31:00.773236+00:00",
  "ground_truth": {
    "is_vulnerable": true,
    "vulnerability_type": "logic_error",
    "vulnerable_functions": [
      "_withdrawActiveVotingPower"
    ],
    "severity": "medium",
    "description": "The isProposalOpen() function returns true if a proposal is open for voting. It returns false if it's too late OR too early for voting. But in _withdrawActiveVotingPower() at line 225, it was being used as an 'isProposalStillOpen()' function, forgetting that it will also be false when the proposal hasn't started yet. This means proposals with future start dates get incorrectly removed from knownProposalIds tracking.",
    "root_cause": "The isProposalOpen() function returns true if a proposal is open for voting. It returns false if it's too late OR too early for voting. But in _withdrawActiveVotingPower() at line 225, it was being used as an 'isProposalStillOpen()' function, forgetting that it will also be false when the proposal hasn't started yet. This means proposals with future start dates get incorrectly removed from knownProposalIds tracking.",
    "attack_scenario": "1. A proposal is created with a future start date (e.g., starts in 1 week).\n2. User calls unlock() before the proposal starts.\n3. _withdrawActiveVotingPower() is called at line 135.\n4. Line 225: plugin.isProposalOpen(_proposalId) returns false (proposal hasn't started).\n5. Line 226: knownProposalIds.remove(_proposalId) - proposal removed from tracking.\n6. Proposal starts a week later, user votes.\n7. User calls unlock() again - vote isn't cleared because proposal isn't tracked.\n8. User withdraws tokens while still having active votes.",
    "fix_description": "Create and use an isProposalEnded() function specifically for this use case. It should return true only if the proposal has actually ended (endDate passed or executed), not just because it hasn't started.",
    "language": "solidity"
  },
  "prediction": {
    "verdict": "vulnerable",
    "confidence": 0.8,
    "vulnerabilities": [
      {
        "type": "Reentrancy",
        "severity": "high",
        "vulnerable_function": "unlock",
        "location": "LockManagerBase/unlock",
        "explanation": "The external call to clearVote() within _withdrawActiveVotingPower() could be reentrant if the plugin contract is malicious or vulnerable.",
        "attack_scenario": "An attacker sets up a malicious plugin that reenters the unlock() function, potentially draining the contract or manipulating its state.",
        "suggested_fix": "Implement a reentrancy lock using OpenZeppelin's ReentrancyGuard or a similar mechanism to prevent reentrancy attacks."
      },
      {
        "type": "Gas Limit Issue",
        "severity": "medium",
        "vulnerable_function": "unlock",
        "location": "LockManagerBase/unlock",
        "explanation": "Iterating over a large number of proposals in _withdrawActiveVotingPower() could lead to gas limit issues.",
        "attack_scenario": "An attacker creates a large number of proposals, making it difficult or impossible for users to unlock their tokens.",
        "suggested_fix": "Consider implementing a more efficient data structure or limiting the number of proposals a user can vote on simultaneously."
      }
    ],
    "overall_explanation": "The LockManagerBase contract contains a potential reentrancy vulnerability and a gas limit issue. While the previous audit did not find these issues, they are significant and should be addressed before deployment."
  },
  "parsing": {
    "success": true,
    "errors": [],
    "raw_response": "### Step 1: Understand the Protocol Intent\n\nThe LockManagerBase contract is designed to manage token locking for voting on multiple proposals across different plugins. It tracks user participation, manages locked tokens, and ensures tokens can't be withdrawn while votes are active. The contract operates in different modes based on the plugin used.\n\n### Step 2: Map the Code Flow\n\n1. **Locking Mechanism**: The contract allows users to lock tokens using `lock()` or `lock(uint256 _amount)`. The `_lock()` function transfers tokens from the user to the contract and updates the user's locked balance.\n\n2. **Voting**: Users can vote on proposals using `vote()`, `lockAndVote()`, which calls the `_vote()` function internally. The `_vote()` function delegates the voting to the plugin contract.\n\n3. **Unlocking**: Users can unlock their tokens using `unlock()`. This function checks if there are active votes and attempts to clear them using `_withdrawActiveVotingPower()` before transferring the tokens back.\n\n4. **Proposal Management**: The contract keeps track of known proposal IDs. When a proposal ends, the plugin calls `proposalEnded()`, which removes the proposal ID from the tracking set.\n\n### Step 3: Compare Intent vs Implementation\n\n1. **Reentrancy Risk**: The `_withdrawActiveVotingPower()` function iterates over active proposals and calls `clearVote()` on the plugin contract for the user's active votes. This external call could potentially be reentrant if the plugin contract calls back into the LockManagerBase contract.\n\n2. **State Management**: The contract correctly updates the user's locked balance and manages proposal IDs. However, the iteration over `knownProposalIds` in `_withdrawActiveVotingPower()` could be problematic if the number of proposals is large, potentially leading to gas limit issues.\n\n3. **Plugin Validation**: The contract checks if the plugin address is valid and supports the required interface before setting it. This is a good practice to prevent incorrect plugin usage.\n\n### Step 4: Identify Attack Vectors\n\n1. **Reentrancy Attack**: A potential vulnerability exists in the `unlock()` function due to the external call to `ILockToVote(address(plugin)).clearVote(_proposalId, msg.sender)` within the `_withdrawActiveVotingPower()` function. If the plugin contract is malicious or contains a reentrancy vulnerability, it could reenter the `unlock()` function or other functions, potentially leading to unintended behavior.\n\n2. **Gas Limit Issue**: The `_withdrawActiveVotingPower()` function iterates over all known proposal IDs. If the number of proposals is very large, this could lead to a gas limit issue, potentially making the `unlock()` function unusable.\n\n### Step 5: Validate Findings\n\n1. **Reentrancy Vulnerability**: The reentrancy risk is significant because it could allow an attacker to drain the contract or manipulate the state in unintended ways. The attack scenario involves a malicious plugin that reenters the LockManagerBase contract.\n\n2. **Gas Limit Issue**: While not necessarily a security vulnerability, a large number of proposals could make the contract unusable due to gas limit constraints.\n\n### Analysis Result\n\n```json\n{\n  \"verdict\": \"vulnerable\",\n  \"confidence\": 0.8,\n  \"vulnerabilities\": [\n    {\n      \"type\": \"Reentrancy\",\n      \"severity\": \"high\",\n      \"vulnerable_function\": \"unlock\",\n      \"location\": \"LockManagerBase/unlock\",\n      \"explanation\": \"The external call to clearVote() within _withdrawActiveVotingPower() could be reentrant if the plugin contract is malicious or vulnerable.\",\n      \"attack_scenario\": \"An attacker sets up a malicious plugin that reenters the unlock() function, potentially draining the contract or manipulating its state.\",\n      \"suggested_fix\": \"Implement a reentrancy lock using OpenZeppelin's ReentrancyGuard or a similar mechanism to prevent reentrancy attacks.\"\n    },\n    {\n      \"type\": \"Gas Limit Issue\",\n      \"severity\": \"medium\",\n      \"vulnerable_function\": \"unlock\",\n      \"location\": \"LockManagerBase/unlock\",\n      \"explanation\": \"Iterating over a large number of proposals in _withdrawActiveVotingPower() could lead to gas limit issues.\",\n      \"attack_scenario\": \"An attacker creates a large number of proposals, making it difficult or impossible for users to unlock their tokens.\",\n      \"suggested_fix\": \"Consider implementing a more efficient data structure or limiting the number of proposals a user can vote on simultaneously.\"\n    }\n  ],\n  \"overall_explanation\": \"The LockManagerBase contract contains a potential reentrancy vulnerability and a gas limit issue. While the previous audit did not find these issues, they are significant and should be addressed before deployment.\"\n}\n```"
  },
  "context_info": {
    "has_context_files": true,
    "context_file_count": 1,
    "has_protocol_doc": true
  },
  "api_metrics": {
    "input_tokens": 4685,
    "output_tokens": 974,
    "latency_ms": 15961.925029754639
  }
}