{
  "sample_id": "gs_007",
  "dataset": "gs",
  "prompt_type": "context_protocol_cot",
  "detector_model": "gemini-3-pro",
  "judge_model": "mistral-large",
  "timestamp": "2026-01-06T05:25:13.953541+00:00",
  "overall_verdict": {
    "said_vulnerable": true,
    "confidence_expressed": 0.95
  },
  "findings": [
    {
      "finding_id": 0,
      "vulnerability_type_claimed": "Token Sweep / Funds Locking",
      "location_claimed": "GaugeCL.sol: _claimFees()",
      "classification": "TARGET_MATCH",
      "reasoning": "\n        **Root Cause Match**: The finding correctly identifies that `_claimFees()` sweeps the entire balance of `token0`/`token1` after `collectFees()`, which includes staking rewards if `rewardToken` matches either pool token. This matches the ground truth root cause exactly.\n        **Location Match**: The finding is about the `_claimFees` function, which matches the ground truth location.\n        **Type Match**: The type 'Token Sweep / Funds Locking' is a semantic match to 'logic_error' as both describe a logical flaw in fund handling.\n        The explanation, attack scenario, and fix suggestion are all technically accurate and align with the ground truth.\n      "
    },
    {
      "finding_id": 1,
      "vulnerability_type_claimed": "Reward Rate Manipulation",
      "location_claimed": "GaugeCL.sol: notifyRewardAmount()",
      "classification": "BONUS_VALID",
      "reasoning": "\n        This finding identifies a real, distinct vulnerability not mentioned in the ground truth. The issue of `rewardRate` manipulation due to small `epochTimeRemaining` is a concrete attack vector with a clear exploit scenario (front-running near epoch end). The impact (dilution of rewards) is genuine and does not require compromised roles. The fix suggestion is valid and actionable.\n      "
    }
  ],
  "target_assessment": {
    "complete_found": true,
    "partial_found": false,
    "finding_id": 0,
    "root_cause_match": true,
    "location_match": true,
    "type_match": "semantic",
    "root_cause_identification": {
      "score": 1.0,
      "reasoning": "The finding's root cause explanation is technically precise and semantically identical to the ground truth, explicitly mentioning the sweeping of entire balances and the impact on staking rewards."
    },
    "attack_vector_validity": {
      "score": 1.0,
      "reasoning": "The attack scenario is concrete, step-by-step, and demonstrates a realistic exploit (funds locked due to swept rewards). It aligns perfectly with the ground truth scenario."
    },
    "fix_suggestion_validity": {
      "score": 0.9,
      "reasoning": "The suggested fix (transferring only the difference in balance before/after `collectFees()`) is correct and matches the ground truth's intent. The minor deduction is for not explicitly mentioning access control, though this is implied by the context."
    }
  },
  "summary": {},
  "notes": "Finding 1 is a valid bonus issue that exceeds the ground truth scope. The model demonstrated strong understanding of the target vulnerability in Finding 0.",
  "judge_latency_ms": 12810.050010681152,
  "raw_response": "```json\n{\n  \"overall_verdict\": {\n    \"said_vulnerable\": true,\n    \"confidence_expressed\": 0.95\n  },\n  \"findings\": [\n    {\n      \"finding_id\": 0,\n      \"vulnerability_type_claimed\": \"Token Sweep / Funds Locking\",\n      \"location_claimed\": \"GaugeCL.sol: _claimFees()\",\n      \"classification\": \"TARGET_MATCH\",\n      \"reasoning\": \"\n        **Root Cause Match**: The finding correctly identifies that `_claimFees()` sweeps the entire balance of `token0`/`token1` after `collectFees()`, which includes staking rewards if `rewardToken` matches either pool token. This matches the ground truth root cause exactly.\n        **Location Match**: The finding is about the `_claimFees` function, which matches the ground truth location.\n        **Type Match**: The type 'Token Sweep / Funds Locking' is a semantic match to 'logic_error' as both describe a logical flaw in fund handling.\n        The explanation, attack scenario, and fix suggestion are all technically accurate and align with the ground truth.\n      \"\n    },\n    {\n      \"finding_id\": 1,\n      \"vulnerability_type_claimed\": \"Reward Rate Manipulation\",\n      \"location_claimed\": \"GaugeCL.sol: notifyRewardAmount()\",\n      \"classification\": \"BONUS_VALID\",\n      \"reasoning\": \"\n        This finding identifies a real, distinct vulnerability not mentioned in the ground truth. The issue of `rewardRate` manipulation due to small `epochTimeRemaining` is a concrete attack vector with a clear exploit scenario (front-running near epoch end). The impact (dilution of rewards) is genuine and does not require compromised roles. The fix suggestion is valid and actionable.\n      \"\n    }\n  ],\n  \"target_assessment\": {\n    \"complete_found\": true,\n    \"partial_found\": false,\n    \"finding_id\": 0,\n    \"root_cause_match\": true,\n    \"location_match\": true,\n    \"type_match\": \"semantic\",\n    \"root_cause_identification\": {\n      \"score\": 1.0,\n      \"reasoning\": \"The finding's root cause explanation is technically precise and semantically identical to the ground truth, explicitly mentioning the sweeping of entire balances and the impact on staking rewards.\"\n    },\n    \"attack_vector_validity\": {\n      \"score\": 1.0,\n      \"reasoning\": \"The attack scenario is concrete, step-by-step, and demonstrates a realistic exploit (funds locked due to swept rewards). It aligns perfectly with the ground truth scenario.\"\n    },\n    \"fix_suggestion_validity\": {\n      \"score\": 0.9,\n      \"reasoning\": \"The suggested fix (transferring only the difference in balance before/after `collectFees()`) is correct and matches the ground truth's intent. The minor deduction is for not explicitly mentioning access control, though this is implied by the context.\"\n    }\n  },\n  \"notes\": \"Finding 1 is a valid bonus issue that exceeds the ground truth scope. The model demonstrated strong understanding of the target vulnerability in Finding 0.\"\n}\n```"
}