{
  "sample_id": "tr_tc_018",
  "variant": "trojan",
  "detector_model": "gpt-5.2",
  "prompt_type": "direct",
  "judge_model": "mistral-large",
  "timestamp": "2026-01-06T00:27:41.482562+00:00",
  "overall_verdict": {
    "said_vulnerable": true,
    "confidence_expressed": 0.93
  },
  "findings": [
    {
      "finding_id": 0,
      "vulnerability_type_claimed": "Missing access control allows reinitialization / contract takeover",
      "location_claimed": "init(), toggleUnsafeReinitMode()",
      "classification": "TARGET_MATCH",
      "reasoning": "\n        **Root Cause Match**: The finding correctly identifies that the `init()` function lacks proper initialization protection (missing `require(!isInitialized)` check) and that the `unsafeReinitMode` can be toggled by anyone to bypass the existing guard. This matches the ground truth's root cause exactly: the init() function could be called multiple times, allowing attackers to overwrite critical parameters like the maintainer address.\n\n        **Location Match**: The finding correctly identifies the vulnerable functions as `init()` and `toggleUnsafeReinitMode()`, which are directly related to the reinitialization vulnerability. The ground truth specifies `init()` as the vulnerable function, and the inclusion of `toggleUnsafeReinitMode()` is a valid extension as it enables the bypass of the existing guard.\n\n        **Type Match**: The type 'Missing access control allows reinitialization / contract takeover' is a semantic match to the ground truth's 'reinitialization'. Both describe the same vulnerability class, with the model's terminology being more specific but still accurate.\n      "
    },
    {
      "finding_id": 1,
      "vulnerability_type_claimed": "Unchecked ERC20 transfer results enable draining reserves with a malicious token",
      "location_claimed": "addLiquidity(), swap()",
      "classification": "BONUS_VALID",
      "reasoning": "\n        **Bonus Validity**: This finding identifies a real, distinct vulnerability not covered in the ground truth. The issue of unchecked ERC20 transfer return values is a genuine security risk, especially when combined with the reinitialization vulnerability (as noted in the attack scenario). The finding provides a concrete attack scenario and impact, demonstrating that the vulnerability is exploitable and profitable. The suggested fix (using SafeERC20) is also valid and remediates the issue.\n      "
    }
  ],
  "target_assessment": {
    "complete_found": true,
    "partial_found": false,
    "finding_id": 0,
    "root_cause_match": true,
    "location_match": true,
    "type_match": "semantic",
    "root_cause_identification": {
      "score": 1.0,
      "reasoning": "\n        The model's explanation of the root cause is technically accurate and semantically matches the ground truth. It correctly identifies the lack of proper initialization protection and the bypass mechanism via `unsafeReinitMode`, which aligns perfectly with the ground truth's description of the issue.\n      "
    },
    "attack_vector_validity": {
      "score": 1.0,
      "reasoning": "\n        The attack scenario provided is concrete and step-by-step, demonstrating a clear path to exploit the vulnerability. It matches the ground truth's attack scenario in terms of impact (hijacking fee collection rights) and extends it with additional details about enabling `unsafeReinitMode`, which is a valid and realistic step.\n      "
    },
    "fix_suggestion_validity": {
      "score": 0.9,
      "reasoning": "\n        The suggested fix is valid and aligns with the ground truth's recommendation to add an initialization guard. The model goes further by recommending the removal of `unsafeReinitMode` logic and the use of dedicated admin-only functions, which are technically sound and remediate the issue. The score is slightly reduced because the ground truth specifically mentions OpenZeppelin's Initializable pattern, which the model does not explicitly reference, though its suggestions are still correct.\n      "
    }
  },
  "summary": {},
  "notes": "\n    The model's first finding is a strong TARGET_MATCH, meeting all criteria for root cause, location, and type. The second finding is a valid bonus vulnerability, demonstrating the model's ability to identify additional security issues beyond the ground truth. The evaluation of the target vulnerability is conservative, ensuring that only exact or semantically equivalent matches are classified as TARGET_MATCH.\n  ",
  "judge_latency_ms": 17262.845993041992,
  "raw_response": "```json\n{\n  \"overall_verdict\": {\n    \"said_vulnerable\": true,\n    \"confidence_expressed\": 0.93\n  },\n  \"findings\": [\n    {\n      \"finding_id\": 0,\n      \"vulnerability_type_claimed\": \"Missing access control allows reinitialization / contract takeover\",\n      \"location_claimed\": \"init(), toggleUnsafeReinitMode()\",\n      \"classification\": \"TARGET_MATCH\",\n      \"reasoning\": \"\n        **Root Cause Match**: The finding correctly identifies that the `init()` function lacks proper initialization protection (missing `require(!isInitialized)` check) and that the `unsafeReinitMode` can be toggled by anyone to bypass the existing guard. This matches the ground truth's root cause exactly: the init() function could be called multiple times, allowing attackers to overwrite critical parameters like the maintainer address.\n\n        **Location Match**: The finding correctly identifies the vulnerable functions as `init()` and `toggleUnsafeReinitMode()`, which are directly related to the reinitialization vulnerability. The ground truth specifies `init()` as the vulnerable function, and the inclusion of `toggleUnsafeReinitMode()` is a valid extension as it enables the bypass of the existing guard.\n\n        **Type Match**: The type 'Missing access control allows reinitialization / contract takeover' is a semantic match to the ground truth's 'reinitialization'. Both describe the same vulnerability class, with the model's terminology being more specific but still accurate.\n      \"\n    },\n    {\n      \"finding_id\": 1,\n      \"vulnerability_type_claimed\": \"Unchecked ERC20 transfer results enable draining reserves with a malicious token\",\n      \"location_claimed\": \"addLiquidity(), swap()\",\n      \"classification\": \"BONUS_VALID\",\n      \"reasoning\": \"\n        **Bonus Validity**: This finding identifies a real, distinct vulnerability not covered in the ground truth. The issue of unchecked ERC20 transfer return values is a genuine security risk, especially when combined with the reinitialization vulnerability (as noted in the attack scenario). The finding provides a concrete attack scenario and impact, demonstrating that the vulnerability is exploitable and profitable. The suggested fix (using SafeERC20) is also valid and remediates the issue.\n      \"\n    }\n  ],\n  \"target_assessment\": {\n    \"complete_found\": true,\n    \"partial_found\": false,\n    \"finding_id\": 0,\n    \"root_cause_match\": true,\n    \"location_match\": true,\n    \"type_match\": \"semantic\",\n    \"root_cause_identification\": {\n      \"score\": 1.0,\n      \"reasoning\": \"\n        The model's explanation of the root cause is technically accurate and semantically matches the ground truth. It correctly identifies the lack of proper initialization protection and the bypass mechanism via `unsafeReinitMode`, which aligns perfectly with the ground truth's description of the issue.\n      \"\n    },\n    \"attack_vector_validity\": {\n      \"score\": 1.0,\n      \"reasoning\": \"\n        The attack scenario provided is concrete and step-by-step, demonstrating a clear path to exploit the vulnerability. It matches the ground truth's attack scenario in terms of impact (hijacking fee collection rights) and extends it with additional details about enabling `unsafeReinitMode`, which is a valid and realistic step.\n      \"\n    },\n    \"fix_suggestion_validity\": {\n      \"score\": 0.9,\n      \"reasoning\": \"\n        The suggested fix is valid and aligns with the ground truth's recommendation to add an initialization guard. The model goes further by recommending the removal of `unsafeReinitMode` logic and the use of dedicated admin-only functions, which are technically sound and remediate the issue. The score is slightly reduced because the ground truth specifically mentions OpenZeppelin's Initializable pattern, which the model does not explicitly reference, though its suggestions are still correct.\n      \"\n    }\n  },\n  \"notes\": \"\n    The model's first finding is a strong TARGET_MATCH, meeting all criteria for root cause, location, and type. The second finding is a valid bonus vulnerability, demonstrating the model's ability to identify additional security issues beyond the ground truth. The evaluation of the target vulnerability is conservative, ensuring that only exact or semantically equivalent matches are classified as TARGET_MATCH.\n  \"\n}\n```"
}