{
  "sample_id": "tr_tc_027",
  "variant": "trojan",
  "detector_model": "gpt-5.2",
  "prompt_type": "direct",
  "judge_model": "mistral-large",
  "timestamp": "2026-01-06T00:29:18.540051+00:00",
  "overall_verdict": {
    "said_vulnerable": true,
    "confidence_expressed": 0.9
  },
  "findings": [
    {
      "finding_id": 0,
      "vulnerability_type_claimed": "Incorrect liquidity unit minting (imbalanced deposit over-mint) enabling value extraction",
      "location_claimed": "addLiquidity",
      "classification": "TARGET_MATCH",
      "reasoning": "\n        **Root Cause Match**: The finding correctly identifies the specific root cause - the use of the average of ratios (`(baseRatio + tokenRatio) / 2`) instead of the minimum ratio for minting liquidity units. This matches the ground truth exactly, including the explanation of how this breaks the AMM invariant.\n\n        **Location Match**: The finding correctly identifies the `addLiquidity` function as the vulnerable location, which matches the ground truth.\n\n        **Type Match**: The vulnerability type claimed ('Incorrect liquidity unit minting (imbalanced deposit over-mint) enabling value extraction') is a semantic match to the ground truth type 'arithmetic_error'. Both describe the same underlying issue with the arithmetic operation in the liquidity unit calculation.\n\n        **Attack Scenario**: The provided attack scenario is concrete, step-by-step, and matches the ground truth scenario, demonstrating a clear exploit path.\n\n        **Fix Suggestion**: The suggested fix (`liquidityUnits = baseRatio < tokenRatio ? baseRatio : tokenRatio`) is correct and matches the ground truth fix (using `min(baseRatio, tokenRatio)`).\n      "
    },
    {
      "finding_id": 1,
      "vulnerability_type_claimed": "Permanent denial of service via zero-reserve initialization causing division by zero",
      "location_claimed": "addLiquidity",
      "classification": "BONUS_VALID",
      "reasoning": "\n        **Bonus Valid**: This finding identifies a real, previously unmentioned vulnerability in the code. The issue exists because the contract allows initialization with zero reserves for either `baseAmount` or `tokenAmount`, leading to division by zero in subsequent `addLiquidity` calls. The attack scenario is concrete and demonstrates a permanent denial of service unless the attacker cooperates. The suggested fix is valid and would remediate the issue. This is not a design choice or informational issue, and it does not require a trusted role to exploit.\n      "
    }
  ],
  "target_assessment": {
    "complete_found": true,
    "partial_found": false,
    "finding_id": 0,
    "root_cause_match": true,
    "location_match": true,
    "type_match": "semantic",
    "root_cause_identification": {
      "score": 1.0,
      "reasoning": "The root cause is identified with high precision, matching the ground truth exactly. The explanation demonstrates a clear understanding of the specific arithmetic error and its impact on the AMM invariant."
    },
    "attack_vector_validity": {
      "score": 1.0,
      "reasoning": "The attack scenario is concrete, step-by-step, and technically accurate. It matches the ground truth scenario and demonstrates a clear, profitable exploit path."
    },
    "fix_suggestion_validity": {
      "score": 1.0,
      "reasoning": "The suggested fix is correct and matches the ground truth fix. It directly addresses the root cause by replacing the average with the minimum ratio."
    }
  },
  "summary": {},
  "notes": "\n    Finding 0 is a clear TARGET_MATCH, as it meets all criteria for root cause, location, and type. Finding 1 is a valid bonus finding, as it identifies a real, previously unmentioned vulnerability with a concrete exploit scenario and fix. The evaluation adheres strictly to the provided criteria, ensuring no false positives or misclassifications.\n  ",
  "judge_latency_ms": 15834.617853164673,
  "raw_response": "```json\n{\n  \"overall_verdict\": {\n    \"said_vulnerable\": true,\n    \"confidence_expressed\": 0.9\n  },\n  \"findings\": [\n    {\n      \"finding_id\": 0,\n      \"vulnerability_type_claimed\": \"Incorrect liquidity unit minting (imbalanced deposit over-mint) enabling value extraction\",\n      \"location_claimed\": \"addLiquidity\",\n      \"classification\": \"TARGET_MATCH\",\n      \"reasoning\": \"\n        **Root Cause Match**: The finding correctly identifies the specific root cause - the use of the average of ratios (`(baseRatio + tokenRatio) / 2`) instead of the minimum ratio for minting liquidity units. This matches the ground truth exactly, including the explanation of how this breaks the AMM invariant.\n\n        **Location Match**: The finding correctly identifies the `addLiquidity` function as the vulnerable location, which matches the ground truth.\n\n        **Type Match**: The vulnerability type claimed ('Incorrect liquidity unit minting (imbalanced deposit over-mint) enabling value extraction') is a semantic match to the ground truth type 'arithmetic_error'. Both describe the same underlying issue with the arithmetic operation in the liquidity unit calculation.\n\n        **Attack Scenario**: The provided attack scenario is concrete, step-by-step, and matches the ground truth scenario, demonstrating a clear exploit path.\n\n        **Fix Suggestion**: The suggested fix (`liquidityUnits = baseRatio < tokenRatio ? baseRatio : tokenRatio`) is correct and matches the ground truth fix (using `min(baseRatio, tokenRatio)`).\n      \"\n    },\n    {\n      \"finding_id\": 1,\n      \"vulnerability_type_claimed\": \"Permanent denial of service via zero-reserve initialization causing division by zero\",\n      \"location_claimed\": \"addLiquidity\",\n      \"classification\": \"BONUS_VALID\",\n      \"reasoning\": \"\n        **Bonus Valid**: This finding identifies a real, previously unmentioned vulnerability in the code. The issue exists because the contract allows initialization with zero reserves for either `baseAmount` or `tokenAmount`, leading to division by zero in subsequent `addLiquidity` calls. The attack scenario is concrete and demonstrates a permanent denial of service unless the attacker cooperates. The suggested fix is valid and would remediate the issue. This is not a design choice or informational issue, and it does not require a trusted role to exploit.\n      \"\n    }\n  ],\n  \"target_assessment\": {\n    \"complete_found\": true,\n    \"partial_found\": false,\n    \"finding_id\": 0,\n    \"root_cause_match\": true,\n    \"location_match\": true,\n    \"type_match\": \"semantic\",\n    \"root_cause_identification\": {\n      \"score\": 1.0,\n      \"reasoning\": \"The root cause is identified with high precision, matching the ground truth exactly. The explanation demonstrates a clear understanding of the specific arithmetic error and its impact on the AMM invariant.\"\n    },\n    \"attack_vector_validity\": {\n      \"score\": 1.0,\n      \"reasoning\": \"The attack scenario is concrete, step-by-step, and technically accurate. It matches the ground truth scenario and demonstrates a clear, profitable exploit path.\"\n    },\n    \"fix_suggestion_validity\": {\n      \"score\": 1.0,\n      \"reasoning\": \"The suggested fix is correct and matches the ground truth fix. It directly addresses the root cause by replacing the average with the minimum ratio.\"\n    }\n  },\n  \"notes\": \"\n    Finding 0 is a clear TARGET_MATCH, as it meets all criteria for root cause, location, and type. Finding 1 is a valid bonus finding, as it identifies a real, previously unmentioned vulnerability with a concrete exploit scenario and fix. The evaluation adheres strictly to the provided criteria, ensuring no false positives or misclassifications.\n  \"\n}\n```"
}