{
  "sample_id": "tr_tc_002",
  "variant": "trojan",
  "detector_model": "gpt-5.2",
  "prompt_type": "direct",
  "judge_model": "mistral-large",
  "timestamp": "2026-01-06T00:24:43.234206+00:00",
  "overall_verdict": {
    "said_vulnerable": true,
    "confidence_expressed": 0.96
  },
  "findings": [
    {
      "finding_id": 0,
      "vulnerability_type_claimed": "Unbacked voting power minting leads to arbitrary call execution",
      "location_claimed": "deposit() + emergencyCommit()",
      "classification": "TARGET_MATCH",
      "reasoning": "\n        **Root Cause Match**: The finding correctly identifies the core issue - the governance system allows instant voting power from deposits with no time-weighting or holding period, and the emergencyCommit() function enables immediate execution of proposals that reach 66% approval. The explanation specifically mentions the lack of economic backing for voting power and the ability to execute arbitrary calls via emergencyCommit(), which aligns with the ground truth root cause.\n\n        **Location Match**: The ground truth specifies the vulnerable function as emergencyCommit, and the finding correctly includes this function. While it also mentions deposit(), this is acceptable because deposit() is directly related to the root cause (unbacked voting power minting). The emergencyCommit() function is explicitly mentioned as the execution vector.\n\n        **Type Match**: The type 'Unbacked voting power minting leads to arbitrary call execution' is a semantic match to 'governance_attack'. Both describe the same class of vulnerability where governance mechanisms are exploited via voting power manipulation.\n      "
    },
    {
      "finding_id": 1,
      "vulnerability_type_claimed": "Quorum/threshold manipulation (vote dilution) via mutable totalVotingPower",
      "location_claimed": "emergencyCommit() threshold calculation",
      "classification": "BONUS_VALID",
      "reasoning": "\n        **Bonus Valid**: This finding identifies a real, distinct vulnerability not covered in the ground truth. The issue of mutable totalVotingPower allowing vote dilution is a concrete attack vector with a clear exploit scenario (governance DoS). The attack does not require trusted roles and has a genuine impact (blocking proposal execution). The explanation and suggested fix are technically sound and address the issue effectively.\n      "
    }
  ],
  "target_assessment": {
    "complete_found": true,
    "partial_found": false,
    "finding_id": 0,
    "root_cause_match": true,
    "location_match": true,
    "type_match": "semantic",
    "root_cause_identification": {
      "score": 0.9,
      "reasoning": "\n        The finding accurately captures the root cause: unbacked voting power minting combined with immediate execution via emergencyCommit(). The explanation is technically precise and aligns closely with the ground truth, though it could have explicitly mentioned the lack of time-weighting or holding periods for additional clarity.\n      "
    },
    "attack_vector_validity": {
      "score": 0.95,
      "reasoning": "\n        The attack scenario is concrete and step-by-step, demonstrating a clear path to exploit the vulnerability. It correctly identifies the ability to mint voting power and execute arbitrary calls, matching the ground truth's attack scenario. The scenario is technically valid and would work as described.\n      "
    },
    "fix_suggestion_validity": {
      "score": 0.9,
      "reasoning": "\n        The suggested fix (making deposit economically backed and restricting emergencyCommit execution scope) is valid and addresses the root cause. It aligns with the ground truth's recommendations (e.g., time-weighted voting, holding periods) and provides actionable remediation steps. The fix is technically sound and would effectively mitigate the vulnerability.\n      "
    }
  },
  "summary": {},
  "notes": "\n    Finding 0 is a strong TARGET_MATCH, as it meets all criteria for root cause, location, and type. Finding 1 is a valid bonus finding, as it identifies a separate but related vulnerability that exists in the code and has a concrete exploit scenario. Both findings demonstrate a deep understanding of the governance attack vector and its implications.\n  ",
  "judge_latency_ms": 16436.586141586304,
  "raw_response": "```json\n{\n  \"overall_verdict\": {\n    \"said_vulnerable\": true,\n    \"confidence_expressed\": 0.96\n  },\n  \"findings\": [\n    {\n      \"finding_id\": 0,\n      \"vulnerability_type_claimed\": \"Unbacked voting power minting leads to arbitrary call execution\",\n      \"location_claimed\": \"deposit() + emergencyCommit()\",\n      \"classification\": \"TARGET_MATCH\",\n      \"reasoning\": \"\n        **Root Cause Match**: The finding correctly identifies the core issue - the governance system allows instant voting power from deposits with no time-weighting or holding period, and the emergencyCommit() function enables immediate execution of proposals that reach 66% approval. The explanation specifically mentions the lack of economic backing for voting power and the ability to execute arbitrary calls via emergencyCommit(), which aligns with the ground truth root cause.\n\n        **Location Match**: The ground truth specifies the vulnerable function as emergencyCommit, and the finding correctly includes this function. While it also mentions deposit(), this is acceptable because deposit() is directly related to the root cause (unbacked voting power minting). The emergencyCommit() function is explicitly mentioned as the execution vector.\n\n        **Type Match**: The type 'Unbacked voting power minting leads to arbitrary call execution' is a semantic match to 'governance_attack'. Both describe the same class of vulnerability where governance mechanisms are exploited via voting power manipulation.\n      \"\n    },\n    {\n      \"finding_id\": 1,\n      \"vulnerability_type_claimed\": \"Quorum/threshold manipulation (vote dilution) via mutable totalVotingPower\",\n      \"location_claimed\": \"emergencyCommit() threshold calculation\",\n      \"classification\": \"BONUS_VALID\",\n      \"reasoning\": \"\n        **Bonus Valid**: This finding identifies a real, distinct vulnerability not covered in the ground truth. The issue of mutable totalVotingPower allowing vote dilution is a concrete attack vector with a clear exploit scenario (governance DoS). The attack does not require trusted roles and has a genuine impact (blocking proposal execution). The explanation and suggested fix are technically sound and address the issue effectively.\n      \"\n    }\n  ],\n  \"target_assessment\": {\n    \"complete_found\": true,\n    \"partial_found\": false,\n    \"finding_id\": 0,\n    \"root_cause_match\": true,\n    \"location_match\": true,\n    \"type_match\": \"semantic\",\n    \"root_cause_identification\": {\n      \"score\": 0.9,\n      \"reasoning\": \"\n        The finding accurately captures the root cause: unbacked voting power minting combined with immediate execution via emergencyCommit(). The explanation is technically precise and aligns closely with the ground truth, though it could have explicitly mentioned the lack of time-weighting or holding periods for additional clarity.\n      \"\n    },\n    \"attack_vector_validity\": {\n      \"score\": 0.95,\n      \"reasoning\": \"\n        The attack scenario is concrete and step-by-step, demonstrating a clear path to exploit the vulnerability. It correctly identifies the ability to mint voting power and execute arbitrary calls, matching the ground truth's attack scenario. The scenario is technically valid and would work as described.\n      \"\n    },\n    \"fix_suggestion_validity\": {\n      \"score\": 0.9,\n      \"reasoning\": \"\n        The suggested fix (making deposit economically backed and restricting emergencyCommit execution scope) is valid and addresses the root cause. It aligns with the ground truth's recommendations (e.g., time-weighted voting, holding periods) and provides actionable remediation steps. The fix is technically sound and would effectively mitigate the vulnerability.\n      \"\n    }\n  },\n  \"notes\": \"\n    Finding 0 is a strong TARGET_MATCH, as it meets all criteria for root cause, location, and type. Finding 1 is a valid bonus finding, as it identifies a separate but related vulnerability that exists in the code and has a concrete exploit scenario. Both findings demonstrate a deep understanding of the governance attack vector and its implications.\n  \"\n}\n```"
}