{
  "sample_id": "tr_tc_012",
  "variant": "trojan",
  "detector_model": "gpt-5.2",
  "prompt_type": "direct",
  "judge_model": "mistral-large",
  "timestamp": "2026-01-06T00:26:30.433212+00:00",
  "overall_verdict": {
    "said_vulnerable": true,
    "confidence_expressed": 0.95
  },
  "findings": [
    {
      "finding_id": 0,
      "vulnerability_type_claimed": "Unrestricted token sweep (missing access control) + wrong underlying token check",
      "location_claimed": "constructor / sweepToken()",
      "classification": "TARGET_MATCH",
      "reasoning": "\n        **Root Cause Match**: The finding correctly identifies that the contract's `underlying` is set to OLD_TUSD, but the actual token used for mint/redeem is NEW_TUSD. The `sweepToken` function only blocks sweeping the `underlying` address (OLD_TUSD), allowing NEW_TUSD to be swept. This matches the ground truth root cause: after TUSD token upgrade, the contract still referenced the old address as underlying, and `sweepToken` only blocked the old address, allowing the new TUSD address to be swept.\n\n        **Location Match**: The finding correctly identifies the `sweepToken` function as the vulnerable location, which matches the ground truth.\n\n        **Type Match**: The finding's type ('Unrestricted token sweep (missing access control) + wrong underlying token check') is a semantic match to the ground truth type ('logic_error'), as both describe a logical flaw in the contract's design regarding token sweeping.\n\n        **Attack Scenario**: The finding provides a concrete attack scenario that aligns with the ground truth, demonstrating how an attacker can drain all NEW_TUSD from the contract.\n\n        **Fix Suggestion**: The suggested fixes (adding access control, ensuring `underlying` matches the actual asset, or forbidding sweeping NEW_TUSD) are valid and address the root cause."
    },
    {
      "finding_id": 1,
      "vulnerability_type_claimed": "Free mint due to incorrect token transfer direction (no deposit collected)",
      "location_claimed": "mint() / redeem()",
      "classification": "BONUS_VALID",
      "reasoning": "\n        **Bonus Valid**: This finding identifies a real vulnerability not covered in the ground truth. The `mint` function incorrectly uses `transfer` instead of `transferFrom`, allowing attackers to mint tokens without depositing any funds. The attack scenario is concrete and profitable, and the impact (draining the contract's NEW_TUSD balance) is genuine. The vulnerability does not require a trusted role to be compromised and is not a design choice or informational issue."
    }
  ],
  "target_assessment": {
    "complete_found": true,
    "partial_found": false,
    "finding_id": 0,
    "root_cause_match": true,
    "location_match": true,
    "type_match": "semantic",
    "root_cause_identification": {
      "score": 1.0,
      "reasoning": "The finding's root cause explanation is technically accurate and semantically matches the ground truth. It correctly identifies the mismatch between `underlying` (OLD_TUSD) and the actual token used (NEW_TUSD), and how this allows NEW_TUSD to be swept."
    },
    "attack_vector_validity": {
      "score": 1.0,
      "reasoning": "The attack scenario is concrete, step-by-step, and aligns with the ground truth. It demonstrates how an attacker can drain all NEW_TUSD from the contract by exploiting the `sweepToken` function."
    },
    "fix_suggestion_validity": {
      "score": 0.9,
      "reasoning": "The suggested fixes are valid and address the root cause. They include adding access control, ensuring `underlying` matches the actual asset, and forbidding sweeping NEW_TUSD. The fix is slightly incomplete as it does not explicitly mention maintaining a mapping of all valid underlying addresses (as suggested in the ground truth), but it is still highly effective."
    }
  },
  "summary": {},
  "notes": "Finding 0 is a clear TARGET_MATCH, as it meets all criteria for root cause, location, and type. Finding 1 is a valid bonus finding, as it identifies a separate critical vulnerability not covered in the ground truth.",
  "judge_latency_ms": 15797.587871551514,
  "raw_response": "```json\n{\n  \"overall_verdict\": {\n    \"said_vulnerable\": true,\n    \"confidence_expressed\": 0.95\n  },\n  \"findings\": [\n    {\n      \"finding_id\": 0,\n      \"vulnerability_type_claimed\": \"Unrestricted token sweep (missing access control) + wrong underlying token check\",\n      \"location_claimed\": \"constructor / sweepToken()\",\n      \"classification\": \"TARGET_MATCH\",\n      \"reasoning\": \"\n        **Root Cause Match**: The finding correctly identifies that the contract's `underlying` is set to OLD_TUSD, but the actual token used for mint/redeem is NEW_TUSD. The `sweepToken` function only blocks sweeping the `underlying` address (OLD_TUSD), allowing NEW_TUSD to be swept. This matches the ground truth root cause: after TUSD token upgrade, the contract still referenced the old address as underlying, and `sweepToken` only blocked the old address, allowing the new TUSD address to be swept.\n\n        **Location Match**: The finding correctly identifies the `sweepToken` function as the vulnerable location, which matches the ground truth.\n\n        **Type Match**: The finding's type ('Unrestricted token sweep (missing access control) + wrong underlying token check') is a semantic match to the ground truth type ('logic_error'), as both describe a logical flaw in the contract's design regarding token sweeping.\n\n        **Attack Scenario**: The finding provides a concrete attack scenario that aligns with the ground truth, demonstrating how an attacker can drain all NEW_TUSD from the contract.\n\n        **Fix Suggestion**: The suggested fixes (adding access control, ensuring `underlying` matches the actual asset, or forbidding sweeping NEW_TUSD) are valid and address the root cause.\"\n    },\n    {\n      \"finding_id\": 1,\n      \"vulnerability_type_claimed\": \"Free mint due to incorrect token transfer direction (no deposit collected)\",\n      \"location_claimed\": \"mint() / redeem()\",\n      \"classification\": \"BONUS_VALID\",\n      \"reasoning\": \"\n        **Bonus Valid**: This finding identifies a real vulnerability not covered in the ground truth. The `mint` function incorrectly uses `transfer` instead of `transferFrom`, allowing attackers to mint tokens without depositing any funds. The attack scenario is concrete and profitable, and the impact (draining the contract's NEW_TUSD balance) is genuine. The vulnerability does not require a trusted role to be compromised and is not a design choice or informational issue.\"\n    }\n  ],\n  \"target_assessment\": {\n    \"complete_found\": true,\n    \"partial_found\": false,\n    \"finding_id\": 0,\n    \"root_cause_match\": true,\n    \"location_match\": true,\n    \"type_match\": \"semantic\",\n    \"root_cause_identification\": {\n      \"score\": 1.0,\n      \"reasoning\": \"The finding's root cause explanation is technically accurate and semantically matches the ground truth. It correctly identifies the mismatch between `underlying` (OLD_TUSD) and the actual token used (NEW_TUSD), and how this allows NEW_TUSD to be swept.\"\n    },\n    \"attack_vector_validity\": {\n      \"score\": 1.0,\n      \"reasoning\": \"The attack scenario is concrete, step-by-step, and aligns with the ground truth. It demonstrates how an attacker can drain all NEW_TUSD from the contract by exploiting the `sweepToken` function.\"\n    },\n    \"fix_suggestion_validity\": {\n      \"score\": 0.9,\n      \"reasoning\": \"The suggested fixes are valid and address the root cause. They include adding access control, ensuring `underlying` matches the actual asset, and forbidding sweeping NEW_TUSD. The fix is slightly incomplete as it does not explicitly mention maintaining a mapping of all valid underlying addresses (as suggested in the ground truth), but it is still highly effective.\"\n    }\n  },\n  \"notes\": \"Finding 0 is a clear TARGET_MATCH, as it meets all criteria for root cause, location, and type. Finding 1 is a valid bonus finding, as it identifies a separate critical vulnerability not covered in the ground truth.\"\n}\n```"
}