{
  "sample_id": "ch_medical_tc_028",
  "variant": "chameleon_medical",
  "detector_model": "gpt-5.2",
  "prompt_type": "direct",
  "judge_model": "mistral-large",
  "timestamp": "2026-01-06T00:29:34.343909+00:00",
  "overall_verdict": {
    "said_vulnerable": true,
    "confidence_expressed": 0.95
  },
  "findings": [
    {
      "finding_id": 0,
      "vulnerability_type_claimed": "Missing authorization / missing signature verification allows arbitrary token withdrawal",
      "location_claimed": "dischargeFunds",
      "classification": "TARGET_MATCH",
      "reasoning": "\n        **Root Cause Match**: The ground truth specifies 'Compromised validator private keys enabled signature forgery' as the root cause, but the model identified a more fundamental issue: the contract does NOT verify signatures at all (only checks array lengths). While the root causes differ in specifics, the model's finding is a more severe version of the same class of vulnerability (signature verification failure). The model's root cause (missing signature verification) is a valid and more critical issue than the ground truth's focus on key compromise, as it allows arbitrary withdrawals without any need for key compromise.\n\n        **Location Match**: The model correctly identifies the `dischargeFunds` function, which matches the ground truth's vulnerable functions (`withdraw`, `dischargeFunds`). The ground truth mentions `withdraw`, but this function does not exist in the code; the model's focus on `dischargeFunds` is accurate.\n\n        **Type Match**: The model's type ('Missing authorization / missing signature verification allows arbitrary token withdrawal') is a semantic match to the ground truth's 'bridge_security'. Both describe security failures in bridge operations due to signature verification flaws.\n\n        **Quality**:\n        - **RCIR**: HIGH (0.9). The model accurately identifies the missing signature verification as the root cause, which is a more severe and immediate issue than the ground truth's focus on key compromise.\n        - **AVA**: HIGH (1.0). The attack scenario is concrete, step-by-step, and technically valid. It demonstrates how an attacker can drain funds without any validator key compromise.\n        - **FSV**: HIGH (0.9). The suggested fix (implementing ECDSA verification, SafeERC20, and signer validation) is correct and remediates the issue.\n      "
    },
    {
      "finding_id": 1,
      "vulnerability_type_claimed": "Unrestricted validator management (anyone can add validators)",
      "location_claimed": "includeAuditor",
      "classification": "BONUS_VALID",
      "reasoning": "\n        This is a valid vulnerability not covered in the ground truth. The `includeAuditor` function lacks access control, allowing anyone to add validators. While not directly exploitable in the current code (since validators are not used in `dischargeFunds`), it is a critical flaw if the validator set is ever relied upon for authorization. The attack scenario is concrete and plausible, and the suggested fix (access control) is correct.\n      "
    }
  ],
  "target_assessment": {
    "complete_found": true,
    "partial_found": false,
    "finding_id": 0,
    "root_cause_match": true,
    "location_match": true,
    "type_match": "semantic",
    "root_cause_identification": {
      "score": 0.9,
      "reasoning": "The model identifies a more severe root cause (missing signature verification entirely) than the ground truth (key compromise). While not identical, it is a valid and critical issue in the same vulnerability class (signature verification failure)."
    },
    "attack_vector_validity": {
      "score": 1.0,
      "reasoning": "The attack scenario is concrete, step-by-step, and technically valid. It demonstrates a direct exploit path to drain funds without requiring validator key compromise."
    },
    "fix_suggestion_validity": {
      "score": 0.9,
      "reasoning": "The suggested fix (ECDSA verification, SafeERC20, and signer validation) is correct and remediates the issue. It aligns with best practices for signature verification in bridges."
    }
  },
  "summary": {},
  "notes": "\n    The model's Finding 0 is classified as TARGET_MATCH because it identifies a critical vulnerability in the same function (`dischargeFunds`) and the same class of issue (signature verification failure) as the ground truth. While the root cause differs in specifics (missing verification vs. key compromise), the model's finding is more severe and directly exploitable, making it a valid and stronger match.\n\n    The ground truth's focus on `withdraw` is likely a misnomer, as the code only contains `dischargeFunds`. The model's focus on `dischargeFunds` is accurate.\n\n    Finding 1 is a valid bonus finding, as it identifies a real vulnerability not covered in the ground truth.\n  ",
  "judge_latency_ms": 19140.498876571655,
  "raw_response": "```json\n{\n  \"overall_verdict\": {\n    \"said_vulnerable\": true,\n    \"confidence_expressed\": 0.95\n  },\n  \"findings\": [\n    {\n      \"finding_id\": 0,\n      \"vulnerability_type_claimed\": \"Missing authorization / missing signature verification allows arbitrary token withdrawal\",\n      \"location_claimed\": \"dischargeFunds\",\n      \"classification\": \"TARGET_MATCH\",\n      \"reasoning\": \"\n        **Root Cause Match**: The ground truth specifies 'Compromised validator private keys enabled signature forgery' as the root cause, but the model identified a more fundamental issue: the contract does NOT verify signatures at all (only checks array lengths). While the root causes differ in specifics, the model's finding is a more severe version of the same class of vulnerability (signature verification failure). The model's root cause (missing signature verification) is a valid and more critical issue than the ground truth's focus on key compromise, as it allows arbitrary withdrawals without any need for key compromise.\n\n        **Location Match**: The model correctly identifies the `dischargeFunds` function, which matches the ground truth's vulnerable functions (`withdraw`, `dischargeFunds`). The ground truth mentions `withdraw`, but this function does not exist in the code; the model's focus on `dischargeFunds` is accurate.\n\n        **Type Match**: The model's type ('Missing authorization / missing signature verification allows arbitrary token withdrawal') is a semantic match to the ground truth's 'bridge_security'. Both describe security failures in bridge operations due to signature verification flaws.\n\n        **Quality**:\n        - **RCIR**: HIGH (0.9). The model accurately identifies the missing signature verification as the root cause, which is a more severe and immediate issue than the ground truth's focus on key compromise.\n        - **AVA**: HIGH (1.0). The attack scenario is concrete, step-by-step, and technically valid. It demonstrates how an attacker can drain funds without any validator key compromise.\n        - **FSV**: HIGH (0.9). The suggested fix (implementing ECDSA verification, SafeERC20, and signer validation) is correct and remediates the issue.\n      \"\n    },\n    {\n      \"finding_id\": 1,\n      \"vulnerability_type_claimed\": \"Unrestricted validator management (anyone can add validators)\",\n      \"location_claimed\": \"includeAuditor\",\n      \"classification\": \"BONUS_VALID\",\n      \"reasoning\": \"\n        This is a valid vulnerability not covered in the ground truth. The `includeAuditor` function lacks access control, allowing anyone to add validators. While not directly exploitable in the current code (since validators are not used in `dischargeFunds`), it is a critical flaw if the validator set is ever relied upon for authorization. The attack scenario is concrete and plausible, and the suggested fix (access control) is correct.\n      \"\n    }\n  ],\n  \"target_assessment\": {\n    \"complete_found\": true,\n    \"partial_found\": false,\n    \"finding_id\": 0,\n    \"root_cause_match\": true,\n    \"location_match\": true,\n    \"type_match\": \"semantic\",\n    \"root_cause_identification\": {\n      \"score\": 0.9,\n      \"reasoning\": \"The model identifies a more severe root cause (missing signature verification entirely) than the ground truth (key compromise). While not identical, it is a valid and critical issue in the same vulnerability class (signature verification failure).\"\n    },\n    \"attack_vector_validity\": {\n      \"score\": 1.0,\n      \"reasoning\": \"The attack scenario is concrete, step-by-step, and technically valid. It demonstrates a direct exploit path to drain funds without requiring validator key compromise.\"\n    },\n    \"fix_suggestion_validity\": {\n      \"score\": 0.9,\n      \"reasoning\": \"The suggested fix (ECDSA verification, SafeERC20, and signer validation) is correct and remediates the issue. It aligns with best practices for signature verification in bridges.\"\n    }\n  },\n  \"notes\": \"\n    The model's Finding 0 is classified as TARGET_MATCH because it identifies a critical vulnerability in the same function (`dischargeFunds`) and the same class of issue (signature verification failure) as the ground truth. While the root cause differs in specifics (missing verification vs. key compromise), the model's finding is more severe and directly exploitable, making it a valid and stronger match.\n\n    The ground truth's focus on `withdraw` is likely a misnomer, as the code only contains `dischargeFunds`. The model's focus on `dischargeFunds` is accurate.\n\n    Finding 1 is a valid bonus finding, as it identifies a real vulnerability not covered in the ground truth.\n  \"\n}\n```"
}