{
  "sample_id": "ch_medical_tc_014",
  "variant": "chameleon_medical",
  "detector_model": "gpt-5.2",
  "prompt_type": "direct",
  "judge_model": "mistral-large",
  "timestamp": "2026-01-06T00:27:02.870624+00:00",
  "overall_verdict": {
    "said_vulnerable": true,
    "confidence_expressed": 0.93
  },
  "findings": [
    {
      "finding_id": 0,
      "vulnerability_type_claimed": "Unrestricted arbitrary external call (arbitrary call execution)",
      "location_claimed": "YieldController.exchangecredentialsExactJarForJar",
      "classification": "TARGET_MATCH",
      "reasoning": "\n        **Root Cause Match**: The finding correctly identifies that the `exchangecredentialsExactJarForJar` function allows arbitrary external calls with user-provided targets and data without validation. This matches the ground truth root cause, which emphasizes the lack of validation in the controller's arbitrary call functionality.\n\n        **Location Match**: The finding correctly identifies the vulnerable function as `exchangecredentialsExactJarForJar`, which matches the ground truth.\n\n        **Type Match**: The type 'Unrestricted arbitrary external call (arbitrary call execution)' is a semantic match to 'access_control' in the ground truth, as the core issue is the lack of access control over who can execute arbitrary calls.\n\n        **Quality**:\n        - **RCIR**: HIGH (0.9). The root cause is accurately and specifically identified.\n        - **AVA**: HIGH (0.9). The attack scenario is concrete, step-by-step, and aligns with the ground truth.\n        - **FSV**: HIGH (0.9). The suggested fix (access control and/or removing arbitrary call capability) aligns with the ground truth fix.\n      "
    },
    {
      "finding_id": 1,
      "vulnerability_type_claimed": "Missing access control on fund withdrawal functions enabling theft via controller arbitrary call",
      "location_claimed": "YieldStrategy.dischargeAllFunds / YieldStrategy.dischargeFunds",
      "classification": "BONUS_VALID",
      "reasoning": "\n        **Bonus Valid**: This finding identifies a real, additional vulnerability not covered in the ground truth. The issue is the lack of access control on `dischargeAllFunds` and `dischargeFunds`, which, when combined with the arbitrary call vulnerability in the controller, enables theft of funds. The attack scenario is concrete and does not require compromised roles. The impact is genuine (loss of funds), and the fix suggestion is valid.\n      "
    }
  ],
  "target_assessment": {
    "complete_found": true,
    "partial_found": false,
    "finding_id": 0,
    "root_cause_match": true,
    "location_match": true,
    "type_match": "semantic",
    "root_cause_identification": {
      "score": 0.9,
      "reasoning": "The root cause is accurately identified as the lack of validation in arbitrary external calls, matching the ground truth."
    },
    "attack_vector_validity": {
      "score": 0.9,
      "reasoning": "The attack scenario is concrete, step-by-step, and aligns with the ground truth, demonstrating a valid exploit path."
    },
    "fix_suggestion_validity": {
      "score": 0.9,
      "reasoning": "The suggested fix (access control and/or removing arbitrary call capability) is valid and aligns with the ground truth fix."
    }
  },
  "summary": {},
  "notes": "\n    Finding 0 is a TARGET_MATCH as it meets all criteria: correct root cause, correct location, and semantic type match. Finding 1 is a valid bonus finding, as it identifies a real, additional vulnerability not covered in the ground truth.\n  ",
  "judge_latency_ms": 13511.943340301514,
  "raw_response": "```json\n{\n  \"overall_verdict\": {\n    \"said_vulnerable\": true,\n    \"confidence_expressed\": 0.93\n  },\n  \"findings\": [\n    {\n      \"finding_id\": 0,\n      \"vulnerability_type_claimed\": \"Unrestricted arbitrary external call (arbitrary call execution)\",\n      \"location_claimed\": \"YieldController.exchangecredentialsExactJarForJar\",\n      \"classification\": \"TARGET_MATCH\",\n      \"reasoning\": \"\n        **Root Cause Match**: The finding correctly identifies that the `exchangecredentialsExactJarForJar` function allows arbitrary external calls with user-provided targets and data without validation. This matches the ground truth root cause, which emphasizes the lack of validation in the controller's arbitrary call functionality.\n\n        **Location Match**: The finding correctly identifies the vulnerable function as `exchangecredentialsExactJarForJar`, which matches the ground truth.\n\n        **Type Match**: The type 'Unrestricted arbitrary external call (arbitrary call execution)' is a semantic match to 'access_control' in the ground truth, as the core issue is the lack of access control over who can execute arbitrary calls.\n\n        **Quality**:\n        - **RCIR**: HIGH (0.9). The root cause is accurately and specifically identified.\n        - **AVA**: HIGH (0.9). The attack scenario is concrete, step-by-step, and aligns with the ground truth.\n        - **FSV**: HIGH (0.9). The suggested fix (access control and/or removing arbitrary call capability) aligns with the ground truth fix.\n      \"\n    },\n    {\n      \"finding_id\": 1,\n      \"vulnerability_type_claimed\": \"Missing access control on fund withdrawal functions enabling theft via controller arbitrary call\",\n      \"location_claimed\": \"YieldStrategy.dischargeAllFunds / YieldStrategy.dischargeFunds\",\n      \"classification\": \"BONUS_VALID\",\n      \"reasoning\": \"\n        **Bonus Valid**: This finding identifies a real, additional vulnerability not covered in the ground truth. The issue is the lack of access control on `dischargeAllFunds` and `dischargeFunds`, which, when combined with the arbitrary call vulnerability in the controller, enables theft of funds. The attack scenario is concrete and does not require compromised roles. The impact is genuine (loss of funds), and the fix suggestion is valid.\n      \"\n    }\n  ],\n  \"target_assessment\": {\n    \"complete_found\": true,\n    \"partial_found\": false,\n    \"finding_id\": 0,\n    \"root_cause_match\": true,\n    \"location_match\": true,\n    \"type_match\": \"semantic\",\n    \"root_cause_identification\": {\n      \"score\": 0.9,\n      \"reasoning\": \"The root cause is accurately identified as the lack of validation in arbitrary external calls, matching the ground truth.\"\n    },\n    \"attack_vector_validity\": {\n      \"score\": 0.9,\n      \"reasoning\": \"The attack scenario is concrete, step-by-step, and aligns with the ground truth, demonstrating a valid exploit path.\"\n    },\n    \"fix_suggestion_validity\": {\n      \"score\": 0.9,\n      \"reasoning\": \"The suggested fix (access control and/or removing arbitrary call capability) is valid and aligns with the ground truth fix.\"\n    }\n  },\n  \"notes\": \"\n    Finding 0 is a TARGET_MATCH as it meets all criteria: correct root cause, correct location, and semantic type match. Finding 1 is a valid bonus finding, as it identifies a real, additional vulnerability not covered in the ground truth.\n  \"\n}\n```"
}