{
  "sample_id": "gs_025",
  "dataset": "gs",
  "prompt_type": "context_protocol_cot_naturalistic",
  "detector_model": "claude-opus-4-5",
  "judge_model": "mistral-large",
  "timestamp": "2026-01-06T05:59:27.161260+00:00",
  "overall_verdict": {
    "said_vulnerable": true,
    "confidence_expressed": 0.85
  },
  "findings": [
    {
      "finding_id": 0,
      "vulnerability_type_claimed": "Centralization Risk / Trust Assumption",
      "location_claimed": "Lines with EMERGENCY_ROLE functions",
      "classification": "TARGET_MATCH",
      "reasoning": "\n        **Root Cause Match**: The finding correctly identifies that the EMERGENCY_ROLE can transfer aWETH (and other tokens) without restrictions, which aligns with the ground truth's root cause: 'EMERGENCY_ROLE in PositionManager can transfer aWETH from the contract to any address without restrictions, which may be unintended and creates additional risks in case this role is compromised.' The explanation is semantically equivalent, focusing on the unrestricted transfer capability of the EMERGENCY_ROLE.\n\n        **Location Match**: The finding explicitly mentions the EMERGENCY_ROLE functions, which includes the `emergencyTokenTransfer` function specified in the ground truth.\n\n        **Type Match**: The claimed type 'Centralization Risk / Trust Assumption' is a semantic match to the ground truth's 'access_control' type. Both describe the same underlying issue of excessive trust placed in a privileged role.\n      "
    },
    {
      "finding_id": 1,
      "vulnerability_type_claimed": "Missing Input Validation",
      "location_claimed": "setLiquidityBuffer function",
      "classification": "BONUS_VALID",
      "reasoning": "\n        This finding identifies a real vulnerability not covered in the ground truth. The `setLiquidityBuffer` function lacks input validation, which could lead to breaking the withdraw flow if set to an invalid address. The attack scenario is concrete (compromised/careless MANAGER_ROLE setting liquidityBuffer to address(0)), and the impact is genuine (failed withdrawals). This meets all BONUS_VALID criteria.\n      "
    },
    {
      "finding_id": 2,
      "vulnerability_type_claimed": "Missing Event",
      "location_claimed": "setLiquidityBuffer function",
      "classification": "INFORMATIONAL",
      "reasoning": "\n        While the observation is true (lack of event emission for a critical administrative action), it does not pose a direct security risk. The impact is limited to off-chain monitoring difficulties, which qualifies as INFORMATIONAL.\n      "
    },
    {
      "finding_id": 3,
      "vulnerability_type_claimed": "Initialization Front-running",
      "location_claimed": "initialize function",
      "classification": "BONUS_VALID",
      "reasoning": "\n        This finding identifies a real vulnerability not covered in the ground truth. The `initialize` function is susceptible to front-running, which could allow an attacker to take control of the contract. The attack scenario is concrete (front-running the initialization with malicious parameters), and the impact is genuine (unauthorized control). This meets all BONUS_VALID criteria.\n      "
    }
  ],
  "target_assessment": {
    "complete_found": true,
    "partial_found": false,
    "finding_id": 0,
    "root_cause_match": true,
    "location_match": true,
    "type_match": "semantic",
    "root_cause_identification": {
      "score": 0.9,
      "reasoning": "\n        The finding's root cause explanation is semantically equivalent to the ground truth. It correctly identifies the unrestricted transfer capability of the EMERGENCY_ROLE and the risks associated with its compromise. The explanation is technically accurate and specific.\n      "
    },
    "attack_vector_validity": {
      "score": 0.9,
      "reasoning": "\n        The attack scenario provided in the finding is concrete and matches the ground truth's scenario. It outlines the steps an attacker would take to drain funds by compromising the EMERGENCY_ROLE and calling `emergencyTokenTransfer`. The scenario is valid and actionable.\n      "
    },
    "fix_suggestion_validity": {
      "score": 0.8,
      "reasoning": "\n        The suggested fix (adding a timelock, multi-sig approval, or limiting transfers to a predefined address) is a valid alternative to the ground truth's fix (disallowing aWETH emergency transfers). While not identical, it effectively mitigates the risk by adding safeguards to the emergency functions.\n      "
    }
  },
  "summary": {},
  "notes": "\n    The LLM's detection output successfully identified the TARGET vulnerability (Finding 0) with high accuracy. The root cause, location, and type were all correctly identified, albeit with slightly different terminology. Additionally, the LLM found two other valid vulnerabilities (Findings 1 and 3) that were not part of the ground truth, demonstrating strong analytical capabilities.\n  ",
  "judge_latency_ms": 19840.007066726685,
  "raw_response": "```json\n{\n  \"overall_verdict\": {\n    \"said_vulnerable\": true,\n    \"confidence_expressed\": 0.85\n  },\n  \"findings\": [\n    {\n      \"finding_id\": 0,\n      \"vulnerability_type_claimed\": \"Centralization Risk / Trust Assumption\",\n      \"location_claimed\": \"Lines with EMERGENCY_ROLE functions\",\n      \"classification\": \"TARGET_MATCH\",\n      \"reasoning\": \"\n        **Root Cause Match**: The finding correctly identifies that the EMERGENCY_ROLE can transfer aWETH (and other tokens) without restrictions, which aligns with the ground truth's root cause: 'EMERGENCY_ROLE in PositionManager can transfer aWETH from the contract to any address without restrictions, which may be unintended and creates additional risks in case this role is compromised.' The explanation is semantically equivalent, focusing on the unrestricted transfer capability of the EMERGENCY_ROLE.\n\n        **Location Match**: The finding explicitly mentions the EMERGENCY_ROLE functions, which includes the `emergencyTokenTransfer` function specified in the ground truth.\n\n        **Type Match**: The claimed type 'Centralization Risk / Trust Assumption' is a semantic match to the ground truth's 'access_control' type. Both describe the same underlying issue of excessive trust placed in a privileged role.\n      \"\n    },\n    {\n      \"finding_id\": 1,\n      \"vulnerability_type_claimed\": \"Missing Input Validation\",\n      \"location_claimed\": \"setLiquidityBuffer function\",\n      \"classification\": \"BONUS_VALID\",\n      \"reasoning\": \"\n        This finding identifies a real vulnerability not covered in the ground truth. The `setLiquidityBuffer` function lacks input validation, which could lead to breaking the withdraw flow if set to an invalid address. The attack scenario is concrete (compromised/careless MANAGER_ROLE setting liquidityBuffer to address(0)), and the impact is genuine (failed withdrawals). This meets all BONUS_VALID criteria.\n      \"\n    },\n    {\n      \"finding_id\": 2,\n      \"vulnerability_type_claimed\": \"Missing Event\",\n      \"location_claimed\": \"setLiquidityBuffer function\",\n      \"classification\": \"INFORMATIONAL\",\n      \"reasoning\": \"\n        While the observation is true (lack of event emission for a critical administrative action), it does not pose a direct security risk. The impact is limited to off-chain monitoring difficulties, which qualifies as INFORMATIONAL.\n      \"\n    },\n    {\n      \"finding_id\": 3,\n      \"vulnerability_type_claimed\": \"Initialization Front-running\",\n      \"location_claimed\": \"initialize function\",\n      \"classification\": \"BONUS_VALID\",\n      \"reasoning\": \"\n        This finding identifies a real vulnerability not covered in the ground truth. The `initialize` function is susceptible to front-running, which could allow an attacker to take control of the contract. The attack scenario is concrete (front-running the initialization with malicious parameters), and the impact is genuine (unauthorized control). This meets all BONUS_VALID criteria.\n      \"\n    }\n  ],\n  \"target_assessment\": {\n    \"complete_found\": true,\n    \"partial_found\": false,\n    \"finding_id\": 0,\n    \"root_cause_match\": true,\n    \"location_match\": true,\n    \"type_match\": \"semantic\",\n    \"root_cause_identification\": {\n      \"score\": 0.9,\n      \"reasoning\": \"\n        The finding's root cause explanation is semantically equivalent to the ground truth. It correctly identifies the unrestricted transfer capability of the EMERGENCY_ROLE and the risks associated with its compromise. The explanation is technically accurate and specific.\n      \"\n    },\n    \"attack_vector_validity\": {\n      \"score\": 0.9,\n      \"reasoning\": \"\n        The attack scenario provided in the finding is concrete and matches the ground truth's scenario. It outlines the steps an attacker would take to drain funds by compromising the EMERGENCY_ROLE and calling `emergencyTokenTransfer`. The scenario is valid and actionable.\n      \"\n    },\n    \"fix_suggestion_validity\": {\n      \"score\": 0.8,\n      \"reasoning\": \"\n        The suggested fix (adding a timelock, multi-sig approval, or limiting transfers to a predefined address) is a valid alternative to the ground truth's fix (disallowing aWETH emergency transfers). While not identical, it effectively mitigates the risk by adding safeguards to the emergency functions.\n      \"\n    }\n  },\n  \"notes\": \"\n    The LLM's detection output successfully identified the TARGET vulnerability (Finding 0) with high accuracy. The root cause, location, and type were all correctly identified, albeit with slightly different terminology. Additionally, the LLM found two other valid vulnerabilities (Findings 1 and 3) that were not part of the ground truth, demonstrating strong analytical capabilities.\n  \"\n}\n```"
}