{
  "sample_id": "ds_t3_002",
  "detector_model": "qwen3-coder-plus",
  "prompt_type": "direct",
  "judge_model": "mistral-large",
  "timestamp": "2026-01-06T02:27:06.545670+00:00",
  "overall_verdict": {
    "said_vulnerable": true,
    "confidence_expressed": 0.85
  },
  "findings": [
    {
      "finding_id": 0,
      "vulnerability_type_claimed": "Token Deflation Attack",
      "location_claimed": "CoreVault.deposit and CoreVault.withdraw",
      "classification": "TARGET_MATCH",
      "reasoning": "\n        **Root Cause Match**: The finding correctly identifies that the CoreVault contract uses the deposited amount directly without accounting for token fees/taxes (burning via the `cut` function in STA tokens). This matches the ground truth's root cause of token incompatibility due to not verifying the actual deposited amount. The ground truth's fix suggestion (balance comparison) aligns with the finding's explanation of the issue.\n\n        **Location Match**: The ground truth specifies the `deposit` function as vulnerable, and the finding correctly identifies `CoreVault.deposit` as part of the vulnerable functions. While the finding also includes `CoreVault.withdraw`, this does not invalidate the match since the primary issue is in the `deposit` function.\n\n        **Type Match**: The finding's type 'Token Deflation Attack' is a semantic match to the ground truth's 'token_incompatibility'. Both describe the same underlying issue of token behavior incompatibility with the vault's accounting logic.\n      "
    },
    {
      "finding_id": 1,
      "vulnerability_type_claimed": "Token Deflation Attack",
      "location_claimed": "CoreVault.withdraw",
      "classification": "BONUS_VALID",
      "reasoning": "\n        This finding identifies a real issue in the `CoreVault.withdraw` function where the vault's internal accounting becomes desynchronized due to the deflationary mechanism of STA tokens. The attack scenario is concrete and demonstrates a genuine vulnerability (vault's token balance mismatch). However, this is not part of the ground truth, so it is classified as a BONUS_VALID finding.\n      "
    }
  ],
  "target_assessment": {
    "complete_found": true,
    "partial_found": false,
    "finding_id": 0,
    "root_cause_match": true,
    "location_match": true,
    "type_match": "semantic",
    "root_cause_identification": {
      "score": 1.0,
      "reasoning": "The finding precisely identifies the root cause: the vault's accounting logic does not account for the deflationary mechanism of STA tokens, leading to incorrect balance crediting. This matches the ground truth's implied root cause (token incompatibility due to not verifying actual deposited amounts)."
    },
    "attack_vector_validity": {
      "score": 1.0,
      "reasoning": "The attack scenario is concrete and step-by-step, demonstrating how an attacker can exploit the vault's accounting logic to create a shortfall. This aligns with the ground truth's concern about deposited amounts being lower than expected."
    },
    "fix_suggestion_validity": {
      "score": 1.0,
      "reasoning": "The suggested fix (balance comparison approach) is identical to the ground truth's fix and correctly remediates the issue by ensuring the vault credits the actual deposited amount."
    }
  },
  "summary": {},
  "notes": "\n    - Finding 0 is a TARGET_MATCH because it meets all criteria: correct root cause, correct location (deposit function), and semantic type match.\n    - Finding 1 is a valid bonus finding but not part of the ground truth.\n    - The ground truth's root cause was not explicitly stated, but the finding's explanation aligns with the implied root cause (token incompatibility due to deflationary mechanisms).\n  ",
  "judge_latency_ms": 14844.938039779663,
  "raw_response": "```json\n{\n  \"overall_verdict\": {\n    \"said_vulnerable\": true,\n    \"confidence_expressed\": 0.85\n  },\n  \"findings\": [\n    {\n      \"finding_id\": 0,\n      \"vulnerability_type_claimed\": \"Token Deflation Attack\",\n      \"location_claimed\": \"CoreVault.deposit and CoreVault.withdraw\",\n      \"classification\": \"TARGET_MATCH\",\n      \"reasoning\": \"\n        **Root Cause Match**: The finding correctly identifies that the CoreVault contract uses the deposited amount directly without accounting for token fees/taxes (burning via the `cut` function in STA tokens). This matches the ground truth's root cause of token incompatibility due to not verifying the actual deposited amount. The ground truth's fix suggestion (balance comparison) aligns with the finding's explanation of the issue.\n\n        **Location Match**: The ground truth specifies the `deposit` function as vulnerable, and the finding correctly identifies `CoreVault.deposit` as part of the vulnerable functions. While the finding also includes `CoreVault.withdraw`, this does not invalidate the match since the primary issue is in the `deposit` function.\n\n        **Type Match**: The finding's type 'Token Deflation Attack' is a semantic match to the ground truth's 'token_incompatibility'. Both describe the same underlying issue of token behavior incompatibility with the vault's accounting logic.\n      \"\n    },\n    {\n      \"finding_id\": 1,\n      \"vulnerability_type_claimed\": \"Token Deflation Attack\",\n      \"location_claimed\": \"CoreVault.withdraw\",\n      \"classification\": \"BONUS_VALID\",\n      \"reasoning\": \"\n        This finding identifies a real issue in the `CoreVault.withdraw` function where the vault's internal accounting becomes desynchronized due to the deflationary mechanism of STA tokens. The attack scenario is concrete and demonstrates a genuine vulnerability (vault's token balance mismatch). However, this is not part of the ground truth, so it is classified as a BONUS_VALID finding.\n      \"\n    }\n  ],\n  \"target_assessment\": {\n    \"complete_found\": true,\n    \"partial_found\": false,\n    \"finding_id\": 0,\n    \"root_cause_match\": true,\n    \"location_match\": true,\n    \"type_match\": \"semantic\",\n    \"root_cause_identification\": {\n      \"score\": 1.0,\n      \"reasoning\": \"The finding precisely identifies the root cause: the vault's accounting logic does not account for the deflationary mechanism of STA tokens, leading to incorrect balance crediting. This matches the ground truth's implied root cause (token incompatibility due to not verifying actual deposited amounts).\"\n    },\n    \"attack_vector_validity\": {\n      \"score\": 1.0,\n      \"reasoning\": \"The attack scenario is concrete and step-by-step, demonstrating how an attacker can exploit the vault's accounting logic to create a shortfall. This aligns with the ground truth's concern about deposited amounts being lower than expected.\"\n    },\n    \"fix_suggestion_validity\": {\n      \"score\": 1.0,\n      \"reasoning\": \"The suggested fix (balance comparison approach) is identical to the ground truth's fix and correctly remediates the issue by ensuring the vault credits the actual deposited amount.\"\n    }\n  },\n  \"notes\": \"\n    - Finding 0 is a TARGET_MATCH because it meets all criteria: correct root cause, correct location (deposit function), and semantic type match.\n    - Finding 1 is a valid bonus finding but not part of the ground truth.\n    - The ground truth's root cause was not explicitly stated, but the finding's explanation aligns with the implied root cause (token incompatibility due to deflationary mechanisms).\n  \"\n}\n```"
}