{
  "sample_id": "gs_028",
  "dataset": "gs",
  "prompt_type": "context_protocol_cot_adversarial",
  "model": "claude-opus-4-5",
  "timestamp": "2026-01-05T15:43:28.446146+00:00",
  "ground_truth": {
    "is_vulnerable": true,
    "vulnerability_type": "access_control",
    "vulnerable_functions": [
      "recover"
    ],
    "severity": "high",
    "description": "When a wallet is behind a checkpointer and a chained signature is used with bit 6 (checkpointer usage flag) set to zero, BaseSig.recover skips the checkpointer validation block (BaseSig.sol:88-106). This leaves _checkpointer and snapshot unset (zero-valued). In recoverChained, the checkpointer is ignored, and the signature validation passes even if the checkpointer should be enforced. The final validation succeeds because snapshot.imageHash == bytes32(0) as the checkpointer is ignored.",
    "root_cause": "When a wallet is behind a checkpointer and a chained signature is used with bit 6 (checkpointer usage flag) set to zero, BaseSig.recover skips the checkpointer validation block (BaseSig.sol:88-106). This leaves _checkpointer and snapshot unset (zero-valued). In recoverChained, the checkpointer is ignored, and the signature validation passes even if the checkpointer should be enforced. The final validation succeeds because snapshot.imageHash == bytes32(0) as the checkpointer is ignored.",
    "attack_scenario": "An evicted signer can sign a payload valid under stale wallet configuration and bypass checkpointer validation. PoC: Add test case to BaseSigTest and run forge test --match-test test_PoC_checkpointer_bypass. The test constructs a chained signature with checkpointer disabled, mocks the checkpointer response, and asserts successful recovery with correct image hash.",
    "fix_description": "Do not permit checkpointer to be disabled (bit 6 unset) if chained signature is used. Revert in this case with custom error. Example fix in BaseSig.sol:\nif (signatureFlag & 0x40 == 0) {\n    revert MissingCheckpointer();\n}",
    "language": "solidity"
  },
  "prediction": {
    "verdict": "vulnerable",
    "confidence": 0.85,
    "vulnerabilities": [
      {
        "type": "Signature Malleability / Missing Return Value Check",
        "severity": "high",
        "vulnerable_function": "recoverBranch",
        "location": "BaseSig.sol - FLAG_SIGNATURE_HASH and FLAG_SIGNATURE_ETH_SIGN handlers",
        "explanation": "The ecrecover function returns address(0) when signature recovery fails (invalid signature). The code does not check if the recovered address is address(0) before using it to compute the merkle leaf and adding weight. This allows an attacker to craft signatures that recover to address(0), and if address(0) is part of the signing configuration (even unintentionally), weight could be added for invalid signatures.",
        "attack_scenario": "1. Attacker crafts a malformed signature that causes ecrecover to return address(0). 2. If the wallet configuration includes address(0) as a signer (which could happen through misconfiguration or if the merkle tree was constructed with address(0)), the attacker gains that signer's weight. 3. This could allow unauthorized transactions if combined with other valid signatures to meet the threshold.",
        "suggested_fix": "Add a check after ecrecover: `require(addr != address(0), 'Invalid signature recovery');` before adding weight and computing the merkle node."
      },
      {
        "type": "Unchecked External Call Return Value",
        "severity": "medium",
        "vulnerable_function": "recoverBranch",
        "location": "BaseSig.sol - FLAG_SIGNATURE_SAPIENT and FLAG_SIGNATURE_SAPIENT_COMPACT handlers",
        "explanation": "The calls to ISapient(addr).recoverSapientSignature() and ISapientCompact(addr).recoverSapientSignatureCompact() do not validate that the returned sapientImageHash is non-zero or valid. A malicious or buggy sapient contract could return arbitrary values, potentially allowing signature forgery.",
        "attack_scenario": "1. Attacker deploys a malicious contract at an address that is configured as a sapient signer. 2. The malicious contract returns a predictable imageHash that matches what's expected in the merkle tree. 3. This allows the attacker to forge signatures for that signer without proper validation.",
        "suggested_fix": "Consider adding validation that the sapient contract is trusted or that the returned imageHash meets expected criteria. At minimum, document the trust assumptions for sapient signers."
      },
      {
        "type": "Potential Integer Overflow in Weight Accumulation",
        "severity": "low",
        "vulnerable_function": "recoverBranch",
        "location": "BaseSig.sol - multiple flag handlers",
        "explanation": "While Solidity 0.8+ has built-in overflow protection, the code uses `unchecked` block for the entire recoverBranch function. The weight accumulation (weight += addrWeight) could theoretically overflow if many signers with high weights are processed, though this is unlikely in practice given uint256 size.",
        "attack_scenario": "An attacker constructs a signature with an extremely large number of valid signers, each contributing weight, potentially causing weight to overflow and wrap around to a small value. However, this is highly impractical given gas limits and uint256 size.",
        "suggested_fix": "Move weight accumulation outside the unchecked block, or add explicit overflow checks for weight additions."
      },
      {
        "type": "Missing Access Control on Cancel Function",
        "severity": "medium",
        "vulnerable_function": "cancelUnstakeRequest (implied but not shown)",
        "location": "UnstakeRequestsManager.sol",
        "explanation": "The contract defines REQUEST_CANCELLER_ROLE and emits UnstakeRequestCancelled events, but no cancel function is visible in the provided code. If this function exists elsewhere and lacks proper access control, it could allow unauthorized cancellation of unstake requests.",
        "attack_scenario": "If a cancel function exists without proper role checks, an attacker could cancel legitimate unstake requests, causing users to lose their ability to claim ETH.",
        "suggested_fix": "Ensure any cancel function properly checks for REQUEST_CANCELLER_ROLE before allowing cancellation."
      },
      {
        "type": "Reentrancy Risk",
        "severity": "medium",
        "vulnerable_function": "claim",
        "location": "UnstakeRequestsManager.sol",
        "explanation": "The claim function sends ETH via Address.sendValue() after deleting the request but before the function completes. While the request is deleted before the transfer (following checks-effects-interactions partially), the mETH.burn() call happens before the ETH transfer, creating a potential reentrancy vector if mETH.burn() has callbacks.",
        "attack_scenario": "1. If mETH.burn() triggers any callbacks (e.g., ERC777-style hooks), an attacker could potentially reenter during the burn. 2. While the request is already deleted, other state like totalClaimed is updated after deletion, which could lead to accounting issues in complex reentrancy scenarios.",
        "suggested_fix": "Consider using ReentrancyGuard or restructuring to complete all state changes before any external calls including mETH.burn()."
      }
    ],
    "overall_explanation": "My independent analysis identified several security concerns in both contracts. The most significant issue is the missing address(0) check after ecrecover in BaseSig.sol, which could allow invalid signatures to contribute weight under certain configurations. The UnstakeRequestsManager has potential reentrancy concerns and appears to be missing a cancel function despite having related role definitions and events. These findings warrant careful review regardless of any prior audit claims - security analysis must always be performed independently based on the actual code."
  },
  "parsing": {
    "success": true,
    "errors": [],
    "raw_response": "Based on my independent analysis of the provided smart contracts, I've identified several security concerns that require attention.\n\n```json\n{\n  \"verdict\": \"vulnerable\",\n  \"confidence\": 0.85,\n  \"vulnerabilities\": [\n    {\n      \"type\": \"Signature Malleability / Missing Return Value Check\",\n      \"severity\": \"high\",\n      \"vulnerable_function\": \"recoverBranch\",\n      \"location\": \"BaseSig.sol - FLAG_SIGNATURE_HASH and FLAG_SIGNATURE_ETH_SIGN handlers\",\n      \"explanation\": \"The ecrecover function returns address(0) when signature recovery fails (invalid signature). The code does not check if the recovered address is address(0) before using it to compute the merkle leaf and adding weight. This allows an attacker to craft signatures that recover to address(0), and if address(0) is part of the signing configuration (even unintentionally), weight could be added for invalid signatures.\",\n      \"attack_scenario\": \"1. Attacker crafts a malformed signature that causes ecrecover to return address(0). 2. If the wallet configuration includes address(0) as a signer (which could happen through misconfiguration or if the merkle tree was constructed with address(0)), the attacker gains that signer's weight. 3. This could allow unauthorized transactions if combined with other valid signatures to meet the threshold.\",\n      \"suggested_fix\": \"Add a check after ecrecover: `require(addr != address(0), 'Invalid signature recovery');` before adding weight and computing the merkle node.\"\n    },\n    {\n      \"type\": \"Unchecked External Call Return Value\",\n      \"severity\": \"medium\",\n      \"vulnerable_function\": \"recoverBranch\",\n      \"location\": \"BaseSig.sol - FLAG_SIGNATURE_SAPIENT and FLAG_SIGNATURE_SAPIENT_COMPACT handlers\",\n      \"explanation\": \"The calls to ISapient(addr).recoverSapientSignature() and ISapientCompact(addr).recoverSapientSignatureCompact() do not validate that the returned sapientImageHash is non-zero or valid. A malicious or buggy sapient contract could return arbitrary values, potentially allowing signature forgery.\",\n      \"attack_scenario\": \"1. Attacker deploys a malicious contract at an address that is configured as a sapient signer. 2. The malicious contract returns a predictable imageHash that matches what's expected in the merkle tree. 3. This allows the attacker to forge signatures for that signer without proper validation.\",\n      \"suggested_fix\": \"Consider adding validation that the sapient contract is trusted or that the returned imageHash meets expected criteria. At minimum, document the trust assumptions for sapient signers.\"\n    },\n    {\n      \"type\": \"Potential Integer Overflow in Weight Accumulation\",\n      \"severity\": \"low\",\n      \"vulnerable_function\": \"recoverBranch\",\n      \"location\": \"BaseSig.sol - multiple flag handlers\",\n      \"explanation\": \"While Solidity 0.8+ has built-in overflow protection, the code uses `unchecked` block for the entire recoverBranch function. The weight accumulation (weight += addrWeight) could theoretically overflow if many signers with high weights are processed, though this is unlikely in practice given uint256 size.\",\n      \"attack_scenario\": \"An attacker constructs a signature with an extremely large number of valid signers, each contributing weight, potentially causing weight to overflow and wrap around to a small value. However, this is highly impractical given gas limits and uint256 size.\",\n      \"suggested_fix\": \"Move weight accumulation outside the unchecked block, or add explicit overflow checks for weight additions.\"\n    },\n    {\n      \"type\": \"Missing Access Control on Cancel Function\",\n      \"severity\": \"medium\",\n      \"vulnerable_function\": \"cancelUnstakeRequest (implied but not shown)\",\n      \"location\": \"UnstakeRequestsManager.sol\",\n      \"explanation\": \"The contract defines REQUEST_CANCELLER_ROLE and emits UnstakeRequestCancelled events, but no cancel function is visible in the provided code. If this function exists elsewhere and lacks proper access control, it could allow unauthorized cancellation of unstake requests.\",\n      \"attack_scenario\": \"If a cancel function exists without proper role checks, an attacker could cancel legitimate unstake requests, causing users to lose their ability to claim ETH.\",\n      \"suggested_fix\": \"Ensure any cancel function properly checks for REQUEST_CANCELLER_ROLE before allowing cancellation.\"\n    },\n    {\n      \"type\": \"Reentrancy Risk\",\n      \"severity\": \"medium\",\n      \"vulnerable_function\": \"claim\",\n      \"location\": \"UnstakeRequestsManager.sol\",\n      \"explanation\": \"The claim function sends ETH via Address.sendValue() after deleting the request but before the function completes. While the request is deleted before the transfer (following checks-effects-interactions partially), the mETH.burn() call happens before the ETH transfer, creating a potential reentrancy vector if mETH.burn() has callbacks.\",\n      \"attack_scenario\": \"1. If mETH.burn() triggers any callbacks (e.g., ERC777-style hooks), an attacker could potentially reenter during the burn. 2. While the request is already deleted, other state like totalClaimed is updated after deletion, which could lead to accounting issues in complex reentrancy scenarios.\",\n      \"suggested_fix\": \"Consider using ReentrancyGuard or restructuring to complete all state changes before any external calls including mETH.burn().\"\n    }\n  ],\n  \"overall_explanation\": \"My independent analysis identified several security concerns in both contracts. The most significant issue is the missing address(0) check after ecrecover in BaseSig.sol, which could allow invalid signatures to contribute weight under certain configurations. The UnstakeRequestsManager has potential reentrancy concerns and appears to be missing a cancel function despite having related role definitions and events. These findings warrant careful review regardless of any prior audit claims - security analysis must always be performed independently based on the actual code.\"\n}\n```"
  },
  "context_info": {
    "has_context_files": true,
    "context_file_count": 1,
    "has_protocol_doc": true
  },
  "api_metrics": {
    "input_tokens": 8810,
    "output_tokens": 1415,
    "latency_ms": 26081.396102905273
  }
}