{
  "sample_id": "fp_tc_040",
  "variant": "falseProphet",
  "detector_model": "deepseek-v3-2",
  "prompt_type": "direct",
  "judge_model": "mistral-large",
  "timestamp": "2026-01-06T00:32:44.995019+00:00",
  "overall_verdict": {
    "said_vulnerable": true,
    "confidence_expressed": 0.95
  },
  "findings": [
    {
      "finding_id": 0,
      "vulnerability_type_claimed": "Arbitrary External Call Execution",
      "location_claimed": "performOperations",
      "classification": "TARGET_MATCH",
      "reasoning": "\n        **Root Cause Match**: The finding correctly identifies the root cause as 'user-controlled target address and calldata in performOperations allowing arbitrary external calls'. The explanation explicitly mentions the lack of validation for target addresses and calldata, which matches the ground truth's key weaknesses (user-controlled target address, user-controlled calldata without validation, no whitelist of approved targets).\n\n        **Location Match**: The finding correctly identifies the vulnerable function as `performOperations`, which matches the ground truth.\n\n        **Type Match**: The type 'Arbitrary External Call Execution' is a semantic match to 'access_control' in the ground truth. Both describe the same underlying issue: unauthorized execution of arbitrary calls due to missing access control or validation.\n\n        **Quality Scoring**:\n        - **RCIR**: HIGH (0.9). The root cause is accurately and comprehensively described, matching the ground truth.\n        - **AVA**: HIGH (0.9). The attack scenario is concrete and aligns with the ground truth (crafting malicious operation data to execute `transferFrom` on victim tokens). The scenario is step-by-step and technically valid.\n        - **FSV**: HIGH (0.8). The suggested fix (access control + whitelist of allowed targets) aligns with the ground truth's recommended fixes (whitelist allowed target contract addresses, whitelist allowed function selectors).\n      "
    },
    {
      "finding_id": 1,
      "vulnerability_type_claimed": "Insufficient Input Validation",
      "location_claimed": "performOperations",
      "classification": "INFORMATIONAL",
      "reasoning": "\n        This finding is about insufficient input validation (e.g., checking for `address(0)` or empty calldata). While true, this is not the TARGET vulnerability (arbitrary external calls due to missing access control). The issue is informational because it doesn't lead to a critical exploit like the TARGET vulnerability. The attack scenario is plausible but not as severe or directly related to the $6.4M exploit described in the ground truth.\n      "
    },
    {
      "finding_id": 2,
      "vulnerability_type_claimed": "Missing Reentrancy Protection",
      "location_claimed": "performOperations",
      "classification": "MISCHARACTERIZED",
      "reasoning": "\n        The contract currently has no state changes between external calls, so reentrancy is not exploitable in its current form. The finding acknowledges this ('no state changes between calls that could be exploited'), but the suggested fix (reentrancy guard) is unnecessary for the current code. This is a mischaracterization because the vulnerability doesn't exist in the provided code. The risk is theoretical and tied to future modifications, not the current implementation.\n      "
    }
  ],
  "target_assessment": {
    "complete_found": true,
    "partial_found": false,
    "finding_id": 0,
    "root_cause_match": true,
    "location_match": true,
    "type_match": "semantic",
    "root_cause_identification": {
      "score": 0.9,
      "reasoning": "The root cause is accurately identified and matches the ground truth's specific issue: user-controlled target address and calldata in `performOperations` allowing arbitrary external calls. The explanation covers all key weaknesses (user-controlled target, user-controlled calldata, no whitelist)."
    },
    "attack_vector_validity": {
      "score": 0.9,
      "reasoning": "The attack scenario is concrete and aligns with the ground truth. It describes how an attacker can craft malicious operation data to execute `transferFrom` on victim tokens, which is the exact exploit used in the $6.4M attack. The scenario is technically valid and step-by-step."
    },
    "fix_suggestion_validity": {
      "score": 0.8,
      "reasoning": "The suggested fix (access control + whitelist of allowed targets) is valid and aligns with the ground truth's recommended fixes. It addresses the root cause by restricting who can call `performOperations` and which targets are allowed."
    }
  },
  "summary": {},
  "notes": "\n    Finding 0 is a clear TARGET_MATCH and demonstrates a strong understanding of the vulnerability. The other findings, while technically true or plausible, are not the TARGET vulnerability and are either informational or mischaracterized. The model's confidence of 0.95 is justified given the accuracy of Finding 0.\n  ",
  "judge_latency_ms": 17888.022899627686,
  "raw_response": "```json\n{\n  \"overall_verdict\": {\n    \"said_vulnerable\": true,\n    \"confidence_expressed\": 0.95\n  },\n  \"findings\": [\n    {\n      \"finding_id\": 0,\n      \"vulnerability_type_claimed\": \"Arbitrary External Call Execution\",\n      \"location_claimed\": \"performOperations\",\n      \"classification\": \"TARGET_MATCH\",\n      \"reasoning\": \"\n        **Root Cause Match**: The finding correctly identifies the root cause as 'user-controlled target address and calldata in performOperations allowing arbitrary external calls'. The explanation explicitly mentions the lack of validation for target addresses and calldata, which matches the ground truth's key weaknesses (user-controlled target address, user-controlled calldata without validation, no whitelist of approved targets).\n\n        **Location Match**: The finding correctly identifies the vulnerable function as `performOperations`, which matches the ground truth.\n\n        **Type Match**: The type 'Arbitrary External Call Execution' is a semantic match to 'access_control' in the ground truth. Both describe the same underlying issue: unauthorized execution of arbitrary calls due to missing access control or validation.\n\n        **Quality Scoring**:\n        - **RCIR**: HIGH (0.9). The root cause is accurately and comprehensively described, matching the ground truth.\n        - **AVA**: HIGH (0.9). The attack scenario is concrete and aligns with the ground truth (crafting malicious operation data to execute `transferFrom` on victim tokens). The scenario is step-by-step and technically valid.\n        - **FSV**: HIGH (0.8). The suggested fix (access control + whitelist of allowed targets) aligns with the ground truth's recommended fixes (whitelist allowed target contract addresses, whitelist allowed function selectors).\n      \"\n    },\n    {\n      \"finding_id\": 1,\n      \"vulnerability_type_claimed\": \"Insufficient Input Validation\",\n      \"location_claimed\": \"performOperations\",\n      \"classification\": \"INFORMATIONAL\",\n      \"reasoning\": \"\n        This finding is about insufficient input validation (e.g., checking for `address(0)` or empty calldata). While true, this is not the TARGET vulnerability (arbitrary external calls due to missing access control). The issue is informational because it doesn't lead to a critical exploit like the TARGET vulnerability. The attack scenario is plausible but not as severe or directly related to the $6.4M exploit described in the ground truth.\n      \"\n    },\n    {\n      \"finding_id\": 2,\n      \"vulnerability_type_claimed\": \"Missing Reentrancy Protection\",\n      \"location_claimed\": \"performOperations\",\n      \"classification\": \"MISCHARACTERIZED\",\n      \"reasoning\": \"\n        The contract currently has no state changes between external calls, so reentrancy is not exploitable in its current form. The finding acknowledges this ('no state changes between calls that could be exploited'), but the suggested fix (reentrancy guard) is unnecessary for the current code. This is a mischaracterization because the vulnerability doesn't exist in the provided code. The risk is theoretical and tied to future modifications, not the current implementation.\n      \"\n    }\n  ],\n  \"target_assessment\": {\n    \"complete_found\": true,\n    \"partial_found\": false,\n    \"finding_id\": 0,\n    \"root_cause_match\": true,\n    \"location_match\": true,\n    \"type_match\": \"semantic\",\n    \"root_cause_identification\": {\n      \"score\": 0.9,\n      \"reasoning\": \"The root cause is accurately identified and matches the ground truth's specific issue: user-controlled target address and calldata in `performOperations` allowing arbitrary external calls. The explanation covers all key weaknesses (user-controlled target, user-controlled calldata, no whitelist).\"\n    },\n    \"attack_vector_validity\": {\n      \"score\": 0.9,\n      \"reasoning\": \"The attack scenario is concrete and aligns with the ground truth. It describes how an attacker can craft malicious operation data to execute `transferFrom` on victim tokens, which is the exact exploit used in the $6.4M attack. The scenario is technically valid and step-by-step.\"\n    },\n    \"fix_suggestion_validity\": {\n      \"score\": 0.8,\n      \"reasoning\": \"The suggested fix (access control + whitelist of allowed targets) is valid and aligns with the ground truth's recommended fixes. It addresses the root cause by restricting who can call `performOperations` and which targets are allowed.\"\n    }\n  },\n  \"notes\": \"\n    Finding 0 is a clear TARGET_MATCH and demonstrates a strong understanding of the vulnerability. The other findings, while technically true or plausible, are not the TARGET vulnerability and are either informational or mischaracterized. The model's confidence of 0.95 is justified given the accuracy of Finding 0.\n  \"\n}\n```"
}