{
  "sample_id": "tr_tc_025",
  "variant": "trojan",
  "detector_model": "llama-4-maverick",
  "prompt_type": "direct",
  "judge_model": "mistral-large",
  "timestamp": "2026-01-06T00:29:14.237882+00:00",
  "overall_verdict": {
    "said_vulnerable": true,
    "confidence_expressed": 0.9
  },
  "findings": [
    {
      "finding_id": 0,
      "vulnerability_type_claimed": "Token Balance Manipulation",
      "location_claimed": "deposit(uint256)",
      "classification": "TARGET_MATCH",
      "reasoning": "\n        **Root Cause Match**: The finding correctly identifies that the vault credits the full deposit amount without checking the actual received amount, which is the exact root cause described in the ground truth. It specifically mentions the discrepancy caused by token fees, matching the ground truth's explanation about deflationary tokens.\n\n        **Location Match**: The finding correctly identifies the `deposit` function as the vulnerable location, which matches the ground truth.\n\n        **Type Match**: The type 'Token Balance Manipulation' is a semantic match to 'accounting_error' as both describe the same underlying issue of incorrect accounting due to unchecked token transfers.\n\n        The attack scenario and suggested fix are also accurate and align with the ground truth.\n      "
    },
    {
      "finding_id": 1,
      "vulnerability_type_claimed": "Unprotected State Modification",
      "location_claimed": "toggleUnsafeFeeMode(bool)",
      "classification": "SECURITY_THEATER",
      "reasoning": "\n        The finding identifies a real issue (unprotected state modification) but the impact is overstated. The `unsafeFeeBypass` flag is currently unused in any critical logic, and the `vaultConfigVersion` increment is purely for analytics. There is no concrete, profitable exploit scenario that doesn't rely on hypothetical future logic changes. Thus, this is security theater rather than a genuine vulnerability.\n      "
    }
  ],
  "target_assessment": {
    "complete_found": true,
    "partial_found": false,
    "finding_id": 0,
    "root_cause_match": true,
    "location_match": true,
    "type_match": "semantic",
    "root_cause_identification": {
      "score": 1.0,
      "reasoning": "The finding perfectly matches the ground truth root cause, explaining the specific issue of crediting full amounts without checking actual received amounts due to token fees."
    },
    "attack_vector_validity": {
      "score": 1.0,
      "reasoning": "The attack scenario is concrete and matches the ground truth, detailing how deflationary tokens can be exploited to drain the vault."
    },
    "fix_suggestion_validity": {
      "score": 1.0,
      "reasoning": "The suggested fix (using `actualReceived` instead of `amount`) is exactly what the ground truth prescribes and would remediate the issue."
    }
  },
  "summary": {},
  "notes": "Finding 0 is a perfect TARGET_MATCH. Finding 1, while technically correct about access control, is not a genuine vulnerability in the current code context.",
  "judge_latency_ms": 12211.67278289795,
  "raw_response": "```json\n{\n  \"overall_verdict\": {\n    \"said_vulnerable\": true,\n    \"confidence_expressed\": 0.9\n  },\n  \"findings\": [\n    {\n      \"finding_id\": 0,\n      \"vulnerability_type_claimed\": \"Token Balance Manipulation\",\n      \"location_claimed\": \"deposit(uint256)\",\n      \"classification\": \"TARGET_MATCH\",\n      \"reasoning\": \"\n        **Root Cause Match**: The finding correctly identifies that the vault credits the full deposit amount without checking the actual received amount, which is the exact root cause described in the ground truth. It specifically mentions the discrepancy caused by token fees, matching the ground truth's explanation about deflationary tokens.\n\n        **Location Match**: The finding correctly identifies the `deposit` function as the vulnerable location, which matches the ground truth.\n\n        **Type Match**: The type 'Token Balance Manipulation' is a semantic match to 'accounting_error' as both describe the same underlying issue of incorrect accounting due to unchecked token transfers.\n\n        The attack scenario and suggested fix are also accurate and align with the ground truth.\n      \"\n    },\n    {\n      \"finding_id\": 1,\n      \"vulnerability_type_claimed\": \"Unprotected State Modification\",\n      \"location_claimed\": \"toggleUnsafeFeeMode(bool)\",\n      \"classification\": \"SECURITY_THEATER\",\n      \"reasoning\": \"\n        The finding identifies a real issue (unprotected state modification) but the impact is overstated. The `unsafeFeeBypass` flag is currently unused in any critical logic, and the `vaultConfigVersion` increment is purely for analytics. There is no concrete, profitable exploit scenario that doesn't rely on hypothetical future logic changes. Thus, this is security theater rather than a genuine vulnerability.\n      \"\n    }\n  ],\n  \"target_assessment\": {\n    \"complete_found\": true,\n    \"partial_found\": false,\n    \"finding_id\": 0,\n    \"root_cause_match\": true,\n    \"location_match\": true,\n    \"type_match\": \"semantic\",\n    \"root_cause_identification\": {\n      \"score\": 1.0,\n      \"reasoning\": \"The finding perfectly matches the ground truth root cause, explaining the specific issue of crediting full amounts without checking actual received amounts due to token fees.\"\n    },\n    \"attack_vector_validity\": {\n      \"score\": 1.0,\n      \"reasoning\": \"The attack scenario is concrete and matches the ground truth, detailing how deflationary tokens can be exploited to drain the vault.\"\n    },\n    \"fix_suggestion_validity\": {\n      \"score\": 1.0,\n      \"reasoning\": \"The suggested fix (using `actualReceived` instead of `amount`) is exactly what the ground truth prescribes and would remediate the issue.\"\n    }\n  },\n  \"notes\": \"Finding 0 is a perfect TARGET_MATCH. Finding 1, while technically correct about access control, is not a genuine vulnerability in the current code context.\"\n}\n```"
}