{
  "sample_id": "ms_tc_025",
  "variant": "minimalsanitized",
  "detector_model": "claude-opus-4-5",
  "prompt_type": "direct",
  "judge_model": "mistral-large",
  "timestamp": "2026-01-05T23:46:34.008568+00:00",
  "overall_verdict": {
    "said_vulnerable": true,
    "confidence_expressed": 0.95
  },
  "findings": [
    {
      "finding_id": 0,
      "vulnerability_type_claimed": "Fee-on-Transfer Token Accounting Mismatch",
      "location_claimed": "Vault.deposit()",
      "classification": "TARGET_MATCH",
      "reasoning": "\n        **Root Cause Match**: The finding correctly identifies that the Vault contract credits depositors with the full `amount` without verifying the actual tokens received, specifically due to the deflationary nature of the token (10% fee on transfer). This matches the ground truth root cause exactly: 'Vault assumed tokens received equal amount transferred. Didn't check actual balance increase before/after transfer. Deflationary tokens with transfer fees caused accounting mismatch between credited amounts and actual holdings.'\n\n        **Location Match**: The finding correctly identifies the vulnerable function as `Vault.deposit()`, which matches the ground truth.\n\n        **Type Match**: The type 'Fee-on-Transfer Token Accounting Mismatch' is a semantic match to the ground truth type 'accounting_error'. Both describe the same underlying issue of accounting mismatch due to transfer fees.\n\n        **Quality**: The root cause identification, attack vector, and fix suggestion are all highly accurate and align with the ground truth.\n      "
    },
    {
      "finding_id": 1,
      "vulnerability_type_claimed": "Missing Allowance Check in transferFrom",
      "location_claimed": "DeflatToken.transferFrom()",
      "classification": "BONUS_VALID",
      "reasoning": "\n        **Bonus Valid**: This finding identifies a real vulnerability not covered in the ground truth. The `DeflatToken.transferFrom()` function lacks an allowance mechanism, allowing anyone to transfer tokens from any address without authorization. The attack scenario is concrete and profitable, and the fix suggestion is valid. This is a genuine security issue with clear impact (loss of funds).\n      "
    }
  ],
  "target_assessment": {
    "complete_found": true,
    "partial_found": false,
    "finding_id": 0,
    "root_cause_match": true,
    "location_match": true,
    "type_match": "semantic",
    "root_cause_identification": {
      "score": 1.0,
      "reasoning": "The finding's root cause explanation is technically accurate and semantically matches the ground truth. It correctly identifies the specific issue of accounting mismatch due to unchecked transfer fees."
    },
    "attack_vector_validity": {
      "score": 1.0,
      "reasoning": "The attack scenario is concrete, step-by-step, and accurately describes how the vulnerability can be exploited to drain funds. It aligns with the ground truth attack scenario."
    },
    "fix_suggestion_validity": {
      "score": 1.0,
      "reasoning": "The suggested fix is technically correct and matches the ground truth fix. It addresses the root cause by measuring the actual tokens received before and after the transfer."
    }
  },
  "summary": {},
  "notes": "Finding 0 is a clear TARGET_MATCH, and Finding 1 is a valid bonus finding that highlights an additional critical vulnerability in the code.",
  "judge_latency_ms": 12194.953918457031,
  "raw_response": "```json\n{\n  \"overall_verdict\": {\n    \"said_vulnerable\": true,\n    \"confidence_expressed\": 0.95\n  },\n  \"findings\": [\n    {\n      \"finding_id\": 0,\n      \"vulnerability_type_claimed\": \"Fee-on-Transfer Token Accounting Mismatch\",\n      \"location_claimed\": \"Vault.deposit()\",\n      \"classification\": \"TARGET_MATCH\",\n      \"reasoning\": \"\n        **Root Cause Match**: The finding correctly identifies that the Vault contract credits depositors with the full `amount` without verifying the actual tokens received, specifically due to the deflationary nature of the token (10% fee on transfer). This matches the ground truth root cause exactly: 'Vault assumed tokens received equal amount transferred. Didn't check actual balance increase before/after transfer. Deflationary tokens with transfer fees caused accounting mismatch between credited amounts and actual holdings.'\n\n        **Location Match**: The finding correctly identifies the vulnerable function as `Vault.deposit()`, which matches the ground truth.\n\n        **Type Match**: The type 'Fee-on-Transfer Token Accounting Mismatch' is a semantic match to the ground truth type 'accounting_error'. Both describe the same underlying issue of accounting mismatch due to transfer fees.\n\n        **Quality**: The root cause identification, attack vector, and fix suggestion are all highly accurate and align with the ground truth.\n      \"\n    },\n    {\n      \"finding_id\": 1,\n      \"vulnerability_type_claimed\": \"Missing Allowance Check in transferFrom\",\n      \"location_claimed\": \"DeflatToken.transferFrom()\",\n      \"classification\": \"BONUS_VALID\",\n      \"reasoning\": \"\n        **Bonus Valid**: This finding identifies a real vulnerability not covered in the ground truth. The `DeflatToken.transferFrom()` function lacks an allowance mechanism, allowing anyone to transfer tokens from any address without authorization. The attack scenario is concrete and profitable, and the fix suggestion is valid. This is a genuine security issue with clear impact (loss of funds).\n      \"\n    }\n  ],\n  \"target_assessment\": {\n    \"complete_found\": true,\n    \"partial_found\": false,\n    \"finding_id\": 0,\n    \"root_cause_match\": true,\n    \"location_match\": true,\n    \"type_match\": \"semantic\",\n    \"root_cause_identification\": {\n      \"score\": 1.0,\n      \"reasoning\": \"The finding's root cause explanation is technically accurate and semantically matches the ground truth. It correctly identifies the specific issue of accounting mismatch due to unchecked transfer fees.\"\n    },\n    \"attack_vector_validity\": {\n      \"score\": 1.0,\n      \"reasoning\": \"The attack scenario is concrete, step-by-step, and accurately describes how the vulnerability can be exploited to drain funds. It aligns with the ground truth attack scenario.\"\n    },\n    \"fix_suggestion_validity\": {\n      \"score\": 1.0,\n      \"reasoning\": \"The suggested fix is technically correct and matches the ground truth fix. It addresses the root cause by measuring the actual tokens received before and after the transfer.\"\n    }\n  },\n  \"notes\": \"Finding 0 is a clear TARGET_MATCH, and Finding 1 is a valid bonus finding that highlights an additional critical vulnerability in the code.\"\n}\n```"
}