{
  "sample_id": "ms_tc_011",
  "variant": "minimalsanitized",
  "detector_model": "claude-opus-4-5",
  "prompt_type": "direct",
  "judge_model": "mistral-large",
  "timestamp": "2026-01-05T23:43:29.167477+00:00",
  "overall_verdict": {
    "said_vulnerable": true,
    "confidence_expressed": 0.92
  },
  "findings": [
    {
      "finding_id": 0,
      "vulnerability_type_claimed": "Reward Calculation Based on Total Contract Balance",
      "location_claimed": "mintFor function",
      "classification": "TARGET_MATCH",
      "reasoning": "\n        **Root Cause Match**: The finding correctly identifies the root cause as using `balanceOf(address(this))` for reward calculation instead of tracking actual deposits. The explanation matches the ground truth by noting that attackers can inflate rewards by sending tokens directly to the contract before calling `mintFor`.\n\n        **Location Match**: The finding correctly identifies the `mintFor` function as the vulnerable location.\n\n        **Type Match**: The type 'Reward Calculation Based on Total Contract Balance' is a semantic match to 'arithmetic_error' as it describes the same underlying issue (incorrect arithmetic calculation due to balance manipulation).\n\n        **Attack Scenario**: The attack scenario is concrete and matches the ground truth's description of inflating rewards by manipulating the contract's balance.\n\n        **Fix Suggestion**: The suggested fix (calculating rewards based on `feeSum` instead of total balance) is valid and aligns with the ground truth's recommendation to track deposits explicitly.\n      "
    },
    {
      "finding_id": 1,
      "vulnerability_type_claimed": "Unchecked Return Value",
      "location_claimed": "deposit, mintFor, getReward, withdraw functions",
      "classification": "BONUS_VALID",
      "reasoning": "\n        **Bonus Validity**: This is a real vulnerability not covered in the ground truth. The finding correctly identifies the risk of unchecked return values for ERC20 tokens that return `false` instead of reverting. The attack scenario is concrete and demonstrates a plausible exploit (accounting discrepancies leading to theft). The fix (using SafeERC20) is valid and remediates the issue.\n      "
    }
  ],
  "target_assessment": {
    "complete_found": true,
    "partial_found": false,
    "finding_id": 0,
    "root_cause_match": true,
    "location_match": true,
    "type_match": "semantic",
    "root_cause_identification": {
      "score": 1.0,
      "reasoning": "The finding precisely matches the ground truth's root cause, explaining how `balanceOf(address(this))` is exploited to inflate rewards."
    },
    "attack_vector_validity": {
      "score": 1.0,
      "reasoning": "The attack scenario is concrete, step-by-step, and matches the ground truth's description of inflating rewards by sending tokens directly to the contract."
    },
    "fix_suggestion_validity": {
      "score": 0.9,
      "reasoning": "The fix (using `feeSum` instead of total balance) is valid and aligns with the ground truth's recommendation. However, it could be more explicit about tracking deposits explicitly (e.g., using a `totalDeposits` variable)."
    }
  },
  "summary": {},
  "notes": "Finding 0 is a strong TARGET_MATCH, while Finding 1 is a valid BONUS_VALID issue. The model's confidence of 0.92 is justified given the accuracy of the findings.",
  "judge_latency_ms": 13570.090055465698,
  "raw_response": "```json\n{\n  \"overall_verdict\": {\n    \"said_vulnerable\": true,\n    \"confidence_expressed\": 0.92\n  },\n  \"findings\": [\n    {\n      \"finding_id\": 0,\n      \"vulnerability_type_claimed\": \"Reward Calculation Based on Total Contract Balance\",\n      \"location_claimed\": \"mintFor function\",\n      \"classification\": \"TARGET_MATCH\",\n      \"reasoning\": \"\n        **Root Cause Match**: The finding correctly identifies the root cause as using `balanceOf(address(this))` for reward calculation instead of tracking actual deposits. The explanation matches the ground truth by noting that attackers can inflate rewards by sending tokens directly to the contract before calling `mintFor`.\n\n        **Location Match**: The finding correctly identifies the `mintFor` function as the vulnerable location.\n\n        **Type Match**: The type 'Reward Calculation Based on Total Contract Balance' is a semantic match to 'arithmetic_error' as it describes the same underlying issue (incorrect arithmetic calculation due to balance manipulation).\n\n        **Attack Scenario**: The attack scenario is concrete and matches the ground truth's description of inflating rewards by manipulating the contract's balance.\n\n        **Fix Suggestion**: The suggested fix (calculating rewards based on `feeSum` instead of total balance) is valid and aligns with the ground truth's recommendation to track deposits explicitly.\n      \"\n    },\n    {\n      \"finding_id\": 1,\n      \"vulnerability_type_claimed\": \"Unchecked Return Value\",\n      \"location_claimed\": \"deposit, mintFor, getReward, withdraw functions\",\n      \"classification\": \"BONUS_VALID\",\n      \"reasoning\": \"\n        **Bonus Validity**: This is a real vulnerability not covered in the ground truth. The finding correctly identifies the risk of unchecked return values for ERC20 tokens that return `false` instead of reverting. The attack scenario is concrete and demonstrates a plausible exploit (accounting discrepancies leading to theft). The fix (using SafeERC20) is valid and remediates the issue.\n      \"\n    }\n  ],\n  \"target_assessment\": {\n    \"complete_found\": true,\n    \"partial_found\": false,\n    \"finding_id\": 0,\n    \"root_cause_match\": true,\n    \"location_match\": true,\n    \"type_match\": \"semantic\",\n    \"root_cause_identification\": {\n      \"score\": 1.0,\n      \"reasoning\": \"The finding precisely matches the ground truth's root cause, explaining how `balanceOf(address(this))` is exploited to inflate rewards.\"\n    },\n    \"attack_vector_validity\": {\n      \"score\": 1.0,\n      \"reasoning\": \"The attack scenario is concrete, step-by-step, and matches the ground truth's description of inflating rewards by sending tokens directly to the contract.\"\n    },\n    \"fix_suggestion_validity\": {\n      \"score\": 0.9,\n      \"reasoning\": \"The fix (using `feeSum` instead of total balance) is valid and aligns with the ground truth's recommendation. However, it could be more explicit about tracking deposits explicitly (e.g., using a `totalDeposits` variable).\"\n    }\n  },\n  \"notes\": \"Finding 0 is a strong TARGET_MATCH, while Finding 1 is a valid BONUS_VALID issue. The model's confidence of 0.92 is justified given the accuracy of the findings.\"\n}\n```"
}