{
  "sample_id": "ms_tc_045",
  "variant": "minimalsanitized",
  "detector_model": "claude-opus-4-5",
  "prompt_type": "direct",
  "judge_model": "mistral-large",
  "timestamp": "2026-01-05T23:50:45.918471+00:00",
  "overall_verdict": {
    "said_vulnerable": true,
    "confidence_expressed": 0.92
  },
  "findings": [
    {
      "finding_id": 0,
      "vulnerability_type_claimed": "Arbitrary Market Injection / Access Control Bypass",
      "location_claimed": "ExactlyMarket.borrow()",
      "classification": "TARGET_MATCH",
      "reasoning": "\n        **Root Cause Match**: The finding correctly identifies that the DebtPreviewer trusts user-provided market addresses without validation, allowing fake market data injection. This matches the ground truth root cause exactly, including the key weaknesses (user-provided market addresses unvalidated, trusts data from arbitrary contracts, no market whitelist or registry).\n\n        **Location Match**: The finding correctly identifies the `borrow` function as part of the vulnerable flow. While it doesn't explicitly mention `previewDebt` and `previewMultipleMarkets`, the `borrow` function is one of the ground truth functions, and the root cause is correctly tied to the previewer's behavior. The attack scenario also involves the previewer, so the location is effectively correct.\n\n        **Type Match**: The type 'Arbitrary Market Injection / Access Control Bypass' is a semantic match to 'oracle_manipulation'. Both describe the same underlying issue: manipulation of trusted data sources (oracles/markets) to bypass access controls.\n\n        **Attack Scenario**: The attack scenario is concrete and matches the ground truth, including the step-by-step exploit flow and the impact (over-borrowing against fake collateral).\n\n        **Fix Suggestion**: The suggested fix (whitelist of authorized market addresses) is valid and aligns with the ground truth fix.\n      "
    },
    {
      "finding_id": 1,
      "vulnerability_type_claimed": "Unchecked Return Value",
      "location_claimed": "ExactlyMarket.deposit() and ExactlyMarket.borrow()",
      "classification": "BONUS_VALID",
      "reasoning": "\n        **Bonus Validity**: This is a real vulnerability not mentioned in the ground truth. The issue exists in the code (unchecked return values for ERC20 transfers), and the attack scenario is concrete (silent failures in tokens like USDT leading to accounting mismatches). The impact is genuine (loss of funds or incorrect state), and the fix (using SafeERC20) is valid. This is not a hallucination, mischaracterization, or security theater.\n      "
    }
  ],
  "target_assessment": {
    "complete_found": true,
    "partial_found": false,
    "finding_id": 0,
    "root_cause_match": true,
    "location_match": true,
    "type_match": "semantic",
    "root_cause_identification": {
      "score": 1.0,
      "reasoning": "The finding's root cause explanation is technically accurate and semantically matches the ground truth, including all key weaknesses (unvalidated user-provided market addresses, trust in arbitrary contracts, lack of whitelist)."
    },
    "attack_vector_validity": {
      "score": 1.0,
      "reasoning": "The attack scenario is concrete, step-by-step, and matches the ground truth. It demonstrates a realistic exploit with significant impact (over-borrowing against fake collateral)."
    },
    "fix_suggestion_validity": {
      "score": 1.0,
      "reasoning": "The suggested fix (whitelist of authorized market addresses) is valid and aligns with the ground truth fix. It directly addresses the root cause by preventing untrusted market data injection."
    }
  },
  "summary": {},
  "notes": "\n    - Finding 0 is classified as TARGET_MATCH because it meets all criteria: correct root cause, correct location (even if not all ground truth functions are explicitly mentioned, the core issue is correctly tied to the previewer and borrow function), and semantic type match.\n    - Finding 1 is a valid bonus finding, as it identifies a real, exploitable issue not covered by the ground truth.\n    - The location match for Finding 0 is considered correct because the `borrow` function is part of the ground truth, and the root cause is correctly tied to the previewer's behavior. The omission of `previewDebt` and `previewMultipleMarkets` is minor since the attack flow is fully described.\n  ",
  "judge_latency_ms": 18212.56923675537,
  "raw_response": "```json\n{\n  \"overall_verdict\": {\n    \"said_vulnerable\": true,\n    \"confidence_expressed\": 0.92\n  },\n  \"findings\": [\n    {\n      \"finding_id\": 0,\n      \"vulnerability_type_claimed\": \"Arbitrary Market Injection / Access Control Bypass\",\n      \"location_claimed\": \"ExactlyMarket.borrow()\",\n      \"classification\": \"TARGET_MATCH\",\n      \"reasoning\": \"\n        **Root Cause Match**: The finding correctly identifies that the DebtPreviewer trusts user-provided market addresses without validation, allowing fake market data injection. This matches the ground truth root cause exactly, including the key weaknesses (user-provided market addresses unvalidated, trusts data from arbitrary contracts, no market whitelist or registry).\n\n        **Location Match**: The finding correctly identifies the `borrow` function as part of the vulnerable flow. While it doesn't explicitly mention `previewDebt` and `previewMultipleMarkets`, the `borrow` function is one of the ground truth functions, and the root cause is correctly tied to the previewer's behavior. The attack scenario also involves the previewer, so the location is effectively correct.\n\n        **Type Match**: The type 'Arbitrary Market Injection / Access Control Bypass' is a semantic match to 'oracle_manipulation'. Both describe the same underlying issue: manipulation of trusted data sources (oracles/markets) to bypass access controls.\n\n        **Attack Scenario**: The attack scenario is concrete and matches the ground truth, including the step-by-step exploit flow and the impact (over-borrowing against fake collateral).\n\n        **Fix Suggestion**: The suggested fix (whitelist of authorized market addresses) is valid and aligns with the ground truth fix.\n      \"\n    },\n    {\n      \"finding_id\": 1,\n      \"vulnerability_type_claimed\": \"Unchecked Return Value\",\n      \"location_claimed\": \"ExactlyMarket.deposit() and ExactlyMarket.borrow()\",\n      \"classification\": \"BONUS_VALID\",\n      \"reasoning\": \"\n        **Bonus Validity**: This is a real vulnerability not mentioned in the ground truth. The issue exists in the code (unchecked return values for ERC20 transfers), and the attack scenario is concrete (silent failures in tokens like USDT leading to accounting mismatches). The impact is genuine (loss of funds or incorrect state), and the fix (using SafeERC20) is valid. This is not a hallucination, mischaracterization, or security theater.\n      \"\n    }\n  ],\n  \"target_assessment\": {\n    \"complete_found\": true,\n    \"partial_found\": false,\n    \"finding_id\": 0,\n    \"root_cause_match\": true,\n    \"location_match\": true,\n    \"type_match\": \"semantic\",\n    \"root_cause_identification\": {\n      \"score\": 1.0,\n      \"reasoning\": \"The finding's root cause explanation is technically accurate and semantically matches the ground truth, including all key weaknesses (unvalidated user-provided market addresses, trust in arbitrary contracts, lack of whitelist).\"\n    },\n    \"attack_vector_validity\": {\n      \"score\": 1.0,\n      \"reasoning\": \"The attack scenario is concrete, step-by-step, and matches the ground truth. It demonstrates a realistic exploit with significant impact (over-borrowing against fake collateral).\"\n    },\n    \"fix_suggestion_validity\": {\n      \"score\": 1.0,\n      \"reasoning\": \"The suggested fix (whitelist of authorized market addresses) is valid and aligns with the ground truth fix. It directly addresses the root cause by preventing untrusted market data injection.\"\n    }\n  },\n  \"notes\": \"\n    - Finding 0 is classified as TARGET_MATCH because it meets all criteria: correct root cause, correct location (even if not all ground truth functions are explicitly mentioned, the core issue is correctly tied to the previewer and borrow function), and semantic type match.\n    - Finding 1 is a valid bonus finding, as it identifies a real, exploitable issue not covered by the ground truth.\n    - The location match for Finding 0 is considered correct because the `borrow` function is part of the ground truth, and the root cause is correctly tied to the previewer's behavior. The omission of `previewDebt` and `previewMultipleMarkets` is minor since the attack flow is fully described.\n  \"\n}\n```"
}