{
  "sample_id": "ms_tc_040",
  "variant": "minimalsanitized",
  "detector_model": "claude-opus-4-5",
  "prompt_type": "direct",
  "judge_model": "mistral-large",
  "timestamp": "2026-01-05T23:49:43.280599+00:00",
  "overall_verdict": {
    "said_vulnerable": true,
    "confidence_expressed": 0.95
  },
  "findings": [
    {
      "finding_id": 0,
      "vulnerability_type_claimed": "Arbitrary External Call",
      "location_claimed": "performOperations function",
      "classification": "TARGET_MATCH",
      "reasoning": "\n        **Root Cause Match**: The finding correctly identifies the root cause as 'User-controlled target address and calldata in performOperations allowing arbitrary external calls'. The explanation explicitly mentions the lack of validation for the target address and calldata, which matches the ground truth's key weaknesses (user-controlled target address, user-controlled calldata without validation, no whitelist of approved targets).\n\n        **Location Match**: The finding correctly identifies the vulnerable function as `performOperations`, which matches the ground truth.\n\n        **Type Match**: The type 'Arbitrary External Call' is a semantic match to 'access_control' in the context of this vulnerability. While the terminology differs, both describe the same underlying issue: the ability to make unauthorized external calls due to missing access control and validation.\n\n        **Quality**: The root cause identification is precise and matches the ground truth. The attack scenario is concrete and aligns with the ground truth's attack flow, though it focuses on direct token transfers rather than `transferFrom` (which is still valid given the arbitrary call capability). The suggested fix (whitelisting targets and adding access control) is valid and aligns with the ground truth's remediation.\n      "
    },
    {
      "finding_id": 1,
      "vulnerability_type_claimed": "Unused Access Control",
      "location_claimed": "vaultOwners mapping and performOperations",
      "classification": "INFORMATIONAL",
      "reasoning": "\n        This finding highlights an unused access control mechanism (`vaultOwners` mapping) but does not identify the TARGET vulnerability (arbitrary external calls). While the observation is true, it is not security-relevant on its own and does not describe the critical issue. The attack scenario is more about the design flaw enabling the arbitrary call vulnerability rather than a standalone vulnerability. Thus, it is classified as INFORMATIONAL.\n      "
    }
  ],
  "target_assessment": {
    "complete_found": true,
    "partial_found": false,
    "finding_id": 0,
    "root_cause_match": true,
    "location_match": true,
    "type_match": "semantic",
    "root_cause_identification": {
      "score": 1.0,
      "reasoning": "\n        The finding's root cause explanation is technically accurate and semantically matches the ground truth. It explicitly calls out the lack of validation for the target address and calldata, which are the core issues enabling the arbitrary external calls.\n      "
    },
    "attack_vector_validity": {
      "score": 0.9,
      "reasoning": "\n        The attack scenario is concrete and valid, though it focuses on direct token transfers (`transfer`) rather than `transferFrom` (which is more aligned with the ground truth's attack flow). However, the arbitrary call capability described in the finding would still allow `transferFrom` calls if the attacker crafts the calldata appropriately. The scenario is slightly less precise than the ground truth but still valid.\n      "
    },
    "fix_suggestion_validity": {
      "score": 0.9,
      "reasoning": "\n        The suggested fix (adding access control and whitelisting targets) is valid and aligns with the ground truth's remediation. However, it does not explicitly mention whitelisting function selectors, which is part of the ground truth's fix. This omission slightly reduces the score.\n      "
    }
  },
  "summary": {},
  "notes": "\n    Finding 0 is a strong TARGET_MATCH, as it correctly identifies the root cause, location, and vulnerability type (semantic match). The attack scenario and fix are valid, though the attack scenario could be more precise by explicitly mentioning `transferFrom`. Finding 1 is informational and does not contribute to the TARGET_MATCH.\n  ",
  "judge_latency_ms": 17448.577165603638,
  "raw_response": "```json\n{\n  \"overall_verdict\": {\n    \"said_vulnerable\": true,\n    \"confidence_expressed\": 0.95\n  },\n  \"findings\": [\n    {\n      \"finding_id\": 0,\n      \"vulnerability_type_claimed\": \"Arbitrary External Call\",\n      \"location_claimed\": \"performOperations function\",\n      \"classification\": \"TARGET_MATCH\",\n      \"reasoning\": \"\n        **Root Cause Match**: The finding correctly identifies the root cause as 'User-controlled target address and calldata in performOperations allowing arbitrary external calls'. The explanation explicitly mentions the lack of validation for the target address and calldata, which matches the ground truth's key weaknesses (user-controlled target address, user-controlled calldata without validation, no whitelist of approved targets).\n\n        **Location Match**: The finding correctly identifies the vulnerable function as `performOperations`, which matches the ground truth.\n\n        **Type Match**: The type 'Arbitrary External Call' is a semantic match to 'access_control' in the context of this vulnerability. While the terminology differs, both describe the same underlying issue: the ability to make unauthorized external calls due to missing access control and validation.\n\n        **Quality**: The root cause identification is precise and matches the ground truth. The attack scenario is concrete and aligns with the ground truth's attack flow, though it focuses on direct token transfers rather than `transferFrom` (which is still valid given the arbitrary call capability). The suggested fix (whitelisting targets and adding access control) is valid and aligns with the ground truth's remediation.\n      \"\n    },\n    {\n      \"finding_id\": 1,\n      \"vulnerability_type_claimed\": \"Unused Access Control\",\n      \"location_claimed\": \"vaultOwners mapping and performOperations\",\n      \"classification\": \"INFORMATIONAL\",\n      \"reasoning\": \"\n        This finding highlights an unused access control mechanism (`vaultOwners` mapping) but does not identify the TARGET vulnerability (arbitrary external calls). While the observation is true, it is not security-relevant on its own and does not describe the critical issue. The attack scenario is more about the design flaw enabling the arbitrary call vulnerability rather than a standalone vulnerability. Thus, it is classified as INFORMATIONAL.\n      \"\n    }\n  ],\n  \"target_assessment\": {\n    \"complete_found\": true,\n    \"partial_found\": false,\n    \"finding_id\": 0,\n    \"root_cause_match\": true,\n    \"location_match\": true,\n    \"type_match\": \"semantic\",\n    \"root_cause_identification\": {\n      \"score\": 1.0,\n      \"reasoning\": \"\n        The finding's root cause explanation is technically accurate and semantically matches the ground truth. It explicitly calls out the lack of validation for the target address and calldata, which are the core issues enabling the arbitrary external calls.\n      \"\n    },\n    \"attack_vector_validity\": {\n      \"score\": 0.9,\n      \"reasoning\": \"\n        The attack scenario is concrete and valid, though it focuses on direct token transfers (`transfer`) rather than `transferFrom` (which is more aligned with the ground truth's attack flow). However, the arbitrary call capability described in the finding would still allow `transferFrom` calls if the attacker crafts the calldata appropriately. The scenario is slightly less precise than the ground truth but still valid.\n      \"\n    },\n    \"fix_suggestion_validity\": {\n      \"score\": 0.9,\n      \"reasoning\": \"\n        The suggested fix (adding access control and whitelisting targets) is valid and aligns with the ground truth's remediation. However, it does not explicitly mention whitelisting function selectors, which is part of the ground truth's fix. This omission slightly reduces the score.\n      \"\n    }\n  },\n  \"notes\": \"\n    Finding 0 is a strong TARGET_MATCH, as it correctly identifies the root cause, location, and vulnerability type (semantic match). The attack scenario and fix are valid, though the attack scenario could be more precise by explicitly mentioning `transferFrom`. Finding 1 is informational and does not contribute to the TARGET_MATCH.\n  \"\n}\n```"
}