{
  "sample_id": "ms_tc_021",
  "variant": "minimalsanitized",
  "detector_model": "claude-opus-4-5",
  "prompt_type": "direct",
  "judge_model": "mistral-large",
  "timestamp": "2026-01-05T23:45:44.858892+00:00",
  "overall_verdict": {
    "said_vulnerable": true,
    "confidence_expressed": 0.92
  },
  "findings": [
    {
      "finding_id": 0,
      "vulnerability_type_claimed": "Oracle Manipulation / Read-Only Reentrancy",
      "location_claimed": "SimplifiedOracle.getPrice() and InverseLending.getCollateralValue()",
      "classification": "PARTIAL_MATCH",
      "reasoning": "\n        **Root Cause Match**: PARTIAL. The finding correctly identifies that the oracle relies on Curve's `get_virtual_price()` and that this can be manipulated via flash loans/liquidity addition. However, it incorrectly frames the issue as 'read-only reentrancy' (a different vulnerability type) rather than focusing solely on the oracle manipulation via liquidity inflation. The root cause is mostly correct but conflated with an unrelated issue (reentrancy).\n        **Location Match**: CORRECT. The finding correctly identifies the vulnerable functions (`getPrice()` and `getCollateralValue()`), which are directly involved in the `borrow` function's oracle price retrieval.\n        **Type Match**: PARTIAL. The type 'Oracle Manipulation' is semantically correct, but the addition of 'Read-Only Reentrancy' is incorrect and distracts from the core issue. The ground truth specifies 'price_oracle_manipulation', which is a semantic match for the 'Oracle Manipulation' part.\n        **Conclusion**: The finding meets the prerequisite (root cause and location mostly correct) but mislabels the type, qualifying as PARTIAL_MATCH.\n      "
    },
    {
      "finding_id": 1,
      "vulnerability_type_claimed": "Unchecked Return Value",
      "location_claimed": "deposit() and borrow()",
      "classification": "BONUS_VALID",
      "reasoning": "\n        **Bonus Validity**: This is a real, distinct vulnerability not covered in the ground truth. The finding correctly identifies that `transferFrom` and `transfer` return values are unchecked, which could lead to silent failures for non-reverting ERC20 tokens. The attack scenario is concrete and plausible, and the suggested fix (SafeERC20) is valid.\n      "
    }
  ],
  "target_assessment": {
    "complete_found": false,
    "partial_found": true,
    "finding_id": 0,
    "root_cause_match": false,
    "location_match": true,
    "type_match": "partial",
    "root_cause_identification": {
      "score": 0.7,
      "reasoning": "\n        The finding correctly identifies the core issue (oracle reliance on `get_virtual_price()` and susceptibility to manipulation) but incorrectly conflates it with read-only reentrancy. The root cause is mostly accurate but imprecise due to the conflation.\n      "
    },
    "attack_vector_validity": {
      "score": 0.8,
      "reasoning": "\n        The attack scenario is plausible and aligns with the ground truth's description of flash loan-based manipulation. However, the inclusion of reentrancy is unnecessary and slightly detracts from the clarity of the exploit steps.\n      "
    },
    "fix_suggestion_validity": {
      "score": 0.9,
      "reasoning": "\n        The suggested fixes (TWAP, price deviation checks, Chainlink oracles) are valid and align with the ground truth's recommendations. The addition of reentrancy guards is irrelevant but not harmful.\n      "
    }
  },
  "summary": {},
  "notes": "\n    - Finding 0 is close to a TARGET_MATCH but fails due to the conflation with read-only reentrancy. The core oracle manipulation issue is correctly identified, but the type and root cause are partially incorrect.\n    - Finding 1 is a valid bonus finding, as it identifies a real, distinct vulnerability not covered in the ground truth.\n    - The ground truth's root cause focuses solely on flash loan-based liquidity inflation, while the finding introduces an unnecessary reentrancy angle. This prevents a TARGET_MATCH classification.\n  ",
  "judge_latency_ms": 17547.44863510132,
  "raw_response": "```json\n{\n  \"overall_verdict\": {\n    \"said_vulnerable\": true,\n    \"confidence_expressed\": 0.92\n  },\n  \"findings\": [\n    {\n      \"finding_id\": 0,\n      \"vulnerability_type_claimed\": \"Oracle Manipulation / Read-Only Reentrancy\",\n      \"location_claimed\": \"SimplifiedOracle.getPrice() and InverseLending.getCollateralValue()\",\n      \"classification\": \"PARTIAL_MATCH\",\n      \"reasoning\": \"\n        **Root Cause Match**: PARTIAL. The finding correctly identifies that the oracle relies on Curve's `get_virtual_price()` and that this can be manipulated via flash loans/liquidity addition. However, it incorrectly frames the issue as 'read-only reentrancy' (a different vulnerability type) rather than focusing solely on the oracle manipulation via liquidity inflation. The root cause is mostly correct but conflated with an unrelated issue (reentrancy).\n        **Location Match**: CORRECT. The finding correctly identifies the vulnerable functions (`getPrice()` and `getCollateralValue()`), which are directly involved in the `borrow` function's oracle price retrieval.\n        **Type Match**: PARTIAL. The type 'Oracle Manipulation' is semantically correct, but the addition of 'Read-Only Reentrancy' is incorrect and distracts from the core issue. The ground truth specifies 'price_oracle_manipulation', which is a semantic match for the 'Oracle Manipulation' part.\n        **Conclusion**: The finding meets the prerequisite (root cause and location mostly correct) but mislabels the type, qualifying as PARTIAL_MATCH.\n      \"\n    },\n    {\n      \"finding_id\": 1,\n      \"vulnerability_type_claimed\": \"Unchecked Return Value\",\n      \"location_claimed\": \"deposit() and borrow()\",\n      \"classification\": \"BONUS_VALID\",\n      \"reasoning\": \"\n        **Bonus Validity**: This is a real, distinct vulnerability not covered in the ground truth. The finding correctly identifies that `transferFrom` and `transfer` return values are unchecked, which could lead to silent failures for non-reverting ERC20 tokens. The attack scenario is concrete and plausible, and the suggested fix (SafeERC20) is valid.\n      \"\n    }\n  ],\n  \"target_assessment\": {\n    \"complete_found\": false,\n    \"partial_found\": true,\n    \"finding_id\": 0,\n    \"root_cause_match\": false,\n    \"location_match\": true,\n    \"type_match\": \"partial\",\n    \"root_cause_identification\": {\n      \"score\": 0.7,\n      \"reasoning\": \"\n        The finding correctly identifies the core issue (oracle reliance on `get_virtual_price()` and susceptibility to manipulation) but incorrectly conflates it with read-only reentrancy. The root cause is mostly accurate but imprecise due to the conflation.\n      \"\n    },\n    \"attack_vector_validity\": {\n      \"score\": 0.8,\n      \"reasoning\": \"\n        The attack scenario is plausible and aligns with the ground truth's description of flash loan-based manipulation. However, the inclusion of reentrancy is unnecessary and slightly detracts from the clarity of the exploit steps.\n      \"\n    },\n    \"fix_suggestion_validity\": {\n      \"score\": 0.9,\n      \"reasoning\": \"\n        The suggested fixes (TWAP, price deviation checks, Chainlink oracles) are valid and align with the ground truth's recommendations. The addition of reentrancy guards is irrelevant but not harmful.\n      \"\n    }\n  },\n  \"notes\": \"\n    - Finding 0 is close to a TARGET_MATCH but fails due to the conflation with read-only reentrancy. The core oracle manipulation issue is correctly identified, but the type and root cause are partially incorrect.\n    - Finding 1 is a valid bonus finding, as it identifies a real, distinct vulnerability not covered in the ground truth.\n    - The ground truth's root cause focuses solely on flash loan-based liquidity inflation, while the finding introduces an unnecessary reentrancy angle. This prevents a TARGET_MATCH classification.\n  \"\n}\n```"
}