{
  "sample_id": "ds_t1_023",
  "detector_model": "qwen3-coder-plus",
  "prompt_type": "direct",
  "judge_model": "mistral-large",
  "timestamp": "2026-01-06T02:14:48.336041+00:00",
  "overall_verdict": {
    "said_vulnerable": true,
    "confidence_expressed": 0.9
  },
  "findings": [
    {
      "finding_id": 0,
      "vulnerability_type_claimed": "Reentrancy",
      "location_claimed": "CashOut function",
      "classification": "TARGET_MATCH",
      "reasoning": "\n        - **Root Cause Match**: The finding correctly identifies the violation of the checks-effects-interactions pattern in the CashOut function, where the external call (`msg.sender.call.value(_am)()`) is made before updating the state (`balances[msg.sender]`). This matches the ground truth's implied root cause (reentrancy due to state update after external call).\n        - **Location Match**: The finding correctly identifies the CashOut function as the vulnerable location.\n        - **Type Match**: The type 'Reentrancy' is an exact match to the ground truth's 'reentrancy'.\n        - The attack scenario and suggested fix are concrete and align with the ground truth's remediation advice (checks-effects-interactions pattern).\n      "
    },
    {
      "finding_id": 1,
      "vulnerability_type_claimed": "tx.origin Vulnerability",
      "location_claimed": "onlyOwner modifier",
      "classification": "BONUS_VALID",
      "reasoning": "\n        - The finding identifies a real vulnerability not covered in the ground truth.\n        - The issue (using `tx.origin` for access control) is a known security risk and exists in the code.\n        - The attack scenario is concrete and plausible (phishing via malicious intermediary contract).\n        - The impact is genuine (unauthorized access to owner-only functions).\n        - The suggested fix (replace `tx.origin` with `msg.sender`) is correct and remediates the issue.\n      "
    }
  ],
  "target_assessment": {
    "complete_found": true,
    "partial_found": false,
    "finding_id": 0,
    "root_cause_match": true,
    "location_match": true,
    "type_match": "exact",
    "root_cause_identification": {
      "score": 1.0,
      "reasoning": "The finding precisely identifies the root cause as the violation of the checks-effects-interactions pattern, which is the core issue enabling reentrancy in the CashOut function."
    },
    "attack_vector_validity": {
      "score": 1.0,
      "reasoning": "The attack scenario is concrete, step-by-step, and accurately describes how an attacker could exploit the reentrancy vulnerability to drain funds."
    },
    "fix_suggestion_validity": {
      "score": 1.0,
      "reasoning": "The suggested fix (updating state before external calls) is correct and aligns with the ground truth's remediation advice."
    }
  },
  "summary": {},
  "notes": "\n    - The ground truth did not specify a root cause, but the finding's explanation of the checks-effects-interactions violation is the de facto root cause for reentrancy in this context.\n    - Finding 1 is a valid bonus finding, as it identifies a real, impactful vulnerability not covered by the ground truth.\n  ",
  "judge_latency_ms": 11787.840843200684,
  "raw_response": "```json\n{\n  \"overall_verdict\": {\n    \"said_vulnerable\": true,\n    \"confidence_expressed\": 0.9\n  },\n  \"findings\": [\n    {\n      \"finding_id\": 0,\n      \"vulnerability_type_claimed\": \"Reentrancy\",\n      \"location_claimed\": \"CashOut function\",\n      \"classification\": \"TARGET_MATCH\",\n      \"reasoning\": \"\n        - **Root Cause Match**: The finding correctly identifies the violation of the checks-effects-interactions pattern in the CashOut function, where the external call (`msg.sender.call.value(_am)()`) is made before updating the state (`balances[msg.sender]`). This matches the ground truth's implied root cause (reentrancy due to state update after external call).\n        - **Location Match**: The finding correctly identifies the CashOut function as the vulnerable location.\n        - **Type Match**: The type 'Reentrancy' is an exact match to the ground truth's 'reentrancy'.\n        - The attack scenario and suggested fix are concrete and align with the ground truth's remediation advice (checks-effects-interactions pattern).\n      \"\n    },\n    {\n      \"finding_id\": 1,\n      \"vulnerability_type_claimed\": \"tx.origin Vulnerability\",\n      \"location_claimed\": \"onlyOwner modifier\",\n      \"classification\": \"BONUS_VALID\",\n      \"reasoning\": \"\n        - The finding identifies a real vulnerability not covered in the ground truth.\n        - The issue (using `tx.origin` for access control) is a known security risk and exists in the code.\n        - The attack scenario is concrete and plausible (phishing via malicious intermediary contract).\n        - The impact is genuine (unauthorized access to owner-only functions).\n        - The suggested fix (replace `tx.origin` with `msg.sender`) is correct and remediates the issue.\n      \"\n    }\n  ],\n  \"target_assessment\": {\n    \"complete_found\": true,\n    \"partial_found\": false,\n    \"finding_id\": 0,\n    \"root_cause_match\": true,\n    \"location_match\": true,\n    \"type_match\": \"exact\",\n    \"root_cause_identification\": {\n      \"score\": 1.0,\n      \"reasoning\": \"The finding precisely identifies the root cause as the violation of the checks-effects-interactions pattern, which is the core issue enabling reentrancy in the CashOut function.\"\n    },\n    \"attack_vector_validity\": {\n      \"score\": 1.0,\n      \"reasoning\": \"The attack scenario is concrete, step-by-step, and accurately describes how an attacker could exploit the reentrancy vulnerability to drain funds.\"\n    },\n    \"fix_suggestion_validity\": {\n      \"score\": 1.0,\n      \"reasoning\": \"The suggested fix (updating state before external calls) is correct and aligns with the ground truth's remediation advice.\"\n    }\n  },\n  \"notes\": \"\n    - The ground truth did not specify a root cause, but the finding's explanation of the checks-effects-interactions violation is the de facto root cause for reentrancy in this context.\n    - Finding 1 is a valid bonus finding, as it identifies a real, impactful vulnerability not covered by the ground truth.\n  \"\n}\n```"
}