{
  "sample_id": "gs_010",
  "dataset": "gs",
  "prompt_type": "context_protocol_cot_naturalistic",
  "detector_model": "grok-4-fast",
  "judge_model": "mistral-large",
  "timestamp": "2026-01-06T06:31:47.464385+00:00",
  "overall_verdict": {
    "said_vulnerable": true,
    "confidence_expressed": 0.95
  },
  "findings": [
    {
      "finding_id": 0,
      "vulnerability_type_claimed": "Logic Error",
      "location_claimed": "_currentBalance = token.balanceOf(_who) + lockManager.getLockedBalance(_who)",
      "classification": "TARGET_MATCH",
      "reasoning": "\n        **Root Cause Match**: The finding correctly identifies that the inclusion of `token.balanceOf(_who)` in the voting power calculation allows users to bypass the locking requirement, which is the core issue described in the ground truth. The ground truth specifies that the vulnerability arises because the check includes the user's token balance (which can be flashloaned), and the finding explicitly states that including free (unlocked) tokens undermines the lock-to-vote mechanism. This matches the root cause precisely.\n\n        **Location Match**: The finding correctly identifies the vulnerable line of code (`_currentBalance = token.balanceOf(_who) + lockManager.getLockedBalance(_who)`) in the `isGranted` function, which matches the ground truth location.\n\n        **Type Match**: The finding labels the issue as a 'Logic Error', which is a semantic match for the ground truth's 'flash_loan' type. While the terminology differs, the underlying concept (a logic flaw enabling bypass via temporary token holdings) is the same. The ground truth's 'flash_loan' is a specific attack vector enabled by this logic error, so the type is semantically equivalent.\n      "
    },
    {
      "finding_id": 1,
      "vulnerability_type_claimed": "Documentation Error",
      "location_claimed": "Function comment",
      "classification": "INFORMATIONAL",
      "reasoning": "\n        This finding is a documentation issue and does not relate to the TARGET vulnerability. It is a valid observation but not security-relevant to the flash loan vulnerability.\n      "
    }
  ],
  "target_assessment": {
    "complete_found": true,
    "partial_found": false,
    "finding_id": 0,
    "root_cause_match": true,
    "location_match": true,
    "type_match": "semantic",
    "root_cause_identification": {
      "score": 1.0,
      "reasoning": "\n        The finding's root cause explanation is technically accurate and semantically matches the ground truth. It correctly identifies that the inclusion of `token.balanceOf(_who)` allows users to bypass the locking requirement, which is the specific issue described in the ground truth. The explanation is clear and directly addresses the vulnerability's root cause.\n      "
    },
    "attack_vector_validity": {
      "score": 0.9,
      "reasoning": "\n        The finding describes a valid attack scenario where users can bypass the locking requirement by holding sufficient free tokens. However, it does not explicitly mention flash loans, which is the primary attack vector in the ground truth. While the scenario is plausible and technically correct, it is slightly less specific than the ground truth's step-by-step flash loan exploit. Nonetheless, the attack vector is valid and aligns with the root cause.\n      "
    },
    "fix_suggestion_validity": {
      "score": 1.0,
      "reasoning": "\n        The suggested fix (`uint256 _currentBalance = lockManager.getLockedBalance(_who);`) is identical to the ground truth's fix and correctly remediates the issue. The additional comment update is also valid and improves clarity.\n      "
    }
  },
  "summary": {},
  "notes": "\n    The first finding is a strong TARGET_MATCH, as it correctly identifies the root cause, location, and provides a valid fix. The only minor discrepancy is the vulnerability type ('Logic Error' vs 'flash_loan'), but this is a semantic difference and does not detract from the overall accuracy of the finding. The second finding is informational and unrelated to the TARGET vulnerability.\n  ",
  "judge_latency_ms": 16666.166067123413,
  "raw_response": "```json\n{\n  \"overall_verdict\": {\n    \"said_vulnerable\": true,\n    \"confidence_expressed\": 0.95\n  },\n  \"findings\": [\n    {\n      \"finding_id\": 0,\n      \"vulnerability_type_claimed\": \"Logic Error\",\n      \"location_claimed\": \"_currentBalance = token.balanceOf(_who) + lockManager.getLockedBalance(_who)\",\n      \"classification\": \"TARGET_MATCH\",\n      \"reasoning\": \"\n        **Root Cause Match**: The finding correctly identifies that the inclusion of `token.balanceOf(_who)` in the voting power calculation allows users to bypass the locking requirement, which is the core issue described in the ground truth. The ground truth specifies that the vulnerability arises because the check includes the user's token balance (which can be flashloaned), and the finding explicitly states that including free (unlocked) tokens undermines the lock-to-vote mechanism. This matches the root cause precisely.\n\n        **Location Match**: The finding correctly identifies the vulnerable line of code (`_currentBalance = token.balanceOf(_who) + lockManager.getLockedBalance(_who)`) in the `isGranted` function, which matches the ground truth location.\n\n        **Type Match**: The finding labels the issue as a 'Logic Error', which is a semantic match for the ground truth's 'flash_loan' type. While the terminology differs, the underlying concept (a logic flaw enabling bypass via temporary token holdings) is the same. The ground truth's 'flash_loan' is a specific attack vector enabled by this logic error, so the type is semantically equivalent.\n      \"\n    },\n    {\n      \"finding_id\": 1,\n      \"vulnerability_type_claimed\": \"Documentation Error\",\n      \"location_claimed\": \"Function comment\",\n      \"classification\": \"INFORMATIONAL\",\n      \"reasoning\": \"\n        This finding is a documentation issue and does not relate to the TARGET vulnerability. It is a valid observation but not security-relevant to the flash loan vulnerability.\n      \"\n    }\n  ],\n  \"target_assessment\": {\n    \"complete_found\": true,\n    \"partial_found\": false,\n    \"finding_id\": 0,\n    \"root_cause_match\": true,\n    \"location_match\": true,\n    \"type_match\": \"semantic\",\n    \"root_cause_identification\": {\n      \"score\": 1.0,\n      \"reasoning\": \"\n        The finding's root cause explanation is technically accurate and semantically matches the ground truth. It correctly identifies that the inclusion of `token.balanceOf(_who)` allows users to bypass the locking requirement, which is the specific issue described in the ground truth. The explanation is clear and directly addresses the vulnerability's root cause.\n      \"\n    },\n    \"attack_vector_validity\": {\n      \"score\": 0.9,\n      \"reasoning\": \"\n        The finding describes a valid attack scenario where users can bypass the locking requirement by holding sufficient free tokens. However, it does not explicitly mention flash loans, which is the primary attack vector in the ground truth. While the scenario is plausible and technically correct, it is slightly less specific than the ground truth's step-by-step flash loan exploit. Nonetheless, the attack vector is valid and aligns with the root cause.\n      \"\n    },\n    \"fix_suggestion_validity\": {\n      \"score\": 1.0,\n      \"reasoning\": \"\n        The suggested fix (`uint256 _currentBalance = lockManager.getLockedBalance(_who);`) is identical to the ground truth's fix and correctly remediates the issue. The additional comment update is also valid and improves clarity.\n      \"\n    }\n  },\n  \"notes\": \"\n    The first finding is a strong TARGET_MATCH, as it correctly identifies the root cause, location, and provides a valid fix. The only minor discrepancy is the vulnerability type ('Logic Error' vs 'flash_loan'), but this is a semantic difference and does not detract from the overall accuracy of the finding. The second finding is informational and unrelated to the TARGET vulnerability.\n  \"\n}\n```"
}