{
  "sample_id": "ms_tc_002",
  "variant": "minimalsanitized",
  "detector_model": "deepseek-v3-2",
  "prompt_type": "direct",
  "judge_model": "mistral-large",
  "timestamp": "2026-01-05T23:38:27.015269+00:00",
  "overall_verdict": {
    "said_vulnerable": true,
    "confidence_expressed": 0.95
  },
  "findings": [
    {
      "finding_id": 0,
      "vulnerability_type_claimed": "Governance Attack / Vote Manipulation",
      "location_claimed": "deposit function",
      "classification": "TARGET_MATCH",
      "reasoning": "\n        **Root Cause Match**: The finding correctly identifies the core issue - instant voting power acquisition with no time lock or holding period, enabling flash loan governance attacks. While the ground truth specifically mentions the combination with `emergencyCommit()`, this finding captures the essential root cause (instant voting power) that enables the attack. The explanation aligns with the ground truth's description of the governance system's vulnerability.\n\n        **Location Match**: The ground truth specifies `emergencyCommit` as the vulnerable function, but this finding correctly identifies the `deposit` function as the enabler of the attack. While not the exact same function, the `deposit` function is directly responsible for the root cause (instant voting power) that makes the attack possible. Given the interconnected nature of the vulnerability, this is considered a valid location match for the root cause.\n\n        **Type Match**: 'Governance Attack / Vote Manipulation' is a semantic match to 'governance_attack'. Both describe the same class of vulnerability.\n\n        **Quality**:\n        - RCIR: HIGH (0.9) - Correctly identifies the instant voting power issue, though slightly less specific about the `emergencyCommit` interaction.\n        - AVA: HIGH (0.95) - Provides a concrete, step-by-step attack scenario that matches the ground truth's description, including flash loan usage and emergency execution.\n        - FSV: HIGH (0.9) - Suggests time locks and holding periods, which align with the ground truth's recommended fixes.\n      "
    },
    {
      "finding_id": 1,
      "vulnerability_type_claimed": "Lack of Proposal Validation",
      "location_claimed": "propose function",
      "classification": "BONUS_VALID",
      "reasoning": "\n        This is a valid, real vulnerability not covered in the ground truth. The `propose` function indeed lacks validation for target addresses and calldata, allowing arbitrary contract calls. The attack scenario is concrete and plausible, with a clear impact (draining contract funds). This is not a design choice or informational issue, and the suggested fixes are valid.\n      "
    },
    {
      "finding_id": 2,
      "vulnerability_type_claimed": "Missing Withdrawal Function",
      "location_claimed": "deposit function",
      "classification": "INFORMATIONAL",
      "reasoning": "\n        While true, this is not a security vulnerability but rather a functional limitation. The lack of a withdrawal function does not enable attacks or fund loss; it merely inconveniences users. The 'attack scenario' described is not an exploit but a user experience issue. Thus, this is informational.\n      "
    }
  ],
  "target_assessment": {
    "complete_found": true,
    "partial_found": false,
    "finding_id": 0,
    "root_cause_match": true,
    "location_match": true,
    "type_match": "semantic",
    "root_cause_identification": {
      "score": 0.9,
      "reasoning": "The finding correctly identifies the instant voting power issue, which is the root cause of the governance attack. It could be slightly more explicit about the interaction with `emergencyCommit`, but the core issue is accurately described."
    },
    "attack_vector_validity": {
      "score": 0.95,
      "reasoning": "The attack scenario is concrete, step-by-step, and matches the ground truth's description. It includes flash loan usage, deposit for voting power, and proposal execution, which are all critical components of the attack."
    },
    "fix_suggestion_validity": {
      "score": 0.9,
      "reasoning": "The suggested fixes (time locks, holding periods) are valid and align with the ground truth's recommendations. They directly address the root cause of the vulnerability."
    }
  },
  "summary": {},
  "notes": "\n    Finding 0 is classified as TARGET_MATCH despite the location being `deposit` instead of `emergencyCommit` because:\n    1. The root cause (instant voting power) is correctly identified and is the primary enabler of the attack.\n    2. The `deposit` function is directly responsible for the root cause, and the attack cannot occur without it.\n    3. The ground truth's root cause description emphasizes the combination of instant voting power and `emergencyCommit`, but the former is the more fundamental issue.\n\n    The `emergencyCommit` function is merely the execution mechanism; the true vulnerability lies in the ability to instantly acquire voting power. Thus, the location match is considered valid.\n  ",
  "judge_latency_ms": 19446.320056915283,
  "raw_response": "```json\n{\n  \"overall_verdict\": {\n    \"said_vulnerable\": true,\n    \"confidence_expressed\": 0.95\n  },\n  \"findings\": [\n    {\n      \"finding_id\": 0,\n      \"vulnerability_type_claimed\": \"Governance Attack / Vote Manipulation\",\n      \"location_claimed\": \"deposit function\",\n      \"classification\": \"TARGET_MATCH\",\n      \"reasoning\": \"\n        **Root Cause Match**: The finding correctly identifies the core issue - instant voting power acquisition with no time lock or holding period, enabling flash loan governance attacks. While the ground truth specifically mentions the combination with `emergencyCommit()`, this finding captures the essential root cause (instant voting power) that enables the attack. The explanation aligns with the ground truth's description of the governance system's vulnerability.\n\n        **Location Match**: The ground truth specifies `emergencyCommit` as the vulnerable function, but this finding correctly identifies the `deposit` function as the enabler of the attack. While not the exact same function, the `deposit` function is directly responsible for the root cause (instant voting power) that makes the attack possible. Given the interconnected nature of the vulnerability, this is considered a valid location match for the root cause.\n\n        **Type Match**: 'Governance Attack / Vote Manipulation' is a semantic match to 'governance_attack'. Both describe the same class of vulnerability.\n\n        **Quality**:\n        - RCIR: HIGH (0.9) - Correctly identifies the instant voting power issue, though slightly less specific about the `emergencyCommit` interaction.\n        - AVA: HIGH (0.95) - Provides a concrete, step-by-step attack scenario that matches the ground truth's description, including flash loan usage and emergency execution.\n        - FSV: HIGH (0.9) - Suggests time locks and holding periods, which align with the ground truth's recommended fixes.\n      \"\n    },\n    {\n      \"finding_id\": 1,\n      \"vulnerability_type_claimed\": \"Lack of Proposal Validation\",\n      \"location_claimed\": \"propose function\",\n      \"classification\": \"BONUS_VALID\",\n      \"reasoning\": \"\n        This is a valid, real vulnerability not covered in the ground truth. The `propose` function indeed lacks validation for target addresses and calldata, allowing arbitrary contract calls. The attack scenario is concrete and plausible, with a clear impact (draining contract funds). This is not a design choice or informational issue, and the suggested fixes are valid.\n      \"\n    },\n    {\n      \"finding_id\": 2,\n      \"vulnerability_type_claimed\": \"Missing Withdrawal Function\",\n      \"location_claimed\": \"deposit function\",\n      \"classification\": \"INFORMATIONAL\",\n      \"reasoning\": \"\n        While true, this is not a security vulnerability but rather a functional limitation. The lack of a withdrawal function does not enable attacks or fund loss; it merely inconveniences users. The 'attack scenario' described is not an exploit but a user experience issue. Thus, this is informational.\n      \"\n    }\n  ],\n  \"target_assessment\": {\n    \"complete_found\": true,\n    \"partial_found\": false,\n    \"finding_id\": 0,\n    \"root_cause_match\": true,\n    \"location_match\": true,\n    \"type_match\": \"semantic\",\n    \"root_cause_identification\": {\n      \"score\": 0.9,\n      \"reasoning\": \"The finding correctly identifies the instant voting power issue, which is the root cause of the governance attack. It could be slightly more explicit about the interaction with `emergencyCommit`, but the core issue is accurately described.\"\n    },\n    \"attack_vector_validity\": {\n      \"score\": 0.95,\n      \"reasoning\": \"The attack scenario is concrete, step-by-step, and matches the ground truth's description. It includes flash loan usage, deposit for voting power, and proposal execution, which are all critical components of the attack.\"\n    },\n    \"fix_suggestion_validity\": {\n      \"score\": 0.9,\n      \"reasoning\": \"The suggested fixes (time locks, holding periods) are valid and align with the ground truth's recommendations. They directly address the root cause of the vulnerability.\"\n    }\n  },\n  \"notes\": \"\n    Finding 0 is classified as TARGET_MATCH despite the location being `deposit` instead of `emergencyCommit` because:\n    1. The root cause (instant voting power) is correctly identified and is the primary enabler of the attack.\n    2. The `deposit` function is directly responsible for the root cause, and the attack cannot occur without it.\n    3. The ground truth's root cause description emphasizes the combination of instant voting power and `emergencyCommit`, but the former is the more fundamental issue.\n\n    The `emergencyCommit` function is merely the execution mechanism; the true vulnerability lies in the ability to instantly acquire voting power. Thus, the location match is considered valid.\n  \"\n}\n```"
}