{
  "sample_id": "nc_tc_017",
  "variant": "nocomments",
  "detector_model": "llama-4-maverick",
  "prompt_type": "direct",
  "judge_model": "mistral-large",
  "timestamp": "2026-01-06T00:27:47.664050+00:00",
  "overall_verdict": {
    "said_vulnerable": true,
    "confidence_expressed": 0.9
  },
  "findings": [
    {
      "finding_id": 0,
      "vulnerability_type_claimed": "Unprotected Price Manipulation",
      "location_claimed": "getLPTokenValue",
      "classification": "TARGET_MATCH",
      "reasoning": "\n        **Root Cause Match**: The finding correctly identifies that the LP token value is calculated directly from current Uniswap pool reserves without protection against manipulation (e.g., TWAP or external oracles). This matches the ground truth root cause exactly.\n        **Location Match**: While the ground truth specifies the `borrow` function as the vulnerable entry point, the root cause is in `getLPTokenValue`, which is called by `borrow`. The finding correctly identifies the source of the vulnerability (the value calculation function), which is the core issue. The ground truth's focus on `borrow` is because it's the function that uses the manipulated value, but the root cause is in `getLPTokenValue`. This is a semantic match for location.\n        **Type Match**: 'Unprotected Price Manipulation' is a semantic match for 'price_oracle_manipulation'. Both describe the same vulnerability class.\n      "
    },
    {
      "finding_id": 1,
      "vulnerability_type_claimed": "Reentrancy Vulnerability",
      "location_claimed": "borrow, withdraw",
      "classification": "SECURITY_THEATER",
      "reasoning": "\n        The finding describes a potential reentrancy risk if the contract were modified or used ERC-777 tokens. However, the current implementation follows the Checks-Effects-Interactions pattern, and there is no concrete attack scenario for standard ERC-20 tokens. The concern is theoretical and does not represent a genuine vulnerability in the provided code. Thus, it is classified as SECURITY_THEATER.\n      "
    }
  ],
  "target_assessment": {
    "complete_found": true,
    "partial_found": false,
    "finding_id": 0,
    "root_cause_match": true,
    "location_match": true,
    "type_match": "semantic",
    "root_cause_identification": {
      "score": 1.0,
      "reasoning": "\n        The finding precisely identifies the root cause: the use of instantaneous Uniswap pool reserves for LP token valuation without protection against manipulation. This matches the ground truth exactly.\n      "
    },
    "attack_vector_validity": {
      "score": 0.9,
      "reasoning": "\n        The attack scenario is valid and closely mirrors the ground truth. It correctly describes how an attacker could manipulate pool reserves via flash loans to inflate collateral value and overborrow. The only minor gap is that the scenario does not explicitly mention the step of swapping back to rebalance the pool after borrowing, but this is implied.\n      "
    },
    "fix_suggestion_validity": {
      "score": 0.9,
      "reasoning": "\n        The suggested fix (implementing TWAP or using oracle services) is valid and aligns with the ground truth. It directly addresses the root cause. The only minor gap is that it does not mention alternative LP token valuation formulas (e.g., Alpha Homora V2's fair LP pricing), but this is not critical.\n      "
    }
  },
  "summary": {},
  "notes": "\n    The location match for Finding 0 is debatable but justified. While the ground truth specifies the `borrow` function as the vulnerable entry point, the root cause lies in `getLPTokenValue`. The finding correctly identifies the core issue (the value calculation function), which is the source of the vulnerability. The `borrow` function is merely the entry point that uses the manipulated value. Thus, the location is considered a semantic match.\n  ",
  "judge_latency_ms": 16526.38006210327,
  "raw_response": "```json\n{\n  \"overall_verdict\": {\n    \"said_vulnerable\": true,\n    \"confidence_expressed\": 0.9\n  },\n  \"findings\": [\n    {\n      \"finding_id\": 0,\n      \"vulnerability_type_claimed\": \"Unprotected Price Manipulation\",\n      \"location_claimed\": \"getLPTokenValue\",\n      \"classification\": \"TARGET_MATCH\",\n      \"reasoning\": \"\n        **Root Cause Match**: The finding correctly identifies that the LP token value is calculated directly from current Uniswap pool reserves without protection against manipulation (e.g., TWAP or external oracles). This matches the ground truth root cause exactly.\n        **Location Match**: While the ground truth specifies the `borrow` function as the vulnerable entry point, the root cause is in `getLPTokenValue`, which is called by `borrow`. The finding correctly identifies the source of the vulnerability (the value calculation function), which is the core issue. The ground truth's focus on `borrow` is because it's the function that uses the manipulated value, but the root cause is in `getLPTokenValue`. This is a semantic match for location.\n        **Type Match**: 'Unprotected Price Manipulation' is a semantic match for 'price_oracle_manipulation'. Both describe the same vulnerability class.\n      \"\n    },\n    {\n      \"finding_id\": 1,\n      \"vulnerability_type_claimed\": \"Reentrancy Vulnerability\",\n      \"location_claimed\": \"borrow, withdraw\",\n      \"classification\": \"SECURITY_THEATER\",\n      \"reasoning\": \"\n        The finding describes a potential reentrancy risk if the contract were modified or used ERC-777 tokens. However, the current implementation follows the Checks-Effects-Interactions pattern, and there is no concrete attack scenario for standard ERC-20 tokens. The concern is theoretical and does not represent a genuine vulnerability in the provided code. Thus, it is classified as SECURITY_THEATER.\n      \"\n    }\n  ],\n  \"target_assessment\": {\n    \"complete_found\": true,\n    \"partial_found\": false,\n    \"finding_id\": 0,\n    \"root_cause_match\": true,\n    \"location_match\": true,\n    \"type_match\": \"semantic\",\n    \"root_cause_identification\": {\n      \"score\": 1.0,\n      \"reasoning\": \"\n        The finding precisely identifies the root cause: the use of instantaneous Uniswap pool reserves for LP token valuation without protection against manipulation. This matches the ground truth exactly.\n      \"\n    },\n    \"attack_vector_validity\": {\n      \"score\": 0.9,\n      \"reasoning\": \"\n        The attack scenario is valid and closely mirrors the ground truth. It correctly describes how an attacker could manipulate pool reserves via flash loans to inflate collateral value and overborrow. The only minor gap is that the scenario does not explicitly mention the step of swapping back to rebalance the pool after borrowing, but this is implied.\n      \"\n    },\n    \"fix_suggestion_validity\": {\n      \"score\": 0.9,\n      \"reasoning\": \"\n        The suggested fix (implementing TWAP or using oracle services) is valid and aligns with the ground truth. It directly addresses the root cause. The only minor gap is that it does not mention alternative LP token valuation formulas (e.g., Alpha Homora V2's fair LP pricing), but this is not critical.\n      \"\n    }\n  },\n  \"notes\": \"\n    The location match for Finding 0 is debatable but justified. While the ground truth specifies the `borrow` function as the vulnerable entry point, the root cause lies in `getLPTokenValue`. The finding correctly identifies the core issue (the value calculation function), which is the source of the vulnerability. The `borrow` function is merely the entry point that uses the manipulated value. Thus, the location is considered a semantic match.\n  \"\n}\n```"
}