{
  "sample_id": "nc_tc_021",
  "variant": "nocomments",
  "detector_model": "llama-4-maverick",
  "prompt_type": "direct",
  "judge_model": "mistral-large",
  "timestamp": "2026-01-06T00:28:39.917194+00:00",
  "overall_verdict": {
    "said_vulnerable": true,
    "confidence_expressed": 0.9
  },
  "findings": [
    {
      "finding_id": 0,
      "vulnerability_type_claimed": "Unprotected Price Manipulation",
      "location_claimed": "getCollateralValue",
      "classification": "TARGET_MATCH",
      "reasoning": "\n        **Root Cause Match**: The finding correctly identifies that the oracle relies on `get_virtual_price()` which can be manipulated via flash loans or liquidity additions, leading to inflated collateral valuation. This matches the ground truth root cause exactly.\n        **Location Match**: While the ground truth specifies the `borrow` function as the vulnerable location, the root cause originates in `getCollateralValue` (called by `borrow`). The finding correctly identifies the source of the vulnerability (oracle price fetch), which is a prerequisite for the `borrow` function's vulnerability. This is acceptable as the `getCollateralValue` function is directly involved in the attack path.\n        **Type Match**: 'Unprotected Price Manipulation' is a semantic match for 'price_oracle_manipulation'.\n      "
    },
    {
      "finding_id": 1,
      "vulnerability_type_claimed": "Lack of Reentrancy Protection",
      "location_claimed": "borrow, deposit",
      "classification": "MISCHARACTERIZED",
      "reasoning": "\n        The finding claims reentrancy vulnerability in `borrow` and `deposit` functions due to external token transfers. However, the contract uses Solidity 0.8.0+, which has built-in reentrancy protection for low-level calls, and the ERC20 `transfer`/`transferFrom` functions are not known to be reentrant in standard implementations. The finding does not demonstrate a concrete attack scenario where reentrancy would be exploitable, making this a mischaracterization.\n      "
    }
  ],
  "target_assessment": {
    "complete_found": true,
    "partial_found": false,
    "finding_id": 0,
    "root_cause_match": true,
    "location_match": true,
    "type_match": "semantic",
    "root_cause_identification": {
      "score": 0.9,
      "reasoning": "\n        The finding accurately describes the root cause: reliance on `get_virtual_price()` without manipulation resistance, allowing flash loan attacks to inflate collateral value. The explanation is technically precise and matches the ground truth.\n      "
    },
    "attack_vector_validity": {
      "score": 0.9,
      "reasoning": "\n        The attack scenario closely mirrors the ground truth: flash loan manipulation of the pool's virtual price to inflate collateral value and overborrow. The steps are concrete and valid.\n      "
    },
    "fix_suggestion_validity": {
      "score": 0.9,
      "reasoning": "\n        The suggested fix (TWAP or multi-source oracles) directly addresses the root cause and aligns with the ground truth fix. It is technically correct and actionable.\n      "
    }
  },
  "summary": {},
  "notes": "\n    Finding 0 is classified as TARGET_MATCH despite the location being reported as `getCollateralValue` instead of `borrow` because the root cause originates in the oracle price fetch, which is called by `borrow`. The `borrow` function's vulnerability is a direct consequence of the issue in `getCollateralValue`. This is a nuanced but acceptable interpretation of the location match requirement.\n  ",
  "judge_latency_ms": 15087.589979171753,
  "raw_response": "```json\n{\n  \"overall_verdict\": {\n    \"said_vulnerable\": true,\n    \"confidence_expressed\": 0.9\n  },\n  \"findings\": [\n    {\n      \"finding_id\": 0,\n      \"vulnerability_type_claimed\": \"Unprotected Price Manipulation\",\n      \"location_claimed\": \"getCollateralValue\",\n      \"classification\": \"TARGET_MATCH\",\n      \"reasoning\": \"\n        **Root Cause Match**: The finding correctly identifies that the oracle relies on `get_virtual_price()` which can be manipulated via flash loans or liquidity additions, leading to inflated collateral valuation. This matches the ground truth root cause exactly.\n        **Location Match**: While the ground truth specifies the `borrow` function as the vulnerable location, the root cause originates in `getCollateralValue` (called by `borrow`). The finding correctly identifies the source of the vulnerability (oracle price fetch), which is a prerequisite for the `borrow` function's vulnerability. This is acceptable as the `getCollateralValue` function is directly involved in the attack path.\n        **Type Match**: 'Unprotected Price Manipulation' is a semantic match for 'price_oracle_manipulation'.\n      \"\n    },\n    {\n      \"finding_id\": 1,\n      \"vulnerability_type_claimed\": \"Lack of Reentrancy Protection\",\n      \"location_claimed\": \"borrow, deposit\",\n      \"classification\": \"MISCHARACTERIZED\",\n      \"reasoning\": \"\n        The finding claims reentrancy vulnerability in `borrow` and `deposit` functions due to external token transfers. However, the contract uses Solidity 0.8.0+, which has built-in reentrancy protection for low-level calls, and the ERC20 `transfer`/`transferFrom` functions are not known to be reentrant in standard implementations. The finding does not demonstrate a concrete attack scenario where reentrancy would be exploitable, making this a mischaracterization.\n      \"\n    }\n  ],\n  \"target_assessment\": {\n    \"complete_found\": true,\n    \"partial_found\": false,\n    \"finding_id\": 0,\n    \"root_cause_match\": true,\n    \"location_match\": true,\n    \"type_match\": \"semantic\",\n    \"root_cause_identification\": {\n      \"score\": 0.9,\n      \"reasoning\": \"\n        The finding accurately describes the root cause: reliance on `get_virtual_price()` without manipulation resistance, allowing flash loan attacks to inflate collateral value. The explanation is technically precise and matches the ground truth.\n      \"\n    },\n    \"attack_vector_validity\": {\n      \"score\": 0.9,\n      \"reasoning\": \"\n        The attack scenario closely mirrors the ground truth: flash loan manipulation of the pool's virtual price to inflate collateral value and overborrow. The steps are concrete and valid.\n      \"\n    },\n    \"fix_suggestion_validity\": {\n      \"score\": 0.9,\n      \"reasoning\": \"\n        The suggested fix (TWAP or multi-source oracles) directly addresses the root cause and aligns with the ground truth fix. It is technically correct and actionable.\n      \"\n    }\n  },\n  \"notes\": \"\n    Finding 0 is classified as TARGET_MATCH despite the location being reported as `getCollateralValue` instead of `borrow` because the root cause originates in the oracle price fetch, which is called by `borrow`. The `borrow` function's vulnerability is a direct consequence of the issue in `getCollateralValue`. This is a nuanced but acceptable interpretation of the location match requirement.\n  \"\n}\n```"
}