{
  "sample_id": "gs_008",
  "dataset": "gs",
  "prompt_type": "context_protocol_cot_naturalistic",
  "model": "llama-4-maverick",
  "timestamp": "2026-01-05T15:29:31.341169+00:00",
  "ground_truth": {
    "is_vulnerable": true,
    "vulnerability_type": "logic_error",
    "vulnerable_functions": [
      "claimRewards"
    ],
    "severity": "medium",
    "description": "`claimRewards()` uses `IVoter.poolVote(veTokenId)` incorrectly; `poolVote` is a mapping, not a function returning an array, causing a revert.",
    "root_cause": "`claimRewards()` uses `IVoter.poolVote(veTokenId)` incorrectly; `poolVote` is a mapping, not a function returning an array, causing a revert.",
    "attack_scenario": "A test votes on pools, warps time, and `claimRewards()` reverts due to invalid getter call.",
    "fix_description": "Add `getPoolVote(veTokenId)` in `VoterV3.sol` to return the array. Status: Mitigation confirmed.",
    "language": "solidity"
  },
  "prediction": {
    "verdict": "vulnerable",
    "confidence": 0.8,
    "vulnerabilities": [
      {
        "type": "Centralization Risk",
        "severity": "medium",
        "vulnerable_function": "Multiple owner-controlled functions",
        "location": "Throughout the contract",
        "explanation": "The contract has several functions that can be controlled by the owner or operator, posing centralization risks.",
        "attack_scenario": "Owner or operator could maliciously change critical parameters or drain funds.",
        "suggested_fix": "Implement timelocks or governance mechanisms for critical changes."
      },
      {
        "type": "Potential External Contract Vulnerability",
        "severity": "high",
        "vulnerable_function": "withdraw",
        "location": "GrowthHYBR.sol",
        "explanation": "The contract relies on `IVotingEscrow.multiSplit` to create new veNFTs. If this function is vulnerable or not implemented correctly, it could lead to loss of funds.",
        "attack_scenario": "Malicious or incorrect implementation of `multiSplit` could result in incorrect veNFT distribution or loss of user funds.",
        "suggested_fix": "Thoroughly audit `IVotingEscrow` and ensure `multiSplit` is correctly implemented."
      },
      {
        "type": "Lack of Input Validation",
        "severity": "low",
        "vulnerable_function": "setTeam",
        "location": "GrowthHYBR.sol",
        "explanation": "The function does not check if the new team address is different from the current one.",
        "attack_scenario": "Unnecessary state changes if the same address is set multiple times.",
        "suggested_fix": "Add a check to ensure the new team address is different from the current one."
      }
    ],
    "overall_explanation": "The contract is generally well-structured but has some centralization risks and relies heavily on external contracts. Ensuring the security of these external dependencies and implementing additional security measures (like timelocks for critical owner functions) could enhance the contract's overall security posture."
  },
  "parsing": {
    "success": true,
    "errors": [],
    "raw_response": "### Step 1: Understand What They're Building\n\nThe contract implements a liquid staking wrapper called GrowthHYBR (gHYBR) that allows users to participate in vote-escrowed tokenomics without locking their HYBR tokens individually. The protocol pools user deposits into a single veNFT position, providing liquidity while capturing governance rewards.\n\n### Step 2: Trace the Code Flow\n\n1. **Deposit Functionality**: Users deposit HYBR tokens and receive gHYBR shares in return. The deposited HYBR is locked into a veNFT.\n2. **Withdrawal Functionality**: Users can withdraw by burning gHYBR shares, receiving a proportional amount of HYBR from the veNFT.\n3. **Reward Compounding**: The contract compounds rewards (rebase and bribes) back into the veNFT.\n4. **Voting**: Authorized addresses can vote using the veNFT to maximize rewards.\n\n### Step 3: Look for Potential Issues\n\n1. **Reentrancy Risks**: The contract uses `ReentrancyGuard` which protects against reentrancy attacks in critical functions like `deposit` and `withdraw`.\n2. **Unprotected Functions**: Some functions lack proper access control (e.g., `compound` is restricted to `onlyOperator`, which is good).\n3. **Potential Issues in `withdraw`**: The function creates new veNFTs using `multiSplit`. If not implemented correctly in `IVotingEscrow`, this could lead to issues.\n4. **Dependency on External Contracts**: The contract's functionality depends on several external contracts (`IVotingEscrow`, `IVoter`, `IGaugeManager`, etc.). Any vulnerabilities in these contracts could impact gHYBR.\n\n### Step 4: Validate Concerns\n\n1. **Reentrancy**: Protected by `ReentrancyGuard`.\n2. **Access Control**: Most critical functions have proper access modifiers (`onlyOwner`, `onlyOperator`).\n3. **External Dependencies**: The contract assumes that external contracts (like `IVotingEscrow` and `IVoter`) are implemented correctly.\n\n### Analysis\n\nAfter reviewing the contract, several potential issues were identified:\n\n1. **Lack of Input Validation in `setTeam`**: The function does not check if the new team address is different from the current one.\n2. **Potential Issue in `withdraw`**: If `IVotingEscrow.multiSplit` fails or is not implemented correctly, it could lead to loss of funds or incorrect veNFT distribution.\n3. **Centralization Risks**: The contract has several owner-controlled functions (`setVoter`, `setOperator`, `setWithdrawFee`, etc.). While necessary, these pose centralization risks if not managed properly.\n\n### JSON Report\n\n```json\n{\n  \"verdict\": \"vulnerable\",\n  \"confidence\": 0.8,\n  \"vulnerabilities\": [\n    {\n      \"type\": \"Centralization Risk\",\n      \"severity\": \"medium\",\n      \"vulnerable_function\": \"Multiple owner-controlled functions\",\n      \"location\": \"Throughout the contract\",\n      \"explanation\": \"The contract has several functions that can be controlled by the owner or operator, posing centralization risks.\",\n      \"attack_scenario\": \"Owner or operator could maliciously change critical parameters or drain funds.\",\n      \"suggested_fix\": \"Implement timelocks or governance mechanisms for critical changes.\"\n    },\n    {\n      \"type\": \"Potential External Contract Vulnerability\",\n      \"severity\": \"high\",\n      \"vulnerable_function\": \"withdraw\",\n      \"location\": \"GrowthHYBR.sol\",\n      \"explanation\": \"The contract relies on `IVotingEscrow.multiSplit` to create new veNFTs. If this function is vulnerable or not implemented correctly, it could lead to loss of funds.\",\n      \"attack_scenario\": \"Malicious or incorrect implementation of `multiSplit` could result in incorrect veNFT distribution or loss of user funds.\",\n      \"suggested_fix\": \"Thoroughly audit `IVotingEscrow` and ensure `multiSplit` is correctly implemented.\"\n    },\n    {\n      \"type\": \"Lack of Input Validation\",\n      \"severity\": \"low\",\n      \"vulnerable_function\": \"setTeam\",\n      \"location\": \"GrowthHYBR.sol\",\n      \"explanation\": \"The function does not check if the new team address is different from the current one.\",\n      \"attack_scenario\": \"Unnecessary state changes if the same address is set multiple times.\",\n      \"suggested_fix\": \"Add a check to ensure the new team address is different from the current one.\"\n    }\n  ],\n  \"overall_explanation\": \"The contract is generally well-structured but has some centralization risks and relies heavily on external contracts. Ensuring the security of these external dependencies and implementing additional security measures (like timelocks for critical owner functions) could enhance the contract's overall security posture.\"\n}\n```"
  },
  "context_info": {
    "has_context_files": true,
    "context_file_count": 1,
    "has_protocol_doc": true
  },
  "api_metrics": {
    "input_tokens": 8348,
    "output_tokens": 992,
    "latency_ms": 2436.7470741271973
  }
}