{
  "sample_id": "gs_029",
  "dataset": "gs",
  "prompt_type": "context_protocol_cot_naturalistic",
  "model": "llama-4-maverick",
  "timestamp": "2026-01-05T15:34:40.086760+00:00",
  "ground_truth": {
    "is_vulnerable": true,
    "vulnerability_type": "signature_replay",
    "vulnerable_functions": [
      "execute"
    ],
    "severity": "high",
    "description": "When a session call with BEHAVIOR_REVERT_ON_ERROR fails, the transaction reverts but nonce is not consumed. The signature remains valid and can be replayed for partial calls. Session signatures are validated per-call using individual call hashes, enabling partial replay. Frontrunners can execute subsets of calls to grief or cause financial loss.",
    "root_cause": "When a session call with BEHAVIOR_REVERT_ON_ERROR fails, the transaction reverts but nonce is not consumed. The signature remains valid and can be replayed for partial calls. Session signatures are validated per-call using individual call hashes, enabling partial replay. Frontrunners can execute subsets of calls to grief or cause financial loss.",
    "attack_scenario": "Original payload: Calls [A, B, C] with signatures [SigA, SigB, SigC]. Execution: [A succeed, B succeed, C revert]. Result: Revert, nonce unused. Attack: Replay [A, B] with [SigA, SigB]. PoC: File POC.t.sol with test testSubmissionValidity. It builds a 2-call payload, expects revert on second call, then replays partial payload successfully.",
    "fix_description": "Bind session call signatures to the complete payload hash to prevent partial signature replay.",
    "language": "solidity"
  },
  "prediction": {
    "verdict": "vulnerable",
    "confidence": 0.7,
    "vulnerabilities": [
      {
        "type": "Reentrancy Risk",
        "severity": "medium",
        "vulnerable_function": "selfExecute",
        "location": "Calls.sol",
        "explanation": "selfExecute is not marked as nonReentrant, potentially allowing reentrancy attacks if not properly guarded by the inheriting contract.",
        "attack_scenario": "An attacker exploits a vulnerability in a contract that inherits from Calls and uses selfExecute in a way that allows reentrancy.",
        "suggested_fix": "Mark selfExecute as nonReentrant or ensure that any contract inheriting from Calls properly guards against reentrancy."
      },
      {
        "type": "Gas Limit Issue",
        "severity": "low",
        "vulnerable_function": "_execute",
        "location": "Calls.sol",
        "explanation": "The gas limit check does not account for the gas cost of operations before the call, potentially leading to out-of-gas errors.",
        "attack_scenario": "A call fails due to out-of-gas because the gas limit check is too optimistic.",
        "suggested_fix": "Consider adding a buffer to the gas limit check or accounting for the gas cost of preceding operations."
      },
      {
        "type": "Delegate Call Security",
        "severity": "high",
        "vulnerable_function": "_execute",
        "location": "Calls.sol",
        "explanation": "The use of delegatecall with potentially untrusted data can lead to arbitrary code execution if not properly validated.",
        "attack_scenario": "An attacker manipulates the delegate call data to execute malicious code.",
        "suggested_fix": "Ensure that IDelegatedExtension.handleSequenceDelegateCall is properly validated and secure. Limit the use of delegatecall to trusted targets."
      }
    ],
    "overall_explanation": "The contract has several potential issues, primarily related to reentrancy protection for selfExecute, gas limit checks, and the security of delegate calls. While the contract is well-structured, these issues need to be addressed to ensure security."
  },
  "parsing": {
    "success": true,
    "errors": [],
    "raw_response": "### Step 1: Understand What They're Building\n\nThe contract is part of a smart wallet system that allows users to execute batches of calls (transactions) in a single transaction. It supports features like session-based authorization, configurable behavior on call failures, and nonce-based replay protection. The main functionality is implemented in the `Calls` contract, which is an abstract contract inheriting from `ReentrancyGuard`, `BaseAuth`, and `Nonce`.\n\n### Step 2: Trace the Code Flow\n\n1. **Entry Points**: The contract has two main entry points for executing calls: `execute` and `selfExecute`. \n   - `execute` is used for external execution with a signature, validating the signature before proceeding.\n   - `selfExecute` is restricted to the contract itself and does not require a signature.\n\n2. **Execution Flow**:\n   - Both `execute` and `selfExecute` decode the provided payload into a `Payload.Decoded` structure.\n   - `execute` consumes a nonce and validates the provided signature. If invalid, it reverts.\n   - Both then call `_execute`, which iterates over the calls in the decoded payload.\n   - For each call, it checks if the call should be skipped based on its `onlyFallback` flag and the previous call's success status.\n   - It then executes the call with the specified gas limit, either as a regular call or a delegate call, depending on the call's configuration.\n   - Based on the call's success and its `behaviorOnError`, it either continues, reverts, or aborts the execution of subsequent calls.\n\n### Step 3: Look for Potential Issues\n\n1. **Reentrancy Protection**: The contract uses `ReentrancyGuard` and is marked as `nonReentrant` for the `execute` function. However, `selfExecute` is not explicitly marked as `nonReentrant`, though it's restricted to `onlySelf`. This could be a potential issue if not properly handled in the inheriting contract or if there's a misconfiguration.\n\n2. **Gas Limit Checks**: The contract checks if the gas left is less than the specified `gasLimit` for a call. However, it does not account for the gas cost of the operations performed before the actual call (e.g., decoding, emitting events). This might lead to a situation where a call is attempted with insufficient gas, potentially causing unexpected behavior.\n\n3. **Delegate Call Security**: The use of `delegatecall` with data from the payload can be risky if not properly validated, as it can lead to arbitrary code execution. The contract delegates to `IDelegatedExtension.handleSequenceDelegateCall`, which might be secure if properly implemented, but this is not shown in the provided code.\n\n4. **Error Handling**: The contract has different behaviors on error (`IGNORE_ERROR`, `REVERT_ON_ERROR`, `ABORT_ON_ERROR`). While this provides flexibility, it also means that the contract's behavior can vary significantly based on how calls are configured, potentially leading to complex debugging or unexpected behavior if not properly understood by users.\n\n### Step 4: Validate Concerns\n\n1. **Reentrancy in `selfExecute`**: Since `selfExecute` is restricted to the contract itself and assuming proper implementation of `onlySelf`, the risk here is low if the contract is correctly configured. However, it's worth noting that `selfExecute` is not protected by `nonReentrant`.\n\n2. **Gas Limit**: The check for `gasLimit` is reasonable but might not cover all edge cases due to the dynamic nature of gas costs.\n\n3. **Delegate Call**: If `IDelegatedExtension.handleSequenceDelegateCall` is properly validated and implemented, the risk is mitigated. However, any vulnerability in the delegate call target could be critical.\n\n### Assessment\n\n```json\n{\n  \"verdict\": \"vulnerable\",\n  \"confidence\": 0.7,\n  \"vulnerabilities\": [\n    {\n      \"type\": \"Reentrancy Risk\",\n      \"severity\": \"medium\",\n      \"vulnerable_function\": \"selfExecute\",\n      \"location\": \"Calls.sol\",\n      \"explanation\": \"selfExecute is not marked as nonReentrant, potentially allowing reentrancy attacks if not properly guarded by the inheriting contract.\",\n      \"attack_scenario\": \"An attacker exploits a vulnerability in a contract that inherits from Calls and uses selfExecute in a way that allows reentrancy.\",\n      \"suggested_fix\": \"Mark selfExecute as nonReentrant or ensure that any contract inheriting from Calls properly guards against reentrancy.\"\n    },\n    {\n      \"type\": \"Gas Limit Issue\",\n      \"severity\": \"low\",\n      \"vulnerable_function\": \"_execute\",\n      \"location\": \"Calls.sol\",\n      \"explanation\": \"The gas limit check does not account for the gas cost of operations before the call, potentially leading to out-of-gas errors.\",\n      \"attack_scenario\": \"A call fails due to out-of-gas because the gas limit check is too optimistic.\",\n      \"suggested_fix\": \"Consider adding a buffer to the gas limit check or accounting for the gas cost of preceding operations.\"\n    },\n    {\n      \"type\": \"Delegate Call Security\",\n      \"severity\": \"high\",\n      \"vulnerable_function\": \"_execute\",\n      \"location\": \"Calls.sol\",\n      \"explanation\": \"The use of delegatecall with potentially untrusted data can lead to arbitrary code execution if not properly validated.\",\n      \"attack_scenario\": \"An attacker manipulates the delegate call data to execute malicious code.\",\n      \"suggested_fix\": \"Ensure that IDelegatedExtension.handleSequenceDelegateCall is properly validated and secure. Limit the use of delegatecall to trusted targets.\"\n    }\n  ],\n  \"overall_explanation\": \"The contract has several potential issues, primarily related to reentrancy protection for selfExecute, gas limit checks, and the security of delegate calls. While the contract is well-structured, these issues need to be addressed to ensure security.\"\n}\n```\n\nThis assessment highlights potential vulnerabilities and areas for improvement in the contract, focusing on reentrancy, gas handling, and delegate call security."
  },
  "context_info": {
    "has_context_files": false,
    "context_file_count": 0,
    "has_protocol_doc": true
  },
  "api_metrics": {
    "input_tokens": 1662,
    "output_tokens": 1254,
    "latency_ms": 26159.02328491211
  }
}