{
  "sample_id": "gs_014",
  "dataset": "gs",
  "prompt_type": "context_protocol_cot_naturalistic",
  "model": "llama-4-maverick",
  "timestamp": "2026-01-05T15:31:08.863642+00:00",
  "ground_truth": {
    "is_vulnerable": true,
    "vulnerability_type": "logic_error",
    "vulnerable_functions": [
      "_withdrawActiveVotingPower"
    ],
    "severity": "medium",
    "description": "The isProposalOpen() function returns true if a proposal is open for voting. It returns false if it's too late OR too early for voting. But in _withdrawActiveVotingPower() at line 225, it was being used as an 'isProposalStillOpen()' function, forgetting that it will also be false when the proposal hasn't started yet. This means proposals with future start dates get incorrectly removed from knownProposalIds tracking.",
    "root_cause": "The isProposalOpen() function returns true if a proposal is open for voting. It returns false if it's too late OR too early for voting. But in _withdrawActiveVotingPower() at line 225, it was being used as an 'isProposalStillOpen()' function, forgetting that it will also be false when the proposal hasn't started yet. This means proposals with future start dates get incorrectly removed from knownProposalIds tracking.",
    "attack_scenario": "1. A proposal is created with a future start date (e.g., starts in 1 week).\n2. User calls unlock() before the proposal starts.\n3. _withdrawActiveVotingPower() is called at line 135.\n4. Line 225: plugin.isProposalOpen(_proposalId) returns false (proposal hasn't started).\n5. Line 226: knownProposalIds.remove(_proposalId) - proposal removed from tracking.\n6. Proposal starts a week later, user votes.\n7. User calls unlock() again - vote isn't cleared because proposal isn't tracked.\n8. User withdraws tokens while still having active votes.",
    "fix_description": "Create and use an isProposalEnded() function specifically for this use case. It should return true only if the proposal has actually ended (endDate passed or executed), not just because it hasn't started.",
    "language": "solidity"
  },
  "prediction": {
    "verdict": "vulnerable",
    "confidence": 0.8,
    "vulnerabilities": [
      {
        "type": "Potential Gas Limit Issue",
        "severity": "high",
        "vulnerable_function": "unlock()",
        "location": "Within the _withdrawActiveVotingPower() loop",
        "explanation": "The contract iterates over all known proposal IDs when unlocking tokens, which could lead to a gas limit issue if there are many proposals.",
        "attack_scenario": "A user attempts to unlock their tokens but fails due to the gas limit being exceeded because they have voted on many proposals.",
        "suggested_fix": "Implement a mechanism to limit the number of proposals a user can vote on or batch the clearing of votes to avoid gas limit issues."
      },
      {
        "type": "Reentrancy Risk",
        "severity": "medium",
        "vulnerable_function": "_withdrawActiveVotingPower()",
        "location": "Within the call to ILockToVote(address(plugin)).clearVote(_proposalId, msg.sender)",
        "explanation": "The external call to clearVote could potentially be reentrant.",
        "attack_scenario": "A malicious plugin contract reenters the LockManagerBase contract, potentially draining funds or causing unintended behavior.",
        "suggested_fix": "Ensure that the state is updated before making external calls (following the Checks-Effects-Interactions pattern) and consider using reentrancy locks if necessary."
      }
    ],
    "overall_explanation": "The LockManagerBase contract is generally well-structured but has potential issues related to gas limits and reentrancy. Addressing these concerns is crucial for the contract's reliability and security."
  },
  "parsing": {
    "success": true,
    "errors": [],
    "raw_response": "### Step 1: Understand What They're Building\n\nThe provided smart contract is `LockManagerBase`, an abstract contract designed to manage token locking for voting purposes within the Aragon protocol. It acts as a vault for locked tokens used across multiple plugins and proposals. The contract tracks user participation in active proposals, manages the lifecycle of locked tokens in relation to voting, and ensures that tokens cannot be unlocked while votes are still active.\n\n### Step 2: Trace the Code Flow\n\n1. **Locking Tokens**: Users can lock tokens into the contract using `lock()` or `lock(uint256 _amount)`. The `_lock()` function is responsible for transferring tokens from the user to the contract and updating the user's locked balance.\n\n2. **Voting**: Users can vote on proposals using `vote(uint256 _proposalId, IMajorityVoting.VoteOption _voteOption)` or `lockAndVote(uint256 _proposalId, IMajorityVoting.VoteOption _voteOption)` which combines locking tokens and voting.\n\n3. **Unlocking Tokens**: Users can unlock their tokens using `unlock()`. This function checks if the user has any active votes and clears them before transferring the locked tokens back to the user.\n\n4. **Proposal Management**: The contract keeps track of active proposal IDs. When a proposal is created, `proposalCreated(uint256 _proposalId)` is called by the plugin to add the proposal ID to the list of known proposals. When a proposal ends, `proposalEnded(uint256 _proposalId)` is called to remove the proposal ID from the list.\n\n### Step 3: Look for Potential Issues\n\n1. **Reentrancy Risk**: The contract uses the `_withdrawActiveVotingPower()` function within `unlock()`, which calls `ILockToVote(address(plugin)).clearVote(_proposalId, msg.sender)`. This external call could potentially be reentrant if the plugin contract is malicious or vulnerable.\n\n2. **Gas Limit**: The `_withdrawActiveVotingPower()` function iterates over all known proposal IDs. If the number of proposals is large, this could lead to a gas limit issue, potentially making it impossible for users to unlock their tokens.\n\n3. **Plugin Validation**: The contract checks if the plugin address supports the required interfaces during `setPluginAddress(ILockToGovernBase _newPluginAddress)`. However, it does not validate the plugin's behavior beyond interface support.\n\n### Step 4: Validate Concerns\n\n1. **Reentrancy Risk**: To mitigate reentrancy, the contract should follow the Checks-Effects-Interactions pattern. In `unlock()`, it first checks conditions and then effects the state change (resetting `lockedBalances[msg.sender]`) before making external calls.\n\n2. **Gas Limit**: The potential gas limit issue in `_withdrawActiveVotingPower()` is significant. A large number of proposals could make `unlock()` unusable. Consider implementing a mechanism to limit the number of proposals a user can vote on or to batch the clearing of votes.\n\n### Assessment\n\n```json\n{\n  \"verdict\": \"vulnerable\",\n  \"confidence\": 0.8,\n  \"vulnerabilities\": [\n    {\n      \"type\": \"Potential Gas Limit Issue\",\n      \"severity\": \"high\",\n      \"vulnerable_function\": \"unlock()\",\n      \"location\": \"Within the _withdrawActiveVotingPower() loop\",\n      \"explanation\": \"The contract iterates over all known proposal IDs when unlocking tokens, which could lead to a gas limit issue if there are many proposals.\",\n      \"attack_scenario\": \"A user attempts to unlock their tokens but fails due to the gas limit being exceeded because they have voted on many proposals.\",\n      \"suggested_fix\": \"Implement a mechanism to limit the number of proposals a user can vote on or batch the clearing of votes to avoid gas limit issues.\"\n    },\n    {\n      \"type\": \"Reentrancy Risk\",\n      \"severity\": \"medium\",\n      \"vulnerable_function\": \"_withdrawActiveVotingPower()\",\n      \"location\": \"Within the call to ILockToVote(address(plugin)).clearVote(_proposalId, msg.sender)\",\n      \"explanation\": \"The external call to clearVote could potentially be reentrant.\",\n      \"attack_scenario\": \"A malicious plugin contract reenters the LockManagerBase contract, potentially draining funds or causing unintended behavior.\",\n      \"suggested_fix\": \"Ensure that the state is updated before making external calls (following the Checks-Effects-Interactions pattern) and consider using reentrancy locks if necessary.\"\n    }\n  ],\n  \"overall_explanation\": \"The LockManagerBase contract is generally well-structured but has potential issues related to gas limits and reentrancy. Addressing these concerns is crucial for the contract's reliability and security.\"\n}\n```"
  },
  "context_info": {
    "has_context_files": true,
    "context_file_count": 1,
    "has_protocol_doc": true
  },
  "api_metrics": {
    "input_tokens": 4590,
    "output_tokens": 967,
    "latency_ms": 11399.554014205933
  }
}