{
  "sample_id": "gs_007",
  "dataset": "gs",
  "prompt_type": "context_protocol_cot_naturalistic",
  "model": "llama-4-maverick",
  "timestamp": "2026-01-05T16:48:40.318748+00:00",
  "ground_truth": {
    "is_vulnerable": true,
    "vulnerability_type": "logic_error",
    "vulnerable_functions": [
      "_claimFees"
    ],
    "severity": "medium",
    "description": "_claimFees() sweeps the entire balance of `token0`/`token1` after `collectFees()`, stealing rewards if `rewardToken` matches `token0` or `token1`. Impact: Bribe contract receives staking rewards instead of fees.",
    "root_cause": "_claimFees() sweeps the entire balance of `token0`/`token1` after `collectFees()`, stealing rewards if `rewardToken` matches `token0` or `token1`. Impact: Bribe contract receives staking rewards instead of fees.",
    "attack_scenario": "A test deposits 10 HYBR rewards, adds 0.1 HYBR fees, and `claimFees()` sweeps all 10.1 HYBR to the bribe contract.",
    "fix_description": "Transfer only the difference in balance before/after `collectFees()`; add access control to `claimFees`. Status: Mitigation confirmed.",
    "language": "solidity"
  },
  "prediction": {
    "verdict": "safe",
    "confidence": 0.9,
    "vulnerabilities": [
      {
        "type": "Reentrancy Risk",
        "severity": "medium",
        "vulnerable_function": "_claimFees",
        "location": "contracts/GaugeCL.sol#L434-L451",
        "explanation": "External call to bribe contract could potentially be reentrant.",
        "attack_scenario": "A malicious bribe contract could reenter the gauge contract.",
        "suggested_fix": "Ensure bribe contracts are secure and consider using a reentrancy lock or checks-effects-interactions pattern."
      },
      {
        "type": "Approval Issue",
        "severity": "low",
        "vulnerable_function": "_getReward",
        "location": "contracts/GaugeCL.sol#L373-L380",
        "explanation": "Approval is not reset to zero before setting a new amount.",
        "attack_scenario": "If `rHYBR` contract doesn't handle approvals correctly, it could lead to issues.",
        "suggested_fix": "Reset approval to zero before setting a new amount: `rewardToken.safeApprove(rHYBR, 0); rewardToken.safeApprove(rHYBR, rewardAmount);`"
      },
      {
        "type": "Lack of Event Emission",
        "severity": "low",
        "vulnerable_function": "setInternalBribe",
        "location": "contracts/GaugeCL.sol#L486-L489",
        "explanation": "Important state change does not emit an event.",
        "attack_scenario": "Off-chain tracking of state changes becomes difficult.",
        "suggested_fix": "Emit an event when `internal_bribe` is updated: `emit InternalBribeUpdated(_int);`"
      }
    ],
    "overall_explanation": "The contract is generally well-structured and follows best practices. However, there are a few areas that require attention to mitigate potential risks."
  },
  "parsing": {
    "success": true,
    "errors": [],
    "raw_response": "### Step 1: Understand What They're Building\n\nThe contract being reviewed is `GaugeCL`, a gauge contract for concentrated liquidity pools in the Hybra Finance protocol. It handles both reward distribution and trading fee collection. The main functionalities include:\n\n1. Collecting trading fees from the underlying concentrated liquidity pool.\n2. Distributing these fees to bribe contracts that incentivize veNFT voters.\n3. Managing staking rewards and trading fee distribution.\n4. Periodic collection and forwarding of fees.\n\n### Step 2: Trace the Code Flow\n\nThe main functions and their flows are as follows:\n\n1. **Deposit**: Users deposit their NFTs (representing liquidity positions) into the gauge. The gauge stakes the liquidity in the underlying pool and tracks the user's stake.\n2. **Withdraw**: Users can withdraw their NFTs. The gauge updates the rewards, claims fees, and unstakes the liquidity from the pool.\n3. **Get Reward**: The gauge manager can trigger a reward distribution for a user's NFT.\n4. **Notify Reward Amount**: The distribution contract notifies the gauge of new reward amounts, updating the reward rate and reserve.\n5. **Claim Fees**: The gauge claims fees from the underlying pool and distributes them to bribe contracts.\n\n### Step 3: Look for Potential Issues\n\nSeveral potential issues were identified during the review:\n\n1. **Reentrancy Protection**: The contract uses `ReentrancyGuard` from OpenZeppelin, which is a good practice. However, the `onERC721Received` function is marked as `pure` and does not interact with external contracts, so it's not a reentrancy risk.\n\n2. **External Calls**: The contract makes several external calls, including to `nonfungiblePositionManager`, `clPool`, `rHYBR`, and bribe contracts. These calls are generally safe due to the use of `SafeERC20` and checks on return values.\n\n3. **Input Validation**: Most functions have appropriate input validation (e.g., checking for zero liquidity, valid token IDs).\n\n4. **Emergency Mode**: The contract has an emergency mode that can be activated by the owner. This is a good practice for pausing critical functions in case of an issue.\n\n### Step 4: Validate Concerns\n\nUpon closer inspection, several specific concerns were identified:\n\n1. **Unprotected External Call in `_claimFees`**: The function `IBribe(internal_bribe).notifyRewardAmount(_token0, _fees0);` and `IBribe(internal_bribe).notifyRewardAmount(_token1, _fees1);` could potentially be reentrancy risks if the bribe contract is malicious or vulnerable. Although the contract uses `nonReentrant`, the risk is mitigated but it's worth noting that the order of operations (approving and then calling `notifyRewardAmount`) could be problematic if not handled correctly in the bribe contract.\n\n2. **Potential Issue with `rewardToken.safeApprove(rHYBR, rewardAmount);`**: The approval is not reset to zero before setting a new approval amount. This could be problematic if `rHYBR` is a contract that doesn't handle this correctly, although most modern ERC20 implementations handle this properly.\n\n3. **Lack of Event Emission for Important State Changes**: Some important state changes (like updating `internal_bribe`) do not emit events. This makes it harder to track changes off-chain.\n\n### Assessment\n\n```json\n{\n  \"verdict\": \"safe\",\n  \"confidence\": 0.9,\n  \"vulnerabilities\": [\n    {\n      \"type\": \"Reentrancy Risk\",\n      \"severity\": \"medium\",\n      \"vulnerable_function\": \"_claimFees\",\n      \"location\": \"contracts/GaugeCL.sol#L434-L451\",\n      \"explanation\": \"External call to bribe contract could potentially be reentrant.\",\n      \"attack_scenario\": \"A malicious bribe contract could reenter the gauge contract.\",\n      \"suggested_fix\": \"Ensure bribe contracts are secure and consider using a reentrancy lock or checks-effects-interactions pattern.\"\n    },\n    {\n      \"type\": \"Approval Issue\",\n      \"severity\": \"low\",\n      \"vulnerable_function\": \"_getReward\",\n      \"location\": \"contracts/GaugeCL.sol#L373-L380\",\n      \"explanation\": \"Approval is not reset to zero before setting a new amount.\",\n      \"attack_scenario\": \"If `rHYBR` contract doesn't handle approvals correctly, it could lead to issues.\",\n      \"suggested_fix\": \"Reset approval to zero before setting a new amount: `rewardToken.safeApprove(rHYBR, 0); rewardToken.safeApprove(rHYBR, rewardAmount);`\"\n    },\n    {\n      \"type\": \"Lack of Event Emission\",\n      \"severity\": \"low\",\n      \"vulnerable_function\": \"setInternalBribe\",\n      \"location\": \"contracts/GaugeCL.sol#L486-L489\",\n      \"explanation\": \"Important state change does not emit an event.\",\n      \"attack_scenario\": \"Off-chain tracking of state changes becomes difficult.\",\n      \"suggested_fix\": \"Emit an event when `internal_bribe` is updated: `emit InternalBribeUpdated(_int);`\"\n    }\n  ],\n  \"overall_explanation\": \"The contract is generally well-structured and follows best practices. However, there are a few areas that require attention to mitigate potential risks.\"\n}\n```\n\nThe contract is considered \"safe\" with a confidence level of 0.9 due to its adherence to best practices and the presence of only a few, relatively low-severity issues. Addressing these issues will further enhance the contract's security and robustness."
  },
  "context_info": {
    "has_context_files": false,
    "context_file_count": 0,
    "has_protocol_doc": true
  },
  "api_metrics": {
    "input_tokens": 3959,
    "output_tokens": 1169,
    "latency_ms": 25565.989017486572
  }
}