{
  "sample_id": "gs_023",
  "dataset": "gs",
  "prompt_type": "context_protocol_cot_naturalistic",
  "model": "llama-4-maverick",
  "timestamp": "2026-01-05T15:33:18.244873+00:00",
  "ground_truth": {
    "is_vulnerable": true,
    "vulnerability_type": "logic_error",
    "vulnerable_functions": [
      "getControlledBalance"
    ],
    "severity": "medium",
    "description": "LiquidityBuffer.getControlledBalance() sums balances of managers with isActive == true only. If an admin deactivates a manager via updatePositionManager()/togglePositionManagerStatus() before evacuating funds, any residual underlying on that manager is excluded from the total, causing under-reporting. Moreover, withdrawals from inactive managers are blocked (_withdrawETHFromManager and onlyPositionManagerContract both require the manager to be active), so the funds remain inaccessible until the manager is reactivated.",
    "root_cause": "LiquidityBuffer.getControlledBalance() sums balances of managers with isActive == true only. If an admin deactivates a manager via updatePositionManager()/togglePositionManagerStatus() before evacuating funds, any residual underlying on that manager is excluded from the total, causing under-reporting. Moreover, withdrawals from inactive managers are blocked (_withdrawETHFromManager and onlyPositionManagerContract both require the manager to be active), so the funds remain inaccessible until the manager is reactivated.",
    "attack_scenario": "1. Position manager 0 has 1000 ETH allocated to it in Aave\n2. Admin calls togglePositionManagerStatus(0) to deactivate manager 0 without first withdrawing funds\n3. getControlledBalance() now returns a value that is 1000 ETH less than the actual protocol holdings\n4. _withdrawETHFromManager(0, amount) reverts with LiquidityBuffer__ManagerInactive()\n5. The 1000 ETH is effectively locked and invisible to the protocol accounting until admin reactivates the manager",
    "fix_description": "Check underlying balance before deactivation and use a dedicated forceDeactivate() if it's not zero. This was fixed in commit 93280383c0858c559270ceaec6f5d04f9be0a8e7.",
    "language": "solidity"
  },
  "prediction": {
    "verdict": "vulnerable",
    "confidence": 0.8,
    "vulnerabilities": [
      {
        "type": "Unbounded Loop",
        "severity": "medium",
        "vulnerable_function": "getControlledBalance()",
        "location": "View function getControlledBalance()",
        "explanation": "This function loops through all position managers, which could lead to high gas costs if the number of managers is large.",
        "attack_scenario": "An attacker could manipulate the number of position managers to make this function unusable due to gas limits.",
        "suggested_fix": "Consider caching the total balance or implementing a pagination mechanism."
      },
      {
        "type": "Reentrancy",
        "severity": "low",
        "vulnerable_function": "receiveETHFromPositionManager()",
        "location": "Payable function receiveETHFromPositionManager()",
        "explanation": "Although the function doesn't perform any state changes or external calls, it's marked as payable and onlyPositionManagerContract. However, the lack of any logic might not be an issue but could be considered for removal or documentation.",
        "attack_scenario": "None directly, but it's an unusual pattern.",
        "suggested_fix": "Consider adding a comment explaining why this function is necessary or removing it if not used."
      },
      {
        "type": "Missing Event",
        "severity": "low",
        "vulnerable_function": "receiveETHFromPositionManager()",
        "location": "Payable function receiveETHFromPositionManager()",
        "explanation": "The function doesn't emit an event when receiving ETH, making it harder to track.",
        "attack_scenario": "None, but it's a good practice to emit events for significant state changes or receipts.",
        "suggested_fix": "Emit an event when ETH is received."
      }
    ],
    "overall_explanation": "The contract is generally well-structured, but there are a few areas that need improvement, such as the unbounded loop in getControlledBalance() and the unusual pattern in receiveETHFromPositionManager(). Addressing these issues will improve the contract's security and usability."
  },
  "parsing": {
    "success": true,
    "errors": [],
    "raw_response": "### Step 1: Understand What They're Building\n\nThe LiquidityBuffer contract is part of the Mantle mETH liquid staking protocol's integration with Aave. It manages ETH liquidity between the staking protocol and yield-generating position managers. The contract handles auto-allocation of deposits, tracks controlled balances, and manages position manager lifecycle.\n\n### Step 2: Trace the Code Flow\n\nThe main functions of the contract include:\n\n1. Receiving ETH deposits from the staking contract.\n2. Auto-allocating funds to a default position manager.\n3. Tracking total ETH controlled across multiple position managers.\n4. Managing position managers (activation/deactivation by administrators).\n5. Supporting withdrawal of funds from position managers back to the buffer.\n\nKey functions to note:\n\n- `depositETH()`: Receives ETH from the staking contract and allocates it to the default position manager if `shouldExecuteAllocation` is true.\n- `withdrawAndReturn()`: Withdraws ETH from a position manager and returns it to the staking contract.\n- `allocateETHToManager()`: Allocates ETH to a specified position manager.\n- `withdrawETHFromManager()`: Withdraws ETH from a position manager.\n- `returnETHToStaking()`: Returns ETH to the staking contract.\n- `claimInterestFromManager()`: Claims interest from a position manager.\n- `topUpInterestToStaking()`: Tops up interest to the staking contract.\n\n### Step 3: Look for Potential Issues\n\n1. **Reentrancy Risk**: The contract uses the Checks-Effects-Interactions pattern in most functions, which mitigates reentrancy risks. However, it's essential to verify that all external calls are made after state updates.\n\n2. **Unbounded Loops**: The `getControlledBalance()` function loops through all position managers to calculate the total balance. This could become gas-expensive if the number of position managers grows significantly. Consider adding a mechanism to limit or cache this information.\n\n3. **Input Validation**: The contract generally does a good job of validating inputs. However, it's crucial to ensure that all possible edge cases are covered.\n\n4. **Role Management**: The contract uses OpenZeppelin's AccessControlEnumerableUpgradeable for role management. Ensure that roles are properly managed and that there are no unnecessary or overly permissive roles.\n\n5. **Pause Functionality**: The contract checks for pause status in several functions. Ensure that the pause functionality is correctly implemented and that it doesn't introduce any unintended behavior.\n\n### Step 4: Validate Concerns\n\nUpon closer inspection, several potential issues are identified:\n\n1. **Unbounded Loop in `getControlledBalance()`**:\n   - **Type**: Unbounded Loop\n   - **Severity**: Medium\n   - **Vulnerable Function**: `getControlledBalance()`\n   - **Location**: View function `getControlledBalance()`\n   - **Explanation**: This function loops through all position managers, which could lead to high gas costs if the number of managers is large.\n   - **Attack Scenario**: An attacker could manipulate the number of position managers to make this function unusable due to gas limits.\n   - **Suggested Fix**: Consider caching the total balance or implementing a pagination mechanism.\n\n2. **Potential Reentrancy in `receiveETHFromPositionManager()`**:\n   - **Type**: Reentrancy\n   - **Severity**: Low\n   - **Vulnerable Function**: `receiveETHFromPositionManager()`\n   - **Location**: Payable function `receiveETHFromPositionManager()`\n   - **Explanation**: Although the function doesn't perform any state changes or external calls, it's marked as `payable` and `onlyPositionManagerContract`. However, the lack of any logic might not be an issue but could be considered for removal or documentation.\n   - **Attack Scenario**: None directly, but it's an unusual pattern.\n   - **Suggested Fix**: Consider adding a comment explaining why this function is necessary or removing it if not used.\n\n3. **Lack of Event Emission in `receiveETHFromPositionManager()`**:\n   - **Type**: Missing Event\n   - **Severity**: Low\n   - **Vulnerable Function**: `receiveETHFromPositionManager()`\n   - **Location**: Payable function `receiveETHFromPositionManager()`\n   - **Explanation**: The function doesn't emit an event when receiving ETH, making it harder to track.\n   - **Attack Scenario**: None, but it's a good practice to emit events for significant state changes or receipts.\n   - **Suggested Fix**: Emit an event when ETH is received.\n\n### Assessment\n\n```json\n{\n  \"verdict\": \"vulnerable\",\n  \"confidence\": 0.8,\n  \"vulnerabilities\": [\n    {\n      \"type\": \"Unbounded Loop\",\n      \"severity\": \"medium\",\n      \"vulnerable_function\": \"getControlledBalance()\",\n      \"location\": \"View function getControlledBalance()\",\n      \"explanation\": \"This function loops through all position managers, which could lead to high gas costs if the number of managers is large.\",\n      \"attack_scenario\": \"An attacker could manipulate the number of position managers to make this function unusable due to gas limits.\",\n      \"suggested_fix\": \"Consider caching the total balance or implementing a pagination mechanism.\"\n    },\n    {\n      \"type\": \"Reentrancy\",\n      \"severity\": \"low\",\n      \"vulnerable_function\": \"receiveETHFromPositionManager()\",\n      \"location\": \"Payable function receiveETHFromPositionManager()\",\n      \"explanation\": \"Although the function doesn't perform any state changes or external calls, it's marked as payable and onlyPositionManagerContract. However, the lack of any logic might not be an issue but could be considered for removal or documentation.\",\n      \"attack_scenario\": \"None directly, but it's an unusual pattern.\",\n      \"suggested_fix\": \"Consider adding a comment explaining why this function is necessary or removing it if not used.\"\n    },\n    {\n      \"type\": \"Missing Event\",\n      \"severity\": \"low\",\n      \"vulnerable_function\": \"receiveETHFromPositionManager()\",\n      \"location\": \"Payable function receiveETHFromPositionManager()\",\n      \"explanation\": \"The function doesn't emit an event when receiving ETH, making it harder to track.\",\n      \"attack_scenario\": \"None, but it's a good practice to emit events for significant state changes or receipts.\",\n      \"suggested_fix\": \"Emit an event when ETH is received.\"\n    }\n  ],\n  \"overall_explanation\": \"The contract is generally well-structured, but there are a few areas that need improvement, such as the unbounded loop in getControlledBalance() and the unusual pattern in receiveETHFromPositionManager(). Addressing these issues will improve the contract's security and usability.\"\n}\n```"
  },
  "context_info": {
    "has_context_files": false,
    "context_file_count": 0,
    "has_protocol_doc": true
  },
  "api_metrics": {
    "input_tokens": 5093,
    "output_tokens": 1372,
    "latency_ms": 11397.429943084717
  }
}