{
  "sample_id": "gs_013",
  "dataset": "gs",
  "prompt_type": "context_protocol_cot_naturalistic",
  "model": "llama-4-maverick",
  "timestamp": "2026-01-05T15:30:57.459367+00:00",
  "ground_truth": {
    "is_vulnerable": true,
    "vulnerability_type": "logic_error",
    "vulnerable_functions": [
      "_incomingTokenBalance"
    ],
    "severity": "medium",
    "description": "The lock() function intends to lock the user's entire approved balance, but this will fail for the most common case: Most users give contracts they interact with an unlimited allowance by setting it to type(uint256).max. The _incomingTokenBalance() function at line 32 returns just 'erc20Token.allowance(msg.sender, address(this))' which would be type(uint256).max for unlimited approvals. The lock() function then attempts to transfer this impossible amount.",
    "root_cause": "The lock() function intends to lock the user's entire approved balance, but this will fail for the most common case: Most users give contracts they interact with an unlimited allowance by setting it to type(uint256).max. The _incomingTokenBalance() function at line 32 returns just 'erc20Token.allowance(msg.sender, address(this))' which would be type(uint256).max for unlimited approvals. The lock() function then attempts to transfer this impossible amount.",
    "attack_scenario": "1. User approves LockManager with unlimited allowance: approve(lockManager, type(uint256).max).\n2. User calls lock() without specifying an amount.\n3. _incomingTokenBalance() returns type(uint256).max.\n4. _doLockTransfer attempts to transfer type(uint256).max tokens.\n5. Transaction reverts because user doesn't have that many tokens.\n6. User cannot use the standard lock() function.",
    "fix_description": "Have _incomingTokenBalance() return either the actual balance or the allowance depending on whichever is smallest: 'return (allowance >= balance) ? balance : allowance;'",
    "language": "solidity"
  },
  "prediction": {
    "verdict": "safe",
    "confidence": 0.9,
    "vulnerabilities": [
      {
        "type": "Non-standard Token Behavior",
        "severity": "medium",
        "vulnerable_function": "_doLockTransfer, _doUnlockTransfer",
        "location": "LockManagerERC20.sol",
        "explanation": "The contract assumes standard ERC20 token behavior. Non-standard tokens (e.g., with transfer fees) could cause unexpected behavior.",
        "attack_scenario": "If a token with a transfer fee is used, the actual amount locked/unlocked might differ from the expected amount, potentially causing accounting discrepancies.",
        "suggested_fix": "Consider adding checks for non-standard token behavior or explicitly documenting the assumption that the token must be standard ERC20 compliant."
      },
      {
        "type": "Input Validation",
        "severity": "low",
        "vulnerable_function": "constructor",
        "location": "LockManagerERC20.sol",
        "explanation": "The constructor does not validate if `_token` is a non-zero address.",
        "attack_scenario": "Passing a zero address could lead to unexpected behavior or errors.",
        "suggested_fix": "Add a check to ensure `_token` is not the zero address."
      }
    ],
    "overall_explanation": "The contract is generally well-structured and follows good practices. However, there are potential issues related to non-standard token behavior and input validation in the constructor."
  },
  "parsing": {
    "success": true,
    "errors": [],
    "raw_response": "### Step 1: Understand What They're Building\n\nThe contract being reviewed is `LockManagerERC20`, an ERC20-specific implementation of the Aragon Lock-to-Vote lock manager. It's designed to handle the custody of users' ERC20 tokens when they lock them to participate in DAO governance. The contract tracks locked balances and manages token transfers between users and the contract.\n\n### Step 2: Trace the Code Flow\n\n1. **Constructor**: The contract is initialized with `LockManagerSettings` and the address of the ERC20 token that users can lock. The ERC20 token address is stored in the `erc20Token` variable.\n2. **Locking Tokens**: When a user locks tokens, the contract calls `_doLockTransfer`, which transfers tokens from the user to the contract using `erc20Token.transferFrom`. The amount to be transferred is checked against the user's allowance in `_incomingTokenBalance` using `erc20Token.allowance`.\n3. **Unlocking Tokens**: When a user unlocks tokens, the contract calls `_doUnlockTransfer`, which transfers tokens from the contract to the user using `erc20Token.transfer`.\n4. **Token Function**: The `token` function returns the address of the ERC20 token stored in `erc20Token`.\n\n### Step 3: Look for Potential Issues\n\n1. **Reentrancy**: The contract uses OpenZeppelin's `IERC20`, which is generally considered safe. However, the `_doUnlockTransfer` function makes an external call to `erc20Token.transfer`, which could potentially be reentrant if the token contract is malicious or has a fallback function that calls back into this contract. However, the contract does not have a state change after the external call that could be exploited in a reentrancy attack in the context of this specific contract's functionality.\n   \n2. **Token Safety**: The contract assumes that `erc20Token` is a standard ERC20 token. However, some tokens (like USDT) have non-standard behavior (e.g., returning `true` on success but not reverting on failure for `transfer`/`transferFrom`), or they might have a fee on transfer, which could affect the contract's behavior.\n\n3. **Allowance Check**: The `_incomingTokenBalance` function checks the allowance of the user. This is a good practice to prevent transferring more tokens than the user has allowed.\n\n4. **Input Validation**: The contract does not explicitly validate if `_token` is a non-zero address or if `_settings` are valid. While `LockManagerBase` might handle some of these checks, it's worth noting.\n\n### Step 4: Validate Concerns\n\n1. **Reentrancy Concern**: Although there's an external call in `_doUnlockTransfer`, the state changes related to locking/unlocking are handled in `LockManagerBase`, and the specific ERC20 transfer is the last operation. Thus, the risk is mitigated as long as `LockManagerBase` correctly handles state changes before calling `_doUnlockTransfer`.\n\n2. **Non-standard Tokens**: If the token has a fee on transfer or behaves non-standardly, it could lead to unexpected behavior. For example, if a token takes a fee on transfer, the amount received by the contract might be less than `_amount`, potentially causing discrepancies in accounting.\n\n### Assessment\n\n```json\n{\n  \"verdict\": \"safe\",\n  \"confidence\": 0.9,\n  \"vulnerabilities\": [\n    {\n      \"type\": \"Non-standard Token Behavior\",\n      \"severity\": \"medium\",\n      \"vulnerable_function\": \"_doLockTransfer, _doUnlockTransfer\",\n      \"location\": \"LockManagerERC20.sol\",\n      \"explanation\": \"The contract assumes standard ERC20 token behavior. Non-standard tokens (e.g., with transfer fees) could cause unexpected behavior.\",\n      \"attack_scenario\": \"If a token with a transfer fee is used, the actual amount locked/unlocked might differ from the expected amount, potentially causing accounting discrepancies.\",\n      \"suggested_fix\": \"Consider adding checks for non-standard token behavior or explicitly documenting the assumption that the token must be standard ERC20 compliant.\"\n    },\n    {\n      \"type\": \"Input Validation\",\n      \"severity\": \"low\",\n      \"vulnerable_function\": \"constructor\",\n      \"location\": \"LockManagerERC20.sol\",\n      \"explanation\": \"The constructor does not validate if `_token` is a non-zero address.\",\n      \"attack_scenario\": \"Passing a zero address could lead to unexpected behavior or errors.\",\n      \"suggested_fix\": \"Add a check to ensure `_token` is not the zero address.\"\n    }\n  ],\n  \"overall_explanation\": \"The contract is generally well-structured and follows good practices. However, there are potential issues related to non-standard token behavior and input validation in the constructor.\"\n}\n```\n\nThe contract is considered \"safe\" with a confidence level of 0.9 because it follows standard practices and the identified vulnerabilities are more related to potential edge cases and assumptions about the token's behavior rather than direct security flaws in the contract's logic."
  },
  "context_info": {
    "has_context_files": false,
    "context_file_count": 0,
    "has_protocol_doc": true
  },
  "api_metrics": {
    "input_tokens": 1066,
    "output_tokens": 1033,
    "latency_ms": 16870.61595916748
  }
}