{
  "sample_id": "gs_024",
  "dataset": "gs",
  "prompt_type": "context_protocol_cot_naturalistic",
  "model": "llama-4-maverick",
  "timestamp": "2026-01-05T15:33:39.176964+00:00",
  "ground_truth": {
    "is_vulnerable": true,
    "vulnerability_type": "front_running",
    "vulnerable_functions": [
      "unstakeRequestWithPermit"
    ],
    "severity": "medium",
    "description": "An attacker can read the v, r, s from the mempool and call mETH.permit() first, consuming the user's signature and updating the nonce. The subsequent user transaction Staking.unstakeRequestWithPermit() then reverts on the permit() call due to an invalidated signature/nonce, preventing the unstake flow from executing, even though allowance is already set.",
    "root_cause": "An attacker can read the v, r, s from the mempool and call mETH.permit() first, consuming the user's signature and updating the nonce. The subsequent user transaction Staking.unstakeRequestWithPermit() then reverts on the permit() call due to an invalidated signature/nonce, preventing the unstake flow from executing, even though allowance is already set.",
    "attack_scenario": "1. User submits unstakeRequestWithPermit() transaction with signature (v, r, s) to the mempool\n2. Attacker monitors mempool and extracts the permit signature parameters\n3. Attacker front-runs with a direct call to mETH.permit() using the extracted (v, r, s)\n4. The permit succeeds, consuming the user's nonce and setting the allowance\n5. User's original unstakeRequestWithPermit() transaction is mined\n6. The SafeERC20Upgradeable.safePermit() call inside unstakeRequestWithPermit() reverts because the nonce is already used\n7. User's unstake request fails even though the allowance was set",
    "fix_description": "Wrap the permit() invocation in a try-catch clause and proceed with the unstake if allowance is already sufficient, avoiding a hard revert when signatures are pre-consumed.",
    "language": "solidity"
  },
  "prediction": {
    "verdict": "vulnerable",
    "confidence": 0.8,
    "vulnerabilities": [
      {
        "type": "Input Validation",
        "severity": "medium",
        "vulnerable_function": "initializeV2",
        "location": "Staking.sol#L164",
        "explanation": "The function does not check if the provided ILiquidityBuffer address is zero.",
        "attack_scenario": "Setting liquidityBuffer to address(0) could lead to unintended behavior or errors when interacting with liquidityBuffer.",
        "suggested_fix": "Add a check to ensure the provided address is not zero."
      },
      {
        "type": "Event Emission",
        "severity": "low",
        "vulnerable_function": "initializeV2",
        "location": "Staking.sol#L164",
        "explanation": "The function does not emit an event when liquidityBuffer is set.",
        "attack_scenario": "Lack of transparency regarding changes to critical contract state.",
        "suggested_fix": "Emit an event when liquidityBuffer is set."
      },
      {
        "type": "Reentrancy",
        "severity": "high",
        "vulnerable_function": "unstakeRequest",
        "location": "Staking.sol#L204",
        "explanation": "Although SafeERC20Upgradeable is used, the interaction with unstakeRequestsManager could be a reentrancy point if not properly handled.",
        "attack_scenario": "If unstakeRequestsManager is not reentrancy-safe, it could lead to unexpected behavior or exploits.",
        "suggested_fix": "Ensure unstakeRequestsManager is reentrancy-safe or apply the checks-effects-interactions pattern."
      }
    ],
    "overall_explanation": "The contract is generally well-structured with proper access control and input validation. However, there are potential issues related to input validation in initializeV2, missing event emission, and potential reentrancy risks associated with external contract interactions."
  },
  "parsing": {
    "success": true,
    "errors": [],
    "raw_response": "### Step 1: Understand What They're Building\n\nThe contract is for a liquid staking protocol on Mantle, allowing users to stake ETH and receive mETH tokens representing their share of staked ETH plus accrued rewards. The contract supports permit-based approvals for gasless unstaking requests.\n\n### Step 2: Trace the Code Flow\n\n1. **Staking Flow**:\n   - Users call `stake()` with ETH, receiving mETH tokens in return.\n   - The ETH is added to `unallocatedETH`.\n\n2. **Unstaking Flow**:\n   - Users call `unstakeRequest()` or `unstakeRequestWithPermit()` to initiate an unstake.\n   - mETH tokens are locked, and an unstake request is created via `unstakeRequestsManager`.\n   - The request includes the amount of ETH requested and mETH locked.\n\n3. **Returns Handling**:\n   - The contract receives returns from the returns aggregator and liquidity buffer, adding them to `unallocatedETH`.\n\n4. **Exchange Rate**:\n   - The exchange rate between mETH and ETH is adjusted based on the total controlled ETH, which includes staked ETH, returns, and ETH in various states (unallocated, allocated for deposits, etc.).\n\n### Step 3: Look for Potential Issues\n\n1. **Reentrancy**:\n   - The contract uses `SafeERC20Upgradeable` for token transfers, which is reentrancy-safe.\n   - However, the interaction with `unstakeRequestsManager` and `liquidityBuffer` could potentially be reentrancy points if not properly handled in those contracts.\n\n2. **Rounding Errors**:\n   - The `ethToMETH` and `mETHToETH` functions use `Math.mulDiv`, which is safe against rounding errors due to its rounding down behavior.\n\n3. **Access Control**:\n   - The contract properly uses OpenZeppelin's AccessControlEnumerableUpgradeable for role-based access control.\n   - Roles are correctly set during initialization.\n\n4. **Pause Functionality**:\n   - The contract checks pause status from `pauser` for staking and unstaking operations, which is a good practice.\n\n5. **Input Validation**:\n   - The contract validates inputs (e.g., minimum stake/unstake amounts, permit signatures).\n\n### Step 4: Validate Concerns\n\n1. **Potential Issue: Lack of Input Validation for `initializeV2`**:\n   - The `initializeV2` function does not check if `ILiquidityBuffer lb` is a zero address.\n\n2. **Potential Issue: Missing Event Emission for `initializeV2`**:\n   - The `initializeV2` function does not emit an event upon setting `liquidityBuffer`.\n\n3. **Potential Issue: Potential Reentrancy in External Calls**:\n   - Although `SafeERC20Upgradeable` is used, ensure that `unstakeRequestsManager` and `liquidityBuffer` contracts are reentrancy-safe.\n\n### Assessment\n\n```json\n{\n  \"verdict\": \"vulnerable\",\n  \"confidence\": 0.8,\n  \"vulnerabilities\": [\n    {\n      \"type\": \"Input Validation\",\n      \"severity\": \"medium\",\n      \"vulnerable_function\": \"initializeV2\",\n      \"location\": \"Staking.sol#L164\",\n      \"explanation\": \"The function does not check if the provided ILiquidityBuffer address is zero.\",\n      \"attack_scenario\": \"Setting liquidityBuffer to address(0) could lead to unintended behavior or errors when interacting with liquidityBuffer.\",\n      \"suggested_fix\": \"Add a check to ensure the provided address is not zero.\"\n    },\n    {\n      \"type\": \"Event Emission\",\n      \"severity\": \"low\",\n      \"vulnerable_function\": \"initializeV2\",\n      \"location\": \"Staking.sol#L164\",\n      \"explanation\": \"The function does not emit an event when liquidityBuffer is set.\",\n      \"attack_scenario\": \"Lack of transparency regarding changes to critical contract state.\",\n      \"suggested_fix\": \"Emit an event when liquidityBuffer is set.\"\n    },\n    {\n      \"type\": \"Reentrancy\",\n      \"severity\": \"high\",\n      \"vulnerable_function\": \"unstakeRequest\",\n      \"location\": \"Staking.sol#L204\",\n      \"explanation\": \"Although SafeERC20Upgradeable is used, the interaction with unstakeRequestsManager could be a reentrancy point if not properly handled.\",\n      \"attack_scenario\": \"If unstakeRequestsManager is not reentrancy-safe, it could lead to unexpected behavior or exploits.\",\n      \"suggested_fix\": \"Ensure unstakeRequestsManager is reentrancy-safe or apply the checks-effects-interactions pattern.\"\n    }\n  ],\n  \"overall_explanation\": \"The contract is generally well-structured with proper access control and input validation. However, there are potential issues related to input validation in initializeV2, missing event emission, and potential reentrancy risks associated with external contract interactions.\"\n}\n```"
  },
  "context_info": {
    "has_context_files": false,
    "context_file_count": 0,
    "has_protocol_doc": true
  },
  "api_metrics": {
    "input_tokens": 3232,
    "output_tokens": 1017,
    "latency_ms": 20928.258180618286
  }
}