{
  "sample_id": "gs_011",
  "dataset": "gs",
  "prompt_type": "context_protocol_cot_naturalistic",
  "model": "llama-4-maverick",
  "timestamp": "2026-01-05T15:30:10.635121+00:00",
  "ground_truth": {
    "is_vulnerable": true,
    "vulnerability_type": "flash_loan",
    "vulnerable_functions": [
      "vote"
    ],
    "severity": "high",
    "description": "If the token used by the LockManager can be flashloaned (or flashminted) and a proposal is created with the voting mode EarlyExecution, anyone could be able to 'early execute' it by flashloaning tokens, locking them, casting a YES vote to trigger early execution, unlocking tokens, and repaying the flashloan - all in one transaction. The vulnerable code is in LockToVotePlugin.vote() at lines 205-207 which calls _attemptEarlyExecution() when VotingMode.EarlyExecution is set.",
    "root_cause": "If the token used by the LockManager can be flashloaned (or flashminted) and a proposal is created with the voting mode EarlyExecution, anyone could be able to 'early execute' it by flashloaning tokens, locking them, casting a YES vote to trigger early execution, unlocking tokens, and repaying the flashloan - all in one transaction. The vulnerable code is in LockToVotePlugin.vote() at lines 205-207 which calls _attemptEarlyExecution() when VotingMode.EarlyExecution is set.",
    "attack_scenario": "1. Flashloan the needed amount.\n2. Lock the flashloaned amount via LockManager.lock().\n3. Cast a 'YES' vote via LockManager.vote() which triggers LockToVotePlugin._attemptEarlyExecution().\n4. Proposal executes immediately in same transaction.\n5. Unlock the tokens via LockManager.unlock().\n6. Repay the flashloan.",
    "fix_description": "Avoid allowing the early execution in the very same block that the vote has been made. This would require tracking the 'success' of a proposal in a separate flag, stored in the proposal struct. Alternatively, remove the EarlyExecution voting mode entirely.",
    "language": "solidity"
  },
  "prediction": {
    "verdict": "vulnerable",
    "confidence": 0.8,
    "vulnerabilities": [
      {
        "type": "Front-Running",
        "severity": "medium",
        "vulnerable_function": "vote",
        "location": "contracts/LockToVotePlugin.sol#L243",
        "explanation": "The vote function is potentially vulnerable to front-running attacks, where an attacker could intercept and reorder transactions.",
        "attack_scenario": "An attacker could front-run a user's vote transaction to change the vote outcome.",
        "suggested_fix": "Implement a commit-reveal scheme or use a secure voting mechanism that prevents front-running."
      },
      {
        "type": "Reentrancy",
        "severity": "low",
        "vulnerable_function": "_execute",
        "location": "contracts/LockToVotePlugin.sol#L423",
        "explanation": "Although the contract uses nonReentrant, the external call to lockManager.proposalEnded could potentially be reentrancy vulnerable if not properly guarded.",
        "attack_scenario": "If lockManager.proposalEnded is not properly secured, it could lead to reentrancy attacks.",
        "suggested_fix": "Ensure lockManager.proposalEnded is secure and consider using reentrancy guards if necessary."
      }
    ],
    "overall_explanation": "The LockToVotePlugin contract is generally well-structured but has potential vulnerabilities related to front-running and reentrancy. Implementing secure voting mechanisms and ensuring external calls are properly secured can mitigate these risks."
  },
  "parsing": {
    "success": true,
    "errors": [],
    "raw_response": "To assess the provided smart contract code, let's break down the analysis into the required steps.\n\n### Step 1: Understand What They're Building\n\nThe contract in question is `LockToVotePlugin`, which is part of the Aragon DAO ecosystem. It's designed to enable token-weighted governance where users must lock tokens to participate in voting. The plugin supports multiple voting modes, including early execution when sufficient support is reached before the voting period ends.\n\n### Step 2: Trace the Code Flow\n\n1. **Initialization**: The contract is initialized with `initialize`, setting up the DAO, lock manager, voting settings, target configuration, and plugin metadata.\n2. **Proposal Creation**: Proposals are created using `createProposal`, which requires the `CREATE_PROPOSAL_PERMISSION_ID` permission. It validates proposal dates and checks if there's any voting power.\n3. **Voting**: Users vote using `vote`, which requires the `LOCK_MANAGER_PERMISSION_ID` permission. It checks if the voter can vote based on their locked balance and the proposal's state.\n4. **Clearing Votes**: Votes can be cleared using `clearVote`, also requiring `LOCK_MANAGER_PERMISSION_ID`. It reverts if the proposal is not open or not in VoteReplacement mode.\n\n### Step 3: Look for Potential Issues\n\n1. **Reentrancy**: The contract uses the `nonReentrant` modifier from `MajorityVotingBase`, which should protect against reentrancy attacks in critical functions.\n2. **Permission Checks**: The contract properly checks for required permissions (`CREATE_PROPOSAL_PERMISSION_ID` and `LOCK_MANAGER_PERMISSION_ID`) before executing sensitive operations.\n3. **Input Validation**: The contract validates inputs, such as proposal dates and voting power, to prevent incorrect state changes.\n\n### Step 4: Validate Concerns\n\nUpon reviewing the code, several potential issues are identified:\n\n1. **Use of `unchecked` Increment**: The contract uses `unchecked` for incrementing loop counters, which is safe as long as the loop doesn't exceed `uint256` max value.\n2. **Potential for Front-Running**: The `vote` function could be vulnerable to front-running, where an attacker intercepts and reorders transactions to their advantage.\n3. **Lack of Two-Phase Withdrawal**: The `LockManagerBase` contract directly transfers tokens upon unlocking, which could be problematic if the recipient is a contract with a fallback function that reverts or consumes a lot of gas.\n\n### Assessment\n\n```json\n{\n  \"verdict\": \"vulnerable\",\n  \"confidence\": 0.8,\n  \"vulnerabilities\": [\n    {\n      \"type\": \"Front-Running\",\n      \"severity\": \"medium\",\n      \"vulnerable_function\": \"vote\",\n      \"location\": \"contracts/LockToVotePlugin.sol#L243\",\n      \"explanation\": \"The vote function is potentially vulnerable to front-running attacks, where an attacker could intercept and reorder transactions.\",\n      \"attack_scenario\": \"An attacker could front-run a user's vote transaction to change the vote outcome.\",\n      \"suggested_fix\": \"Implement a commit-reveal scheme or use a secure voting mechanism that prevents front-running.\"\n    },\n    {\n      \"type\": \"Reentrancy\",\n      \"severity\": \"low\",\n      \"vulnerable_function\": \"_execute\",\n      \"location\": \"contracts/LockToVotePlugin.sol#L423\",\n      \"explanation\": \"Although the contract uses nonReentrant, the external call to lockManager.proposalEnded could potentially be reentrancy vulnerable if not properly guarded.\",\n      \"attack_scenario\": \"If lockManager.proposalEnded is not properly secured, it could lead to reentrancy attacks.\",\n      \"suggested_fix\": \"Ensure lockManager.proposalEnded is secure and consider using reentrancy guards if necessary.\"\n    }\n  ],\n  \"overall_explanation\": \"The LockToVotePlugin contract is generally well-structured but has potential vulnerabilities related to front-running and reentrancy. Implementing secure voting mechanisms and ensuring external calls are properly secured can mitigate these risks.\"\n}\n```\n\nThis assessment highlights the importance of considering front-running and reentrancy vulnerabilities in the contract's design and implementation."
  },
  "context_info": {
    "has_context_files": true,
    "context_file_count": 2,
    "has_protocol_doc": true
  },
  "api_metrics": {
    "input_tokens": 8926,
    "output_tokens": 846,
    "latency_ms": 2260.266065597534
  }
}