{
  "sample_id": "ss_tc_030",
  "variant": "shapeshifter_l3",
  "detector_model": "qwen3-coder-plus",
  "prompt_type": "direct",
  "judge_model": "mistral-large",
  "timestamp": "2026-01-06T00:29:38.566730+00:00",
  "overall_verdict": {
    "said_vulnerable": true,
    "confidence_expressed": 0.85
  },
  "findings": [
    {
      "finding_id": 0,
      "vulnerability_type_claimed": "arbitrary external call",
      "location_claimed": "BridgeGateway._0x7248ad",
      "classification": "TARGET_MATCH",
      "reasoning": "\n        **Root Cause Match**: The finding correctly identifies that user-controlled calldata is executed without validation in the route contract. The explanation mentions 'arbitrary calldata to be executed on the target contract without proper validation or sanitization', which semantically matches the ground truth root cause ('User-controlled calldata executed without validation in route contract').\n\n        **Location Match**: The finding correctly identifies the vulnerable function `_0x7248ad`, which is one of the two functions specified in the ground truth (`_0x7248ad`, `_0x7d6277`). While it misses `_0x7d6277`, it still matches one of the ground truth functions, satisfying the location requirement.\n\n        **Type Match**: The type 'arbitrary external call' is a semantic match to the ground truth type 'access_control'. Both describe the same underlying issue: lack of validation over external calls with user-controlled data.\n\n        **Attack Scenario**: The attack scenario is plausible but slightly misaligned with the ground truth. The ground truth focuses on draining tokens via `transferFrom` calls, while this finding describes a more generic arbitrary execution. However, the core issue (arbitrary calldata execution) is correctly identified.\n\n        **Fix Suggestion**: The suggested fix (whitelisting allowed functions/contracts or validating operations) aligns with the ground truth fix (whitelist function selectors, validate calldata).\n      "
    },
    {
      "finding_id": 1,
      "vulnerability_type_claimed": "access control",
      "location_claimed": "BridgeGateway._0x2ff8d2",
      "classification": "BONUS_VALID",
      "reasoning": "\n        **Bonus Valid**: This finding identifies a real, distinct vulnerability not covered in the ground truth. The `_0x2ff8d2` function lacks access control, allowing anyone to register and approve malicious routes. This is a concrete issue with a clear attack path (register malicious contract \u2192 execute arbitrary code via `_0x7248ad`). The impact is genuine (unauthorized state manipulation) and does not require compromised roles. Thus, it qualifies as BONUS_VALID.\n      "
    }
  ],
  "target_assessment": {
    "complete_found": true,
    "partial_found": false,
    "finding_id": 0,
    "root_cause_match": true,
    "location_match": true,
    "type_match": "semantic",
    "root_cause_identification": {
      "score": 0.9,
      "reasoning": "\n        The finding accurately identifies the root cause: user-controlled calldata executed without validation. The explanation is technically precise and semantically matches the ground truth, though it could explicitly mention the risk of `transferFrom` calls to fully align with the ground truth.\n      "
    },
    "attack_vector_validity": {
      "score": 0.7,
      "reasoning": "\n        The attack scenario is valid but generic. It correctly describes arbitrary execution but does not explicitly detail the `transferFrom` drain vector from the ground truth. However, the core issue (arbitrary calldata execution) is correctly identified, so the score is MEDIUM.\n      "
    },
    "fix_suggestion_validity": {
      "score": 0.9,
      "reasoning": "\n        The fix suggestion is valid and aligns with the ground truth. It proposes whitelisting or validation, which directly addresses the root cause. The only minor gap is the lack of explicit mention of function selector whitelisting, but this is a semantic detail.\n      "
    }
  },
  "summary": {},
  "notes": "\n    - Finding 0 is a TARGET_MATCH despite missing `_0x7d6277` because it correctly identifies the root cause and one of the two ground truth functions. The ground truth allows for partial function matches (one or more).\n    - Finding 1 is a valid bonus finding, not a partial match, because it addresses a different vulnerability (missing access control on route registration).\n    - The model's confidence (0.85) is justified given the accurate root cause identification and valid attack scenario.\n  ",
  "judge_latency_ms": 17240.62490463257,
  "raw_response": "```json\n{\n  \"overall_verdict\": {\n    \"said_vulnerable\": true,\n    \"confidence_expressed\": 0.85\n  },\n  \"findings\": [\n    {\n      \"finding_id\": 0,\n      \"vulnerability_type_claimed\": \"arbitrary external call\",\n      \"location_claimed\": \"BridgeGateway._0x7248ad\",\n      \"classification\": \"TARGET_MATCH\",\n      \"reasoning\": \"\n        **Root Cause Match**: The finding correctly identifies that user-controlled calldata is executed without validation in the route contract. The explanation mentions 'arbitrary calldata to be executed on the target contract without proper validation or sanitization', which semantically matches the ground truth root cause ('User-controlled calldata executed without validation in route contract').\n\n        **Location Match**: The finding correctly identifies the vulnerable function `_0x7248ad`, which is one of the two functions specified in the ground truth (`_0x7248ad`, `_0x7d6277`). While it misses `_0x7d6277`, it still matches one of the ground truth functions, satisfying the location requirement.\n\n        **Type Match**: The type 'arbitrary external call' is a semantic match to the ground truth type 'access_control'. Both describe the same underlying issue: lack of validation over external calls with user-controlled data.\n\n        **Attack Scenario**: The attack scenario is plausible but slightly misaligned with the ground truth. The ground truth focuses on draining tokens via `transferFrom` calls, while this finding describes a more generic arbitrary execution. However, the core issue (arbitrary calldata execution) is correctly identified.\n\n        **Fix Suggestion**: The suggested fix (whitelisting allowed functions/contracts or validating operations) aligns with the ground truth fix (whitelist function selectors, validate calldata).\n      \"\n    },\n    {\n      \"finding_id\": 1,\n      \"vulnerability_type_claimed\": \"access control\",\n      \"location_claimed\": \"BridgeGateway._0x2ff8d2\",\n      \"classification\": \"BONUS_VALID\",\n      \"reasoning\": \"\n        **Bonus Valid**: This finding identifies a real, distinct vulnerability not covered in the ground truth. The `_0x2ff8d2` function lacks access control, allowing anyone to register and approve malicious routes. This is a concrete issue with a clear attack path (register malicious contract \u2192 execute arbitrary code via `_0x7248ad`). The impact is genuine (unauthorized state manipulation) and does not require compromised roles. Thus, it qualifies as BONUS_VALID.\n      \"\n    }\n  ],\n  \"target_assessment\": {\n    \"complete_found\": true,\n    \"partial_found\": false,\n    \"finding_id\": 0,\n    \"root_cause_match\": true,\n    \"location_match\": true,\n    \"type_match\": \"semantic\",\n    \"root_cause_identification\": {\n      \"score\": 0.9,\n      \"reasoning\": \"\n        The finding accurately identifies the root cause: user-controlled calldata executed without validation. The explanation is technically precise and semantically matches the ground truth, though it could explicitly mention the risk of `transferFrom` calls to fully align with the ground truth.\n      \"\n    },\n    \"attack_vector_validity\": {\n      \"score\": 0.7,\n      \"reasoning\": \"\n        The attack scenario is valid but generic. It correctly describes arbitrary execution but does not explicitly detail the `transferFrom` drain vector from the ground truth. However, the core issue (arbitrary calldata execution) is correctly identified, so the score is MEDIUM.\n      \"\n    },\n    \"fix_suggestion_validity\": {\n      \"score\": 0.9,\n      \"reasoning\": \"\n        The fix suggestion is valid and aligns with the ground truth. It proposes whitelisting or validation, which directly addresses the root cause. The only minor gap is the lack of explicit mention of function selector whitelisting, but this is a semantic detail.\n      \"\n    }\n  },\n  \"notes\": \"\n    - Finding 0 is a TARGET_MATCH despite missing `_0x7d6277` because it correctly identifies the root cause and one of the two ground truth functions. The ground truth allows for partial function matches (one or more).\n    - Finding 1 is a valid bonus finding, not a partial match, because it addresses a different vulnerability (missing access control on route registration).\n    - The model's confidence (0.85) is justified given the accurate root cause identification and valid attack scenario.\n  \"\n}\n```"
}