{
  "sample_id": "tr_tc_038",
  "variant": "trojan",
  "detector_model": "deepseek-v3-2",
  "prompt_type": "direct",
  "judge_model": "mistral-large",
  "timestamp": "2026-01-06T00:31:39.880407+00:00",
  "overall_verdict": {
    "said_vulnerable": true,
    "confidence_expressed": 0.95
  },
  "findings": [
    {
      "finding_id": 0,
      "vulnerability_type_claimed": "Unrestricted Token Mint",
      "location_claimed": "CollateralToken.mint()",
      "classification": "TARGET_MATCH",
      "reasoning": "\n        **Root Cause Match**: The finding correctly identifies the missing access control modifier on the `mint()` function, allowing anyone to mint unlimited tokens. This matches the ground truth's specific root cause: 'Missing access control modifier on mint() function allowing anyone to mint unlimited tokens'.\n\n        **Location Match**: The finding correctly identifies the `mint()` function as the vulnerable location, which is one of the ground truth functions (`mint`, `borrow`). The attack scenario also correctly links the `mint()` vulnerability to the `borrow` function's exploitation.\n\n        **Type Match**: The type 'Unrestricted Token Mint' is a semantic match to the ground truth's 'access_control' type, as both describe the same core issue of missing access restrictions.\n\n        **Quality**:\n        - **Root Cause Identification (RCIR)**: HIGH (0.95) - The explanation precisely matches the ground truth's root cause.\n        - **Attack Vector Validity (AVA)**: HIGH (0.95) - The attack scenario is concrete, step-by-step, and matches the ground truth's attack flow.\n        - **Fix Suggestion Validity (FSV)**: HIGH (0.95) - The suggested fix (adding access control) matches the ground truth's remediation.\n      "
    },
    {
      "finding_id": 1,
      "vulnerability_type_claimed": "Transfer Without Emitting Event",
      "location_claimed": "CollateralToken.transfer(), transferFrom(), approve()",
      "classification": "INFORMATIONAL",
      "reasoning": "\n        This finding is a true observation about the code (missing ERC20 event emissions) but does not represent a security vulnerability with a concrete, profitable exploit. It is an informational issue that affects off-chain tracking and integrations but does not lead to loss of funds or unauthorized access. Thus, it is classified as INFORMATIONAL.\n      "
    }
  ],
  "target_assessment": {
    "complete_found": true,
    "partial_found": false,
    "finding_id": 0,
    "root_cause_match": true,
    "location_match": true,
    "type_match": "semantic",
    "root_cause_identification": {
      "score": 0.95,
      "reasoning": "The finding's root cause explanation is technically accurate and semantically matches the ground truth's specific root cause (missing access control on `mint()`)."
    },
    "attack_vector_validity": {
      "score": 0.95,
      "reasoning": "The attack scenario is concrete, step-by-step, and matches the ground truth's attack flow, including the link between `mint()` and `borrow()`."
    },
    "fix_suggestion_validity": {
      "score": 0.95,
      "reasoning": "The suggested fix (adding access control) is correct and matches the ground truth's remediation."
    }
  },
  "summary": {},
  "notes": "\n    - Finding 0 is a clear TARGET_MATCH, meeting all criteria for root cause, location, and type.\n    - Finding 1 is a valid observation but not a security vulnerability, hence classified as INFORMATIONAL.\n    - The LLM's confidence of 0.95 is justified given the accuracy of Finding 0.\n  ",
  "judge_latency_ms": 13363.91305923462,
  "raw_response": "```json\n{\n  \"overall_verdict\": {\n    \"said_vulnerable\": true,\n    \"confidence_expressed\": 0.95\n  },\n  \"findings\": [\n    {\n      \"finding_id\": 0,\n      \"vulnerability_type_claimed\": \"Unrestricted Token Mint\",\n      \"location_claimed\": \"CollateralToken.mint()\",\n      \"classification\": \"TARGET_MATCH\",\n      \"reasoning\": \"\n        **Root Cause Match**: The finding correctly identifies the missing access control modifier on the `mint()` function, allowing anyone to mint unlimited tokens. This matches the ground truth's specific root cause: 'Missing access control modifier on mint() function allowing anyone to mint unlimited tokens'.\n\n        **Location Match**: The finding correctly identifies the `mint()` function as the vulnerable location, which is one of the ground truth functions (`mint`, `borrow`). The attack scenario also correctly links the `mint()` vulnerability to the `borrow` function's exploitation.\n\n        **Type Match**: The type 'Unrestricted Token Mint' is a semantic match to the ground truth's 'access_control' type, as both describe the same core issue of missing access restrictions.\n\n        **Quality**:\n        - **Root Cause Identification (RCIR)**: HIGH (0.95) - The explanation precisely matches the ground truth's root cause.\n        - **Attack Vector Validity (AVA)**: HIGH (0.95) - The attack scenario is concrete, step-by-step, and matches the ground truth's attack flow.\n        - **Fix Suggestion Validity (FSV)**: HIGH (0.95) - The suggested fix (adding access control) matches the ground truth's remediation.\n      \"\n    },\n    {\n      \"finding_id\": 1,\n      \"vulnerability_type_claimed\": \"Transfer Without Emitting Event\",\n      \"location_claimed\": \"CollateralToken.transfer(), transferFrom(), approve()\",\n      \"classification\": \"INFORMATIONAL\",\n      \"reasoning\": \"\n        This finding is a true observation about the code (missing ERC20 event emissions) but does not represent a security vulnerability with a concrete, profitable exploit. It is an informational issue that affects off-chain tracking and integrations but does not lead to loss of funds or unauthorized access. Thus, it is classified as INFORMATIONAL.\n      \"\n    }\n  ],\n  \"target_assessment\": {\n    \"complete_found\": true,\n    \"partial_found\": false,\n    \"finding_id\": 0,\n    \"root_cause_match\": true,\n    \"location_match\": true,\n    \"type_match\": \"semantic\",\n    \"root_cause_identification\": {\n      \"score\": 0.95,\n      \"reasoning\": \"The finding's root cause explanation is technically accurate and semantically matches the ground truth's specific root cause (missing access control on `mint()`).\"\n    },\n    \"attack_vector_validity\": {\n      \"score\": 0.95,\n      \"reasoning\": \"The attack scenario is concrete, step-by-step, and matches the ground truth's attack flow, including the link between `mint()` and `borrow()`.\"\n    },\n    \"fix_suggestion_validity\": {\n      \"score\": 0.95,\n      \"reasoning\": \"The suggested fix (adding access control) is correct and matches the ground truth's remediation.\"\n    }\n  },\n  \"notes\": \"\n    - Finding 0 is a clear TARGET_MATCH, meeting all criteria for root cause, location, and type.\n    - Finding 1 is a valid observation but not a security vulnerability, hence classified as INFORMATIONAL.\n    - The LLM's confidence of 0.95 is justified given the accuracy of Finding 0.\n  \"\n}\n```"
}