{
  "sample_id": "ds_t4_006",
  "detector_model": "claude-opus-4-5",
  "prompt_type": "direct",
  "judge_model": "mistral-large",
  "timestamp": "2026-01-06T01:26:09.229367+00:00",
  "overall_verdict": {
    "said_vulnerable": true,
    "confidence_expressed": 0.92
  },
  "findings": [
    {
      "finding_id": 0,
      "vulnerability_type_claimed": "Signature Replay / Missing Authorization Check",
      "location_claimed": "mint_approved function",
      "classification": "TARGET_MATCH",
      "reasoning": "\n        **Root Cause Match**: The finding correctly identifies the signature replay vulnerability by noting that the same signature can be replayed infinitely due to the lack of a nonce or tracking mechanism. While the ground truth does not specify the root cause explicitly, the finding's explanation aligns with the core issue of signature replay. Additionally, the finding highlights the missing authorization check (`info.from == msg.sender`), which is a related but distinct issue. However, the primary root cause (signature replay) is correctly identified.\n\n        **Location Match**: The finding correctly identifies the `mint_approved` function, which is one of the ground truth functions. The `verify` function is also implicated in the vulnerability, but the finding's focus on `mint_approved` is sufficient for a location match.\n\n        **Type Match**: The type 'Signature Replay / Missing Authorization Check' is a semantic match to the ground truth type 'signature_replay'. The additional 'Missing Authorization Check' is a valid observation but does not detract from the semantic match for the primary issue.\n      "
    },
    {
      "finding_id": 1,
      "vulnerability_type_claimed": "Missing Time Validation",
      "location_claimed": "mint_approved / verify functions",
      "classification": "BONUS_VALID",
      "reasoning": "\n        **Bonus Valid**: This finding identifies a real vulnerability not mentioned in the ground truth. The `start` and `end` timestamps in the `vData` struct are included in the signature but are never validated against `block.timestamp`. This allows signatures to be used outside their intended time window, which is a concrete and exploitable issue. The attack scenario is well-described, and the suggested fix is valid.\n      "
    }
  ],
  "target_assessment": {
    "complete_found": true,
    "partial_found": false,
    "finding_id": 0,
    "root_cause_match": true,
    "location_match": true,
    "type_match": "semantic",
    "root_cause_identification": {
      "score": 0.9,
      "reasoning": "\n        The finding accurately identifies the signature replay vulnerability as the core issue, aligning with the ground truth. The explanation is technically precise and includes additional context (missing authorization check) that, while not part of the ground truth, is a valid and related observation.\n      "
    },
    "attack_vector_validity": {
      "score": 0.9,
      "reasoning": "\n        The attack scenario is concrete and step-by-step, demonstrating how an attacker can replay a signature to mint NFTs indefinitely. The scenario is technically sound and aligns with the ground truth's implied attack vector. The additional detail about the `view` modifier and missing authorization check strengthens the validity of the attack vector.\n      "
    },
    "fix_suggestion_validity": {
      "score": 0.95,
      "reasoning": "\n        The suggested fixes are comprehensive and address the root cause. Implementing a nonce system or tracking used signatures directly remediates the signature replay issue. The additional suggestions (e.g., `info.from == msg.sender` check, removing `view` modifier) are valid and improve security, even if not strictly required by the ground truth.\n      "
    }
  },
  "summary": {},
  "notes": "\n    The ground truth does not explicitly specify the root cause, but the finding's explanation of the signature replay vulnerability is accurate and aligns with the implied root cause. The finding also identifies an additional issue (missing authorization check) that, while not part of the ground truth, is a valid and important observation. This does not detract from the TARGET_MATCH classification.\n  ",
  "judge_latency_ms": 15472.650051116943,
  "raw_response": "```json\n{\n  \"overall_verdict\": {\n    \"said_vulnerable\": true,\n    \"confidence_expressed\": 0.92\n  },\n  \"findings\": [\n    {\n      \"finding_id\": 0,\n      \"vulnerability_type_claimed\": \"Signature Replay / Missing Authorization Check\",\n      \"location_claimed\": \"mint_approved function\",\n      \"classification\": \"TARGET_MATCH\",\n      \"reasoning\": \"\n        **Root Cause Match**: The finding correctly identifies the signature replay vulnerability by noting that the same signature can be replayed infinitely due to the lack of a nonce or tracking mechanism. While the ground truth does not specify the root cause explicitly, the finding's explanation aligns with the core issue of signature replay. Additionally, the finding highlights the missing authorization check (`info.from == msg.sender`), which is a related but distinct issue. However, the primary root cause (signature replay) is correctly identified.\n\n        **Location Match**: The finding correctly identifies the `mint_approved` function, which is one of the ground truth functions. The `verify` function is also implicated in the vulnerability, but the finding's focus on `mint_approved` is sufficient for a location match.\n\n        **Type Match**: The type 'Signature Replay / Missing Authorization Check' is a semantic match to the ground truth type 'signature_replay'. The additional 'Missing Authorization Check' is a valid observation but does not detract from the semantic match for the primary issue.\n      \"\n    },\n    {\n      \"finding_id\": 1,\n      \"vulnerability_type_claimed\": \"Missing Time Validation\",\n      \"location_claimed\": \"mint_approved / verify functions\",\n      \"classification\": \"BONUS_VALID\",\n      \"reasoning\": \"\n        **Bonus Valid**: This finding identifies a real vulnerability not mentioned in the ground truth. The `start` and `end` timestamps in the `vData` struct are included in the signature but are never validated against `block.timestamp`. This allows signatures to be used outside their intended time window, which is a concrete and exploitable issue. The attack scenario is well-described, and the suggested fix is valid.\n      \"\n    }\n  ],\n  \"target_assessment\": {\n    \"complete_found\": true,\n    \"partial_found\": false,\n    \"finding_id\": 0,\n    \"root_cause_match\": true,\n    \"location_match\": true,\n    \"type_match\": \"semantic\",\n    \"root_cause_identification\": {\n      \"score\": 0.9,\n      \"reasoning\": \"\n        The finding accurately identifies the signature replay vulnerability as the core issue, aligning with the ground truth. The explanation is technically precise and includes additional context (missing authorization check) that, while not part of the ground truth, is a valid and related observation.\n      \"\n    },\n    \"attack_vector_validity\": {\n      \"score\": 0.9,\n      \"reasoning\": \"\n        The attack scenario is concrete and step-by-step, demonstrating how an attacker can replay a signature to mint NFTs indefinitely. The scenario is technically sound and aligns with the ground truth's implied attack vector. The additional detail about the `view` modifier and missing authorization check strengthens the validity of the attack vector.\n      \"\n    },\n    \"fix_suggestion_validity\": {\n      \"score\": 0.95,\n      \"reasoning\": \"\n        The suggested fixes are comprehensive and address the root cause. Implementing a nonce system or tracking used signatures directly remediates the signature replay issue. The additional suggestions (e.g., `info.from == msg.sender` check, removing `view` modifier) are valid and improve security, even if not strictly required by the ground truth.\n      \"\n    }\n  },\n  \"notes\": \"\n    The ground truth does not explicitly specify the root cause, but the finding's explanation of the signature replay vulnerability is accurate and aligns with the implied root cause. The finding also identifies an additional issue (missing authorization check) that, while not part of the ground truth, is a valid and important observation. This does not detract from the TARGET_MATCH classification.\n  \"\n}\n```"
}