{
  "sample_id": "ds_t4_004",
  "detector_model": "claude-opus-4-5",
  "prompt_type": "direct",
  "judge_model": "mistral-large",
  "timestamp": "2026-01-06T01:25:45.095514+00:00",
  "overall_verdict": {
    "said_vulnerable": true,
    "confidence_expressed": 0.95
  },
  "findings": [
    {
      "finding_id": 0,
      "vulnerability_type_claimed": "Price Oracle Manipulation",
      "location_claimed": "SimplePool.getPrice() and SimpleBank.exchange()",
      "classification": "TARGET_MATCH",
      "reasoning": "\n        **Root Cause Match**: The finding correctly identifies that the price calculation in `getPrice()` is based on spot balances (`USDbAmount / USDaAmount`), which can be manipulated via flash loans. This matches the ground truth's implied root cause (oracle manipulation via balance-based pricing).\n\n        \n\n        **Location Match**: The finding correctly identifies the vulnerable functions `getPrice()` and `exchange()`, which matches the ground truth.\n\n        \n\n        **Type Match**: The type 'Price Oracle Manipulation' is a semantic match to the ground truth's 'oracle_manipulation'.\n\n        \n\n        The attack scenario and fix are concrete and technically accurate, demonstrating a clear understanding of the vulnerability."
    },
    {
      "finding_id": 1,
      "vulnerability_type_claimed": "Flash Loan Reentrancy",
      "location_claimed": "SimplePool.flashLoan()",
      "classification": "BONUS_VALID",
      "reasoning": "\n        **Bonus Validity**: This is a real vulnerability not covered in the ground truth. The finding correctly identifies that `flashLoan()` makes an external call without reentrancy protection, which could enable nested flash loans or other unexpected interactions. The attack scenario is plausible, and the fix (adding `ReentrancyGuard`) is valid. The issue is security-relevant and does not require trusted roles to exploit."
    }
  ],
  "target_assessment": {
    "complete_found": true,
    "partial_found": false,
    "finding_id": 0,
    "root_cause_match": true,
    "location_match": true,
    "type_match": "semantic",
    "root_cause_identification": {
      "score": 1.0,
      "reasoning": "The finding precisely identifies the root cause: spot balance-based pricing in `getPrice()` is manipulable via flash loans. This is a technically accurate and complete explanation of the issue."
    },
    "attack_vector_validity": {
      "score": 1.0,
      "reasoning": "The attack scenario is concrete, step-by-step, and technically sound. It demonstrates how an attacker can exploit the vulnerability to profit at the expense of the protocol."
    },
    "fix_suggestion_validity": {
      "score": 1.0,
      "reasoning": "The suggested fix (using TWAP, Chainlink, or other manipulation-resistant oracles) is a standard and effective remediation for this type of vulnerability. It aligns with the ground truth's recommendation."
    }
  },
  "summary": {},
  "notes": "\n    - The ground truth's description of the root cause was vague ('Not specified'), but the LLM's finding filled in the gap with a precise and correct explanation.\n\n    - Finding 1 is a valid bonus vulnerability, as it meets all criteria for `BONUS_VALID` (real, exploitable, and not in the ground truth).\n\n    - The LLM's confidence score (0.95) is justified given the quality of the findings.",
  "judge_latency_ms": 13981.611013412476,
  "raw_response": "```json\n{\n  \"overall_verdict\": {\n    \"said_vulnerable\": true,\n    \"confidence_expressed\": 0.95\n  },\n  \"findings\": [\n    {\n      \"finding_id\": 0,\n      \"vulnerability_type_claimed\": \"Price Oracle Manipulation\",\n      \"location_claimed\": \"SimplePool.getPrice() and SimpleBank.exchange()\",\n      \"classification\": \"TARGET_MATCH\",\n      \"reasoning\": \"\n        **Root Cause Match**: The finding correctly identifies that the price calculation in `getPrice()` is based on spot balances (`USDbAmount / USDaAmount`), which can be manipulated via flash loans. This matches the ground truth's implied root cause (oracle manipulation via balance-based pricing).\\n\n        \\n\n        **Location Match**: The finding correctly identifies the vulnerable functions `getPrice()` and `exchange()`, which matches the ground truth.\\n\n        \\n\n        **Type Match**: The type 'Price Oracle Manipulation' is a semantic match to the ground truth's 'oracle_manipulation'.\\n\n        \\n\n        The attack scenario and fix are concrete and technically accurate, demonstrating a clear understanding of the vulnerability.\"\n    },\n    {\n      \"finding_id\": 1,\n      \"vulnerability_type_claimed\": \"Flash Loan Reentrancy\",\n      \"location_claimed\": \"SimplePool.flashLoan()\",\n      \"classification\": \"BONUS_VALID\",\n      \"reasoning\": \"\n        **Bonus Validity**: This is a real vulnerability not covered in the ground truth. The finding correctly identifies that `flashLoan()` makes an external call without reentrancy protection, which could enable nested flash loans or other unexpected interactions. The attack scenario is plausible, and the fix (adding `ReentrancyGuard`) is valid. The issue is security-relevant and does not require trusted roles to exploit.\"\n    }\n  ],\n  \"target_assessment\": {\n    \"complete_found\": true,\n    \"partial_found\": false,\n    \"finding_id\": 0,\n    \"root_cause_match\": true,\n    \"location_match\": true,\n    \"type_match\": \"semantic\",\n    \"root_cause_identification\": {\n      \"score\": 1.0,\n      \"reasoning\": \"The finding precisely identifies the root cause: spot balance-based pricing in `getPrice()` is manipulable via flash loans. This is a technically accurate and complete explanation of the issue.\"\n    },\n    \"attack_vector_validity\": {\n      \"score\": 1.0,\n      \"reasoning\": \"The attack scenario is concrete, step-by-step, and technically sound. It demonstrates how an attacker can exploit the vulnerability to profit at the expense of the protocol.\"\n    },\n    \"fix_suggestion_validity\": {\n      \"score\": 1.0,\n      \"reasoning\": \"The suggested fix (using TWAP, Chainlink, or other manipulation-resistant oracles) is a standard and effective remediation for this type of vulnerability. It aligns with the ground truth's recommendation.\"\n    }\n  },\n  \"notes\": \"\n    - The ground truth's description of the root cause was vague ('Not specified'), but the LLM's finding filled in the gap with a precise and correct explanation.\\n\n    - Finding 1 is a valid bonus vulnerability, as it meets all criteria for `BONUS_VALID` (real, exploitable, and not in the ground truth).\\n\n    - The LLM's confidence score (0.95) is justified given the quality of the findings.\"\n}\n```"
}