{
  "sample_id": "ds_t4_009",
  "detector_model": "claude-opus-4-5",
  "prompt_type": "direct",
  "judge_model": "mistral-large",
  "timestamp": "2026-01-06T01:26:47.964309+00:00",
  "overall_verdict": {
    "said_vulnerable": true,
    "confidence_expressed": 0.92
  },
  "findings": [
    {
      "finding_id": 0,
      "vulnerability_type_claimed": "Unauthorized External Call / Missing Access Control",
      "location_claimed": "LendingPool.flashLoan() and SimpleBankAlt.executeOperation()",
      "classification": "TARGET_MATCH",
      "reasoning": "\n        **Root Cause Match**: The finding correctly identifies the missing access control in `executeOperation()` where the initiator is not verified. This matches the ground truth's core issue of missing flash loan initiator checks, even though the ground truth did not specify the root cause explicitly. The finding's explanation aligns with the ground truth's description of unauthorized use of flash loan functionality.\n\n        **Location Match**: The finding correctly identifies `executeOperation()` as the vulnerable function, which matches the ground truth's specified location. The mention of `LendingPool.flashLoan()` is contextually relevant but not the primary vulnerable function, so it does not detract from the location match.\n\n        **Type Match**: The type 'Unauthorized External Call / Missing Access Control' is a semantic match to 'flash_loan_attack' as described in the ground truth. Both describe the same underlying issue of unauthorized access leading to potential fund drainage or manipulation.\n      "
    },
    {
      "finding_id": 1,
      "vulnerability_type_claimed": "Flash Loan Receiver Manipulation",
      "location_claimed": "LendingPool.flashLoan()",
      "classification": "BONUS_VALID",
      "reasoning": "\n        This finding identifies a real and distinct vulnerability not covered in the ground truth. The issue is the lack of borrower validation in `LendingPool.flashLoan()`, allowing attackers to force arbitrary contracts to execute `executeOperation()`. The attack scenario is concrete and does not require trusted roles, and the impact (theft of funds) is genuine. This qualifies as a BONUS_VALID finding.\n      "
    }
  ],
  "target_assessment": {
    "complete_found": true,
    "partial_found": false,
    "finding_id": 0,
    "root_cause_match": true,
    "location_match": true,
    "type_match": "semantic",
    "root_cause_identification": {
      "score": 0.9,
      "reasoning": "\n        The finding accurately identifies the root cause as missing access control and initiator verification in `executeOperation()`. This is a precise match to the ground truth's implied root cause (missing flash loan initiator check). The explanation is technically accurate and specific.\n      "
    },
    "attack_vector_validity": {
      "score": 0.9,
      "reasoning": "\n        The attack scenario is concrete and step-by-step, demonstrating how an attacker could drain funds by directly calling `executeOperation()` or manipulating the flash loan process. This aligns with the ground truth's description of unauthorized actions enabled by the vulnerability.\n      "
    },
    "fix_suggestion_validity": {
      "score": 0.85,
      "reasoning": "\n        The suggested fix (adding access control to `executeOperation()` and verifying the initiator) is correct and aligns with the ground truth's fix recommendation. The additional suggestion to track ongoing flash loans is a valid enhancement but not strictly necessary for the core fix.\n      "
    }
  },
  "summary": {},
  "notes": "\n    The ground truth's description of the vulnerability was somewhat vague, but the LLM's findings were precise and technically accurate. Finding 0 is a clear TARGET_MATCH, while Finding 1 is a valid bonus issue. The LLM's confidence score of 0.92 is justified given the quality of the findings.\n  ",
  "judge_latency_ms": 17692.764043807983,
  "raw_response": "```json\n{\n  \"overall_verdict\": {\n    \"said_vulnerable\": true,\n    \"confidence_expressed\": 0.92\n  },\n  \"findings\": [\n    {\n      \"finding_id\": 0,\n      \"vulnerability_type_claimed\": \"Unauthorized External Call / Missing Access Control\",\n      \"location_claimed\": \"LendingPool.flashLoan() and SimpleBankAlt.executeOperation()\",\n      \"classification\": \"TARGET_MATCH\",\n      \"reasoning\": \"\n        **Root Cause Match**: The finding correctly identifies the missing access control in `executeOperation()` where the initiator is not verified. This matches the ground truth's core issue of missing flash loan initiator checks, even though the ground truth did not specify the root cause explicitly. The finding's explanation aligns with the ground truth's description of unauthorized use of flash loan functionality.\n\n        **Location Match**: The finding correctly identifies `executeOperation()` as the vulnerable function, which matches the ground truth's specified location. The mention of `LendingPool.flashLoan()` is contextually relevant but not the primary vulnerable function, so it does not detract from the location match.\n\n        **Type Match**: The type 'Unauthorized External Call / Missing Access Control' is a semantic match to 'flash_loan_attack' as described in the ground truth. Both describe the same underlying issue of unauthorized access leading to potential fund drainage or manipulation.\n      \"\n    },\n    {\n      \"finding_id\": 1,\n      \"vulnerability_type_claimed\": \"Flash Loan Receiver Manipulation\",\n      \"location_claimed\": \"LendingPool.flashLoan()\",\n      \"classification\": \"BONUS_VALID\",\n      \"reasoning\": \"\n        This finding identifies a real and distinct vulnerability not covered in the ground truth. The issue is the lack of borrower validation in `LendingPool.flashLoan()`, allowing attackers to force arbitrary contracts to execute `executeOperation()`. The attack scenario is concrete and does not require trusted roles, and the impact (theft of funds) is genuine. This qualifies as a BONUS_VALID finding.\n      \"\n    }\n  ],\n  \"target_assessment\": {\n    \"complete_found\": true,\n    \"partial_found\": false,\n    \"finding_id\": 0,\n    \"root_cause_match\": true,\n    \"location_match\": true,\n    \"type_match\": \"semantic\",\n    \"root_cause_identification\": {\n      \"score\": 0.9,\n      \"reasoning\": \"\n        The finding accurately identifies the root cause as missing access control and initiator verification in `executeOperation()`. This is a precise match to the ground truth's implied root cause (missing flash loan initiator check). The explanation is technically accurate and specific.\n      \"\n    },\n    \"attack_vector_validity\": {\n      \"score\": 0.9,\n      \"reasoning\": \"\n        The attack scenario is concrete and step-by-step, demonstrating how an attacker could drain funds by directly calling `executeOperation()` or manipulating the flash loan process. This aligns with the ground truth's description of unauthorized actions enabled by the vulnerability.\n      \"\n    },\n    \"fix_suggestion_validity\": {\n      \"score\": 0.85,\n      \"reasoning\": \"\n        The suggested fix (adding access control to `executeOperation()` and verifying the initiator) is correct and aligns with the ground truth's fix recommendation. The additional suggestion to track ongoing flash loans is a valid enhancement but not strictly necessary for the core fix.\n      \"\n    }\n  },\n  \"notes\": \"\n    The ground truth's description of the vulnerability was somewhat vague, but the LLM's findings were precise and technically accurate. Finding 0 is a clear TARGET_MATCH, while Finding 1 is a valid bonus issue. The LLM's confidence score of 0.92 is justified given the quality of the findings.\n  \"\n}\n```"
}