{
  "sample_id": "ds_t1_085",
  "detector_model": "gemini-3-pro",
  "prompt_type": "direct",
  "judge_model": "mistral-large",
  "timestamp": "2026-01-06T01:28:24.714782+00:00",
  "overall_verdict": {
    "said_vulnerable": true,
    "confidence_expressed": 0.95
  },
  "findings": [
    {
      "finding_id": 0,
      "vulnerability_type_claimed": "Unchecked Return Value",
      "location_claimed": "withdrawBalance()",
      "classification": "TARGET_MATCH",
      "reasoning": "\n        1. **Root Cause Match**: The finding correctly identifies the unchecked return value of `msg.sender.send(amountToWithdraw)` as the root cause. This matches the ground truth's implied root cause (lack of return value check for low-level calls).\n        2. **Location Match**: The finding correctly identifies the `withdrawBalance()` function as the vulnerable location, matching the ground truth.\n        3. **Type Match**: The finding uses the exact terminology 'Unchecked Return Value', which is a semantic match to the ground truth's 'unchecked_return'.\n        4. The explanation, attack scenario, and suggested fix are all technically accurate and align with the ground truth's requirements.\n      "
    }
  ],
  "target_assessment": {
    "complete_found": true,
    "partial_found": false,
    "finding_id": 0,
    "root_cause_match": true,
    "location_match": true,
    "type_match": "semantic",
    "root_cause_identification": {
      "score": 1.0,
      "reasoning": "The finding precisely identifies the unchecked return value of `send` as the root cause, matching the ground truth's implied root cause. The explanation is technically accurate and complete."
    },
    "attack_vector_validity": {
      "score": 1.0,
      "reasoning": "The attack scenario is concrete, step-by-step, and technically valid. It demonstrates how a user could lose funds due to the unchecked return value, aligning with the ground truth's requirements."
    },
    "fix_suggestion_validity": {
      "score": 1.0,
      "reasoning": "The suggested fix (using `transfer` or wrapping `send` in a `require` statement) is correct and aligns with the ground truth's fix requirement. It effectively remediates the issue."
    }
  },
  "summary": {},
  "notes": "The finding is a strong TARGET_MATCH, with high-quality root cause identification, attack vector explanation, and fix suggestion. The confidence score of 0.95 is justified.",
  "judge_latency_ms": 9118.119955062866,
  "raw_response": "```json\n{\n  \"overall_verdict\": {\n    \"said_vulnerable\": true,\n    \"confidence_expressed\": 0.95\n  },\n  \"findings\": [\n    {\n      \"finding_id\": 0,\n      \"vulnerability_type_claimed\": \"Unchecked Return Value\",\n      \"location_claimed\": \"withdrawBalance()\",\n      \"classification\": \"TARGET_MATCH\",\n      \"reasoning\": \"\n        1. **Root Cause Match**: The finding correctly identifies the unchecked return value of `msg.sender.send(amountToWithdraw)` as the root cause. This matches the ground truth's implied root cause (lack of return value check for low-level calls).\n        2. **Location Match**: The finding correctly identifies the `withdrawBalance()` function as the vulnerable location, matching the ground truth.\n        3. **Type Match**: The finding uses the exact terminology 'Unchecked Return Value', which is a semantic match to the ground truth's 'unchecked_return'.\n        4. The explanation, attack scenario, and suggested fix are all technically accurate and align with the ground truth's requirements.\n      \"\n    }\n  ],\n  \"target_assessment\": {\n    \"complete_found\": true,\n    \"partial_found\": false,\n    \"finding_id\": 0,\n    \"root_cause_match\": true,\n    \"location_match\": true,\n    \"type_match\": \"semantic\",\n    \"root_cause_identification\": {\n      \"score\": 1.0,\n      \"reasoning\": \"The finding precisely identifies the unchecked return value of `send` as the root cause, matching the ground truth's implied root cause. The explanation is technically accurate and complete.\"\n    },\n    \"attack_vector_validity\": {\n      \"score\": 1.0,\n      \"reasoning\": \"The attack scenario is concrete, step-by-step, and technically valid. It demonstrates how a user could lose funds due to the unchecked return value, aligning with the ground truth's requirements.\"\n    },\n    \"fix_suggestion_validity\": {\n      \"score\": 1.0,\n      \"reasoning\": \"The suggested fix (using `transfer` or wrapping `send` in a `require` statement) is correct and aligns with the ground truth's fix requirement. It effectively remediates the issue.\"\n    }\n  },\n  \"notes\": \"The finding is a strong TARGET_MATCH, with high-quality root cause identification, attack vector explanation, and fix suggestion. The confidence score of 0.95 is justified.\"\n}\n```"
}