{
  "sample_id": "ss_tc_021",
  "variant": "shapeshifter_l3",
  "detector_model": "deepseek-v3-2",
  "prompt_type": "direct",
  "judge_model": "mistral-large",
  "timestamp": "2026-01-06T00:28:29.839864+00:00",
  "overall_verdict": {
    "said_vulnerable": true,
    "confidence_expressed": 0.9
  },
  "findings": [
    {
      "finding_id": 0,
      "vulnerability_type_claimed": "Insufficient Collateral Validation",
      "location_claimed": "_0x390062 function",
      "classification": "TARGET_MATCH",
      "reasoning": "\n        **Root Cause Match**: The finding correctly identifies that the oracle price can be manipulated to inflate collateral value, which matches the ground truth's root cause about oracle manipulation via flash loans inflating virtual_price. The explanation demonstrates understanding of the specific issue: the oracle's price is not manipulation-resistant and reflects current pool state, allowing temporary inflation.\n\n        **Location Match**: While the finding mentions the `_0x390062` function (which is the collateral valuation function), the actual vulnerable function in the ground truth is `_0x8e4527` (the borrow function). However, `_0x390062` is directly called by `_0x8e4527` and is the source of the oracle price used in the borrow logic. The root cause is correctly tied to the oracle price manipulation, which originates in `_0x390062`. Thus, the location is considered a match because the oracle price is fetched in `_0x390062` and used in `_0x8e4527`.\n\n        **Type Match**: The type 'Insufficient Collateral Validation' is a semantic match to 'price_oracle_manipulation' because the insufficient validation stems from the oracle's vulnerability to manipulation. Both describe the same underlying issue.\n      "
    },
    {
      "finding_id": 1,
      "vulnerability_type_claimed": "Missing Access Control",
      "location_claimed": "_0x51bedd function",
      "classification": "MISCHARACTERIZED",
      "reasoning": "\n        The finding describes a missing access control issue where a malicious ERC20 token could be used to fake collateral deposits. However, the contract does not allow arbitrary changes to `_0x7248ad` (the collateral token address) after deployment, and the `_0x1045d1` function is called on the trusted `_0x7248ad` token. The scenario assumes the attacker can change `_0x7248ad` or that the token is malicious, but the code does not support this. The issue is not a real vulnerability in the provided code.\n      "
    },
    {
      "finding_id": 2,
      "vulnerability_type_claimed": "Integer Precision Loss",
      "location_claimed": "_0x8e4527 function",
      "classification": "INFORMATIONAL",
      "reasoning": "\n        The finding describes a potential precision loss due to division after multiplication, but the impact is minimal and does not lead to a meaningful exploit. The example provided shows no actual loss of funds or over-borrowing. This is an informational issue rather than a security vulnerability.\n      "
    }
  ],
  "target_assessment": {
    "complete_found": true,
    "partial_found": false,
    "finding_id": 0,
    "root_cause_match": true,
    "location_match": true,
    "type_match": "semantic",
    "root_cause_identification": {
      "score": 0.9,
      "reasoning": "\n        The finding accurately identifies the root cause: the oracle's price can be manipulated to inflate collateral value, allowing over-borrowing. The explanation is technically precise and matches the ground truth's description of the oracle's vulnerability to flash loan manipulation.\n      "
    },
    "attack_vector_validity": {
      "score": 0.85,
      "reasoning": "\n        The attack scenario is valid and aligns with the ground truth: an attacker manipulates the oracle price to inflate collateral value and over-borrow. However, the scenario does not explicitly mention flash loans or the specific mechanics of inflating the Curve pool's virtual_price, which slightly reduces the score.\n      "
    },
    "fix_suggestion_validity": {
      "score": 0.9,
      "reasoning": "\n        The suggested fix (using a decentralized oracle with TWAP, multiple price sources, and deviation checks) is valid and aligns with the ground truth's recommendation for manipulation-resistant oracles. The fix is technically correct and would remediate the issue.\n      "
    }
  },
  "summary": {},
  "notes": "\n    Finding 0 is classified as TARGET_MATCH because it correctly identifies the root cause (oracle manipulation) and the location (the oracle price fetch in `_0x390062`, which directly impacts the borrow logic in `_0x8e4527`). The type is semantically equivalent to the ground truth. The other findings are either mischaracterized or informational.\n  ",
  "judge_latency_ms": 19173.460960388184,
  "raw_response": "```json\n{\n  \"overall_verdict\": {\n    \"said_vulnerable\": true,\n    \"confidence_expressed\": 0.9\n  },\n  \"findings\": [\n    {\n      \"finding_id\": 0,\n      \"vulnerability_type_claimed\": \"Insufficient Collateral Validation\",\n      \"location_claimed\": \"_0x390062 function\",\n      \"classification\": \"TARGET_MATCH\",\n      \"reasoning\": \"\n        **Root Cause Match**: The finding correctly identifies that the oracle price can be manipulated to inflate collateral value, which matches the ground truth's root cause about oracle manipulation via flash loans inflating virtual_price. The explanation demonstrates understanding of the specific issue: the oracle's price is not manipulation-resistant and reflects current pool state, allowing temporary inflation.\n\n        **Location Match**: While the finding mentions the `_0x390062` function (which is the collateral valuation function), the actual vulnerable function in the ground truth is `_0x8e4527` (the borrow function). However, `_0x390062` is directly called by `_0x8e4527` and is the source of the oracle price used in the borrow logic. The root cause is correctly tied to the oracle price manipulation, which originates in `_0x390062`. Thus, the location is considered a match because the oracle price is fetched in `_0x390062` and used in `_0x8e4527`.\n\n        **Type Match**: The type 'Insufficient Collateral Validation' is a semantic match to 'price_oracle_manipulation' because the insufficient validation stems from the oracle's vulnerability to manipulation. Both describe the same underlying issue.\n      \"\n    },\n    {\n      \"finding_id\": 1,\n      \"vulnerability_type_claimed\": \"Missing Access Control\",\n      \"location_claimed\": \"_0x51bedd function\",\n      \"classification\": \"MISCHARACTERIZED\",\n      \"reasoning\": \"\n        The finding describes a missing access control issue where a malicious ERC20 token could be used to fake collateral deposits. However, the contract does not allow arbitrary changes to `_0x7248ad` (the collateral token address) after deployment, and the `_0x1045d1` function is called on the trusted `_0x7248ad` token. The scenario assumes the attacker can change `_0x7248ad` or that the token is malicious, but the code does not support this. The issue is not a real vulnerability in the provided code.\n      \"\n    },\n    {\n      \"finding_id\": 2,\n      \"vulnerability_type_claimed\": \"Integer Precision Loss\",\n      \"location_claimed\": \"_0x8e4527 function\",\n      \"classification\": \"INFORMATIONAL\",\n      \"reasoning\": \"\n        The finding describes a potential precision loss due to division after multiplication, but the impact is minimal and does not lead to a meaningful exploit. The example provided shows no actual loss of funds or over-borrowing. This is an informational issue rather than a security vulnerability.\n      \"\n    }\n  ],\n  \"target_assessment\": {\n    \"complete_found\": true,\n    \"partial_found\": false,\n    \"finding_id\": 0,\n    \"root_cause_match\": true,\n    \"location_match\": true,\n    \"type_match\": \"semantic\",\n    \"root_cause_identification\": {\n      \"score\": 0.9,\n      \"reasoning\": \"\n        The finding accurately identifies the root cause: the oracle's price can be manipulated to inflate collateral value, allowing over-borrowing. The explanation is technically precise and matches the ground truth's description of the oracle's vulnerability to flash loan manipulation.\n      \"\n    },\n    \"attack_vector_validity\": {\n      \"score\": 0.85,\n      \"reasoning\": \"\n        The attack scenario is valid and aligns with the ground truth: an attacker manipulates the oracle price to inflate collateral value and over-borrow. However, the scenario does not explicitly mention flash loans or the specific mechanics of inflating the Curve pool's virtual_price, which slightly reduces the score.\n      \"\n    },\n    \"fix_suggestion_validity\": {\n      \"score\": 0.9,\n      \"reasoning\": \"\n        The suggested fix (using a decentralized oracle with TWAP, multiple price sources, and deviation checks) is valid and aligns with the ground truth's recommendation for manipulation-resistant oracles. The fix is technically correct and would remediate the issue.\n      \"\n    }\n  },\n  \"notes\": \"\n    Finding 0 is classified as TARGET_MATCH because it correctly identifies the root cause (oracle manipulation) and the location (the oracle price fetch in `_0x390062`, which directly impacts the borrow logic in `_0x8e4527`). The type is semantically equivalent to the ground truth. The other findings are either mischaracterized or informational.\n  \"\n}\n```"
}