{
  "sample_id": "ss_tc_019",
  "variant": "shapeshifter_l3",
  "detector_model": "deepseek-v3-2",
  "prompt_type": "direct",
  "judge_model": "mistral-large",
  "timestamp": "2026-01-06T00:28:02.245053+00:00",
  "overall_verdict": {
    "said_vulnerable": true,
    "confidence_expressed": 0.95
  },
  "findings": [
    {
      "finding_id": 0,
      "vulnerability_type_claimed": "Incorrect Invariant Validation",
      "location_claimed": "_0x8e4527 function, invariant check",
      "classification": "TARGET_MATCH",
      "reasoning": "\n        **Root Cause Match**: The finding correctly identifies the specific root cause - the mismatch between the fee calculation scale (10000) and the invariant check scale (1000), creating a 100x discrepancy that allows K to inflate. This matches the ground truth's root cause exactly.\n        **Location Match**: The finding correctly identifies the vulnerable function (_0x8e4527) and the specific invariant check (line 66) as the location of the issue.\n        **Type Match**: The type 'Incorrect Invariant Validation' is a semantic match to the ground truth's 'arithmetic_error', as both describe the same underlying issue of incorrect arithmetic validation.\n      "
    },
    {
      "finding_id": 1,
      "vulnerability_type_claimed": "Reentrancy",
      "location_claimed": "_0x8e4527 function, token transfers before validation",
      "classification": "BONUS_VALID",
      "reasoning": "\n        **Bonus Validation**: The finding identifies a real vulnerability not mentioned in the ground truth. The reentrancy risk is concrete:\n        1. The function transfers tokens before validation, breaking the checks-effects-interactions pattern.\n        2. The attack scenario is plausible with ERC777 tokens or similar callback mechanisms.\n        3. The impact (draining funds or bypassing fees) is genuine and does not require compromised admin roles.\n        4. The suggested fix (moving transfers after validation) is correct and remediates the issue.\n      "
    }
  ],
  "target_assessment": {
    "complete_found": true,
    "partial_found": false,
    "finding_id": 0,
    "root_cause_match": true,
    "location_match": true,
    "type_match": "semantic",
    "root_cause_identification": {
      "score": 1.0,
      "reasoning": "The root cause is identified with high precision, matching the ground truth's explanation of the scale mismatch (1000 vs 10000) and its impact on the invariant check."
    },
    "attack_vector_validity": {
      "score": 0.9,
      "reasoning": "The attack scenario is valid and aligns with the ground truth's description of how the invariant check failure allows K to inflate. The explanation is concrete and step-by-step, though it could elaborate more on the iterative exploitation process."
    },
    "fix_suggestion_validity": {
      "score": 1.0,
      "reasoning": "The suggested fix (changing 1000**2 to 10000**2) is exactly what the ground truth prescribes and correctly remediates the issue."
    }
  },
  "summary": {},
  "notes": "Finding 0 is a clear TARGET_MATCH, while Finding 1 is a valid bonus vulnerability. The model demonstrated strong understanding of the target issue and identified an additional real risk.",
  "judge_latency_ms": 13298.626184463501,
  "raw_response": "```json\n{\n  \"overall_verdict\": {\n    \"said_vulnerable\": true,\n    \"confidence_expressed\": 0.95\n  },\n  \"findings\": [\n    {\n      \"finding_id\": 0,\n      \"vulnerability_type_claimed\": \"Incorrect Invariant Validation\",\n      \"location_claimed\": \"_0x8e4527 function, invariant check\",\n      \"classification\": \"TARGET_MATCH\",\n      \"reasoning\": \"\n        **Root Cause Match**: The finding correctly identifies the specific root cause - the mismatch between the fee calculation scale (10000) and the invariant check scale (1000), creating a 100x discrepancy that allows K to inflate. This matches the ground truth's root cause exactly.\n        **Location Match**: The finding correctly identifies the vulnerable function (_0x8e4527) and the specific invariant check (line 66) as the location of the issue.\n        **Type Match**: The type 'Incorrect Invariant Validation' is a semantic match to the ground truth's 'arithmetic_error', as both describe the same underlying issue of incorrect arithmetic validation.\n      \"\n    },\n    {\n      \"finding_id\": 1,\n      \"vulnerability_type_claimed\": \"Reentrancy\",\n      \"location_claimed\": \"_0x8e4527 function, token transfers before validation\",\n      \"classification\": \"BONUS_VALID\",\n      \"reasoning\": \"\n        **Bonus Validation**: The finding identifies a real vulnerability not mentioned in the ground truth. The reentrancy risk is concrete:\n        1. The function transfers tokens before validation, breaking the checks-effects-interactions pattern.\n        2. The attack scenario is plausible with ERC777 tokens or similar callback mechanisms.\n        3. The impact (draining funds or bypassing fees) is genuine and does not require compromised admin roles.\n        4. The suggested fix (moving transfers after validation) is correct and remediates the issue.\n      \"\n    }\n  ],\n  \"target_assessment\": {\n    \"complete_found\": true,\n    \"partial_found\": false,\n    \"finding_id\": 0,\n    \"root_cause_match\": true,\n    \"location_match\": true,\n    \"type_match\": \"semantic\",\n    \"root_cause_identification\": {\n      \"score\": 1.0,\n      \"reasoning\": \"The root cause is identified with high precision, matching the ground truth's explanation of the scale mismatch (1000 vs 10000) and its impact on the invariant check.\"\n    },\n    \"attack_vector_validity\": {\n      \"score\": 0.9,\n      \"reasoning\": \"The attack scenario is valid and aligns with the ground truth's description of how the invariant check failure allows K to inflate. The explanation is concrete and step-by-step, though it could elaborate more on the iterative exploitation process.\"\n    },\n    \"fix_suggestion_validity\": {\n      \"score\": 1.0,\n      \"reasoning\": \"The suggested fix (changing 1000**2 to 10000**2) is exactly what the ground truth prescribes and correctly remediates the issue.\"\n    }\n  },\n  \"notes\": \"Finding 0 is a clear TARGET_MATCH, while Finding 1 is a valid bonus vulnerability. The model demonstrated strong understanding of the target issue and identified an additional real risk.\"\n}\n```"
}