{
  "sample_id": "ds_t2_022",
  "detector_model": "gemini-3-pro",
  "prompt_type": "direct",
  "judge_model": "mistral-large",
  "timestamp": "2026-01-06T01:26:38.616785+00:00",
  "overall_verdict": {
    "said_vulnerable": true,
    "confidence_expressed": 1.0
  },
  "findings": [
    {
      "finding_id": 0,
      "vulnerability_type_claimed": "Access Control Bypass",
      "location_claimed": "transfer function / State Variables",
      "classification": "TARGET_MATCH",
      "reasoning": "\n        **Root Cause Match**: The finding correctly identifies that the `Admin` variable is uninitialized (defaults to `address(0)`) and that `ecrecover` can return `address(0)` for invalid signatures. This matches the ground truth's implicit root cause (ecrecover returning `address(0)` for invalid inputs and uninitialized `Admin`). The explanation demonstrates understanding of the specific issue described in the ground truth.\n\n        **Location Match**: The finding correctly identifies the vulnerable functions (`recoverSignerAddress` and `transfer`), as specified in the ground truth.\n\n        **Type Match**: The type 'Access Control Bypass' is a semantic match to 'logic_error' in the ground truth, as both describe a logic flaw leading to unauthorized access.\n\n        **Quality Scoring**:\n        - RCIR: HIGH (0.9) - The root cause is accurately identified and matches the ground truth.\n        - AVA: HIGH (1.0) - The attack scenario is concrete, step-by-step, and valid.\n        - FSV: HIGH (0.9) - The suggested fix (initialize `Admin` and check for `address(0)`) is valid and aligns with the ground truth's fix suggestion.\n      "
    },
    {
      "finding_id": 1,
      "vulnerability_type_claimed": "Improper Signature Verification / Logic Error",
      "location_claimed": "transfer function",
      "classification": "BONUS_VALID",
      "reasoning": "\n        This finding identifies a **different** real vulnerability not mentioned in the ground truth. The issue is that the `_hash` input is not bound to the transaction parameters (`_to` and `_amount`), allowing signature reuse. This is a valid and critical vulnerability with a concrete attack scenario (signature replay). The suggested fix (reconstructing the hash within the function) is technically correct and remediates the issue.\n      "
    }
  ],
  "target_assessment": {
    "complete_found": true,
    "partial_found": false,
    "finding_id": 0,
    "root_cause_match": true,
    "location_match": true,
    "type_match": "semantic",
    "root_cause_identification": {
      "score": 0.9,
      "reasoning": "The root cause is accurately identified, matching the ground truth's implicit root cause (ecrecover returning `address(0)` and uninitialized `Admin`)."
    },
    "attack_vector_validity": {
      "score": 1.0,
      "reasoning": "The attack scenario is concrete, step-by-step, and valid, demonstrating a clear exploit path."
    },
    "fix_suggestion_validity": {
      "score": 0.9,
      "reasoning": "The suggested fix (initialize `Admin` and check for `address(0)`) is valid and aligns with the ground truth's fix suggestion."
    }
  },
  "summary": {},
  "notes": "\n    Finding 0 is a TARGET_MATCH because it meets all criteria: correct root cause, correct location, and semantic type match. Finding 1 is a BONUS_VALID as it identifies a separate, real vulnerability not covered in the ground truth.\n  ",
  "judge_latency_ms": 14747.127056121826,
  "raw_response": "```json\n{\n  \"overall_verdict\": {\n    \"said_vulnerable\": true,\n    \"confidence_expressed\": 1.0\n  },\n  \"findings\": [\n    {\n      \"finding_id\": 0,\n      \"vulnerability_type_claimed\": \"Access Control Bypass\",\n      \"location_claimed\": \"transfer function / State Variables\",\n      \"classification\": \"TARGET_MATCH\",\n      \"reasoning\": \"\n        **Root Cause Match**: The finding correctly identifies that the `Admin` variable is uninitialized (defaults to `address(0)`) and that `ecrecover` can return `address(0)` for invalid signatures. This matches the ground truth's implicit root cause (ecrecover returning `address(0)` for invalid inputs and uninitialized `Admin`). The explanation demonstrates understanding of the specific issue described in the ground truth.\n\n        **Location Match**: The finding correctly identifies the vulnerable functions (`recoverSignerAddress` and `transfer`), as specified in the ground truth.\n\n        **Type Match**: The type 'Access Control Bypass' is a semantic match to 'logic_error' in the ground truth, as both describe a logic flaw leading to unauthorized access.\n\n        **Quality Scoring**:\n        - RCIR: HIGH (0.9) - The root cause is accurately identified and matches the ground truth.\n        - AVA: HIGH (1.0) - The attack scenario is concrete, step-by-step, and valid.\n        - FSV: HIGH (0.9) - The suggested fix (initialize `Admin` and check for `address(0)`) is valid and aligns with the ground truth's fix suggestion.\n      \"\n    },\n    {\n      \"finding_id\": 1,\n      \"vulnerability_type_claimed\": \"Improper Signature Verification / Logic Error\",\n      \"location_claimed\": \"transfer function\",\n      \"classification\": \"BONUS_VALID\",\n      \"reasoning\": \"\n        This finding identifies a **different** real vulnerability not mentioned in the ground truth. The issue is that the `_hash` input is not bound to the transaction parameters (`_to` and `_amount`), allowing signature reuse. This is a valid and critical vulnerability with a concrete attack scenario (signature replay). The suggested fix (reconstructing the hash within the function) is technically correct and remediates the issue.\n      \"\n    }\n  ],\n  \"target_assessment\": {\n    \"complete_found\": true,\n    \"partial_found\": false,\n    \"finding_id\": 0,\n    \"root_cause_match\": true,\n    \"location_match\": true,\n    \"type_match\": \"semantic\",\n    \"root_cause_identification\": {\n      \"score\": 0.9,\n      \"reasoning\": \"The root cause is accurately identified, matching the ground truth's implicit root cause (ecrecover returning `address(0)` and uninitialized `Admin`).\"\n    },\n    \"attack_vector_validity\": {\n      \"score\": 1.0,\n      \"reasoning\": \"The attack scenario is concrete, step-by-step, and valid, demonstrating a clear exploit path.\"\n    },\n    \"fix_suggestion_validity\": {\n      \"score\": 0.9,\n      \"reasoning\": \"The suggested fix (initialize `Admin` and check for `address(0)`) is valid and aligns with the ground truth's fix suggestion.\"\n    }\n  },\n  \"notes\": \"\n    Finding 0 is a TARGET_MATCH because it meets all criteria: correct root cause, correct location, and semantic type match. Finding 1 is a BONUS_VALID as it identifies a separate, real vulnerability not covered in the ground truth.\n  \"\n}\n```"
}