{
  "sample_id": "ds_t2_024",
  "detector_model": "gemini-3-pro",
  "prompt_type": "direct",
  "judge_model": "mistral-large",
  "timestamp": "2026-01-06T01:26:53.373073+00:00",
  "overall_verdict": {
    "said_vulnerable": true,
    "confidence_expressed": 0.95
  },
  "findings": [
    {
      "finding_id": 0,
      "vulnerability_type_claimed": "Reentrancy",
      "location_claimed": "LedgerChannel.sol: LCOpenTimeout()",
      "classification": "TARGET_MATCH",
      "reasoning": "\n        The finding correctly identifies the reentrancy vulnerability in the `LCOpenTimeout` function.\n        - **Root Cause Match**: The model explains that the function makes external calls (ETH transfer and token transfer) before updating the channel state, which matches the ground truth's implied root cause (checks-effects-interactions violation).\n        - **Location Match**: The finding is about the `LCOpenTimeout` function, which matches the ground truth.\n        - **Type Match**: The type 'Reentrancy' is an exact match to the ground truth.\n        - The attack scenario is concrete and demonstrates how an attacker could drain funds by re-entering the function.\n        - The suggested fix aligns with the ground truth's recommendation to apply the checks-effects-interactions pattern.\n      "
    },
    {
      "finding_id": 1,
      "vulnerability_type_claimed": "Access Control / Logic Error",
      "location_claimed": "LedgerChannel.sol: settleVC()",
      "classification": "BONUS_VALID",
      "reasoning": "\n        This finding identifies a separate, real vulnerability not mentioned in the ground truth.\n        - The issue exists: `settleVC` only verifies the signature of `partyA` and does not enforce any checks on `partyB`'s consent, allowing `partyA` to unilaterally update the state.\n        - The attack scenario is concrete and demonstrates how `partyA` could steal funds from `partyB`.\n        - The impact is genuine (loss of funds) and does not require a trusted role to be compromised.\n        - The suggested fix is valid and would remediate the issue.\n      "
    }
  ],
  "target_assessment": {
    "complete_found": true,
    "partial_found": false,
    "finding_id": 0,
    "root_cause_match": true,
    "location_match": true,
    "type_match": "exact",
    "root_cause_identification": {
      "score": 1.0,
      "reasoning": "\n        The model accurately identifies the root cause as a violation of the checks-effects-interactions pattern, where external calls are made before state updates. This is a precise match to the ground truth's implied root cause.\n      "
    },
    "attack_vector_validity": {
      "score": 1.0,
      "reasoning": "\n        The attack scenario is concrete, step-by-step, and demonstrates a realistic exploit that would drain funds from the contract. It aligns with the ground truth's description of the vulnerability.\n      "
    },
    "fix_suggestion_validity": {
      "score": 1.0,
      "reasoning": "\n        The suggested fix (applying the checks-effects-interactions pattern by zeroing out balances or deleting the channel struct before external transfers) is a precise match to the ground truth's recommendation.\n      "
    }
  },
  "summary": {},
  "notes": "\n    The model successfully identified the target vulnerability (reentrancy in `LCOpenTimeout`) with high accuracy and also discovered an additional valid vulnerability in `settleVC`. Both findings are well-explained and actionable.\n  ",
  "judge_latency_ms": 21431.68306350708,
  "raw_response": "```json\n{\n  \"overall_verdict\": {\n    \"said_vulnerable\": true,\n    \"confidence_expressed\": 0.95\n  },\n  \"findings\": [\n    {\n      \"finding_id\": 0,\n      \"vulnerability_type_claimed\": \"Reentrancy\",\n      \"location_claimed\": \"LedgerChannel.sol: LCOpenTimeout()\",\n      \"classification\": \"TARGET_MATCH\",\n      \"reasoning\": \"\n        The finding correctly identifies the reentrancy vulnerability in the `LCOpenTimeout` function.\n        - **Root Cause Match**: The model explains that the function makes external calls (ETH transfer and token transfer) before updating the channel state, which matches the ground truth's implied root cause (checks-effects-interactions violation).\n        - **Location Match**: The finding is about the `LCOpenTimeout` function, which matches the ground truth.\n        - **Type Match**: The type 'Reentrancy' is an exact match to the ground truth.\n        - The attack scenario is concrete and demonstrates how an attacker could drain funds by re-entering the function.\n        - The suggested fix aligns with the ground truth's recommendation to apply the checks-effects-interactions pattern.\n      \"\n    },\n    {\n      \"finding_id\": 1,\n      \"vulnerability_type_claimed\": \"Access Control / Logic Error\",\n      \"location_claimed\": \"LedgerChannel.sol: settleVC()\",\n      \"classification\": \"BONUS_VALID\",\n      \"reasoning\": \"\n        This finding identifies a separate, real vulnerability not mentioned in the ground truth.\n        - The issue exists: `settleVC` only verifies the signature of `partyA` and does not enforce any checks on `partyB`'s consent, allowing `partyA` to unilaterally update the state.\n        - The attack scenario is concrete and demonstrates how `partyA` could steal funds from `partyB`.\n        - The impact is genuine (loss of funds) and does not require a trusted role to be compromised.\n        - The suggested fix is valid and would remediate the issue.\n      \"\n    }\n  ],\n  \"target_assessment\": {\n    \"complete_found\": true,\n    \"partial_found\": false,\n    \"finding_id\": 0,\n    \"root_cause_match\": true,\n    \"location_match\": true,\n    \"type_match\": \"exact\",\n    \"root_cause_identification\": {\n      \"score\": 1.0,\n      \"reasoning\": \"\n        The model accurately identifies the root cause as a violation of the checks-effects-interactions pattern, where external calls are made before state updates. This is a precise match to the ground truth's implied root cause.\n      \"\n    },\n    \"attack_vector_validity\": {\n      \"score\": 1.0,\n      \"reasoning\": \"\n        The attack scenario is concrete, step-by-step, and demonstrates a realistic exploit that would drain funds from the contract. It aligns with the ground truth's description of the vulnerability.\n      \"\n    },\n    \"fix_suggestion_validity\": {\n      \"score\": 1.0,\n      \"reasoning\": \"\n        The suggested fix (applying the checks-effects-interactions pattern by zeroing out balances or deleting the channel struct before external transfers) is a precise match to the ground truth's recommendation.\n      \"\n    }\n  },\n  \"notes\": \"\n    The model successfully identified the target vulnerability (reentrancy in `LCOpenTimeout`) with high accuracy and also discovered an additional valid vulnerability in `settleVC`. Both findings are well-explained and actionable.\n  \"\n}\n```"
}