{
  "sample_id": "ds_t2_030",
  "detector_model": "gemini-3-pro",
  "prompt_type": "direct",
  "judge_model": "mistral-large",
  "timestamp": "2026-01-06T01:27:46.042582+00:00",
  "overall_verdict": {
    "said_vulnerable": true,
    "confidence_expressed": 1.0
  },
  "findings": [
    {
      "finding_id": 0,
      "vulnerability_type_claimed": "Denial of Service (DoS)",
      "location_claimed": "CrowdFundBasic.refundAll()",
      "classification": "TARGET_MATCH",
      "reasoning": "\n        **Root Cause Match**: The finding correctly identifies the unbounded iteration over the `refundAddresses` array as a root cause for DoS, which aligns with the ground truth's description of exceeding block gas limits. The finding also highlights the additional risk of reverts from malicious contracts, which is a valid extension of the core issue (unbounded iteration leading to DoS).\n\n        **Location Match**: The finding explicitly targets the `refundAll()` function, which matches the ground truth's specified vulnerable function.\n\n        **Type Match**: The finding uses 'Denial of Service (DoS)', which is an exact semantic match to the ground truth's 'dos'.\n\n        **Quality**:\n        - RCIR: HIGH (0.9) - The root cause is accurately described, including both the unbounded iteration and the revert risk.\n        - AVA: HIGH (1.0) - The attack scenario is concrete, step-by-step, and technically valid.\n        - FSV: HIGH (0.9) - The suggested fix (pull-over-push pattern) aligns with the ground truth's recommendation and is technically sound.\n      "
    },
    {
      "finding_id": 1,
      "vulnerability_type_claimed": "Denial of Service (DoS)",
      "location_claimed": "CrowdFundBatched.refundBatched()",
      "classification": "BONUS_VALID",
      "reasoning": "\n        This finding identifies a real vulnerability in the `refundBatched()` function that is not part of the ground truth. The issue (revert-based DoS due to `transfer()`) is concrete, actionable, and does not require trusted roles. The attack scenario is valid, and the impact (permanent lock of funds) is genuine. Thus, it qualifies as a BONUS_VALID finding.\n      "
    }
  ],
  "target_assessment": {
    "complete_found": true,
    "partial_found": false,
    "finding_id": 0,
    "root_cause_match": true,
    "location_match": true,
    "type_match": "semantic",
    "root_cause_identification": {
      "score": 0.9,
      "reasoning": "The root cause is accurately identified as unbounded iteration leading to DoS, with additional valid context about revert risks."
    },
    "attack_vector_validity": {
      "score": 1.0,
      "reasoning": "The attack scenario is concrete, step-by-step, and technically valid."
    },
    "fix_suggestion_validity": {
      "score": 0.9,
      "reasoning": "The suggested fix (pull-over-push pattern) aligns with the ground truth and is technically sound."
    }
  },
  "summary": {},
  "notes": "\n    The ground truth's root cause was not explicitly specified, but the finding's explanation covers the core issue (unbounded iteration) and extends it with additional valid context (revert risks). This does not detract from the match, as the core issue is correctly identified.\n  ",
  "judge_latency_ms": 15194.337844848633,
  "raw_response": "```json\n{\n  \"overall_verdict\": {\n    \"said_vulnerable\": true,\n    \"confidence_expressed\": 1.0\n  },\n  \"findings\": [\n    {\n      \"finding_id\": 0,\n      \"vulnerability_type_claimed\": \"Denial of Service (DoS)\",\n      \"location_claimed\": \"CrowdFundBasic.refundAll()\",\n      \"classification\": \"TARGET_MATCH\",\n      \"reasoning\": \"\n        **Root Cause Match**: The finding correctly identifies the unbounded iteration over the `refundAddresses` array as a root cause for DoS, which aligns with the ground truth's description of exceeding block gas limits. The finding also highlights the additional risk of reverts from malicious contracts, which is a valid extension of the core issue (unbounded iteration leading to DoS).\n\n        **Location Match**: The finding explicitly targets the `refundAll()` function, which matches the ground truth's specified vulnerable function.\n\n        **Type Match**: The finding uses 'Denial of Service (DoS)', which is an exact semantic match to the ground truth's 'dos'.\n\n        **Quality**:\n        - RCIR: HIGH (0.9) - The root cause is accurately described, including both the unbounded iteration and the revert risk.\n        - AVA: HIGH (1.0) - The attack scenario is concrete, step-by-step, and technically valid.\n        - FSV: HIGH (0.9) - The suggested fix (pull-over-push pattern) aligns with the ground truth's recommendation and is technically sound.\n      \"\n    },\n    {\n      \"finding_id\": 1,\n      \"vulnerability_type_claimed\": \"Denial of Service (DoS)\",\n      \"location_claimed\": \"CrowdFundBatched.refundBatched()\",\n      \"classification\": \"BONUS_VALID\",\n      \"reasoning\": \"\n        This finding identifies a real vulnerability in the `refundBatched()` function that is not part of the ground truth. The issue (revert-based DoS due to `transfer()`) is concrete, actionable, and does not require trusted roles. The attack scenario is valid, and the impact (permanent lock of funds) is genuine. Thus, it qualifies as a BONUS_VALID finding.\n      \"\n    }\n  ],\n  \"target_assessment\": {\n    \"complete_found\": true,\n    \"partial_found\": false,\n    \"finding_id\": 0,\n    \"root_cause_match\": true,\n    \"location_match\": true,\n    \"type_match\": \"semantic\",\n    \"root_cause_identification\": {\n      \"score\": 0.9,\n      \"reasoning\": \"The root cause is accurately identified as unbounded iteration leading to DoS, with additional valid context about revert risks.\"\n    },\n    \"attack_vector_validity\": {\n      \"score\": 1.0,\n      \"reasoning\": \"The attack scenario is concrete, step-by-step, and technically valid.\"\n    },\n    \"fix_suggestion_validity\": {\n      \"score\": 0.9,\n      \"reasoning\": \"The suggested fix (pull-over-push pattern) aligns with the ground truth and is technically sound.\"\n    }\n  },\n  \"notes\": \"\n    The ground truth's root cause was not explicitly specified, but the finding's explanation covers the core issue (unbounded iteration) and extends it with additional valid context (revert risks). This does not detract from the match, as the core issue is correctly identified.\n  \"\n}\n```"
}