{
  "sample_id": "sn_tc_017",
  "variant": "sanitized",
  "detector_model": "claude-opus-4-5",
  "prompt_type": "direct",
  "judge_model": "mistral-large",
  "timestamp": "2026-01-06T00:27:40.469245+00:00",
  "overall_verdict": {
    "said_vulnerable": true,
    "confidence_expressed": 0.95
  },
  "findings": [
    {
      "finding_id": 0,
      "vulnerability_type_claimed": "Price Oracle Manipulation",
      "location_claimed": "getLPTokenValue",
      "classification": "TARGET_MATCH",
      "reasoning": "\n        **Root Cause Match**: The finding correctly identifies that the LP token value is calculated directly from current Uniswap pool reserves without using TWAP or external oracles, making it vulnerable to flash loan manipulation. This matches the ground truth root cause exactly.\n        **Location Match**: The ground truth specifies the vulnerability is in the `borrow` function, but the root cause is in `getLPTokenValue`, which is called by `borrow`. The model correctly identifies the root cause location (`getLPTokenValue`), which is the source of the vulnerability. The ground truth's 'vulnerable functions' field is interpreted as the entry point (`borrow`), but the actual vulnerable logic is in `getLPTokenValue`. This is a semantic match for location.\n        **Type Match**: The type 'Price Oracle Manipulation' is an exact semantic match to the ground truth's 'price_oracle_manipulation'."
    },
    {
      "finding_id": 1,
      "vulnerability_type_claimed": "Incorrect Price Calculation",
      "location_claimed": "getLPTokenValue",
      "classification": "BONUS_VALID",
      "reasoning": "\n        **Bonus Validity**: This finding identifies a separate, real vulnerability not covered in the ground truth. The issue is that the LP token value calculation does not account for the actual market price of ETH (or token1), leading to incorrect valuation. The attack scenario is concrete and does not require trusted roles. The impact (undervaluation or overvaluation of collateral) is genuine and could lead to loss of funds. This is not a hallucination, mischaracterization, or design choice."
    }
  ],
  "target_assessment": {
    "complete_found": true,
    "partial_found": false,
    "finding_id": 0,
    "root_cause_match": true,
    "location_match": true,
    "type_match": "semantic",
    "root_cause_identification": {
      "score": 1.0,
      "reasoning": "The finding's root cause explanation is technically accurate and semantically matches the ground truth. It correctly identifies the lack of TWAP or external oracles and the reliance on spot reserves as the core issue."
    },
    "attack_vector_validity": {
      "score": 1.0,
      "reasoning": "The attack scenario is concrete, step-by-step, and mirrors the ground truth's attack scenario. It demonstrates how flash loans can manipulate reserves to inflate collateral value and overborrow."
    },
    "fix_suggestion_validity": {
      "score": 0.9,
      "reasoning": "The suggested fix (using TWAP oracles) is correct and matches the ground truth. The alternative of using Chainlink oracles is also valid. The fix is slightly less detailed than the ground truth but is technically sound."
    }
  },
  "summary": {},
  "notes": "\n    The ground truth's 'vulnerable functions' field specifies `borrow`, but the actual vulnerable logic is in `getLPTokenValue`. The model correctly identifies the root cause location (`getLPTokenValue`), which is the source of the vulnerability. This is considered a location match because the `borrow` function's vulnerability stems from its reliance on `getLPTokenValue`.",
  "judge_latency_ms": 14950.90627670288,
  "raw_response": "```json\n{\n  \"overall_verdict\": {\n    \"said_vulnerable\": true,\n    \"confidence_expressed\": 0.95\n  },\n  \"findings\": [\n    {\n      \"finding_id\": 0,\n      \"vulnerability_type_claimed\": \"Price Oracle Manipulation\",\n      \"location_claimed\": \"getLPTokenValue\",\n      \"classification\": \"TARGET_MATCH\",\n      \"reasoning\": \"\n        **Root Cause Match**: The finding correctly identifies that the LP token value is calculated directly from current Uniswap pool reserves without using TWAP or external oracles, making it vulnerable to flash loan manipulation. This matches the ground truth root cause exactly.\n        **Location Match**: The ground truth specifies the vulnerability is in the `borrow` function, but the root cause is in `getLPTokenValue`, which is called by `borrow`. The model correctly identifies the root cause location (`getLPTokenValue`), which is the source of the vulnerability. The ground truth's 'vulnerable functions' field is interpreted as the entry point (`borrow`), but the actual vulnerable logic is in `getLPTokenValue`. This is a semantic match for location.\n        **Type Match**: The type 'Price Oracle Manipulation' is an exact semantic match to the ground truth's 'price_oracle_manipulation'.\"\n    },\n    {\n      \"finding_id\": 1,\n      \"vulnerability_type_claimed\": \"Incorrect Price Calculation\",\n      \"location_claimed\": \"getLPTokenValue\",\n      \"classification\": \"BONUS_VALID\",\n      \"reasoning\": \"\n        **Bonus Validity**: This finding identifies a separate, real vulnerability not covered in the ground truth. The issue is that the LP token value calculation does not account for the actual market price of ETH (or token1), leading to incorrect valuation. The attack scenario is concrete and does not require trusted roles. The impact (undervaluation or overvaluation of collateral) is genuine and could lead to loss of funds. This is not a hallucination, mischaracterization, or design choice.\"\n    }\n  ],\n  \"target_assessment\": {\n    \"complete_found\": true,\n    \"partial_found\": false,\n    \"finding_id\": 0,\n    \"root_cause_match\": true,\n    \"location_match\": true,\n    \"type_match\": \"semantic\",\n    \"root_cause_identification\": {\n      \"score\": 1.0,\n      \"reasoning\": \"The finding's root cause explanation is technically accurate and semantically matches the ground truth. It correctly identifies the lack of TWAP or external oracles and the reliance on spot reserves as the core issue.\"\n    },\n    \"attack_vector_validity\": {\n      \"score\": 1.0,\n      \"reasoning\": \"The attack scenario is concrete, step-by-step, and mirrors the ground truth's attack scenario. It demonstrates how flash loans can manipulate reserves to inflate collateral value and overborrow.\"\n    },\n    \"fix_suggestion_validity\": {\n      \"score\": 0.9,\n      \"reasoning\": \"The suggested fix (using TWAP oracles) is correct and matches the ground truth. The alternative of using Chainlink oracles is also valid. The fix is slightly less detailed than the ground truth but is technically sound.\"\n    }\n  },\n  \"notes\": \"\n    The ground truth's 'vulnerable functions' field specifies `borrow`, but the actual vulnerable logic is in `getLPTokenValue`. The model correctly identifies the root cause location (`getLPTokenValue`), which is the source of the vulnerability. This is considered a location match because the `borrow` function's vulnerability stems from its reliance on `getLPTokenValue`.\"\n}\n```"
}