{
  "sample_id": "sn_tc_025",
  "variant": "sanitized",
  "detector_model": "claude-opus-4-5",
  "prompt_type": "direct",
  "judge_model": "mistral-large",
  "timestamp": "2026-01-06T00:29:24.801876+00:00",
  "overall_verdict": {
    "said_vulnerable": true,
    "confidence_expressed": 0.95
  },
  "findings": [
    {
      "finding_id": 0,
      "vulnerability_type_claimed": "Fee-on-Transfer Token Accounting Mismatch",
      "location_claimed": "Vault.deposit()",
      "classification": "TARGET_MATCH",
      "reasoning": "\n        **Root Cause Match**: The finding correctly identifies that the Vault contract assumes it receives the exact `amount` specified in the deposit call, but with fee-on-transfer tokens like DeflatToken, the actual received amount is less due to the burn fee. This matches the ground truth root cause exactly: 'Vault assumed tokens received equal amount transferred. Didn't check actual balance increase before/after transfer. Deflationary tokens with transfer fees caused accounting mismatch between credited amounts and actual holdings.'\n\n        **Location Match**: The finding correctly identifies the vulnerable function as `Vault.deposit()`, which matches the ground truth location.\n\n        **Type Match**: The type 'Fee-on-Transfer Token Accounting Mismatch' is a semantic match to the ground truth type 'accounting_error'. Both describe the same underlying issue of accounting mismatch due to transfer fees.\n\n        **Quality**: The root cause, attack scenario, and fix suggestion are all technically accurate and align with the ground truth. The attack scenario is concrete and demonstrates a realistic exploit path. The fix suggestion is correct and matches the ground truth fix.\n      "
    },
    {
      "finding_id": 1,
      "vulnerability_type_claimed": "Missing Allowance Check",
      "location_claimed": "DeflatToken.transferFrom()",
      "classification": "BONUS_VALID",
      "reasoning": "\n        **Bonus Valid**: This finding identifies a real vulnerability in the `DeflatToken.transferFrom()` function that is not part of the ground truth. The issue is that the function lacks an allowance check, allowing anyone to transfer tokens from any address without approval. This is a genuine security flaw with a concrete attack scenario (unauthorized transfers) and a valid fix (adding allowance checks). The impact is severe (loss of funds) and does not require compromised roles.\n      "
    }
  ],
  "target_assessment": {
    "complete_found": true,
    "partial_found": false,
    "finding_id": 0,
    "root_cause_match": true,
    "location_match": true,
    "type_match": "semantic",
    "root_cause_identification": {
      "score": 1.0,
      "reasoning": "The finding's root cause explanation is technically accurate and semantically matches the ground truth. It correctly identifies the specific issue of accounting mismatch due to unchecked transfer fees."
    },
    "attack_vector_validity": {
      "score": 1.0,
      "reasoning": "The attack scenario is concrete, step-by-step, and demonstrates a realistic exploit path that aligns with the ground truth. It shows how the accounting mismatch can be exploited to drain the vault."
    },
    "fix_suggestion_validity": {
      "score": 1.0,
      "reasoning": "The suggested fix is technically correct and matches the ground truth fix. It addresses the root cause by measuring the actual tokens received via balance checks before and after the transfer."
    }
  },
  "summary": {},
  "notes": "Finding 0 is a clear TARGET_MATCH, meeting all criteria for root cause, location, and type. Finding 1 is a valid bonus finding that identifies a separate, real vulnerability in the code.",
  "judge_latency_ms": 13489.543914794922,
  "raw_response": "```json\n{\n  \"overall_verdict\": {\n    \"said_vulnerable\": true,\n    \"confidence_expressed\": 0.95\n  },\n  \"findings\": [\n    {\n      \"finding_id\": 0,\n      \"vulnerability_type_claimed\": \"Fee-on-Transfer Token Accounting Mismatch\",\n      \"location_claimed\": \"Vault.deposit()\",\n      \"classification\": \"TARGET_MATCH\",\n      \"reasoning\": \"\n        **Root Cause Match**: The finding correctly identifies that the Vault contract assumes it receives the exact `amount` specified in the deposit call, but with fee-on-transfer tokens like DeflatToken, the actual received amount is less due to the burn fee. This matches the ground truth root cause exactly: 'Vault assumed tokens received equal amount transferred. Didn't check actual balance increase before/after transfer. Deflationary tokens with transfer fees caused accounting mismatch between credited amounts and actual holdings.'\n\n        **Location Match**: The finding correctly identifies the vulnerable function as `Vault.deposit()`, which matches the ground truth location.\n\n        **Type Match**: The type 'Fee-on-Transfer Token Accounting Mismatch' is a semantic match to the ground truth type 'accounting_error'. Both describe the same underlying issue of accounting mismatch due to transfer fees.\n\n        **Quality**: The root cause, attack scenario, and fix suggestion are all technically accurate and align with the ground truth. The attack scenario is concrete and demonstrates a realistic exploit path. The fix suggestion is correct and matches the ground truth fix.\n      \"\n    },\n    {\n      \"finding_id\": 1,\n      \"vulnerability_type_claimed\": \"Missing Allowance Check\",\n      \"location_claimed\": \"DeflatToken.transferFrom()\",\n      \"classification\": \"BONUS_VALID\",\n      \"reasoning\": \"\n        **Bonus Valid**: This finding identifies a real vulnerability in the `DeflatToken.transferFrom()` function that is not part of the ground truth. The issue is that the function lacks an allowance check, allowing anyone to transfer tokens from any address without approval. This is a genuine security flaw with a concrete attack scenario (unauthorized transfers) and a valid fix (adding allowance checks). The impact is severe (loss of funds) and does not require compromised roles.\n      \"\n    }\n  ],\n  \"target_assessment\": {\n    \"complete_found\": true,\n    \"partial_found\": false,\n    \"finding_id\": 0,\n    \"root_cause_match\": true,\n    \"location_match\": true,\n    \"type_match\": \"semantic\",\n    \"root_cause_identification\": {\n      \"score\": 1.0,\n      \"reasoning\": \"The finding's root cause explanation is technically accurate and semantically matches the ground truth. It correctly identifies the specific issue of accounting mismatch due to unchecked transfer fees.\"\n    },\n    \"attack_vector_validity\": {\n      \"score\": 1.0,\n      \"reasoning\": \"The attack scenario is concrete, step-by-step, and demonstrates a realistic exploit path that aligns with the ground truth. It shows how the accounting mismatch can be exploited to drain the vault.\"\n    },\n    \"fix_suggestion_validity\": {\n      \"score\": 1.0,\n      \"reasoning\": \"The suggested fix is technically correct and matches the ground truth fix. It addresses the root cause by measuring the actual tokens received via balance checks before and after the transfer.\"\n    }\n  },\n  \"notes\": \"Finding 0 is a clear TARGET_MATCH, meeting all criteria for root cause, location, and type. Finding 1 is a valid bonus finding that identifies a separate, real vulnerability in the code.\"\n}\n```"
}