{
  "sample_id": "ms_tc_017",
  "variant": "minimalsanitized",
  "detector_model": "llama-4-maverick",
  "prompt_type": "direct",
  "judge_model": "mistral-large",
  "timestamp": "2026-01-05T21:13:06.213954+00:00",
  "overall_verdict": {
    "said_vulnerable": true,
    "confidence_expressed": 0.9
  },
  "findings": [
    {
      "finding_id": 0,
      "vulnerability_type_claimed": "Unprotected Price Manipulation",
      "location_claimed": "getLPTokenValue",
      "classification": "TARGET_MATCH",
      "reasoning": "\n        1. **Location Match**: The ground truth specifies the vulnerability is in the `borrow` function, but the root cause is in `getLPTokenValue` (which is called by `borrow`). The finding correctly identifies the root cause location (`getLPTokenValue`), which is where the vulnerable logic resides. This is acceptable as the `borrow` function relies on `getLPTokenValue` for its critical calculation.\n        2. **Root Cause Match**: The finding accurately identifies the root cause: the contract directly uses Uniswap pool reserves to calculate LP token value, which can be manipulated via flash loans. This matches the ground truth's root cause exactly.\n        3. **Type Match**: The type 'Unprotected Price Manipulation' is a semantic match for 'price_oracle_manipulation'. Both describe the same vulnerability class.\n      "
    },
    {
      "finding_id": 1,
      "vulnerability_type_claimed": "Lack of Reentrancy Protection",
      "location_claimed": "borrow, repay, withdraw",
      "classification": "MISCHARACTERIZED",
      "reasoning": "\n        The contract uses Solidity 0.8.0, which has built-in overflow/underflow protection, and the external calls to `IERC20.transfer` and `IERC20.transferFrom` are not followed by state changes that could be exploited for reentrancy. The Checks-Effects-Interactions pattern is correctly followed in all functions (state changes occur before external calls). Thus, this is not a real vulnerability in the provided code.\n      "
    }
  ],
  "target_assessment": {
    "found": true,
    "finding_id": 0,
    "location_match": true,
    "root_cause_match": true,
    "type_match": "semantic",
    "root_cause_identification": {
      "score": 1.0,
      "reasoning": "\n        The finding precisely matches the ground truth root cause: the contract calculates LP token value directly from Uniswap pool reserves, which can be manipulated via flash loans. The explanation is technically accurate and complete.\n      "
    },
    "attack_vector_validity": {
      "score": 1.0,
      "reasoning": "\n        The attack scenario provided in the finding is concrete and matches the ground truth's attack vector. It correctly describes how an attacker can manipulate pool reserves to inflate LP token value and overborrow stablecoins.\n      "
    },
    "fix_suggestion_validity": {
      "score": 1.0,
      "reasoning": "\n        The suggested fix (using a TWAP oracle or external oracle) is technically correct and matches the ground truth's implied fix (using time-weighted average prices or external oracles).\n      "
    }
  },
  "summary": {},
  "notes": "\n    The `borrow` function is the entry point for the vulnerability, but the root cause lies in `getLPTokenValue`. The finding correctly identifies the root cause location, which is sufficient for a TARGET_MATCH. The second finding is a false positive (MISCHARACTERIZED) due to the use of Solidity 0.8.0 and proper adherence to the Checks-Effects-Interactions pattern.\n  ",
  "judge_latency_ms": 14491.995096206665,
  "raw_response": "```json\n{\n  \"overall_verdict\": {\n    \"said_vulnerable\": true,\n    \"confidence_expressed\": 0.9\n  },\n  \"findings\": [\n    {\n      \"finding_id\": 0,\n      \"vulnerability_type_claimed\": \"Unprotected Price Manipulation\",\n      \"location_claimed\": \"getLPTokenValue\",\n      \"classification\": \"TARGET_MATCH\",\n      \"reasoning\": \"\n        1. **Location Match**: The ground truth specifies the vulnerability is in the `borrow` function, but the root cause is in `getLPTokenValue` (which is called by `borrow`). The finding correctly identifies the root cause location (`getLPTokenValue`), which is where the vulnerable logic resides. This is acceptable as the `borrow` function relies on `getLPTokenValue` for its critical calculation.\n        2. **Root Cause Match**: The finding accurately identifies the root cause: the contract directly uses Uniswap pool reserves to calculate LP token value, which can be manipulated via flash loans. This matches the ground truth's root cause exactly.\n        3. **Type Match**: The type 'Unprotected Price Manipulation' is a semantic match for 'price_oracle_manipulation'. Both describe the same vulnerability class.\n      \"\n    },\n    {\n      \"finding_id\": 1,\n      \"vulnerability_type_claimed\": \"Lack of Reentrancy Protection\",\n      \"location_claimed\": \"borrow, repay, withdraw\",\n      \"classification\": \"MISCHARACTERIZED\",\n      \"reasoning\": \"\n        The contract uses Solidity 0.8.0, which has built-in overflow/underflow protection, and the external calls to `IERC20.transfer` and `IERC20.transferFrom` are not followed by state changes that could be exploited for reentrancy. The Checks-Effects-Interactions pattern is correctly followed in all functions (state changes occur before external calls). Thus, this is not a real vulnerability in the provided code.\n      \"\n    }\n  ],\n  \"target_assessment\": {\n    \"found\": true,\n    \"finding_id\": 0,\n    \"location_match\": true,\n    \"root_cause_match\": true,\n    \"type_match\": \"semantic\",\n    \"root_cause_identification\": {\n      \"score\": 1.0,\n      \"reasoning\": \"\n        The finding precisely matches the ground truth root cause: the contract calculates LP token value directly from Uniswap pool reserves, which can be manipulated via flash loans. The explanation is technically accurate and complete.\n      \"\n    },\n    \"attack_vector_validity\": {\n      \"score\": 1.0,\n      \"reasoning\": \"\n        The attack scenario provided in the finding is concrete and matches the ground truth's attack vector. It correctly describes how an attacker can manipulate pool reserves to inflate LP token value and overborrow stablecoins.\n      \"\n    },\n    \"fix_suggestion_validity\": {\n      \"score\": 1.0,\n      \"reasoning\": \"\n        The suggested fix (using a TWAP oracle or external oracle) is technically correct and matches the ground truth's implied fix (using time-weighted average prices or external oracles).\n      \"\n    }\n  },\n  \"notes\": \"\n    The `borrow` function is the entry point for the vulnerability, but the root cause lies in `getLPTokenValue`. The finding correctly identifies the root cause location, which is sufficient for a TARGET_MATCH. The second finding is a false positive (MISCHARACTERIZED) due to the use of Solidity 0.8.0 and proper adherence to the Checks-Effects-Interactions pattern.\n  \"\n}\n```"
}