{
  "sample_id": "ms_tc_005",
  "variant": "minimalsanitized",
  "detector_model": "llama-4-maverick",
  "prompt_type": "direct",
  "judge_model": "mistral-large",
  "timestamp": "2026-01-05T21:12:35.387736+00:00",
  "overall_verdict": {
    "said_vulnerable": true,
    "confidence_expressed": 0.9
  },
  "findings": [
    {
      "finding_id": 0,
      "vulnerability_type_claimed": "Unprotected Function Call",
      "location_claimed": "EthCrossChainManager.verifyHeaderAndExecuteTx",
      "classification": "TARGET_MATCH",
      "reasoning": "\n        1. **Location Match**: The finding correctly identifies the vulnerable function `verifyHeaderAndExecuteTx`, matching the ground truth.\n        2. **Root Cause Match**: The finding explains that the contract calls `toContract.call(abi.encodePacked(method, args))` without proper validation of `toContract` and `method`, allowing an attacker to call any function on any contract. This matches the ground truth root cause: EthCrossChainManager didn't restrict which contracts could be targeted for execution, allowing calls to privileged contracts like EthCrossChainData.\n        3. **Type Match**: The type 'Unprotected Function Call' is a semantic match for 'access_control' as it describes the same underlying issue (lack of access control on function calls).\n        The attack scenario and suggested fix also align with the ground truth, demonstrating a clear understanding of the vulnerability.\n      "
    },
    {
      "finding_id": 1,
      "vulnerability_type_claimed": "Simplified Verification",
      "location_claimed": "EthCrossChainManager._verifyHeader and _verifyProof",
      "classification": "MISCHARACTERIZED",
      "reasoning": "\n        The finding identifies a real issue (simplified verification functions), but this is not the target vulnerability. The ground truth explicitly states that the verification functions are simplified for the example, and the critical issue is the lack of access control in `verifyHeaderAndExecuteTx`. The finding is a valid observation but does not match the target vulnerability's root cause or location.\n      "
    },
    {
      "finding_id": 2,
      "vulnerability_type_claimed": "Static Return Values",
      "location_claimed": "EthCrossChainManager._decodeTx",
      "classification": "INFORMATIONAL",
      "reasoning": "\n        The finding notes that `_decodeTx` returns static values, which is true but not a security vulnerability. It is a design choice or limitation of the simplified example, not a concrete attack vector. Thus, it is classified as informational.\n      "
    }
  ],
  "target_assessment": {
    "found": true,
    "finding_id": 0,
    "location_match": true,
    "root_cause_match": true,
    "type_match": "semantic",
    "root_cause_identification": {
      "score": 1.0,
      "reasoning": "\n        The finding precisely identifies the root cause: lack of validation on `toContract` and `method`, allowing arbitrary function calls to any contract. This matches the ground truth root cause exactly.\n      "
    },
    "attack_vector_validity": {
      "score": 1.0,
      "reasoning": "\n        The attack scenario is concrete and matches the ground truth: an attacker crafts a malicious proof to call privileged functions on EthCrossChainData, bypassing access control. The steps are clear and valid.\n      "
    },
    "fix_suggestion_validity": {
      "score": 0.9,
      "reasoning": "\n        The suggested fix (validate `toContract` and `method`) is correct and aligns with the ground truth's recommendation to implement a whitelist of allowed target contracts. It is slightly less comprehensive than the ground truth's multi-layered fix but is still valid.\n      "
    }
  },
  "summary": {},
  "notes": "\n    The model successfully identified the target vulnerability (Finding 0) with high accuracy. The other findings, while valid observations, do not detract from the primary match and are correctly classified as non-target issues.\n  ",
  "judge_latency_ms": 16471.349954605103,
  "raw_response": "```json\n{\n  \"overall_verdict\": {\n    \"said_vulnerable\": true,\n    \"confidence_expressed\": 0.9\n  },\n  \"findings\": [\n    {\n      \"finding_id\": 0,\n      \"vulnerability_type_claimed\": \"Unprotected Function Call\",\n      \"location_claimed\": \"EthCrossChainManager.verifyHeaderAndExecuteTx\",\n      \"classification\": \"TARGET_MATCH\",\n      \"reasoning\": \"\n        1. **Location Match**: The finding correctly identifies the vulnerable function `verifyHeaderAndExecuteTx`, matching the ground truth.\n        2. **Root Cause Match**: The finding explains that the contract calls `toContract.call(abi.encodePacked(method, args))` without proper validation of `toContract` and `method`, allowing an attacker to call any function on any contract. This matches the ground truth root cause: EthCrossChainManager didn't restrict which contracts could be targeted for execution, allowing calls to privileged contracts like EthCrossChainData.\n        3. **Type Match**: The type 'Unprotected Function Call' is a semantic match for 'access_control' as it describes the same underlying issue (lack of access control on function calls).\n        The attack scenario and suggested fix also align with the ground truth, demonstrating a clear understanding of the vulnerability.\n      \"\n    },\n    {\n      \"finding_id\": 1,\n      \"vulnerability_type_claimed\": \"Simplified Verification\",\n      \"location_claimed\": \"EthCrossChainManager._verifyHeader and _verifyProof\",\n      \"classification\": \"MISCHARACTERIZED\",\n      \"reasoning\": \"\n        The finding identifies a real issue (simplified verification functions), but this is not the target vulnerability. The ground truth explicitly states that the verification functions are simplified for the example, and the critical issue is the lack of access control in `verifyHeaderAndExecuteTx`. The finding is a valid observation but does not match the target vulnerability's root cause or location.\n      \"\n    },\n    {\n      \"finding_id\": 2,\n      \"vulnerability_type_claimed\": \"Static Return Values\",\n      \"location_claimed\": \"EthCrossChainManager._decodeTx\",\n      \"classification\": \"INFORMATIONAL\",\n      \"reasoning\": \"\n        The finding notes that `_decodeTx` returns static values, which is true but not a security vulnerability. It is a design choice or limitation of the simplified example, not a concrete attack vector. Thus, it is classified as informational.\n      \"\n    }\n  ],\n  \"target_assessment\": {\n    \"found\": true,\n    \"finding_id\": 0,\n    \"location_match\": true,\n    \"root_cause_match\": true,\n    \"type_match\": \"semantic\",\n    \"root_cause_identification\": {\n      \"score\": 1.0,\n      \"reasoning\": \"\n        The finding precisely identifies the root cause: lack of validation on `toContract` and `method`, allowing arbitrary function calls to any contract. This matches the ground truth root cause exactly.\n      \"\n    },\n    \"attack_vector_validity\": {\n      \"score\": 1.0,\n      \"reasoning\": \"\n        The attack scenario is concrete and matches the ground truth: an attacker crafts a malicious proof to call privileged functions on EthCrossChainData, bypassing access control. The steps are clear and valid.\n      \"\n    },\n    \"fix_suggestion_validity\": {\n      \"score\": 0.9,\n      \"reasoning\": \"\n        The suggested fix (validate `toContract` and `method`) is correct and aligns with the ground truth's recommendation to implement a whitelist of allowed target contracts. It is slightly less comprehensive than the ground truth's multi-layered fix but is still valid.\n      \"\n    }\n  },\n  \"notes\": \"\n    The model successfully identified the target vulnerability (Finding 0) with high accuracy. The other findings, while valid observations, do not detract from the primary match and are correctly classified as non-target issues.\n  \"\n}\n```"
}