{
  "sample_id": "fp_tc_044",
  "variant": "falseProphet",
  "detector_model": "claude-opus-4-5",
  "prompt_type": "direct",
  "judge_model": "mistral-large",
  "timestamp": "2026-01-06T00:33:10.124073+00:00",
  "overall_verdict": {
    "said_vulnerable": true,
    "confidence_expressed": 0.95
  },
  "findings": [
    {
      "finding_id": 0,
      "vulnerability_type_claimed": "Exchange Rate Manipulation / First Depositor Attack",
      "location_claimed": "mint() and exchangeRate()",
      "classification": "TARGET_MATCH",
      "reasoning": "\n        **Root Cause Match**: The finding correctly identifies the root cause as the exchange rate calculation being vulnerable when totalSupply is very small, allowing donation to manipulate the underlying/supply ratio. The explanation explicitly mentions the initial 1:1 exchange rate (line 41), using contract balance directly (line 44), and integer division rounding (line 61), which aligns with the ground truth's key weaknesses (exchange rate uses balanceOf including donations; no minimum liquidity requirement; tiny totalSupply allows massive rate manipulation).\n\n        **Location Match**: The finding correctly identifies the vulnerable functions `exchangeRate` and `mint`, which are part of the ground truth's specified functions (`exchangeRate`, `mint`, `redeem`, `balanceOfUnderlying`). While it doesn't explicitly mention `redeem` and `balanceOfUnderlying`, the root cause and attack scenario are centered around `exchangeRate` and `mint`, which are sufficient for a match.\n\n        **Type Match**: The type 'Exchange Rate Manipulation / First Depositor Attack' is a semantic match to 'oracle_manipulation' as described in the ground truth. Both refer to the same underlying vulnerability class.\n\n        **Attack Scenario**: The attack scenario provided is concrete and matches the ground truth's description, including the steps of minting minimal cTokens, donating underlying to inflate the exchange rate, and exploiting the inflated collateral value.\n\n        **Fix Suggestion**: The suggested fix (implementing minimum liquidity locking on first deposit) is a valid alternative to the ground truth's fixes (burn first 1000 tokens permanently or implement virtual reserves), and it effectively remediates the issue.\n      "
    },
    {
      "finding_id": 1,
      "vulnerability_type_claimed": "Unchecked Return Value",
      "location_claimed": "mint() and redeem()",
      "classification": "BONUS_VALID",
      "reasoning": "\n        **Bonus Valid**: This finding identifies a real vulnerability not mentioned in the ground truth. The issue of unchecked return values for `transferFrom` and `transfer` calls is a genuine concern, especially with tokens that return false instead of reverting on failure (e.g., USDT). The attack scenario is concrete and plausible, and the suggested fix (using OpenZeppelin's SafeERC20 library) is valid and effective. The vulnerability does not require a trusted role to be compromised and has a genuine impact (loss of funds).\n      "
    }
  ],
  "target_assessment": {
    "complete_found": true,
    "partial_found": false,
    "finding_id": 0,
    "root_cause_match": true,
    "location_match": true,
    "type_match": "semantic",
    "root_cause_identification": {
      "score": 1.0,
      "reasoning": "The finding's explanation of the root cause is technically accurate and semantically matches the ground truth. It correctly identifies the specific weaknesses in the exchange rate calculation and how they can be exploited."
    },
    "attack_vector_validity": {
      "score": 1.0,
      "reasoning": "The attack scenario is concrete, step-by-step, and matches the ground truth's description. It demonstrates a clear and profitable exploit that works as described."
    },
    "fix_suggestion_validity": {
      "score": 0.9,
      "reasoning": "The suggested fix (minimum liquidity locking) is a valid alternative to the ground truth's fixes and effectively remediates the issue. It is slightly less comprehensive than the ground truth's options (e.g., virtual reserves or sanity checks) but still addresses the root cause."
    }
  },
  "summary": {},
  "notes": "Finding 0 is a strong TARGET_MATCH, covering the root cause, location, and type with high accuracy. Finding 1 is a valid bonus finding that highlights an additional real vulnerability not covered in the ground truth.",
  "judge_latency_ms": 16572.657108306885,
  "raw_response": "```json\n{\n  \"overall_verdict\": {\n    \"said_vulnerable\": true,\n    \"confidence_expressed\": 0.95\n  },\n  \"findings\": [\n    {\n      \"finding_id\": 0,\n      \"vulnerability_type_claimed\": \"Exchange Rate Manipulation / First Depositor Attack\",\n      \"location_claimed\": \"mint() and exchangeRate()\",\n      \"classification\": \"TARGET_MATCH\",\n      \"reasoning\": \"\n        **Root Cause Match**: The finding correctly identifies the root cause as the exchange rate calculation being vulnerable when totalSupply is very small, allowing donation to manipulate the underlying/supply ratio. The explanation explicitly mentions the initial 1:1 exchange rate (line 41), using contract balance directly (line 44), and integer division rounding (line 61), which aligns with the ground truth's key weaknesses (exchange rate uses balanceOf including donations; no minimum liquidity requirement; tiny totalSupply allows massive rate manipulation).\n\n        **Location Match**: The finding correctly identifies the vulnerable functions `exchangeRate` and `mint`, which are part of the ground truth's specified functions (`exchangeRate`, `mint`, `redeem`, `balanceOfUnderlying`). While it doesn't explicitly mention `redeem` and `balanceOfUnderlying`, the root cause and attack scenario are centered around `exchangeRate` and `mint`, which are sufficient for a match.\n\n        **Type Match**: The type 'Exchange Rate Manipulation / First Depositor Attack' is a semantic match to 'oracle_manipulation' as described in the ground truth. Both refer to the same underlying vulnerability class.\n\n        **Attack Scenario**: The attack scenario provided is concrete and matches the ground truth's description, including the steps of minting minimal cTokens, donating underlying to inflate the exchange rate, and exploiting the inflated collateral value.\n\n        **Fix Suggestion**: The suggested fix (implementing minimum liquidity locking on first deposit) is a valid alternative to the ground truth's fixes (burn first 1000 tokens permanently or implement virtual reserves), and it effectively remediates the issue.\n      \"\n    },\n    {\n      \"finding_id\": 1,\n      \"vulnerability_type_claimed\": \"Unchecked Return Value\",\n      \"location_claimed\": \"mint() and redeem()\",\n      \"classification\": \"BONUS_VALID\",\n      \"reasoning\": \"\n        **Bonus Valid**: This finding identifies a real vulnerability not mentioned in the ground truth. The issue of unchecked return values for `transferFrom` and `transfer` calls is a genuine concern, especially with tokens that return false instead of reverting on failure (e.g., USDT). The attack scenario is concrete and plausible, and the suggested fix (using OpenZeppelin's SafeERC20 library) is valid and effective. The vulnerability does not require a trusted role to be compromised and has a genuine impact (loss of funds).\n      \"\n    }\n  ],\n  \"target_assessment\": {\n    \"complete_found\": true,\n    \"partial_found\": false,\n    \"finding_id\": 0,\n    \"root_cause_match\": true,\n    \"location_match\": true,\n    \"type_match\": \"semantic\",\n    \"root_cause_identification\": {\n      \"score\": 1.0,\n      \"reasoning\": \"The finding's explanation of the root cause is technically accurate and semantically matches the ground truth. It correctly identifies the specific weaknesses in the exchange rate calculation and how they can be exploited.\"\n    },\n    \"attack_vector_validity\": {\n      \"score\": 1.0,\n      \"reasoning\": \"The attack scenario is concrete, step-by-step, and matches the ground truth's description. It demonstrates a clear and profitable exploit that works as described.\"\n    },\n    \"fix_suggestion_validity\": {\n      \"score\": 0.9,\n      \"reasoning\": \"The suggested fix (minimum liquidity locking) is a valid alternative to the ground truth's fixes and effectively remediates the issue. It is slightly less comprehensive than the ground truth's options (e.g., virtual reserves or sanity checks) but still addresses the root cause.\"\n    }\n  },\n  \"notes\": \"Finding 0 is a strong TARGET_MATCH, covering the root cause, location, and type with high accuracy. Finding 1 is a valid bonus finding that highlights an additional real vulnerability not covered in the ground truth.\"\n}\n```"
}