{
  "sample_id": "fp_tc_038",
  "variant": "falseProphet",
  "detector_model": "claude-opus-4-5",
  "prompt_type": "direct",
  "judge_model": "mistral-large",
  "timestamp": "2026-01-06T00:31:57.705752+00:00",
  "overall_verdict": {
    "said_vulnerable": true,
    "confidence_expressed": 0.95
  },
  "findings": [
    {
      "finding_id": 0,
      "vulnerability_type_claimed": "Unrestricted Minting",
      "location_claimed": "CollateralToken.mint()",
      "classification": "TARGET_MATCH",
      "reasoning": "\n        **Root Cause Match**: The finding correctly identifies the missing access control modifier on the `mint()` function, allowing anyone to mint unlimited tokens. This matches the ground truth's specific root cause: 'Missing access control modifier on mint() function allowing anyone to mint unlimited tokens. Key Weaknesses: No owner/admin check on mint(); No role-based access control; No minting limits or caps.'\n\n        **Location Match**: The finding correctly identifies the `mint()` function (and implicitly the `borrow()` function through the attack scenario) as the vulnerable functions, matching the ground truth locations.\n\n        **Type Match**: The type 'Unrestricted Minting' is a semantic match to 'access_control' as it describes the same vulnerability class (missing access control leading to unauthorized minting).\n\n        **Attack Scenario**: The attack scenario provided is concrete and matches the ground truth's attack flow, demonstrating a valid exploit path.\n\n        **Fix Suggestion**: The suggested fix (adding access control) is valid and matches the ground truth's recommended remediation.\n      "
    },
    {
      "finding_id": 1,
      "vulnerability_type_claimed": "Unchecked Return Value",
      "location_claimed": "CollateralVault (multiple functions)",
      "classification": "BONUS_VALID",
      "reasoning": "\n        **Bonus Validity**: This finding identifies a real vulnerability not covered in the ground truth. The issue of unchecked return values in ERC20 transfers is a genuine concern, especially when interacting with tokens that return false instead of reverting. The attack scenario is concrete and demonstrates a plausible exploit path that could lead to loss of funds. The fix suggestion (using SafeERC20 or checking return values) is valid and remediates the issue.\n      "
    }
  ],
  "target_assessment": {
    "complete_found": true,
    "partial_found": false,
    "finding_id": 0,
    "root_cause_match": true,
    "location_match": true,
    "type_match": "semantic",
    "root_cause_identification": {
      "score": 1.0,
      "reasoning": "The finding's root cause explanation is technically accurate and semantically matches the ground truth, identifying the specific issue of missing access control on the `mint()` function."
    },
    "attack_vector_validity": {
      "score": 1.0,
      "reasoning": "The attack scenario is concrete, step-by-step, and matches the ground truth's attack flow, demonstrating a valid and profitable exploit."
    },
    "fix_suggestion_validity": {
      "score": 1.0,
      "reasoning": "The suggested fix (adding access control) is valid and matches the ground truth's recommended remediation, effectively addressing the root cause."
    }
  },
  "summary": {},
  "notes": "Finding 0 is a clear TARGET_MATCH, while Finding 1 is a valid bonus finding that addresses a different but real vulnerability in the code.",
  "judge_latency_ms": 13261.999130249023,
  "raw_response": "```json\n{\n  \"overall_verdict\": {\n    \"said_vulnerable\": true,\n    \"confidence_expressed\": 0.95\n  },\n  \"findings\": [\n    {\n      \"finding_id\": 0,\n      \"vulnerability_type_claimed\": \"Unrestricted Minting\",\n      \"location_claimed\": \"CollateralToken.mint()\",\n      \"classification\": \"TARGET_MATCH\",\n      \"reasoning\": \"\n        **Root Cause Match**: The finding correctly identifies the missing access control modifier on the `mint()` function, allowing anyone to mint unlimited tokens. This matches the ground truth's specific root cause: 'Missing access control modifier on mint() function allowing anyone to mint unlimited tokens. Key Weaknesses: No owner/admin check on mint(); No role-based access control; No minting limits or caps.'\n\n        **Location Match**: The finding correctly identifies the `mint()` function (and implicitly the `borrow()` function through the attack scenario) as the vulnerable functions, matching the ground truth locations.\n\n        **Type Match**: The type 'Unrestricted Minting' is a semantic match to 'access_control' as it describes the same vulnerability class (missing access control leading to unauthorized minting).\n\n        **Attack Scenario**: The attack scenario provided is concrete and matches the ground truth's attack flow, demonstrating a valid exploit path.\n\n        **Fix Suggestion**: The suggested fix (adding access control) is valid and matches the ground truth's recommended remediation.\n      \"\n    },\n    {\n      \"finding_id\": 1,\n      \"vulnerability_type_claimed\": \"Unchecked Return Value\",\n      \"location_claimed\": \"CollateralVault (multiple functions)\",\n      \"classification\": \"BONUS_VALID\",\n      \"reasoning\": \"\n        **Bonus Validity**: This finding identifies a real vulnerability not covered in the ground truth. The issue of unchecked return values in ERC20 transfers is a genuine concern, especially when interacting with tokens that return false instead of reverting. The attack scenario is concrete and demonstrates a plausible exploit path that could lead to loss of funds. The fix suggestion (using SafeERC20 or checking return values) is valid and remediates the issue.\n      \"\n    }\n  ],\n  \"target_assessment\": {\n    \"complete_found\": true,\n    \"partial_found\": false,\n    \"finding_id\": 0,\n    \"root_cause_match\": true,\n    \"location_match\": true,\n    \"type_match\": \"semantic\",\n    \"root_cause_identification\": {\n      \"score\": 1.0,\n      \"reasoning\": \"The finding's root cause explanation is technically accurate and semantically matches the ground truth, identifying the specific issue of missing access control on the `mint()` function.\"\n    },\n    \"attack_vector_validity\": {\n      \"score\": 1.0,\n      \"reasoning\": \"The attack scenario is concrete, step-by-step, and matches the ground truth's attack flow, demonstrating a valid and profitable exploit.\"\n    },\n    \"fix_suggestion_validity\": {\n      \"score\": 1.0,\n      \"reasoning\": \"The suggested fix (adding access control) is valid and matches the ground truth's recommended remediation, effectively addressing the root cause.\"\n    }\n  },\n  \"notes\": \"Finding 0 is a clear TARGET_MATCH, while Finding 1 is a valid bonus finding that addresses a different but real vulnerability in the code.\"\n}\n```"
}