{
  "sample_id": "fp_tc_045",
  "variant": "falseProphet",
  "detector_model": "claude-opus-4-5",
  "prompt_type": "direct",
  "judge_model": "mistral-large",
  "timestamp": "2026-01-06T00:33:26.707981+00:00",
  "overall_verdict": {
    "said_vulnerable": true,
    "confidence_expressed": 0.92
  },
  "findings": [
    {
      "finding_id": 0,
      "vulnerability_type_claimed": "Arbitrary Market Injection / Access Control Bypass",
      "location_claimed": "LendingMarket.borrow()",
      "classification": "TARGET_MATCH",
      "reasoning": "\n        **Root Cause Match**: The finding correctly identifies that the DebtPreviewer trusts user-provided market addresses without validation, allowing fake market data injection. This matches the ground truth root cause exactly, including the key weaknesses of unvalidated user-provided market addresses and trust in arbitrary contracts.\n\n        **Location Match**: The finding identifies the `borrow` function, which is one of the vulnerable functions specified in the ground truth. While it does not explicitly mention `previewDebt` and `previewMultipleMarkets`, the root cause is intrinsically linked to these functions as they are called within `borrow`. The ground truth specifies that all three functions are vulnerable, and the finding's focus on `borrow` is sufficient for a location match since it is the entry point for the exploit.\n\n        **Type Match**: The type 'Arbitrary Market Injection / Access Control Bypass' is a semantic match to 'oracle_manipulation'. Both describe the same underlying issue of trusting unvalidated external data sources to manipulate perceived collateral value.\n\n        **Attack Scenario and Fix**: The attack scenario and suggested fix are concrete, accurate, and align with the ground truth. The fix (whitelisting trusted markets) directly addresses the root cause.\n      "
    },
    {
      "finding_id": 1,
      "vulnerability_type_claimed": "Unchecked Return Value",
      "location_claimed": "LendingMarket.deposit() and LendingMarket.borrow()",
      "classification": "BONUS_VALID",
      "reasoning": "\n        **Bonus Valid**: This finding identifies a real, distinct vulnerability not covered in the ground truth. The issue of unchecked return values for ERC20 transfers is a legitimate concern, especially for tokens that do not revert on failure. The attack scenario is concrete and plausible, and the suggested fix (using SafeERC20 or checking return values) is valid and remediates the issue. This finding meets all criteria for BONUS_VALID.\n      "
    }
  ],
  "target_assessment": {
    "complete_found": true,
    "partial_found": false,
    "finding_id": 0,
    "root_cause_match": true,
    "location_match": true,
    "type_match": "semantic",
    "root_cause_identification": {
      "score": 1.0,
      "reasoning": "\n        The finding's explanation of the root cause is technically accurate and semantically matches the ground truth. It explicitly states that the DebtPreviewer trusts user-provided market addresses without validation, allowing fake market data injection. This is a HIGH match.\n      "
    },
    "attack_vector_validity": {
      "score": 1.0,
      "reasoning": "\n        The attack scenario is concrete, step-by-step, and accurately describes how an attacker could exploit the vulnerability to over-borrow. It aligns perfectly with the ground truth attack flow and is HIGH validity.\n      "
    },
    "fix_suggestion_validity": {
      "score": 1.0,
      "reasoning": "\n        The suggested fix (implementing a whitelist of trusted market addresses) is technically correct and directly addresses the root cause. It matches the ground truth fix and is HIGH validity.\n      "
    }
  },
  "summary": {},
  "notes": "\n    The first finding is a TARGET_MATCH despite not explicitly listing all three vulnerable functions (`previewDebt`, `previewMultipleMarkets`, `borrow`). The `borrow` function is the critical entry point for the exploit, and the root cause is correctly identified as originating from the DebtPreviewer's trust in unvalidated market addresses, which is called within `borrow`. The location match is thus considered valid.\n  ",
  "judge_latency_ms": 16372.45798110962,
  "raw_response": "```json\n{\n  \"overall_verdict\": {\n    \"said_vulnerable\": true,\n    \"confidence_expressed\": 0.92\n  },\n  \"findings\": [\n    {\n      \"finding_id\": 0,\n      \"vulnerability_type_claimed\": \"Arbitrary Market Injection / Access Control Bypass\",\n      \"location_claimed\": \"LendingMarket.borrow()\",\n      \"classification\": \"TARGET_MATCH\",\n      \"reasoning\": \"\n        **Root Cause Match**: The finding correctly identifies that the DebtPreviewer trusts user-provided market addresses without validation, allowing fake market data injection. This matches the ground truth root cause exactly, including the key weaknesses of unvalidated user-provided market addresses and trust in arbitrary contracts.\n\n        **Location Match**: The finding identifies the `borrow` function, which is one of the vulnerable functions specified in the ground truth. While it does not explicitly mention `previewDebt` and `previewMultipleMarkets`, the root cause is intrinsically linked to these functions as they are called within `borrow`. The ground truth specifies that all three functions are vulnerable, and the finding's focus on `borrow` is sufficient for a location match since it is the entry point for the exploit.\n\n        **Type Match**: The type 'Arbitrary Market Injection / Access Control Bypass' is a semantic match to 'oracle_manipulation'. Both describe the same underlying issue of trusting unvalidated external data sources to manipulate perceived collateral value.\n\n        **Attack Scenario and Fix**: The attack scenario and suggested fix are concrete, accurate, and align with the ground truth. The fix (whitelisting trusted markets) directly addresses the root cause.\n      \"\n    },\n    {\n      \"finding_id\": 1,\n      \"vulnerability_type_claimed\": \"Unchecked Return Value\",\n      \"location_claimed\": \"LendingMarket.deposit() and LendingMarket.borrow()\",\n      \"classification\": \"BONUS_VALID\",\n      \"reasoning\": \"\n        **Bonus Valid**: This finding identifies a real, distinct vulnerability not covered in the ground truth. The issue of unchecked return values for ERC20 transfers is a legitimate concern, especially for tokens that do not revert on failure. The attack scenario is concrete and plausible, and the suggested fix (using SafeERC20 or checking return values) is valid and remediates the issue. This finding meets all criteria for BONUS_VALID.\n      \"\n    }\n  ],\n  \"target_assessment\": {\n    \"complete_found\": true,\n    \"partial_found\": false,\n    \"finding_id\": 0,\n    \"root_cause_match\": true,\n    \"location_match\": true,\n    \"type_match\": \"semantic\",\n    \"root_cause_identification\": {\n      \"score\": 1.0,\n      \"reasoning\": \"\n        The finding's explanation of the root cause is technically accurate and semantically matches the ground truth. It explicitly states that the DebtPreviewer trusts user-provided market addresses without validation, allowing fake market data injection. This is a HIGH match.\n      \"\n    },\n    \"attack_vector_validity\": {\n      \"score\": 1.0,\n      \"reasoning\": \"\n        The attack scenario is concrete, step-by-step, and accurately describes how an attacker could exploit the vulnerability to over-borrow. It aligns perfectly with the ground truth attack flow and is HIGH validity.\n      \"\n    },\n    \"fix_suggestion_validity\": {\n      \"score\": 1.0,\n      \"reasoning\": \"\n        The suggested fix (implementing a whitelist of trusted market addresses) is technically correct and directly addresses the root cause. It matches the ground truth fix and is HIGH validity.\n      \"\n    }\n  },\n  \"notes\": \"\n    The first finding is a TARGET_MATCH despite not explicitly listing all three vulnerable functions (`previewDebt`, `previewMultipleMarkets`, `borrow`). The `borrow` function is the critical entry point for the exploit, and the root cause is correctly identified as originating from the DebtPreviewer's trust in unvalidated market addresses, which is called within `borrow`. The location match is thus considered valid.\n  \"\n}\n```"
}