{
  "sample_id": "fp_tc_018",
  "variant": "falseProphet",
  "detector_model": "claude-opus-4-5",
  "prompt_type": "direct",
  "judge_model": "mistral-large",
  "timestamp": "2026-01-06T00:28:02.750357+00:00",
  "overall_verdict": {
    "said_vulnerable": true,
    "confidence_expressed": 0.95
  },
  "findings": [
    {
      "finding_id": 0,
      "vulnerability_type_claimed": "Unprotected Initialization",
      "location_claimed": "init()",
      "classification": "TARGET_MATCH",
      "reasoning": "\n        **Root Cause Match**: The finding correctly identifies the missing `require(!isInitialized)` check at the start of the `init()` function, which allows reinitialization and overwriting of critical parameters like the maintainer address. This matches the ground truth root cause exactly.\n        **Location Match**: The finding correctly identifies the `init()` function as the vulnerable location.\n        **Type Match**: The type 'Unprotected Initialization' is a semantic match to the ground truth type 'reinitialization'.\n        The explanation, attack scenario, and suggested fix all align with the ground truth, demonstrating a clear understanding of the vulnerability.\n      "
    },
    {
      "finding_id": 1,
      "vulnerability_type_claimed": "Unchecked Return Value",
      "location_claimed": "addLiquidity(), swap(), claimFees()",
      "classification": "BONUS_VALID",
      "reasoning": "\n        **Bonus Validity**: This finding identifies a real vulnerability not covered in the ground truth. The issue of unchecked return values for ERC20 transfers is a genuine security concern, especially for tokens that return false on failure instead of reverting. The attack scenario is concrete and plausible, involving silent failures in `transferFrom` calls leading to incorrect balance updates and potential token extraction without proper input. The suggested fix (using SafeERC20 or checking return values) is valid and remediates the issue.\n      "
    }
  ],
  "target_assessment": {
    "complete_found": true,
    "partial_found": false,
    "finding_id": 0,
    "root_cause_match": true,
    "location_match": true,
    "type_match": "semantic",
    "root_cause_identification": {
      "score": 1.0,
      "reasoning": "The finding's root cause explanation is technically accurate and semantically matches the ground truth, identifying the missing initialization guard and its implications for parameter overwriting."
    },
    "attack_vector_validity": {
      "score": 1.0,
      "reasoning": "The attack scenario is concrete, step-by-step, and matches the ground truth's description of how an attacker can hijack the maintainer role and redirect fees."
    },
    "fix_suggestion_validity": {
      "score": 1.0,
      "reasoning": "The suggested fix (adding `require(!isInitialized, 'Already initialized')`) is correct and aligns with the ground truth's recommended remediation."
    }
  },
  "summary": {},
  "notes": "Finding 0 is a clear TARGET_MATCH, while Finding 1 is a valid bonus finding that addresses a separate, real vulnerability in the contract.",
  "judge_latency_ms": 12060.595989227295,
  "raw_response": "```json\n{\n  \"overall_verdict\": {\n    \"said_vulnerable\": true,\n    \"confidence_expressed\": 0.95\n  },\n  \"findings\": [\n    {\n      \"finding_id\": 0,\n      \"vulnerability_type_claimed\": \"Unprotected Initialization\",\n      \"location_claimed\": \"init()\",\n      \"classification\": \"TARGET_MATCH\",\n      \"reasoning\": \"\n        **Root Cause Match**: The finding correctly identifies the missing `require(!isInitialized)` check at the start of the `init()` function, which allows reinitialization and overwriting of critical parameters like the maintainer address. This matches the ground truth root cause exactly.\n        **Location Match**: The finding correctly identifies the `init()` function as the vulnerable location.\n        **Type Match**: The type 'Unprotected Initialization' is a semantic match to the ground truth type 'reinitialization'.\n        The explanation, attack scenario, and suggested fix all align with the ground truth, demonstrating a clear understanding of the vulnerability.\n      \"\n    },\n    {\n      \"finding_id\": 1,\n      \"vulnerability_type_claimed\": \"Unchecked Return Value\",\n      \"location_claimed\": \"addLiquidity(), swap(), claimFees()\",\n      \"classification\": \"BONUS_VALID\",\n      \"reasoning\": \"\n        **Bonus Validity**: This finding identifies a real vulnerability not covered in the ground truth. The issue of unchecked return values for ERC20 transfers is a genuine security concern, especially for tokens that return false on failure instead of reverting. The attack scenario is concrete and plausible, involving silent failures in `transferFrom` calls leading to incorrect balance updates and potential token extraction without proper input. The suggested fix (using SafeERC20 or checking return values) is valid and remediates the issue.\n      \"\n    }\n  ],\n  \"target_assessment\": {\n    \"complete_found\": true,\n    \"partial_found\": false,\n    \"finding_id\": 0,\n    \"root_cause_match\": true,\n    \"location_match\": true,\n    \"type_match\": \"semantic\",\n    \"root_cause_identification\": {\n      \"score\": 1.0,\n      \"reasoning\": \"The finding's root cause explanation is technically accurate and semantically matches the ground truth, identifying the missing initialization guard and its implications for parameter overwriting.\"\n    },\n    \"attack_vector_validity\": {\n      \"score\": 1.0,\n      \"reasoning\": \"The attack scenario is concrete, step-by-step, and matches the ground truth's description of how an attacker can hijack the maintainer role and redirect fees.\"\n    },\n    \"fix_suggestion_validity\": {\n      \"score\": 1.0,\n      \"reasoning\": \"The suggested fix (adding `require(!isInitialized, 'Already initialized')`) is correct and aligns with the ground truth's recommended remediation.\"\n    }\n  },\n  \"notes\": \"Finding 0 is a clear TARGET_MATCH, while Finding 1 is a valid bonus finding that addresses a separate, real vulnerability in the contract.\"\n}\n```"
}