{
  "sample_id": "nc_tc_045",
  "variant": "nocomments",
  "detector_model": "claude-opus-4-5",
  "prompt_type": "direct",
  "judge_model": "mistral-large",
  "timestamp": "2026-01-06T00:33:48.578467+00:00",
  "overall_verdict": {
    "said_vulnerable": true,
    "confidence_expressed": 0.95
  },
  "findings": [
    {
      "finding_id": 0,
      "vulnerability_type_claimed": "Arbitrary Market Array Manipulation",
      "location_claimed": "LendingMarket.borrow()",
      "classification": "TARGET_MATCH",
      "reasoning": "\n        **Root Cause Match**: The finding correctly identifies that the DebtPreviewer trusts user-provided market addresses without validation, allowing fake market data injection. The explanation explicitly mentions the lack of validation for market addresses and the ability to pass malicious contracts implementing IMarket, which matches the ground truth root cause exactly.\n\n        **Location Match**: The finding identifies the `borrow` function, which is one of the vulnerable functions specified in the ground truth (previewDebt, previewMultipleMarkets, borrow). While it does not explicitly mention `previewDebt` or `previewMultipleMarkets`, the root cause is inherently tied to the `borrow` function's use of these preview functions, and the attack scenario flows through `borrow`. Thus, the location is considered a match.\n\n        **Type Match**: The type 'Arbitrary Market Array Manipulation' is a semantic match to 'oracle_manipulation' as it describes the same underlying issue (manipulation of trusted data sources). The ground truth explicitly mentions 'oracle_manipulation', but the model's terminology is contextually equivalent.\n      "
    },
    {
      "finding_id": 1,
      "vulnerability_type_claimed": "Unchecked Return Value",
      "location_claimed": "LendingMarket.deposit() and LendingMarket.borrow()",
      "classification": "BONUS_VALID",
      "reasoning": "\n        **Bonus Valid**: This finding identifies a real vulnerability not covered in the ground truth. The issue of unchecked return values for ERC20 transfers is a known risk, especially with non-standard tokens like USDT. The attack scenario is concrete and plausible, involving phantom collateral due to failed transfers not reverting. The impact is genuine (loss of funds), and the fix suggestion (using SafeERC20) is valid and remediates the issue. This is not a design choice or informational issue, and it does not require trusted roles to be compromised.\n      "
    }
  ],
  "target_assessment": {
    "complete_found": true,
    "partial_found": false,
    "finding_id": 0,
    "root_cause_match": true,
    "location_match": true,
    "type_match": "semantic",
    "root_cause_identification": {
      "score": 1.0,
      "reasoning": "\n        The root cause is identified with high precision. The finding explicitly states that the `markets` array is user-controlled and lacks validation, allowing malicious market addresses to be passed. This matches the ground truth's root cause of 'DebtPreviewer trusted user-provided market addresses without validation, allowing fake market data injection' exactly.\n      "
    },
    "attack_vector_validity": {
      "score": 0.9,
      "reasoning": "\n        The attack scenario is concrete and step-by-step, matching the ground truth's description. It correctly outlines how a malicious market can be used to inflate collateral values and over-borrow. The only minor deduction is for not explicitly mentioning the possibility of mixing legitimate and malicious markets in the array (though this is implied by the attack scenario).\n      "
    },
    "fix_suggestion_validity": {
      "score": 0.9,
      "reasoning": "\n        The suggested fix (implementing a whitelist of authorized markets) is valid and aligns with the ground truth's recommendation. The fix is technically correct and would remediate the issue. The minor deduction is for not mentioning the alternative fix of querying markets directly from the protocol or integrating a trusted price oracle, though the whitelist approach is sufficient.\n      "
    }
  },
  "summary": {},
  "notes": "\n    The model's first finding is a strong TARGET_MATCH, as it correctly identifies the root cause, location, and type of the vulnerability. The second finding is a valid bonus issue, demonstrating the model's ability to identify additional vulnerabilities beyond the ground truth. The evaluation of the first finding's location is slightly lenient, as it focuses on `borrow` but does not explicitly mention `previewDebt` or `previewMultipleMarkets`. However, the root cause is inherently tied to these functions, and the attack flows through `borrow`, so the location is considered a match.\n  ",
  "judge_latency_ms": 18359.818935394287,
  "raw_response": "```json\n{\n  \"overall_verdict\": {\n    \"said_vulnerable\": true,\n    \"confidence_expressed\": 0.95\n  },\n  \"findings\": [\n    {\n      \"finding_id\": 0,\n      \"vulnerability_type_claimed\": \"Arbitrary Market Array Manipulation\",\n      \"location_claimed\": \"LendingMarket.borrow()\",\n      \"classification\": \"TARGET_MATCH\",\n      \"reasoning\": \"\n        **Root Cause Match**: The finding correctly identifies that the DebtPreviewer trusts user-provided market addresses without validation, allowing fake market data injection. The explanation explicitly mentions the lack of validation for market addresses and the ability to pass malicious contracts implementing IMarket, which matches the ground truth root cause exactly.\n\n        **Location Match**: The finding identifies the `borrow` function, which is one of the vulnerable functions specified in the ground truth (previewDebt, previewMultipleMarkets, borrow). While it does not explicitly mention `previewDebt` or `previewMultipleMarkets`, the root cause is inherently tied to the `borrow` function's use of these preview functions, and the attack scenario flows through `borrow`. Thus, the location is considered a match.\n\n        **Type Match**: The type 'Arbitrary Market Array Manipulation' is a semantic match to 'oracle_manipulation' as it describes the same underlying issue (manipulation of trusted data sources). The ground truth explicitly mentions 'oracle_manipulation', but the model's terminology is contextually equivalent.\n      \"\n    },\n    {\n      \"finding_id\": 1,\n      \"vulnerability_type_claimed\": \"Unchecked Return Value\",\n      \"location_claimed\": \"LendingMarket.deposit() and LendingMarket.borrow()\",\n      \"classification\": \"BONUS_VALID\",\n      \"reasoning\": \"\n        **Bonus Valid**: This finding identifies a real vulnerability not covered in the ground truth. The issue of unchecked return values for ERC20 transfers is a known risk, especially with non-standard tokens like USDT. The attack scenario is concrete and plausible, involving phantom collateral due to failed transfers not reverting. The impact is genuine (loss of funds), and the fix suggestion (using SafeERC20) is valid and remediates the issue. This is not a design choice or informational issue, and it does not require trusted roles to be compromised.\n      \"\n    }\n  ],\n  \"target_assessment\": {\n    \"complete_found\": true,\n    \"partial_found\": false,\n    \"finding_id\": 0,\n    \"root_cause_match\": true,\n    \"location_match\": true,\n    \"type_match\": \"semantic\",\n    \"root_cause_identification\": {\n      \"score\": 1.0,\n      \"reasoning\": \"\n        The root cause is identified with high precision. The finding explicitly states that the `markets` array is user-controlled and lacks validation, allowing malicious market addresses to be passed. This matches the ground truth's root cause of 'DebtPreviewer trusted user-provided market addresses without validation, allowing fake market data injection' exactly.\n      \"\n    },\n    \"attack_vector_validity\": {\n      \"score\": 0.9,\n      \"reasoning\": \"\n        The attack scenario is concrete and step-by-step, matching the ground truth's description. It correctly outlines how a malicious market can be used to inflate collateral values and over-borrow. The only minor deduction is for not explicitly mentioning the possibility of mixing legitimate and malicious markets in the array (though this is implied by the attack scenario).\n      \"\n    },\n    \"fix_suggestion_validity\": {\n      \"score\": 0.9,\n      \"reasoning\": \"\n        The suggested fix (implementing a whitelist of authorized markets) is valid and aligns with the ground truth's recommendation. The fix is technically correct and would remediate the issue. The minor deduction is for not mentioning the alternative fix of querying markets directly from the protocol or integrating a trusted price oracle, though the whitelist approach is sufficient.\n      \"\n    }\n  },\n  \"notes\": \"\n    The model's first finding is a strong TARGET_MATCH, as it correctly identifies the root cause, location, and type of the vulnerability. The second finding is a valid bonus issue, demonstrating the model's ability to identify additional vulnerabilities beyond the ground truth. The evaluation of the first finding's location is slightly lenient, as it focuses on `borrow` but does not explicitly mention `previewDebt` or `previewMultipleMarkets`. However, the root cause is inherently tied to these functions, and the attack flows through `borrow`, so the location is considered a match.\n  \"\n}\n```"
}