{
  "sample_id": "nc_tc_042",
  "variant": "nocomments",
  "detector_model": "claude-opus-4-5",
  "prompt_type": "direct",
  "judge_model": "mistral-large",
  "timestamp": "2026-01-06T00:33:05.149022+00:00",
  "overall_verdict": {
    "said_vulnerable": true,
    "confidence_expressed": 0.92
  },
  "findings": [
    {
      "finding_id": 0,
      "vulnerability_type_claimed": "Arbitrary External Call / Fake Market Attack",
      "location_claimed": "VeTokenStaking contract - deposit, claimRewards, withdraw functions",
      "classification": "PARTIAL_MATCH",
      "reasoning": "\n        - **Root Cause Match**: The finding correctly identifies the lack of market validation (insufficient market validation on registration) and mentions the risk of reentrancy via arbitrary external calls. However, it does not explicitly state that the reentrancy is combined with the market validation issue as the root cause, nor does it highlight the violation of the checks-effects-interactions pattern in `claimRewards()`.\n        - **Location Match**: The finding correctly identifies the vulnerable functions (`deposit`, `claimRewards`, `withdraw`), which match the ground truth.\n        - **Type Match**: The type claimed ('Arbitrary External Call / Fake Market Attack') is partially related to reentrancy but is not a semantic or exact match. The focus is more on arbitrary external calls and fake markets rather than the reentrancy vulnerability itself.\n        - **Conclusion**: The root cause and location match, but the type is imprecise, so this is a PARTIAL_MATCH.\n      "
    },
    {
      "finding_id": 1,
      "vulnerability_type_claimed": "Unchecked Return Value",
      "location_claimed": "VeTokenStaking - deposit and withdraw functions",
      "classification": "BONUS_VALID",
      "reasoning": "\n        - This is a valid vulnerability not mentioned in the ground truth.\n        - **Existence**: The issue exists in the code (unchecked return values for `transfer` and `transferFrom`).\n        - **Attack Scenario**: The scenario is concrete and plausible (non-standard ERC20 tokens returning false instead of reverting).\n        - **Impact**: Genuine risk of accounting discrepancies leading to loss of funds.\n        - **No Trusted Role Required**: The attack does not require compromising an admin or owner.\n        - **Conclusion**: This is a BONUS_VALID finding.\n      "
    },
    {
      "finding_id": 2,
      "vulnerability_type_claimed": "Broken Reward Distribution",
      "location_claimed": "VeTokenStaking - claimRewards function",
      "classification": "INFORMATIONAL",
      "reasoning": "\n        - **Existence**: The issue exists (empty loop in `claimRewards`), but it is not a security vulnerability.\n        - **Impact**: While rewards are not distributed, this is a functional bug rather than a security risk. There is no concrete attack scenario that leads to loss of funds or unauthorized access.\n        - **Conclusion**: This is an INFORMATIONAL finding, as it is a true observation but not security-relevant.\n      "
    }
  ],
  "target_assessment": {
    "complete_found": false,
    "partial_found": true,
    "finding_id": 0,
    "root_cause_match": true,
    "location_match": true,
    "type_match": "partial",
    "root_cause_identification": {
      "score": 0.7,
      "reasoning": "\n        - The finding correctly identifies the lack of market validation and the risk of arbitrary external calls, which are key components of the root cause.\n        - However, it does not explicitly mention the reentrancy vulnerability in `claimRewards()` or the violation of the checks-effects-interactions pattern, which are critical aspects of the ground truth root cause.\n        - The explanation is technically accurate but incomplete.\n      "
    },
    "attack_vector_validity": {
      "score": 0.6,
      "reasoning": "\n        - The attack scenario describes inflating balances via a fake market, which is plausible but does not fully match the ground truth attack flow.\n        - The scenario lacks the reentrancy aspect during the `claimRewards` callback, which is the core of the ground truth exploit.\n        - The steps are partially correct but miss the critical reentrancy manipulation.\n      "
    },
    "fix_suggestion_validity": {
      "score": 0.8,
      "reasoning": "\n        - The suggested fix (whitelisting approved markets) is a valid alternative to the ground truth fix (reentrancy guards + market validation).\n        - It addresses the lack of market validation, which is a key part of the root cause.\n        - However, it does not address the reentrancy vulnerability directly, which is another critical aspect of the ground truth fix.\n      "
    }
  },
  "summary": {},
  "notes": "\n    - The LLM's findings are insightful but miss the explicit reentrancy aspect of the ground truth vulnerability. The PARTIAL_MATCH finding (Finding 0) correctly identifies the market validation issue but does not fully capture the reentrancy root cause.\n    - The BONUS_VALID finding (Finding 1) is a legitimate and important vulnerability not covered in the ground truth.\n    - The INFORMATIONAL finding (Finding 2) is accurate but not security-relevant.\n  ",
  "judge_latency_ms": 19395.982027053833,
  "raw_response": "```json\n{\n  \"overall_verdict\": {\n    \"said_vulnerable\": true,\n    \"confidence_expressed\": 0.92\n  },\n  \"findings\": [\n    {\n      \"finding_id\": 0,\n      \"vulnerability_type_claimed\": \"Arbitrary External Call / Fake Market Attack\",\n      \"location_claimed\": \"VeTokenStaking contract - deposit, claimRewards, withdraw functions\",\n      \"classification\": \"PARTIAL_MATCH\",\n      \"reasoning\": \"\n        - **Root Cause Match**: The finding correctly identifies the lack of market validation (insufficient market validation on registration) and mentions the risk of reentrancy via arbitrary external calls. However, it does not explicitly state that the reentrancy is combined with the market validation issue as the root cause, nor does it highlight the violation of the checks-effects-interactions pattern in `claimRewards()`.\n        - **Location Match**: The finding correctly identifies the vulnerable functions (`deposit`, `claimRewards`, `withdraw`), which match the ground truth.\n        - **Type Match**: The type claimed ('Arbitrary External Call / Fake Market Attack') is partially related to reentrancy but is not a semantic or exact match. The focus is more on arbitrary external calls and fake markets rather than the reentrancy vulnerability itself.\n        - **Conclusion**: The root cause and location match, but the type is imprecise, so this is a PARTIAL_MATCH.\n      \"\n    },\n    {\n      \"finding_id\": 1,\n      \"vulnerability_type_claimed\": \"Unchecked Return Value\",\n      \"location_claimed\": \"VeTokenStaking - deposit and withdraw functions\",\n      \"classification\": \"BONUS_VALID\",\n      \"reasoning\": \"\n        - This is a valid vulnerability not mentioned in the ground truth.\n        - **Existence**: The issue exists in the code (unchecked return values for `transfer` and `transferFrom`).\n        - **Attack Scenario**: The scenario is concrete and plausible (non-standard ERC20 tokens returning false instead of reverting).\n        - **Impact**: Genuine risk of accounting discrepancies leading to loss of funds.\n        - **No Trusted Role Required**: The attack does not require compromising an admin or owner.\n        - **Conclusion**: This is a BONUS_VALID finding.\n      \"\n    },\n    {\n      \"finding_id\": 2,\n      \"vulnerability_type_claimed\": \"Broken Reward Distribution\",\n      \"location_claimed\": \"VeTokenStaking - claimRewards function\",\n      \"classification\": \"INFORMATIONAL\",\n      \"reasoning\": \"\n        - **Existence**: The issue exists (empty loop in `claimRewards`), but it is not a security vulnerability.\n        - **Impact**: While rewards are not distributed, this is a functional bug rather than a security risk. There is no concrete attack scenario that leads to loss of funds or unauthorized access.\n        - **Conclusion**: This is an INFORMATIONAL finding, as it is a true observation but not security-relevant.\n      \"\n    }\n  ],\n  \"target_assessment\": {\n    \"complete_found\": false,\n    \"partial_found\": true,\n    \"finding_id\": 0,\n    \"root_cause_match\": true,\n    \"location_match\": true,\n    \"type_match\": \"partial\",\n    \"root_cause_identification\": {\n      \"score\": 0.7,\n      \"reasoning\": \"\n        - The finding correctly identifies the lack of market validation and the risk of arbitrary external calls, which are key components of the root cause.\n        - However, it does not explicitly mention the reentrancy vulnerability in `claimRewards()` or the violation of the checks-effects-interactions pattern, which are critical aspects of the ground truth root cause.\n        - The explanation is technically accurate but incomplete.\n      \"\n    },\n    \"attack_vector_validity\": {\n      \"score\": 0.6,\n      \"reasoning\": \"\n        - The attack scenario describes inflating balances via a fake market, which is plausible but does not fully match the ground truth attack flow.\n        - The scenario lacks the reentrancy aspect during the `claimRewards` callback, which is the core of the ground truth exploit.\n        - The steps are partially correct but miss the critical reentrancy manipulation.\n      \"\n    },\n    \"fix_suggestion_validity\": {\n      \"score\": 0.8,\n      \"reasoning\": \"\n        - The suggested fix (whitelisting approved markets) is a valid alternative to the ground truth fix (reentrancy guards + market validation).\n        - It addresses the lack of market validation, which is a key part of the root cause.\n        - However, it does not address the reentrancy vulnerability directly, which is another critical aspect of the ground truth fix.\n      \"\n    }\n  },\n  \"notes\": \"\n    - The LLM's findings are insightful but miss the explicit reentrancy aspect of the ground truth vulnerability. The PARTIAL_MATCH finding (Finding 0) correctly identifies the market validation issue but does not fully capture the reentrancy root cause.\n    - The BONUS_VALID finding (Finding 1) is a legitimate and important vulnerability not covered in the ground truth.\n    - The INFORMATIONAL finding (Finding 2) is accurate but not security-relevant.\n  \"\n}\n```"
}