{
  "sample_id": "nc_tc_017",
  "variant": "nocomments",
  "detector_model": "claude-opus-4-5",
  "prompt_type": "direct",
  "judge_model": "mistral-large",
  "timestamp": "2026-01-06T00:27:55.510338+00:00",
  "overall_verdict": {
    "said_vulnerable": true,
    "confidence_expressed": 0.95
  },
  "findings": [
    {
      "finding_id": 0,
      "vulnerability_type_claimed": "Price Oracle Manipulation",
      "location_claimed": "getLPTokenValue",
      "classification": "TARGET_MATCH",
      "reasoning": "\n        **Root Cause Match**: The finding correctly identifies that the LP token value is calculated directly from current Uniswap pool reserves (getReserves) without TWAP or external oracles, making it vulnerable to flash loan manipulation. This matches the ground truth root cause exactly.\n        **Location Match**: The ground truth specifies the vulnerability is in the `borrow` function, but the root cause is in `getLPTokenValue`, which is called by `borrow`. The model correctly identifies the root cause location (`getLPTokenValue`), which is the source of the vulnerability. The ground truth's 'borrow' function is the entry point, but the actual issue is in `getLPTokenValue`. This is a semantic match for location.\n        **Type Match**: The type 'Price Oracle Manipulation' is an exact semantic match to the ground truth's 'price_oracle_manipulation'.\n        **Conclusion**: This is a TARGET_MATCH because the root cause, location (semantic), and type all align with the ground truth."
    },
    {
      "finding_id": 1,
      "vulnerability_type_claimed": "Incorrect Price Calculation",
      "location_claimed": "getLPTokenValue",
      "classification": "BONUS_VALID",
      "reasoning": "\n        **Bonus Validity**: This finding identifies a real, distinct vulnerability not covered in the ground truth. The issue is that the function adds raw token amounts (amount0 + amount1) without considering their actual USD values or decimals, which can lead to incorrect collateral valuation. The attack scenario is concrete and demonstrates how this could be exploited to over-borrow. The suggested fix (using proper price conversion with oracles) is valid and remediates the issue. This is not a hallucination, mischaracterization, or security theater."
    }
  ],
  "target_assessment": {
    "complete_found": true,
    "partial_found": false,
    "finding_id": 0,
    "root_cause_match": true,
    "location_match": true,
    "type_match": "semantic",
    "root_cause_identification": {
      "score": 1.0,
      "reasoning": "The model's explanation of the root cause (using spot reserves without TWAP or external oracles) is technically accurate and semantically identical to the ground truth. It demonstrates a clear understanding of the specific issue."
    },
    "attack_vector_validity": {
      "score": 1.0,
      "reasoning": "The attack scenario is concrete, step-by-step, and mirrors the ground truth's attack scenario. It correctly describes how flash loans can manipulate reserves to inflate LP token value and over-borrow."
    },
    "fix_suggestion_validity": {
      "score": 0.9,
      "reasoning": "The suggested fix (using TWAP oracles or Chainlink) is valid and aligns with the ground truth's remediation. The only minor deduction is for not explicitly mentioning multi-block delays or other manipulation-resistant formulas, but the core fix is correct."
    }
  },
  "summary": {},
  "notes": "\n    - The ground truth specifies the vulnerable function as `borrow`, but the actual root cause is in `getLPTokenValue`. The model correctly identified the root cause location, which is more precise. This is treated as a semantic location match.\n    - Finding 1 is classified as BONUS_VALID because it identifies a real, distinct vulnerability (incorrect price calculation due to raw token addition) that is not covered in the ground truth but is a genuine security issue.",
  "judge_latency_ms": 15506.44302368164,
  "raw_response": "```json\n{\n  \"overall_verdict\": {\n    \"said_vulnerable\": true,\n    \"confidence_expressed\": 0.95\n  },\n  \"findings\": [\n    {\n      \"finding_id\": 0,\n      \"vulnerability_type_claimed\": \"Price Oracle Manipulation\",\n      \"location_claimed\": \"getLPTokenValue\",\n      \"classification\": \"TARGET_MATCH\",\n      \"reasoning\": \"\n        **Root Cause Match**: The finding correctly identifies that the LP token value is calculated directly from current Uniswap pool reserves (getReserves) without TWAP or external oracles, making it vulnerable to flash loan manipulation. This matches the ground truth root cause exactly.\n        **Location Match**: The ground truth specifies the vulnerability is in the `borrow` function, but the root cause is in `getLPTokenValue`, which is called by `borrow`. The model correctly identifies the root cause location (`getLPTokenValue`), which is the source of the vulnerability. The ground truth's 'borrow' function is the entry point, but the actual issue is in `getLPTokenValue`. This is a semantic match for location.\n        **Type Match**: The type 'Price Oracle Manipulation' is an exact semantic match to the ground truth's 'price_oracle_manipulation'.\n        **Conclusion**: This is a TARGET_MATCH because the root cause, location (semantic), and type all align with the ground truth.\"\n    },\n    {\n      \"finding_id\": 1,\n      \"vulnerability_type_claimed\": \"Incorrect Price Calculation\",\n      \"location_claimed\": \"getLPTokenValue\",\n      \"classification\": \"BONUS_VALID\",\n      \"reasoning\": \"\n        **Bonus Validity**: This finding identifies a real, distinct vulnerability not covered in the ground truth. The issue is that the function adds raw token amounts (amount0 + amount1) without considering their actual USD values or decimals, which can lead to incorrect collateral valuation. The attack scenario is concrete and demonstrates how this could be exploited to over-borrow. The suggested fix (using proper price conversion with oracles) is valid and remediates the issue. This is not a hallucination, mischaracterization, or security theater.\"\n    }\n  ],\n  \"target_assessment\": {\n    \"complete_found\": true,\n    \"partial_found\": false,\n    \"finding_id\": 0,\n    \"root_cause_match\": true,\n    \"location_match\": true,\n    \"type_match\": \"semantic\",\n    \"root_cause_identification\": {\n      \"score\": 1.0,\n      \"reasoning\": \"The model's explanation of the root cause (using spot reserves without TWAP or external oracles) is technically accurate and semantically identical to the ground truth. It demonstrates a clear understanding of the specific issue.\"\n    },\n    \"attack_vector_validity\": {\n      \"score\": 1.0,\n      \"reasoning\": \"The attack scenario is concrete, step-by-step, and mirrors the ground truth's attack scenario. It correctly describes how flash loans can manipulate reserves to inflate LP token value and over-borrow.\"\n    },\n    \"fix_suggestion_validity\": {\n      \"score\": 0.9,\n      \"reasoning\": \"The suggested fix (using TWAP oracles or Chainlink) is valid and aligns with the ground truth's remediation. The only minor deduction is for not explicitly mentioning multi-block delays or other manipulation-resistant formulas, but the core fix is correct.\"\n    }\n  },\n  \"notes\": \"\n    - The ground truth specifies the vulnerable function as `borrow`, but the actual root cause is in `getLPTokenValue`. The model correctly identified the root cause location, which is more precise. This is treated as a semantic location match.\n    - Finding 1 is classified as BONUS_VALID because it identifies a real, distinct vulnerability (incorrect price calculation due to raw token addition) that is not covered in the ground truth but is a genuine security issue.\"\n}\n```"
}