{
  "sample_id": "nc_tc_011",
  "variant": "nocomments",
  "detector_model": "claude-opus-4-5",
  "prompt_type": "direct",
  "judge_model": "mistral-large",
  "timestamp": "2026-01-06T00:26:42.531252+00:00",
  "overall_verdict": {
    "said_vulnerable": true,
    "confidence_expressed": 0.95
  },
  "findings": [
    {
      "finding_id": 0,
      "vulnerability_type_claimed": "Reward Calculation Based on Total Balance",
      "location_claimed": "mintFor",
      "classification": "TARGET_MATCH",
      "reasoning": "\n        **Root Cause Match**: The finding correctly identifies that the `mintFor` function calculates rewards based on the entire LP token balance of the contract (`lpToken.balanceOf(address(this))`) rather than just the fees deposited in the transaction. This matches the ground truth root cause: 'Using balanceOf(address(this)) for reward calculation instead of tracking actual deposits. Attacker sent tokens directly to contract before calling mintFor, inflating the balance used for reward calculation.'\n\n        **Location Match**: The finding correctly identifies the `mintFor` function as the vulnerable location, which matches the ground truth.\n\n        **Type Match**: The vulnerability type 'Reward Calculation Based on Total Balance' is a semantic match to the ground truth type 'arithmetic_error', as both describe an issue with incorrect arithmetic calculation due to reliance on an inflatable balance.\n\n        **Attack Scenario**: The provided attack scenario is concrete and demonstrates the exploit effectively, showing how an attacker can earn disproportionate rewards with minimal contribution.\n\n        **Fix Suggestion**: The suggested fix ('Calculate rewards based only on the fees deposited in the current transaction') is correct and aligns with the ground truth fix ('Track deposits explicitly instead of using balanceOf')."
    },
    {
      "finding_id": 1,
      "vulnerability_type_claimed": "Unchecked Return Value",
      "location_claimed": "deposit, mintFor, getReward, withdraw",
      "classification": "BONUS_VALID",
      "reasoning": "\n        **Bonus Validity**: This finding identifies a real vulnerability not covered in the ground truth. The issue of unchecked return values for `transfer` and `transferFrom` is a known risk, especially with tokens like USDT that return false instead of reverting. The attack scenario is concrete and demonstrates a plausible exploit leading to accounting discrepancies. The suggested fix (using SafeERC20 or checking return values) is valid and remediates the issue."
    }
  ],
  "target_assessment": {
    "complete_found": true,
    "partial_found": false,
    "finding_id": 0,
    "root_cause_match": true,
    "location_match": true,
    "type_match": "semantic",
    "root_cause_identification": {
      "score": 1.0,
      "reasoning": "The finding's root cause explanation is technically accurate and semantically matches the ground truth. It correctly identifies the specific issue of using `balanceOf(address(this))` for reward calculation, which can be inflated by direct token transfers."
    },
    "attack_vector_validity": {
      "score": 1.0,
      "reasoning": "The attack scenario is concrete, step-by-step, and demonstrates a valid exploit that would work in practice. It aligns with the ground truth attack scenario but provides additional clarity."
    },
    "fix_suggestion_validity": {
      "score": 1.0,
      "reasoning": "The suggested fix is correct and remediates the issue by calculating rewards based on the fees deposited in the transaction, not the total contract balance. This matches the ground truth fix conceptually."
    }
  },
  "summary": {},
  "notes": "Finding 0 is a strong TARGET_MATCH with high-quality root cause identification, attack vector, and fix suggestion. Finding 1 is a valid bonus finding that addresses a separate, real vulnerability in the contract.",
  "judge_latency_ms": 13983.75415802002,
  "raw_response": "```json\n{\n  \"overall_verdict\": {\n    \"said_vulnerable\": true,\n    \"confidence_expressed\": 0.95\n  },\n  \"findings\": [\n    {\n      \"finding_id\": 0,\n      \"vulnerability_type_claimed\": \"Reward Calculation Based on Total Balance\",\n      \"location_claimed\": \"mintFor\",\n      \"classification\": \"TARGET_MATCH\",\n      \"reasoning\": \"\n        **Root Cause Match**: The finding correctly identifies that the `mintFor` function calculates rewards based on the entire LP token balance of the contract (`lpToken.balanceOf(address(this))`) rather than just the fees deposited in the transaction. This matches the ground truth root cause: 'Using balanceOf(address(this)) for reward calculation instead of tracking actual deposits. Attacker sent tokens directly to contract before calling mintFor, inflating the balance used for reward calculation.'\n\n        **Location Match**: The finding correctly identifies the `mintFor` function as the vulnerable location, which matches the ground truth.\n\n        **Type Match**: The vulnerability type 'Reward Calculation Based on Total Balance' is a semantic match to the ground truth type 'arithmetic_error', as both describe an issue with incorrect arithmetic calculation due to reliance on an inflatable balance.\n\n        **Attack Scenario**: The provided attack scenario is concrete and demonstrates the exploit effectively, showing how an attacker can earn disproportionate rewards with minimal contribution.\n\n        **Fix Suggestion**: The suggested fix ('Calculate rewards based only on the fees deposited in the current transaction') is correct and aligns with the ground truth fix ('Track deposits explicitly instead of using balanceOf').\"\n    },\n    {\n      \"finding_id\": 1,\n      \"vulnerability_type_claimed\": \"Unchecked Return Value\",\n      \"location_claimed\": \"deposit, mintFor, getReward, withdraw\",\n      \"classification\": \"BONUS_VALID\",\n      \"reasoning\": \"\n        **Bonus Validity**: This finding identifies a real vulnerability not covered in the ground truth. The issue of unchecked return values for `transfer` and `transferFrom` is a known risk, especially with tokens like USDT that return false instead of reverting. The attack scenario is concrete and demonstrates a plausible exploit leading to accounting discrepancies. The suggested fix (using SafeERC20 or checking return values) is valid and remediates the issue.\"\n    }\n  ],\n  \"target_assessment\": {\n    \"complete_found\": true,\n    \"partial_found\": false,\n    \"finding_id\": 0,\n    \"root_cause_match\": true,\n    \"location_match\": true,\n    \"type_match\": \"semantic\",\n    \"root_cause_identification\": {\n      \"score\": 1.0,\n      \"reasoning\": \"The finding's root cause explanation is technically accurate and semantically matches the ground truth. It correctly identifies the specific issue of using `balanceOf(address(this))` for reward calculation, which can be inflated by direct token transfers.\"\n    },\n    \"attack_vector_validity\": {\n      \"score\": 1.0,\n      \"reasoning\": \"The attack scenario is concrete, step-by-step, and demonstrates a valid exploit that would work in practice. It aligns with the ground truth attack scenario but provides additional clarity.\"\n    },\n    \"fix_suggestion_validity\": {\n      \"score\": 1.0,\n      \"reasoning\": \"The suggested fix is correct and remediates the issue by calculating rewards based on the fees deposited in the transaction, not the total contract balance. This matches the ground truth fix conceptually.\"\n    }\n  },\n  \"notes\": \"Finding 0 is a strong TARGET_MATCH with high-quality root cause identification, attack vector, and fix suggestion. Finding 1 is a valid bonus finding that addresses a separate, real vulnerability in the contract.\"\n}\n```"
}