{
  "sample_id": "sn_tc_044",
  "variant": "sanitized",
  "detector_model": "gemini-3-pro",
  "prompt_type": "direct",
  "judge_model": "mistral-large",
  "timestamp": "2026-01-06T00:30:11.868468+00:00",
  "overall_verdict": {
    "said_vulnerable": true,
    "confidence_expressed": 0.95
  },
  "findings": [
    {
      "finding_id": 0,
      "vulnerability_type_claimed": "Inflation Attack / First Depositor Attack",
      "location_claimed": "exchangeRate() and mint()",
      "classification": "TARGET_MATCH",
      "reasoning": "\n        **Root Cause Match**: The finding correctly identifies the root cause as the exchange rate calculation being vulnerable when totalSupply is very small, allowing donation to manipulate the underlying/supply ratio. The explanation explicitly mentions the reliance on `underlying.balanceOf(address(this))` (which includes direct transfers) and the lack of minimum liquidity requirements, which aligns with the ground truth.\n\n        **Location Match**: The finding correctly identifies the vulnerable functions `exchangeRate()` and `mint()`, which are part of the ground truth functions (`exchangeRate`, `mint`, `redeem`, `balanceOfUnderlying`). While it doesn't mention `redeem` or `balanceOfUnderlying`, it is sufficient to match at least one of the ground truth functions.\n\n        **Type Match**: The type 'Inflation Attack / First Depositor Attack' is a semantic match to 'oracle_manipulation' as both describe the same vulnerability class (manipulation of the exchange rate through donation attacks).\n\n        **Attack Scenario**: The attack scenario provided is concrete and matches the ground truth, demonstrating a step-by-step exploit that results in the theft of victim funds.\n\n        **Fix Suggestion**: The suggested fixes (burning a small amount of shares or using internal accounting) are valid and align with the ground truth fixes (minimum liquidity lock or virtual reserves).\n      "
    },
    {
      "finding_id": 1,
      "vulnerability_type_claimed": "Unchecked Return Value",
      "location_claimed": "mint() and redeem()",
      "classification": "BONUS_VALID",
      "reasoning": "\n        **Bonus Valid**: This finding identifies a real vulnerability not mentioned in the ground truth. The issue of unchecked return values for ERC20 transfers is a genuine security concern, especially for tokens that return `false` on failure instead of reverting. The attack scenario is concrete and demonstrates how an attacker could mint cTokens without depositing underlying assets. The suggested fix (using `SafeERC20` or requiring the return value) is valid and remediates the issue.\n      "
    }
  ],
  "target_assessment": {
    "complete_found": true,
    "partial_found": false,
    "finding_id": 0,
    "root_cause_match": true,
    "location_match": true,
    "type_match": "semantic",
    "root_cause_identification": {
      "score": 1.0,
      "reasoning": "The root cause is identified with high precision, matching the ground truth explanation of the exchange rate vulnerability due to small totalSupply and donation manipulation."
    },
    "attack_vector_validity": {
      "score": 1.0,
      "reasoning": "The attack scenario is concrete, step-by-step, and matches the ground truth exploit flow, demonstrating a realistic and profitable attack."
    },
    "fix_suggestion_validity": {
      "score": 0.9,
      "reasoning": "The suggested fixes are valid and align with the ground truth. The only minor deduction is for not explicitly mentioning 'virtual reserves' or 'sanity checks,' but the provided fixes are technically correct and effective."
    }
  },
  "summary": {},
  "notes": "Finding 0 is a strong TARGET_MATCH, covering the critical oracle manipulation vulnerability. Finding 1 is a valid bonus finding, highlighting an additional security issue not in the ground truth.",
  "judge_latency_ms": 14264.09387588501,
  "raw_response": "```json\n{\n  \"overall_verdict\": {\n    \"said_vulnerable\": true,\n    \"confidence_expressed\": 0.95\n  },\n  \"findings\": [\n    {\n      \"finding_id\": 0,\n      \"vulnerability_type_claimed\": \"Inflation Attack / First Depositor Attack\",\n      \"location_claimed\": \"exchangeRate() and mint()\",\n      \"classification\": \"TARGET_MATCH\",\n      \"reasoning\": \"\n        **Root Cause Match**: The finding correctly identifies the root cause as the exchange rate calculation being vulnerable when totalSupply is very small, allowing donation to manipulate the underlying/supply ratio. The explanation explicitly mentions the reliance on `underlying.balanceOf(address(this))` (which includes direct transfers) and the lack of minimum liquidity requirements, which aligns with the ground truth.\n\n        **Location Match**: The finding correctly identifies the vulnerable functions `exchangeRate()` and `mint()`, which are part of the ground truth functions (`exchangeRate`, `mint`, `redeem`, `balanceOfUnderlying`). While it doesn't mention `redeem` or `balanceOfUnderlying`, it is sufficient to match at least one of the ground truth functions.\n\n        **Type Match**: The type 'Inflation Attack / First Depositor Attack' is a semantic match to 'oracle_manipulation' as both describe the same vulnerability class (manipulation of the exchange rate through donation attacks).\n\n        **Attack Scenario**: The attack scenario provided is concrete and matches the ground truth, demonstrating a step-by-step exploit that results in the theft of victim funds.\n\n        **Fix Suggestion**: The suggested fixes (burning a small amount of shares or using internal accounting) are valid and align with the ground truth fixes (minimum liquidity lock or virtual reserves).\n      \"\n    },\n    {\n      \"finding_id\": 1,\n      \"vulnerability_type_claimed\": \"Unchecked Return Value\",\n      \"location_claimed\": \"mint() and redeem()\",\n      \"classification\": \"BONUS_VALID\",\n      \"reasoning\": \"\n        **Bonus Valid**: This finding identifies a real vulnerability not mentioned in the ground truth. The issue of unchecked return values for ERC20 transfers is a genuine security concern, especially for tokens that return `false` on failure instead of reverting. The attack scenario is concrete and demonstrates how an attacker could mint cTokens without depositing underlying assets. The suggested fix (using `SafeERC20` or requiring the return value) is valid and remediates the issue.\n      \"\n    }\n  ],\n  \"target_assessment\": {\n    \"complete_found\": true,\n    \"partial_found\": false,\n    \"finding_id\": 0,\n    \"root_cause_match\": true,\n    \"location_match\": true,\n    \"type_match\": \"semantic\",\n    \"root_cause_identification\": {\n      \"score\": 1.0,\n      \"reasoning\": \"The root cause is identified with high precision, matching the ground truth explanation of the exchange rate vulnerability due to small totalSupply and donation manipulation.\"\n    },\n    \"attack_vector_validity\": {\n      \"score\": 1.0,\n      \"reasoning\": \"The attack scenario is concrete, step-by-step, and matches the ground truth exploit flow, demonstrating a realistic and profitable attack.\"\n    },\n    \"fix_suggestion_validity\": {\n      \"score\": 0.9,\n      \"reasoning\": \"The suggested fixes are valid and align with the ground truth. The only minor deduction is for not explicitly mentioning 'virtual reserves' or 'sanity checks,' but the provided fixes are technically correct and effective.\"\n    }\n  },\n  \"notes\": \"Finding 0 is a strong TARGET_MATCH, covering the critical oracle manipulation vulnerability. Finding 1 is a valid bonus finding, highlighting an additional security issue not in the ground truth.\"\n}\n```"
}