{
  "sample_id": "gs_020",
  "dataset": "gs",
  "prompt_type": "context_protocol_cot_naturalistic",
  "detector_model": "gemini-3-pro",
  "judge_model": "mistral-large",
  "timestamp": "2026-01-06T06:15:41.596253+00:00",
  "overall_verdict": {
    "said_vulnerable": true,
    "confidence_expressed": 0.95
  },
  "findings": [
    {
      "finding_id": 0,
      "vulnerability_type_claimed": "Signature Replay",
      "location_claimed": "UniswapV4KEMHook.sol:116-127",
      "classification": "TARGET_MATCH",
      "reasoning": "\n        **Root Cause Match**: The finding correctly identifies that the signature digest construction lacks domain separation (no chain ID or contract address), which allows cross-chain replay attacks. This matches the ground truth's specific root cause about the absence of domain separators and the implications for cross-chain replay.\n\n        **Location Match**: The finding correctly identifies the vulnerable function (`beforeSwap`) and the specific lines (116-127) where the digest is constructed. This matches the ground truth's location.\n\n        **Type Match**: The finding uses the exact terminology 'Signature Replay', which is a semantic match to the ground truth's 'signature_replay'.\n\n        **Quality**:\n        - Root Cause Identification: HIGH (0.9). The explanation is technically accurate and matches the ground truth.\n        - Attack Vector Validity: HIGH (0.9). The attack scenario is concrete and matches the ground truth's cross-chain replay scenario.\n        - Fix Suggestion Validity: HIGH (0.9). The suggested fix (including `block.chainid` and `address(this)`) is valid and aligns with the ground truth's recommendation for domain separation.\n      "
    },
    {
      "finding_id": 1,
      "vulnerability_type_claimed": "Lack of EIP-712 Compliance",
      "location_claimed": "UniswapV4KEMHook.sol:116-127",
      "classification": "BONUS_VALID",
      "reasoning": "\n        **Bonus Validity**: This finding is a valid security concern that is not part of the ground truth but is relevant and actionable.\n        - The issue (lack of EIP-712 compliance) actually exists in the code.\n        - The attack scenario (collisions if the signer key is reused elsewhere) is plausible and specific.\n        - The impact (potential signature misuse) is genuine.\n        - The fix (implementing EIP-712) is valid and would remediate the issue.\n        - The issue does not require a trusted role to be compromised and is not security theater.\n      "
    }
  ],
  "target_assessment": {
    "complete_found": true,
    "partial_found": false,
    "finding_id": 0,
    "root_cause_match": true,
    "location_match": true,
    "type_match": "semantic",
    "root_cause_identification": {
      "score": 0.9,
      "reasoning": "The finding's root cause explanation is technically accurate and semantically matches the ground truth. It correctly identifies the absence of domain separation as the core issue enabling cross-chain replay attacks."
    },
    "attack_vector_validity": {
      "score": 0.9,
      "reasoning": "The attack scenario is concrete, step-by-step, and matches the ground truth's cross-chain replay attack. It demonstrates a clear and profitable exploit."
    },
    "fix_suggestion_validity": {
      "score": 0.9,
      "reasoning": "The suggested fix (including `block.chainid` and `address(this)`) is valid and aligns with the ground truth's recommendation for domain separation. It would effectively remediate the issue."
    }
  },
  "summary": {},
  "notes": "Finding 0 is a strong TARGET_MATCH, fully meeting the prerequisite criteria and type match. Finding 1 is a valid bonus finding, highlighting an additional security concern not covered in the ground truth.",
  "judge_latency_ms": 16467.555046081543,
  "raw_response": "```json\n{\n  \"overall_verdict\": {\n    \"said_vulnerable\": true,\n    \"confidence_expressed\": 0.95\n  },\n  \"findings\": [\n    {\n      \"finding_id\": 0,\n      \"vulnerability_type_claimed\": \"Signature Replay\",\n      \"location_claimed\": \"UniswapV4KEMHook.sol:116-127\",\n      \"classification\": \"TARGET_MATCH\",\n      \"reasoning\": \"\n        **Root Cause Match**: The finding correctly identifies that the signature digest construction lacks domain separation (no chain ID or contract address), which allows cross-chain replay attacks. This matches the ground truth's specific root cause about the absence of domain separators and the implications for cross-chain replay.\n\n        **Location Match**: The finding correctly identifies the vulnerable function (`beforeSwap`) and the specific lines (116-127) where the digest is constructed. This matches the ground truth's location.\n\n        **Type Match**: The finding uses the exact terminology 'Signature Replay', which is a semantic match to the ground truth's 'signature_replay'.\n\n        **Quality**:\n        - Root Cause Identification: HIGH (0.9). The explanation is technically accurate and matches the ground truth.\n        - Attack Vector Validity: HIGH (0.9). The attack scenario is concrete and matches the ground truth's cross-chain replay scenario.\n        - Fix Suggestion Validity: HIGH (0.9). The suggested fix (including `block.chainid` and `address(this)`) is valid and aligns with the ground truth's recommendation for domain separation.\n      \"\n    },\n    {\n      \"finding_id\": 1,\n      \"vulnerability_type_claimed\": \"Lack of EIP-712 Compliance\",\n      \"location_claimed\": \"UniswapV4KEMHook.sol:116-127\",\n      \"classification\": \"BONUS_VALID\",\n      \"reasoning\": \"\n        **Bonus Validity**: This finding is a valid security concern that is not part of the ground truth but is relevant and actionable.\n        - The issue (lack of EIP-712 compliance) actually exists in the code.\n        - The attack scenario (collisions if the signer key is reused elsewhere) is plausible and specific.\n        - The impact (potential signature misuse) is genuine.\n        - The fix (implementing EIP-712) is valid and would remediate the issue.\n        - The issue does not require a trusted role to be compromised and is not security theater.\n      \"\n    }\n  ],\n  \"target_assessment\": {\n    \"complete_found\": true,\n    \"partial_found\": false,\n    \"finding_id\": 0,\n    \"root_cause_match\": true,\n    \"location_match\": true,\n    \"type_match\": \"semantic\",\n    \"root_cause_identification\": {\n      \"score\": 0.9,\n      \"reasoning\": \"The finding's root cause explanation is technically accurate and semantically matches the ground truth. It correctly identifies the absence of domain separation as the core issue enabling cross-chain replay attacks.\"\n    },\n    \"attack_vector_validity\": {\n      \"score\": 0.9,\n      \"reasoning\": \"The attack scenario is concrete, step-by-step, and matches the ground truth's cross-chain replay attack. It demonstrates a clear and profitable exploit.\"\n    },\n    \"fix_suggestion_validity\": {\n      \"score\": 0.9,\n      \"reasoning\": \"The suggested fix (including `block.chainid` and `address(this)`) is valid and aligns with the ground truth's recommendation for domain separation. It would effectively remediate the issue.\"\n    }\n  },\n  \"notes\": \"Finding 0 is a strong TARGET_MATCH, fully meeting the prerequisite criteria and type match. Finding 1 is a valid bonus finding, highlighting an additional security concern not covered in the ground truth.\"\n}\n```"
}