{
  "sample_id": "ds_t2_069",
  "detector_model": "claude-opus-4-5",
  "prompt_type": "direct",
  "judge_model": "gemini-3-flash",
  "timestamp": "2026-01-04T21:26:18.002134+00:00",
  "overall_verdict": {
    "said_vulnerable": true,
    "confidence_expressed": 0.95
  },
  "findings": [
    {
      "finding_id": 0,
      "description": "The secretSeed is derived from predictable blockchain variables, allowing users to pre-calculate if they win.",
      "vulnerability_type_claimed": "Predictable Randomness / Weak PRNG",
      "severity_claimed": "critical",
      "location_claimed": "luckyNumberOfAddress, reseed",
      "matches_target": false,
      "is_valid_concern": true,
      "classification": "BONUS_VALID",
      "reasoning": "This is a classic and highly exploitable vulnerability in early Solidity contracts. Since the seed is based on block variables and the winning check is public/predictable, an attacker can indeed guarantee a win before spending gas on the transaction. This is not the specific logic error in forceReseed mentioned in the ground truth, but it is a valid, high-impact vulnerability."
    },
    {
      "finding_id": 1,
      "description": "In Solidity 0.4.x, local struct variables default to storage, creating an uninitialized storage pointer that overwrites state variables.",
      "vulnerability_type_claimed": "Uninitialized Storage Pointer",
      "severity_claimed": "high",
      "location_claimed": "forceReseed",
      "matches_target": true,
      "is_valid_concern": true,
      "classification": "TARGET_MATCH",
      "reasoning": "This correctly identifies the specific logic error in the forceReseed function. In Solidity 0.4.19, 'SeedComponents s;' defaults to storage and points to slot 0. Assigning values to its members overwrites 'owner', 'secretSeed', and 'lastReseed'. This matches the ground truth's location and description of a logic error in forceReseed."
    },
    {
      "finding_id": 2,
      "description": "Attackers can observe pending transactions and front-run reseed events.",
      "vulnerability_type_claimed": "Front-running",
      "severity_claimed": "high",
      "location_claimed": "participate",
      "matches_target": false,
      "is_valid_concern": true,
      "classification": "BONUS_VALID",
      "reasoning": "This is a valid concern regarding the mechanics of the lottery. If a reseed is about to happen, an attacker can manipulate their position in the block to exploit the new seed. While related to the randomness issue, it is a distinct architectural weakness."
    }
  ],
  "target_assessment": {
    "found": true,
    "finding_id": 1,
    "type_match": "semantic",
    "type_match_reasoning": "The ground truth uses the broad term 'logic_error', while the finding identifies the specific technical cause: 'Uninitialized Storage Pointer'.",
    "root_cause_identification": {
      "score": 1.0,
      "reasoning": "Correctly identifies that in 0.4.x, uninitialized local structs in functions default to storage and point to slot 0, leading to state corruption."
    },
    "attack_vector_validity": {
      "score": 1.0,
      "reasoning": "Correctly identifies that calling forceReseed will overwrite the owner and other state variables due to the storage pointer overlap."
    },
    "fix_suggestion_validity": {
      "score": 1.0,
      "reasoning": "Correctly suggests using the 'memory' keyword, which is the standard fix for this specific Solidity 0.4.x behavior."
    }
  },
  "summary": {
    "total_findings": 3,
    "target_matches": 1,
    "partial_matches": 0,
    "bonus_valid": 2,
    "hallucinated": 0,
    "mischaracterized": 0,
    "design_choice": 0,
    "out_of_scope": 0,
    "security_theater": 0,
    "informational": 0
  },
  "notes": "The LLM performed exceptionally well, identifying both the specific logic error requested in the ground truth (the storage pointer bug) and the broader architectural flaws (weak randomness) inherent in the contract's design.",
  "judge_latency_ms": 6017.266273498535,
  "raw_response": "```json\n{\n  \"overall_verdict\": {\n    \"said_vulnerable\": true,\n    \"confidence_expressed\": 0.95\n  },\n  \"findings\": [\n    {\n      \"finding_id\": 0,\n      \"description\": \"The secretSeed is derived from predictable blockchain variables, allowing users to pre-calculate if they win.\",\n      \"vulnerability_type_claimed\": \"Predictable Randomness / Weak PRNG\",\n      \"severity_claimed\": \"critical\",\n      \"location_claimed\": \"luckyNumberOfAddress, reseed\",\n      \"matches_target\": false,\n      \"is_valid_concern\": true,\n      \"classification\": \"BONUS_VALID\",\n      \"reasoning\": \"This is a classic and highly exploitable vulnerability in early Solidity contracts. Since the seed is based on block variables and the winning check is public/predictable, an attacker can indeed guarantee a win before spending gas on the transaction. This is not the specific logic error in forceReseed mentioned in the ground truth, but it is a valid, high-impact vulnerability.\"\n    },\n    {\n      \"finding_id\": 1,\n      \"description\": \"In Solidity 0.4.x, local struct variables default to storage, creating an uninitialized storage pointer that overwrites state variables.\",\n      \"vulnerability_type_claimed\": \"Uninitialized Storage Pointer\",\n      \"severity_claimed\": \"high\",\n      \"location_claimed\": \"forceReseed\",\n      \"matches_target\": true,\n      \"is_valid_concern\": true,\n      \"classification\": \"TARGET_MATCH\",\n      \"reasoning\": \"This correctly identifies the specific logic error in the forceReseed function. In Solidity 0.4.19, 'SeedComponents s;' defaults to storage and points to slot 0. Assigning values to its members overwrites 'owner', 'secretSeed', and 'lastReseed'. This matches the ground truth's location and description of a logic error in forceReseed.\",\n    },\n    {\n      \"finding_id\": 2,\n      \"description\": \"Attackers can observe pending transactions and front-run reseed events.\",\n      \"vulnerability_type_claimed\": \"Front-running\",\n      \"severity_claimed\": \"high\",\n      \"location_claimed\": \"participate\",\n      \"matches_target\": false,\n      \"is_valid_concern\": true,\n      \"classification\": \"BONUS_VALID\",\n      \"reasoning\": \"This is a valid concern regarding the mechanics of the lottery. If a reseed is about to happen, an attacker can manipulate their position in the block to exploit the new seed. While related to the randomness issue, it is a distinct architectural weakness.\"\n    }\n  ],\n  \"target_assessment\": {\n    \"found\": true,\n    \"finding_id\": 1,\n    \"type_match\": \"semantic\",\n    \"type_match_reasoning\": \"The ground truth uses the broad term 'logic_error', while the finding identifies the specific technical cause: 'Uninitialized Storage Pointer'.\",\n    \"root_cause_identification\": {\n      \"score\": 1.0,\n      \"reasoning\": \"Correctly identifies that in 0.4.x, uninitialized local structs in functions default to storage and point to slot 0, leading to state corruption.\"\n    },\n    \"attack_vector_validity\": {\n      \"score\": 1.0,\n      \"reasoning\": \"Correctly identifies that calling forceReseed will overwrite the owner and other state variables due to the storage pointer overlap.\"\n    },\n    \"fix_suggestion_validity\": {\n      \"score\": 1.0,\n      \"reasoning\": \"Correctly suggests using the 'memory' keyword, which is the standard fix for this specific Solidity 0.4.x behavior.\"\n    }\n  },\n  \"summary\": {\n    \"total_findings\": 3,\n    \"target_matches\": 1,\n    \"partial_matches\": 0,\n    \"bonus_valid\": 2,\n    \"hallucinated\": 0,\n    \"mischaracterized\": 0,\n    \"design_choice\": 0,\n    \"out_of_scope\": 0,\n    \"security_theater\": 0,\n    \"informational\": 0\n  },\n  \"notes\": \"The LLM performed exceptionally well, identifying both the specific logic error requested in the ground truth (the storage pointer bug) and the broader architectural flaws (weak randomness) inherent in the contract's design.\"\n}\n```"
}