{
  "sample_id": "ds_t4_011",
  "detector_model": "llama-4-maverick",
  "prompt_type": "direct",
  "judge_model": "mistral-large",
  "timestamp": "2026-01-06T02:46:17.287586+00:00",
  "overall_verdict": {
    "said_vulnerable": true,
    "confidence_expressed": 0.9
  },
  "findings": [
    {
      "finding_id": 0,
      "vulnerability_type_claimed": "Integer Overflow",
      "location_claimed": "batchTransfer function in PausableToken contract",
      "classification": "TARGET_MATCH",
      "reasoning": "\n        **Root Cause Match**: The finding correctly identifies the integer overflow vulnerability in the multiplication `uint256(cnt) * _value` within the `batchTransfer` function. This matches the ground truth's root cause (integer overflow/underflow in the batchTransfer function).\n        **Location Match**: The finding correctly identifies the `batchTransfer` function in the `PausableToken` contract, which matches the ground truth's specified location.\n        **Type Match**: The finding uses the term 'Integer Overflow', which is a semantic match to the ground truth's 'integer_issues'. Both refer to the same class of vulnerability.\n        **Attack Scenario**: The provided attack scenario is concrete and valid, demonstrating how an attacker could exploit the overflow to transfer more tokens than intended.\n        **Fix Suggestion**: The suggested fix (using SafeMath's `mul` function) is correct and aligns with the ground truth's recommendation to use SafeMath or Solidity 0.8+.\n      "
    },
    {
      "finding_id": 1,
      "vulnerability_type_claimed": "Outdated Solidity Version",
      "location_claimed": "pragma solidity ^0.4.16;",
      "classification": "INFORMATIONAL",
      "reasoning": "\n        This finding is a true observation about the use of an outdated Solidity version, but it is not directly related to the TARGET vulnerability (integer overflow in `batchTransfer`). While it is a security-relevant observation, it does not constitute a concrete, exploitable vulnerability in the provided code without additional context (e.g., known vulnerabilities in Solidity 0.4.16 that affect this contract). Thus, it is classified as INFORMATIONAL.\n      "
    }
  ],
  "target_assessment": {
    "complete_found": true,
    "partial_found": false,
    "finding_id": 0,
    "root_cause_match": true,
    "location_match": true,
    "type_match": "semantic",
    "root_cause_identification": {
      "score": 1.0,
      "reasoning": "The finding precisely identifies the integer overflow in the multiplication operation within `batchTransfer`, which is the exact root cause described in the ground truth."
    },
    "attack_vector_validity": {
      "score": 1.0,
      "reasoning": "The attack scenario is concrete, step-by-step, and technically valid. It demonstrates how an attacker could exploit the overflow to transfer more tokens than their balance."
    },
    "fix_suggestion_validity": {
      "score": 1.0,
      "reasoning": "The suggested fix (using SafeMath's `mul` function) is correct and directly addresses the root cause of the vulnerability."
    }
  },
  "summary": {},
  "notes": "\n    The LLM's detection output for Finding 0 is a strong match for the TARGET vulnerability. It correctly identifies the root cause, location, and type, and provides a valid attack scenario and fix. Finding 1, while true, is not directly related to the TARGET vulnerability and is classified as informational.\n  ",
  "judge_latency_ms": 12239.73298072815,
  "raw_response": "```json\n{\n  \"overall_verdict\": {\n    \"said_vulnerable\": true,\n    \"confidence_expressed\": 0.9\n  },\n  \"findings\": [\n    {\n      \"finding_id\": 0,\n      \"vulnerability_type_claimed\": \"Integer Overflow\",\n      \"location_claimed\": \"batchTransfer function in PausableToken contract\",\n      \"classification\": \"TARGET_MATCH\",\n      \"reasoning\": \"\n        **Root Cause Match**: The finding correctly identifies the integer overflow vulnerability in the multiplication `uint256(cnt) * _value` within the `batchTransfer` function. This matches the ground truth's root cause (integer overflow/underflow in the batchTransfer function).\n        **Location Match**: The finding correctly identifies the `batchTransfer` function in the `PausableToken` contract, which matches the ground truth's specified location.\n        **Type Match**: The finding uses the term 'Integer Overflow', which is a semantic match to the ground truth's 'integer_issues'. Both refer to the same class of vulnerability.\n        **Attack Scenario**: The provided attack scenario is concrete and valid, demonstrating how an attacker could exploit the overflow to transfer more tokens than intended.\n        **Fix Suggestion**: The suggested fix (using SafeMath's `mul` function) is correct and aligns with the ground truth's recommendation to use SafeMath or Solidity 0.8+.\n      \"\n    },\n    {\n      \"finding_id\": 1,\n      \"vulnerability_type_claimed\": \"Outdated Solidity Version\",\n      \"location_claimed\": \"pragma solidity ^0.4.16;\",\n      \"classification\": \"INFORMATIONAL\",\n      \"reasoning\": \"\n        This finding is a true observation about the use of an outdated Solidity version, but it is not directly related to the TARGET vulnerability (integer overflow in `batchTransfer`). While it is a security-relevant observation, it does not constitute a concrete, exploitable vulnerability in the provided code without additional context (e.g., known vulnerabilities in Solidity 0.4.16 that affect this contract). Thus, it is classified as INFORMATIONAL.\n      \"\n    }\n  ],\n  \"target_assessment\": {\n    \"complete_found\": true,\n    \"partial_found\": false,\n    \"finding_id\": 0,\n    \"root_cause_match\": true,\n    \"location_match\": true,\n    \"type_match\": \"semantic\",\n    \"root_cause_identification\": {\n      \"score\": 1.0,\n      \"reasoning\": \"The finding precisely identifies the integer overflow in the multiplication operation within `batchTransfer`, which is the exact root cause described in the ground truth.\"\n    },\n    \"attack_vector_validity\": {\n      \"score\": 1.0,\n      \"reasoning\": \"The attack scenario is concrete, step-by-step, and technically valid. It demonstrates how an attacker could exploit the overflow to transfer more tokens than their balance.\"\n    },\n    \"fix_suggestion_validity\": {\n      \"score\": 1.0,\n      \"reasoning\": \"The suggested fix (using SafeMath's `mul` function) is correct and directly addresses the root cause of the vulnerability.\"\n    }\n  },\n  \"notes\": \"\n    The LLM's detection output for Finding 0 is a strong match for the TARGET vulnerability. It correctly identifies the root cause, location, and type, and provides a valid attack scenario and fix. Finding 1, while true, is not directly related to the TARGET vulnerability and is classified as informational.\n  \"\n}\n```"
}