{
  "sample_id": "ds_t1_019",
  "detector_model": "deepseek-v3-2",
  "prompt_type": "direct",
  "judge_model": "mistral-large",
  "timestamp": "2026-01-06T01:26:22.144605+00:00",
  "overall_verdict": {
    "said_vulnerable": true,
    "confidence_expressed": 0.95
  },
  "findings": [
    {
      "finding_id": 0,
      "vulnerability_type_claimed": "Reentrancy",
      "location_claimed": "Collect function",
      "classification": "TARGET_MATCH",
      "reasoning": "\n        - **Root Cause Match**: The finding correctly identifies the reentrancy vulnerability in the `Collect` function, specifically noting that the external call (`msg.sender.call.value()`) occurs before the state update (`balances[msg.sender]-=_am`). This matches the ground truth's implied root cause (checks-effects-interactions violation).\n        - **Location Match**: The finding correctly identifies the `Collect` function as the vulnerable location, matching the ground truth.\n        - **Type Match**: The finding uses the exact term 'Reentrancy', which matches the ground truth's type.\n      "
    },
    {
      "finding_id": 1,
      "vulnerability_type_claimed": "Uninitialized Storage Pointer",
      "location_claimed": "LogFile.AddMessage function",
      "classification": "BONUS_VALID",
      "reasoning": "\n        - **Existence**: The vulnerability is real and exists in the `LogFile.AddMessage` function, where `LastMsg` is a storage pointer and all `History` entries reference the same storage location.\n        - **Attack Scenario**: The finding provides a concrete attack scenario where historical data is corrupted due to the storage pointer issue, leading to loss of integrity.\n        - **Impact**: The impact is genuine (data corruption) and does not require a trusted role to be compromised.\n        - **Not Hallucinated**: The issue is accurately described and exists in the code.\n      "
    },
    {
      "finding_id": 2,
      "vulnerability_type_claimed": "Unprotected Initialization",
      "location_claimed": "SetMinSum, SetLogFile, Initialized functions",
      "classification": "BONUS_VALID",
      "reasoning": "\n        - **Existence**: The vulnerability is real and exists in the initialization functions, where the `intitalized` flag can be set by anyone, allowing front-running attacks.\n        - **Attack Scenario**: The finding provides a concrete attack scenario where an attacker front-runs the owner to set malicious parameters.\n        - **Impact**: The impact is genuine (malicious parameters or log manipulation) and does not require a trusted role to be compromised.\n        - **Not Hallucinated**: The issue is accurately described and exists in the code.\n      "
    }
  ],
  "target_assessment": {
    "complete_found": true,
    "partial_found": false,
    "finding_id": 0,
    "root_cause_match": true,
    "location_match": true,
    "type_match": "exact",
    "root_cause_identification": {
      "score": 1.0,
      "reasoning": "The finding accurately identifies the root cause as the violation of the checks-effects-interactions pattern, where the external call occurs before the state update. This is a precise match to the ground truth's implied root cause."
    },
    "attack_vector_validity": {
      "score": 1.0,
      "reasoning": "The attack scenario is concrete and step-by-step, detailing how an attacker can drain funds by re-entering the `Collect` function before the balance is updated. This is a valid and accurate description of the exploit."
    },
    "fix_suggestion_validity": {
      "score": 1.0,
      "reasoning": "The suggested fix (implementing checks-effects-interactions pattern or using a reentrancy guard) is correct and matches the ground truth's recommended fix. The example fix provided is also valid."
    }
  },
  "summary": {},
  "notes": "\n    - The ground truth did not specify a root cause, but the finding's explanation aligns perfectly with the implied root cause (checks-effects-interactions violation).\n    - Findings 1 and 2 are classified as BONUS_VALID as they identify real vulnerabilities not covered in the ground truth.\n  ",
  "judge_latency_ms": 16554.29983139038,
  "raw_response": "```json\n{\n  \"overall_verdict\": {\n    \"said_vulnerable\": true,\n    \"confidence_expressed\": 0.95\n  },\n  \"findings\": [\n    {\n      \"finding_id\": 0,\n      \"vulnerability_type_claimed\": \"Reentrancy\",\n      \"location_claimed\": \"Collect function\",\n      \"classification\": \"TARGET_MATCH\",\n      \"reasoning\": \"\n        - **Root Cause Match**: The finding correctly identifies the reentrancy vulnerability in the `Collect` function, specifically noting that the external call (`msg.sender.call.value()`) occurs before the state update (`balances[msg.sender]-=_am`). This matches the ground truth's implied root cause (checks-effects-interactions violation).\n        - **Location Match**: The finding correctly identifies the `Collect` function as the vulnerable location, matching the ground truth.\n        - **Type Match**: The finding uses the exact term 'Reentrancy', which matches the ground truth's type.\n      \"\n    },\n    {\n      \"finding_id\": 1,\n      \"vulnerability_type_claimed\": \"Uninitialized Storage Pointer\",\n      \"location_claimed\": \"LogFile.AddMessage function\",\n      \"classification\": \"BONUS_VALID\",\n      \"reasoning\": \"\n        - **Existence**: The vulnerability is real and exists in the `LogFile.AddMessage` function, where `LastMsg` is a storage pointer and all `History` entries reference the same storage location.\n        - **Attack Scenario**: The finding provides a concrete attack scenario where historical data is corrupted due to the storage pointer issue, leading to loss of integrity.\n        - **Impact**: The impact is genuine (data corruption) and does not require a trusted role to be compromised.\n        - **Not Hallucinated**: The issue is accurately described and exists in the code.\n      \"\n    },\n    {\n      \"finding_id\": 2,\n      \"vulnerability_type_claimed\": \"Unprotected Initialization\",\n      \"location_claimed\": \"SetMinSum, SetLogFile, Initialized functions\",\n      \"classification\": \"BONUS_VALID\",\n      \"reasoning\": \"\n        - **Existence**: The vulnerability is real and exists in the initialization functions, where the `intitalized` flag can be set by anyone, allowing front-running attacks.\n        - **Attack Scenario**: The finding provides a concrete attack scenario where an attacker front-runs the owner to set malicious parameters.\n        - **Impact**: The impact is genuine (malicious parameters or log manipulation) and does not require a trusted role to be compromised.\n        - **Not Hallucinated**: The issue is accurately described and exists in the code.\n      \"\n    }\n  ],\n  \"target_assessment\": {\n    \"complete_found\": true,\n    \"partial_found\": false,\n    \"finding_id\": 0,\n    \"root_cause_match\": true,\n    \"location_match\": true,\n    \"type_match\": \"exact\",\n    \"root_cause_identification\": {\n      \"score\": 1.0,\n      \"reasoning\": \"The finding accurately identifies the root cause as the violation of the checks-effects-interactions pattern, where the external call occurs before the state update. This is a precise match to the ground truth's implied root cause.\"\n    },\n    \"attack_vector_validity\": {\n      \"score\": 1.0,\n      \"reasoning\": \"The attack scenario is concrete and step-by-step, detailing how an attacker can drain funds by re-entering the `Collect` function before the balance is updated. This is a valid and accurate description of the exploit.\"\n    },\n    \"fix_suggestion_validity\": {\n      \"score\": 1.0,\n      \"reasoning\": \"The suggested fix (implementing checks-effects-interactions pattern or using a reentrancy guard) is correct and matches the ground truth's recommended fix. The example fix provided is also valid.\"\n    }\n  },\n  \"notes\": \"\n    - The ground truth did not specify a root cause, but the finding's explanation aligns perfectly with the implied root cause (checks-effects-interactions violation).\n    - Findings 1 and 2 are classified as BONUS_VALID as they identify real vulnerabilities not covered in the ground truth.\n  \"\n}\n```"
}